PuzzleId,FEN,Moves,Rating,RatingDeviation,Popularity,NbPlays,Themes,GameUrl,OpeningTags
1jS5x,3rk2r/pbp5/4p1q1/2p5/7p/1PN4P/P1P2BP1/R1Q1R1K1 w k - 1 24,g2g4 h4g3 e1e6 g6e6,1362,83,69,202,crushing enPassant middlegame short,https://lichess.org/RXCKFAk1#47,
1ptpW,7k/5Bp1/7p/2b4P/p2NP1b1/3K4/1P6/8 b - - 1 42,c5d4 d3d4 g7g5 h5g6,1366,76,93,13744,bishopEndgame crushing enPassant endgame master short,https://lichess.org/pDNPE0yG/black#84,
2ZxRG,4R1R1/1p1r1kp1/p4p1p/5P2/6P1/1P1p1K2/1r3P2/8 b - - 1 38,g7g5 f5g6,1320,118,85,95,enPassant endgame master mate mateIn1 oneMove rookEndgame,https://lichess.org/tF4ntFNt/black#76,
38k3M,r1b1nrk1/ppqpbppp/4p3/n3P3/5B2/2NB1N2/PP2QPPP/R2R2K1 b - - 6 12,d7d5 e5d6,1389,82,77,220,advantage enPassant middlegame oneMove,https://lichess.org/TjhUMpXV/black#24,Sicilian_Defense Sicilian_Defense_Smith-Morra_Gambit
4LLCj,8/8/1B6/8/5Kp1/6P1/4k2P/3b4 w - - 8 66,h2h4 g4h3 b6g1 e2f1 g1h2 f1g2,1364,76,88,254,bishopEndgame crushing enPassant endgame long,https://lichess.org/nf8WwP7m#131,
4ol21,r1b2r2/1pq1npbk/p1n1p1pp/3pP3/5B1P/P1NB1NQ1/1P3PP1/R3R1K1 b - - 0 15,f7f5 e5f6 c7f4 g3f4,1355,110,84,103,crushing enPassant middlegame short,https://lichess.org/bZMKHCth/black#30,French_Defense French_Defense_Advance_Variation
51QoE,2kr3r/pp2bppp/1n2p3/PN3b2/1Pn2B2/2P2N2/5PPP/R2BK2R b KQ - 0 16,b6d5 b5a7 c8d7 d1a4 b7b5 a5b6,1394,77,84,164,discoveredAttack enPassant long mate mateIn3 middlegame queensideAttack,https://lichess.org/wkQiCvwz/black#32,Sicilian_Defense Sicilian_Defense_Smith-Morra_Gambit_Declined
52mDY,r1b1k2r/pppq1p1p/8/2bpPp2/3p1P2/1B1P4/PPP3PP/RN1Q1RK1 w kq - 0 12,c2c4 d4c3 g1h1 c3b2,1348,78,94,15460,advancedPawn crushing discoveredAttack enPassant middlegame short,https://lichess.org/06gYtQUn#23,Italian_Game Italian_Game_Blackburne-Kostic_Gambit
9ZWEC,8/8/7p/4k1p1/3pP1P1/3K3P/2P5/8 w - - 0 39,c2c4 d4c3 d3c3 e5e4,1384,81,67,233,crushing deflection enPassant endgame pawnEndgame short,https://lichess.org/y3c3neCN#77,
AdidB,2R5/2r3p1/pp1k4/3p4/P2Pp3/4P3/4KPP1/8 w - - 2 36,c8c7 d6c7 f2f4 e4f3,1302,77,82,312,crushing enPassant endgame short,https://lichess.org/CVyqTcso#71,
B4UsA,2r1n3/1bp1Pk1p/pb1p1pn1/1p1P4/8/1BN5/PP3PPP/R3R1K1 b - - 1 24,c7c5 d5c6 f7g7 c6b7,1322,122,75,51,advancedPawn advantage discoveredAttack enPassant middlegame short,https://lichess.org/DV0jXwuO/black#48,
BUhRY,rnbq1rk1/pp2ppb1/2pp4/6pQ/3PP3/2NB2P1/PPP3PP/R4RK1 b - - 1 12,e7e6 e4e5 f7f5 e5f6,1376,75,88,1846,crushing enPassant middlegame short,https://lichess.org/J8LvAZUJ/black#24,Pirc_Defense Pirc_Defense_Classical_Variation
BzSlV,2kr3r/1ppq1ppp/p1n1p3/2Pp4/B2Pb3/P3PNP1/1P3PP1/R2QK2R b KQ - 1 13,b7b5 c5b6,1333,87,88,213,advantage enPassant middlegame oneMove,https://lichess.org/WP6ko18O/black#26,Queens_Pawn_Game Queens_Pawn_Game_Accelerated_London_System
GjaQV,8/2p5/p2p1k2/P2P3p/4K2P/8/8/8 b - - 0 42,f6e7 e4f5 c7c5 d5c6,1308,77,92,2989,crushing enPassant endgame pawnEndgame short,https://lichess.org/RiVrQeAE/black#84,
GsoSK,r1bq1b1r/pp1p1kpn/7p/2p1P3/5Q2/2N5/PPP2PPP/R1B1K2R b KQ - 1 10,f7g8 f4c4 d7d5 e5d6 c8e6 c4e6,1374,197,43,7,discoveredAttack enPassant kingsideAttack long mate mateIn3 opening,https://lichess.org/GTx5qsDq/black#20,Italian_Game Italian_Game_Anti-Fried_Liver_Defense
IXrEz,4k2r/1prbnppp/p3p3/3pP3/P2P1BPP/1P3P2/1KP5/3R3R b k - 0 23,f7f5 e5f6 c7c2 b2c2,1335,80,72,332,advantage enPassant middlegame short,https://lichess.org/XDQv0i86/black#46,
K4Bsk,8/8/7p/7P/1p4k1/1P2K3/2P5/8 w - - 0 57,e3f2 g4h5 c2c4 b4c3,1305,76,95,9681,crushing enPassant endgame pawnEndgame short,https://lichess.org/uzj7tKRI#113,
KQoL6,r5k1/p1R4p/1p1p3q/3P1p2/P2P2p1/4PpP1/1P1Q1P1P/5K2 w - - 1 27,h2h4 g4h3 d2d1 h3h2,1362,77,92,5601,advancedPawn crushing enPassant endgame short,https://lichess.org/UZ87MRh3#53,
Kp1tC,rn2k1nr/pbpp1ppp/1pq1p3/4P3/3P4/2B3P1/PPP1QPBP/R3K1R1 b Qkq - 4 12,d7d5 e5d6 c6c3 b2c3,1352,115,53,76,advantage enPassant middlegame short,https://lichess.org/W8jwqKUd/black#24,French_Defense French_Defense_Knight_Variation
N0Hkw,r2qk2r/1pb1nppp/p1n1p3/P2p4/QP1P2b1/2P2NP1/3N1PBP/R1B2RK1 b kq - 1 13,b7b5 a5b6,1357,89,3,129,advantage enPassant middlegame oneMove,https://lichess.org/O9KSrIsw/black#26,Zukertort_Opening Zukertort_Opening_Slav_Invitation
OHI71,8/5k1p/6p1/6P1/8/1NK5/1Pb5/8 b - - 0 43,c2b3 c3b3 h7h5 g5h6,1311,75,83,360,crushing enPassant endgame short,https://lichess.org/g2YYCgq3/black#86,
QI4Jl,5rk1/1Rp2p1p/3p1p2/3P4/2Nb4/8/5PPP/6K1 b - - 0 29,c7c5 d5c6,1398,78,78,307,crushing enPassant endgame oneMove,https://lichess.org/hlp8liCI/black#58,
SMVYP,8/8/8/3k2p1/1p3pP1/1P1K1P2/P7/8 w - - 2 57,d3d2 d5d4 a2a4 b4a3,1370,79,25,295,crushing enPassant endgame pawnEndgame short zugzwang,https://lichess.org/Vlqfbgoz#113,
TNGTK,8/1p4p1/p3k1p1/Pr4R1/3PK2P/8/6P1/8 b - - 6 35,b5g5 h4g5 b7b5 a5b6,1381,81,74,218,crushing enPassant endgame short,https://lichess.org/V1e03i0u/black#70,
Tk4EA,r1bq3r/p2p1kpn/2p4p/4P3/8/4P3/PP4PP/RN1Q1RK1 b - - 0 13,f7g8 d1b3 d7d5 e5d6 c8e6 b3e6,1386,76,92,4138,discoveredAttack enPassant kingsideAttack long mate mateIn3 middlegame,https://lichess.org/D9hKxwCx/black#26,Sicilian_Defense Sicilian_Defense_Morphy_Gambit
TwfYD,8/7p/7K/p7/1p6/1P2k3/1PP5/8 w - - 3 41,h6h7 e3d2 c2c4 b4c3 b2c3 d2c3,1346,75,99,1020,crushing enPassant endgame long pawnEndgame,https://lichess.org/taRc8pdH#81,
VXjcJ,2r2rk1/1p3ppp/4b3/p2pP3/3P4/3B2Q1/q2B1PPP/3R2K1 b - - 1 21,g8h8 g3h4 f7f5 e5f6 g7g6 d3g6,1358,240,86,4,advantage enPassant long middlegame pin,https://lichess.org/Q9dAesan/black#42,
VpfLL,r4rk1/ppqnbpp1/4p2p/3pP3/5B2/1PPQP3/2B2PPP/R3K2R b KQ - 2 16,f7f5 e5f6 c7c3 d3c3,1320,79,80,231,crushing enPassant middlegame short,https://lichess.org/bw0fAwfd/black#32,Queens_Pawn_Game Queens_Pawn_Game_Steinitz_Countergambit
WEUDf,r1b2qk1/pp1n2bp/2p2rp1/3p4/3Pp2P/2P1P1N1/PP1BQPB1/2KR3R w - - 2 19,f2f4 e4f3 g2f3 f6f3,1367,76,87,1024,crushing enPassant fork middlegame short,https://lichess.org/IIZ5cZ41#37,Vant_Kruijs_Opening Vant_Kruijs_Opening_Other_variations
Xuus4,8/5p2/1K1k2p1/2p3P1/2P5/8/8/8 b - - 2 45,d6d7 b6c5 f7f5 g5f6,1364,75,89,1805,crushing enPassant endgame pawnEndgame short,https://lichess.org/oCBFyWWT/black#90,
Zt31Q,2r3k1/p1rn1ppp/3p1q2/8/1P1pP3/PQ1P4/1BP2PPP/R1R3K1 w - - 1 22,c2c4 d4c3 c1c3 c7c3,1352,80,79,380,advantage enPassant middlegame short,https://lichess.org/UzbXG8hr#43,
aW2BQ,8/6pp/5p2/1kp3P1/4PP2/PK6/8/8 b - - 0 34,c5c4 b3c3 h7h5 g5h6,1375,80,84,195,crushing defensiveMove enPassant endgame pawnEndgame short,https://lichess.org/s2wy0eu1/black#68,
bH6gg,6k1/p4p2/6p1/6Pp/1P5P/P1q2QK1/8/8 b - - 14 57,c3f3 g3f3 f7f5 g5f6,1308,78,90,751,crushing enPassant endgame master masterVsMaster short,https://lichess.org/hvlLxSG8/black#114,
bP4HM,8/6p1/pK5p/1p3k1P/1P3P2/1P6/8/8 b - - 1 48,f5f4 b6a6 f4f5 a6b5 g7g5 h5g6,1375,82,78,277,crushing enPassant endgame long pawnEndgame,https://lichess.org/9xxM9Hzp/black#96,
bT8Bb,4rr1k/1b2bpp1/2q1pn1B/pp6/2pPP2Q/2P2P2/P1BN2PP/R4RK1 b - - 0 19,g7h6 h4h6 f6h7 e4e5 f7f5 e5f6,1392,113,87,84,crushing enPassant kingsideAttack long middlegame quietMove,https://lichess.org/yHn8WZBU/black#38,Indian_Defense Indian_Defense_Other_variations
cnFRx,1r2k2r/3bbpp1/4p1n1/3pP3/p1pP3p/PpP2N1P/1R3PPB/RN4K1 b k - 1 24,f7f5 e5f6 g7f6 h2b8,1373,80,76,285,advantage discoveredAttack enPassant middlegame short,https://lichess.org/1bHN4YwZ/black#48,
dx7bn,1n1qkb1r/rb2pppp/p2p4/1p1P4/3N4/2N4P/PPP2PP1/R1BQ1RK1 b k - 2 10,e7e5 d5e6,1360,82,51,226,crushing enPassant oneMove opening,https://lichess.org/icuS92Ux/black#20,Sicilian_Defense Sicilian_Defense_Modern_Variations
fju9U,7Q/8/8/p5p1/1p4k1/1P5q/KPP5/8 w - - 1 36,h8h3 g4h3 c2c4 b4c3,1318,79,85,906,crushing enPassant endgame short,https://lichess.org/6zqcsB64#71,
hZuF3,1r3rk1/p3ppbp/2p1b1pn/q3P3/6P1/2N1Q1BP/PPP1B3/1K1R3R b - - 6 19,f7f5 e5f6 b8b2 b1b2,1397,97,-45,71,crushing enPassant middlegame short,https://lichess.org/6ABK9JdR/black#38,Sicilian_Defense Sicilian_Defense_Accelerated_Dragon
hbAaT,r1b2rk1/pp3ppp/1q2p3/3pP3/P2P4/2PQ1N2/4B1PP/5RK1 b - - 0 17,a7a5 f3g5 f7f5 e5f6,1387,76,93,6329,crushing enPassant middlegame short,https://lichess.org/MptCL9xL/black#34,French_Defense French_Defense_Advance_Variation
i6sDd,8/2k5/5p2/1pPp1P2/p7/P3K3/1P6/8 w - - 7 53,e3d4 c7c6 b2b4 a4b3,1352,84,64,90,crushing enPassant endgame pawnEndgame short zugzwang,https://lichess.org/6R0QfuYR#105,
ipguV,7r/1pBk1p1p/2nP1np1/3p2P1/2p1pP2/r1P5/P6P/R3KB1R b KQ - 0 21,f6e8 f1h3 f7f5 g5f6,1389,77,92,1380,discoveredAttack enPassant master mate mateIn2 middlegame short,https://lichess.org/YPLhkfdI/black#42,
j75Ew,6k1/1q1QKp1p/8/5PP1/8/8/8/8 b - - 12 55,b7d7 e7d7 h7h5 g5h6,1313,75,100,903,crushing enPassant endgame master short,https://lichess.org/5UQxOLaA/black#110,
k4L1h,8/p5p1/1p3k2/2p2ppP/P2p4/3P1K2/1PP2PP1/8 b - - 0 33,g5g4 f3f4 g7g5 h5g6,1398,75,93,1374,advantage defensiveMove enPassant endgame pawnEndgame short,https://lichess.org/x8hXW6Dj/black#66,
kmGsW,r1b1r1k1/ppp2p1p/4pqpB/6P1/8/3R4/P1PKQP1P/7R b - - 0 19,f6e7 e2e5 f7f5 g5f6,1353,78,93,3301,crushing enPassant middlegame short,https://lichess.org/DMFRbMBe/black#38,Modern_Defense Modern_Defense_Other_variations
mbb5b,4r1k1/p4pp1/7p/1pppPP1P/3q4/1P4Q1/2P1R1PK/8 b - - 0 33,c5c4 f5f6 g7g5 h5g6,1375,75,80,440,crushing enPassant endgame short,https://lichess.org/v1s55S47/black#66,
ng33y,6k1/6p1/7p/2KR1r1P/8/1P6/8/8 b - - 1 52,f5d5 c5d5 g7g5 h5g6,1390,76,88,3563,crushing enPassant endgame master short superGM,https://lichess.org/PfaVTDPC/black#104,
nsIo6,rb2r1k1/2q2pp1/p1p2n1p/2Ppp3/1P6/P3P2b/1B2BPPN/R2Q1RK1 w - - 0 18,g2h3 e5e4 f2f4 e4f3,1339,76,93,11123,crushing enPassant opening quietMove short,https://lichess.org/Txkeoea5#35,Queens_Gambit_Declined Queens_Gambit_Declined_Semi-Tarrasch_Defense
o49b2,3q1bk1/p2p1r1p/2P1p1p1/1p2Pp2/1P3P2/P3B3/6PP/2RR3K b - - 2 26,d7d5 e5d6 d8d6 d1d6,1375,84,71,206,advantage enPassant endgame short,https://lichess.org/d3NHiM9t/black#52,
osQBJ,8/7p/6k1/5pP1/4pK2/4P3/8/8 b - - 4 46,h7h5 g5h6 g6h6 f4f5 h6g7 f5e4,1388,76,88,175,crushing deflection enPassant endgame long pawnEndgame,https://lichess.org/UauLaREb/black#92,
pbwtl,rn1q1rk1/ppp1b1pp/1n1p4/3Pp3/1P2Pp2/1BP2Q1P/P2N1PP1/R1B1R1K1 w - - 0 14,g2g4 f4g3 f2g3 f8f3,1391,80,1,153,crushing discoveredAttack enPassant middlegame short,https://lichess.org/Xm5tqwuh#27,Philidor_Defense Philidor_Defense_Other_variations
pc2oU,8/1p6/2p5/k1Pp4/p1rP4/3K4/8/1R6 b - - 7 56,b7b5 c5b6 c4c1 b1c1,1345,83,94,13232,crushing enPassant endgame master rookEndgame short,https://lichess.org/Z972gVaT/black#112,
po9Sk,r5k1/5p1p/2R1pBp1/4P3/1p6/1Pb3P1/P6P/5K2 w - - 2 38,a2a4 b4a3 c6c3 a3a2,1368,82,65,232,advancedPawn crushing enPassant endgame sacrifice short,https://lichess.org/UYuKMuuX#75,
qvFF7,8/8/3k2p1/1p2p1P1/2p1P3/P2K4/1P6/8 w - - 0 40,d3c3 d6c5 b2b4 c4b3,1395,77,78,239,crushing enPassant endgame pawnEndgame short zugzwang,https://lichess.org/CfJE7Cv8#79,
rbXRp,8/p5p1/4k2p/1p1pP2P/5K2/P1P1P3/8/8 b - - 0 45,a7a6 e3e4 d5e4 f4e4 g7g5 h5g6,1376,76,87,282,crushing enPassant endgame long pawnEndgame,https://lichess.org/uHLv231Z/black#90,
t923E,8/r5k1/6p1/6q1/5p1p/1B5P/P1R2PP1/4R1K1 w - - 0 43,e1c1 f4f3 g2g4 h4g3,1313,78,87,3745,crushing enPassant endgame pin short,https://lichess.org/HJY0BYed#85,
tOz6v,8/p2k4/1p6/1P1pK3/3P4/8/8/8 b - - 13 64,d7c7 e5d5 a7a5 b5a6,1312,78,91,2619,crushing enPassant endgame pawnEndgame short,https://lichess.org/4IwG0XGH/black#128,
u1l6i,8/5p1p/3k1Np1/6P1/2p5/3b4/1P1K4/8 b - - 2 49,h7h5 g5h6 g6g5 h6h7 d3h7 f6h7 f7f6 h7f6,1350,125,86,26,advancedPawn crushing enPassant endgame veryLong,https://lichess.org/NcyrTBJg/black#98,
uEvFq,8/p5pk/1p4qp/2p1P3/4p3/1P2P1P1/PB2bPQP/6K1 w - - 0 34,f2f4 e4f3 g2e2 f3e2,1333,83,65,226,advancedPawn crushing enPassant endgame short,https://lichess.org/1KoTpHLZ#67,
uaMis,2r3k1/1brqbpp1/pn2p2B/1p1pP3/7P/1PPB1N2/P2Q1PP1/2R1R1K1 b - - 0 20,g7h6 d2h6 f7f5 e5f6,1381,79,82,319,crushing enPassant middlegame short,https://lichess.org/rSQ5vrip/black#40,
wAlBR,8/p1p2rpk/7p/5P2/3B4/Pb6/7K/6R1 b - - 0 33,g7g5 f5g6 h7g8 g6f7,1310,81,79,197,advancedPawn advantage doubleCheck enPassant endgame fork short,https://lichess.org/OJfisu5M/black#66,
wTZ9N,rrn3k1/5pp1/2B2q1p/p1p1pP1P/2P1P3/3P2Q1/1P4P1/R4RK1 b - - 2 22,f6c6 f5f6 g7g5 h5g6,1390,78,90,3214,crushing enPassant middlegame short,https://lichess.org/PEiBTzpl/black#44,
wg5CR,r2qk2r/1p1bppbp/p2p2p1/3P4/3B4/5P2/PPP1B1PP/R2Q1RK1 b kq - 0 12,e7e5 d5e6 g7d4 d1d4,1304,101,86,133,crushing enPassant middlegame short,https://lichess.org/5LASSSm7/black#24,Sicilian_Defense Sicilian_Defense_Najdorf_Variation
ws8cz,r3k2r/1np2ppp/1p4q1/pP3b2/2PPp3/P3P3/1BQ1BPPP/R4RK1 w kq - 3 20,f2f4 e4f3 e2f3 f5c2,1371,82,32,199,crushing discoveredAttack enPassant middlegame pin short,https://lichess.org/sUVkMBCp#39,
xvPlG,r2qnn1r/pp1k1p1p/8/2pP2P1/2P2B2/8/P1P4P/R2QR1K1 b - - 2 22,f8g6 d1g4 f7f5 g5f6,1322,79,86,411,discoveredAttack enPassant mate mateIn2 middlegame short,https://lichess.org/iT6QfQXu/black#44,
