PuzzleId,FEN,Moves,Rating,RatingDeviation,Popularity,NbPlays,Themes,GameUrl,OpeningTags
HNL0b,8/1KR3p1/1P4k1/7p/8/8/8/1r6 b - - 1 49,b1b6 b7b6 h5h4 b6c5 g6f5 c5d4,2483,89,90,1208,crushing defensiveMove endgame hangingPiece long master masterVsMaster rookEndgame,https://lichess.org/vx94ta04/black#98,
HO7Uf,6rk/7p/4q1r1/P1P2p2/1pBppP2/1Pp3PQ/7P/R6K b - - 1 37,e6c4 b3c4 b4b3 h3f1,2419,149,88,24,defensiveMove endgame equality hangingPiece short,https://lichess.org/fnkIHC4T/black#74,
HP2ce,r3Nk2/ppp2p1p/2n3pP/6P1/2PPq1b1/4BNb1/PP2K3/R2Q1B1R w - - 0 20,f1g2 a8e8 d1d3 g4f3,2482,96,87,772,advantage hangingPiece middlegame short,https://lichess.org/tKBHF2gY#39,
HQuhz,3rr1k1/1Q5p/1p4q1/p1ppB3/2b5/2P4P/P6K/R3R3 b - - 4 35,e8e5 e1e5 g6c2 h2h1,2461,147,55,26,advantage defensiveMove hangingPiece master middlegame short,https://lichess.org/IliWFNWv/black#70,
HSycj,rnb2rk1/p5pp/2p2n2/q1pp1p2/1b1Pp3/PQN1P2P/1P1N1PP1/R1B1KB1R w KQ - 0 13,a3b4 a5a1 b3c2 c5c4,2469,79,86,133,advantage defensiveMove hangingPiece opening short,https://lichess.org/FXmKsdGY#25,Rat_Defense Rat_Defense_English_Rat
HTc08,8/6p1/8/p1k2Kn1/2P5/1P3P2/3N4/8 b - - 1 42,g5f3 d2f3 a5a4 f5e4,2459,85,98,102,crushing defensiveMove endgame hangingPiece knightEndgame short,https://lichess.org/3HgoMOPM/black#84,
HTpXm,2R5/2pk4/3p4/p4K2/6PP/2r5/P7/8 w - - 1 60,g4g5 d7c8 g5g6 c8d7,2441,95,90,596,crushing defensiveMove endgame hangingPiece master rookEndgame short,https://lichess.org/Ws43t1Nc#119,
HV3vc,8/p2b1k1p/1p5p/3R1p2/8/1P4QP/P3qPPK/2r5 b - - 2 33,e2f1 d5d7 f7e8 g3g7 f1g1 h2g3 f5f4 g3f3 c1c3 g7c3,2451,107,90,791,crushing endgame hangingPiece veryLong,https://lichess.org/qVrxb3su/black#66,
HVjWd,4r1k1/QP2bp2/6p1/4p3/4P3/5N1P/pq4PK/5R2 w - - 0 38,f3g5 e7g5 b7b8r e8b8 a7f7 g8h8 f7g6 g5f4 f1f4 e5f4,2403,77,89,208,advantage endgame hangingPiece master masterVsMaster veryLong,https://lichess.org/eyFLl9is#75,
HW5b9,6k1/p5pp/q4b2/2Q1Bp2/5P2/1P1r3P/P2r2P1/R4R1K b - - 6 26,d2g2 h1g2 f6e5 f4e5 a6g6 g2f2,2412,91,84,32,crushing defensiveMove hangingPiece long middlegame,https://lichess.org/XF8vBgw7/black#52,
HWxwO,4k2r/pp3Npp/2nr1n2/8/2B1p1b1/2P5/PP3PPP/R3K2R b KQk - 1 15,c6a5 f7d6 e8e7 b2b4 e7d6 b4a5,2411,83,82,174,advantage hangingPiece long middlegame,https://lichess.org/mJz0QrM9/black#30,Queens_Pawn_Game Queens_Pawn_Game_Steinitz_Countergambit
HXjw2,8/6Kp/6p1/5pP1/5P1P/3p4/2kB4/8 w - - 8 54,g7h7 c2d2 h4h5 g6h5 g5g6 d2e3 g6g7 d3d2 g7g8q d2d1q,2499,86,80,194,advancedPawn crushing endgame hangingPiece promotion veryLong,https://lichess.org/nQuPbh9G#107,
HZeuS,r4r1k/2p3pp/p7/8/4Q3/P1P5/5qP1/3RR2K b - - 2 30,f8f4 e4a8 f4f8 a8e4,2497,79,95,347,advantage endgame hangingPiece short,https://lichess.org/7YcA6gXy/black#60,
Hdosd,4Brk1/Rb4pp/2P1p3/3n1p2/2p1pP1B/4P3/6PP/6K1 b - - 0 33,c4c3 c6b7 c3c2 e8f7 g8h8 a7a1,2404,78,92,3364,advancedPawn crushing defensiveMove endgame hangingPiece long master,https://lichess.org/S4f0YjW0/black#66,
HeR3e,rn2kbnQ/pp2p3/4bpp1/3pP3/3N4/8/PqPB1PPP/RN2K2R w KQq - 0 11,b1c3 b2a1 e1e2 e6g4 f2f3 a1h1,2445,85,92,1008,advantage hangingPiece long middlegame,https://lichess.org/E4HQZgHS#21,Scandinavian_Defense Scandinavian_Defense_Other_variations
HevgM,8/8/8/8/1k6/R3NKPP/p4P2/r7 w - - 6 62,h3h4 b4a3 e3c2 a3b3 c2a1 b3b2,2430,109,85,20,crushing endgame hangingPiece long master,https://lichess.org/QTIfEAWC#123,
HgHeZ,2kr3r/ppp2ppp/2nb1n2/5q2/Q2N4/2P1B3/PP3PPP/RN3RK1 b - - 0 12,d6h2 g1h2 c6d4 c3d4,2459,76,91,1606,advantage hangingPiece middlegame short,https://lichess.org/icfgtZyh/black#24,Scandinavian_Defense Scandinavian_Defense_Portuguese_Variation
HgyDn,3rb1k1/8/4PN1p/1p1p2p1/n1pP4/bpP2B2/1P2RB1P/6K1 b - - 1 33,g8f8 b2a3 f8e7 f6g8,2430,93,73,58,crushing hangingPiece middlegame short,https://lichess.org/jzBcE2Tt/black#66,
HhKXk,R2n2r1/2r2k1p/4p3/2NpPpp1/3q4/8/5PPP/1RQ3K1 w - - 8 28,a8d8 g8d8 c1g5 d4c5 g5f6 f7e8,2433,88,88,640,crushing hangingPiece long master middlegame,https://lichess.org/Pc13DhWg#55,
HhzUV,r1bq1rk1/pp4pp/2n5/2Pp4/5B2/2bB1N2/P1P3PP/R2Q1RK1 w - - 0 13,d3h7 g8h7 f3g5 h7g8 d1h5 c3d4 g1h1 c8f5,2463,88,79,60,advantage fork hangingPiece master opening veryLong,https://lichess.org/QiRMgHJ2#25,Vienna_Game Vienna_Game_Vienna_Gambit
Hj4Sk,3r4/pppr2kp/2p2p2/8/7B/2nBR3/b1P2PPP/R5K1 b - - 1 19,a2c4 d3c4 d7d1 a1d1 d8d1 c4f1,2462,84,80,106,advantage hangingPiece long middlegame,https://lichess.org/sLADb12L/black#38,Scotch_Game Scotch_Game_Schmidt_Variation
HkH5z,5R2/4P3/1pk2P2/3n1N1K/4r3/3p4/8/8 b - - 1 47,d5f6 f8f6 c6c7 f6f7,2492,86,89,799,crushing defensiveMove endgame hangingPiece master short,https://lichess.org/vmkEMEP1/black#94,
HlLPA,1k1r3r/1pq5/2p1B3/p2p4/P1nP4/2Q2RP1/2P4P/R5K1 b - - 0 24,h8h2 g1h2 d8h8 e6h3 c7h7 g3g4,2423,80,70,69,crushing defensiveMove hangingPiece long middlegame,https://lichess.org/QPenhygC/black#48,
HlemY,6k1/2q4p/4p1p1/2Pp1pP1/2rPnP2/4Q1bP/1R6/3R2K1 b - - 1 34,c4b4 b2b4 g3f2 e3f2 e4f2 d1b1,2458,81,84,80,advantage defensiveMove hangingPiece long middlegame,https://lichess.org/M7SZMVdX/black#68,
Hm4au,r1b1q1k1/2p3pp/p1Np1r2/2b5/4P3/8/PPP2PPP/RN1Q1RK1 w - - 0 13,c6e7 e8e7 d1d5 e7f7 d5a8 f6f2 a8c8 f7f8 c8f8 f2f8,2465,78,93,1593,advantage discoveredAttack hangingPiece middlegame sacrifice veryLong,https://lichess.org/ToBsr5HI#25,Ruy_Lopez Ruy_Lopez_Morphy_Defense
HnNP5,2kr4/1pp2p1p/p1b1p3/P3b3/2B2N2/1P3nP1/R6P/1N3R1K w - - 0 23,f1f3 c6f3 h1g1 d8d1 g1f2 f3g4,2424,80,91,1137,advantage defensiveMove fork hangingPiece long middlegame,https://lichess.org/jA6BQN1M#45,
HpaP6,r4rk1/ppq1nppp/3bp3/3p4/Qn4PP/2NBBP2/PP2N3/2R1K2R w K - 12 16,c3d5 b4d3 e1d2 c7d8 d5f6 g7f6,2400,85,80,81,advantage fork hangingPiece long middlegame quietMove,https://lichess.org/tEDFNDRj#31,Caro-Kann_Defense Caro-Kann_Defense_Other_variations
Hpx99,8/8/8/R7/5K2/4rp2/p4k2/8 b - - 1 66,e3e4 f4e4 f2g3 a5a3 a2a1r a3a1,2439,77,93,1841,crushing endgame hangingPiece long rookEndgame,https://lichess.org/AXilzWOu/black#132,
HqTK8,r2q1rk1/ppp3pp/2nb4/8/2PNb3/1P6/PB2BPPP/R2Q1RK1 b - - 0 13,e4g2 g1g2 d8g5 g2h1 g5h6 f2f4,2449,81,82,259,advantage defensiveMove hangingPiece long opening,https://lichess.org/eA3g7zHr/black#26,Nimzo-Larsen_Attack Nimzo-Larsen_Attack_Modern_Variation
Hr0Zg,6k1/1p3p1p/6p1/1N1n4/8/pr1BP3/b4PPP/R5K1 w - - 4 25,a1a2 b3d3 h2h4 d5c3 a2a3 d3d1 g1h2 c3b5,2432,98,90,1258,crushing endgame hangingPiece veryLong,https://lichess.org/OLmFd20C#49,
Hr64v,7r/3bkp2/p2b1p2/1p1Q1P2/4p3/1PP5/P1N1RK2/7r b - - 0 35,d7f5 d5f5 h8h2 f2e3 h2h5 f5c8,2479,80,92,1545,crushing hangingPiece long master middlegame,https://lichess.org/9zQhis6T/black#70,
HsHyJ,r4k2/p6p/1q4p1/3Q1p2/6n1/2Pp4/PP1N1bPP/R1B1R2K b - - 0 24,f2e1 d5a8 f8g7 h2h3 g4f2 h1h2,2482,95,90,1013,crushing hangingPiece long middlegame,https://lichess.org/Lr8c6PuJ/black#48,
HvkEo,r4rk1/pp2q3/3p3b/2p1pp1Q/2P1N3/3Pn1PB/PP3R2/1R4K1 b - - 1 27,f5e4 h5h6 f8f2 g1f2 e7f8 h6f8,2435,111,90,874,crushing hangingPiece kingsideAttack long middlegame,https://lichess.org/MoEXQnRB/black#54,
HwXcY,4r3/3RP2p/pb2kP2/1pp5/1Pn4P/8/P4PK1/B7 w - - 0 34,b4c5 e6d7 f6f7 b6c5 f7e8q d7e8,2472,84,83,51,crushing endgame hangingPiece intermezzo long,https://lichess.org/SBkBwgCK#67,
HwnqR,r2q2k1/p1p2pp1/3brn2/4p3/7Q/2NP3P/PP2PP2/R1B1K1R1 w Q - 4 17,g1g7 g8g7 c1h6 g7h8 h6g5 h8g8,2401,89,90,694,advantage defensiveMove hangingPiece long middlegame,https://lichess.org/VCXaAwcr#33,Grob_Opening Grob_Opening_Spike
I4ILI,rnr3k1/pp1n1pp1/8/b2pP1PQ/3P3P/2q1PN2/P2N4/R1B1K2R w KQ - 5 21,e1f2 c3a1 g5g6 f7g6 h5g6 d7f8,2431,81,70,123,crushing hangingPiece long master middlegame,https://lichess.org/acK4Z48G#41,
I4uQI,r2qr1k1/p2b1ppp/2Q5/8/5P2/3n2P1/PP1PN1BP/R1B2RK1 w - - 1 18,c6c4 e8e2 c4d3 e2g2,2449,78,93,2107,crushing hangingPiece kingsideAttack opening short,https://lichess.org/fXe9kX4q#35,English_Opening English_Opening_Mikenas-Carls_Variation
I5PZv,r3r1k1/1p1qbpp1/p6p/2PppP2/1P2N1Q1/P7/5PPP/3R1RK1 w - - 0 26,d1d5 d7d5 f5f6 e7f8 f6g7 f8e7,2431,78,91,3041,advantage hangingPiece long middlegame,https://lichess.org/VrWrZn4W#51,
I5hNw,8/2p2p2/2k2q2/2P5/PP2p1Q1/3bP1P1/3P1P2/R3K1N1 w Q - 1 29,f2f4 f6a1 g4d1 a1h8 b4b5 c6b7,2453,79,90,298,crushing defensiveMove endgame hangingPiece long quietMove,https://lichess.org/83eiy7yn#57,
IA3f6,3r3k/p6p/1p1P1Np1/1P2n3/1Qn5/B3bPPq/7P/4RRK1 w - - 0 29,e1e3 c4e3 f1f2 e5f3 g1h1 f3h2 b4h4 h2g4 h4h3 g4f2 h1h2 f2h3,2423,85,91,443,crushing discoveredAttack fork hangingPiece middlegame veryLong,https://lichess.org/jAEgefBf#57,
IDsST,3q4/p7/1p3k2/1P3p1B/P1pbpP2/6K1/5P2/3Q4 b - - 8 44,d4f2 g3f2 d8d3 h5e2,2440,96,85,22,advantage endgame hangingPiece master short,https://lichess.org/KZVIHpKm/black#88,
IE3Q0,2b2rk1/1p6/4p2p/1pPn2p1/1P1P1p1B/4p2P/1P2QPPK/r4B2 w - - 0 24,h4g5 h6g5 e2h5 f8f6,2450,102,78,45,crushing defensiveMove hangingPiece middlegame short,https://lichess.org/SQiyBLIq#47,
IEjrh,4rr1k/pp1q2pp/3P2b1/2Q5/2Bp3b/6P1/PP3P1P/R1B2RK1 b - - 0 20,h4g3 f2g3 f8f1 c4f1,2497,86,81,172,crushing hangingPiece middlegame short,https://lichess.org/CrmSaFd1/black#40,
IIXnL,6r1/1p1k1p2/1pb2p2/1NbR3p/r7/2N2PP1/1PP1K2P/3R4 b - - 0 21,c6d5 c3a4 g8e8 e2f1,2433,88,91,905,advantage defensiveMove hangingPiece master middlegame pin short,https://lichess.org/QzxOwd81/black#42,
IJabh,8/3q1k2/1p1p1p2/pPpPpNr1/2P1Pn2/P4QN1/3K1P1r/7R b - - 15 44,g5g3 f3g3 d7f5 g3h2 f5e4 h2h7 e4h7 h1h7,2455,107,89,1335,crushing hangingPiece master middlegame veryLong,https://lichess.org/pT3lE6sW/black#88,
ILtwy,2k1r3/pp3Npp/2p2q2/3B4/3nbK2/3P2P1/PPP4P/R1BQ1R2 w - - 0 19,f4e3 e4d5 e3d2 d4f3 f1f3 d5f3,2486,100,90,1184,advantage discoveredAttack hangingPiece long middlegame,https://lichess.org/4BgowWhj#37,Italian_Game Italian_Game_Two_Knights_Defense
IMGRt,8/8/3R4/4r3/4pK1P/1k1p4/8/8 b - - 1 54,b3c2 f4e5 e4e3 e5d4 e3e2 d6e6 e2e1q e6e1,2427,78,85,76,crushing endgame hangingPiece master rookEndgame veryLong,https://lichess.org/KrUFc3of/black#108,
IN81Y,r1q1k2r/2bb4/p4Q2/4p2P/3n2B1/3P4/PPP2P2/R3K1R1 b Qkq - 0 27,d7g4 f6h8 e8d7 h8g7 d7c6 g1g4,2407,78,84,123,advantage exposedKing fork hangingPiece long middlegame,https://lichess.org/EdEPUZLB/black#54,
IOodN,5rr1/p3N1qk/3pR2p/2pB1p2/2P2P2/1Pb4P/P7/4nQ1K b - - 1 44,c3d4 e6e1 g7g1 f1g1 g8g1 e1g1 d4g1 h1g1,2433,87,74,46,crushing hangingPiece master masterVsMaster middlegame veryLong,https://lichess.org/uZSxsnyT/black#88,
IP2Ro,r2q2k1/5p1r/3bbnp1/3p3p/1P1Bp3/4P3/1Q1NBPPP/1R3RK1 b - - 2 21,d6h2 g1h2 f6g4 h2g1 d8h4 d4e5,2457,91,85,229,crushing defensiveMove hangingPiece long middlegame,https://lichess.org/PvaSVuYV/black#42,
IPp9M,5r2/pp2KP2/2p5/8/1P1P4/P7/8/7k b - - 1 48,f8f7 e7f7 h1g2 f7e6 g2f3 d4d5 c6d5 e6d5 f3e3 d5d6,2467,83,72,130,crushing defensiveMove endgame hangingPiece veryLong,https://lichess.org/Z6cg7AbR/black#96,
IQCwb,3r2k1/p6p/4p2r/3b3q/5Q2/1PP1R1Pp/P4P1K/4R3 b - - 3 34,h5f5 f4h6 f5f2 h2h3 g8h8 e3e2,2414,89,90,925,advantage hangingPiece long middlegame,https://lichess.org/78UrhbBn/black#68,
IQsJ5,1k4r1/1pbP4/p2RP3/7p/8/PP2r3/7N/5R1K w - - 4 47,d6d3 e3d3 e6e7 d3d7 f1f8 b8a7,2493,78,85,579,advantage defensiveMove endgame hangingPiece long,https://lichess.org/CbRo6fNa#93,
ISqyu,1k4rr/pp3q2/1b1P1p2/2N5/8/3Q2Pp/PP5P/4RRK1 w - - 3 29,e1e7 b6c5 g1h1 f7a2,2491,81,85,248,advantage hangingPiece middlegame short,https://lichess.org/h8nhGACM#57,
IT18k,r3r1k1/pp6/5Qp1/3pn2p/2q2N2/P7/1PP5/1K4R1 b - - 5 29,e8f8 f6e5 c4a6 g1g6 a6g6 f4g6,2430,87,85,69,crushing exposedKing fork hangingPiece long middlegame,https://lichess.org/oSDZKlbV/black#58,
ITkmI,r7/7R/PK6/5pp1/8/8/5k1P/8 b - - 0 39,a8a6 b6a6 g5g4 h7g7 f2g2 h2h4,2489,84,94,76,crushing defensiveMove endgame hangingPiece long rookEndgame,https://lichess.org/FI8rStRs/black#78,
IU7yh,5r2/p5k1/1p4p1/2pBr2p/3pP1q1/P2P1p1R/1PP4Q/1K6 b - - 1 36,g4g2 h2e5 g7h6 e5d6 g2h3 d6f8,2405,86,80,74,advantage endgame hangingPiece long,https://lichess.org/tcIAwCsr/black#72,
IUgoC,r3k2r/1b1p1ppp/pq2p3/8/3pP3/B7/PPP3PP/R2Q1RK1 w kq - 1 15,f1f7 e8f7 d1h5 f7g8 a1f1 h7h6,2417,85,83,61,crushing defensiveMove hangingPiece long middlegame,https://lichess.org/9MYwSQiU#29,Sicilian_Defense Sicilian_Defense_Nyezhmetdinov-Rossolimo_Attack
IUhqe,6k1/p2r3p/2p5/5p2/1bP1p1b1/2NnP1P1/P1R2PN1/5BK1 b - - 4 35,d3e1 g2e1 b4c3 c2c3 d7d1 f2f3 e4f3 e1d3,2490,76,92,2134,advantage defensiveMove hangingPiece master middlegame veryLong,https://lichess.org/oPfcdt33/black#70,
IVYYR,4r3/6k1/p3pp1p/qb1p2pQ/B2Bn3/2P4P/2P2PP1/R5K1 w - - 0 25,a4b5 a5a1 g1h2 e8e7,2474,85,79,180,advantage defensiveMove hangingPiece middlegame short,https://lichess.org/eOvvNCrU#49,
IWFat,3rr1k1/pp1b1p1p/5Pp1/3N4/3n3Q/8/Pq2B1PP/3R1R1K w - - 2 27,d1d4 b2e2 f1g1 h7h5,2477,209,68,19,defensiveMove equality hangingPiece middlegame short,https://lichess.org/WS8xfvZd#53,
IXVKb,r3rb1k/p4Rpq/5n1p/4B2P/1pNP2Q1/8/5PP1/4R1K1 w - - 3 35,e5f6 e8e1 g1h2 h7g8 c4e5 e1e5,2438,94,89,299,advantage hangingPiece long middlegame,https://lichess.org/ok8EGDOm#69,
IXzpL,3r2k1/1p3pp1/pQb1p2p/8/2Pr4/PP3PB1/3q2PP/2R2R1K b - - 4 28,d2c1 f1c1 d4d1 g3e1,2425,77,93,6548,crushing defensiveMove hangingPiece middlegame short,https://lichess.org/mps8sFe2/black#56,
IYuNJ,2r2k2/4r1pp/1qBQPn2/p1p5/1p6/6PP/1P3P2/3RR1K1 w - - 6 29,d6e7 f8e7 d1d7 e7e8 c6a4 e8f8 e6e7 f8g8,2431,96,76,64,advantage defensiveMove hangingPiece middlegame veryLong,https://lichess.org/Yi2dw4Ox#57,
IZm7i,3rk2r/4ppbp/pq4p1/1p2Pb2/3n4/1BN1QN2/PP4PP/R4RK1 b k - 1 17,g7e5 f3e5 d4e2 g1f2 b6e3 f2e3,2460,78,91,3640,advantage hangingPiece long middlegame,https://lichess.org/I8PntfBa/black#34,Sicilian_Defense Sicilian_Defense_McDonnell_Attack
IcHdV,2k5/p1p4r/1p2q3/2Q1N3/3p4/1P6/2P5/1K4R1 w - - 2 33,g1g8 e6g8 c5c6 g8g1 b1a2 g1h1,2470,111,90,1046,crushing endgame hangingPiece long,https://lichess.org/vCZ7Zf5T#65,
Iegw2,8/8/8/1pk5/5r2/4Kp2/5R2/8 b - - 5 51,b5b4 e3f4 c5c4 f4e3 c4c3 f2f1 b4b3 f1c1,2437,88,48,47,crushing endgame hangingPiece rookEndgame veryLong,https://lichess.org/Jht8MpsE/black#102,
IpcY2,8/8/2N5/2np1k2/Pp1p2p1/1P6/2P3K1/8 b - - 2 49,c5b3 c2b3 d4d3 c6b4 d3d2 b4d5 d2d1n a4a5 f5e6 a5a6 e6d5 a6a7,2423,90,80,258,advancedPawn crushing endgame hangingPiece knightEndgame veryLong,https://lichess.org/1aOo3uZ0/black#98,
IplPI,7k/pp3pp1/1bpN1p1p/6nP/2PP2Q1/1P4P1/PB1q1PK1/8 w - - 4 35,d6f7 g5f7 c4c5 b6a5 g4d7 d2b2,2456,87,69,104,advantage endgame hangingPiece long quietMove,https://lichess.org/5NgAUaUB#69,
IqGn9,8/1k3Pp1/p5q1/2Bb4/2pP2p1/7p/PP1K4/7Q w - - 1 40,f7f8q d5h1 f8e7 b7c6,2406,82,89,441,advantage endgame hangingPiece master masterVsMaster short,https://lichess.org/RArv3Va6#79,
IrI8K,r1b2rk1/p2pn3/np4pR/5pN1/8/8/PPP2PPP/4R1K1 b - - 4 20,c8b7 e1e7 f8f6 e7h7 g8f8 h7d7,2484,101,87,358,crushing hangingPiece long middlegame,https://lichess.org/jvFPLec9/black#40,
Irfef,3rr1k1/pp1q1ppp/3b4/4n3/4p3/PBB1P2b/1PP1QPP1/3RNRK1 b - - 1 20,h3g2 g1g2 e5f3 f1h1 d7g4 g2f1 f3h2 h1h2 g4e2 f1e2,2413,93,82,45,advantage hangingPiece middlegame veryLong,https://lichess.org/OxkIq4JJ/black#40,
IrusT,8/8/8/p4Kp1/2N3P1/6k1/3b4/8 b - - 9 78,a5a4 c4d2 g3f2 d2c4,2448,87,90,252,crushing defensiveMove endgame hangingPiece short,https://lichess.org/eTIXdJsy/black#156,
Is6g8,1r4k1/b4ppp/p7/3B4/2n2N2/P3q1P1/QB3nKP/1R6 b - - 0 35,b8b2 a2c4 f2d1 b1b2,2491,82,91,1013,crushing hangingPiece intermezzo master middlegame short,https://lichess.org/1As1IbWW/black#70,
IsrTc,1n3b1r/5kpp/1B2p3/3R4/8/1PK2P2/q1PQ2PP/r2R4 b - - 4 23,f8b4 c3b4 a2a3 b4c4 h8c8 d5c5 a3a6 c4c3,2491,91,70,66,advantage defensiveMove hangingPiece middlegame veryLong,https://lichess.org/yutfkSvK/black#46,
Ivu6n,r2q1rk1/4bpp1/2n4p/3pN3/1ppPn3/2P3BP/1PQ1NPP1/1R3RK1 b - - 1 23,e4g3 e5c6 b4b3 c2d1 g3f1 c6d8,2423,77,93,2452,crushing hangingPiece long middlegame,https://lichess.org/37u4Wzgs/black#46,
Iw9Uc,kr6/p1Q1Bb2/B3r3/3p3q/P2P1R2/7P/3N1K2/7R w - - 3 37,f4f7 h5f7 d2f3 b8b2 f2g3 e6g6 f3g5 g6g5,2468,81,96,380,crushing exposedKing fork hangingPiece middlegame veryLong,https://lichess.org/lb1zlcUx#73,
IzCk2,8/8/1PK3p1/4pk1p/P2b1p2/5B1P/8/8 b - - 0 57,d4b6 c6b6 e5e4 f3d1 f4f3 a4a5 f5f4 a5a6,2482,79,91,377,bishopEndgame crushing endgame hangingPiece quietMove veryLong,https://lichess.org/DaqXNkbM/black#114,
IzKYb,3k1b1r/3q2pp/P1p1p3/4P3/3n4/2p2Q2/1PP3PP/R2R2K1 w - - 2 22,d1d4 d7d4 g1h1 c3b2 a1d1 d4d1 f3d1 d8c7,2442,97,90,766,advancedPawn crushing defensiveMove endgame hangingPiece veryLong,https://lichess.org/dKHJ9RDl#43,
Izsy5,8/8/4Rn2/P6p/6k1/5pp1/8/5K2 b - - 1 59,h5h4 e6f6 h4h3 f1g1,2453,93,90,890,crushing defensiveMove endgame hangingPiece short,https://lichess.org/NctfmhM2/black#118,
J1Pjt,6k1/p4rp1/2r1N3/3p4/1P1P2QP/2q1P3/P4nP1/R4RK1 w - - 0 31,g4g3 c6e6 a1c1 c3d2,2495,77,91,4773,advantage hangingPiece middlegame short,https://lichess.org/i1WIdj4c#61,
J1ltl,2r1r1k1/p4pb1/1pp1q2p/4N1p1/1P1P4/PNn3P1/2Q2PP1/4RK1R b - - 16 28,g7e5 c2c3 e5d4 b3d4,2404,92,90,1112,advantage hangingPiece middlegame short,https://lichess.org/5es1eGXy/black#56,
J1pP1,6rk/1p3Rb1/3Q2Pp/p2P2p1/6P1/2pq1NK1/P7/8 w - - 0 38,f7g7 h8g7 d6e7 g7g6 g3f2 d3c2,2431,89,85,144,crushing endgame hangingPiece long,https://lichess.org/hNm8iKdH#75,
J26Mj,4r3/8/3p1n1k/3p2p1/3P3n/2P3Q1/P1RNqP2/3N2KR w - - 7 32,d2f3 e2d1 g1h2 d1f3 g3f3 h4f3 h2g2 f3h4,2429,103,89,845,advantage fork hangingPiece middlegame veryLong,https://lichess.org/xXOuWdzC#63,
J3eyx,r3r3/p4k2/2p4p/2N2bpB/2PKpp2/1P5P/P2R1nP1/3R4 b - - 1 29,f7f6 d2f2 e4e3 f2b2,2456,99,85,2101,advantage defensiveMove hangingPiece master middlegame short,https://lichess.org/yOzyrUB6/black#58,
J78Jo,k2r4/pp5Q/1bp1B3/q4P2/3r3p/6B1/PPP3PP/R4R1K w - - 0 26,g3e5 a5e5 a1e1 d4f4,2462,79,77,52,advantage hangingPiece middlegame short,https://lichess.org/Eey9UMTa#51,
JA1Ul,2r3k1/3q1pbp/6b1/6P1/1Q1p1P2/pPN5/P7/K1RR4 b - - 1 39,d4c3 d1d7 c3c2 b4d4,2493,84,92,3188,advantage hangingPiece middlegame short,https://lichess.org/NcZCTpNx/black#78,
JAIaE,r4r1k/b2N2p1/p1p3qp/4p3/1P2Pn2/PQ4PP/1B2nP1K/3R1R2 b - - 0 28,a7f2 f1f2 f4d3 f2e2,2455,102,90,416,crushing hangingPiece middlegame short,https://lichess.org/6SHBIg3L/black#56,
JB2xu,r1b4r/pp2kpNp/2n2q1B/3pp3/1b2Q3/2N5/PPP2PPP/R3KB1R w KQ - 2 13,e1c1 f6h6 e4e3 h6e3,2493,110,90,892,advantage fork hangingPiece middlegame short,https://lichess.org/MwsJzTWW#25,Sicilian_Defense Sicilian_Defense_Lowenthal_Variation
JBN1T,r3r3/pp4k1/1qp3b1/3pN3/3P4/1P2P1QP/P7/5RK1 b - - 1 29,e8e5 g3e5 g7h6 e5f4 h6h7 f4h4,2462,87,90,2000,advantage endgame exposedKing hangingPiece long,https://lichess.org/K7CXuKs9/black#58,
JCcBD,2rqkb1r/p4ppp/2n1p3/1Q2P3/7N/1P6/P3pPPP/R1B1R1K1 w k - 4 19,c1g5 d8g5 a1c1 g5d2,2431,80,92,2791,crushing hangingPiece middlegame short,https://lichess.org/WHR4tSQd#37,Caro-Kann_Defense Caro-Kann_Defense_Advance_Variation
JDmG7,4r1k1/6pp/q3N3/pbBpP1b1/1p6/1P3QP1/r6P/2R2RK1 b - - 0 38,b5f1 e6g5 a2g2 g1h1 g2h2 h1h2,2463,79,78,103,advantage hangingPiece long middlegame,https://lichess.org/svHGv6GK/black#76,
JESyk,4k2r/2pb1p2/2B1p2p/2Pp1q2/Q7/1Kb2N2/6PP/7R b k - 0 21,e8e7 b3c3 d7c6 a4c6,2411,162,79,20,equality hangingPiece middlegame short,https://lichess.org/AMukE75L/black#42,
JF3uZ,8/1r3k2/2RBp3/4Kp2/1p1P2p1/p3P1P1/8/8 w - - 0 51,d6b4 b7b4 c6a6 b4b3 e3e4 b3e3,2466,88,82,194,crushing endgame hangingPiece long,https://lichess.org/wGhbjKS4#101,
JH627,2r1r1k1/1p3pp1/3Pp2p/1p6/6n1/P2Q1N2/1B3qPP/1R2R2K b - - 1 22,f2e1 f3e1 g4f2 h1g1 f2d3 d6d7,2442,91,89,1269,advancedPawn advantage hangingPiece long middlegame,https://lichess.org/JRzXMOT8/black#44,
JH7Cu,r2q1rk1/4bppp/p2pb3/6P1/3QPB1P/5PN1/PpP5/1K1R3R b - - 1 20,e6a2 b1a2 d8a5 a2b2 a8b8 b2c1 d6d5 d1d3,2473,89,82,56,advantage defensiveMove hangingPiece master middlegame veryLong,https://lichess.org/8D0qG2gt/black#40,
JPLfC,r5k1/pp1rqppp/1b2bn2/6B1/6B1/1N5P/PP2QPP1/R3R1K1 b - - 9 18,b6f2 g1f2 f6g4 e2g4,2405,90,90,1050,advantage hangingPiece master middlegame short,https://lichess.org/SztNCMBC/black#36,Caro-Kann_Defense Caro-Kann_Defense_Exchange_Variation
JRmsq,8/1Q4bk/p2R2p1/7p/4P3/1B5P/P3qRP1/2r3K1 w - - 1 32,g1h2 e2f2 d6d1 c1d1 b3d1 h7h6 b7c7 g7d4 c7c1 d4e3 c1e3 f2e3,2488,95,83,35,crushing hangingPiece middlegame quietMove veryLong,https://lichess.org/pKSW3EwC#63,
JSGA0,r2q2k1/p1p2ppp/2p4B/8/4r3/P1n2RQ1/2P3PP/R5K1 b - - 1 18,g7g6 f3c3 d8d4 g1h1 e4h4 g3e3,2484,82,77,87,crushing hangingPiece long middlegame,https://lichess.org/U9v3pjdv/black#36,Four_Knights_Game Four_Knights_Game_Spanish_Variation
JSUzI,r2qr1k1/ppp2pp1/2n2n1p/4N3/2BP2b1/P1NQ4/1PP3PP/R4RK1 b - - 0 14,g4e2 c3e2 c6e5 d4e5,2492,95,90,695,crushing hangingPiece middlegame short,https://lichess.org/9TMeVItU/black#28,Three_Knights_Opening Three_Knights_Opening_Other_variations
JScyN,r1bqkbnr/pp4pp/2n5/2P1pp2/4N3/8/PPPB1PPP/R2QKBNR w KQkq - 0 8,f1b5 f5e4 b5c6 b7c6 d1h5 e8e7,2418,82,29,49,advantage defensiveMove hangingPiece long opening,https://lichess.org/BzzBIeyZ#15,Queens_Pawn_Game Queens_Pawn_Game_Levitsky_Attack
JSdgw,1k2r3/1pp3b1/p2p2Q1/P2P3p/1n5P/2N2q2/3B4/1K1R4 b - - 0 33,g7c3 g6e8 b8a7 e8e3 f3e3 d2e3,2492,99,95,1043,advantage hangingPiece long middlegame,https://lichess.org/gKIWtJy5/black#66,
JT62m,2r2rk1/3R2p1/p3p1Pp/4P3/1b3P2/qPN3QR/P7/1K6 w - - 1 27,h3h6 g7h6 g3h3 a3c1 b1c1 c8c3 h3c3 b4c3,2414,81,39,70,advantage attraction fork hangingPiece master middlegame veryLong,https://lichess.org/Wc9IMMwA#53,
JTAza,6rk/2Q3pp/8/2P2p2/3PbP2/2P3P1/7r/4RK2 w - - 0 39,e1e4 f5e4 c7b7 e4e3 f1e1 g8e8,2406,163,32,25,defensiveMove endgame equality hangingPiece long queenRookEndgame,https://lichess.org/Fehuvut7#77,
JTgPj,2k3r1/p1p2p1p/b1pb4/3p4/5p1q/1P1PPNn1/PBP1Q1PP/RN3K1R w - - 5 14,h2g3 h4h1 f3g1 g8g3 b1d2 f4e3,2450,85,90,779,crushing hangingPiece intermezzo long middlegame,https://lichess.org/hADsO8f0#27,Nimzo-Larsen_Attack Nimzo-Larsen_Attack_Classical_Variation
JUOfo,q4rk1/5p2/4p1p1/3pP1Q1/7P/2p1P1R1/p1P2PPK/Rr6 w - - 2 40,a1a2 a8a2 g5h6 f8a8 h4h5 a2a1,2414,102,40,57,advantage defensiveMove endgame hangingPiece long quietMove,https://lichess.org/oqZCDuoG#79,
JWMLz,5r1k/p5p1/2p5/1p2q3/8/3BB1Pb/PP2Q2P/R5K1 w - - 2 27,e3d4 e5d4 g1h1 h3g4 a1f1 d4d5 d3e4 f8f1 e2f1 d5e4,2455,83,90,428,crushing hangingPiece middlegame veryLong,https://lichess.org/lu4RNp09#53,
JX2Ma,1k1r1b1r/1p1q1pp1/p2N2p1/2PpnnB1/3N4/1Q6/PP3PPP/R4RK1 w - - 2 18,g5d8 f5d4 b3d5 f8d6 d5d6 d7d6 c5d6 h8d8,2436,101,89,775,advantage hangingPiece middlegame veryLong,https://lichess.org/kdEDaq9y#35,Caro-Kann_Defense Caro-Kann_Defense_Advance_Variation
JXcJi,2r2rk1/3n1ppp/bqn1p3/p2pP3/3P4/2P2N2/2BB1PPP/R2Q1RK1 w - - 2 19,c2h7 g8h7 f3g5 h7g8 d1h5 a6d3,2466,83,85,190,advantage hangingPiece long middlegame,https://lichess.org/SyqmF5gw#37,Caro-Kann_Defense Caro-Kann_Defense_Accelerated_Panov_Attack
JYErY,6k1/p4ppp/2p5/1p1q4/1b4Q1/1P2P2P/PB3PP1/6K1 b - - 1 22,g7g6 g4b4 d5d1 g1h2,2444,124,85,20,crushing endgame hangingPiece short,https://lichess.org/reSbfqfN/black#44,
JYays,1b3r1k/1p4p1/p3p3/2r3Nq/P1n5/5NPP/2Q2P2/R4RK1 w - - 0 24,g5e6 f8f3 a1d1 c5c8,2480,92,86,419,crushing defensiveMove hangingPiece middlegame short,https://lichess.org/r6iKfKjG#47,
JZNcR,1k1r3r/1ppb2p1/Pp1p4/1P1P4/2Pqp3/5PPp/3N3P/R2Q1R1K w - - 0 24,d1a4 d4d2 a1a2 d2d3,2435,243,-50,8,crushing hangingPiece middlegame short,https://lichess.org/lRABZu82#47,
JZSpA,8/5kp1/2b5/3p1PpN/p1nP4/Pp2pK2/1P3b2/2R5 b - - 3 47,c4e5 d4e5 g5g4 f3g2 f2h4 h5f4,2443,97,77,34,advantage endgame hangingPiece long,https://lichess.org/UYSmod7E/black#94,
JZghE,6rk/pp1q2pp/2p5/2brB3/4R1P1/2Q5/PPP4P/4R2K b - - 2 26,d5d1 c3c5 d1e1 e4e1,2457,82,90,1321,advantage hangingPiece middlegame short,https://lichess.org/f0zmLy0p/black#52,
Jd4ot,5r1k/6rP/3p1P1R/4p3/p3B3/Pp3K2/1P2Q3/3q4 b - - 0 47,f8f6 h6f6 d1h1 f3e3 h1g1 e2f2,2460,80,81,70,crushing endgame hangingPiece long,https://lichess.org/QgMeQLSV/black#94,
JfHHf,8/6k1/2p3P1/pp1p1pK1/P2PnP2/1PP5/3N4/8 w - - 1 37,g5f5 e4d2 f5e6 g7g6 f4f5 g6g7 e6d6 g7f6 d6c6 d2b3 c6b5 f6f5,2494,198,44,14,crushing endgame hangingPiece knightEndgame veryLong,https://lichess.org/4YrZCefx#73,
JfNJB,8/1p4kB/3N4/3PP2R/1P3p2/P4Pp1/7r/b2K4 w - - 1 38,e5e6 h2h5 e6e7 g3g2 e7e8q g2g1q,2453,98,85,43,advancedPawn crushing endgame hangingPiece long promotion,https://lichess.org/zzIqgWBf#75,
JfR00,3k4/q2bR3/5rp1/6Qp/p1rP2n1/5N2/1PP3P1/2K1R3 w - - 2 28,e7d7 a7d7 g5a5 c4c7 a5a8 c7c8,2492,98,90,660,crushing hangingPiece long master middlegame,https://lichess.org/NKCssrJB#55,
JgWvx,7k/1p2p2p/QP1p1brN/2pPn3/8/5P2/3r2PP/1R3RK1 w - - 0 33,h6g4 b7a6 b6b7 e5d7 b7b8q d7b8,2485,78,84,368,crushing hangingPiece long middlegame quietMove,https://lichess.org/CPzEjtge#65,
Jgkas,3r1k2/5pqN/4r3/4P2Q/2p2P2/6P1/6BP/n5K1 b - - 3 39,g7h7 h5h7 c4c3 g2e4 c3c2 e4c2 a1c2 h7c2,2401,78,93,540,crushing endgame hangingPiece quietMove veryLong,https://lichess.org/f739jgcG/black#78,
Jh4mp,2rq2k1/pp3rpp/5N1B/3p4/6Q1/2P4P/PP3PP1/R4nK1 b - - 0 23,d8f6 g4c8 f7f8 c8c5,2467,78,74,93,crushing hangingPiece middlegame short,https://lichess.org/8Pq8UjIL/black#46,
Jidw7,1r1r4/ppn1R1bk/3q1Nbp/6p1/1PB1Qpn1/3P4/P1P3PP/1RB4K b - - 3 24,h7h8 e4g6 d6f6 e7g7 f6g6 g7g6 h8h7 c1f4 g4f2 h1g1 g5f4 g6f6,2405,95,72,33,advantage hangingPiece middlegame veryLong,https://lichess.org/WupilOIc/black#48,
JkIlE,5rk1/pp3qpp/3n4/8/2p5/2Pn2QP/PP1BRNP1/6K1 b - - 16 32,d6e4 f2e4 f7f1 g1h2 f1e2 d2h6,2466,82,72,111,crushing hangingPiece long middlegame pin sacrifice,https://lichess.org/KTxaXUFT/black#64,
JnCci,rn2kb1r/1b4pp/p2pNq2/8/Np2n3/8/PPP2PPP/R1BQR1K1 w kq - 1 13,e1e4 b7e4 e6c7 e8f7,2456,85,84,412,advantage defensiveMove hangingPiece opening short,https://lichess.org/Empn0hi7#25,Sicilian_Defense Sicilian_Defense_Modern_Variations
JnXg0,2kr3r/q4ppp/p2Bp3/bp1nPP2/2pPQ3/5N2/6PP/1RR4K b - - 0 22,d8d6 e5d6 h8d8 f5e6 d8d6 e4e5 a7e7 e6f7,2435,85,70,76,advancedPawn crushing hangingPiece middlegame veryLong,https://lichess.org/VNtp3k6Z/black#44,
JoHjh,8/8/6pp/3p1p2/p1p5/4K1P1/1k2B2P/N7 w - - 1 56,e3d4 b2a1 d4c3 a1b1,2486,86,68,87,crushing defensiveMove endgame hangingPiece short,https://lichess.org/nDvFVxvJ#111,
JrHNd,r1b2knQ/1p4p1/2p1pn1b/p2pP1qP/8/2P1P1B1/PP4P1/RN3RK1 w - - 2 18,e5f6 g5g3 f1f3 g3e1 g1h2 e1h4,2439,87,90,539,advantage hangingPiece kingsideAttack long middlegame,https://lichess.org/d0C7GmLR#35,Queens_Pawn_Game Queens_Pawn_Game_Zukertort_Variation
