PuzzleId,FEN,Moves,Rating,RatingDeviation,Popularity,NbPlays,Themes,GameUrl,OpeningTags
Ul5GL,5r1k/1p1q4/pB1P2Qp/6p1/6P1/P4b2/1bB4P/1K1R4 b - - 1 32,f3d1 b1b2 d7g7 g6g7,2464,82,84,165,crushing hangingPiece middlegame short,https://lichess.org/8zE37bt2/black#64,
UnaBJ,8/P7/1K3p2/R7/6k1/6pp/8/r7 b - - 3 54,g3g2 a5a1 h3h2 a7a8q g2g1q b6b5,2490,86,74,43,advancedPawn crushing defensiveMove endgame hangingPiece long master promotion rookEndgame,https://lichess.org/YynBXLI8/black#108,
UsxQP,8/8/8/7p/2PBkp1P/4p3/6K1/8 w - - 1 42,c4c5 e4d4 c5c6 e3e2 g2f2 d4d3 c6c7 d3d2 f2g2 e2e1q,2491,89,80,98,advancedPawn crushing endgame hangingPiece promotion veryLong,https://lichess.org/na2ix3bF#83,
UuZJw,6k1/3r2p1/1pb1r1np/1p6/2P1P3/P1Q1bPB1/3p2PP/3R3K b - - 1 32,b5c4 c3e3 d7d3 e3e2,2460,78,91,1057,advantage hangingPiece middlegame short,https://lichess.org/18JlXUfO/black#64,
Uvxiz,2kr4/QR3p2/2p5/3p1bn1/7r/P1n2Pq1/2PKB3/5R2 b - - 1 26,h4d4 d2c3 d4a4 e2a6 g5e4 c3b2,2479,80,84,47,advantage defensiveMove hangingPiece long middlegame quietMove,https://lichess.org/RFPt7Q2D/black#52,
Ux9E9,kr5r/4QRp1/p1p1P3/PB6/3q4/7p/1P3K1B/8 w - - 0 40,f2e2 b8b5 f7f8 h8f8 e7f8 a8a7,2419,84,90,788,crushing defensiveMove hangingPiece long middlegame,https://lichess.org/8WkokNM3#79,
UygQ6,2r2b2/5ppk/Q1n1p3/1p1p3b/3P4/2q1P2P/P4PP1/R4RK1 b - - 0 20,b5b4 a6c8 c6d4 c8f8,2448,78,95,197,advantage hangingPiece middlegame short,https://lichess.org/9xWtNhX7/black#40,
V0FoU,1r5k/6p1/1q5p/1Pr5/P4Q2/5P2/6PP/4R2K b - - 3 44,b6a5 f4b8 h8h7 b8e8 a5a4 e1b1,2444,101,83,57,advantage defensiveMove endgame hangingPiece long quietMove,https://lichess.org/mskEuMUM/black#88,
V0To0,1n2kb1r/rb3ppp/pq2pB2/1N6/2pP4/4P1Q1/1P3PPP/R3KBNR b KQk - 2 12,a6b5 g3b8 e8d7 b8a7,2409,89,90,1226,advantage hangingPiece opening short,https://lichess.org/aTTzwGbF/black#24,Indian_Defense Indian_Defense_Normal_Variation
V241V,r2qk2r/pb2bppp/1p2p3/2p3B1/2B5/2N3Q1/PPP2nPP/R3K2R w KQkq - 0 13,g5e7 f2h1 g3g7 e8e7 g7g5 e7f8,2430,94,89,778,crushing defensiveMove hangingPiece intermezzo long middlegame,https://lichess.org/svMBLOdQ#25,Four_Knights_Game Four_Knights_Game_Scotch_Variation_Accepted
V4Ie5,2k5/2P5/8/3nB2p/5p2/5P2/5K2/8 w - - 1 57,e5f4 d5f4 f2g3 f4d5 g3h4 d5f6 f3f4 c8c7,2491,90,95,75,crushing endgame hangingPiece quietMove veryLong,https://lichess.org/gGIY6XLv#113,
V62Dm,r1bq2kr/4pR2/3p2P1/2pP2N1/4P3/PpQ3n1/1P2B3/2K5 b - - 2 26,e7e5 c3g3 h8h1 c1d2 d8a5 d2e3,2485,85,75,55,advantage defensiveMove hangingPiece long middlegame,https://lichess.org/ZkcY3ZIP/black#52,
V7ARE,r1b2rk1/ppp2pb1/3p3p/3Pp1p1/4n1qP/2NQB3/PP2BP1R/R4K2 b - - 1 18,e4f2 f1f2 g4f5 d3f5,2442,82,82,124,advantage hangingPiece middlegame short,https://lichess.org/znqPrQKf/black#36,Kings_Indian_Defense Kings_Indian_Defense_Makogonov_Variation
V8far,2r3k1/5ppp/R7/P2n4/Q1q5/3N2P1/b3rPBP/5RK1 w - - 2 31,f1c1 c4a6 c1c8 a6c8,2468,93,85,836,advantage hangingPiece middlegame short,https://lichess.org/0sOVWvr2#61,
V92bG,r2r4/1pp3pk/7p/3QPb2/1p1N1Pq1/6P1/PP1N1K2/R6R w - - 4 22,d5b7 d8d4 d2f3 a8d8 f3d4 d8d4,2451,83,80,78,crushing hangingPiece long middlegame quietMove,https://lichess.org/mKXCDy3A#43,
VBhlJ,8/7p/p5pk/n3K1p1/R1p4P/8/8/8 b - - 0 59,g5h4 a4a5 h6g5 e5e4,2444,85,85,424,crushing discoveredAttack endgame hangingPiece short,https://lichess.org/w5busdtp/black#118,
VCgdm,4k3/1RP5/3K4/3P4/8/ppr5/8/8 b - - 0 54,c3c7 d6c7 a3a2 d5d6 b3b2 d6d7 e8f7 d7d8q,2471,96,90,2087,advancedPawn crushing deflection endgame exposedKing hangingPiece promotion rookEndgame veryLong,https://lichess.org/agU7HM2h/black#108,
VEXll,8/8/8/3p2p1/k1pP2Pp/1pPr3P/1P3RK1/8 b - - 59 71,d3c3 b2c3 a4a3 f2f5 a3b2 f5d5 b2c3 d5b5,2434,94,69,40,crushing endgame hangingPiece rookEndgame veryLong,https://lichess.org/fYT99GKb/black#142,
VFvrd,rnbq1rk1/pp1p1ppp/2p2n2/8/2BPPB1b/2N2N2/PPP3PP/R2Q1K1R b - - 1 8,f6e4 c3e4 d7d5 e4d6 d5c4 d6c8,2461,100,90,1825,advantage hangingPiece long opening,https://lichess.org/LTkO8teY/black#16,Kings_Gambit_Accepted Kings_Gambit_Accepted_Bishops_Gambit
VGJUG,8/1pp5/p7/4K3/1P5N/7k/8/8 w - - 0 43,e5e6 h3h4 e6d7 b7b6 d7c7 a6a5 b4b5 a5a4 c7b6 a4a3 b6c7 a3a2 b5b6 a2a1q,2415,93,90,1280,advancedPawn crushing endgame hangingPiece promotion quietMove veryLong,https://lichess.org/p35BngaD#85,
VKOaX,r1bq1rk1/pppp1ppp/2n2N1n/4P3/2B5/P3QN2/5PPP/R4RK1 b - - 6 16,g7f6 e3h6 c6e5 f3e5 f6e5 a1e1,2490,189,-58,8,advantage hangingPiece long middlegame,https://lichess.org/2kmxKqnD/black#32,Italian_Game Italian_Game_Evans_Gambit
VKbCH,3r2k1/p2r1ppp/2p1b3/b1N5/8/1Pn3BP/P3BPP1/3R1RK1 w - - 0 22,d1d7 c3e2 g1h2 d8d7,2482,81,93,647,advantage hangingPiece intermezzo middlegame short,https://lichess.org/FmHvlUwa#43,
VLP0u,r2qr1k1/pb2nppp/1p6/3p4/3P4/3B1N2/PP3PPP/R2QR1K1 w - - 2 16,d3h7 g8h7 f3g5 h7g8 d1h5 e7g6 h5h7 g8f8 e1e8 d8e8,2415,75,92,409,advantage hangingPiece middlegame quietMove veryLong,https://lichess.org/AlYOkAj1#31,Sicilian_Defense Sicilian_Defense_Alapin_Variation
VNaSh,6r1/3R2bk/pR6/3Np3/Q3Pppq/3r1P2/P5P1/6K1 w - - 5 34,d7g7 h7g7 b6g6 g7g6,2486,79,33,48,crushing hangingPiece middlegame short,https://lichess.org/zvlCcBEO#67,
VPESt,r1b1k3/ppp2pp1/2np4/2b1p3/2B1P1p1/2NP1qPR/PPPBNPK1/R2Q4 w q - 1 14,g2g1 g4h3 d1f1 h3h2 g1h2 f3h5,2458,89,39,54,advancedPawn advantage attraction hangingPiece kingsideAttack long middlegame,https://lichess.org/TuRxfkRy#27,Vienna_Game Vienna_Game_Stanley_Variation
VPwmI,5rk1/pR3ppp/1p6/1Q6/6B1/4P2P/1bq2PPK/8 w - - 0 33,b7f7 g8f7 b5d5 f7g6,2417,79,91,1194,crushing defensiveMove endgame hangingPiece short,https://lichess.org/P75x2C8Y#65,
VRwQD,r6r/ppp2kpp/2n1bq2/2bBp3/8/2N2Q2/PPPP1PPP/R1B1K2R w KQ - 3 10,c3e4 e6d5 f3h5 f6g6,2401,78,98,215,advantage hangingPiece middlegame short,https://lichess.org/ZVePJoaA#19,Four_Knights_Game Four_Knights_Game_Italian_Variation
VTWyH,8/5p2/3Bp3/6Kp/p1n1P2P/Pk3P2/8/8 w - - 4 50,g5h5 c4d6 h5g5 f7f5 e4e5 d6f7,2412,90,85,114,advantage endgame hangingPiece long,https://lichess.org/B5QZdIuI#99,
VTwGo,8/8/2n5/1P2p3/p3P1pk/2PNK3/8/8 b - - 0 38,a4a3 b5c6 a3a2 c6c7 a2a1q c7c8q a1g1 e3e2,2456,85,90,517,advancedPawn crushing defensiveMove endgame hangingPiece knightEndgame promotion veryLong,https://lichess.org/qJtFicNi/black#76,
VUesn,2k1r3/1p1b1Q2/1qp2R2/8/1N2P3/6pP/rP4P1/2R2K2 b - - 2 33,b6b4 f7a2 b4d2 a2c4,2417,81,77,108,advantage hangingPiece middlegame short,https://lichess.org/Kxvo7t35/black#66,
VViYN,r1q2rk1/1pp2pp1/2b2R1n/p5N1/7Q/P7/1PP1B1P1/3R2K1 b - - 8 23,g7f6 h4h6 c8f5 e2d3 f5c5 g1h2 c5e5 g2g3,2489,88,65,144,crushing defensiveMove hangingPiece middlegame veryLong,https://lichess.org/ljsf1LhW/black#46,
VXFk6,r1b2rk1/ppp2pp1/8/8/5P2/2qB2P1/P1P3P1/R2Q1K1R w - - 3 18,d1h5 c3a1 f1f2 a1d4 f2f3 f7f5,2437,80,89,758,advantage defensiveMove hangingPiece long middlegame,https://lichess.org/Fl7MAaNt#35,Queens_Pawn_Game Queens_Pawn_Game_Accelerated_London_System
VXnXl,8/5k1p/1PP1p3/2Bn1p2/2K2p2/2b5/5P2/8 b - - 0 51,d5b6 c5b6 c3e5 c6c7 e5c7 b6c7 f7f6 c4d4,2471,81,53,54,advancedPawn crushing defensiveMove endgame hangingPiece master veryLong,https://lichess.org/xWJyNlCd/black#102,
VZGpa,4k3/n3pp1p/1P1p2p1/2pP4/2K1P3/8/5PPP/b7 b - - 0 40,a7c6 d5c6 e8d8 c4b5 a1d4 c6c7 d8d7 b5a6 d7c8 b6b7 c8c7 a6a7 c5c4 a7a8,2494,92,94,59,advancedPawn advantage endgame hangingPiece veryLong,https://lichess.org/SGzAe5JH/black#80,
VbJyw,8/5p2/4p1p1/4P3/2k2P2/1p1pK1P1/1B4R1/1r6 b - - 11 55,b1b2 g2b2 c4c3 b2d2 b3b2 d2d3,2482,78,95,177,crushing endgame hangingPiece long rookEndgame,https://lichess.org/0vUoEnlu/black#110,
VbwbK,2r1k1r1/pb6/1pp1Q3/3p1p2/1P5R/2q1P3/P5P1/6K1 b - - 5 36,e8d8 e6g8 d8c7 g8g3 c7d7 h4h7 d7e6 h7h6,2446,96,32,66,crushing endgame exposedKing hangingPiece veryLong,https://lichess.org/YxoJz5Qt/black#72,
VbyyV,2kr1bnr/ppp2p2/5qn1/1P1PNbpB/8/P1N3B1/2P2PPP/R2Q1RK1 w - - 1 16,e5g4 f6c3 h5g6 f7g6 g3e5 c3c4 g4e3 c4h4,2453,104,43,24,advantage hangingPiece middlegame veryLong,https://lichess.org/LYTispy2#31,Scandinavian_Defense Scandinavian_Defense_Mieses-Kotroc_Variation
Vc5q1,7k/p4ppB/2p2q2/3r2Nb/3p4/6QP/Pr1B1PP1/5RK1 w - - 0 25,g3h4 b2d2 f2f4 g7g6,2404,82,84,76,crushing defensiveMove hangingPiece master middlegame short,https://lichess.org/o14fddLS#49,
Vchxr,r2kr3/1b4Q1/p5R1/1p2pq2/4n1N1/P1P2P2/1P4P1/6K1 b - - 0 36,e4d6 g6d6 d8c8 g4f6 e8d8 d6d8,2420,79,83,289,crushing hangingPiece long middlegame,https://lichess.org/P5RtQJAo/black#72,
VdH27,q1rr2k1/1B2bppp/4pn2/1p6/1P3P2/P2pP1P1/1B2Q2P/2RR2K1 w - - 0 24,b7a8 d3e2 d1d8 e7d8,2480,84,82,48,advancedPawn advantage hangingPiece master middlegame short,https://lichess.org/NgGZLv0w#47,
VfQo6,r4rk1/pQp2nbp/3p4/6B1/4P3/3P2pP/PPP5/R5K1 w - - 0 20,a1f1 f7g5 b7d5 g8h8 f1f8 a8f8,2412,203,71,12,equality hangingPiece long middlegame,https://lichess.org/RRafSbcR#39,
VgNOq,8/1p6/2k2KP1/p6R/6r1/8/8/8 b - - 2 48,g4g6 f6g6 a5a4 g6f5 c6d5 f5f4 d5c4 f4e3,2441,96,89,1500,crushing defensiveMove discoveredAttack endgame exposedKing hangingPiece rookEndgame veryLong,https://lichess.org/SeD3zRPx/black#96,
Vi5ua,1r1qk1r1/2p3Qp/p2b1n1B/1p2n3/8/2N2B2/PPP2PPP/2KR3R w - - 3 18,f3c6 e5c6 h1e1 c6e5 f2f4 g8g7,2431,80,92,3598,advantage hangingPiece long middlegame trappedPiece,https://lichess.org/E0WQ68xt#35,Philidor_Defense Philidor_Defense_Other_variations
VjtQF,5rk1/pp2bppp/4p3/q2pB1P1/3PbQ2/P6P/1Pr2P2/R2K1BR1 b - - 3 17,e4f3 d1c2 f8c8 c2b3,2443,87,83,439,advantage defensiveMove hangingPiece middlegame short,https://lichess.org/NkbFIdoU/black#34,Caro-Kann_Defense Caro-Kann_Defense_Other_variations
Vkh0m,1k6/ppR5/5p2/3r4/2P5/1P3K2/5P2/8 w - - 0 35,c4d5 b8c7 f3e4 c7d6 b3b4 a7a6 e4f5 b7b6,2427,94,75,26,crushing defensiveMove endgame hangingPiece quietMove veryLong,https://lichess.org/hI7F4l8w#69,
VrkQN,3rk3/7R/3Pp3/4B3/6P1/5B1P/3p3K/2r5 w - - 1 62,f3c6 c1c6 d6d7 e8f8,2407,82,83,65,crushing endgame hangingPiece short,https://lichess.org/S1VDWmx9#123,
Vtg8I,6r1/2q2k1p/p4p2/2pP4/5bb1/4QN2/P4PPP/2R1N1K1 w - - 1 27,e3b3 f4c1 d5d6 c5c4,2483,83,67,48,advantage hangingPiece middlegame short,https://lichess.org/Afyzuh90#53,
VuJ6l,8/5ppk/p5qp/1pQ5/2p5/P1P1PBP1/1P1r1PP1/1R4K1 w - - 1 32,c5e5 g6b1 g1h2 g7g6,2464,78,72,84,advantage defensiveMove endgame hangingPiece short,https://lichess.org/7F0Xw03g#63,
VuuYB,2r2rk1/P4ppp/8/8/3P4/1Qp2KP1/3n1P1P/R6R w - - 1 29,f3g2 d2b3 a1a3 b3d4 a7a8q c8a8,2465,79,84,75,crushing endgame hangingPiece long,https://lichess.org/hRZYMIsW#57,
Vw33g,r3Bk1r/2R1bppp/bp2p3/q3B3/8/8/PP2QPPP/3R2K1 w - - 1 19,e5g7 f8g7 e2g4 a5g5 g4g5 e7g5,2445,92,90,945,advantage hangingPiece long middlegame,https://lichess.org/9oSb6Kfx#37,Sicilian_Defense Sicilian_Defense_Smith-Morra_Gambit_Accepted
Vw375,Qn4k1/3q3p/6p1/5pP1/5P1P/Pb1p4/5NB1/b5K1 b - - 1 34,d3d2 a8b8 g8g7 b8b3 a1d4 g2f3,2456,78,64,106,advantage defensiveMove fork hangingPiece long master middlegame,https://lichess.org/ClWKiOCq/black#68,
VwQnf,3r4/8/8/P7/3p4/1P1K4/6kp/7R w - - 1 55,h1h2 g2h2 a5a6 h2g3 b3b4 g3f4 b4b5 f4e5,2407,82,90,274,crushing defensiveMove endgame hangingPiece rookEndgame veryLong,https://lichess.org/feVulDu4#109,
VwlgR,1r4k1/5ppp/q7/3P4/4Q3/7P/pr3PP1/R4RK1 b - - 0 37,a6f1 a1f1 b2b1 e4a4 a2a1r a4a1 b1a1 f1a1,2429,188,100,19,endgame equality hangingPiece veryLong xRayAttack,https://lichess.org/7ueRejjT/black#74,
VyGqk,6r1/p2q1pk1/1pp5/4p2Q/2B1P2N/2N5/PPP4K/6r1 b - - 2 30,d7d2 h2g1 d2e1 g1h2,2468,87,84,237,crushing defensiveMove hangingPiece middlegame short,https://lichess.org/B4pn1LQr/black#60,
VySRf,6r1/5pk1/1p1qp1p1/1P1p2QB/r2P3P/8/Pn2RPP1/R5K1 b - - 2 31,a4d4 e2b2 g8h8 h5f3 d4h4 g2g3,2491,78,91,1167,advantage hangingPiece long middlegame pin,https://lichess.org/mxuKIC1g/black#62,
VzzgV,r2r2k1/ppp1b2p/5npB/4n3/4PP2/2P5/PPKN3P/R4BR1 b - - 0 18,d8d2 c2d2 e5f3 d2c2 f3g1 f1c4 g8h8 a1g1,2484,90,85,444,advantage discoveredAttack hangingPiece middlegame veryLong,https://lichess.org/VKZt4fvq/black#36,Englund_Gambit_Complex Englund_Gambit_Complex_Hartlaub-Charlick_Gambit
W00XV,3q1rk1/pp3pp1/2rbp2p/3p4/2PPb3/PP6/1B2BPPP/2RQ1RK1 b - - 0 15,e4g2 g1g2 d8g5 g2h3,2405,84,84,418,advantage defensiveMove hangingPiece middlegame short,https://lichess.org/e7nQ2aCv/black#30,Queens_Pawn_Game Queens_Pawn_Game_Colle_System
W0GLv,2r3k1/3Q1pb1/4p1p1/B2pPnNp/5P1P/P7/1q4P1/5RK1 b - - 2 25,f5e3 d7c8 g7f8 f1f2 b2a1 g1h2 e3g4 h2g3 a1a3 c8c3,2418,80,92,2314,advantage hangingPiece middlegame pin veryLong,https://lichess.org/s2f3kkP5/black#50,
W0qw2,5r1k/1q3p2/1p2pP2/p3P1pP/3p1P2/3Pn2Q/r2B3R/3R2K1 w - - 0 33,f4g5 e3d1 g5g6 f8c8,2469,85,75,102,crushing defensiveMove hangingPiece middlegame short,https://lichess.org/Fhqm89sd#65,
W2FIb,r7/1b3kpQ/p1q2r1p/1p1p4/5n2/P1PB4/1B3RPP/4R2K w - - 0 26,f2f4 f6f4 d3e2 c6g6 h7g6 f7g6,2400,77,57,72,crushing hangingPiece long middlegame,https://lichess.org/84MwiU2V#51,
W2MAA,r3q3/ppp3k1/3p1nn1/4p1N1/3PP3/2P3PQ/PP6/5RK1 w - - 2 21,f1f6 g7f6 h3f5 f6e7 f5e6 e7f8,2426,109,90,447,advantage endgame hangingPiece long,https://lichess.org/ION88OJv#41,
W2baF,4rr1k/1b4pp/p1p5/1p6/6Nq/2Q1Pp1P/PP2BP2/3R1RK1 w - - 0 26,e2f3 f8f3 d1d7 f3g3 f2g3 h4g3 g1h1 g3h3 g4h2 h3d7,2410,78,83,204,crushing fork hangingPiece middlegame veryLong,https://lichess.org/79piVAoV#51,
W36RZ,5r1k/pp4pp/3p4/3BPp2/2Q5/6N1/P6q/2R2K2 w - - 0 29,g3f5 f8f5 f1e1 h2g1 e1d2 f5f2 d2c3 g1c1,2414,79,83,217,crushing deflection endgame exposedKing hangingPiece veryLong,https://lichess.org/hyzUBGOf#57,
W6ffg,r2q1Rk1/pbp3pp/2pb4/3nN3/3P4/1Q6/PPP3PP/R1B3K1 b - - 0 14,g8f8 b3b7 d6e5 d4e5,2430,78,86,231,advantage hangingPiece middlegame short,https://lichess.org/hWM3swkU/black#28,Italian_Game Italian_Game_Rousseau_Gambit
W6iCL,r2q1rk1/pb1n1ppp/1pn1p3/3pP3/3P4/3BQN2/PP1N1PPP/R4RK1 w - - 3 13,d3h7 g8h7 f3g5 h7g8 f2f4 f8e8,2493,83,52,106,advantage defensiveMove hangingPiece long middlegame,https://lichess.org/qW41C80U#25,English_Defense English_Defense_Other_variations
W9mao,r6r/1b1n2k1/3B2p1/ppP1pq2/2BQN3/1P2P3/P4P2/R3K1R1 w Q - 2 27,g1g6 g7g6 d6e5 f5e5,2434,105,90,1142,advantage hangingPiece master middlegame short,https://lichess.org/wEjlKwiu#53,
WB7Pg,rn1qk2r/ppp2ppp/8/2bp4/4n1b1/1BP2N2/P4PPP/RNBQR1K1 w kq - 1 10,e1e4 d5e4 b3f7 e8f7 f3e5 f7e8,2481,107,90,662,crushing defensiveMove hangingPiece long opening,https://lichess.org/7879yrEH#19,Russian_Game Russian_Game_Modern_Attack
WFgkC,r4rk1/4bpp1/2b4p/3ppP2/8/P1P1BNqP/P5P1/R2QR2K w - - 0 26,f3e5 g3e5 e3c5 e5e1 d1e1 e7c5,2486,79,83,183,crushing hangingPiece long middlegame,https://lichess.org/L7daj1oo#51,
WGRwN,3r3k/pp4q1/2pp2n1/1P2p1Q1/P1P1P2p/2N4P/2P2r2/3RR2K b - - 1 31,h8h7 g5d8 g7f7 d8g5 f7f3 h1g1 g6f4 g5h4 h7g7 h4g4 f3g4 h3g4,2406,89,90,488,crushing exposedKing hangingPiece middlegame veryLong,https://lichess.org/Yyy8GtTt/black#62,
WGYXA,3qr1k1/p3bp1p/4p1pB/8/3r4/3n4/P2RQPPP/5RK1 b - - 1 24,d3f2 e2f2 e7f6 f2f6 d8f6 f1f6 d4d2 h6d2,2405,77,95,522,advantage hangingPiece middlegame veryLong,https://lichess.org/ekFugoxb/black#48,
WGvYA,3r2k1/3n1p1p/6p1/3Q4/2nP2P1/P3PK1P/1P5N/5N1r b - - 0 24,h1f1 h2f1 d7e5 f3e4 d8d5 e4d5,2401,79,92,904,advantage endgame hangingPiece long,https://lichess.org/RWMA03Hb/black#48,
WJyoQ,8/8/7p/P1n1kp1P/2P3p1/4K3/3N2P1/8 w - - 1 48,d2b3 c5b3 a5a6 b3a5 a6a7 a5c4 e3f2 c4b6,2489,81,83,184,crushing defensiveMove endgame exposedKing hangingPiece knightEndgame veryLong,https://lichess.org/VO9C8hHQ#95,
WK0Nb,2rqk1nr/1b3pbp/3p2p1/1p1Bp3/3nP3/1Q3N2/PP3PPP/RNB1K2R w KQk - 6 15,f3d4 c8c1 e1e2 c1h1 b3b5 d8d7,2491,88,89,1389,advantage hangingPiece long middlegame skewer,https://lichess.org/xCanB6B6#29,Ponziani_Opening Ponziani_Opening_Other_variations
WMg02,r2r2k1/p5p1/2p2p2/4nP2/3qP3/Bb1RN1pP/4Q3/R4BK1 b - - 0 33,d4e4 d3b3 d8d2 f1g2 d2e2 g2e4,2487,106,90,374,advantage hangingPiece long middlegame,https://lichess.org/UABOLm6Y/black#66,
WjJy4,1r4k1/3n1ppp/3P4/2P5/1r3Q2/p6P/q4PP1/2RR2K1 w - - 1 31,f4b4 b8b4 c5c6 b4b8 c6d7 a2e6,2486,92,92,2329,advantage endgame hangingPiece long quietMove,https://lichess.org/F016Qzo3#61,
WkLuB,3r2k1/pb3pp1/1p2pq1p/8/3r2PP/P4P2/1PR1B3/1K2QR2 b - - 0 23,b7c6 c2c6 d4d2 c6c3,2410,87,65,49,advantage defensiveMove hangingPiece middlegame short,https://lichess.org/v7qPgqW0/black#46,
WlObA,7k/7p/3qr3/p1p2p1Q/3b1P2/3P4/7P/1R5K b - - 1 42,e6e8 h5e8 h8g7 b1b7 g7h6 e8g8 d6c6 g8g2,2456,106,89,660,advantage endgame hangingPiece veryLong,https://lichess.org/nEVfpcoG/black#84,
WlpTD,rnbq2k1/ppp2ppp/8/2bP4/2P1BP2/5N2/PP3nPP/R1BQ1K1R w - - 1 12,e4h7 g8h7 d1c2 g7g6 b2b4 c8f5 c2b3 f5d3,2428,101,90,1440,advantage hangingPiece opening veryLong,https://lichess.org/bgFUh13p#23,Kings_Gambit_Declined Kings_Gambit_Declined_Falkbeer_Countergambit
Wm1vd,r5r1/pppQ3p/5p1k/3P4/5N2/2N5/PPP2q1K/R5R1 w - - 3 23,g1g2 f2f4 h2h1 f4f3 d7h3 f3h3,2439,90,90,345,advantage hangingPiece long middlegame,https://lichess.org/gzOET9vL#45,
WmoI8,2b1r3/1p2P1kp/2p3p1/p3nq2/2P5/1P2Q1P1/P4PBP/1R1R2K1 w - - 1 26,d1d8 f5b1 g2f1 e8e7,2459,103,88,131,crushing hangingPiece middlegame short,https://lichess.org/VNUQyCKv#51,
WneuF,5R2/8/4n3/P1K5/8/4kp2/8/8 w - - 5 58,c5d6 e6f8 a5a6 f3f2 a6a7 f2f1q a7a8q f1f6 d6c7 f8e6,2485,103,90,941,advancedPawn crushing endgame hangingPiece promotion veryLong,https://lichess.org/JA5qu2OE#115,
WrXjs,r2q1rk1/2p2pp1/p2p2bp/1pbnP3/8/1Q3P1P/PPB2P2/RNB1R1K1 b - - 4 17,d5f4 c1f4 d8h4 f4e3 g6c2 b3c2 c5e3 e1e3,2471,100,90,807,advantage hangingPiece middlegame veryLong,https://lichess.org/B7dBF1x7/black#34,Ruy_Lopez Ruy_Lopez_Morphy_Defense
WsQ2d,7Q/p4kpR/3q1p2/1p3P2/3pr3/8/PPr3PP/5RK1 b - - 5 36,c2g2 g1g2 e4g4 g2h3 d6d5 f1f2,2452,105,90,567,crushing defensiveMove endgame hangingPiece long,https://lichess.org/WI1Z034X/black#72,
Wurqu,r5k1/p2Q1ppp/2nN2q1/8/8/8/Pr3PPP/R4RK1 b - - 3 20,b2d2 d7c6 a8d8 d6c8 g6c6 c8e7 g8f8 e7c6,2411,85,90,288,crushing fork hangingPiece middlegame sacrifice veryLong,https://lichess.org/t0TXxGzr/black#40,
WvORi,3b4/8/7p/3k4/2p2PKP/2P5/1P6/8 b - - 1 42,d8h4 g4h4 d5e4 h4g4 h6h5 g4h5 e4f4 h5g6,2481,80,86,334,crushing defensiveMove endgame hangingPiece veryLong zugzwang,https://lichess.org/z1egOUNW/black#84,
Ww8TE,2b2k2/4q2p/p2pnrp1/2pB4/2P4P/2Q3P1/8/R3R1K1 w - - 2 30,a1a6 c8a6 g3g4 e7g7 d5e6 f6f4 c3g7 f8g7,2469,95,77,31,advantage hangingPiece master middlegame quietMove veryLong,https://lichess.org/jo1yeaoT#59,
Wx7dY,rn2k2r/pBp2p2/1p1bp3/7p/3P2p1/2N3Pq/PPP2P2/R1BQ1RK1 w kq - 0 14,b7c6 b8c6 c3e4 d6e7 e4g5 e7g5,2490,97,75,300,crushing hangingPiece long middlegame quietMove,https://lichess.org/UjHMHAOj#27,French_Defense French_Defense_Knight_Variation
X08Hs,1r4k1/5pp1/3p1q1p/P2P4/2Q2P2/R4R1P/1r4PK/8 b - - 0 28,b2g2 h2g2 b8b2 g2h1,2481,86,84,136,crushing defensiveMove endgame hangingPiece short,https://lichess.org/mc496G9e/black#56,
X0rpo,3rrbk1/5ppp/pp3P2/3B4/1P2q3/P4R2/5RPP/3Q2K1 w - - 0 29,d5f7 g8f7 d1b3 e8e6 f6g7 f7g7,2494,79,81,254,advantage hangingPiece long middlegame,https://lichess.org/cbJF6hr8#57,
X1TRB,8/8/1p2k3/p2p2p1/P1pP1bPB/2P2K1P/8/8 b - - 0 39,g5h4 f3f4 b6b5 f4e3 b5a4 e3d2,2467,78,100,203,crushing defensiveMove endgame hangingPiece long,https://lichess.org/G4qCzfUe/black#78,
X2M1K,8/8/2p5/pPPQ2b1/P4p1k/6p1/6K1/8 w - - 0 56,b5b6 c6d5 b6b7 h4g4 b7b8q f4f3 g2f1 g3g2 f1f2 g5e3 f2e3 g2g1q,2429,81,88,80,advancedPawn attraction crushing deflection endgame exposedKing hangingPiece promotion veryLong,https://lichess.org/WfWfwR6O#111,
X3TMx,1r6/8/7P/1pRR4/1k6/1r6/P2p2PK/8 b - - 1 43,d2d1q d5d1 b4c5 a2b3 b8b6 g2g4,2470,87,91,363,advantage defensiveMove endgame hangingPiece long,https://lichess.org/9206sRdd/black#86,
X4G01,rnb2b1k/ppp4p/3p2p1/4p3/4P3/1QPPq2P/PP1N2P1/5R1K b - - 1 16,e3d2 f1f8 h8g7 b3g8 g7h6 f8f7 d2e1 h1h2,2469,79,83,114,advantage fork hangingPiece middlegame veryLong,https://lichess.org/SQjTFdmW/black#32,Pirc_Defense Pirc_Defense_Other_variations
X52Z5,r7/ppp1q2k/1bn1B1pp/8/1PP1b1Q1/3p4/PB4PP/5R1K b - - 0 22,a8d8 g4e4 b6d4 f1f7 d4g7 f7e7,2476,88,85,54,crushing fork hangingPiece long middlegame pin,https://lichess.org/Ey8BGvdJ/black#44,
X8fV3,r4rk1/pppqnp1p/6p1/4b1B1/3pN3/3Q4/PPP2PPP/R3K2R b KQ - 1 14,d7f5 g5e7 f8e8 e7a3 e5f4 f2f3,2440,81,92,207,advantage defensiveMove hangingPiece long middlegame quietMove,https://lichess.org/V8k7n59m/black#28,French_Defense French_Defense_Paulsen_Variation
XARbm,8/8/8/P7/1K6/6k1/3n1pB1/8 w - - 1 54,g2f1 d2f1 a5a6 f1d2 a6a7 f2f1q a7a8q f1c4 b4a5 c4a2,2423,79,60,71,advancedPawn clearance crushing endgame hangingPiece master promotion quietMove veryLong,https://lichess.org/1czNmit8#107,
XAS4g,r1r5/ppB3kp/3P2p1/2b5/4R3/3p4/PP3PPP/1R4K1 w - - 0 24,d6d7 c8c7 e4e8 c7d7 e8a8 d3d2 b1d1 d7e7 g1f1 c5b4 d1d2 b4d2,2401,83,87,217,advancedPawn advantage endgame hangingPiece quietMove veryLong,https://lichess.org/S8w1KioT#47,
XBQpb,rnbqk1nr/pppp1pQp/8/4P3/3bP3/8/PPPP2PP/RNB1KB1R b KQkq - 0 5,d8e7 g7h8 e7h4 e1d1 e8f8 c2c3,2447,78,91,1271,advantage hangingPiece long opening pin,https://lichess.org/pH40vrU1/black#10,Kings_Gambit_Declined Kings_Gambit_Declined_Classical_Variation
XBg3b,3r1k2/1B3p2/p1P4r/5Q1p/1P4p1/2q5/P3RPP1/4R1K1 w - - 1 37,e2c2 c3e1 g1h2 g4g3 h2g3 h5h4,2447,96,90,273,advantage attraction hangingPiece long middlegame,https://lichess.org/u5Kvx8BR#73,
XBjOf,rnb1k2r/ppp2ppp/4p3/8/1bPPn3/2N2NP1/PPK1Q2P/R1B2B1q b kq - 7 11,c8d7 c3e4 b8c6 c1e3 e6e5 e4f2,2487,92,70,42,advantage hangingPiece long middlegame quietMove,https://lichess.org/ekiYVJgB/black#22,French_Defense French_Defense_Diemer-Duhm_Gambit_Accepted
XBsbn,2r3k1/1Q2Rpp1/1p4qp/1P1pPp2/5P2/2p1Pn1P/2P2KP1/8 b - - 1 29,f3h4 b7c8 g8h7 g2g3 g6h5 g3g4,2442,89,89,417,advantage endgame hangingPiece long,https://lichess.org/xNaLb49m/black#58,
XCAM2,r5nr/pp4b1/5k1p/3BnN2/4P3/BPQ5/P1PP1qp1/RN1K2R1 w - - 8 19,c3e5 f6e5 d2d4 e5f6 g1g2 f2f1 d1d2 f1g2,2465,79,76,151,advantage fork hangingPiece middlegame veryLong,https://lichess.org/BsqbAsZq#37,
XCnuU,r5k1/pp1n1q1p/1n4pQ/1B2rb2/3N4/B1P5/P1P2PP1/R4K1R w - - 6 22,d4f3 e5b5 f3g5 f7g7 h6g7 g8g7 h1h7 g7g8,2405,80,85,87,advantage hangingPiece middlegame veryLong,https://lichess.org/T2GhwpDI#43,
XEQxT,Q5r1/2pnkp2/5q1b/2pPp2p/4Pp2/P1NB1P2/5BrP/1R2R2K w - - 3 26,a8b7 g2f2 d5d6 e7d6 b7c7 d6c7,2422,80,98,96,advantage hangingPiece long middlegame,https://lichess.org/hCm7V242#51,
XHDJO,2r1rk2/1p3p1Q/p2q1b2/8/1n1PB3/1PN1P1P1/PB5P/R5K1 w - - 1 25,b2a3 c8c3 a1f1 a6a5,2420,96,88,963,advantage defensiveMove hangingPiece middlegame short,https://lichess.org/COC5j86n#49,
XIdEw,2r2rk1/6b1/P5p1/4p1P1/1pq1P3/1n4B1/3p1PP1/RQ1K3R b - - 0 35,c4a6 a1a6 c8c1 d1e2 c1b1 h1b1 b3c5 a6c6 c5e4 b1b4 e4g3 f2g3 f8f2 e2d1,2469,81,74,60,advantage hangingPiece middlegame veryLong,https://lichess.org/aD98JZJ3/black#70,
XJCUc,8/7k/p1KN1Q1p/3P4/3N4/2q1P3/P1P3r1/8 w - - 2 36,d6c4 c3c4 c6d6 g2g6,2420,96,90,1688,advantage endgame hangingPiece master pin short,https://lichess.org/g7RdNWYy#71,
XJDIJ,8/4kpp1/4N1pr/pprpP3/6Pq/P3Q2P/3n1P1K/R3R3 b - - 2 32,f7e6 e3c5 e7e8 c5e3,2466,315,-20,12,defensiveMove equality hangingPiece middlegame short,https://lichess.org/CRiJ7iSJ/black#64,
XNDn1,1r6/4qpk1/b2pp1p1/2p5/Pp2P1Rr/1P1P3P/3QB1PK/5R2 w - - 5 30,f1f7 g7f7 d2f4 f7e8 g4h4 g6g5 h4h8 e8d7 h8b8 g5f4,2412,78,91,1002,crushing fork hangingPiece middlegame veryLong,https://lichess.org/xRbZEuvy#59,
XOOaW,2r2rk1/1p1n1p1p/3p1np1/PB1Pq1B1/4P3/8/6PP/2RQ1RK1 w - - 1 27,d1f3 e5g5 c1c8 f8c8 b5d7 c8c1,2498,100,90,349,crushing hangingPiece long middlegame,https://lichess.org/2eInFjG6#53,
XPcaN,5r2/P6p/4pkp1/3p1n2/Q2P1P2/3Pq2P/6P1/2N2RK1 w - - 3 34,f1f2 e3c1 g1h2 f8a8,2498,103,90,929,advantage endgame hangingPiece short,https://lichess.org/3kvjIXKY#67,
XQkaZ,r3r1k1/p1p1P1p1/3q3p/2p2R2/2ppQ3/3P2P1/PP4KP/5R2 w - - 1 27,e4a8 e8a8 f5f8 g8h7 f8a8 d6e7,2408,77,90,507,crushing endgame hangingPiece long,https://lichess.org/hHSxEUUH#53,
XSYcx,2r5/3Qq1kp/6p1/4Pr2/2p5/4R3/P6P/3R2K1 b - - 1 34,f5f7 d7c8 e7a7 c8h3,2427,77,94,744,advantage endgame hangingPiece short,https://lichess.org/eW1fjbuN/black#68,
XSZ3y,r1b2nk1/p6p/1p3bpP/3B1pN1/3P1P2/8/PPPK2P1/3Rr3 b - - 0 23,g8h8 d1e1 f6g5 f4g5 c8b7 d5b7,2485,83,90,191,crushing hangingPiece long middlegame,https://lichess.org/7QSxv2fH/black#46,
XV3so,r2qkb1r/ppp2ppp/2np4/8/2B3b1/2P2N2/PPP2PPP/R1BQK2R w KQkq - 2 8,c4f7 e8f7 d1d5 f7e8,2401,78,91,1601,advantage defensiveMove hangingPiece opening short,https://lichess.org/s8ifNaJR#15,Alekhine_Defense Alekhine_Defense_Mokele_Mbembe
XYXVr,2r4k/6pp/p2Q4/8/4Pr2/1P1P2qP/P1P5/4RR1K w - - 0 33,f1f4 g3e1 h1g2 c8c2 g2f3 e1e2 f3g3 e2g2 g3h4 g7g5 h4h5 g2h3 h5g5 c2g2 g5f6 g2g6 f6e7 g6d6,2499,143,76,51,crushing deflection endgame exposedKing fork hangingPiece skewer veryLong,https://lichess.org/sg0ZsHri#65,
XZA4X,1r4k1/p4p2/2p1b3/2b1p3/4P1p1/1P1RN3/P1PN1PP1/2K5 w - - 4 23,e3g4 e6g4 d3g3 c5a3 c1b1 b8d8,2474,98,84,260,advantage endgame hangingPiece long master,https://lichess.org/1xU3SQm1#45,
XZD9K,r2k2nr/3nb1pp/p3Q3/q2pP1B1/1ppP4/2N4P/PPP1B1P1/2KR1R2 w - - 2 19,f1f8 d7f8 e6d6 f8d7 g5e7 g8e7 e5e6 a8a7,2467,96,90,411,advantage defensiveMove hangingPiece middlegame veryLong,https://lichess.org/CmNXsMpS#37,Caro-Kann_Defense Caro-Kann_Defense_Campomanes_Attack
XaJwR,r3q2k/6pp/bp6/p3B3/8/8/PP2QPPP/3R1K1R w - - 1 22,e5g7 h8g7 d1d3 a8d8 e2e8 d8e8,2483,101,90,978,advantage hangingPiece long middlegame pin,https://lichess.org/rme4lDyO#43,
Xax2X,4r1k1/pp3p1p/2p1N1pq/7n/3r4/3B1P1R/PP2QP1P/6RK w - - 1 26,e2e5 d4d3 h3h5 e8e6,2407,77,86,347,advantage hangingPiece middlegame short,https://lichess.org/3nDWIoeY#51,
Xd3WR,r3r1k1/2p2ppp/2P5/Pp1p4/1p1QB3/5P1q/1P3P2/RN3RK1 w - - 0 25,e4h7 h3h7 b1d2 e8e6 f1e1 e6g6,2483,83,82,104,advantage hangingPiece long middlegame,https://lichess.org/W9vDHUlB#49,
XfsWQ,r5k1/3p3p/3Pppp1/3n1q2/1R2Q3/1P3P2/P4P1P/5R1K b - - 2 32,d5b4 e4a8 g8g7 a8e4,2438,78,90,969,advantage endgame hangingPiece short,https://lichess.org/GDMKbnOG/black#64,
XiArl,7r/Rp3pp1/2kNp1q1/3nPnb1/3P4/1P4P1/5PQP/5RK1 w - - 0 28,f1c1 g5c1 g2f1 f5d6 f1c1 c6d7,2463,76,90,304,advantage defensiveMove hangingPiece long middlegame,https://lichess.org/Fc5xfP1f#55,
Xlvrl,1k1n2r1/p1p1b3/Pp5p/1BqPQpr1/4p3/2N5/1PP3PP/3R2RK b - - 10 26,c5f2 e5e7 g5g2 e7d8 g8d8 g1g2,2400,86,88,1015,crushing deflection hangingPiece long middlegame,https://lichess.org/S8GsE7Vj/black#52,
XomrN,1r3r1k/6p1/p1n1B2p/3p2Nn/2p1NP1P/q1P1P3/P1Q2P2/3K2RR w - - 1 24,e4f6 h5f6 c2g6 a3a2 g5f7 f8f7,2417,79,82,130,crushing hangingPiece long middlegame,https://lichess.org/OuZK3Pdz#47,
