PuzzleId,FEN,Moves,Rating,RatingDeviation,Popularity,NbPlays,Themes,GameUrl,OpeningTags
jitNn,1r4k1/1b3p1p/p5p1/1pp5/3b1Q2/P6P/1P4P1/R1B1qN1K b - - 4 27,e1e2 f4b8 g8g7 c1h6 g7h6 b8b7 e2b2 a1d1,2424,83,90,633,advantage fork hangingPiece middlegame veryLong,https://lichess.org/5RXDBHw4/black#54,
jkfb3,8/4p3/4Ppp1/3B4/8/1pk5/4KPP1/8 w - - 0 47,d5b3 c3b3 e2d3 b3b4 d3d4 b4b5 d4d5 b5b6 f2f3 b6b5,2463,95,89,842,crushing defensiveMove endgame hangingPiece veryLong,https://lichess.org/c6QAr0Rr#93,
jlVyQ,r1bq1rk1/p1p1bppp/1pnp1n2/6B1/2BPP3/2N2N2/P4PPP/1R1Q1RK1 b - - 1 11,f6e4 c3e4 d6d5 c4b5 d5e4 b5c6 e7g5 f3g5,2457,100,90,1077,advantage hangingPiece opening veryLong,https://lichess.org/WL9tlbFt/black#22,Italian_Game Italian_Game_Evans_Gambit
jlWRC,r1b1kb1r/pppp1ppp/8/8/1q1Pn3/8/PP1BQPPP/RN2KB1R b KQkq - 2 9,b4b2 e2e4 e8d8 f1c4,2417,90,72,71,advantage hangingPiece opening short,https://lichess.org/hrOHZyX3/black#18,Russian_Game Russian_Game_Other_variations
jmVqn,r2q3k/pR4pB/2Pp4/2n5/2P2rb1/5N2/P1Q3PP/5R1K w - - 1 20,b7g7 h8g7 c2g6 g7h8 h7g8 d8h4,2431,96,51,29,advantage hangingPiece long middlegame,https://lichess.org/aNmrbJJp#39,
jnZ27,8/4qpk1/Q2p2pp/2pPn3/1r1nN1N1/6PP/5PK1/4R3 b - - 11 31,e5d3 a6d3 f7f5 d3d2 f5g4 e4c5,2440,85,91,652,advantage hangingPiece long middlegame,https://lichess.org/y1EdBZo8/black#62,
jqLOg,5k2/5pbp/pq2p1p1/1p1N3n/1P6/Pn1BP2P/5PPQ/2rR2K1 w - - 0 21,d5b6 c1d1 d3f1 e6e5 g2g4 b3d2,2467,89,78,38,advantage fork hangingPiece long middlegame quietMove,https://lichess.org/hRTAPrUm#41,
jrEWj,8/3r4/2PP1R2/8/p1K5/p7/5p2/5k2 b - - 0 56,a3a2 c6d7 a2a1q d7d8q a4a3 d8h8,2426,95,90,1044,advancedPawn crushing defensiveMove endgame hangingPiece long promotion rookEndgame,https://lichess.org/k6xx4LrT/black#112,
js6eq,3rQr1k/3P2pn/p5p1/8/2p5/2P3qP/1P4P1/3RR2K w - - 0 32,e8f8 h7f8 e1e8 g3b8,2473,81,71,104,crushing endgame hangingPiece short,https://lichess.org/UdR8EzHt#63,
jv4LL,3r4/p7/2p1rpk1/5Q1p/q1p4P/3p4/5RK1/8 b - - 2 42,g6g7 f5e6 d8f8 g2h3,2432,132,90,33,defensiveMove endgame equality hangingPiece short,https://lichess.org/mOHioLNm/black#84,
jvFhJ,1k3rnr/ppR5/2n5/1N1pP2p/3P2b1/3B1N2/Pq5P/2RQK3 w - - 1 18,c7b7 b8b7 c1b1 g4f3 b1b2 f3d1 b5d6 b7a8,2403,84,83,911,advantage hangingPiece middlegame veryLong,https://lichess.org/lTiH2oej#35,Nimzowitsch_Defense Nimzowitsch_Defense_Other_variations
jvabM,4r1k1/1R4p1/P4p2/2p3r1/2P4Q/3P1qP1/5P1P/5RK1 w - - 0 36,a6a7 f3b7 f2f4 g5g6 h4h5 b7f7,2412,92,90,1122,advantage endgame hangingPiece long,https://lichess.org/KV0TG6tM#71,
jvmds,2kr3r/1p6/pP5b/3b3n/2pPp3/B1P1P2R/1Q1NNq2/2K3R1 w - - 1 30,h3h5 f2e2 g1h1 e2e3,2402,80,95,884,crushing hangingPiece master middlegame short,https://lichess.org/vPqQo3nI#59,
jxZKp,2kr4/p5bp/3N2p1/2P5/1P2p3/3p2P1/P4K1P/2R5 b - - 1 28,d8d6 c5d6 c8d8 c1c4,2493,96,90,1583,crushing discoveredAttack endgame hangingPiece master masterVsMaster short,https://lichess.org/tfdD19Xx/black#56,
jz4qp,b7/K7/P5p1/N7/5pkP/8/8/8 b - - 1 51,f4f3 a7a8 f3f2 a5c4 g4f3 c4d2 f3e2 d2e4,2478,76,93,1091,crushing endgame hangingPiece master quietMove veryLong,https://lichess.org/GQfP2Z5H/black#102,
k1EcU,8/2r4p/4p1pP/1k1pPpP1/1p1P4/r1PR1R2/PK6/8 b - - 2 46,b4c3 b2a3 c3c2 d3b3,2424,98,100,59,endgame equality hangingPiece rookEndgame short,https://lichess.org/G16A9p8S/black#92,
k23pL,2kr2r1/p1pq1p2/Ppnbp3/1B1n3p/3P1P1B/1QN1P3/1P3P1K/R4R2 b - - 0 20,e6e5 b3d5 d7g4 h4g3 e5f4 h2g2,2435,106,84,53,crushing defensiveMove hangingPiece long middlegame quietMove,https://lichess.org/3sDGNnOU/black#40,
k3R6h,6k1/4B1p1/p1p1p1Bp/1p2r2n/7P/P1Pr1P1K/P3R1P1/R7 b - - 0 38,e5e2 g6h5 d3d7 e7b4 c6c5 b4a5,2404,80,83,74,advantage defensiveMove endgame hangingPiece long quietMove,https://lichess.org/KoItmBAy/black#76,
k3c3s,8/1p5p/p7/P3k1p1/5N2/5bP1/1P3K1P/8 b - - 1 39,g5f4 f2f3 f4g3 f3g3 e5f5 g3h4,2470,90,83,82,crushing defensiveMove endgame hangingPiece long master masterVsMaster,https://lichess.org/GORQ0tgm/black#78,
k6Al3,3R4/4k3/4p3/4P3/3P1Kp1/6P1/8/3b4 w - - 1 53,d4d5 e7d8 d5d6 d8e8 f4g5 e8f7,2407,80,89,348,crushing defensiveMove endgame hangingPiece long,https://lichess.org/6XvLY8Ei#105,
k7P8l,2r1r1k1/p4ppp/1bp3q1/3p1b2/Q2P4/2P2NBP/PP4P1/R3R2K w - - 6 23,f3h4 g6g3 e1e8 c8e8 a4c6 e8e1 a1e1 g3e1 h1h2 g7g6 h4f5 g6f5,2452,84,91,911,advantage fork hangingPiece middlegame quietMove veryLong,https://lichess.org/yuXYDHhX#45,
k7qpl,r5k1/pQp2pb1/2n2qpp/4p3/6P1/2PrPN1P/3N1P2/2KR3R b - - 0 17,e5e4 b7a8 g8h7 d2e4 f6f3 a8c6 d3c3 c6c3 g7c3 e4c3,2454,78,100,91,advantage hangingPiece middlegame veryLong,https://lichess.org/xeL0sHyt/black#34,Indian_Defense Indian_Defense_Other_variations
k7wAm,r1bqkb1r/1pp3pp/p1np1p1n/4p1N1/2B1P3/3P1Q2/PPP2PPP/RNB1K2R w KQkq - 0 7,g5h7 h8h7 f3h5 e8d7,2441,103,89,943,advantage defensiveMove hangingPiece opening short,https://lichess.org/sdZcTFFj#13,Philidor_Defense Philidor_Defense_Other_variations
k8HRR,4q1rk/1p1R4/p1p5/8/5PQp/P1P1P1b1/1P6/5RK1 w - - 3 42,g4f3 e8d7 f3h5 h8g7,2453,76,94,1008,crushing endgame hangingPiece short,https://lichess.org/nbneVhiV#83,
k8WdE,1k6/2p1qb2/Qb3p2/2p1p1p1/2P1P1P1/1KN5/1P3r2/R7 b - - 1 34,f7c4 b3c4 e7e6 c3d5 e6c6 a1h1,2411,77,90,351,crushing defensiveMove hangingPiece long middlegame,https://lichess.org/YHes8Ec3/black#68,
k8pBW,r1b2rk1/5ppp/1q3n2/1ppPN3/8/1P6/P1K3BN/R2Q3R b - - 0 25,f6d5 g2d5 c8f5 c2b2 c5c4 h2g4,2474,135,80,33,advantage defensiveMove hangingPiece long middlegame,https://lichess.org/7kiHcik5/black#50,
k9bAH,R7/4n1kp/2bQppp1/1q6/8/7P/1P3PP1/6K1 b - - 0 31,b5d5 d6e7 g7h6 e7f8 h6g5 f2f4 g5f5 g2g4 f5e4 f8b4,2459,84,90,506,crushing endgame hangingPiece veryLong,https://lichess.org/9iylJrXh/black#62,
k9xsp,r1b2rk1/pp1pbpp1/5n1p/2p5/QqB1P2B/1P6/P1PN1PPP/R3K2R w KQ - 3 12,e1g1 b4d2 e4e5 f6d5 f1d1 d2b4,2441,93,89,1120,advantage hangingPiece long middlegame quietMove,https://lichess.org/Udc5JNVc#23,Scotch_Game Scotch_Game_Other_variations
kDoav,rnQ5/pp3qkp/5p2/8/5P2/6P1/PP5P/2R2K2 b - - 9 28,b8a6 c8a8 f7d5 a8a7 d5h1 a7g1,2422,77,93,1734,crushing endgame hangingPiece long master,https://lichess.org/F9DnyiWY/black#56,
kFCem,r1bqr1k1/pp3ppp/2n1p3/3n4/1b1P3P/2NB1N2/PP1B1PP1/R2QK2R w KQ - 1 11,d3h7 g8h7 f3g5 h7g8 d1h5 d8f6,2422,93,89,1187,advantage hangingPiece long master opening,https://lichess.org/eoWhKrjR#21,Sicilian_Defense Sicilian_Defense_Morphy_Gambit
kG5zy,1bk2r1r/1p6/1Bp5/Q5p1/4q3/P5Pp/1P1R3P/2R3K1 b - - 1 34,b8g3 h2g3 h3h2 d2h2 h8h2 a5a8 c8d7 a8b7,2468,80,64,47,crushing deflection hangingPiece master middlegame veryLong,https://lichess.org/6iBNC0fA/black#68,
kIAG6,8/8/5k1p/3p2pP/1b2ppP1/5P2/2N1K3/8 b - - 7 47,f6e5 c2b4 e5d6 f3e4 d5e4 e2d2 d6c5 d2c3 f4f3 b4c2 f3f2 c2e3,2449,86,62,62,crushing defensiveMove endgame hangingPiece quietMove veryLong zugzwang,https://lichess.org/lxVrT34i/black#94,
kIGbk,1Rq3k1/p4p1p/3B1Qp1/4pP2/3Pb2P/7K/P3p1r1/8 b - - 2 36,e4f5 h3g2 c8b8 d6b8 e2e1q f6d8 g8g7 b8e5 e1e5 d4e5,2425,88,88,836,crushing endgame hangingPiece master pin veryLong,https://lichess.org/YVFq3Ub7/black#72,
kJWev,5r1k/ppp3pp/2P1n3/1Pb1p2q/2Q1P1n1/5NP1/PB1R1PK1/5R2 b - - 0 22,f8f3 c4e6 f3f8 f1h1 g4e3 f2e3 h5f3 g2h2,2478,79,93,1268,crushing defensiveMove hangingPiece master masterVsMaster middlegame veryLong,https://lichess.org/AvHW36JT/black#44,
kJXZw,5r2/Rp1k1b2/3p1Qp1/4p3/6P1/1N3P2/Pr2q3/K6R b - - 0 33,e2b5 a1b2 f7b3 f6f8,2479,86,84,153,crushing hangingPiece middlegame short,https://lichess.org/M9zyEwLP/black#66,
kJcgp,rnQ2k1r/ppp1q2p/3p1n1b/3P4/4Pp1P/8/PPP3P1/RNB2RK1 b - - 6 14,f8f7 c8h8 e7d7 f1f4 h6f4 c1f4,2430,80,88,429,advantage hangingPiece long middlegame,https://lichess.org/iETZjMzR/black#28,Kings_Gambit_Accepted Kings_Gambit_Accepted_Kieseritzky_Gambit
kLJYM,r4n1k/pp5p/2p1Pn2/7q/8/2Q5/PPP2PP1/4R1K1 b - - 2 27,a8e8 c3f6 h8g8 e1e3 h5d1 g1h2,2410,145,46,22,advantage endgame hangingPiece long quietMove,https://lichess.org/0CKIBY7K/black#54,
kM30b,rnb2rk1/p1p1bppp/1p2p3/3qP3/3P3P/3B1N2/PP3PP1/R1BQK2R w KQ - 0 11,d3h7 g8h7 f3g5 h7g8 d1h5 e7b4,2457,88,84,406,advantage hangingPiece long opening,https://lichess.org/OEhwIMHi#21,Queens_Gambit_Declined Queens_Gambit_Declined_Exchange_Variation
kPHhW,r5k1/r6p/3p1qn1/3Pn3/1p1N1p2/1P3P1R/P2Q4/1K3B1R b - - 2 27,e5f3 d4f3 a7a2 d2a2 f6f5 a2c2 a8a1 b1a1 f5c2 f1c4,2417,78,84,117,advantage defensiveMove hangingPiece middlegame veryLong,https://lichess.org/mzE81Z3j/black#54,
kQXHm,4r2k/ppRR3p/5pb1/3p4/q7/B7/1K4PP/2N5 b - - 3 33,e8e2 c1e2 a4b5 b2c1 b5e2 c7c8 g6e8 d7e7,2499,90,93,89,advantage hangingPiece middlegame veryLong,https://lichess.org/XUhK95as/black#66,
kSO21,rn1q1rk1/p1p2p1p/1p2pp2/8/1b4Q1/1P1b4/PBPN1PPP/R4RK1 b - - 1 12,g8h8 g4b4 b8c6 b4h4,2470,100,90,1173,crushing hangingPiece middlegame short,https://lichess.org/0Df6BW8f/black#24,French_Defense French_Defense_Kings_Indian_Attack
kSknx,4r1k1/3R2p1/p7/1p3B1p/3Bp1K1/1P3r2/1PP5/8 w - - 0 32,g4h5 f3f5 h5g6 f5f7 d7f7 e8e6 g6f5 g8f7,2438,100,90,901,crushing deflection endgame hangingPiece sacrifice veryLong,https://lichess.org/iCJCfMAg#63,
kU1os,8/8/b2p1p2/3P2p1/2p1Pp1p/1pK2P1P/6k1/R7 b - - 1 62,g2h3 a1a6 g5g4 a6d6,2452,78,91,179,advantage endgame hangingPiece master masterVsMaster short,https://lichess.org/gn85TyeP/black#124,
kUqcr,4r1k1/bpqn1pp1/p4n1p/3p1N2/3Nr3/2P1B2P/PP1Q1PP1/R3R1K1 w - - 6 19,f5g7 g8g7 d4f5 g7g6,2428,79,74,152,advantage hangingPiece middlegame short,https://lichess.org/jWiFMd9b#37,French_Defense French_Defense_Tarrasch_Variation
kUw8f,r3nrk1/p1p1bppp/3p4/2B1P3/6q1/3Q1N2/PPP2PPP/3RK2R w K - 1 17,e1g1 d6c5 d3d7 g4e6 d7e6 f7e6,2437,89,90,768,advantage hangingPiece long middlegame,https://lichess.org/WkRhprkg#33,Four_Knights_Game Four_Knights_Game_Spanish_Variation
kWxHC,3n4/p5k1/1p1P2Bp/1P2K2P/8/3r4/8/8 b - - 0 53,a7a5 g6d3 g7f8 e5f6 f8e8 d3f5 d8b7 d6d7,2467,84,90,383,advancedPawn crushing endgame hangingPiece quietMove veryLong,https://lichess.org/gtHYThXR/black#106,
kaD6l,3r1k2/3r4/1p3Q2/pP1p2p1/3Rp3/1BP1q2P/1P4PK/8 b - - 0 39,d7f7 f6d8 f8g7 d4d1,2439,83,85,59,crushing endgame hangingPiece short,https://lichess.org/kjvb4M8y/black#78,
kcIp4,6k1/7p/1b2p1p1/P3P3/1p1r4/1B1p1P2/P2K4/8 b - - 0 49,d4f4 a5b6 f4f8 b3e6 g8g7 b6b7,2478,77,67,121,advancedPawn crushing endgame hangingPiece long,https://lichess.org/AVQZN2d8/black#98,
kct7z,2Q2b2/5k1p/3r2p1/P3p3/P2qPp2/7n/3B1R2/2Q3K1 w - - 1 38,g1h1 h3f2 h1g2 d4d2 c1d2 d6d2,2464,80,90,269,crushing hangingPiece long middlegame,https://lichess.org/MOJnCcpr#75,
kd9cH,2r3k1/5ppp/1q3P2/pNb1p3/r1P3Q1/7P/6P1/5R1K b - - 0 27,g7g6 g4c8 c5f8 b5c3 a4b4 c3d5 b6b8 d5e7 g8h8 f1d1,2496,85,86,72,advantage defensiveMove fork hangingPiece middlegame veryLong,https://lichess.org/4rTkOOvV/black#54,
kdzrx,2r1r1k1/pq3p1p/6p1/2RpP3/Q4P2/P5P1/7P/2R3K1 b - - 0 30,c8c5 a4e8 g8g7 c1c5 b7b1 g1f2,2475,82,74,61,crushing defensiveMove endgame hangingPiece intermezzo long,https://lichess.org/nkchrPsw/black#60,
kegvB,2r4r/pp1q1n1k/3p1P1p/2B2Pp1/5n2/5N1P/PPQ3P1/3R1RK1 w - - 1 27,c2b3 c8c5 f1e1 c5b5,2496,88,68,169,advantage hangingPiece middlegame short,https://lichess.org/o1iodoHs#53,
kg8SC,3r2k1/p4pb1/6pp/1P6/P4Q2/3pR2P/3B1PP1/3q2K1 w - - 0 32,g1h2 d1d2 e3e8 d8e8 f4d2 e8d8,2470,85,90,598,crushing defensiveMove endgame hangingPiece long,https://lichess.org/IVTKHTNe#63,
kgNiV,rn3bk1/3r1ppp/1p4q1/1Np3N1/PnQ5/5R1P/1B1P1PP1/4R1K1 w - - 7 26,g5h7 g6h7 b2g7 h7g7,2412,96,96,59,equality hangingPiece middlegame short,https://lichess.org/HtRvdaH0#51,
kh1nf,6R1/7K/2r5/8/4kB2/6P1/8/8 w - - 21 63,g3g4 e4f4 g4g5 f4g4,2488,127,100,45,endgame equality hangingPiece short,https://lichess.org/dsP0I7SF#125,
kiePD,r7/pp2R1pk/2p2q1p/5Pr1/4Q3/8/PPP3PP/2KR4 w - - 1 28,d1d6 f6d6 f5f6 h7h8 h2h4 g5d5,2485,89,90,1959,advantage defensiveMove endgame hangingPiece long,https://lichess.org/YYJr2ywa#55,
kjSSJ,2k2b1r/ppp2p1p/2n1p1p1/1PP1q3/3r4/P1Q2P2/1N2BP1P/R3K2R b KQ - 2 20,d4d1 b2d1 c6d4 a1a2,2411,81,82,157,advantage defensiveMove hangingPiece middlegame short,https://lichess.org/jQ9N56Yc/black#40,
kjthd,r1r3k1/4pp1p/4b1pb/p2pB3/P4P2/qP1N3P/2PKQ1P1/3R3R b - - 0 22,c8c2 d2c2 a3a2 e5b2 h6f4 d3f4,2483,85,90,959,advantage hangingPiece long middlegame,https://lichess.org/ZnFOdsTX/black#44,
klWw7,rq2r1k1/1p4p1/p5p1/2PnN3/1P1b2R1/PN3P2/3K3P/R2Q4 w - - 0 28,g4d4 b8e5 d2c1 d5c3 d1d2 c3e2 c1c2 e2d4,2406,86,89,470,crushing exposedKing fork hangingPiece middlegame veryLong,https://lichess.org/pOX7WbMM#55,
koCJC,r2q3r/3bb1k1/p1pp1p2/1p4pQ/4N3/PP1P2RP/1P1B2P1/4R1K1 w - - 0 26,e4g5 h8h5 g5e6 g7h8 e6d8 e7d8,2412,78,76,247,advantage hangingPiece long middlegame,https://lichess.org/w4Omh66y#51,
kpj1W,5k2/N1n5/3p2p1/3P2P1/3pPpK1/2p2P2/2B5/8 w - - 4 60,a7b5 c7b5 e4e5 b5a3 c2g6 a3c4 g4f4 c4e5,2401,95,77,40,crushing endgame hangingPiece veryLong,https://lichess.org/WsjkmVdL#119,
kpqLt,7r/3k4/5P2/p1p3PB/2P4P/PPK1p3/8/8 w - - 1 42,g5g6 h8h5 g6g7 h5e5 g7g8r e3e2,2490,86,84,42,advancedPawn crushing endgame hangingPiece long master quietMove,https://lichess.org/ESJEePaK#83,
ktDdk,4r1k1/Q5pp/p1pq4/3p4/7P/2P2R2/P1P3r1/3R1K2 b - - 8 33,d6e6 f1g2 e6g4 f3g3 g4e2 g2h3,2436,77,94,516,advantage defensiveMove endgame hangingPiece long,https://lichess.org/ciaG5B3o/black#66,
kvHLk,rn1qr1k1/1p3p2/2p1p1p1/p2pP1P1/1B1P2PQ/8/PPP4P/R4RK1 w - - 0 18,b4e7 e8e7 f1f3 d8f8,2438,84,79,89,advantage defensiveMove hangingPiece middlegame short,https://lichess.org/L1FrSNWq#35,Caro-Kann_Defense Caro-Kann_Defense_Other_variations
kwXxu,3r4/pp3p1k/4p1pp/4b3/P3b2q/R4P1N/1P2Q1PP/2B3K1 b - - 2 25,e4d3 e2e5 d3e4 e5g3 h4g3 h2g3,2427,80,87,87,advantage hangingPiece long middlegame,https://lichess.org/BC9fZ6in/black#50,
kwwWV,1rr5/7k/2bp1qp1/2n1pB2/p1P1P2P/1P1pQ1NK/P7/R5R1 w - - 0 34,f5g6 f6g6 g3f5 c6e4 g1g6 e4f5 h3h2 f5g6,2428,99,89,182,advantage fork hangingPiece middlegame sacrifice veryLong,https://lichess.org/fWzWjt3d#67,
kxNAu,r6k/1pp2p1p/3p1b1q/p2P1P1n/2PB1p2/1P3B2/P2Q1PrP/R3R2K b - - 0 23,g2h2 h1h2 a8g8 f3g2 f6e5 d4e5,2422,94,90,225,advantage hangingPiece long middlegame quietMove,https://lichess.org/fWs5sZr9/black#46,
ky0Zt,5r2/8/2R5/2nk2K1/6PP/8/8/8 w - - 1 62,c6c5 d5c5 h4h5 c5d6 g5g6 d6e7,2425,88,90,691,crushing defensiveMove endgame hangingPiece long rookEndgame,https://lichess.org/hdkwLg6Q#123,
ky8Zr,r2r1qk1/1pn2p1p/p2P2p1/2p2b2/P3NP2/1Q4PP/1P4B1/R3R1K1 b - - 2 22,f5e4 d6c7 d8d3 b3c2,2424,98,90,1864,advancedPawn crushing hangingPiece master middlegame short,https://lichess.org/nnMyia6H/black#44,
kyjsX,8/6K1/6P1/8/p4n2/8/Pk6/2N5 w - - 1 59,g7h7 b2c1 g6g7 f4h5,2470,84,69,136,crushing endgame hangingPiece knightEndgame short,https://lichess.org/KnQJJBnO#117,
kzysU,r4rk1/ppp1q1pp/4p3/3n4/3P4/1P2N1P1/P4PKP/R2Q1R2 b - - 0 19,f8f2 g2f2 a8f8 f2g1 d5e3 f1f8,2450,106,90,666,crushing discoveredAttack hangingPiece long middlegame,https://lichess.org/dlOm0DOh/black#38,Queens_Pawn_Game Queens_Pawn_Game_Other_variations
l9c5D,rnbq1rk1/pp4pp/2pb4/3p1p2/3Pn3/3BNP2/PPPN2PP/R1BQ1RK1 b - - 0 10,d6h2 g1h2 d8h4 h2g1 e4g3 f3f4,2422,100,77,75,advantage defensiveMove hangingPiece long opening,https://lichess.org/5WgOLsez/black#20,Russian_Game Russian_Game_Paulsen_Attack
lAgys,1r1r2k1/5pPp/p2q4/2pP2P1/2Q5/8/P1P3P1/2KR3R w - - 1 23,h1h7 g8h7 d1h1 h7g7 c4c3 g7f8,2424,84,90,405,crushing defensiveMove endgame hangingPiece long,https://lichess.org/mMU5OGmw#45,
lBK8g,1r2k2r/2p2pp1/2pb2p1/p2q2P1/3Pp1QP/P1P1B3/1P3P2/2KR3R b k - 2 19,d6a3 b2a3 d5a2 g4e4 e8d7 d1d2,2494,83,91,1081,advantage hangingPiece long middlegame,https://lichess.org/PN0FjjCY/black#38,Queens_Pawn_Game Queens_Pawn_Game_Chigorin_Variation
lEBlH,2r4k/1q4bp/1p4p1/p4r2/8/P2QP3/1P1B1N2/1R2K2R b K - 5 26,f5f2 e1f2 c8f8 f2g1 b7f3 h1h2,2461,76,76,242,crushing hangingPiece long middlegame,https://lichess.org/3HDXBFr3/black#52,
lEDpG,r3k2r/1pp1p2p/8/1p2b2Q/2qP4/2P5/1PK4P/3R3R b - - 1 28,e8f8 h5e5 h8g8 h1g1 g8g1 d1g1,2403,109,81,17,crushing hangingPiece long middlegame,https://lichess.org/TX6q2dYQ/black#56,
lGQd4,1r1q1rk1/pbp2ppp/1p2pb2/8/3P3P/2PB1N2/PP2QPP1/R3K2R w KQ - 1 13,d3h7 g8h7 f3g5 h7h6,2489,100,90,832,advantage hangingPiece middlegame short,https://lichess.org/wOfF3iCt#25,French_Defense French_Defense_Rubinstein_Variation
lHsb2,3b1rk1/q4ppp/pP1P1n2/8/b7/PN1Q1B2/1B3PPP/2r1R1K1 w - - 0 27,b6a7 c1e1 d3f1 e1f1 g1f1 d8b6,2493,77,96,557,advantage hangingPiece kingsideAttack long middlegame,https://lichess.org/KUukiIE6#53,
lIKT3,7k/1p3Q2/2P2p1p/4p1b1/6b1/1B1P4/2P2PK1/2q5 b - - 2 36,g4h3 g2h3 c1h1 h3g4 f6f5 g4f5 h1f3 f5e5 f3f7 b3f7,2478,82,84,110,crushing endgame hangingPiece veryLong,https://lichess.org/XzZZRelD/black#72,
lLERY,8/7P/8/8/8/1Pkpp3/4B2r/3K2R1 w - - 0 52,e2d3 c3d3 d1c1 h2h7 g1d1 d3c3 d1d6 h7h1,2417,97,71,51,capturingDefender crushing endgame hangingPiece veryLong,https://lichess.org/tX4v5rbj#103,
lNpP6,2R2rk1/8/5Q1p/7q/P7/5KP1/1P6/8 w - - 5 43,f3f2 f8c8 f6e6 h5f7 e6f7 g8f7,2470,78,91,1579,crushing endgame hangingPiece long,https://lichess.org/eg8aB6cS#85,
lO4NS,r5k1/1p3ppp/1b1nb1r1/p1q1p3/4P3/NBP4P/PP2Q1P1/R1B2R1K b - - 5 24,e6h3 g2h3 d6e4 e2e4 g6g1 h1h2 g1f1 c1e3 f1f2 e3f2,2400,84,51,44,advantage hangingPiece middlegame veryLong,https://lichess.org/Vsx2Om7U/black#48,
lPhb6,r2qr3/ppp2k1p/2nb2pB/3p4/4p1b1/3P2NP/PPP1NPP1/R2QK2R b KQ - 0 12,d6g3 h3g4,2455,149,100,32,equality hangingPiece middlegame oneMove,https://lichess.org/9BwK2sLl/black#24,
lQ21f,rn4kb/2q1p2p/3pbNpP/2p3P1/1p5R/p2B1r2/2P2P2/1R2QK2 b - - 1 27,e7f6 e1e6 g8f8 d3c4,2415,88,89,1099,crushing defensiveMove hangingPiece middlegame short,https://lichess.org/IqNX1v6z/black#54,
lUbvm,6k1/2r3n1/p2N2Q1/3Pp3/4P1P1/3NK3/rp6/8 w - - 0 36,d3b2 a2b2 e3d3 b2c2,2422,80,91,3687,advantage defensiveMove endgame hangingPiece short,https://lichess.org/zs4utOrF#71,
lW9Mq,r1br4/1p2bppk/p1n1pn1p/4N3/5P2/P1N1Q3/1PP3PP/R5K1 b - - 0 17,b7b5 e5c6 f6g4 e3b6,2448,84,80,117,advantage fork hangingPiece middlegame short,https://lichess.org/gbrArijb/black#34,Caro-Kann_Defense Caro-Kann_Defense_Exchange_Variation
lWv0U,8/8/8/2p4p/1nK2P1N/6k1/6P1/8 w - - 0 48,f4f5 g3h4 f5f6 b4c6 c4c5 c6e5 c5d6 e5g6,2496,96,85,203,crushing defensiveMove endgame hangingPiece knightEndgame quietMove veryLong,https://lichess.org/fSHAnKVb#95,
laAvV,r4r1k/3q1ppn/3p4/p1pPp2Q/PpP1P2N/6RP/1P3P2/R6K w - - 1 27,g3g7 h8g7 a1g1 g7h8,2484,85,86,56,advantage defensiveMove hangingPiece middlegame short,https://lichess.org/WdJYUtzU#53,
lb3QH,1r1q2k1/2b2ppp/b3rn2/1p6/5p2/N2P1B2/PP1B2PP/2RQ1RK1 b - - 1 22,d8d3 c1c7 b5b4 a3c2 d3f1 d1f1 a6f1 g1f1,2483,108,82,27,advantage hangingPiece middlegame veryLong,https://lichess.org/Dt0T8rCf/black#44,
lc0K6,2r3k1/8/2pq3B/PpRnpr2/1P1P2p1/1Q4P1/8/2R3K1 w - - 0 38,a5a6 d6h6 b3d5 c6d5 c5c8 f5f8 a6a7 h6e3,2435,76,73,139,crushing hangingPiece middlegame veryLong,https://lichess.org/at8jgn65#75,
ldC9D,r3k2r/ppp2ppp/4p3/5Pq1/1n1n4/3B1Q2/PP2NP1P/RN2K1R1 w Qkq - 0 13,f3b7 b4d3 e1f1 g5f5 b7a8 e8d7 a8g2 d4e2,2478,96,82,63,advantage hangingPiece middlegame veryLong,https://lichess.org/CduQL538#25,Queens_Pawn_Game Queens_Pawn_Game_Other_variations
ldWdz,2rk1r2/1p1b1p2/p2Q3P/4PB2/8/1Pp5/q5P1/1N2K3 b - - 4 35,c8c7 d6f8 d7e8 f8d6 c7d7 d6b6,2460,95,80,104,advantage exposedKing hangingPiece long middlegame,https://lichess.org/NyFq1xHb/black#70,
le2A8,8/7p/6p1/6P1/Pn2p1KP/4k3/2B5/8 w - - 2 52,a4a5 b4c2 a5a6 e3d2,2444,94,90,389,advantage defensiveMove endgame hangingPiece short,https://lichess.org/KckBAv09#103,
leWeG,r1b1kb1r/2ppq2p/p2n4/4Npp1/1p3Q2/1B1P4/PPPB1PPP/R3K2R w KQkq - 0 15,f4g5 e7e5 e1f1 h7h6,2434,154,23,19,advantage hangingPiece middlegame short,https://lichess.org/sfAMFZls#29,Ruy_Lopez Ruy_Lopez_Morphy_Defense
lgrmI,3r1rk1/pp3pbp/2n3p1/2R1P2q/4PB2/3B1N1b/P2Q1PP1/R5K1 b - - 0 19,h3g2 g1g2 g7h6 f4h6 h5g4 g2h2,2466,86,74,57,advantage defensiveMove hangingPiece long middlegame,https://lichess.org/Jg19NWwO/black#38,Grunfeld_Defense Grunfeld_Defense_Three_Knights_Variation
lhbju,r1bk1r2/1ppp1Qpp/p2b4/8/2BpP1n1/3P1NPq/PPP2P1P/R1B2RK1 w - - 3 13,f7g7 f8f3 g7g8 d6f8,2482,80,51,88,advantage defensiveMove hangingPiece opening short,https://lichess.org/0PwoxDGb#25,Ruy_Lopez Ruy_Lopez_Bird_Variation
lj0Zg,k2r4/1p1q4/pQPP4/5p2/5r2/KP6/P4P2/3R4 b - - 0 44,d7c6 b6d8 a8a7 d8c7 f4a4 a3b2,2468,80,90,666,crushing endgame hangingPiece long,https://lichess.org/Nmj5J89u/black#88,
ln1Qt,1Qb1k2r/1p3p2/pn2nP1p/3p4/6PP/2q5/2P3B1/1K1RR3 w k - 2 26,e1e6 f7e6 b8d6 c3b2 b1b2 b6c4 b2b3 c4d6,2467,79,91,1323,attraction crushing fork hangingPiece middlegame sacrifice veryLong,https://lichess.org/czNf2Tzn#51,
lpk5Q,2r2rk1/5ppp/p7/2PN4/2B1P2q/P3QP1b/5R1P/6K1 b - - 2 27,c8c5 e3c5 h4g5 g1h1 g5c1 f2f1 h3f1 d5f6 g7f6 c4f7 f8f7 c5c1,2444,77,92,5571,advantage discoveredAttack hangingPiece middlegame sacrifice veryLong,https://lichess.org/u3nvO1AD/black#54,
lrNKA,r3k3/2p1bp2/p4np1/Np2P3/1P3B2/P2p1Q1P/6PK/q7 b q - 0 24,f6h5 f3a8 e7d8 a5c6 e8d7 e5e6,2435,90,85,337,crushing hangingPiece long middlegame,https://lichess.org/HnLFSbe1/black#48,
lrY09,r2q3k/pb4p1/1pp2b1p/2P2B2/1PnpN3/4P3/P1QB2PP/5RK1 b - - 1 21,d4e3 c2c4 d8d4 c4d4 f6d4 d2c3 e3e2 c3d4,2406,106,88,846,advantage hangingPiece kingsideAttack middlegame veryLong,https://lichess.org/FeryDDz4/black#42,
ls1OF,1r6/6p1/KB2k3/p2bPp1p/3P1P1P/1p4P1/8/R7 b - - 1 36,b8b6 a6b6 d5e4 d4d5 e6d7 e5e6,2493,95,26,41,crushing endgame hangingPiece long master,https://lichess.org/VXCW7NiI/black#72,
lsSKL,3r2k1/1b1P1pp1/6p1/p5P1/1p5P/8/6r1/3RRK2 b - - 8 40,d8d7 d1d7 b7c6 d7d8 g8h7 e1c1 b4b3 c1c6,2450,86,77,114,crushing endgame hangingPiece veryLong,https://lichess.org/2ulGIgNo/black#80,
ltMOV,1n1R4/QP3p1k/b5p1/P6p/5q1P/5P2/1p2rPK1/7R b - - 1 28,b8c6 a7a6 f4e3 h1f1 b2b1r a6e2 e3e2 f1b1,2487,92,85,48,crushing fork hangingPiece middlegame quietMove veryLong,https://lichess.org/LR7tXqBi/black#56,
lu5km,3r2k1/5p1p/p3pbpP/1p4B1/3P2Q1/P7/1q3PP1/3R2K1 b - - 1 26,d8d4 g5f6 d4d1 g4d1 b2f6 d1d6 f6a1 g1h2,2403,94,90,795,advantage endgame hangingPiece veryLong,https://lichess.org/obsISCtM/black#52,
luIL5,1k1r1r2/pp1q2b1/1npNp3/B1Q1P1Pp/4P1bP/1P4P1/P7/2R2RK1 b - - 2 26,g7e5 c5e5 f8f1 c1f1 d7d6 e5d6,2468,113,86,16,crushing hangingPiece long middlegame,https://lichess.org/CQ6Brehi/black#52,
lvMLc,r1bk3r/p1pp4/1p3pp1/2bN2Bn/2B3Q1/8/PqP2PPP/R3R1K1 w - - 0 16,g4h5 g6h5 g5f6 b2f6,2435,105,86,511,advantage hangingPiece middlegame short,https://lichess.org/oZ0UU497#31,Italian_Game Italian_Game_Anti-Fried_Liver_Defense
lvozF,5rk1/P5bp/2p3p1/2Q5/2PpN3/4n1B1/2q3PP/R5K1 w - - 1 28,g3f2 c2e4 f2e3 e4e3 g1h1 f8a8,2489,79,97,256,advantage hangingPiece long middlegame,https://lichess.org/vCZ04r2t#55,
lw3Y6,4k3/4pp1p/nBqp1bp1/P7/1pN1P3/1Pr2P2/4Q1PP/1R5K w - - 13 32,c4d6 e7d6 e4e5 f6e5,2452,88,90,599,crushing hangingPiece master middlegame short,https://lichess.org/9B9vojJG#63,
lw8Jt,2kr1r2/pp1b1Qpp/4p3/2qpP3/4n3/2PB4/PP4PP/RNB2R1K w - - 2 15,c1e3 c5e3 f7f8 d8f8,2422,79,91,3131,crushing hangingPiece middlegame short,https://lichess.org/pYNcEtXh#29,Horwitz_Defense Horwitz_Defense_Other_variations
lwGFE,rn1q1rk1/pb3ppp/4p3/1pb1P3/8/2PB1N2/P4PPP/R1BQ1RK1 w - - 0 13,d3h7 g8h7 f3g5 h7g8 d1h5 d8d3,2460,82,85,114,advantage hangingPiece long middlegame,https://lichess.org/T9RmiP2n#25,Queens_Gambit_Declined Queens_Gambit_Declined_Exchange_Variation
lyDG4,5rkq/1pQ2p2/p3rP1p/2Pp2p1/3P2P1/1P1B3P/6N1/5RK1 w - - 1 27,g2e3 e6e3 d3f5 h6h5,2492,95,90,606,advantage hangingPiece middlegame short,https://lichess.org/xeoYCb5h#53,
lyR9L,2r1k2r/2q1ppb1/B2p2p1/7p/n5P1/2p2P1P/PPQ2B2/1K1RR3 b k - 1 23,c8b8 c2a4 e8f8 e1e2,2425,83,86,50,advantage hangingPiece master middlegame short,https://lichess.org/qHTQ77OG/black#46,
lyw0w,r1bq1rk1/2ppnppp/p7/1pbPN3/2P5/3P4/PP3PPP/RNBQK2R b KQ - 0 10,e7d5 c4d5 c5b4 e1f1,2424,79,92,947,advantage defensiveMove hangingPiece master opening short,https://lichess.org/N09w8I6p/black#20,Ruy_Lopez Ruy_Lopez_Morphy_Defense
lz2QL,8/8/P1n1p2p/3pPp2/1p3P1k/1K2N3/7P/8 w - - 3 47,e3d5 e6d5 b3b2 h4h5,2417,79,91,1737,crushing defensiveMove endgame hangingPiece knightEndgame master short,https://lichess.org/mmvG7CF2#93,
m0ZYr,8/8/5p2/7p/1N3P2/6P1/2pb1K1P/3k4 w - - 0 42,b4c2 d1c2 f2g2 h5h4,2412,92,89,725,crushing endgame hangingPiece short,https://lichess.org/DSGGSfc3#83,
m0Zet,r1r3k1/5n2/3p1qpR/6p1/1p2P3/1P2B2Q/P6R/1K6 w - - 2 35,e3g5 f6g5 h6h8 f7h8 h3h8 g8f7 h2f2 f7e6,2408,78,76,127,crushing defensiveMove hangingPiece middlegame veryLong,https://lichess.org/JG4ttLtF#69,
m1NQm,3q2k1/3nbrPp/p2pb1p1/1p2p3/2r1P3/1NN1BP2/PPPQ4/2KR3R w - - 1 19,h1h7 g8h7 d2h2 e7h4,2472,80,82,249,advantage defensiveMove hangingPiece master middlegame short,https://lichess.org/i8Nywm2q#37,Sicilian_Defense Sicilian_Defense_Najdorf_Variation
m5Aui,1r6/3k4/2pP1p2/2Pbp1pr/pP4Rp/B4P1P/3R2P1/4K3 w - - 2 34,d2d5 c6d5 b4b5 d5d4 c5c6 d7c8,2404,93,85,30,advantage defensiveMove endgame hangingPiece long quietMove,https://lichess.org/QeFqvcJg#67,
m60ML,8/p6B/1p1k2p1/1Pp1n1Pp/P1P1PK1P/8/8/8 w - - 23 67,h7g6 e5g6 f4f5 g6h4 f5f6 d6d7,2469,114,90,2496,crushing defensiveMove endgame hangingPiece long,https://lichess.org/xydYjKfD#133,
m7tt5,r5k1/1R4p1/n6p/2p1p3/2PpP3/B4q2/1Q5P/5BK1 w - - 0 26,b7g7 g8g7 b2b7 a6c7 b7c7 g7g8,2401,92,95,93,advantage defensiveMove hangingPiece long middlegame,https://lichess.org/Nwczewti#51,
m7xbz,2r5/k6p/Pp1p4/n2B2B1/P7/5P1q/3Q3P/1R5K w - - 2 32,d2a5 b6a5 g5e3 c8c5,2416,175,65,14,endgame equality hangingPiece short,https://lichess.org/zmjVjXIY#63,
mD8Ze,8/2nk4/PK3p2/4p3/4P3/3P4/5P2/8 b - - 2 55,c7a6 b6a6 d7c6 a6a7,2457,86,88,316,crushing defensiveMove endgame hangingPiece short,https://lichess.org/37dhYePx/black#110,
mEM5p,4R1rk/5Qpp/p7/2p5/1p4r1/1P1P2PK/P2q3P/8 b - - 8 44,g4g3 h2g3 d2h6 h3g4 h6g6 f7g6 h7g6 e8g8 h8g8 g4f4,2408,95,89,269,crushing defensiveMove endgame hangingPiece veryLong,https://lichess.org/Nrld6zZk/black#88,
mF4Ad,kr3r2/p1pR2bp/QpP1p3/8/4p3/1P3p2/P6P/7K b - - 1 41,g7d4 d7d4 b6b5 h1g1 b8b6 a6a3,2431,83,64,70,advantage endgame hangingPiece long,https://lichess.org/rXkYX2hs/black#82,
mFQzq,8/8/7R/5pP1/2bk1P1P/K7/8/8 w - - 3 58,h6e6 c4e6 g5g6 e6d7 h4h5 d7e8,2434,93,85,196,crushing endgame hangingPiece long quietMove,https://lichess.org/SBYTZIRA#115,
mFbHM,r1b2rk1/pp3pP1/4p3/2b1n2Q/q2p4/8/P1PN1P1P/R3K2R b KQ - 0 18,g8g7 h5e5 f7f6 h1g1 g7f7 e5h5,2466,101,90,658,crushing fork hangingPiece long middlegame,https://lichess.org/mOOGH1OA/black#36,French_Defense French_Defense_Advance_Variation
