PuzzleId,FEN,Moves,Rating,RatingDeviation,Popularity,NbPlays,Themes,GameUrl,OpeningTags
gu84L,8/8/6p1/1pnk1pP1/p1p2P2/P3PK2/1PB5/8 b - - 5 40,c5e4 c2e4 f5e4 f3e2,2494,78,85,120,advantage defensiveMove endgame master masterVsMaster short,https://lichess.org/mWr1f6rz/black#80,
guhZV,3r1k2/1p1b1p2/1p1p1p1p/pP1P1PP1/P1P2K1P/3B4/4R3/8 b - - 0 38,h6g5 h4g5 d8e8 e2h2 f6g5 f4g5,2469,76,80,103,crushing endgame long master masterVsMaster quietMove,https://lichess.org/LiTf6XBk/black#76,
gvsJC,4r3/4Pk2/7R/1P3pp1/p2N4/2Pr3P/1P4P1/5K2 b - - 0 37,e8e7 h6h7 f7f8 h7e7 f8e7 f1e2,2463,104,88,493,crushing endgame long master masterVsMaster,https://lichess.org/5ZYRZN7E/black#74,
gxG7L,2RQ4/5ppk/4r3/p6p/1b6/4B2P/P4PPK/1q6 b - - 4 27,b1a2 d8h8 h7g6 c8g8 b4d6 g2g3,2409,94,89,1226,clearance crushing defensiveMove endgame long master masterVsMaster,https://lichess.org/2JVM6Okz/black#54,
gxYUS,6k1/1p6/5Bp1/1PPp1p2/3P1n1p/4RP1P/r2r2PK/6R1 w - - 1 38,f6h4 f4g2 e3e8 g8f7 e8e7 f7f8 h2g3 g2h4,2429,78,93,2086,crushing endgame fork master masterVsMaster veryLong,https://lichess.org/vi2Lla2E#75,
h37ji,1r6/4nk2/6p1/pN1p1pP1/n1pP4/P1P1P3/5PK1/1B5R w - - 1 38,h1h7 f7g8 h7e7 b8b5,2498,91,84,137,advantage defensiveMove endgame master masterVsMaster short,https://lichess.org/Hg8LsLjL#75,
h6xUB,r3k2r/1p1q4/p2p1p1b/3PnN2/6n1/3B2Q1/PPP3PP/1K1R3R b kq - 4 22,e8c8 h2h3 e5d3 h3g4,2448,92,89,562,advantage master masterVsMaster middlegame short,https://lichess.org/3vHUY5WN/black#44,
hBdys,2r2rk1/p3b1pp/1pqpp1P1/3b4/2nP1B1N/P2B4/1PP1QP2/2KR2R1 b - - 0 19,e7h4 g6h7 g8h8 g1g7,2498,81,51,114,advancedPawn advantage discoveredAttack kingsideAttack master masterVsMaster middlegame short,https://lichess.org/48AulyPG/black#38,Indian_Defense Indian_Defense_London_System
hCo5A,3r4/1p3p2/p4Np1/1kB2nPp/7P/1P3n2/P7/1KR5 b - - 1 34,f3h4 a2a4 b5a5 b1b2,2418,81,0,105,crushing defensiveMove endgame master masterVsMaster short,https://lichess.org/HE1OqEcj/black#68,
hCqRN,r5k1/2p2pp1/p2b3p/4qP2/P2p1nP1/3P4/2B3KP/R1B2Q2 w - - 0 29,f1f4 e5e2 f4f2 e2g4 g2f1 a8e8,2400,88,90,1333,advantage deflection long master masterVsMaster middlegame,https://lichess.org/zpjucQOK#57,
hCrKk,r4rk1/3qnpbp/pp1N1np1/3p4/3N1P2/BP5P/P5P1/2RQRK2 b - - 0 23,f6e4 d6e4 d5e4 d4c6 d7c6 c1c6,2419,80,60,99,crushing long master masterVsMaster middlegame,https://lichess.org/rGFXLM6O/black#46,
hMQJ2,8/8/4p3/4b3/2Pk4/5p2/3KR3/8 w - - 0 62,e2e1 e5f4 d2d1 f3f2,2428,89,90,1284,advancedPawn crushing endgame master masterVsMaster short,https://lichess.org/6FCbWqXL#123,
hNcUS,6k1/1p4p1/1p1p1rqr/2pR2n1/1PN1Pp2/2P2P2/P4QPP/3R3K w - - 14 32,h2h4 g6h7 h1g1 h6h4,2423,90,79,40,crushing master masterVsMaster middlegame pin short,https://lichess.org/2Si8G9Wf#63,
hQ6GR,r1bq1kr1/3n4/2n1p1Bb/p2pP2N/1p1P1PQp/1Pp1B3/P1P3PP/R4RK1 b - - 4 20,d8e8 f4f5 h6e3 g1h1,2401,82,90,496,crushing master masterVsMaster middlegame sacrifice short,https://lichess.org/5olJoaBx/black#40,
hTuW1,8/5pk1/1Q3bp1/p7/P1P1N1P1/1P3K1P/8/7q w - - 1 43,f3e3 f6g5 e4g5 h1g1 e3d3 g1b6,2425,80,94,343,crushing endgame exposedKing long master masterVsMaster sacrifice skewer,https://lichess.org/cP4MOB9f#85,
hVjQC,5QB1/p1k5/1q3p2/3p4/2pPb3/2P4P/6PK/8 w - - 11 36,h3h4 b6d6 f8d6 c7d6 h4h5 d6e7 h5h6 e7f8 h6h7 f8g7,2493,79,85,140,crushing endgame master masterVsMaster veryLong,https://lichess.org/34l8Ca3C#71,
hZnQH,8/4BK2/8/3k3p/2p4P/4bP2/8/8 w - - 0 46,e7b4 d5d4 f7e6 d4d3,2410,91,90,356,bishopEndgame crushing defensiveMove endgame master masterVsMaster short,https://lichess.org/kBdO53pa#91,
hdbkk,6k1/p5pp/1b2p3/3rBq2/2p5/2Q2P1P/PP4P1/4R2K w - - 1 29,e1e4 d5d3 c3c4 d3d1 h1h2 b6g1,2482,116,90,936,crushing endgame long master masterVsMaster,https://lichess.org/OiEuC7iF#57,
hgNwI,rnbq1r1k/pp3p1P/6p1/3p4/2pPn3/P1P1BN2/2P4Q/2KR1B1R b - - 0 21,d8a5 h2e5 f7f6 e5e7 a5d8 f3h4,2452,99,90,833,advantage long master masterVsMaster middlegame,https://lichess.org/lBxKkbhl/black#42,
hhIix,4r1k1/1b4pp/p2p4/Qpqp1P2/7P/1RP3P1/P4PB1/6K1 w - - 1 26,a2a4 e8e2 a5d8 g8f7,2449,96,88,905,advantage endgame master masterVsMaster short,https://lichess.org/QJMuqVe3#51,
hkaR0,8/4qpk1/4rRp1/1p1p2P1/p2P4/P1P2QPK/8/8 w - - 3 41,f6e6 e7e6 h3g2 e6d6,2417,107,33,25,crushing endgame master masterVsMaster short,https://lichess.org/A2pzsk8M#81,
i4OlL,r1bq1rk1/6p1/p1Npp2p/1pNn4/3P4/P5P1/1P2QP1P/R3R1K1 b - - 1 22,d8c7 c5e6 c7c6 e6f8 c8f5 a1c1 c6b7 f8e6,2438,75,81,258,crushing fork master masterVsMaster middlegame veryLong,https://lichess.org/29ioimrg/black#44,
i4Spg,8/4n1k1/4b1p1/1Q3p2/4p2R/6PK/5PB1/r5q1 b - - 3 37,g1f2 b5e5 g7f8 e5e6,2408,87,90,78,crushing fork master masterVsMaster middlegame short,https://lichess.org/kff9YWys/black#74,
iDhZg,7r/1br2pk1/1p1q1R1p/p2p4/P2P3Q/4P3/1P4PP/5RK1 b - - 4 28,d6e7 h4g3 g7f8 f6f7 e7f7 g3c7,2420,75,93,4781,crushing fork long master masterVsMaster middlegame pin,https://lichess.org/mo3JDbB9/black#56,
iFMqo,2k3rr/Ppbq4/2p1pp2/7p/3Pn2P/3QB3/1P3PP1/2R2RK1 b - - 0 21,g8g2 g1g2 d7g7 e3g5,2487,96,90,1908,crushing hangingPiece master masterVsMaster middlegame short,https://lichess.org/xz4umZFK/black#42,
iJVVz,8/8/3k1B2/4p3/2Bpb3/2p5/4K3/8 w - - 4 73,c4d3 e4d3 e2d3 d6d5 d3c2 e5e4 f6d8 d5c4,2495,98,90,1009,bishopEndgame crushing defensiveMove endgame master masterVsMaster quietMove veryLong,https://lichess.org/VAYlQf4z#145,
iKcEF,8/6p1/kp2p1Pp/3pP2P/P1pn1N2/2K5/8/8 b - - 1 68,d4f3 f4e6 b6b5 e6g7,2400,92,89,503,crushing endgame knightEndgame master masterVsMaster short,https://lichess.org/DH0Q0QvM/black#136,
iPfJD,4r3/8/4b3/1R6/p1k1p3/2p4P/5PP1/1R3K2 w - - 2 55,f1e2 c3c2 b1b4 c4c3 b4a4 e8c8,2408,88,83,31,advancedPawn crushing defensiveMove endgame long master masterVsMaster,https://lichess.org/xgn9GuQI#109,
iRy2J,r3k1r1/pp2qp1p/7Q/4n2B/3P1p2/2P3P1/PP3p1P/3R1RK1 w q - 0 20,g1f2 e5g4 h5g4 e7e3 f2g2 f4f3 f1f3 e3h6,2411,95,82,54,clearance crushing discoveredAttack fork master masterVsMaster middlegame sacrifice veryLong,https://lichess.org/4kVQuqY5#39,
iXMkR,5r2/pp1P3p/6k1/2p1P3/1pB1Knp1/4R3/P7/8 w - - 0 39,d7d8q f8d8 e4f4 d8d4 e3e4 d4e4 f4e4 g4g3 c4f1 c5c4,2411,116,88,610,crushing defensiveMove endgame fork master masterVsMaster veryLong,https://lichess.org/Bf5cQzUp#77,
iXOA0,rn3rk1/3nbppp/bp2p3/p1qpP3/7P/2PB1NB1/PP1NQPP1/R3K2R w KQ - 1 14,d3h7 g8h7 f3g5 h7g8,2404,83,83,143,advantage defensiveMove hangingPiece master masterVsMaster middlegame short,https://lichess.org/2zNVyRQa#27,Queens_Pawn_Game Queens_Pawn_Game_Zukertort_Variation
ieHJu,2k4r/p1q1p2p/2p3p1/2P2p2/1P2b3/2Pr3P/PB1NQPPb/R3R1K1 w - - 6 21,g1f1 d3d2 e2d2 h8d8,2432,78,83,86,crushing master masterVsMaster middlegame sacrifice short,https://lichess.org/3feeQJPU#41,
ihkhZ,3rr1k1/1pq2pp1/p1n2n1p/4p3/6bQ/P1PB2B1/2PN2PP/R4RK1 b - - 3 19,c7c8 f1f6 g7f6 h4h6 f6f5 h6g5,2469,84,85,89,advantage deflection kingsideAttack long master masterVsMaster middlegame,https://lichess.org/w70T0qTq/black#38,Sicilian_Defense Sicilian_Defense_Kan_Variation
ijUhy,8/6k1/5pp1/8/4KP1P/8/8/8 w - - 2 57,e4d5 f6f5 h4h5 g6h5,2467,94,80,41,crushing endgame master masterVsMaster pawnEndgame quietMove short,https://lichess.org/hUCyB8od#113,
ijjAN,n7/P7/4k1p1/2p1P1P1/2P1K1P1/1P6/8/8 w - - 7 47,b3b4 c5b4 e4d4 a8c7,2479,84,91,854,crushing defensiveMove endgame knightEndgame master masterVsMaster short,https://lichess.org/b7vQaugy#93,
ildm5,r5k1/pb3ppp/6q1/1B1P1p2/2p1rPn1/P1N1PK2/1P1QN1P1/4RR2 w - - 0 21,c3e4 f5e4 f3g3 g4e3 g3f2 e3g4,2445,97,90,318,advantage discoveredAttack long master masterVsMaster middlegame,https://lichess.org/Or2MCg52#41,
ioiUp,2r3k1/pq4b1/2P3p1/4PpPp/2R1bP2/P1Qp4/1B4B1/6K1 b - - 0 34,c8c6 c4c6 e4c6 g2c6,2412,78,91,3166,crushing master masterVsMaster middlegame short xRayAttack,https://lichess.org/TqApWZCG/black#68,
ir6hO,4n1k1/1p6/4pB2/1BP2bP1/3Q4/5q2/P7/6K1 w - - 1 46,b5e8 f5e4 d4d2 f3g3 g1f1 e4d3 d2d3 g3d3,2467,95,36,45,advantage endgame exposedKing master masterVsMaster quietMove veryLong,https://lichess.org/E8o0Y35p#91,
irCx3,6k1/8/5PK1/8/3B4/8/p5P1/1r6 b - - 4 60,g8f8 f6f7 f8e7 d4f6,2445,79,86,483,advancedPawn crushing endgame master masterVsMaster short,https://lichess.org/MunNJL6T/black#120,
itsMu,4k3/6p1/4p1Np/2p1PP2/1p1r2P1/p3N2P/P3K3/8 w - - 0 39,f5e6 d4e4 e2f2 e4e3,2455,80,79,157,crushing endgame master masterVsMaster short,https://lichess.org/y9Hs40BM#77,
ivWd7,2r5/8/3R1pk1/4n2p/4P2P/1B4N1/PP3PP1/2r3K1 w - - 1 36,b3d1 e5f7 d6d5 c8d8,2497,91,84,42,advantage endgame master masterVsMaster short,https://lichess.org/6IAy8RJ2#71,
ivvFf,r4r1k/pbp4B/1p2p2p/2b5/1nPq4/2N2P1N/PPQ3PP/3R1K1R w - - 1 15,c2g6 d4c4 f1e1 c4h4,2407,78,84,94,crushing master masterVsMaster middlegame short,https://lichess.org/M7DCplGU#29,English_Defense English_Defense_Poli_Gambit
iwWXa,4b3/4k3/1p2p1p1/pP1pK3/P4PNP/8/8/8 b - - 0 63,e8b5 a4b5 a5a4 e5d4 a4a3 d4c3,2435,83,84,212,crushing defensiveMove endgame hangingPiece long master masterVsMaster,https://lichess.org/bhD9ycEo/black#126,
iwzzu,8/8/6k1/1P3pp1/5r1p/1KR2P1P/8/8 b - - 0 65,g5g4 b5b6 f4f3 b6b7,2463,76,78,217,advancedPawn crushing endgame master masterVsMaster rookEndgame short,https://lichess.org/DCmcROiq/black#130,
j1D9z,5r2/pr5p/8/1p1nkp2/3p3P/3P4/PP3NRK/4R3 b - - 1 31,e5f6 f2e4 f5e4 g2f2 f6g7 e1g1 g7h6 f2f8,2402,81,89,485,advantage clearance deflection endgame master masterVsMaster sacrifice veryLong,https://lichess.org/D3Ymw7xu/black#62,
j2jPy,3qn1k1/1b4pp/p1n2p1B/1p2p3/4P2N/1PP1Q1PB/5P1P/6K1 b - - 1 22,g7h6 h3e6 g8f8 h4f5 d8d1 g1g2,2471,87,84,549,crushing long master masterVsMaster middlegame,https://lichess.org/q3tq9P6s/black#44,
j6IM0,3r3k/4Q2p/p2r1p2/1pp5/1q3P2/1P3NPK/P2R3P/8 b - - 1 34,c5c4 d2d5 d6d5 e7b4,2424,95,89,355,crushing endgame master masterVsMaster short,https://lichess.org/MFkjDpbD/black#68,
j8NA3,8/7p/4k1pP/1pp5/p3KPP1/P7/1P6/8 w - - 1 39,f4f5 g6f5 g4f5 e6d6,2436,76,72,156,crushing defensiveMove endgame master masterVsMaster pawnEndgame short zugzwang,https://lichess.org/M0GtlPQW#77,
jC4Rd,Q1b4r/p1k1q1p1/3b4/8/3N4/3pB1P1/PP2n1PP/4RRK1 w - - 1 23,d4e2 e7e3 g1h1 d3e2 f1f7 c7d8,2472,104,90,555,advancedPawn crushing defensiveMove hangingPiece intermezzo long master masterVsMaster middlegame,https://lichess.org/anQ1IFQj#45,
jFGFH,7R/8/4pk2/7P/P3K3/6pr/8/8 w - - 0 62,a4a5 f6g7 h8b8 g3g2 b8b1 h3h1,2489,78,82,174,advancedPawn crushing endgame long master masterVsMaster rookEndgame,https://lichess.org/kLZOY5eE#123,
jHrqW,6k1/3R4/8/p3B1Kp/6p1/r5P1/4n3/8 b - - 3 39,a3e3 g5g6 g8f8 d7d8 f8e7 e5f6 e7e6 d8e8 e6d6 e8e3,2435,78,91,2220,crushing endgame exposedKing master masterVsMaster skewer veryLong,https://lichess.org/xRNoaOLN/black#78,
jJd01,k7/1b2q3/4P1p1/pp1pQ1P1/2p4p/2P5/6BP/5K2 b - - 1 38,a5a4 e5f6 e7a3 e6e7,2423,86,83,453,advancedPawn crushing endgame master masterVsMaster short,https://lichess.org/T3Ponbs1/black#76,
jNmCY,8/8/1pB5/p1p5/2P2kp1/8/4K3/8 w - - 0 52,e2f2 f4e5 f2e3 g4g3 c6e8 g3g2,2456,86,75,155,advancedPawn bishopEndgame crushing endgame long master masterVsMaster zugzwang,https://lichess.org/eTowy6FR#103,
jQ3CI,8/p4p2/1p5p/5P2/3kp3/P5KP/1P3P2/8 w - - 0 31,g3f4 f7f6 f4g4 d4d3,2400,76,53,103,crushing defensiveMove endgame master masterVsMaster pawnEndgame quietMove short,https://lichess.org/gPjG5f3J#61,
jRd2z,8/8/8/pp6/2k5/P7/1PK5/8 w - - 0 58,c2d2 c4b3 d2c1 b3a2 a3a4 b5b4 c1c2 a2a1,2400,78,96,661,endgame master masterVsMaster,https://lichess.org/sfb0Eh28#115,
jWqmS,8/8/6p1/2k1pp1p/7P/3PP1P1/3K4/8 b - - 5 46,c5b4 d2c2 e5e4 d3d4,2412,94,90,1041,crushing defensiveMove endgame master masterVsMaster pawnEndgame short,https://lichess.org/R4vxddQN/black#92,
jYFs1,3r4/4kpp1/2P1p2p/5P2/3N2PP/p1P5/Pr6/K3R3 b - - 0 33,d8d6 f5f6 g7f6 d4f5 e7d8 f5d6,2489,117,90,2226,crushing endgame long master masterVsMaster pin,https://lichess.org/JRENbrZR/black#66,
jdCuu,1nr2rk1/1p2ppb1/4b2p/1BP3p1/1PN5/P1P2PB1/4K2P/R1R5 w - - 1 25,a1a2 b8c6 a3a4 c6a7,2461,96,86,364,advantage master masterVsMaster middlegame short,https://lichess.org/BuAsSVmm#49,
jgNZk,8/5p2/8/4k1pp/4P3/4P1PP/4K3/8 w - - 4 43,e2d3 g5g4 h3h4 f7f6 d3e2 e5e4 e2d2 e4f3,2470,81,93,3834,crushing endgame master masterVsMaster pawnEndgame quietMove veryLong zugzwang,https://lichess.org/8tLiZz22#85,
jmOwU,r1b4r/1p2NQb1/p6k/7B/7P/2q5/P1PK2P1/3R3R w - - 2 25,d2e2 c3e5 e2f2 h8f8 e7g8 h6h7,2401,79,86,136,crushing long master masterVsMaster middlegame pin,https://lichess.org/CA8m0RwL#49,
jmnt4,6k1/1p2np2/p2p1q2/P2P2pp/4P3/4Q2P/2r2PP1/1R3BK1 b - - 3 33,c2c3 e4e5 f6e5 e3e5 d6e5 d5d6 e7c6 b1b7,2418,77,91,859,crushing endgame master masterVsMaster veryLong,https://lichess.org/ULrmMvHN/black#66,
jr0Pa,1rb2k1r/p4Bb1/8/6Pp/nq1P4/1N4P1/PKQ3PN/4RR2 w - - 1 28,b2a1 b4d4 b3d4 g7d4,2437,77,93,434,advantage master masterVsMaster middlegame sacrifice short,https://lichess.org/ZVlZ4OOO#55,
jsgPv,2r4k/1Q4p1/3n1p1p/8/3qPN2/8/6PP/4R2K w - - 2 36,b7d7 d4d2 f4g6 h8h7,2401,94,91,242,advantage endgame fork master masterVsMaster short,https://lichess.org/zTNa78Yt#71,
ju2UD,3K4/3P2k1/7p/6p1/8/8/2r5/5R2 b - - 0 60,h6h5 f1f5 g7g6 f5d5 g6f7 d5g5,2482,84,81,36,crushing endgame long master masterVsMaster rookEndgame,https://lichess.org/KhlCzK4f/black#120,
juwE0,8/1p3k2/pN1R2p1/P3npKp/1PP4P/6P1/4r3/8 w - - 2 36,b6d5 f7g7 d6b6 e2e4 b6b7 e5f7 b7f7 g7f7,2486,104,88,436,advantage endgame master masterVsMaster veryLong,https://lichess.org/2hs3Baz3#71,
jxUcK,8/1R3p2/4p3/4P3/1P1P2p1/4k3/7r/5K2 w - - 0 42,d4d5 h2f2 f1g1 e6d5,2486,89,86,412,crushing endgame master masterVsMaster rookEndgame short,https://lichess.org/Ia8wKz20#83,
jxZKp,2kr4/p5bp/3N2p1/2P5/1P2p3/3p2P1/P4K1P/2R5 b - - 1 28,d8d6 c5d6 c8d8 c1c4,2493,96,90,1583,crushing discoveredAttack endgame hangingPiece master masterVsMaster short,https://lichess.org/tfdD19Xx/black#56,
jxuQ6,rnbqkb1r/5n2/p2pp1Q1/2p1P1N1/1pP2P2/8/PP4PP/RNB2RK1 b kq - 2 14,d8d7 f4f5 h8h6 g6f7 d7f7 g5f7,2470,97,88,1383,attackingF2F7 crushing exposedKing long master masterVsMaster middlegame pin,https://lichess.org/cKmCohD1/black#28,Benko_Gambit Benko_Gambit_Other_variations
jz1FH,3r4/4kpQ1/4p2P/4Pq2/B2p4/6P1/1P3P2/6K1 b - - 0 40,d4d3 h6h7 d3d2 a4d1,2475,102,90,506,advancedPawn crushing defensiveMove endgame master masterVsMaster short,https://lichess.org/VHOglAvp/black#80,
jzkz9,r1b2rk1/pp4pp/1q2pb2/3p4/3n1B2/1B1Q1NP1/PP3PK1/R6R b - - 1 19,g7g6 h1h7 g8h7 a1h1 h7g7 f4h6 g7f7 h6f8,2476,82,86,164,attraction crushing kingsideAttack master masterVsMaster middlegame sacrifice skewer veryLong,https://lichess.org/UpqK6ExS/black#38,Sicilian_Defense Sicilian_Defense_Modern_Variations
k3c3s,8/1p5p/p7/P3k1p1/5N2/5bP1/1P3K1P/8 b - - 1 39,g5f4 f2f3 f4g3 f3g3 e5f5 g3h4,2470,90,83,82,crushing defensiveMove endgame hangingPiece long master masterVsMaster,https://lichess.org/GORQ0tgm/black#78,
k4PtZ,R7/1p3p2/2p1pPk1/2P1P3/2p1P3/3bBK2/Pr6/8 b - - 2 46,c4c3 a8h8 d3e4 f3e4,2491,95,90,394,crushing endgame master masterVsMaster quietMove short,https://lichess.org/vx8fE7IZ/black#92,
k7GjF,r4rk1/pp3p2/3p1q1p/2pPbPpn/2P5/4B1P1/PPBQ3P/1R3RK1 b - - 2 21,e5b2 b1b2 f6b2 f5f6,2433,87,85,97,advantage master masterVsMaster middlegame sacrifice short,https://lichess.org/vVGMOJ4x/black#42,
k8DDA,3qr1k1/p2bbp1p/4pnp1/3pP1B1/3P3Q/3BPR2/r2N2PP/3R2K1 b - - 0 19,f6e4 d2e4 d5e4 f3f7,2447,81,82,116,crushing master masterVsMaster middlegame short,https://lichess.org/GxDrY43H/black#38,Queens_Pawn_Game Queens_Pawn_Game_London_System
k8s89,r3r1k1/1b3ppp/p5q1/np1R1N2/8/1B6/PPP2PPP/1K1Q3R w - - 5 22,h1e1 b7d5 b3d5 g6f5 d5a8 e8a8,2467,77,84,93,capturingDefender crushing long master masterVsMaster middlegame,https://lichess.org/GesKEm19#43,
k9ajm,8/1pk5/6p1/PK4P1/8/8/8/8 b - - 0 53,c7c8 b5c4 c8d8 c4d4,2488,82,92,2295,crushing defensiveMove endgame master masterVsMaster pawnEndgame short zugzwang,https://lichess.org/Tk6MuNn6/black#106,
kIXgI,8/1p4p1/p7/3kB3/2pn1P2/5KP1/PP6/8 w - - 0 36,e5d4 d5d4 g3g4 d4d3 g4g5 d3c2 f4f5 c2b2 f5f6 g7f6 g5g6 c4c3 g6g7 c3c2 g7g8q c2c1q,2404,84,80,56,advancedPawn crushing endgame master masterVsMaster promotion veryLong,https://lichess.org/pqXj2Mrl#71,
kJWev,5r1k/ppp3pp/2P1n3/1Pb1p2q/2Q1P1n1/5NP1/PB1R1PK1/5R2 b - - 0 22,f8f3 c4e6 f3f8 f1h1 g4e3 f2e3 h5f3 g2h2,2478,79,93,1268,crushing defensiveMove hangingPiece master masterVsMaster middlegame veryLong,https://lichess.org/AvHW36JT/black#44,
kLDIV,8/5p2/5k2/4pr2/1P1P4/4K3/5p2/5R2 w - - 0 89,f1f2 e5d4 e3e2 f5f2 e2f2 f6e5 f2e2 f7f5 b4b5 f5f4 b5b6 e5d6 e2d3 f4f3 b6b7 d6c7 b7b8r c7b8,2496,86,93,1115,crushing endgame master masterVsMaster quietMove rookEndgame veryLong,https://lichess.org/5HTDwhJF#177,
kNLBD,r2q1rk1/pp2bpp1/5n2/4B1N1/2p2N2/7Q/PP2KP1P/n5R1 b - - 0 19,f8e8 g5f7 d8d3 f4d3,2424,91,89,663,crushing master masterVsMaster middlegame short,https://lichess.org/rStIdr9u/black#38,Caro-Kann_Defense Caro-Kann_Defense_Main_Line
kNpQC,r3r1k1/pp1n1pbp/1q1p1np1/2pP2B1/2P2QP1/1PN2N2/P4PP1/R4RK1 b - - 0 15,f6g4 c3a4 b6c7 f4g4,2410,82,92,1801,advantage intermezzo master masterVsMaster middlegame short,https://lichess.org/tciRHbTJ/black#30,Kings_Indian_Defense Kings_Indian_Defense_Averbakh_Variation
kOOaX,2r2rk1/pp3pb1/3p1np1/3Pp1Bp/4P2q/5PR1/PP1Q1P2/R3K1N1 b Q - 1 20,h4h2 e1f1 f6h7 g3h3 h2h3 g1h3,2402,82,42,56,advantage long master masterVsMaster middlegame trappedPiece,https://lichess.org/RveMVCsy/black#40,
kQTTJ,r4rk1/1b1N1ppp/3bpn2/ppq5/5B2/1BP5/PP2QPPP/3R1RK1 b - - 3 17,c5c6 d7f6 g8h8 f6d5,2430,92,90,4342,advantage defensiveMove kingsideAttack master masterVsMaster middlegame short superGM,https://lichess.org/CiVN3Xxn/black#34,Caro-Kann_Defense Caro-Kann_Defense_Two_Knights_Attack
kU1os,8/8/b2p1p2/3P2p1/2p1Pp1p/1pK2P1P/6k1/R7 b - - 1 62,g2h3 a1a6 g5g4 a6d6,2452,78,91,179,advantage endgame hangingPiece master masterVsMaster short,https://lichess.org/gn85TyeP/black#124,
kU9gd,5r1k/6b1/2p3Qp/1p1n4/3q4/rP5P/2B2PP1/1R2R1K1 b - - 0 27,d5f6 e1e7 f8g8 e7f7,2431,81,85,107,crushing master masterVsMaster middlegame short,https://lichess.org/fWZ4KaCY/black#54,
kVLM6,r1br2k1/qp2bppp/2p1nn2/3p4/P1P5/1NNP2P1/P1Q2PBP/1RB1R1K1 w - - 0 18,c1e3 d5d4 b3d4 d8d4,2453,96,89,529,advantage fork master masterVsMaster middlegame short,https://lichess.org/cAGS0CI2#35,English_Opening English_Opening_Kings_English_Variation
kVXrT,8/7p/3k2p1/1p4P1/1PpK4/2P2b2/7P/1B6 b - - 0 57,f3c6 b1e4 c6d7 e4d5,2430,79,84,269,bishopEndgame crushing endgame master masterVsMaster short,https://lichess.org/3N0YFQEz/black#114,
kW5IR,8/p1p1kpb1/3p4/3Q4/2P3q1/6B1/Pr3PP1/2KR4 b - - 1 26,g4e2 g3d6 e7f6 d6e5 f6g6 d5c6 g6g5 f2f4,2487,82,83,308,advantage endgame fork master masterVsMaster veryLong,https://lichess.org/sTKKLdwm/black#52,
kYJN3,8/4k3/2pRn3/1pPb2p1/1P1P1pK1/4p2P/8/6B1 w - - 0 52,h3h4 g5h4 g4h4 e6d4,2490,82,59,61,crushing endgame master masterVsMaster short,https://lichess.org/sXU2Hc9t#103,
kcxND,8/8/p5R1/4pp1P/1p3k2/5P2/r4PK1/8 b - - 0 43,b4b3 h5h6 b3b2 h6h7 b2b1q h7h8q a2f2 g2f2,2448,85,88,85,advancedPawn advantage endgame master masterVsMaster promotion rookEndgame veryLong,https://lichess.org/8w4K3Ebb/black#86,
khZNc,8/ppp2Qpk/6r1/7p/2P3PP/5P2/qPK5/4R3 b - - 0 29,b7b5 f7f5 a2c4 c2b1 c4c6 g4h5,2453,77,83,243,crushing defensiveMove endgame long master masterVsMaster,https://lichess.org/avMZED5r/black#58,
kiQq9,8/7p/5k2/4p3/4K1P1/8/5P2/8 b - - 0 44,f6g5 f2f3 g5f6 e4d5 h7h6 d5d6 h6h5 g4h5,2420,90,85,103,crushing endgame master masterVsMaster pawnEndgame quietMove veryLong,https://lichess.org/4Ekve1ca/black#88,
kiq2j,r2r3k/1Q5p/2p3p1/1p3p2/4q2P/P3PNP1/1b3PK1/3R1R2 b - - 0 29,b2a3 d1d7 d8d7 b7a8 h8g7 a8a3,2481,86,88,802,crushing deflection fork long master masterVsMaster middlegame,https://lichess.org/hLOpj9Iq/black#58,
kiuJE,8/p5k1/B1p3p1/2Pp1p2/R7/5P2/P3RPK1/1r1r4 w - - 6 43,g2g3 d1h1 g3f4 h1h4,2456,83,81,42,advantage endgame master masterVsMaster quietMove short,https://lichess.org/9EthvPgv#85,
kj0h5,4rrk1/5pqn/3p2p1/p1pPn3/1p2PN2/1P3PN1/P5PQ/4RK1R b - - 1 24,a5a4 g3f5 g6f5 f4h5,2495,89,83,190,crushing master masterVsMaster middlegame sacrifice short,https://lichess.org/4oh9tj1z/black#48,
kolhg,r2r2k1/bp3ppp/p7/3Pn3/1P2p1bq/PQN1P3/1B3PPP/R2R1NK1 w - - 0 19,d1d2 e5f3 g2f3 e4f3 c3e2 f3e2,2455,106,90,719,advancedPawn crushing kingsideAttack long master masterVsMaster middlegame sacrifice,https://lichess.org/NANPPz3E#37,English_Opening English_Opening_Symmetrical_Variation
kqXIk,3r2r1/p1n3bk/2p4p/5p2/Np2pB1q/1P2P2N/1PP2P2/2K2Q1R b - - 5 26,c7d5 h3g5 h6g5 f4g5 h4h1 f1h1,2402,101,38,40,advantage long master masterVsMaster middlegame pin sacrifice,https://lichess.org/W6sK3mMo/black#52,
ksTs7,3r4/p1p5/6p1/5pk1/1qB3n1/4PKN1/6P1/2Q4R w - - 0 35,e3e4 d8d2 e4f5 g4e5,2418,81,73,42,crushing defensiveMove master masterVsMaster middlegame short,https://lichess.org/ruExArpo#69,
ktKpK,2r5/p4qbk/3Qb1p1/N1p3Bp/1rp1P2P/3p1PP1/PP4B1/1RR3K1 w - - 0 26,g5d2 b4b6 d6f4 f7f4,2484,102,90,776,advantage master masterVsMaster middlegame short,https://lichess.org/VZs71Wpz#51,
kzuAe,2k5/1p4p1/pRbBpr1r/2Pp2Kp/5PnP/P2B4/8/1R6 b - - 3 39,g4h2 b6c6 c8d8 f4f5,2485,101,71,19,advantage master masterVsMaster middlegame short,https://lichess.org/JynULV4v/black#78,
l1XOC,rnb2rk1/1p3p1p/p4p2/2qN4/4P3/3B4/PPPQ2PP/R6K b - - 1 16,c8e6 d2h6 c5d5 e4d5,2409,96,87,161,crushing master masterVsMaster middlegame short,https://lichess.org/H3cFs34j/black#32,Sicilian_Defense Sicilian_Defense_Kan_Variation
l1qxa,r4rk1/pB3pp1/4R3/3p3p/6n1/2P4K/PP3qPP/RNBQ4 w - - 0 17,d1f3 f2g1 c1f4 f7e6,2474,88,73,66,crushing master masterVsMaster middlegame short,https://lichess.org/b3LtH8ME#33,Sicilian_Defense Sicilian_Defense_Alapin_Variation
l29xT,8/2k5/8/P5p1/4pp1p/6P1/5PKP/8 w - - 2 41,g2h3 h4g3 h2g3 f4f3,2490,82,76,106,crushing endgame master masterVsMaster pawnEndgame short,https://lichess.org/UofQ00QC#81,
l2n7a,6r1/8/8/4Rp1p/P4K1P/3p1PP1/8/3k4 w - - 3 45,e5f5 g8d8 f5b5 d1c1,2430,103,83,34,crushing defensiveMove endgame master masterVsMaster quietMove rookEndgame short,https://lichess.org/mCAHcnWE#89,
l4ZlR,8/6k1/pp1qp1n1/5p1Q/1P6/P1N2PP1/6K1/8 w - - 3 42,h5g5 d6d3 g5c1 g6e5,2482,86,87,472,crushing endgame master masterVsMaster short,https://lichess.org/9iEOi9uG#83,
l6L4n,8/7p/3kp3/pp2p1p1/4K1P1/PP5P/2P5/8 b - - 0 44,h7h6 b3b4 a5a4 c2c3 d6c6 e4e5,2410,82,95,502,crushing endgame long master masterVsMaster pawnEndgame quietMove zugzwang,https://lichess.org/qmrGkZly/black#88,
l6LG7,5rk1/pp1b1pb1/3p2pB/3Np2n/2r1P1p1/1N3q2/PPPQ4/1K4RR b - - 1 20,f8e8 h6g7 g8g7 h1h5,2402,91,86,283,advantage master masterVsMaster middlegame short,https://lichess.org/Kh7bijK1/black#40,
lAaRK,6B1/8/3k3P/1p4p1/p5n1/2P1R3/Pr6/6K1 w - - 1 35,h6h7 b2b1 e3e1 b1e1 g1g2 g4e3,2458,81,84,58,advantage endgame exposedKing long master masterVsMaster,https://lichess.org/tRICWpgK#69,
lBZfF,rn2qbk1/1bRr1ppp/pp2p3/8/3NP1Q1/1P4P1/PB3PBP/3R2K1 w - - 11 19,d4e6 e8e6 d1d7 e6g4,2494,83,49,48,advantage master masterVsMaster middlegame short,https://lichess.org/u6BywrOe#37,
lFbPN,1k4r1/1p6/P1P5/P4Kp1/5n2/2N2r2/3R4/1R6 b - - 0 32,f3c3 b1b7 b8a8 d2d7,2427,86,90,629,crushing defensiveMove endgame master masterVsMaster short,https://lichess.org/A8GlDnK2/black#64,
lKC1q,8/5Bn1/5p1p/k2KpP2/6P1/8/8/8 b - - 4 56,h6h5 g4h5 g7f5 f7g6,2465,93,89,778,crushing endgame master masterVsMaster short,https://lichess.org/IEvSlNr6/black#112,
lKE6Z,1r4k1/5ppp/B1p1p3/q2n4/3P2Q1/6P1/1P3P1P/2R3K1 w - - 0 26,c1c6 d5b4 c6d6 b4a6,2496,96,86,391,crushing endgame master masterVsMaster short,https://lichess.org/sxKrDVSP#51,
lLD77,6k1/5pp1/5q1p/8/4R3/6Q1/r2r1PPP/4R1K1 w - - 2 29,e4f4 f6e5 g3e3 e5e3,2481,105,90,429,crushing endgame master masterVsMaster short,https://lichess.org/EaTOSn9R#57,
lW8wj,3n4/P6p/2bk3P/5KN1/8/8/8/8 b - - 2 54,d6c7 f5f6 c6d5 g5h7,2419,83,69,62,crushing endgame master masterVsMaster short,https://lichess.org/GHD9ktW7/black#108,
lXozd,8/4b1pk/3Np2p/4P3/p1Pp2PP/3P2P1/6K1/8 w - - 0 39,c4c5 a4a3 c5c6 e7d8 d6b7 a3a2 b7d8 a2a1q,2420,90,90,764,advancedPawn crushing endgame master masterVsMaster promotion veryLong,https://lichess.org/Fmm4GNtM#77,
lajYp,6k1/5pp1/p2Bp2p/3b4/1Q1Pp3/1P2P2P/P3qPP1/6K1 b - - 0 36,e2a2 b4b8 g8h7 d6f8,2454,107,53,25,crushing endgame master masterVsMaster short,https://lichess.org/SZCcbcu7/black#72,
ld9fM,r2qkb1r/pp3pp1/2p1p1p1/3nP3/3N4/1B6/PP4PP/R1BQK2R w KQkq - 0 15,e1g1 f8c5 g2g3 d8b6,2432,80,91,4863,advantage master masterVsMaster opening short,https://lichess.org/BtS6SfQu#29,Queens_Gambit_Accepted Queens_Gambit_Accepted_Central_Variation
ldggn,3r2k1/3r4/ppqb1BP1/2pR4/2n1P2p/4P3/P5Q1/6RK b - - 0 31,c4e3 d5h5 d7g7 f6g7,2417,83,84,47,crushing master masterVsMaster middlegame short,https://lichess.org/5mSHWtP4/black#62,
leMcz,3r4/5p1k/5Qpp/pP1bP2P/1q6/5N2/4RPPK/2r5 b - - 0 44,d5f3 f6f7 h7h8 f7f6 h8g8 f6d8 b4f8 d8f8 g8f8 g2f3,2429,91,90,854,crushing endgame fork master masterVsMaster veryLong,https://lichess.org/7ObgFa5u/black#88,
leeVm,8/p4p1k/5p2/8/5P2/8/P4KP1/8 b - - 1 48,h7g7 f2e3 f6f5 e3d4,2400,85,84,125,crushing defensiveMove endgame master masterVsMaster pawnEndgame short,https://lichess.org/ZFM61NWL/black#96,
lezQr,8/3r1k1p/p1p3p1/5p2/1PN5/P1K2PbP/6P1/4R3 w - - 1 34,c4e5 f7e6 e1e2 g3e5,2404,90,90,1623,crushing defensiveMove endgame master masterVsMaster short,https://lichess.org/8MNqU6LO#67,
lnDTE,3k4/p3r1p1/2R5/2pB1PP1/2Pb4/1P2p3/4K3/8 b - - 0 54,d8e8 f5f6 g7f6 g5f6 d4f6 c6f6,2420,82,90,1417,crushing endgame long master masterVsMaster,https://lichess.org/OOrd2nZk/black#108,
lojsY,r2qk2r/2p2ppp/p2p1n2/1p2p3/4P3/1BNP1b1P/PPP1NP2/R2Q1RK1 w kq - 3 15,d1d2 f6g4 c3d5 d8h4 e2d4 e5d4 d2f4 h4h3 f4f7 e8f7,2444,92,80,32,advantage clearance master masterVsMaster middlegame veryLong,https://lichess.org/VNawPMnW#29,Ruy_Lopez Ruy_Lopez_Morphy_Defense
lr2vy,3k4/1p6/p3PN1p/2PP1Kp1/8/8/P7/4r3 b - - 2 46,e1f1 f5g6 f1e1 g6f7,2470,78,88,850,crushing defensiveMove endgame master masterVsMaster short superGM,https://lichess.org/no2tK4QL/black#92,
lsEuc,5k2/1p3p1p/4p1p1/1P6/3Pp3/4PPP1/6KP/8 b - - 0 34,f7f5 f3e4 f5e4 g2h3,2456,78,91,3343,crushing defensiveMove endgame master masterVsMaster pawnEndgame short,https://lichess.org/d1taqlYl/black#68,
lyqkq,r3r1k1/1p1qnpp1/p1nb3p/3p3b/2PP2P1/1P1B1N1P/1B1NQP2/R3R1K1 b - - 0 17,e7g6 d3f5 e8e2 f5d7,2434,80,92,2142,advantage master masterVsMaster middlegame short superGM,https://lichess.org/XeGib56J/black#34,Sicilian_Defense Sicilian_Defense_Delayed_Alapin_Variation
