PuzzleId,FEN,Moves,Rating,RatingDeviation,Popularity,NbPlays,Themes,GameUrl,OpeningTags
0BSZ7,r3k2r/1p2ppbp/pq1p2p1/8/3nPPn1/2NB4/PPPQ2PP/R1B2RK1 w kq - 2 16,c3d5 d4e2 g1h1 b6g1 f1g1 g4f2,2202,83,93,6523,doubleCheck kingsideAttack long mate mateIn3 middlegame sacrifice smotheredMate,https://lichess.org/QUuXvSWo#31,Pirc_Defense Pirc_Defense_Austrian_Attack
Mhfvi,2k4r/ppp4p/1b2p3/1Nq4r/2P3n1/1Q4B1/PP4PP/R4R1K w - - 4 22,b3c3 c5g1 f1g1 h5h2 g3h2 g4f2,2295,86,93,170984,kingsideAttack long mate mateIn3 middlegame sacrifice smotheredMate,https://lichess.org/cxk849ie#43,
m8jTK,r4rk1/ppp2ppp/1bbp1n2/5q2/2P5/1PN3P1/P3NPBP/R1BQR1K1 w - - 0 14,g2c6 f5f2 g1h1 f6g4 c6g2 f2g1 e1g1 g4f2,2231,85,94,165871,attackingF2F7 kingsideAttack mate mateIn4 middlegame sacrifice smotheredMate veryLong,https://lichess.org/rUEgFy89#27,English_Opening English_Opening_Kings_English_Variation
rekHm,2rqkb1r/3b1p1p/p1npp1p1/1p4Pn/2p1NP1Q/P3P2P/BPPP4/R1B1K1NR b KQk - 1 15,c6e7 e4d6,2288,83,94,4021,mate mateIn1 middlegame oneMove smotheredMate,https://lichess.org/6v4njS5l/black#30,Vant_Kruijs_Opening Vant_Kruijs_Opening_Other_variations
tyuig,r3k2r/2p2p2/p1ppb3/2b1P1p1/3q2n1/2NB2B1/PPPQ2PP/R4R1K w kq - 2 17,d2g5 d4g1 f1g1 h8h2 g3h2 g4f2,2215,87,93,171204,kingsideAttack long mate mateIn3 middlegame sacrifice smotheredMate,https://lichess.org/FMf5IQqn#33,Scotch_Game Scotch_Game_Classical_Variation
