PuzzleId,FEN,Moves,Rating,RatingDeviation,Popularity,NbPlays,Themes,GameUrl,OpeningTags
OqXBN,r2qbrk1/1p1n1pp1/p3pn1p/2b5/4N3/1P4QP/PBP2PP1/2KR1B1R b - - 0 16,d8e7 d1d7 f6h5 d7e7 h5g3 e4c5,2642,87,92,862,capturingDefender crushing long middlegame,https://lichess.org/KsJBmvLv/black#32,Nimzo-Larsen_Attack Nimzo-Larsen_Attack_Other_variations
P8aXM,R1k1r3/2p5/6KP/8/1r1b4/5N2/2R1p3/8 b - - 1 44,c8d7 a8e8 d7e8 c2e2 e8f8 f3d4 b4d4 e2f2,2642,108,86,861,attraction capturingDefender crushing endgame veryLong,https://lichess.org/ZXaA4AE0/black#88,
PZDt2,1Rr3k1/5ppp/4pq2/P1bp4/2r5/3QP1P1/5P1P/1R4K1 b - - 1 28,c5d6 d3c4 d5c4 b8c8 d6f8 a5a6,2670,99,87,230,capturingDefender crushing long master masterVsMaster middlegame pin,https://lichess.org/VPGlWmiI/black#56,
PtOdW,8/1p3Q1k/2r2pp1/1Pn5/4NqP1/5P2/6KP/8 b - - 1 38,h7h6 g4g5 f6g5 f7f4 g5f4 b5c6 b7c6 e4c5,2610,79,91,751,capturingDefender crushing endgame master veryLong,https://lichess.org/PBQUqqmK/black#76,
Pxu2e,2r1r1k1/p1b2p1p/2pq2p1/3p4/3Pn3/P3P1PP/4BP2/2RQBRK1 w - - 0 24,d1a4 e4f2 f1f2 d6g3 g1f1 g3h3,2666,90,88,239,capturingDefender crushing kingsideAttack long master middlegame,https://lichess.org/Eo8SLf5J#47,
QDoE9,r3r1k1/2q2pp1/7p/pQ2b3/3p4/1B1P2Pb/PP3P1P/RN2R1K1 w - - 3 21,b5c4 a5a4 b3a4 c7c4 d3c4 a8a4,2654,107,87,210,advantage capturingDefender deflection intermezzo long middlegame,https://lichess.org/ldrnqgUp#41,
QOgFN,r1b1kb1r/ppp1pppp/2n2n2/qN6/8/4B3/PPP2QPP/2KR1BNR b kq - 7 9,f6e4 f2e1 c8d7 e1a5 c6a5 b5c7,2657,113,90,935,capturingDefender crushing long opening,https://lichess.org/CDiWzsTH/black#18,Blackmar-Diemer_Gambit Blackmar-Diemer_Gambit_Ryder_Gambit
QhmQ4,8/6kp/2R1p1p1/3pq3/1P2n3/4Q2P/5PP1/r3N1K1 w - - 0 31,f2f3 d5d4 c6e6 d4e3 e6e5 a1e1,2699,104,91,160,capturingDefender crushing endgame long pin,https://lichess.org/R2tocF10#61,
QthBy,4r1k1/6p1/2p4p/2N3rq/P3p3/1PQR1bPP/5P1K/4R3 w - - 0 34,c3c4 g8h8 d3f3 h5f3 c5e4 e8e4 c4e4 f3f2,2636,81,81,172,capturingDefender crushing defensiveMove middlegame veryLong,https://lichess.org/bz50Eniz#67,
R2r7E,2r1r1k1/5pp1/R6p/1R2p3/4n3/2p2N1P/2P2PP1/6K1 w - - 0 30,f3e5 c8c5 b5c5 e4c5 a6a3 e8e5,2651,91,92,1899,capturingDefender crushing endgame long,https://lichess.org/lU2QM95t#59,
RVKcK,8/1Q4pk/6bp/P7/1P1r4/6P1/4q1BP/5R1K w - - 1 42,a5a6 d4d1 b7f3 e2f3 g2f3 d1f1 h1g2 f1a1,2602,80,92,502,advantage capturingDefender endgame fork master pin veryLong,https://lichess.org/NPbbAUJ4#83,
RWmvN,8/6k1/1p1q1pp1/p2p3p/P1PQ3P/1P4P1/5P1K/8 b - - 0 32,d6c5 d4c5 b6c5 c4d5 g7f7 h2g2 f7e7 g2f3 e7d6 f3e4 f6f5 e4e3,2672,107,87,169,advantage capturingDefender defensiveMove endgame queenEndgame veryLong zugzwang,https://lichess.org/CkArReeQ/black#64,
RyRRi,1kr4r/pppQR3/5q2/2P5/1PN5/P2P1P1p/6P1/4R1K1 w - - 2 40,d7b5 h3g2 b5d7 f6f3 d7c8 h8c8,2661,87,97,128,advancedPawn advantage capturingDefender long master middlegame,https://lichess.org/kw8FmAy4#79,
SC6Pj,1r5r/p4qk1/1p5p/1PpPp1p1/3p4/P2P1PQR/1K2P3/7R b - - 4 42,f7d5 h3h6 h8h6 g3g5 h6g6 g5e7 d5f7 e7e5,2613,83,91,1924,capturingDefender crushing deflection endgame sacrifice veryLong,https://lichess.org/8Ytb7k8N/black#84,
SHoui,8/7p/4b1p1/8/1KN1k3/1P1ppN1P/6P1/8 w - - 2 39,c4d6 e4f4 b4c3 d3d2 f3d2 e3d2 c3d2 e6b3 d2e2 f4g3 h3h4 g3g2,2608,111,91,1034,advancedPawn capturingDefender crushing endgame veryLong,https://lichess.org/9LgOUdcq#77,
SLcsm,r6k/1pp3p1/p7/3Pp3/5p1p/PBP2P2/KP1QRPr1/6q1 b - - 3 27,h4h3 e2e5 g2g6 d2f4 g6h6 e5e6,2674,86,39,49,capturingDefender crushing endgame long,https://lichess.org/8goMZrAl/black#54,
SQ3WI,4k2r/2p3p1/ppn4p/4p3/P3n3/B1Pr1N2/5PPP/2R1R1K1 b k - 3 19,e4c3 a3b2 c3a4 c1c6 a4b2 f3e5,2629,93,74,94,advantage capturingDefender long middlegame,https://lichess.org/ktYlPil3/black#38,Italian_Game Italian_Game_Anti-Fried_Liver_Defense
SR06D,r2r1k2/2R5/3p1p2/1p2pBp1/4Pb1p/2P5/1P6/1K1R4 b - - 0 36,h4h3 d1d3 g5g4 f5g4 d8e8 d3h3,2656,116,88,447,capturingDefender crushing endgame long,https://lichess.org/o05WC2tA/black#72,
SlCsp,2r4r/pbp2kpp/1p1pNp2/1q1Pn3/5PP1/1PQ4P/P2K2B1/2R4R b - - 0 26,b7d5 e6d4 b5c5 c3c5 d6c5 g2d5,2681,115,90,1119,capturingDefender crushing long middlegame,https://lichess.org/ewlt3Qxn/black#52,
StNzn,r1bqk1r1/pp3p1Q/4p3/8/6n1/1P6/1B1P1PPP/3K1B1R b q - 2 20,g4f6 f1b5 c8d7 b2f6 d8f6 h7g8 e8e7 g8a8 f6a1 d1c2,2605,114,89,442,capturingDefender crushing middlegame skewer veryLong,https://lichess.org/0k7H6M4N/black#40,
SxFrF,r2qr1k1/ppp2ppp/3b1n2/3P4/5Q2/1B6/PPP3PP/RNB2RK1 w - - 1 14,f4d4 f6e4 d4d3 d8h4 d3h3 d6c5 c1e3 h4h3 g2h3 c5e3,2630,87,80,158,advantage capturingDefender clearance kingsideAttack opening quietMove veryLong,https://lichess.org/DrqThEmB#27,Kings_Gambit_Accepted Kings_Gambit_Accepted_Fischer_Defense
TFAti,5rk1/2pq2rp/p3p1p1/1p1bP1N1/3P4/2P5/1PQ3PR/1K5R b - - 0 31,d7e7 g5h7 g7h7 c2g6 e7g7 g6g7 h7g7 h2h8 g8f7 h1f1,2667,102,96,487,advantage capturingDefender deflection kingsideAttack middlegame veryLong,https://lichess.org/V5vDIIcR/black#62,
TPqIy,2r2rk1/1p1b1p1p/pq2p1p1/3pP1N1/3P3P/bPNQP3/P1R3P1/5RK1 b - - 0 18,h7h6 g5f7 f8f7 d3g6 f7g7 c3d5 g7g6 c2c8 d7c8 d5b6,2670,114,87,168,capturingDefender crushing discoveredAttack kingsideAttack middlegame sacrifice veryLong,https://lichess.org/zdl387yi/black#36,French_Defense French_Defense_Knight_Variation
TyGnM,6k1/Q2B1p1p/2pb2p1/3p4/3Pp3/2q1P1P1/Pr3PP1/5RK1 w - - 0 23,a2a4 b2f2 d7e8 d6g3 e8f7 g8g7 f7e6 g7h6 f1f2 c3e1 f2f1 g3f2,2648,86,70,93,capturingDefender crushing endgame kingsideAttack sacrifice veryLong,https://lichess.org/RU9mXSww#45,
TyOph,1r6/k4pp1/Ppr5/3p4/4p1p1/4P3/1Q1KNq2/RR6 w - - 0 37,b2g7 b8c8 b1b2 c6c3 g7c3 c8c3 d2c3 f2e3,2682,93,97,175,attraction capturingDefender crushing middlegame pin quietMove veryLong,https://lichess.org/C9ikVPmY#73,
U4uHV,1r1q1rk1/2p3pp/p1b1p3/1p2n3/3PN2b/P1PQ2P1/1PB5/R1B1K2R w KQ - 1 20,d4e5 c6e4 d3d8 h4g3 e1e2 e4f3 e2e3 b8d8 c2h7 g8h8,2661,112,87,688,capturingDefender crushing exposedKing fork middlegame sacrifice veryLong,https://lichess.org/rYxnpUid#39,
U9xuT,2kr3r/nb1p1Q1p/p2R2p1/1pB1P3/1P2q3/5N2/1KP1n1PP/7R w - - 0 24,c5a7 h8f8 f7b3 f8f3 g2f3 e4e5,2674,87,95,876,advantage capturingDefender long middlegame,https://lichess.org/EhsgttIR#47,
UMHXM,2krr3/p1p2ppp/8/1qp5/1P2b1P1/P1KN3P/2P5/RN1QR3 w - - 0 23,b4c5 e4d3 e1e8 b5c5 c3b2 c5b6 b2c1 d8e8,2609,92,85,42,capturingDefender crushing exposedKing intermezzo middlegame veryLong,https://lichess.org/AYBdMWHc#45,
UcKUt,4kr2/p2p1p1p/2p1p3/2n1P3/3R4/P4Q1P/1rq2PP1/3R2K1 b - - 6 24,c2g6 d4d7 g6f5 f3c6 f5f2 g1h1 f2g2 c6g2 b2g2 d7d8 e8e7 d8f8,2668,107,90,940,advantage capturingDefender middlegame veryLong,https://lichess.org/gmPZFw9I/black#48,
UhDPq,b7/5p2/2k3p1/3NK1P1/5P2/8/8/8 b - - 9 62,c6c5 d5e7 a8b7 e5f6 c5d4 f6f7 d4e4 e7g6 e4f5 g6e7 f5f4 g5g6,2625,82,77,152,capturingDefender crushing endgame master veryLong,https://lichess.org/l58YZ5zh/black#124,
UtBZ1,1r6/1p2k3/p2pn1qP/5R2/4B1n1/2PPB3/PP5K/R2Q4 w - - 1 31,h2h3 g4e3 d1f3 g6h6 h3g3 b8g8 g3f2 e3f5,2623,114,83,20,advantage capturingDefender exposedKing fork hangingPiece middlegame veryLong,https://lichess.org/OKn2F4cm#61,
Uu8qN,2r5/2q1rpk1/1R1R2pp/1p2p3/1P2bn2/1BP1Q2P/1B3PP1/6K1 b - - 3 37,e4g2 c3c4 g7h7 b2e5 b5c4 e3f4 c4b3 g1g2,2604,86,81,82,advantage capturingDefender discoveredAttack middlegame veryLong,https://lichess.org/1lzAj3fP/black#74,
UvOIW,5rk1/R5bp/4n1pN/1ppqn3/3pN1P1/3P3P/1PP5/2B2QK1 b - - 4 28,g7h6 f1f8 e6f8 e4f6 g8h8 c1h6 d5f7 a7f7 e5f7 h6f8,2679,115,90,550,advantage capturingDefender fork middlegame sacrifice veryLong,https://lichess.org/o1cyjMKc/black#56,
V0nh1,4r1k1/1bQqr1pp/1p3b2/p2p4/3P1n2/PB2NN2/1P3PP1/2R1R1K1 b - - 5 29,f4d3 e3d5 b7d5 c7d7 e7d7 e1e8 g8f7 c1c8,2683,91,85,50,capturingDefender crushing defensiveMove middlegame veryLong,https://lichess.org/lvjA31Fw/black#58,
V3MjZ,r3k2r/1bq2ppp/p2pp3/1pn3bP/3NN3/P2B1Q2/1PP2PP1/1K1R3R b kq - 3 15,f7f5 d4e6 c5e6 f3f5,2645,99,90,1411,capturingDefender crushing master middlegame short,https://lichess.org/Iklgwm2Y/black#30,Sicilian_Defense Sicilian_Defense_Najdorf_Variation
V7v5G,r4r1k/1bqn1p2/p1N2bp1/2Pp1B2/RPnN1P2/2B1P3/2Q3PP/5RK1 b - - 0 21,b7c6 d4c6 c4e3 c2b2 d5d4 c3d4 c7c6 f5d7 c6d7 d4f6,2652,85,79,94,advantage capturingDefender middlegame quietMove veryLong,https://lichess.org/fz62S5R4/black#42,
W8rNM,3rr1k1/2R2pp1/1p5p/p2b4/P2P4/1qQB1P1P/6P1/1R4K1 b - - 10 32,b3a4 d3c2 a4a2 b1a1 e8e3 c7d7 d8e8 a1a2 e3c3 d7d5,2636,87,50,84,capturingDefender crushing middlegame veryLong,https://lichess.org/buwCc38V/black#64,
WGe40,2kr3r/p1Bq1p2/Ppn4b/1N1b4/3p4/6Q1/1P3PPP/2R1R1K1 b - - 8 26,d8g8 c1c6 d7c6 b5a7 c8d7 e1e7 d7e7 a7c6,2672,86,92,999,attraction capturingDefender crushing exposedKing fork middlegame veryLong,https://lichess.org/AqiDyyC9/black#52,
WTcaA,r1r3k1/4ppbp/6p1/2B2b2/8/1P1B1P2/P1P3PP/2KR3R w - - 3 20,b3b4 g7c3 d3c4 c3b4 c5b4 c8c4 c2c3 a8a2,2604,86,71,110,advantage capturingDefender middlegame veryLong,https://lichess.org/N2rPFVuq#39,
WW3WX,r1b3rk/4qpb1/p3pn1p/1p4N1/3p3Q/3B2R1/PPP4P/2K2R2 b - - 3 24,e6e5 g3f3 h6h5 f3f6 g7f6 h4h5,2652,123,91,482,capturingDefender crushing kingsideAttack long middlegame pin,https://lichess.org/ac2z3dpq/black#48,
WkE7c,r2qkb1r/ppp2ppp/2n5/3pP3/3P2b1/2NBpN2/PPP3PP/R2Q1RK1 b kq - 3 10,g4f3 d1f3 d8e7 c3d5 c6d4 f3e4,2684,112,87,424,advantage capturingDefender long opening,https://lichess.org/Jt4ABlRa/black#20,Kings_Gambit_Accepted Kings_Gambit_Accepted_MacLeod_Defense
X4UpL,r2qk2r/1p3pQp/p1n1b1n1/2Np4/3P4/2Pp4/PP3PPP/R1B1R1K1 b kq - 4 16,d8e7 c1g5 e7g5 e1e6 c6e7 e6g6 g5g6 g7h8,2627,94,77,102,capturingDefender crushing deflection middlegame veryLong,https://lichess.org/5moaZEOQ/black#32,French_Defense French_Defense_Tarrasch_Variation
XUyg7,k6r/pp6/2p4p/3nQ2n/3P4/1BP2PPP/PP1R3K/5q2 b - - 2 28,d5f6 b3f7 f1f3 f7h5 f3h5 e5f6,2615,86,54,58,capturingDefender crushing long middlegame,https://lichess.org/H0atNZ5L/black#56,
XVSag,1k2R3/npqr2p1/p2r3p/2P4P/1PQp1pP1/8/P1P2P2/1K1R4 b - - 1 32,d7d8 c5d6 c7c4 e8d8 a7c8 a2a3 d4d3 d1d3,2664,93,95,199,advantage capturingDefender middlegame pin quietMove veryLong,https://lichess.org/VyTJvoOf/black#64,
XfVXa,2QR4/5p1k/p5pp/2P5/1rN1n3/7P/5PPK/q7 w - - 2 35,c8d7 a1f6 d7d4 f6d4 d8d4 e4c5,2607,91,84,129,advantage capturingDefender endgame long,https://lichess.org/wVrdrJOn#69,
Xp7qm,r1bqr1k1/ppp1bppp/3p1n2/3P1P2/2P1PNP1/2N5/PP5P/R2QKB1R w KQ - 1 12,g4g5 f6e4 c3e4 c8f5,2606,90,74,106,advantage capturingDefender opening short,https://lichess.org/ejUKyRdb#23,Nimzowitsch_Defense Nimzowitsch_Defense_Kennedy_Variation
XwGbM,r6n/p2bk1p1/2p1p1p1/Pp1pP1P1/5N2/1P6/2P2PP1/2K4R b - - 0 23,a7a6 h1h8 a8h8 f4g6 e7d8 g6h8 d7e8 b3b4,2613,83,83,62,attraction capturingDefender crushing defensiveMove endgame fork veryLong,https://lichess.org/zcPmS0vt/black#46,
Y3KVc,1r5r/R3nkp1/3pp1p1/3p1p2/1pqP1N2/2P1P1QP/3K1PP1/1R6 b - - 1 22,c4c3 d2d1 f7f6 a7e7 f6e7 g3g6,2678,100,91,559,advantage capturingDefender deflection long middlegame,https://lichess.org/SIVpqGsh/black#44,
YHS9Q,4r2k/2p2Qbp/3p4/p1pPq3/2P2R2/2N3P1/PP4KP/8 w - - 5 28,c3e4 e8e7 f7f5 e5f5 f4f5 e7e4,2660,101,81,102,advantage capturingDefender endgame long,https://lichess.org/LcfFKvBA#55,
YZloF,r2q1rk1/pb1nbppp/2n1p3/4P1N1/PpBp4/5N2/1P2QPPP/R1BR2K1 b - - 3 14,d7e5 f3e5 e7g5 e5f7 f8f7 e2e6,2605,114,90,1825,advantage capturingDefender discoveredAttack long master opening,https://lichess.org/LCYpGBUK/black#28,Queens_Gambit_Accepted Queens_Gambit_Accepted_Normal_Variation
Yijkp,3rn1k1/p2r1p1p/1p2p1p1/q7/P1Rb1N2/6P1/1BR1QP1P/6K1 w - - 0 25,b2d4 d7d4 c4d4 d8d4 c2c8 a5a4 f4e6 d4d1 g1g2 a4d7,2665,121,91,497,advantage capturingDefender middlegame veryLong,https://lichess.org/2bR3cO65#49,
YroDB,r6k/pp1n2p1/2p2q2/3p1rp1/5PRp/3PP3/PBQ1K3/7R b - - 2 26,f6f7 f4g5 h8g8 g4h4 f7g6 h4h8 g8f7 h8a8,2664,91,93,450,advantage capturingDefender middlegame skewer veryLong,https://lichess.org/2r01c1iY/black#52,
YuGw9,3q1r1k/3n1pN1/pp1pbb1P/8/1Pr1N2P/P2QB3/5P2/R3K1R1 b Q - 0 27,f6a1 e4g5 d7f6 g7e6 f7e6 d3c4,2626,121,90,782,capturingDefender crushing long master middlegame,https://lichess.org/yMQ7I59o/black#54,
ZH9Nm,r3r1k1/p1q2pp1/3b4/1pp1n1P1/7Q/2P1B2P/PP2PP2/3RKN1R w K - 5 23,f1g3 e5g6 h4g4 d6g3 g4g3 c7g3 f2g3 e8e3,2649,86,92,1357,capturingDefender crushing discoveredAttack middlegame veryLong,https://lichess.org/mxXEq521#45,
ZJZKL,4r1k1/pQp3pp/3q1rp1/6n1/1P1n2P1/P3PP1P/3B2KN/2R2R2 w - - 0 22,c1c7 d4f3 h2f3 g5f3 f1f3 d6d2,2650,95,93,536,advantage capturingDefender long middlegame,https://lichess.org/3a7Df2fF#43,
ZKbXJ,1r1q1rk1/1p3pbp/pN4p1/2P1p3/1PB1bnQ1/P3B3/6PP/2R2RK1 b - - 1 25,e4g2 f1d1 g2h3 g4g3 d8e7 e3f4 e5f4 g3h3,2693,92,94,993,advantage capturingDefender middlegame veryLong,https://lichess.org/MSQMNwQP/black#50,
ZPRC8,6rk/7p/5p2/7q/Q4PrP/2P3P1/P5RK/5R2 w - - 1 32,a4d7 g4g3 f1f2 h5h4 h2g1 g8b8,2637,87,70,73,advantage capturingDefender defensiveMove endgame long master,https://lichess.org/yXRyjYVp#63,
ZmjJl,5rk1/p4ppp/3pnR1B/2r5/4P1Q1/8/Pq4PP/5R1K b - - 8 24,b2e5 f6f5 e5c3 f5f7 f8f7 g4e6 c5f5 e4f5,2665,116,90,2304,advantage capturingDefender discoveredAttack master middlegame pin veryLong,https://lichess.org/76TgaePl/black#48,
a2bHB,4Q3/p1q3pk/4p2r/3p4/2p2b2/2P5/PP4PP/4RRK1 w - - 0 27,g2g3 c7b6 f1f2 h6h2 e1e2 f4g3,2695,105,86,194,capturingDefender crushing endgame long pin,https://lichess.org/4InmyqXh#53,
a7Elp,3qkb1r/2r2ppp/1p2pn2/n2p4/1P1P1B2/P3P2P/2b2PP1/R2QKBNR w KQk - 0 16,f4c7 d8c7 a1c1 c7c3 d1d2 c3a3 d2c2 f8b4,2698,99,80,218,advantage capturingDefender middlegame veryLong,https://lichess.org/QhMcuxzp#31,Queens_Pawn_Game Queens_Pawn_Game_Steinitz_Countergambit
a8ax8,4rrk1/3b3p/1pq2np1/pB1pB3/P2P4/2P3P1/2Q4P/4RRK1 b - - 1 26,c6e6 e5f6 e6e1 b5d7 e1e3 g1g2,2673,86,86,69,capturingDefender crushing defensiveMove long middlegame,https://lichess.org/YjCmaua1/black#52,
aMLX7,3r2k1/5pp1/pqn1p2p/1b1n4/p7/4PN1P/1PQ1NPP1/2R2RK1 w - - 5 28,f1d1 d5b4 d1d8 b6d8 c2d2 d8d2 f3d2 b5e2,2611,104,90,425,advantage capturingDefender middlegame veryLong,https://lichess.org/5AivAJSB#55,
aNZbE,4b3/2N2k1p/3n1bp1/3q1p2/1P1p4/5PP1/1B5P/4QBK1 b - - 6 38,d5c6 e1e6 f7g7 e6d6 c6d6 c7e8 g7f8 e8d6,2653,113,86,478,attraction capturingDefender crushing deflection fork middlegame sacrifice veryLong,https://lichess.org/ZrYOvifM/black#76,
aYNsr,5rk1/1R3p2/4pQp1/3p4/P7/6PB/4nPK1/3q4 b - - 6 43,d5d4 b7f7 f8f7 h3e6 d1g1 g2f3 g1h1 f3e2,2654,107,88,710,capturingDefender crushing endgame master pin sacrifice veryLong,https://lichess.org/3oRo0xax/black#86,
bTuVQ,4r1k1/4rpq1/2p3p1/2Np1n1p/3P1P2/4P2P/4RQPK/4R3 w - - 3 33,g2g4 h5g4 h3g4 f5e3 e2e3 g7d4,2667,123,87,673,capturingDefender crushing long middlegame,https://lichess.org/BTaxRiLS#65,
bcgfR,r1b1k2r/ppp1qppp/2np1n2/b7/Q1BPP3/5N2/P4PPP/RNB2RK1 b kq - 2 10,a7a6 c4d5 c8d7 d5c6 d7c6 a4a5,2652,90,93,1660,advantage capturingDefender long opening,https://lichess.org/e92O1jb3/black#20,Italian_Game Italian_Game_Evans_Gambit
bfDY2,4r3/1r1kPpbp/p5p1/5qP1/3p3P/P2P4/1PR3Q1/2K1R3 b - - 6 39,f5f4 c1b1 b7b6 g2d5 f4d6 d5f7 g7e5 c2c8 d6e7 f7e8 e7e8 c8e8 d7e8 e1e5,2674,105,85,133,attraction capturingDefender crushing defensiveMove deflection exposedKing middlegame veryLong,https://lichess.org/0UrJg3Da/black#78,
bkocN,1rr3kb/R3p2p/3pPppB/3n4/3P4/5N1P/1q1Q1PP1/4R1K1 b - - 4 26,c8c2 d2a5 h8g7 a5d5 g7h6 a7e7,2669,101,85,109,capturingDefender crushing long middlegame,https://lichess.org/RoNBWOcx/black#52,
byZeE,2r2rk1/4bpp1/7p/pQ2p1q1/3pP3/PN3P2/1PP3PP/1K1R3R w - - 1 21,d1d2 c8b8 b5a5 e7d8 a5c5 b8b3 c2b3 g5d2,2608,92,77,172,advantage capturingDefender middlegame veryLong,https://lichess.org/Klwo4SSN#41,
cDEq7,5r1k/pb1r3p/1p4pb/2qNp3/8/1QP1P1P1/P4PBP/2RR2K1 w - - 3 28,d5b4 f8f2 g2b7 c5e3,2606,86,76,156,capturingDefender crushing master middlegame short,https://lichess.org/DMo7zEKx#55,
cJOZ8,6rk/1b3p1p/p2pp2r/1pp3qN/4PNn1/1P1P3P/1PP1Q1P1/R4R1K b - - 0 25,h6h5 f4h5 g5h5 h1g1 g4f6 e2h5 f6h5 f1f7 b7c8 e4e5,2681,111,82,91,advantage capturingDefender master middlegame skewer veryLong,https://lichess.org/BsrlSzOc/black#50,
cPcYo,2r2rk1/p2bpp1p/1p1p2p1/q4P2/n1P3B1/1N1QP3/6PP/R4RK1 b - - 1 20,a5b4 f5g6 d7g4 g6f7 f8f7 f1f7 g8f7 d3h7 f7e8 h7g8 e8d7 g8g4 d7c7 b3d4,2665,90,91,698,advancedPawn advantage attraction capturingDefender defensiveMove fork master middlegame veryLong,https://lichess.org/QULRUZtm/black#40,
cp2d6,r4rk1/pp4p1/4p3/3pP3/6nq/1PN5/P2Q1P2/2KR2R1 b - - 3 20,f8f2 g1g4 h4g4 d2f2 a8c8 f2e3,2692,103,84,342,advantage capturingDefender deflection long middlegame,https://lichess.org/ZdJgoxs8/black#40,
crcrs,2kr1b1r/ppp1pppp/8/4n2q/6n1/3P1N2/PPPNBPP1/R1BQ1RK1 w - - 2 10,g2g3 h5h3 f1e1 g4f2 f3e5 h3g3,2670,88,94,99,advantage capturingDefender kingsideAttack long opening,https://lichess.org/nlpNLWiU#19,Scandinavian_Defense Scandinavian_Defense_Mieses-Kotroc_Variation
creHd,8/K7/1p3k2/2p2PpP/Pr6/1P6/3R4/8 w - - 1 48,d2b2 c5c4 a7b8 c4b3 h5h6 b4a4,2661,95,87,64,advantage capturingDefender endgame long master rookEndgame,https://lichess.org/3C12cXwS#95,
cu2oC,r2qk2r/pbp3pp/1pn1p1n1/4Pp2/1b1P4/2NBBNP1/PPPQ3P/R3K2R b KQkq - 2 11,c6d4 f3d4 b7h1 d4e6 d8d7 d3f5,2666,103,93,920,advantage capturingDefender long middlegame,https://lichess.org/w9LK3pOy/black#22,Duras_Gambit Duras_Gambit_Other_variations
d8eO4,2k5/ppp2pp1/4p1p1/1r2P3/1q4P1/3PQN1r/2R1K3/3R4 w - - 0 32,e3a7 b4f4 d1f1 h3f3 f1f3 b5e5,2660,100,88,62,capturingDefender crushing long middlegame,https://lichess.org/qCF90YU1#63,
d9Cxy,Q1bk3r/p1p3pp/3b4/1p1n1qN1/3P4/2P1B3/PP4PP/R4NK1 w - - 9 24,f1g3 d6g3 a1f1 g3f4 e3f4 d5f4 f1f4 f5g5,2657,88,57,44,advantage capturingDefender middlegame veryLong,https://lichess.org/H34xVEgr#47,
dB0Jx,4r3/p1p1rpp1/3p3p/1k6/1P1P1n2/P1R1NP2/3K3P/4R3 b - - 6 29,f4d5 a3a4 b5a6 e3d5 e7e1 c3c7,2620,88,65,39,capturingDefender crushing endgame long,https://lichess.org/Sexp83t8/black#58,
dBOjD,r4rk1/p5Rp/n1p2p2/2Q1p3/2P2nNB/7P/5PPK/1q6 b - - 0 30,g8g7 c5e7 g7g6 h4f6 b1b4 g4e5 g6f5 g2g4 f5e4 e7h7,2675,116,89,672,capturingDefender crushing middlegame veryLong,https://lichess.org/Ei1OIh42/black#60,
dEpvs,r1b5/5Rbk/p2pP2p/nppP2q1/5n1p/1PP4P/PQ4PN/RN4K1 w - - 6 25,h2g4 f4d5 b1d2 c8e6 d2f3 g5g6,2676,94,78,193,advantage capturingDefender long middlegame,https://lichess.org/6qcotGo9#49,
dHsxr,r1br2k1/ppB1p1bp/4P1p1/2P2p2/2Bn4/2N2N2/PPP2nPP/2KR3R b - - 9 16,f2d1 h1d1 c8e6 d1d4 d8d4 c4e6,2655,87,84,92,capturingDefender crushing long master masterVsMaster middlegame,https://lichess.org/OJtZPeMi/black#32,Pirc_Defense Pirc_Defense_Other_variations
dX6BV,2r3k1/2b1R1pp/p2p4/2p5/2P5/8/P2Q1PKP/Bq6 b - - 2 33,b1a1 d2d5 g8h8 d5e6 c8f8 e7e8 a1f6 e6f6 g7f6 e8f8,2692,101,91,1103,capturingDefender crushing endgame pin veryLong,https://lichess.org/sQS8v70f/black#66,
dZpJ7,6rk/2p2prp/p1p2B2/3pPq1P/3b1N2/6Q1/PP4P1/5R1K b - - 0 30,d4e5 f6e5 f7f6 f4g6 g7g6 f1f5 g6g3 e5f6 g3g7 h5h6,2606,112,91,1894,capturingDefender crushing discoveredAttack kingsideAttack middlegame pin veryLong,https://lichess.org/MLghqN05/black#60,
df77a,r1b2rk1/ppp2ppp/3q1n2/6R1/2B5/1Q6/PB1b1PPP/3R2K1 b - - 2 15,c8g4 d1d2 d6d2 b2f6 g7g6 g5g4,2670,104,88,493,advantage capturingDefender deflection long middlegame pin,https://lichess.org/vvbef6eX/black#30,Danish_Gambit_Accepted Danish_Gambit_Accepted_Copenhagen_Defense
dfMsU,8/8/3K3k/3PpbpP/4r3/8/8/3B2R1 b - - 0 40,g5g4 d1c2 e4f4 c2f5 f4f5 g1g4,2643,83,80,155,capturingDefender crushing endgame long,https://lichess.org/TrRDdFh5/black#80,
dl8Tg,2rk3r/1bq2pb1/3p2p1/1B1Pn2p/Q7/2R3P1/PPP5/1K3R2 b - - 3 25,c7b8 a4h4 f7f6 f1f6 c8c3 f6f8 d8c7 h4e7 c7b6 f8b8 h8b8 e7d6 b6a7 b2c3,2694,105,88,227,advantage capturingDefender doubleCheck exposedKing fork middlegame pin sacrifice veryLong,https://lichess.org/6z1FSbJz/black#50,
dvNWp,6k1/2rr1qPp/4p3/3b4/2p4Q/1p4RP/1P3PP1/3R2K1 b - - 2 30,c4c3 d1d4 h7h5 d4f4 c7c8 f4f7 d7f7 h4h5,2635,83,40,161,advantage capturingDefender middlegame veryLong,https://lichess.org/WS4wBLDZ/black#60,
eEw5Y,4rrk1/R5bp/b1p3p1/1q1p4/N2Pn3/5N2/PP3PPP/1RBQ2K1 w - - 1 18,a4c5 g7d4 f3d4 b5c5,2657,115,87,958,advantage capturingDefender middlegame short,https://lichess.org/PnDNLrOh#35,Sicilian_Defense Sicilian_Defense_Nyezhmetdinov-Rossolimo_Attack
eF6D3,2r5/2P2p1k/2R2P2/3p2PK/2r4p/8/p7/R7 w - - 1 69,c6c4 d5c4 a1a2 c8c7 a2e2 h4h3 g5g6 f7g6,2683,85,92,602,advantage capturingDefender endgame master masterVsMaster rookEndgame veryLong,https://lichess.org/MH1mrALV#137,
eI9TS,6r1/8/4P3/3p1R2/p1pP4/PpP2bp1/1P2k1N1/6K1 b - - 4 52,f3g2 g1g2 e2d2 f5d5 d2c1 e6e7 g8e8 d5e5 c1b2 d4d5,2691,105,85,240,advancedPawn advantage capturingDefender defensiveMove endgame quietMove veryLong,https://lichess.org/DBbMYA1Y/black#104,
ePLAr,8/1p2r1k1/5qpp/1PQ1Nn2/3p4/8/5PP1/4R1K1 b - - 9 40,f5e3 e5g4 b7b6 c5b4 e3d5 g4f6 d5b4 e1e7,2640,80,94,909,capturingDefender crushing endgame veryLong,https://lichess.org/rb6BBn7s/black#80,
ealUw,r2qkb1r/ppp1pppp/2n2n2/4N1B1/2pP2b1/2N5/PP2PPPP/R2QKB1R b KQkq - 7 6,d8d4 d1d4 c6d4 e1c1 a8d8 g5f6 g7f6 e5g4,2684,111,87,470,advantage capturingDefender castling opening veryLong,https://lichess.org/e53C2lCZ/black#12,Queens_Gambit_Accepted Queens_Gambit_Accepted_Other_variations
edCX8,4r1k1/p4ppp/b4q2/3pN3/P1pPn3/2r4P/1Q3PPB/R3R1K1 b - - 7 27,f6g5 e1e4 c3b3 e5c4 d5e4 b2b3,2681,116,86,45,advantage capturingDefender long middlegame,https://lichess.org/CmUmEF0Q/black#54,
en5A8,4r3/ppp3k1/2n2n2/4pq1p/6r1/b1PP2BR/P1BNQPP1/1K2R3 w - - 1 24,e1h1 f6d5 d2e4 g4e4 d3e4 d5c3,2625,105,87,1123,advantage capturingDefender long middlegame queensideAttack,https://lichess.org/AeS3ap5K#47,
eqg02,r2q1rk1/1pp1n2p/p2p1pp1/3P4/2BQ2P1/PPB2P2/7P/K6R b - - 0 20,c7c5 d5c6 d6d5 c6b7 a8b8 c4a6 d8d6 d4a4,2697,111,91,812,advancedPawn advantage capturingDefender defensiveMove discoveredAttack enPassant middlegame veryLong,https://lichess.org/CiOVfe4i/black#40,
f1uYd,2r5/1p4k1/p3p2r/P3p1p1/2NpPbQ1/1P1q3P/5RP1/5R1K b - - 1 29,c8h8 f2f4 e5f4 g4g5 h6g6 g5g6 g7g6 c4e5 g6h6 e5d3,2648,89,92,2370,attraction capturingDefender crushing exposedKing fork middlegame pin sacrifice veryLong,https://lichess.org/8nTDX2rZ/black#58,
fIeD1,8/7p/6p1/2pk4/P4P2/1PP1p1P1/7P/6K1 w - - 1 37,b3b4 d5c4 g1f1 c4c3 f1e2 c5b4 a4a5 b4b3 a5a6 b3b2 a6a7 b2b1q a7a8q b1d3,2655,87,81,108,advancedPawn capturingDefender crushing endgame pawnEndgame promotion veryLong,https://lichess.org/gxQ988er#73,
fZgec,8/4P1pk/p1p1Qr2/2p4p/1p2P2P/1P1P4/1bP1K1P1/q1N4R w - - 4 28,e6d7 a1b1 d7f5 f6f5 e4f5 b1c2 e2f3 b2c1 e7e8q c2d3,2663,122,89,731,capturingDefender crushing endgame veryLong,https://lichess.org/p0Jz5JFX#55,
fwBSG,r3kbnr/pp3ppp/2p1pn2/8/B7/P1NRB3/1PP1KP1P/3R4 b kq - 0 16,f6g4 d3d7 g4e3 f2e3 a8b8 d7b7 b8b7 a4c6 e8e7 c6b7,2607,89,71,108,advantage attraction capturingDefender fork middlegame pin sacrifice veryLong,https://lichess.org/TQX7IJVN/black#32,Scandinavian_Defense Scandinavian_Defense_Gubinsky-Melts_Defense
g8EsK,1r2nr2/3bppbk/3p4/1pp3N1/3nP3/3PB1PP/Pq1N2B1/3Q1RK1 b - - 3 21,h7g8 d1h5 d4e2 g1h2 g7h6 f1f7 b2f6 f7f6,2614,109,90,1536,capturingDefender crushing kingsideAttack middlegame veryLong,https://lichess.org/WVrQZs6c/black#42,
gOFGh,1r4k1/7p/2p2ppP/p2p1Q1N/Pn1P4/1Bp5/2P4q/1K4R1 w - - 1 33,h5f6 g8h8 f5g4 b4c2 g1g2 b8b3 b1c2 h2g2 g4g2 b3b2 c2c3 b2g2,2622,94,90,401,capturingDefender crushing defensiveMove discoveredAttack middlegame pin queensideAttack sacrifice skewer veryLong,https://lichess.org/sjdeA111#65,
gsLuG,r4qk1/pppbn3/3p2rp/3P1p2/8/P1N2QRP/1PP2PP1/4R1K1 b - - 0 24,a8e8 e1e7 e8e7 g3g6 g8h7 g6g4,2650,82,77,77,advantage capturingDefender defensiveMove exposedKing kingsideAttack long middlegame,https://lichess.org/zik7oL46/black#48,
gvSrV,2k4r/p4p2/2Pp1nr1/2P1p2b/4Pp1q/2NB1P2/P3QRPP/2R4K w - - 1 26,h2h3 g6g2 f2g2 h4h3 h1g1 h5f3 d3a6 c8d8 c6c7 d8c7 c5d6 c7d8 e2f3 h3f3,2660,99,91,1603,capturingDefender crushing fork middlegame sacrifice veryLong,https://lichess.org/L0KS8WQr#51,
h9E2H,2rq1rk1/3b1ppp/3p4/6Pn/p1NBPP1b/R1QB4/1PP4P/5RK1 w - - 1 25,d3e2 h5f4 f1f4 d8g5 c3g3 h4g3 a3g3 g5h6,2625,83,80,132,advantage capturingDefender fork middlegame veryLong,https://lichess.org/ddmRiO6S#49,
hHfrK,5r1k/2p3qn/1p1p2r1/p5RR/2P2P1P/1P2Q1P1/P3P2K/8 w - - 5 33,f4f5 g6g5 h4g5 f8f5 e3e8 g7g8,2619,112,91,1411,advantage capturingDefender long master middlegame,https://lichess.org/oQ0Dudl3#65,
hLOjt,5r1k/6p1/6QP/3P4/4PrK1/8/8/8 w - - 1 59,g4g3 f4f3 g3g4 f8f4 g4h5 f3h3 h5g5 h3g3 g5f4 g3g6 e4e5 g7h6 d5d6 g6g8 f4f5 h8g7,2672,110,91,1404,capturingDefender crushing defensiveMove endgame exposedKing queenRookEndgame quietMove skewer veryLong,https://lichess.org/mkBePFle#117,
hg9gB,3q1r1k/p2bpB1p/2p2bp1/3p2N1/8/4P1Q1/PrP3PP/4RRK1 b - - 3 19,e7e5 g5h7 f8f7 h7f6 f7f6 g3e5,2630,86,90,166,advantage capturingDefender long middlegame,https://lichess.org/XiIjfVgR/black#38,
hkEZp,1r1r2k1/6b1/1pq2p1B/p1p1n2p/4RQpP/1P1P4/1P4P1/5RK1 b - - 3 33,c6d5 h6g7 e5d3 f4f6 d8d7 e4e7,2608,81,92,1243,capturingDefender crushing long middlegame,https://lichess.org/6dNCvdox/black#66,
hkw8W,r2r2k1/2p2pp1/1q2p2p/2N1P3/p1PP3N/1p2Q3/P4PPP/2R3K1 w - - 0 26,a2b3 a4b3 e3b3 d8d4 h4f3 b6c5 f3d4 c5d4,2600,87,91,664,advantage capturingDefender middlegame veryLong,https://lichess.org/zcESJ4Fr#51,
hlL3N,8/p4p2/1pK1pk2/PP1n3p/4Bp1P/5P2/5P2/8 b - - 1 31,f6e5 e4d5 e6d5 c6b7 e5e6 b7a7 d5d4 a5b6 d4d3 b6b7,2651,99,98,52,advancedPawn capturingDefender crushing endgame veryLong,https://lichess.org/NhT5Soxl/black#62,
huw1n,1kb1r3/1p5p/r7/p7/3P1b2/3QN1Pq/PPP1BP1P/R4RK1 w - - 1 23,g3f4 e8g8 e3g4 c8g4 g1h1 h3d3 c2d3 g4e2,2630,111,91,695,capturingDefender crushing kingsideAttack middlegame veryLong,https://lichess.org/YEVOJOHz#45,
i0ztZ,2r2rkb/1p1b4/p3p2p/P2p2pN/1Pq2p2/2P4P/1B1QRPP1/4R1K1 b - - 1 25,h8c3 d2c2 f8f5 e2e6 c3e1 c2f5 e1f2 g1f2 c4c2 f5c2 c8c2 e6e2 c2e2 f2e2,2641,91,94,270,advantage capturingDefender middlegame veryLong,https://lichess.org/hFs7KSFa/black#50,
iOTUj,r1b2rk1/1p2p1bp/p2p1np1/6q1/3BP3/P1N2R2/1PP1B1PP/R2Q2K1 b - - 2 14,c8g4 d4e3 g5e5 f3f6 e7f6 e2g4,2687,119,91,1150,advantage capturingDefender discoveredAttack long middlegame,https://lichess.org/8g6mL9FP/black#28,Sicilian_Defense Sicilian_Defense_Other_variations
iVvHh,8/8/5p1p/p1k1p1p1/PrPpP1P1/1b3P2/1R3K1P/1R6 w - - 1 31,f2e2 b3a2 b2b4 a5b4 b1b2 a2c4 e2d1 b4b3,2629,87,52,40,capturingDefender crushing endgame veryLong,https://lichess.org/SvTq6Xg7#61,
