PuzzleId,FEN,Moves,Rating,RatingDeviation,Popularity,NbPlays,Themes,GameUrl,OpeningTags
C5yth,r1bq1r1k/ppppb3/2nn2Q1/8/8/1P6/P1PP1PPP/RNB1R1K1 b - - 0 14,e7f6 e1e3 d6f5 g6f5 f8f7 f5g6,2615,95,84,111,crushing long opening quietMove,https://lichess.org/9gdjovoX/black#28,Ruy_Lopez Ruy_Lopez_Berlin_Defense
CA93o,r2qkb1r/1pp1n1p1/p1npQ2p/3N4/4P2N/8/PP3PPP/R1B1K2R b KQkq - 1 11,c6e5 h4f5 e5d3 e1e2 d3c5 d5c7 d8c7 f5d6,2688,104,87,524,crushing defensiveMove exposedKing opening veryLong,https://lichess.org/yQKO0DYW/black#22,Scotch_Game Scotch_Game_Scotch_Gambit
CBLdf,r2q1rk1/pb1nbpp1/1p5p/2pPn3/4N3/P4N2/1B3PPP/RB1Q1RK1 b - - 1 17,e7f6 e4f6 d8f6 f3e5 d7e5 d1c2,2651,95,91,2199,advantage kingsideAttack long opening,https://lichess.org/e1xOqf1o/black#34,Sicilian_Defense Sicilian_Defense_Wing_Gambit
CEQe9,r1b1k2r/ppp2Npp/8/2bpp3/2Bnn2q/4B3/PPP2PPP/RN1Q1RK1 w kq - 0 9,c4d5 c8g4 d1d3 d4e2,2684,87,91,1427,advantage opening short,https://lichess.org/IiO5YXWn#17,Italian_Game Italian_Game_Two_Knights_Defense
CGFnO,r2qk2r/5pbp/3np1p1/pp4N1/3n4/8/PPB2PPP/R1BQR1K1 b kq - 1 17,d4c2 g5e6 f7e6 e1e6 e8f7 e6d6 h8e8 c1e3,2664,101,85,615,advantage defensiveMove opening veryLong,https://lichess.org/EwXxQXdj/black#34,Caro-Kann_Defense Caro-Kann_Defense_Other_variations
CNroT,r2qnrk1/pb1n1ppp/1p1bp3/2ppN3/3P1P2/1PPBPQ2/P2N2PP/R1B2RK1 b - - 4 11,f7f6 d3h7 g8h7 f3h3 h7g8 h3e6,2605,97,93,3417,attraction crushing kingsideAttack long opening sacrifice,https://lichess.org/56XguzhH/black#22,Queens_Pawn_Game Queens_Pawn_Game_Stonewall_Attack
CQdIp,2rqkb1r/p3n1pp/1p2Q1n1/3p2B1/8/8/PPP2PPP/RN2R1K1 b k - 4 14,c8c2 b1a3 c2c5 b2b4,2678,93,95,246,advantage opening short,https://lichess.org/gOeuaS0o/black#28,French_Defense French_Defense_Advance_Variation
CVD11,rnQ2b1r/p1p1kppp/2q2n2/4p3/2B1P3/8/PPP2PPP/RNB1K2R w KQ - 3 10,c4b3 b8d7 b3d5 c6c2,2698,121,76,61,advantage opening quietMove short,https://lichess.org/iwA2LJet#19,Philidor_Defense Philidor_Defense_Other_variations
CW61q,r1bqkb1r/ppp3pp/2n5/4ppN1/4N3/3P1Q2/PP3PPP/R1B1K2R b KQkq - 0 9,h7h6 f3h5 e8d7 h5f7 d8e7 f7f5 d7d8 f5g6,2609,115,61,42,advantage exposedKing master opening veryLong,https://lichess.org/1OGtRxSw/black#18,Four_Knights_Game Four_Knights_Game_Italian_Variation
CWMtl,r3kbnr/ppp1qppp/3p4/8/Q1BnP3/2N2P2/PP3P1P/R1B2RK1 b kq - 2 10,d4c6 c4a6 e7d7 a6b7,2648,115,90,1886,crushing opening short,https://lichess.org/8smYxaTm/black#20,Danish_Gambit Danish_Gambit_Other_variations
CYKMq,r2qr1k1/1ppb1ppn/pbn4p/3NP3/B7/5N1P/PP3PP1/R1BQR1K1 b - - 2 15,c6e5 e1e5 d7a4 d1a4 b6f2 g1f2,2658,85,82,226,advantage long opening,https://lichess.org/27iqUYYZ/black#30,Italian_Game Italian_Game_Scotch_Gambit
CdybG,r1bk1b1r/pp1np1p1/1q3nBp/4B3/3N4/8/PPP2PPP/R2Q1RK1 b - - 0 13,f6g4 g6f7 g4e5 d4e6 b6e6 f7e6,2662,93,86,229,crushing long opening quietMove sacrifice,https://lichess.org/AWSkBdOg/black#26,Caro-Kann_Defense Caro-Kann_Defense_Karpov_Variation
CegEr,r1b2k1r/ppp3pp/2p2n2/2b5/4q3/1B6/PPPP1PPP/RNBQ1RK1 w - - 0 9,f1e1 c5f2 g1f2 e4h4 f2g1 c8g4 g2g3 h4h5,2690,92,92,2101,advantage attraction kingsideAttack opening sacrifice veryLong,https://lichess.org/EQU3V1uv#17,Russian_Game Russian_Game_Italian_Variation
CfqbN,r1bq3r/pppp2kp/1b4p1/3nPR2/3P2Q1/8/PPP3PP/RNB3K1 b - - 2 13,d5e7 c1h6 g7h6 g4f4 h6g7 f5f7 g7g8 f4f6,2674,96,82,226,attraction clearance crushing opening pin sacrifice veryLong,https://lichess.org/4vKRD2DV/black#26,French_Defense French_Defense_La_Bourdonnais_Variation
ChERL,r1b4r/pp2bkpp/3p4/3Pp3/B3n3/2N1q3/PP2N1PP/2RQKR2 b - - 1 16,f7g8 c3e4 e3e4 c1c8 a8c8 a4d7 g7g6 d7c8,2694,87,92,1512,attraction crushing discoveredAttack opening sacrifice veryLong,https://lichess.org/ICE8Lxq9/black#32,Caro-Kann_Defense Caro-Kann_Defense_Accelerated_Panov_Attack
CpBZi,2r1kb1r/pp1b1ppp/1qn1pn2/8/2PP4/P4N2/1BQ2PPP/RN2KB1R w KQk - 5 11,c4c5 c6d4 b2d4 f8c5 d4c3 f6g4,2688,91,93,1264,crushing long opening,https://lichess.org/LWE67tGy#21,Queens_Pawn_Game Queens_Pawn_Game_Colle_System
CqUUh,rnbq1rk1/ppppBppp/4p3/8/3P4/2nB4/PPP2PPP/R2QK1NR w KQ - 0 7,e7d8 c3d1 d8e7 d1b2,2694,214,85,16,equality opening short,https://lichess.org/ntrAzzKl#13,
D06r4,r1br2k1/1p2n1bp/pqnNppp1/3pP3/3p1Q2/1P1B1N2/P1P2PPP/R1B1R1K1 b - - 1 14,f6e5 f4f7 g8h8 d6e8 e7f5 e8g7,2676,98,82,154,advantage kingsideAttack long opening,https://lichess.org/okytgeAU/black#28,French_Defense French_Defense_Advance_Variation
D0WXU,r1b1kb1r/ppq2ppp/2n2n2/3p2B1/2BN4/2N5/PPP2PPP/R2QK2R w KQkq - 0 9,c4d5 f6d5 d1e2 f8e7 d4b5 c7a5,2645,88,76,119,advantage long opening pin,https://lichess.org/9Pu2FoBg#17,Sicilian_Defense Sicilian_Defense_Closed
D3mxC,r3kb1r/pp2nppp/1q2p3/1b1pN3/3P4/3B4/PP3PPP/R1BQ1RK1 b kq - 1 11,e7f5 d3f5 b5f1 g1f1,2654,91,93,1415,crushing opening short,https://lichess.org/1PCpfpiz/black#22,French_Defense French_Defense_Advance_Variation
D4CTD,r1bq1rk1/ppppbppp/2n5/4n1NQ/3p4/1B6/PPP2PPP/RNB2RK1 b - - 3 9,e7g5 c1g5 c6e7 f2f4 e5g6 f4f5,2668,94,86,213,advantage long opening,https://lichess.org/KWXcOV2C/black#18,Italian_Game Italian_Game_Scotch_Gambit
D5a0g,rnb1k2r/pp3ppp/1q3n2/2bPp3/4P3/5P2/PP4PP/RNBQKBNR w KQkq - 1 7,g1e2 c5f2 e1d2 f6d5,2673,124,89,1947,advantage opening short,https://lichess.org/bVTtEqZl#13,Queens_Gambit_Declined Queens_Gambit_Declined_Austrian_Defense
D6qjz,r3kb1r/pppb2pp/2n5/1B1Q4/3q4/6P1/PPP4P/R1B1K1NR w KQkq - 0 12,b5c6 d4b4 c1d2 b4e7,2659,90,91,1877,crushing opening short,https://lichess.org/6RKPAY5q#23,Vienna_Game Vienna_Game_Vienna_Gambit
D8gVl,rnbqk1r1/ppppnp1p/5B2/8/1bB1P3/8/P4PPP/RN1Q1KNR b q - 2 8,d7d6 d1b3 d6d5 c4d5 c8e6 d5e6 f7e6 b3b4,2613,99,91,1708,advantage opening veryLong,https://lichess.org/TZREM3us/black#16,Danish_Gambit_Accepted Danish_Gambit_Accepted_Copenhagen_Defense
DAKVO,rn1qk2r/pbp1bppp/1p2pn2/4N1B1/3P4/2NB4/PPP4P/R2QK1R1 b Qkq - 1 11,e8g8 g5f6 e7f6 d3h7 g8h7 d1h5 h7g8 e1c1,2659,108,87,142,advantage attraction castling defensiveMove kingsideAttack opening pin sacrifice veryLong,https://lichess.org/Vl2GcI01/black#22,Owen_Defense Owen_Defense_Smith_Gambit
DGtwU,rnb2rk1/1pq1bppp/p7/3p1N2/6P1/4BP2/PPPQ3P/2KR1B1R b - - 3 13,c8e6 d2c3 c7c3 f5e7 g8h8 b2c3,2620,89,91,3689,crushing deflection intermezzo long opening sacrifice,https://lichess.org/35IXwlHo/black#26,Sicilian_Defense Sicilian_Defense_Scheveningen_Variation
DIjrY,r1b2rk1/pppp2p1/2nb2Qp/3p4/3q3P/3B3N/PPP3P1/R1BK3R b - - 5 15,c6e5 g6h7 g8f7 c1h6 e5d3 c2d3,2677,100,87,254,advantage long opening pin,https://lichess.org/CXSFXJvT/black#30,Dutch_Defense Dutch_Defense_Raphael_Variation
DJKKI,r2qkbnr/pQp1pppp/8/5b2/8/2NB2K1/PPn3PP/R1B3NR b kq - 5 10,e7e6 d3b5 e8e7 c1g5 f7f6 a1d1 d8b8 d1d7 e7e8 b7c6 f8d6 d7d6,2604,99,77,122,clearance crushing discoveredAttack opening veryLong,https://lichess.org/kl2GuzJ0/black#20,Blackmar-Diemer_Gambit Blackmar-Diemer_Gambit_Other_variations
DQmLo,r1br2k1/pp2bppp/5n2/q1p1P1B1/8/2NQ4/PPP3PP/2KR1B1R w - - 1 13,d3g3 d8d1 c1d1 f6h5 g3e3 a5d8,2656,101,91,1585,crushing long opening,https://lichess.org/5Eu2iI2y#25,Four_Knights_Game Four_Knights_Game_Scotch_Variation_Accepted
DUNnL,r2q1rk1/pp2ppbp/2n2np1/8/3PP1b1/2N3P1/PP2NP1P/R1BQKB1R w KQ - 2 9,d4d5 g4f3 h1g1 c6e5,2687,103,88,321,advantage defensiveMove master opening short,https://lichess.org/LoS9Df6w#17,English_Opening English_Opening_Anglo-Indian_Defense
DWtsO,r2qk2r/pp2npbp/2n3p1/2P5/1P1N2b1/P7/1BP1NPPP/R2QKB1R b KQkq - 0 11,c6d4 b2d4 g4e2 d4g7 e2d1 a1d1,2624,116,90,832,advantage long opening sacrifice,https://lichess.org/9iox9vFG/black#22,Queens_Pawn_Game Queens_Pawn_Game_Other_variations
DXQze,r1bq2kr/ppp2pNp/2n4B/3p4/1b2n3/2N2Q2/PPP2PPP/R3KB1R w KQ - 0 10,e1c1 b4c3 f3e4 c3g7,2674,101,87,150,advantage opening short,https://lichess.org/O7LlYonC#19,Scotch_Game Scotch_Game_Schmidt_Variation
DXdmI,r2qkb1r/pp3ppp/2n1p3/1B1p1n2/8/2N2Q1P/PPPP1PP1/R1B1R1K1 w kq - 6 10,c3d5 f5d4 f3h5 g7g6 h5e5 d4b5 e5h8 d8d5,2617,102,90,898,advantage fork opening veryLong,https://lichess.org/O9PvQlwo#19,Caro-Kann_Defense Caro-Kann_Defense_Two_Knights_Attack
DYYFE,2rqnrk1/pb1nbppp/1p2p3/3pN3/3P1P2/P1PB1Q2/1P1N2PP/R1B2RK1 b - - 0 13,f7f6 d3h7 g8h7 f3h3 h7g8 h3e6,2636,105,87,155,attraction crushing kingsideAttack long opening sacrifice,https://lichess.org/drddKuqZ/black#26,Queens_Pawn_Game Queens_Pawn_Game_Mason_Attack
DYs9p,rn2k1nr/pQp1b1pp/3pq3/8/3Pb3/5N2/PPP1BPPP/RNB1K2R w KQkq - 3 10,e2b5 e8d8 b5c4 e4f3 c4e6 f3b7,2645,117,90,971,advantage defensiveMove discoveredAttack long opening,https://lichess.org/gpLorPlY#19,Latvian_Gambit_Accepted Latvian_Gambit_Accepted_Main_Line
DauGY,r2q1rk1/pb2bppp/1pn1p3/3n2B1/3PN3/5N2/PP3PPP/1BRQ1RK1 b - - 5 13,d5f6 c1c6 f6e4 g5e7 d8e7 b1e4 b7c6 e4c6,2619,95,66,76,advantage opening veryLong,https://lichess.org/lliKtxN5/black#26,Sicilian_Defense Sicilian_Defense_Alapin_Variation
Dcu38,r1b2rk1/p1pp1N2/1pnb3p/3Bp3/4P2q/3P4/PPP2PPP/R2QK2R b KQ - 0 11,c6e7 g2g3 h4f6 f7h6 g8g7 h6g4 f6g6 d5a8,2656,102,90,163,advantage doubleCheck exposedKing opening veryLong,https://lichess.org/8nBkhMwj/black#22,Italian_Game Italian_Game_Two_Knights_Defense
De1HZ,rn2kbnr/ppp2ppp/4p3/q4b2/1P6/P1N2N2/2PP1PPP/R1BQKB1R b KQkq - 0 6,f8b4 a3b4 a5a1 f3d4,2625,84,91,6342,advantage opening sacrifice short trappedPiece,https://lichess.org/UuwmB7tB/black#12,Scandinavian_Defense Scandinavian_Defense_Main_Line
DonUi,rnbqk2r/pp1p1ppp/4p3/4P3/3N2Q1/2b5/P1P2PPP/R1BK1B1R b kq - 1 9,c3a1 g4g7 d8e7 g7h8 e7f8 h8h7,2605,95,72,90,advantage long opening,https://lichess.org/nfjJhOzi/black#18,Sicilian_Defense Sicilian_Defense_Pin_Variation
DtGM6,r1b1k1nr/ppp3bp/2nqp1p1/5p2/2BP1P2/2N2N2/PPP3PP/R1BQK2R b KQkq - 1 8,c8d7 c3b5 d6b4 c1d2 b4c4 b5c7 e8d8 b2b3,2664,96,80,147,crushing defensiveMove exposedKing fork opening sacrifice veryLong,https://lichess.org/2HhxWcYf/black#16,Duras_Gambit Duras_Gambit_Other_variations
E3D01,r1b2bkr/ppQ3p1/2n1pnp1/8/8/8/PPP2PPP/RNB1K2R w KQ - 1 10,c1g5 e6e5 g5f6 g7f6 b1c3 h8h7,2615,109,90,1371,advantage long opening quietMove,https://lichess.org/2AVRcZeh#19,French_Defense French_Defense_Knight_Variation
EAkTl,2r1kb1r/pb1pqppp/1p4n1/1N2p3/2Q1P3/P7/BPP2PPP/R1B2RK1 w k - 4 13,b5d6 e7d6 c4f7 e8d8 c1g5 g6e7 f1d1 d6g6 f7g6 h7g6,2695,99,92,1540,advantage clearance opening veryLong,https://lichess.org/4udepyTX#25,Sicilian_Defense Sicilian_Defense_Open
EE9WA,r1bqk1nr/p1p2p1p/2p3p1/2bp4/2B1PQ2/8/PPP2PPP/RNB1K2R b KQkq - 1 8,d5c4 f4e5 d8e7 e5h8 e7e4 c1e3 c5e3 e1g1 c8h3 g2h3,2622,222,85,23,castling equality fork opening pin veryLong,https://lichess.org/rhb1lrXb/black#16,
EIp59,rnbq1r2/pp2bppk/4p3/2ppP1N1/3P3P/8/PPP2PP1/RN1QK2R b KQ - 1 10,h7g6 d1d3 f7f5 e5f6 g6f6 d3f3,2689,101,80,208,attraction crushing discoveredAttack enPassant exposedKing long opening,https://lichess.org/wJAjyLNO/black#20,Trompowsky_Attack Trompowsky_Attack_Classical_Defense
EJ7mL,r1bqkb1r/ppp2ppp/2n5/4p3/2BP4/5N2/P1P2PPP/R1BQ1RK1 b kq - 0 9,c6d4 f3e5 c8e6 c4e6 d4e6 d1f3,2664,105,88,569,advantage long opening,https://lichess.org/oIHsXxLw/black#18,Alekhine_Defense Alekhine_Defense_Other_variations
EJYfa,r1b1k1nr/ppp2Npp/8/3p4/2BqP3/8/PPQ2bPP/RNBK1R2 w kq - 2 10,c4d3 c8g4 d1d2 g8f6,2643,114,78,120,advantage opening short,https://lichess.org/4UTNtgYt#19,Italian_Game Italian_Game_Rosentreter_Gambit
ENcEK,r3k1nr/1p3pBp/p1bbp3/q7/8/5B2/PPP2PPP/R2Q1RK1 b kq - 0 13,d6e5 f3c6 b7c6 d1h5,2630,87,92,1738,clearance crushing master opening short,https://lichess.org/YgbmM9sL/black#26,French_Defense French_Defense_Two_Knights_Variation
ER5PW,r1bqkb1r/pppp1p1p/5np1/4p3/2B1P3/2N2Q2/PPPP1P1P/R1B1K2R b KQkq - 2 9,f8c5 d2d4 e5d4 c1g5 c5e7 e4e5 e8g8 e5f6,2631,95,83,190,advantage clearance opening veryLong,https://lichess.org/mYePvmYr/black#18,Bishops_Opening Bishops_Opening_Other_variations
ERbFf,r2qr1k1/p2bbppp/5n2/2ppQ3/8/2NB4/PPP2PPP/R1B1R1K1 w - - 2 14,c3d5 e7f8 d5f6 d8f6 c1f4 e8e5,2676,122,90,628,crushing long opening quietMove,https://lichess.org/5JhkNitB#27,French_Defense French_Defense_Knight_Variation
EctgY,r1b2rk1/pp5p/2p3pb/3Pn1q1/3Np3/4P2P/PP1NBPP1/R2Q1RK1 w - - 1 15,d5c6 c8h3 d1b3 g8h8 g2g3 f8f2 d2e4 f2f1 e2f1 g5e3 b3e3 h6e3,2625,112,91,763,advantage fork opening pin veryLong,https://lichess.org/ulx3LLR2#29,Queens_Pawn_Game Queens_Pawn_Game_Other_variations
EeZ1Q,r2q1rk1/pp2bppp/3p1n2/4p1B1/3nP3/1PN2P2/1PPQ2PP/2KR1B1R w - - 1 12,c3e2 f6e4 g5e7 d8c7,2686,101,93,1312,advantage opening sacrifice short,https://lichess.org/SZ7jZdh8#23,Sicilian_Defense Sicilian_Defense_Classical_Variation
EeeL6,rn2kb1r/ppp1qNpp/4bn2/8/2B5/8/PB3PPP/RN1Q1RK1 b kq - 0 10,e8f7 b2f6 e7f6 c4e6 f6e6 f1e1,2686,106,86,96,advantage long opening,https://lichess.org/FlEKhNke/black#20,Danish_Gambit_Accepted Danish_Gambit_Accepted_Classical_Defense
EhFsH,r3kb1r/pbppqppp/1p4n1/4P3/6P1/1P4RN/P1PP1Q1P/R1B1KB2 b Qkq - 0 15,e7e5 g3e3 b7e4 d2d4 e5d4 c2c3,2682,105,91,962,advantage defensiveMove long opening pin,https://lichess.org/2YhTe3EE/black#30,Van_Geet_Opening Van_Geet_Opening_Other_variations
Ejp0n,r1bkr3/pp4Q1/2pp2p1/2b1p3/4P1pq/1BPPN3/PP3PP1/R1B2RK1 w - - 0 17,g7g6 e8h8 f2f4 e5f4 f1f4 h4e1 f4f1 c5e3 c1e3 e1e3 f1f2 h8h6 g6h6 e3h6,2632,95,84,119,crushing kingsideAttack opening quietMove veryLong,https://lichess.org/vlGYPvzi#33,Four_Knights_Game Four_Knights_Game_Spanish_Variation
EjsGY,r1bqkbnr/pPp2ppp/8/8/8/8/PpP2PPP/R1BQKBNR w KQkq - 0 7,b7a8q f8b4 e1e2 b2a1q,2654,114,91,2563,advancedPawn advantage master opening promotion short,https://lichess.org/A3O7Gyio#13,Nimzowitsch_Defense Nimzowitsch_Defense_Scandinavian_Variation
Ek83L,rnb1r1k1/ppp1qppp/8/3P4/6n1/2NB4/PPP1NKPP/R1BQR3 w - - 1 12,f2g1 e7c5 e2d4 e8e1 d1e1 c5d4,2694,97,87,603,crushing discoveredAttack kingsideAttack long opening pin,https://lichess.org/7qsbVrs1#23,Elephant_Gambit Elephant_Gambit_Paulsen_Countergambit
EmPGG,r1bqr1k1/1p2bppB/2p5/4N3/8/p1n4P/P1P2PP1/R2QR1K1 b - - 0 18,g8f8 d1h5 c8e6 h7f5 e7f6 f5e6,2612,112,91,406,crushing long opening,https://lichess.org/PD5fRsnE/black#36,Scandinavian_Defense Scandinavian_Defense_Modern_Variation
EnF6h,r3kbr1/pppb1p1p/4p3/3PP2p/3n3q/3B2P1/PP2NPK1/RN1Q1R2 b q - 0 12,e6d5 f1h1 h4g4 e2d4,2623,101,87,348,advantage opening short,https://lichess.org/o75Lgb9V/black#24,French_Defense French_Defense_Schlechter_Variation
EnKkg,r1bq1rk1/ppp2pp1/2n4p/2b1p3/2B2n2/2PP1N1P/PP3PP1/RNBQR1K1 w - - 2 10,f3e5 f4h3 g2h3 c5f2,2695,98,84,207,advantage kingsideAttack opening short,https://lichess.org/1W8brv8W#19,Italian_Game Italian_Game_Two_Knights_Defense
F1LA6,2rq1rk1/pb1nppb1/1p1p4/5Np1/3pP3/2PB4/PP1N2PP/2RQ1R1K b - - 1 17,d4c3 d1h5 d7e5 d2f3,2678,112,56,51,crushing opening short,https://lichess.org/NUFtIBLP/black#34,Paleface_Attack Paleface_Attack_Other_variations
F72DA,r1bqk1nr/pp2ppb1/2ppn3/6B1/3PP3/2N2N2/PPPQ2PP/2KR1B1R w kq - 5 10,d4d5 e6g5 f3g5 f7f6 e4e5 f6g5,2678,88,92,1040,advantage long opening,https://lichess.org/0GUPxLO8#19,Carr_Defense Carr_Defense_Other_variations
F8VXQ,r1b2r1k/pp2p2p/1q1p2p1/2n5/2B1P3/2b2N2/P3QPP1/1NKR3R b - - 3 16,c3g7 h1h7 h8h7 d1h1 g7h6 e2d2 c5d3 c4d3,2686,101,92,2675,attraction crushing opening pin sacrifice veryLong,https://lichess.org/KmkOstDb/black#32,London_System London_System_Other_variations
F8ey2,rnb2rk1/pp3ppp/2p1p3/2b5/4N3/2BP4/PqP1Q1PP/R3KB1R b KQ - 1 13,b2b6 e4f6 g8h8 e2e4 c5f2 e1d1,2663,114,88,390,clearance crushing defensiveMove long opening,https://lichess.org/7P5fBqHc/black#26,Caro-Kann_Defense Caro-Kann_Defense_Other_variations
FGz1x,r3kb1r/p2n3p/1pp1pnp1/4q3/3N3Q/2N5/PP1PPP1P/R1B1K2R w KQkq - 10 15,d4c6 e5d6 c6a7 a8a7,2638,108,90,452,advantage opening short,https://lichess.org/KA1lthGz#29,Grob_Opening Grob_Opening_Grob_Gambit
FHTPc,r1b1k1nr/ppp2ppp/3p4/2b5/2QPq3/4BN2/PP3PPP/RN2K2R b KQkq - 1 10,g8e7 b1d2 c5b4 c4b4,2622,115,90,2006,advantage opening short,https://lichess.org/bqmPx5ap/black#20,Bishops_Opening Bishops_Opening_Philidor_Variation
FJjyZ,r1bq1r1k/pp1np1b1/6B1/2n5/4p3/1P6/PBPN1PPP/R2Q1RK1 b - - 0 14,g7b2 d1h5 h8g7 h5h7 g7f6 a1d1,2676,90,86,64,crushing defensiveMove exposedKing long opening,https://lichess.org/UA7Lvk0u/black#28,East_Indian_Defense East_Indian_Defense_Other_variations
FLKw3,r1b1kbnr/5ppp/p1qP4/2p5/8/8/PP3PPP/RNBQ1RK1 b kq - 0 12,c6d6 d1a4 d6d7 a4e4 f8e7 e4a8,2628,90,81,132,advantage fork long opening,https://lichess.org/VAKhGc9G/black#24,Sicilian_Defense Sicilian_Defense_Old_Sicilian
FMKK9,r2k2nr/pppqbQ1p/3pB1p1/4n3/4P3/8/PPP2PPP/RNB1K2R w KQ - 7 13,f7g7 d7e6 g7h8 e6f7 h2h4 d8d7,2671,121,88,709,advantage defensiveMove long opening sacrifice,https://lichess.org/jxI88Rkw#25,Philidor_Defense Philidor_Defense_Exchange_Variation
FN0IT,r1bqk2r/pp1n1pp1/5n1p/2bp4/7B/2N1P3/PP3PPP/R2QKBNR w KQkq - 0 10,c3d5 g7g5 h4g3 f6d5,2625,106,89,489,advantage intermezzo opening short,https://lichess.org/dTmW70L3#19,Queens_Gambit_Declined Queens_Gambit_Declined_Modern_Variation
FPq6T,r1bqk2r/p1pp2pp/1pn5/n1b1PB2/5B2/P4N2/1R3PPP/1N1Q1RK1 b kq - 0 13,e8g8 f5h7 g8h7 f3g5 h7g8 d1d5,2680,102,85,120,advantage attraction kingsideAttack long opening sacrifice,https://lichess.org/BCoNrhQb/black#26,Center_Game Center_Game_Other_variations
FQNko,rk3b1r/pp5p/6p1/4Nb2/3n4/1BQ5/PPPP1PqP/R1B1K2R w KQ - 5 18,h1f1 f8c5 c3g3 g2e4,2625,88,78,438,advantage opening quietMove short,https://lichess.org/K44IyIVv#35,Italian_Game Italian_Game_Two_Knights_Defense
FQU2h,r1bq1rk1/1pp2ppp/p2p1n1P/2bNp3/2P1P3/5N2/PPP2PP1/R1BQK2R b KQ - 0 10,g7g6 c1g5 c5f2 e1e2 f6d5 g5d8,2653,97,86,96,crushing defensiveMove long opening,https://lichess.org/rcmSMr36/black#20,Four_Knights_Game Four_Knights_Game_Italian_Variation
FUKOk,1rbqr1k1/2p1nppn/p2b3p/P7/1p1P4/1B3N1P/1PQB1PP1/RN2R1K1 w - - 2 19,b3f7 g8f7 c2h7 e7f5 e1e8 d8e8 d2h6 f5h6,2614,90,76,68,advantage master opening veryLong,https://lichess.org/fFJeGg86#37,Ruy_Lopez Ruy_Lopez_Closed
FWHwc,r2n1b1r/pb1pk1p1/1p1P3p/5q2/8/1QP2N2/PP3PPP/R1B1R1K1 b - - 0 17,e7d6 f3d4 f5f7 c1f4,2616,95,91,2001,crushing opening short,https://lichess.org/WnpFpZtI/black#34,Italian_Game Italian_Game_Blackburne-Kostic_Gambit
FXINL,rn1qr1k1/pp3pp1/2pb1n1p/4Nb2/3Pp3/2N3P1/PP3PBP/R1BQR1K1 w - - 0 12,c3e4 f5e4 g2e4 d6e5 d4e5 d8d1 e1d1 f6e4,2621,98,91,973,crushing discoveredAttack master opening veryLong,https://lichess.org/t7oisos4#23,Queens_Pawn_Game Queens_Pawn_Game_Zukertort_Variation
Ffw9n,r1b1kb1r/pp3ppp/2n2n2/qB2p3/3p4/2N1P1B1/PPP2PPP/R2QK1NR w KQkq - 0 9,b5c6 b7c6 e3d4 f8a3 g1e2 a3b2,2625,84,56,79,crushing long opening,https://lichess.org/OT4Xa1FC#17,Benoni_Defense Benoni_Defense_Old_Benoni
FiAyG,r2q1rk1/1b1pb1pp/1p2p3/p2n1p2/Qn1P4/4PNB1/PP1N1PPP/1B1R1RK1 w - - 0 14,a2a3 b6b5 a4b5 b7a6 b5a4 d5b6 a4b3 a5a4,2641,99,84,164,crushing master opening veryLong,https://lichess.org/89RR1jMp#27,Indian_Defense Indian_Defense_London_System
FtQDR,r1bq1rk1/pp1n1ppp/2pb4/4p3/2PPB3/5N2/PP3PPP/R1BQ1RK1 w - - 0 11,e4h7 g8h7 d4e5 d6e7,2640,112,91,1093,advantage defensiveMove master opening short,https://lichess.org/J5ptSECE#21,Semi-Slav_Defense Semi-Slav_Defense_Chigorin_Defense
Fu6vA,r1bqk2r/ppp2ppp/1bnp4/4N3/1PBp4/2P5/P4PPP/RNBQR1K1 b kq - 0 10,c6e5 c3d4 d8h4 c1e3 e8g8 g2g3 h4g4 c4e2,2685,87,70,84,advantage opening pin quietMove veryLong,https://lichess.org/I4PdcuB9/black#20,Italian_Game Italian_Game_Classical_Variation
GFFSl,r1bqkb1r/ppp1p2p/5nN1/8/1n1Pp2Q/8/PP3PPP/RNB1KB1R w KQkq - 3 10,g6h8 b4c2 e1d1 c2d4,2656,106,82,123,crushing fork opening short,https://lichess.org/leYsUGw5#19,Queens_Gambit_Declined Queens_Gambit_Declined_Marshall_Defense
GK8iK,rn2k1r1/p4p1p/2p2p1b/4P2b/8/2N1PN1q/PP2BPP1/2RQ1RK1 w q - 0 15,g2g3 h6e3 c3e4 g8g3 e4g3 h3g3,2604,86,92,3199,crushing kingsideAttack long opening pin,https://lichess.org/CFnux2ks#29,Slav_Defense Slav_Defense_Three_Knights_Variation
GLPse,r2qr1k1/1bb2pp1/p4n1p/npp1pN2/4p2N/2PP4/PPBQ1PPP/R1B1R1K1 b - - 1 16,b7c8 f5g7 e4e3 e1e3 a5c4 d3c4 d8d2 c1d2,2661,106,88,474,advantage opening veryLong,https://lichess.org/bxJ6jrlE/black#32,Ruy_Lopez Ruy_Lopez_Other_variations
GNUtD,rn2kb1r/ppp2ppp/5q2/4N3/2B5/2N4b/PPPP1PnP/R1BQ2KR w kq - 4 9,e5f7 g2h4 d1e2 f8e7,2653,89,94,2010,crushing defensiveMove opening quietMove short,https://lichess.org/28zNMrau#17,Russian_Game Russian_Game_Three_Knights_Game
GOZuA,r1bq1rk1/pp2bppp/2n5/3n4/8/2NB1P2/PP2QPPP/R1BR2K1 b - - 1 12,c6d4 d3h7 g8h7 d1d4 d5c3 e2c2 h7g8 d4d8,2682,99,79,152,advantage discoveredAttack fork opening sacrifice veryLong,https://lichess.org/SjTbaTFK/black#24,Englund_Gambit_Declined Englund_Gambit_Declined_Reversed_Krebs
GOdsc,r3kb1r/ppp1npp1/3q3p/3np2Q/8/1B1P3P/PPP2PP1/RNB2RK1 w kq - 2 11,c1g5 h6g5 h5h8 d5f6 b1d2 e7g6 d2e4 g6h8,2621,98,91,824,advantage opening quietMove sacrifice trappedPiece veryLong,https://lichess.org/ImJNs5aK#21,Italian_Game Italian_Game_Two_Knights_Defense
GOpo5,r1b1kb1r/pppp2pp/2n2q2/8/8/3P1Q2/PPP2PPP/RNB1R1K1 b - - 2 10,e8f7 f3d5 f7g6 e1e3 h7h6 d5e4 f6f5 e3g3,2614,94,84,637,advantage opening quietMove veryLong,https://lichess.org/HUEQRdJw/black#20,Russian_Game Russian_Game_Italian_Variation
GPXvr,r1b1k2r/pppp1ppp/2n5/8/N2NP1nq/8/PPP1BPPb/R1BQ1R1K w kq - 2 10,e2g4 h2e5 g4h3 e5d4,2699,92,81,174,advantage discoveredAttack opening short,https://lichess.org/8xtSj3R9#19,Four_Knights_Game Four_Knights_Game_Other_variations
GQZ2L,rnb1kb1r/pp1p1p1p/1q2pp2/2pP4/4P3/8/PPP2PPP/RNQ1KBNR b KQkq - 2 6,f8h6 c1h6 b6b2 g1e2 b2a1 e2c3,2657,112,90,1012,advantage defensiveMove long opening quietMove sacrifice,https://lichess.org/5WdOrF6z/black#12,Trompowsky_Attack Trompowsky_Attack_Other_variations
GXS30,rnb1kb1r/ppn2ppp/8/1BpqN3/5B2/8/PP3PPP/RN1QK2R b KQkq - 1 10,b8d7 b1c3 d5d1 a1d1 c7b5 c3b5,2622,93,91,1655,crushing long opening,https://lichess.org/gJ5O1J7T/black#20,Alekhine_Defense Alekhine_Defense_Other_variations
GbgKP,r1b1rb2/ppq2p1k/4pBpp/3pP3/3n3N/7Q/P4PPP/1BR2RK1 b - - 1 22,c7b6 b1g6 f7g6 h3g4,2665,117,88,1102,crushing opening sacrifice short,https://lichess.org/McpibubN/black#44,
Gc8Jl,r2qk2r/ppp2pp1/3b1n1p/4p3/2B1P1b1/6Q1/PPPP2PP/RNB2RK1 w kq - 0 10,f1f6 g7f6 g3g4 d6c5 g1h1 d8d4,2640,110,91,1376,advantage clearance long opening,https://lichess.org/dZgCJH4K#19,Kings_Gambit_Declined Kings_Gambit_Declined_Queens_Knight_Defense
GgoGq,2rq1rk1/pb2bp2/1p2p1pP/2nn2p1/8/2N2N2/PPQBPP2/1K1R1B1R b - - 3 16,d5c3 d2c3 g8h7 d1d8 f8d8 f1g2,2638,118,91,1243,advantage defensiveMove discoveredAttack long opening,https://lichess.org/oGoW1AQK/black#32,Queens_Gambit_Declined Queens_Gambit_Declined_Other_variations
GhSJX,r3k1nr/pbpnqpb1/1p1pp1N1/8/4P1Q1/2PPB1P1/PP4BP/RN3RK1 b kq - 0 12,f7g6 g4g6 e8d8 f1f7 g7h6 e3h6 d7e5 f7e7 e5g6 e7g7 g8h6 g7g6,2661,118,90,1365,advantage opening veryLong,https://lichess.org/cHABo1vM/black#24,Owen_Defense Owen_Defense_Other_variations
Gjnjm,rn3rk1/1p1b1ppp/4q3/pP2N3/Pb6/2n1P3/1B1N1PPP/R2QKB1R w KQ - 1 16,f1c4 c3d1 c4e6 d1b2,2632,87,94,173,crushing opening short,https://lichess.org/ry3tcXUz#31,Yusupov-Rubinstein_System Yusupov-Rubinstein_System_Other_variations
Gl41Y,r2q1rk1/b2pnpp1/p2Q1n1p/1p6/8/2P2P2/PPB2P1P/RNB2RK1 w - - 1 15,c1h6 a7b8 d6d4 d8c7 d4h4 g7h6,2610,93,54,61,advantage long opening,https://lichess.org/VubRlKqR#29,Nimzowitsch_Defense Nimzowitsch_Defense_Franco-Nimzowitsch_Variation
GmQ4C,r1bq1rk1/p3bpp1/1p2p2p/n3P1NQ/1n2N3/8/P4PPP/RBB2RK1 b - - 3 17,b4d3 e4f6 e7f6 e5f6 d8f6 b1d3 f6a1 d3h7,2669,93,81,198,advantage kingsideAttack opening sacrifice veryLong,https://lichess.org/zFyct6zA/black#34,Sicilian_Defense Sicilian_Defense_Old_Sicilian
GreGp,rn2kb1r/pp3ppp/2p1pn2/5b2/3Pq3/2P2N2/PP2BPPP/RNBQ1RK1 w kq - 0 8,d1b3 e4e2 b3b7 e2a6 b7a8 f8d6,2619,107,90,593,advantage long opening sacrifice,https://lichess.org/zWF8noJI#15,Scandinavian_Defense Scandinavian_Defense_Modern_Variation
GskCe,r1bq1rk1/p4ppp/4p3/1p1nb3/8/2P3P1/PB1NPPBP/R2Q1RK1 b - - 1 13,d5c3 d1e1 c3e2 e1e2,2679,121,87,496,advantage opening quietMove short,https://lichess.org/opoVA8yi/black#26,Queens_Pawn_Game Queens_Pawn_Game_Symmetrical_Variation
GxRns,r2q1rk1/ppp2pp1/3p1n1p/n1b1p3/2Q1P2B/2PP1N1P/PP3PP1/RN2K2R w KQ - 1 11,h4f6 d8e8 c4c5 d6c5,2601,88,82,208,advantage opening quietMove short,https://lichess.org/UgxoLsVw#21,Italian_Game Italian_Game_Classical_Variation
GyBsT,r3kbnr/pp1bpppp/2pq4/3N4/5B2/1P3Q2/P1P2PPP/2KR1B1R b kq - 1 11,d6a3 c1b1 c6d5 f3d5 d7c6 f1b5 a3a6 f4b8 a8b8 d5e5 b8c8 b5a6,2654,90,72,61,advantage opening pin sacrifice veryLong,https://lichess.org/9rsycEZ2/black#22,Scandinavian_Defense Scandinavian_Defense_Main_Line
H3z6j,1rbqk2r/p2n1ppp/2Q1pn2/1p6/8/1BPP1N2/P1P2PPP/R1B1K2R w KQk - 1 12,e1g1 b8b6 c6a8 b6b7 c1e3 e8g8,2696,116,90,1070,advantage castling defensiveMove long opening quietMove,https://lichess.org/43W10HPW#23,Scandinavian_Defense Scandinavian_Defense_Other_variations
H8whf,rn3rk1/ppp2p1p/3q2p1/5b2/4Q3/2BB4/P4PPP/3RK1NR w K - 2 14,e4b7 f5d3 g1e2 b8c6 d1d3 d6d3,2679,103,92,1252,crushing long opening quietMove,https://lichess.org/UqRu0DvB#27,Danish_Gambit_Accepted Danish_Gambit_Accepted_Classical_Defense
HARda,r3kb1r/ppp2ppp/2n1b3/1Q2p1q1/2B5/8/PPPP1PPP/RNB1K2R w KQkq - 3 9,b5b7 g5g2 b7a8 e8d7 c4e6 f7e6,2666,92,85,157,advantage long opening sacrifice,https://lichess.org/CHanchYy#17,Russian_Game Russian_Game_Italian_Variation
HAi48,r1bq1b1r/ppp3pp/2n1k3/3np3/2B5/2N2Q2/PPPP2PP/R1B1K2R b KQ - 3 10,c6b4 e1g1 f8c5 d2d4 c5d4 g1h1,2689,104,87,266,advantage castling defensiveMove long opening,https://lichess.org/cmkATUav/black#20,Kings_Gambit Kings_Gambit_Other_variations
HJRes,r1bq1rk1/p5p1/2p2b1p/n3p3/5p2/1P6/P1PPBPPP/RNBQ1RK1 w - - 0 16,c1b2 f4f3 e2f3 e5e4 b2f6 d8f6 f3e4 f6a1,2614,91,91,3896,advantage opening trappedPiece veryLong,https://lichess.org/nmCXkL2N#31,Italian_Game Italian_Game_Two_Knights_Defense
HNqdf,r1bqr1k1/pp1nbpp1/2p1p2p/3nNP2/3P4/2PB2N1/PP4PP/R1BQ1RK1 b - - 0 15,e6f5 e5f7 g8f7 g3f5 d7f6 f5h6,2696,102,77,224,crushing intermezzo kingsideAttack long opening,https://lichess.org/8DhoK6q7/black#30,Scandinavian_Defense Scandinavian_Defense_Marshall_Variation
HQ0r1,rn2kb1r/1b2pppp/p4n2/1p1P4/4P1q1/1QN5/3BBPPP/R3K1NR b KQkq - 4 12,g4g2 c3b5 a6b5 a1a8 b7a8 b3c2,2655,93,78,70,crushing defensiveMove long opening pin sacrifice,https://lichess.org/ZthVeFHX/black#24,Queens_Gambit_Accepted Queens_Gambit_Accepted_Other_variations
HQJY8,r3kbnr/ppp2ppp/2n5/1B6/3N4/6N1/PPb2PPP/R1B1K2R b KQkq - 1 10,f8b4 e1e2 c2d3 e2d3 e8c8 b5c6,2611,94,84,75,advantage defensiveMove long master opening pin,https://lichess.org/GQjMGlok/black#20,Nimzowitsch_Defense Nimzowitsch_Defense_Scandinavian_Variation
