PuzzleId,FEN,Moves,Rating,RatingDeviation,Popularity,NbPlays,Themes,GameUrl,OpeningTags
02uKZ,r1b1r1k1/pp3ppp/8/2pq4/1nNPn3/1P3N1P/P3BPP1/RQ2R1K1 w - - 0 17,d4c5 d5c5 c4e3 e4f2,2603,111,84,319,advantage opening short,https://lichess.org/g7WxI8b4#33,French_Defense French_Defense_Exchange_Variation
04TFa,rnb1kb1r/pp3ppp/2p2n2/4p3/8/1B1P1Q2/PPP2PqP/RNB1K1NR b KQkq - 1 7,c8h3 f3h3 g2h1 h3c8 e8e7 e1f1 b8d7 c8a8,2656,111,84,245,advantage opening sacrifice veryLong,https://lichess.org/o9olxwYP/black#14,Portuguese_Opening Portuguese_Opening_Other_variations
055Ov,r1bqk2r/1pp2p2/p2p1n1p/2bNp1N1/2P1P2B/7P/PPP2PP1/R2QK2R b KQkq - 0 11,h6g5 h4g5 c5f2 e1e2,2622,82,83,65,advantage opening short,https://lichess.org/oDu3QnBH/black#22,Italian_Game Italian_Game_Giuoco_Pianissimo
062Xx,rn1q2k1/ppp2ppp/3br3/8/6b1/5N2/PPP1BPPP/R1BQ1RK1 w - - 4 13,e2c4 g4f3 d1f3 d8h4 c1f4 h4f4 f3f4 d6f4 c4e6 f7e6,2621,113,86,1733,advantage opening veryLong,https://lichess.org/hTjnPPqq#25,Kings_Pawn_Game Kings_Pawn_Game_Other_variations
06L0V,rnbqkbn1/7r/1P6/3P4/P7/8/6PP/RNBQKBNR w KQq - 7 21,g2g4 f8b4 e1f2 d8h4 f2g2 c8g4,2659,109,86,363,advantage exposedKing long opening,https://lichess.org/T3JAv20U#41,
06ojO,rn1qkb1r/pp3ppp/8/2pp3b/3pn3/1BP2N1P/PP3PP1/RNBQR1K1 b kq - 0 9,b8c6 c3c4 f8e7 c4d5,2606,105,90,1035,advantage opening short,https://lichess.org/9jkrkQjP/black#18,Bishops_Opening Bishops_Opening_Urusov_Gambit
07N7O,rn2kbnr/pp2p1pp/3q4/3N4/8/7P/PPP2PP1/R1BQR1K1 b kq - 0 13,b8c6 c1f4 e7e5 f4e5 c6e5 d1h5 g7g6 e1e5 g8e7 h5e2 e8c8 d5e7,2609,115,90,786,crushing opening quietMove sacrifice veryLong,https://lichess.org/YjueYx3w/black#26,Caro-Kann_Defense Caro-Kann_Defense_Other_variations
09DMC,r1bqk2r/ppp2ppp/2np4/2b3B1/4n3/1NN5/PPP2PPP/R2QKB1R w KQkq - 0 8,g5d8 c5f2 e1e2 c8g4 e2d3 c6e5 d3e4 f7f5 e4d5 a8d8,2639,116,90,2287,attackingF2F7 crushing opening sacrifice veryLong,https://lichess.org/alSuOmEu#15,Russian_Game Russian_Game_Three_Knights_Game
0Ds5S,r1bqk2r/pppp2pp/2n2n2/2b3N1/4pP2/2N5/PPPP2PP/R1BQKB1R w KQkq - 2 8,c3e4 d8e7 d1e2 c6d4 e4f6 g7f6,2608,112,90,817,advantage long opening,https://lichess.org/igiYM0ya#15,Vienna_Game Vienna_Game_Vienna_Gambit
0F7bd,r1bqk2r/ppppbppp/2n5/6B1/2nN4/2N5/PPP2PPP/R2QR1K1 b kq - 0 9,c4b2 d1h5 e8g8 d4c6,2634,98,71,56,advantage master opening short,https://lichess.org/IXGSEUnm/black#18,Italian_Game Italian_Game_Scotch_Gambit
0RqJr,r1b1k2r/ppppqppp/3b1n2/8/3QP3/3B4/PPP2PPP/RNB2RK1 w kq - 5 8,f1e1 d6c5 d4c3 c5b4,2649,105,88,503,advantage opening short,https://lichess.org/TxjuNytf#15,Scotch_Game Scotch_Game_Other_variations
0VFpZ,2rq1rk1/pp2bpp1/2p1pnbp/8/2BP2P1/2P2N1P/PP2QP2/R1B1R1K1 w - - 1 15,c4e6 f7e6 e2e6 g8h7 e6e7 d8e7 e1e7 f6d5 e7b7 f8f3,2680,110,87,624,advantage opening veryLong,https://lichess.org/rnRMLoS6#29,Caro-Kann_Defense Caro-Kann_Defense_Two_Knights_Attack
0W9aB,r2q1rk1/ppp2ppp/2n2n2/2bp1b2/8/1P1P2P1/PBPNPP1P/R2QKBNR w KQ - 1 8,f1g2 f6g4 g1h3 c5f2 h3f2 g4e3 d1c1 e3g2 e1f1 g2e3,2674,89,71,203,advantage attackingF2F7 fork opening sacrifice veryLong,https://lichess.org/Ffzfii0v#15,Nimzo-Larsen_Attack Nimzo-Larsen_Attack_Classical_Variation
0ZaRg,b2r1rk1/b4pp1/p1n3qp/1p6/8/PNP1NB2/1P3PPP/R1Q2RK1 w - - 3 21,f1d1 c6a5 b3a5 a8f3 d1d8 f8d8,2653,96,91,1350,advantage discoveredAttack long opening pin,https://lichess.org/nAto17BT#41,
0Zp4o,rn2kb1r/pQ1b1qpp/5n2/3p4/B2Pp3/2N5/PP3PPP/R1B2RK1 b kq - 5 13,f8d6 b7c8 e8e7 c8h8,2636,114,90,451,advantage opening pin short skewer,https://lichess.org/ueRLGncG/black#26,Latvian_Gambit_Accepted Latvian_Gambit_Accepted_Main_Line
0axmS,2kr1bnr/1pp1pppp/p2q4/8/3nNP1P/4B3/PPP1BP2/R2QK2R b KQ - 1 11,d6b4 c2c3 d4f3 e2f3 d8d1 a1d1 b4b2 e4c5,2664,92,85,401,advantage defensiveMove fork opening sacrifice veryLong,https://lichess.org/xNq6j52z/black#22,Scandinavian_Defense Scandinavian_Defense_Mieses-Kotroc_Variation
0fqww,rnb1kb1r/ppp1pp1p/7p/1N5Q/3qp3/7P/PPP2P2/R3KBNR b KQkq - 1 8,d4b4 c2c3 b4b2 a1d1 c8d7 f1c4,2645,96,70,69,advantage defensiveMove long opening quietMove,https://lichess.org/lkCYKSEn/black#16,Indian_Defense Indian_Defense_Gibbins-Wiedenhagen_Gambit_Accepted
0fzax,r3k1nr/p2qbppp/1p2p3/2p1N3/3Pb3/P1P5/1P3PPP/R1BQK2R b KQkq - 1 12,d7d5 d1a4 e8d8 c3c4,2660,103,85,125,advantage opening short,https://lichess.org/AR4PHIFV/black#24,Horwitz_Defense Horwitz_Defense_Other_variations
0hYuX,r1b1kb1r/1p1ppppp/2q2n2/1N2P3/3B4/2N5/2P2PPP/3QKB1R b Kkq - 0 11,f6e4 c3d5 e7e6 b5c7 e8d8 f1b5 c6c7 d5c7,2670,101,86,404,advantage clearance fork opening trappedPiece veryLong,https://lichess.org/BRlMPzXj/black#22,Sicilian_Defense Sicilian_Defense_Godiva_Variation
0iGok,r3kbnr/ppB2pp1/2n2q1p/4p3/2Bp2b1/5N2/PPP2PPP/RN1QR1K1 b kq - 1 9,a8c8 c7e5 c6e5 c4b5 e8d8 d1d4,2652,88,80,260,advantage long opening sacrifice,https://lichess.org/aAjT4S55/black#18,Italian_Game Italian_Game_Anti-Fried_Liver_Defense
0wAjX,rn1q1rk1/pbp2pp1/1p1bp2p/8/2BPR3/5N1P/PPP2PP1/R1BQ2K1 w - - 1 12,d4d5 e6d5 e4g4 h6h5 g4g7 g8g7,2699,107,84,41,advantage fork long opening,https://lichess.org/KEmOOtLN#23,Scandinavian_Defense Scandinavian_Defense_Mieses-Kotroc_Variation
0zQbV,r3kbnr/p4ppp/1pn1p3/3p4/3P1P2/3B1P2/PqPBN2P/R2QK2R b KQkq - 1 11,g8f6 a2a3 c6d4 d2c3,2605,105,90,1226,advantage opening quietMove short,https://lichess.org/ySMLjH77/black#22,Caro-Kann_Defense Caro-Kann_Defense_Other_variations
10vzK,r2q1rk1/pppbbpp1/2n2n1p/4p3/2B1P3/1QP2N1P/PP3PP1/RNB1R1K1 w - - 0 12,b3b7 a7a6 b7b3 c6a5 b3d1 a5c4,2699,121,89,335,advantage long opening quietMove,https://lichess.org/MZebIc2V#23,Italian_Game Italian_Game_Anti-Fried_Liver_Defense
15QZ4,2r1qrk1/3bbppp/N4n2/1B1p4/Pn1PpB2/4P3/3N1PPP/2RQK2R w K - 1 20,a6c7 c8c7 c1c7 d7b5 a4b5 e8b5,2666,119,91,1315,advantage long opening,https://lichess.org/3o6Hsouv#39,
18Lrd,r1b1k1nr/ppqpppbp/4n1p1/1P6/P1PN4/8/1B2PPPP/RN1QKB1R b KQkq - 4 10,c7c4 b1d2 c4b4 d4e6 g7b2 e6c7,2602,95,84,127,advantage long opening,https://lichess.org/7suJSqUB/black#20,Benoni_Defense Benoni_Defense_Benoni_Gambit_Accepted
19qkR,rnb1k1nr/ppp2pp1/3b2q1/8/1P1Np3/P5P1/1BP1P1BP/RN1QK2R w KQkq - 0 11,b1c3 h8h2 h1h2 g6g3,2671,99,91,1310,advantage capturingDefender master opening sacrifice short,https://lichess.org/2NDlUc11#21,Polish_Opening Polish_Opening_German_Defense
1A4pF,r3kb1r/ppq2pp1/2n2n1p/5b2/8/1P3N2/PBP1PPPP/RN1QKB1R w KQkq - 3 8,b2f6 c6b4 b1a3 g7f6,2685,111,82,210,advantage intermezzo opening short,https://lichess.org/lGXagFee#15,Englund_Gambit_Complex Englund_Gambit_Complex_Hartlaub-Charlick_Gambit
1F7Tq,r2qk2r/ppp2pb1/3pbnp1/3Np1B1/2PnP2N/3P4/PP2BPPP/R2Q1RK1 w kq - 3 11,b2b4 f6d5 g5d8 d5c3 d1d2 c3e2,2682,111,86,1061,advantage long opening sacrifice,https://lichess.org/vAGveUIc#21,English_Opening English_Opening_Kings_English_Variation
1J8oq,r1bqr1k1/1p3ppp/2p5/pB1pP3/1n1P4/8/PP1Q2PP/RNB1K2R w KQ - 0 14,b5d3 d8h4 e1f1 f7f6 a2a3 b4d3,2638,100,82,97,advantage long opening,https://lichess.org/E869lLyk#27,Russian_Game Russian_Game_Modern_Attack
1M5WT,rnb2k1r/pp1pnBpp/2p5/4N3/8/4P3/P2B1PqP/2RQKR2 b - - 2 14,d7d6 d2b4 d6e5 f7h5 b8d7 f2f4,2612,105,85,66,advantage long opening quietMove sacrifice,https://lichess.org/s7S81gDB/black#28,English_Opening English_Opening_Kings_English_Variation
1PMwO,rnbqk2r/pppnbppp/8/4N3/2B5/2P5/P4PPP/RNBQR1K1 b kq - 0 10,e8g8 e5f7 f8f7 d1b3,2662,109,90,401,advantage opening pin sacrifice short,https://lichess.org/GIbFasMH/black#20,Bishops_Opening Bishops_Opening_Urusov_Gambit
1SlcC,r1b1kb1r/pp1p1ppp/2n1pq2/8/2BP1P2/2N3P1/PP3P1P/R2QK1NR b KQkq - 0 9,c6d4 c3e4 f6e7 d1d4 e7b4 e4d2 d7d5 a2a3 b4c5 d4c5,2676,109,91,1168,advantage opening veryLong,https://lichess.org/ROwUllyK/black#18,Indian_Defense Indian_Defense_Other_variations
1SrL6,r1bq1rk1/pppp1ppp/1bn2n2/4N3/2BP4/1Q6/P2B1PPP/RN2R1K1 b - - 5 12,c6d4 c4f7 f8f7 b3f7 g8h8 d2g5,2622,89,89,1350,advantage kingsideAttack long opening,https://lichess.org/DTcBD596/black#24,Italian_Game Italian_Game_Evans_Gambit
1UMAs,r1bqkb1r/1p3p2/p4np1/4p2p/3NP1n1/P1N4P/BPP3P1/R1BQ1RK1 w kq - 0 13,d4f3 f8c5 g1h1 d8d1,2610,107,91,1917,advantage opening short,https://lichess.org/ht7XhJfD#25,Sicilian_Defense Sicilian_Defense_Bowdler_Attack
1VBKC,r1bqkbnr/pppp1ppp/6n1/3NP3/2BP4/5Q2/PPP2PPP/R1B1K2R b KQkq - 6 9,g8e7 c1g5 e7d5 g5d8,2655,111,89,265,crushing opening short,https://lichess.org/49m7GRwu/black#18,Four_Knights_Game Four_Knights_Game_Halloween_Gambit
1XLXX,r1b1kbnr/ppq2ppp/4p3/3pn3/3N1B2/5N2/PPP2PPP/R2QKB1R b KQkq - 1 8,f8d6 d4b5 c7a5 c2c3 e5d3 d1d3 d6f4 d3d4,2658,98,91,401,advantage defensiveMove opening veryLong,https://lichess.org/eXPtTI7c/black#16,French_Defense French_Defense_Advance_Variation
1ac1A,rn3rk1/pp2bppp/3P4/8/1pB1Nqb1/5N2/P4PPP/R2Q1RK1 b - - 0 16,f4e4 c4d5 g4f3 d5e4 f3d1 d6e7,2617,94,79,289,advancedPawn advantage long opening,https://lichess.org/4VO6MYLv/black#32,Sicilian_Defense Sicilian_Defense_Wing_Gambit
1cGfq,r3k1nr/pppqbpp1/2npb3/7p/2PPp3/1P3NPP/P3PPBK/RNBQ1R2 w kq - 0 10,d4d5 e4f3 d5e6 f7e6 e2f3 e7f6 b1c3 f6c3,2615,94,53,52,advantage opening veryLong,https://lichess.org/9gk5dtYJ#19,Zukertort_Opening Zukertort_Opening_Black_Mustang_Defense
1lVkI,r2qk2r/pbpnnpb1/1p1p3p/5p2/2BN3Q/2NP4/PPP3PP/R1B2RK1 b kq - 3 12,h8g8 c4f7 e8f7 h4h5 e7g6 d4f5,2656,121,89,738,attackingF2F7 attraction crushing deflection long opening sacrifice,https://lichess.org/keULhuf1/black#24,Modern_Defense Modern_Defense_Other_variations
1yG56,r1bqkb1Q/pp3p2/2pp1n2/7p/4PPpP/2Nn2P1/P5B1/R1B2KNR w q - 3 14,e4e5 d8b6 g2c6 b6c6,2676,99,91,985,advantage opening short,https://lichess.org/nCi0O5LL#27,French_Defense French_Defense_Normal_Variation
2668J,r1bq1bnr/pppn1k1p/6p1/4N3/4P3/8/PPP2PPP/RNBQK2R b KQ - 0 7,f7e7 d1d5 d8e8 c1g5 g8f6 e5d7,2688,108,81,288,crushing exposedKing long opening pin,https://lichess.org/B0nMvcBm/black#14,Philidor_Defense Philidor_Defense_Hanham_Variation
26xhi,r1bq3r/pppp1Qpp/2n2n2/2b1p3/4P2k/2P3P1/PP1P1P1P/RNB1K2R b KQ - 0 9,h4g4 h2h3 g4f3 f7c4 c5f2 e1f1,2622,89,86,115,crushing long opening,https://lichess.org/9Wr22yT0/black#18,Italian_Game Italian_Game_Classical_Variation
29Uhi,r1b2rk1/ppq2ppp/2nbpn2/3pN1B1/2pP4/2P1P3/PPB2PPP/RN1Q1RK1 b - - 3 10,c6e5 d4e5 d6e5 f2f4,2601,107,87,404,advantage opening short,https://lichess.org/OpJlDbME/black#20,Indian_Defense Indian_Defense_Spielmann-Indian
2B8dS,rnb3kr/1p2b1pp/p4n2/4p1N1/3qP3/5Q2/PPP3PP/R1B2R1K b - - 1 15,c8g4 f3b3 f6d5 c1e3,2699,125,56,136,crushing opening short,https://lichess.org/LsrLUgkc/black#30,Sicilian_Defense Sicilian_Defense_Halasz_Gambit
2EuzJ,rnbq1rk1/ppp2ppp/3b4/8/2B5/5N2/PB3PPP/R2Q1RK1 b - - 1 12,c8g4 d1d4 d8f6 d4g4 f6b2 f3g5,2629,134,-20,11,advantage long opening,https://lichess.org/CdvbaTgF/black#24,Danish_Gambit_Accepted Danish_Gambit_Accepted_Copenhagen_Defense
2KVt7,r1bqk2r/ppppbppp/2nn4/3B2B1/3p4/5N2/PPP2PPP/RN1QR1K1 b kq - 5 8,d6f5 d1d3 d7d6 d5c6 b7c6 f3d4,2677,112,86,245,advantage long opening pin,https://lichess.org/ES7S7bAz/black#16,Italian_Game Italian_Game_Scotch_Gambit
2OTLT,r2q1r1k/4b1pp/p1p2p2/1p3b2/2Q5/5PN1/PPPB2PP/2KR2NR w - - 0 16,c4c6 a8c8 d2c3 c8c6 d1d8 f8d8 g3f5 c6c3,2669,95,93,1959,advantage opening veryLong,https://lichess.org/by4jCZy5#31,Sicilian_Defense Sicilian_Defense_Smith-Morra_Gambit
2OYs5,r3k1nr/1p3ppp/pqnbp3/3pNb2/B2P4/2N5/PPP1QPPP/R1B1K2R w KQkq - 2 10,c3d5 b6d4 a4c6 b7c6 e5c4 d4d5,2620,115,90,1476,advantage fork long opening,https://lichess.org/mh9AnkxV#19,Caro-Kann_Defense Caro-Kann_Defense_Other_variations
2Pj8u,r2q1rk1/pb2bpp1/1p2pn2/6N1/3P4/P7/1P3PPP/1BRQ1RK1 b - - 0 19,f6h7 b1h7 g8h8 g5f7 f8f7 d1h5,2656,115,90,1802,crushing kingsideAttack long opening,https://lichess.org/EMkRKE9L/black#38,Queens_Gambit_Declined Queens_Gambit_Declined_Neo-Orthodox_Variation
2Tv5W,r1bq1rk1/pp3ppp/2n1pb2/8/3P3P/3B1N2/PP3PP1/R1BQK2R w KQ - 1 11,d3h7 g8h7 f3g5 h7g8 d1h5 d8a5 c1d2 a5f5,2698,115,90,378,advantage hangingPiece opening veryLong,https://lichess.org/1nzIIE9o#21,French_Defense French_Defense_Tarrasch_Variation
2XG1G,r2qk1nr/pppb1ppp/1b6/1N6/1nQp4/5N2/PB1PPPPP/R3KB1R b KQkq - 1 10,b4c2 c4c2 d7b5 a2a4,2678,118,86,572,advantage opening short,https://lichess.org/Az6VtdF2/black#20,Zukertort_Opening Zukertort_Opening_Reversed_Mexican_Defense
2fqwH,r1bqkb1r/ppp2ppp/2n3n1/1B1P4/4Np2/5N2/PPP3PP/R1BQK2R b KQkq - 0 8,d8e7 e1f2 e7e4 h1e1 f8c5 f3d4,2619,91,80,80,advantage clearance defensiveMove long opening pin sacrifice,https://lichess.org/vOSc1jmc/black#16,Kings_Gambit_Accepted Kings_Gambit_Accepted_MacLeod_Defense
2oCs8,rnb2rk1/ppp4p/4Pqp1/8/1b1PQ3/2N5/PPP3PP/R1B1KBNR w KQ - 1 11,e6e7 f6f1 e1d2 b4e7,2669,112,87,161,crushing opening short,https://lichess.org/zthahTNa#21,Blackmar-Diemer_Gambit Blackmar-Diemer_Gambit_Netherlands_Variation
3093j,r2q1rk1/pp1nn1pp/2p1p3/2bpPbN1/N4BP1/8/PPP1QP1P/R3KB1R b KQ - 0 11,f5c2 e2c2 c5f2 c2f2,2681,86,84,811,advantage hangingPiece opening short,https://lichess.org/9mVbz11h/black#22,Scandinavian_Defense Scandinavian_Defense_Other_variations
31tFS,r1bqk1nr/pp1pbppp/8/8/3QP3/8/PP3PPP/RNB1KB1R w KQkq - 1 8,c1h6 g8h6 d4g7 e7f6 g7h6 f6b2,2612,113,91,1058,crushing interference long opening,https://lichess.org/C9pSvs6u#15,Sicilian_Defense Sicilian_Defense_Old_Sicilian
39EbS,r1b1k1nr/ppp2ppp/2p5/2b5/4P2q/2P5/PP1P1PPP/RNBQKB1R w KQkq - 1 6,d1e2 c8g4 g2g3 h4h5 e2c4 b7b5,2672,92,92,2293,advantage long opening,https://lichess.org/YARJbHEj#11,Kings_Pawn_Game Kings_Pawn_Game_Busch-Gass_Gambit
39HnD,r1bq1b1r/ppp1k1pp/2n5/3n2B1/2Bp2Q1/8/PPP2PPP/RN2K2R b KQ - 5 10,d5f6 g4e2 e7d6 g5f4 d6c5 b1c3,2677,100,86,106,advantage defensiveMove exposedKing long opening,https://lichess.org/gZNakRFG/black#20,Italian_Game Italian_Game_Two_Knights_Defense
3BfQ3,r1bqkbnr/5ppp/pp2p3/2p1P3/2B5/3PB3/PP4PP/RN1Q1RK1 b kq - 1 10,g8e7 d1f3 e7f5 g2g4 a8a7 g4f5,2603,104,90,1358,advantage long opening,https://lichess.org/0H9MHWcU/black#20,Bird_Opening Bird_Opening_Dutch_Variation
3E5iJ,r2q1rk1/ppp3pp/4pn2/n1b1p3/8/P1N2N2/1PPP1PPP/R1BQR1K1 w - - 0 12,f3e5 c5f2 g1f2 d8d4 f2g3 g7g5,2637,116,90,762,advantage attraction defensiveMove kingsideAttack long opening sacrifice,https://lichess.org/8RyEC5HD#23,Russian_Game Russian_Game_Other_variations
3FafY,r2q1rk1/pB1bbppp/n3p3/P1p1N3/1n6/1QNP2P1/1P2PP1P/R1B1K2R w KQ - 1 13,b7g2 d8b8 e1g1 b8e5,2604,88,93,598,advantage master opening short,https://lichess.org/viv0aLLQ#25,Hungarian_Opening Hungarian_Opening_Indian_Defense
3Gbw6,r2qkb1r/pp2pppp/5n2/3p1b2/1n1P4/4BN1P/PPP1BPP1/RN1Q1RK1 b kq - 4 8,b4c2 e2b5 f6d7 f3e5 c2a1 d1f3,2612,86,84,128,clearance crushing long opening sacrifice,https://lichess.org/vocnlnnN/black#16,Caro-Kann_Defense Caro-Kann_Defense_Other_variations
3HMOV,rnbk1r2/ppp3Qp/8/3BP3/1b1q4/2N5/PP4PP/R1BK2NR w - - 2 12,d1c2 c8f5 c2b3 b8d7 c1g5 d8c8,2648,89,92,965,advantage defensiveMove long opening,https://lichess.org/CbKVc9S7#23,Bishops_Opening Bishops_Opening_Ponziani_Gambit
3KrPc,r1bqr1k1/2p2pp1/p1np1n1p/1p6/3PP3/PBP2N1P/3B1PP1/R2QR1K1 b - - 0 15,f6e4 b3d5 e4d2 d5c6 d2f3 d1f3 e8e1 a1e1 a8b8 e1e8 d8e8 c6e8,2669,104,87,362,advantage fork opening veryLong,https://lichess.org/7EZmAo9g/black#30,Italian_Game Italian_Game_Giuoco_Piano
3LUfi,rnbqr1k1/ppN2ppp/8/5n2/1pP5/4B1Q1/PP3PPP/R3KB1R w KQ - 3 15,g3f4 g7g5 a1d1 d8e7 f4f5 c8f5,2694,102,85,135,crushing long opening,https://lichess.org/JJGRCIc1#29,Semi-Slav_Defense Semi-Slav_Defense_Accelerated_Move_Order
3PDT5,rnb1k1nr/pp1pppbp/1q4p1/8/8/2N2NP1/PP1BPPBP/R1Q1K2R b KQkq - 6 8,g8f6 c3d5 f6d5 c1c8 b6d8 c8d8 e8d8 f3g5,2606,83,61,77,crushing discoveredAttack opening trappedPiece veryLong,https://lichess.org/7EUi6KSy/black#16,Benoni_Defense Benoni_Defense_Old_Benoni
3R7Fc,2kr2nr/pppq1ppp/2n5/3NP3/2PP1Bbb/5N2/PP2K1PP/R2Q1B1R w - - 1 11,h2h3 g4f3 e2f3 g8e7 g2g3 e7d5,2657,114,87,749,crushing long opening,https://lichess.org/SMjfKwaZ#21,Vienna_Game Vienna_Game_Vienna_Gambit
3WTo5,r2qk2r/1pp2pp1/p1bp4/2b4p/4n2N/1P2P3/PBPP1PPP/RN1Q1RK1 w kq - 2 11,b2g7 h8h7 g7b2 d8h4,2651,118,91,2737,advantage opening short,https://lichess.org/JPZ3W8so#21,Vant_Kruijs_Opening Vant_Kruijs_Opening_Other_variations
3X2m2,rnbqk2r/p2pppbp/5np1/2pP4/NpP5/1P3N2/P3PPPP/R1BQKB1R b KQkq - 1 7,f6d5 d1d5 g7a1 d5a8 b8c6 c1h6,2608,85,80,138,advantage defensiveMove hangingPiece long opening trappedPiece,https://lichess.org/FQGjyhBL/black#14,Kings_Indian_Defense Kings_Indian_Defense_Normal_Variation
3i5za,r1b1qrk1/pp4pp/5n2/2p3B1/2Pb4/2N5/PP2BPPP/R2Q1RK1 w - - 2 13,f1e1 f6g4 e2g4 d4f2,2694,93,92,1220,advantage kingsideAttack opening sacrifice short,https://lichess.org/IzzdZEZv#25,Queens_Gambit_Declined Queens_Gambit_Declined_Albin_Countergambit
3ilXc,r1b1k2r/ppp2pp1/2nb4/4p2N/3pP1nq/3P4/PPPNBPPP/R1BQ1RK1 w kq - 1 10,h5g7 e8e7 g7f5 c8f5,2689,105,86,374,advantage defensiveMove opening short,https://lichess.org/2wA2Vsms#19,Vant_Kruijs_Opening Vant_Kruijs_Opening_Other_variations
3nyOC,r1bqk2r/pp1p1ppp/2n1p3/8/3Nn1Q1/P1P1B3/2P2PPP/R3KB1R b KQkq - 1 9,d8a5 d4b5 a7a6 g4g7 a6b5 g7h8,2682,110,87,384,advantage long opening,https://lichess.org/rL6v5Wui/black#18,Sicilian_Defense Sicilian_Defense_Four_Knights_Variation
3q4Jb,rnb1k1nr/pp4pp/4pp2/1B1p4/3P4/1Pq2N2/P2N1PPP/R2QK2R b KQkq - 1 10,c8d7 a1c1 c3b2 c1c2,2682,101,88,295,advantage opening short,https://lichess.org/Tk9pSh07/black#20,Nimzo-Larsen_Attack Nimzo-Larsen_Attack_Classical_Variation
3rP8f,r1b2rk1/ppp2ppp/8/n1bpP3/3N2nq/2N4P/PPP2PP1/R1BQRBK1 w - - 1 12,d4f3 c5f2 g1h1 f2e1 d1e1 h4e1,2614,84,70,98,advantage fork long opening pin,https://lichess.org/zTkwQyut#23,Italian_Game Italian_Game_Two_Knights_Defense
3vBmX,rn3rk1/1bqp1pp1/p6p/5N2/8/P1PQ4/2P2PPb/R1B1R2K b - - 0 18,h2f4 d3d4 b7g2 h1g1,2647,98,79,141,crushing opening short,https://lichess.org/smMBUQ6w/black#36,St_George_Defense St_George_Defense_Polish_Variation
3x3p2,r1bq1rk1/ppp2pp1/2n4p/2b1p3/2B2n2/2PP1N1P/PP3PP1/RNBQR1K1 w - - 3 10,f3e5 f4h3 g2h3 c5f2 g1f2 d8h4,2698,96,80,94,attraction crushing kingsideAttack long opening sacrifice,https://lichess.org/IvK33jXG#19,Italian_Game Italian_Game_Giuoco_Piano
3y4JN,r2q1rk1/p4ppp/8/2pb4/Q3p1n1/2P5/P1N1PPPP/R1B1KB1R w KQ - 2 14,e2e3 d8h4 g2g3 h4f6 f2f4 e4f3,2641,103,91,1144,crushing enPassant long opening,https://lichess.org/X8HatT3c#27,Queens_Gambit_Declined Queens_Gambit_Declined_Albin_Countergambit
40sfD,2r1kbnr/p1Qpqppp/b7/1p2P3/1n6/P4N2/1PP1PPPP/RNB1KB1R w KQk - 1 8,c7a7 b4c2 e1d1 e7e6,2621,115,89,1196,advantage fork opening short,https://lichess.org/0M5TNmkd#15,Englund_Gambit_Complex Englund_Gambit_Complex_Stockholm_Variation
43hku,rn1k3r/ppp2Qpp/8/3pP3/3bn2q/1B6/PPP3PP/RNB2R1K w - - 1 12,f7d5 d8c8 c1f4 e4f2 f1f2 h4f2 b1c3 f2f4,2655,111,90,802,advantage defensiveMove kingsideAttack opening veryLong,https://lichess.org/CZ4w25mV#23,Kings_Gambit_Declined Kings_Gambit_Declined_Classical_Variation
45nip,r3k1nr/pppb1p1p/7q/4P3/1b6/2N2QB1/PPP3PP/R3KB1R w KQkq - 1 13,f3b7 b4c3 b2c3 h6e3 f1e2 e3c3 e1f2 c3d4,2671,92,88,92,advantage exposedKing fork opening veryLong,https://lichess.org/dqQwvZcz#25,Vienna_Game Vienna_Game_Vienna_Gambit
47TU5,r1bq1rk1/ppp3bN/2n1p1n1/5pNQ/2P5/6P1/PP3P2/R3KB1R b KQ - 2 15,d8e7 h5g6 e7b4 e1d1 f8d8 f1d3 c6e5 h7f6,2641,93,72,94,crushing hangingPiece opening pin veryLong,https://lichess.org/6TMs4iUd/black#30,Modern_Defense Modern_Defense_Other_variations
4BQeO,rn1qk1nb/ppp2p2/3p4/4Pbp1/2BP1p2/2N2N2/PPP3P1/R1BQK3 b Qq - 3 10,b8d7 f3h4 g5h4 d1h5 d7e5 d4e5,2665,119,87,373,advantage clearance fork long opening sacrifice,https://lichess.org/DtzpOqqs/black#20,Kings_Gambit_Accepted Kings_Gambit_Accepted_Becker_Defense
4DCuO,rn2k2r/ppq2ppp/2p2p2/7b/5b1N/3P3P/PPP1B1P1/R1BQ1RK1 b kq - 2 11,h5e2 d1e2 c7e5 e2g4 f4h2 g1h1,2635,91,80,219,crushing long opening,https://lichess.org/O4ir4zra/black#22,Caro-Kann_Defense Caro-Kann_Defense_Other_variations
4FeQR,r1bk1b1r/ppN2p1p/2n2qp1/3p4/3p4/4P3/PPP2PPP/R2QKBNR w KQ - 1 9,c7a8 f8b4 c2c3 d4c3 d1d5 d8e7,2612,84,56,89,advantage defensiveMove long opening,https://lichess.org/cbaLOWpQ#17,Queens_Pawn_Game Queens_Pawn_Game_Accelerated_London_System
4Hd7d,rn1qkbnr/pp3ppp/2p1b3/4N3/4P3/2N4P/PPPP2P1/R1BQKB1R w KQkq - 1 8,f1c4 d8h4 e1f1 h4f6 e5f3 e6c4,2606,91,91,2154,advantage deflection fork long opening,https://lichess.org/DbiuE3l6#15,Vienna_Game Vienna_Game_Other_variations
4JeCk,r2q1r1k/1pp3pp/p5n1/4bp1b/2Q3P1/2P4P/PPBN1P2/R1B2RK1 w - - 2 18,g4h5 d8g5 g1h1 g6f4 f1g1 g5h5,2618,89,90,344,crushing long opening,https://lichess.org/Ufzst0wd#35,Queens_Pawn_Game Queens_Pawn_Game_Chigorin_Variation
4KT2i,r1b2rk1/pp1n2pp/2pbpq2/3p1p2/2PPn3/1P1BP3/PB1N1PPP/R2QNRK1 w - - 7 11,f2f3 d6h2 g1h2 f6h6 h2g1 h6e3,2656,106,87,184,attraction crushing kingsideAttack long master opening sacrifice,https://lichess.org/juMO5cm1#21,Slav_Defense Slav_Defense_Modern_Line
4PcyT,r1b1k1nN/bppp2pp/p1n2q2/8/2B1P3/8/Pp3PPP/RNBQ1RK1 w q - 0 10,d1d5 b2a1q d5g8 e8e7 h2h4 a7f2 f1f2 a1d4 c1g5 d4f2,2636,87,83,76,advancedPawn attraction crushing kingsideAttack opening pin promotion veryLong,https://lichess.org/JYzSI9yS#19,Italian_Game Italian_Game_Classical_Variation
4PqAO,r1bqk1nr/pp4bp/2np2p1/2p3N1/5P2/2NP4/PPP1Q1PP/R1B2RK1 b - - 1 12,e8d7 e2e6 d7c7 e6f7 d8d7 g5e6,2641,87,83,300,advantage fork long opening,https://lichess.org/aG55oxqB/black#24,Sicilian_Defense Sicilian_Defense_McDonnell_Attack
4PsVK,r2qkb2/pp1bn2p/2n3p1/3p4/Q3p3/2N5/PPPP1PPP/R1B1KB1R w KQq - 3 12,a4b3 c6d4 c3b5 e7c6 b3d5 d4c2,2686,104,91,1426,advantage long opening quietMove,https://lichess.org/2vLaWwj2#23,Latvian_Gambit Latvian_Gambit_Mlotkowski_Variation
4TgTa,r2qk2r/1pp2ppp/1pn5/3pp3/2B1P1b1/P4N2/1PPP1PK1/R1BQ1R2 w kq - 0 13,c4d5 c6d4 d5f7 e8e7,2698,95,83,132,crushing defensiveMove opening short,https://lichess.org/BiNKW2G3#25,Italian_Game Italian_Game_Giuoco_Piano
4Tr9p,2kr1b1r/ppp1pppp/8/4n2q/6n1/3P1N2/PPPNBPP1/R1BQ1RK1 w - - 3 10,g2g3 h5h3 f1e1 g4f2 f3e5 h3g3,2689,96,84,61,capturingDefender crushing kingsideAttack long opening,https://lichess.org/RSjTJ93P#19,Scandinavian_Defense Scandinavian_Defense_Modern_Variation
4c2il,rn1kn2r/ppp1b1pp/4b3/3qN1Q1/8/3B4/PPPN1PPP/R1B2RK1 w - - 5 12,d3c4 e7g5 c4d5 e6d5 f1d1 d8c8,2636,116,89,1312,advantage defensiveMove long opening,https://lichess.org/p6hRL5uh#23,French_Defense French_Defense_Tarrasch_Variation
4cJbP,r3kbnr/ppp1pppp/2n3b1/1N6/4N3/1PB1qPP1/P1P1B2P/R2QK2R b KQkq - 2 14,e3b6 e4c5 a8d8 c5a4 d8d1 a1d1 b6b5 e2b5,2645,119,90,771,crushing opening sacrifice veryLong,https://lichess.org/CX3vhEfe/black#28,Scandinavian_Defense Scandinavian_Defense_Mieses-Kotroc_Variation
4j3F1,r2qkb1r/pb3ppp/2p2n2/2p5/N2p4/1N6/PPPP1PPP/R1BQK2R w KQkq - 2 10,a4c5 f8c5 b3c5 d8d5 e1g1 d5c5,2625,84,76,78,advantage long opening,https://lichess.org/e4lGm39w#19,French_Defense French_Defense_Knight_Variation
4j6UQ,rnb1k2r/pp3ppp/3b4/1Bp5/8/8/q1P1NPPP/1R1Q1RK1 b kq - 1 13,b8c6 d1d6 a2e6 d6c5 e6e7 b5c6,2661,102,90,1322,crushing hangingPiece long opening,https://lichess.org/IU1Qh8Bs/black#26,Indian_Defense Indian_Defense_Reversed_Chigorin_Defense
4oSmd,r2k1b1r/pbp2Qpp/2q2n2/4p1N1/8/8/PPPP1PPP/RNB2RK1 w - - 1 12,f2f3 c6b6 g1h1 b7d5,2642,106,89,1800,advantage clearance opening short,https://lichess.org/TJQaq65n#23,Italian_Game Italian_Game_Two_Knights_Defense
4s0RM,r1bqr1k1/1p1n1pbp/p2p2p1/3P3n/2PN4/2N1p2P/PP2BPPB/R2QR1K1 w - - 0 15,e2h5 e3f2 g1f2 e8e1 f2e1 d8h4 e1f1 g7d4,2653,84,79,158,advancedPawn advantage attraction discoveredAttack kingsideAttack opening veryLong,https://lichess.org/9GVmWWNg#29,Queens_Pawn_Game Queens_Pawn_Game_Other_variations
4zoQl,rn1q1rk1/pbp2ppp/1p2pn1B/8/2PP4/3BP3/P2N1P1P/R2QK1R1 b Q - 3 12,f6e8 g1g7 e8g7 d1g4 d8f6 h6g5 f6g6 d3g6,2696,102,90,793,advantage kingsideAttack opening sacrifice trappedPiece veryLong,https://lichess.org/M0tfyvln/black#24,Indian_Defense Indian_Defense_Other_variations
536CQ,r1b2rk1/pp1n1ppp/1q2pb2/3p3Q/3N4/2P5/PPB2PPP/R1B1R1K1 b - - 5 14,h7h6 c1h6 f8e8 h6g5 d7f8 g5f6,2632,112,90,476,crushing long opening,https://lichess.org/enNqBWD7/black#28,Sicilian_Defense Sicilian_Defense_Modern_Variations
53FwN,r3kb1r/p1p1q1p1/1p1ppn1p/4N3/1P2b3/P1Q4P/2P1PPP1/RN2KB1R w KQkq - 0 14,e5g6 e4g6 c3c6 e8f7 c6a8 f6e4,2634,88,92,973,crushing hangingPiece long opening sacrifice,https://lichess.org/uj33BR6O#27,Horwitz_Defense Horwitz_Defense_Other_variations
59VYU,r1b3kr/pppp2pp/3b4/4q3/4nB2/5Q2/PPP2PPP/RN2R1K1 b - - 3 11,e4d2 b1d2 e5f4 e1e8 g8f7 e8h8,2623,87,93,2277,crushing deflection long opening pin skewer,https://lichess.org/guGpQuj1/black#22,Italian_Game Italian_Game_Two_Knights_Defense
5BRbT,rnb1kb1r/1p3ppp/p2P1n2/4p3/3N1B2/2q1P3/P2N1PPP/R2QKB1R b KQkq - 0 11,e5f4 a1c1 c8g4 f1e2,2655,100,69,203,advantage opening short,https://lichess.org/kFDO2V3Z/black#22,Indian_Defense Indian_Defense_Wade-Tartakower_Defense
5IF3M,r1b1k1nr/ppp2ppp/2n5/1Bb5/3NpP1q/2P3P1/PP5P/RNBQK2R b KQkq - 0 8,h4h3 d4c6 b7c6 b5c6 e8e7 d1d5,2610,106,90,775,advantage fork long opening,https://lichess.org/48DGgq2X/black#16,Kings_Gambit_Declined Kings_Gambit_Declined_Classical_Variation
5JI43,r1bqk2r/2pp1ppp/p1n5/1p1P4/8/1B3N2/P4PPP/b1BQR1K1 b kq - 1 13,e8f8 d5c6 d7d6 f3g5,2603,90,92,1045,advantage opening short,https://lichess.org/sK8TokVv/black#26,Ruy_Lopez Ruy_Lopez_Morphy_Defense
5Obj6,r1b1kb1r/p1p2p2/1p4p1/3BpN2/4P3/4KPpq/PPPPR3/RNBQ4 w kq - 0 16,d5a8 c8a6 c2c4 a6c4,2686,116,87,291,advantage opening short,https://lichess.org/RdB1snUi#31,Italian_Game Italian_Game_Blackburne-Kostic_Gambit
5PJq9,r3k1nr/pbpp1ppp/1p6/3qn3/8/2P2BP1/PP1P3P/RNBQRK2 b kq - 4 12,d5d3 f1f2 d3f5 e1e5 f5e5 f3b7,2601,111,91,786,advantage defensiveMove long opening pin,https://lichess.org/HE9QNT3w/black#24,Italian_Game Italian_Game_Giuoco_Piano
5b8eQ,rn2kbnr/1b4pp/pq2N3/2p5/5P2/2pP4/PPP1B1PP/R1BQ1RK1 b kq - 0 11,c3b2 e2h5 g7g6 c1b2,2655,102,88,287,crushing intermezzo opening short,https://lichess.org/IUna6NTn/black#22,Sicilian_Defense Sicilian_Defense_Closed
5ib5s,rn1q1rk1/1p2b1pp/p4n2/3Np3/8/3BB2P/PPP2PP1/R2QK2R b KQ - 0 13,f6d5 d3c4 d8a5 d1d2 a5d2 e3d2,2696,87,68,73,advantage defensiveMove long opening pin,https://lichess.org/rUlyXRv0/black#26,Sicilian_Defense Sicilian_Defense_Najdorf_Variation
5jXUB,r2qrbk1/1bp2ppp/p1np1n2/1p6/3PP3/1B3N1P/PP3PP1/R1BQRNK1 b - - 0 15,f6e4 e1e4 e8e4 f3g5 d6d5 d1h5,2603,86,92,1543,advantage clearance long master masterVsMaster opening sacrifice,https://lichess.org/htvAQtQK/black#30,Ruy_Lopez Ruy_Lopez_Closed
