PuzzleId,FEN,Moves,Rating,RatingDeviation,Popularity,NbPlays,Themes,GameUrl,OpeningTags
ri0T7,r1bqk2r/pp1pbppp/2p2n2/6B1/4P3/2N5/PPPQ1PPP/R3KB1R b KQkq - 5 8,f6e4 c3e4 d7d5 e1c1,2265,81,80,297,advantage castling defensiveMove hangingPiece opening short,https://lichess.org/An3f5r79/black#16,Scotch_Game Scotch_Game_Other_variations
2mI8B,r1b1k2r/pp3ppp/4pb2/3q4/1B6/P7/2Q2PPP/3RKB1R b Kkq - 3 16,d5e5 f1e2 a7a6 e1g1,2292,85,84,1015,advantage castling defensiveMove middlegame short,https://lichess.org/HxPAk9v9/black#32,Sicilian_Defense Sicilian_Defense_Wing_Gambit_Deferred
uSiMo,r4rk1/3qb1p1/2pp2P1/pp2p1N1/1n2P1n1/P1N1B3/1PPQ1P2/R3K1R1 b Q - 0 19,g4e3 f2e3 e7g5 g1g5 d7h3 e1c1,2273,95,90,748,advantage castling defensiveMove long middlegame,https://lichess.org/naYtUNhm/black#38,Philidor_Defense Philidor_Defense_Other_variations
xQdFV,4rr1k/1p4p1/pq6/3QRb2/5P2/P5P1/1PP3KP/R7 b - - 0 22,f5c2 e5e8 f8e8 d5h5 h8g8 h5e8,2222,75,93,8287,attraction clearance crushing fork long middlegame,https://lichess.org/jUBEIJNH/black#44,
YpEjy,r6q/1p4p1/3P1p2/pB1Q1Pk1/1b4nr/4P1N1/PP4P1/R4RK1 w - - 3 28,f1f4 h4h1 g3h1 h8h2 g1f1 g4e3 f1e2 e3d5,2289,77,96,1482,clearance crushing fork middlegame pin sacrifice veryLong,https://lichess.org/ILbkLOVw#55,
8NUH6,3r2k1/pp2Qr1p/1q4pB/3p4/8/2N5/PP3bPP/RK5R w - - 2 23,e7e5 f2d4 e5g3 f7f2 h6c1 d8c8,2202,76,84,79,advantage clearance long middlegame,https://lichess.org/9WanvWiP#45,
l49lz,5rk1/3PR1p1/5n1p/8/pp1N1p2/1P5P/5PPK/8 b - - 1 36,a4a3 d4e6 a3a2 e6f8 f6d7 e7e1,2291,84,90,1819,clearance crushing defensiveMove endgame long,https://lichess.org/J0M8F82H/black#72,
XqirM,1Q6/5pk1/P3p2p/3p3q/3n4/6P1/5P1N/7K b - - 0 39,d4f3 g3g4 h5h4 b8g3,2222,77,87,277,clearance crushing endgame short,https://lichess.org/1gdzTd4c/black#78,
b3aLO,r3k2r/1pp5/p1np4/4pnBp/1PPP4/P4NPq/5P2/R2QR1K1 b kq - 0 18,c6d4 f3d4 f5g3 d1f3 h8g8 f3g3 h3g3 f2g3,2213,78,91,885,advantage clearance middlegame pin veryLong,https://lichess.org/F73ZmrAZ/black#36,Vienna_Game Vienna_Game_Other_variations
RaMbG,rnbq1r2/pp3ppk/4p3/3pP3/4n2P/5N2/PB3PP1/R2QR1K1 b - - 2 15,b8c6 f3g5 e4g5 d1h5 h7g8 h4g5,2293,87,88,367,advantage clearance intermezzo long opening sacrifice,https://lichess.org/yKFeUj7A/black#30,Sicilian_Defense Sicilian_Defense_Smith-Morra_Gambit_Deferred
EXQT6,2r2rk1/p6p/3P1Pp1/1R4N1/P1p2P2/2Q3PK/7P/3q4 b - - 0 37,d1d6 f6f7 f8f7 c3h8 g8h8 g5f7 h8g7 f7d6,2276,87,85,47,advancedPawn advantage attraction clearance endgame fork master sacrifice veryLong,https://lichess.org/VRSA0ZhT/black#74,
EKqmU,R7/3rkpp1/1Q5p/2p5/4n3/1P1q4/6PP/5RK1 w - - 2 25,f1e1 d3e3 e1e3 d7d1 e3e1 d1e1,2264,82,90,1213,clearance endgame long mate mateIn3 sacrifice,https://lichess.org/mG5IZwTS#49,
nJEmj,3r1rk1/p1p3pp/1pq2Pn1/2n1p1P1/3pP1Q1/P2P2P1/1P2B1K1/R1B2R2 w - - 1 24,f6g7 f8f1 e2f1 c5b3 a1b1 c6c2,2273,143,61,13,clearance crushing long middlegame,https://lichess.org/h3LCqHAz#47,
HuT3k,6k1/1p4b1/3p3p/p4N2/2Pp4/P4Q2/1q3PPK/8 b - - 1 34,d4d3 f5e7 g8h8 f3f7,2237,76,95,952,clearance crushing endgame master short,https://lichess.org/203EfzpC/black#68,
XwK8m,r3n3/pp1nqrpk/2p1p1Rb/3pB2Q/PP6/2P2N1P/2K2P2/6R1 b - - 11 25,f7f5 g6h6 g7h6 h5g6,2222,78,94,3815,clearance mate mateIn2 middlegame sacrifice short,https://lichess.org/QmW1U8Bd/black#50,
rTn2s,8/p2k1r2/1p2p2Q/2pp1p2/5P2/5q2/4R2P/4K3 b - - 1 34,f3h1 e1f2 f7e7 e2e1 h1e1 f2e1,2234,77,89,1072,advantage clearance endgame long trappedPiece,https://lichess.org/YFH1I03L/black#68,
8jnAU,2r2k2/R5p1/5p1p/3p4/P1b5/3pP1P1/5P1P/2R3K1 w - - 0 35,a4a5 d3d2 c1d1 c4e2 d1d2 e2f3 d2d1 f3d1,2243,78,86,68,advancedPawn clearance crushing endgame quietMove veryLong,https://lichess.org/PB2kGHei#69,
rKqqT,r5k1/p4p2/1ppn1p1p/3b3q/P4P1N/3P2PP/3Q2BK/4R3 b - - 1 29,a8e8 e1e8 d6e8 d2e1,2267,78,91,1193,advantage clearance middlegame short,https://lichess.org/IHSXRYPr/black#58,
csXvb,6k1/pp3q1p/2n1Q1p1/3N4/3b2B1/6PP/PP4K1/8 b - - 0 26,d4b2 e6c8 g8g7 g4e6 c6e7 c8d7,2291,74,92,6667,advantage clearance endgame long,https://lichess.org/f5tM8shG/black#52,
XcUaT,2r2bk1/4qp1p/4n1p1/pB6/6Q1/1P3N1P/5PP1/3R2K1 w - - 0 38,d1d7 c8c1 g1h2 e7c5 b5c4 f8d6 d7d6 c5d6,2222,77,84,113,clearance crushing middlegame veryLong,https://lichess.org/mKy87auG#75,
zVfXI,r6k/rR6/P1p5/2Np2pp/5p1n/3P3K/8/1R6 b - - 1 37,h4f5 b7a7 a8a7 b1b8 h8g7 b8b7,2214,78,91,1265,clearance crushing endgame exposedKing long master,https://lichess.org/SXvIJKGK/black#74,
RyFDq,5rk1/5pp1/r2p1q1p/pNp1nbn1/2P5/7P/1PQB1PP1/RB3RK1 w - - 5 22,d2g5 e5f3 g1h1 f6e5 g5f4 e5f4,2220,115,68,15,advantage clearance kingsideAttack long middlegame,https://lichess.org/55mqrcKn#43,
9cLfs,8/n2b1pk1/1p2p1p1/pP1pP1P1/P1qP1R2/4P3/3Q2P1/7K b - - 0 37,a7c8 d2f2 d7e8 f4h4 g7f8 f2f6,2259,79,100,66,clearance crushing endgame long master quietMove,https://lichess.org/slWyX68j/black#74,
EHxo6,6rk/2R3p1/7p/8/2p1P3/2q2P2/6PP/6QK w - - 0 34,g1f1 g8a8 c7b7 a8a1 b7b1 a1b1,2246,76,91,457,crushing endgame long pin quietMove,https://lichess.org/Y8b3e7SC#67,
eWeoc,8/1p6/p1nPk2p/2P1Bpp1/2K2P1P/6P1/8/8 w - - 0 44,h4h5 c6e5 f4e5 f5f4 c5c6 b7c6 g3f4 g5f4 c4c5 f4f3 c5c6 f3f2 d6d7 f2f1q d7d8q f1b5 c6c7 b5a5 c7c8 a5d8,2247,77,86,99,advancedPawn crushing endgame promotion veryLong,https://lichess.org/tgI7y1VZ#87,
s8ycs,3r1qk1/ppp1p1b1/4p1Q1/7p/6nP/2N5/PPP1nPP1/R1B2RK1 w - - 6 16,g1h1 e2g3 h1g1 g3f1,2219,78,92,9623,crushing kingsideAttack middlegame short,https://lichess.org/zgtWh4iS#31,Modern_Defense Modern_Defense_Other_variations
lHcxI,2r1n3/4k2B/p3pp1R/2qp4/6Q1/N1n1P3/1PP2PP1/1K6 w - - 4 31,b1a1 c8b8 h6h1 b8b4 g4b4 c5b4,2297,82,76,70,crushing long middlegame,https://lichess.org/Lc9eaDEk#61,
GR0jq,8/7p/p2k1p1P/1p1P1P2/P2Kp3/4P3/8/8 w - - 0 45,a4b5 a6b5 d4e4 d6c5 d5d6 c5d6,2221,75,71,125,crushing endgame long pawnEndgame zugzwang,https://lichess.org/RkDwGEJP#89,
gOTF1,1kr5/pp6/4p2Q/8/3Kb1P1/P4q2/5P1P/2R3R1 w - - 14 35,h6e3 e6e5 d4e5 c8e8,2293,79,90,1158,attraction crushing endgame short,https://lichess.org/smlAux1l#69,
pG3iu,r1bQ2k1/p7/1p2p1p1/8/8/P1R5/2P1Brq1/1R2K3 b - - 1 24,g8g7 d8d4 g7g8 d4f2,2220,84,86,98,crushing middlegame short,https://lichess.org/nHgOwVIE/black#48,
sXzlh,3r2k1/p4p2/1p2p1B1/3b3q/3P4/2r3R1/P4Q2/4RK2 b - - 0 29,h5h1 f1e2 h1f3 g3f3 d5f3 e2d2,2285,76,93,3506,crushing defensiveMove long master masterVsMaster middlegame,https://lichess.org/1iMDdZ9y/black#58,
zQkgw,1k6/ppp4r/2n3p1/2b4q/5P2/3p2Q1/PPP3PP/R1B2R1K w - - 0 24,c2c3 c5f2 g3h3 h5e2 c1e3 h7h3,2204,78,93,231,crushing discoveredAttack long middlegame,https://lichess.org/1R3U3rpx#47,
WEQ9T,k1r4q/1p6/p7/8/1P4N1/P3QP2/1KP5/4R3 w - - 3 44,b2a2 c8c2 a2b3 h8b2 b3a4 c2c3 e3c3 b2c3,2245,75,84,232,crushing endgame veryLong,https://lichess.org/TqqJLO6m#87,
3yZ9B,4rk2/5pb1/p7/1p4p1/1qp5/4pP1R/PPQ1K1P1/7R b - - 5 37,g7b2 h3h8 b2h8 h1h8 f8g7 h8e8,2249,75,95,1859,crushing deflection endgame long sacrifice skewer,https://lichess.org/Jn09M6Aj/black#74,
NUDtZ,1r3rk1/p5p1/P1p2q2/1pPp1pnp/3Pp1n1/4P1B1/1P2B1R1/R2Q1NK1 w - - 4 28,g3b8 g5h3 g1h1 h3f2,2228,74,86,287,crushing kingsideAttack middlegame short,https://lichess.org/hnbn2waC#55,
OgS03,1r6/8/R1p3k1/3b2P1/8/KP2B1r1/8/4R3 w - - 1 38,a6b6 b8b6 e3b6 g3b3 a3a4 b3b6,2241,77,94,2036,crushing endgame fork long master,https://lichess.org/CD0cTrRI#75,
pLNac,1R6/2K1kp2/2P3p1/7p/5P1P/2r5/8/8 w - - 3 55,b8d8 c3c6 c7c6 e7d8 c6d5 d8d7 d5e5 d7e7 f4f5 f7f6,2240,89,71,26,crushing deflection endgame rookEndgame veryLong zugzwang,https://lichess.org/NIB4DRho#109,
asOUv,8/1p1kb1N1/6p1/p1ppP3/5Pp1/2P5/PP3K1P/8 w - - 0 28,f2g3 e7f8 f4f5 f8g7,2245,75,91,877,crushing endgame short trappedPiece,https://lichess.org/mEStxn82#55,
80CdM,2q3k1/p4pp1/5b1p/4pN2/5n2/4Q3/PPP2PPP/5RK1 w - - 2 24,g2g4 c8c6 f2f3 c6c2 e3f2 f4h3 g1g2 h3f2,2225,79,90,617,crushing endgame fork veryLong,https://lichess.org/hnXyDrTR#47,
86oyo,r1bqk2r/pp2ppbp/2np1np1/8/3NP3/2N1B3/PPP1BPPP/R2Q1RK1 b kq - 5 8,f6g4 e2g4 c8g4 d4c6 g4d1 c6d8,2295,77,61,49,crushing long opening,https://lichess.org/0MoexHtj/black#16,Sicilian_Defense Sicilian_Defense_Dragon_Variation
fWUQK,4b3/8/3k4/1pN2ppp/pPp3P1/P1P1KP1P/8/8 b - - 0 46,f5f4 e3d4 e8g6 g4h5 g6h5 c5e4,2236,106,75,27,crushing defensiveMove endgame long,https://lichess.org/G12Z5vKe/black#92,
56CAf,3B4/6K1/p7/1p3p1k/2p5/4p2P/PPP5/8 w - - 0 53,g7f6 c4c3 b2c3 e3e2,2276,77,84,121,advancedPawn bishopEndgame crushing endgame short,https://lichess.org/s6DBEWeC#105,
FOaFk,8/6p1/k4pp1/3K4/6P1/7P/8/8 b - - 1 51,f6f5 d5e5 a6b5 g4f5 g6f5 e5f5,2273,87,91,47,crushing endgame long pawnEndgame,https://lichess.org/pSIzEsUv/black#102,
9j2kK,rn3k2/pppq1prp/5p1Q/4p3/2P5/5NP1/P3KP1P/3R3R b - - 3 19,d7e7 f3h4 e7c5 d1d8 f8e7 h1d1,2234,92,57,25,advantage clearance defensiveMove long middlegame quietMove,https://lichess.org/jTx6Vvhr/black#38,Scandinavian_Defense Scandinavian_Defense_Main_Line
mFVOq,1r3rk1/4npBp/p1p1b1p1/4p1QP/N3p1P1/qP1P1N2/P4P2/3K2RR b - - 0 22,g8g7 h5h6 g7g8 g5f6 e6b3 d1e2 e4d3 e2f1,2279,86,86,101,crushing defensiveMove middlegame sacrifice veryLong,https://lichess.org/i2u1wvKd/black#44,
KrRMR,8/8/4n3/p4p2/k4P2/3N2K1/P7/8 w - - 0 51,g3f2 a4a3 f2e3 a3a2 e3d2 a2b3,2226,82,87,867,crushing defensiveMove endgame knightEndgame long,https://lichess.org/f1rwHqwT#101,
mjhDE,8/1p6/8/1P2p3/4k1pp/4B3/6K1/8 w - - 1 38,e3g5 h4h3 g2g3 e4d3 g5e7 e5e4,2285,85,90,2663,bishopEndgame crushing defensiveMove endgame long,https://lichess.org/QRmssxRM#75,
CNqB9,8/7p/p7/4p3/1P6/P5Pk/2K4P/8 b - - 0 50,h3h2 a3a4 h2g2 b4b5 a6b5 a4a5,2239,85,87,42,crushing defensiveMove endgame long pawnEndgame quietMove,https://lichess.org/leQdCSI8/black#100,
KE9xB,6k1/5p2/4rPp1/p1p1P3/Pp1p2K1/1P1PnN2/2P5/4R3 w - - 5 41,g4f4 e3g2 f4e4 g2e1 f3e1 g6g5,2273,81,86,312,crushing defensiveMove endgame fork long,https://lichess.org/GDTLfgNT#81,
HtL6M,8/8/pp5k/2p1p1pp/2P1Pq2/PP3Q2/4K1B1/8 w - - 0 48,b3b4 f4f3 e2f3 g5g4 f3g3 h6g5,2283,80,91,269,attraction crushing defensiveMove endgame exposedKing long master,https://lichess.org/aKViXZAg#95,
67EQV,8/2p3p1/p1p5/5k2/1PPP1P2/P7/6Kp/8 b - - 1 36,f5f4 a3a4,2281,130,93,38,defensiveMove endgame equality oneMove pawnEndgame,https://lichess.org/HiEJKGlZ/black#72,
SsQoR,8/p7/2p3k1/6Pp/8/2P5/PP1K4/8 w - - 1 34,d2e2 g6g5 e2f3 g5f5,2263,76,89,934,crushing defensiveMove endgame pawnEndgame short,https://lichess.org/CmD7lSZQ#67,
5aTHz,8/7r/p5k1/5p2/8/P4K2/7R/8 w - - 0 49,h2h7 g6h7 a3a4 a6a5,2279,75,86,122,crushing defensiveMove endgame master masterVsMaster short,https://lichess.org/ZMMzsq9C#97,
UKjAN,8/3k4/6KP/3P4/p1n4P/5P2/8/8 b - - 0 51,a4a3 h6h7 c4e5 g6f6 a3a2 h7h8q a2a1q h8g7 d7c8 g7f8,2252,76,79,75,advancedPawn crushing defensiveMove endgame exposedKing knightEndgame promotion veryLong,https://lichess.org/muSkv5If/black#102,
b1biN,r1bqk3/1pp1bpp1/4p3/p2n4/1n1P4/1Q3N1P/PPP1NPP1/R3KB1R w KQq - 0 15,a2a3 a5a4 b3c4 b7b5 c4b5 c7c6 b5c4 c8a6,2230,77,90,490,advantage defensiveMove middlegame veryLong,https://lichess.org/F7JWyyqU#29,French_Defense French_Defense_Two_Knights_Variation
mZLWC,2N5/8/2k5/1pp5/p1n5/P1PK4/1P6/8 w - - 18 63,d3c2 c6d7 c8a7 c4d6,2290,82,77,36,crushing defensiveMove endgame knightEndgame short,https://lichess.org/tcWBPLWj#125,
O4W43,3r1b1r/3k2pp/1q3pn1/3Pp3/4P3/2P2B2/P1Q2PPP/1R4K1 b - - 5 21,b6d6 b1b7 d7c8 c2b3,2274,83,53,139,crushing defensiveMove middlegame short,https://lichess.org/IwM5YSo5/black#42,
LAz0r,8/8/6r1/3p2PK/3B4/3kP3/8/8 b - - 0 77,g6g8 g5g6 d3e4 h5h6 e4f5 g6g7 f5e6 h6g6,2210,136,81,11,advancedPawn crushing defensiveMove endgame veryLong,https://lichess.org/0FGxpGS6/black#154,
MVJfb,4k3/2p5/1p1p4/1P1Pp1b1/4Ppp1/8/4KN2/4B3 b - - 5 56,f4f3 e2f1 g4g3 f2h3 g3g2 f1g1,2286,74,92,1262,advantage defensiveMove endgame long master,https://lichess.org/wvuYe7IO/black#112,
N9jwY,Q7/p4pkp/4q1p1/2p1P3/2P5/2B4P/P4bP1/7K w - - 6 32,a8a7 e6c4 e5e6 g7h6 c3d2 g6g5,2264,80,73,88,crushing defensiveMove endgame long,https://lichess.org/yDBnB3n7#63,
AuWmB,7R/Qbk5/4p1B1/p2pP1P1/2p2PP1/2q1P1K1/1r6/8 w - - 2 35,a7b8 c7b6 b8d6 b6a7 d6c5 a7a6,2260,120,90,15,crushing defensiveMove endgame long pin,https://lichess.org/OTMVeUbj#69,
bz7mF,8/1p2kpb1/2p4p/1p4p1/rP1Pb3/r6P/P3BBP1/R3R1K1 b - - 1 26,a3a2 a1a2 a4a2 e2g4,2257,78,89,688,advantage defensiveMove master middlegame pin short,https://lichess.org/ocHmgffD/black#52,
avpMX,5k2/5p2/2K5/3P4/2P1n1p1/1P6/7P/8 b - - 4 42,e4d2 d5d6 d2b3 d6d7 b3d4 c6d6,2259,92,91,2388,advancedPawn crushing defensiveMove endgame knightEndgame long,https://lichess.org/gaRPLuvX/black#84,
iD5V6,4r1k1/1q3pp1/p6p/1p2b3/3p2QP/1P6/PB1P1PP1/2R3K1 w - - 1 25,b2d4 h6h5 g4h5 e5d4,2239,77,91,1340,crushing deflection endgame short,https://lichess.org/KwDXSu4v#49,
gioIV,r1r1b2k/pQ4pp/7n/3B2N1/4P1PP/1Pq2P2/P3K3/R6R w - - 2 28,h1d1 c3b2 d1d2 b2a1,2284,82,82,51,advantage deflection middlegame short,https://lichess.org/1VBfvqYz#55,
vqRuY,1r1r2k1/5pp1/p1p1b2p/2p5/N1P1PqPP/1P5Q/P3K2N/R6R w - - 3 25,h3f3 e6g4 h2g4 d8d2 e2e1 f4f3,2261,79,90,1479,crushing deflection exposedKing long middlegame pin sacrifice,https://lichess.org/RBu9ZtdX#49,
S3Xah,N5k1/1p3qbp/p1r3p1/3pBb2/8/1P3PQ1/P1PPN1PP/2KR3R w - - 1 19,e5g7 c6c2 c1b1 c2d2 b1c1 d2c2,2221,75,96,296,crushing deflection discoveredAttack long middlegame queensideAttack,https://lichess.org/ow4IKHrV#37,
z2P1Z,8/r7/P7/1P4k1/7p/3K2p1/8/4R3 w - - 0 53,e1g1 g5g4 g1a1 g3g2 b5b6 a7a6 a1a6 g2g1q,2235,82,91,2048,advancedPawn crushing deflection endgame promotion rookEndgame veryLong,https://lichess.org/LW61CA6h#105,
LIJam,3r1q1k/pp4pp/8/8/3np3/4Q2P/PP2B1P1/2R3K1 w - - 0 26,e3e4 f8f4 e4f4 d4e2 g1h2 e2f4,2242,80,82,390,attraction crushing deflection endgame fork long sacrifice,https://lichess.org/8VQdzhL6#51,
hMhH0,8/6R1/5pp1/4pPk1/4P3/3r2P1/4K3/8 b - - 5 45,d3a3 g7g6 g5h5 g6f6,2216,94,89,1157,crushing deflection endgame master rookEndgame short,https://lichess.org/VySQIoEK/black#90,
Aaizy,3r3Q/p3kpp1/b4b1p/1p3p2/1P6/q7/2B2PPP/4R1K1 b - - 1 29,f6e5 e1e5 e7f6 h8d8 f6e5 d8e7,2298,95,90,266,crushing deflection hangingPiece long middlegame,https://lichess.org/AIE6oGZn/black#58,
6DutI,r1b3k1/1pp3pp/p4r2/2P5/PP1Nppq1/2N3P1/2Q1PPK1/R3R3 w - - 0 22,c2e4 g4h3 g2g1 f4g3,2213,75,95,678,crushing deflection middlegame short,https://lichess.org/I7nNuGen#43,
F8ADz,3r1rk1/4qpp1/p3p2p/1p1bP3/2p1N3/P3Q2P/1PP2PP1/3RR1K1 b - - 1 21,e7c7 e4f6 g7f6 e3h6 f6e5 e1e3,2245,75,92,3160,crushing deflection long middlegame sacrifice,https://lichess.org/Nmxd2G6m/black#42,
FzaPD,5q2/ppp1r1k1/3p1rpp/3Ppn2/2P1QP1P/5RPB/PP6/4R1K1 w - - 5 25,e1f1 f5g3 f3g3 e5f4,2296,76,94,1767,crushing deflection middlegame short,https://lichess.org/vWgN5FS0#49,
x56rz,r2q1rk1/ppp1bppp/3p1n2/3P2NP/4PBb1/2NQ4/PPP3P1/R3K2R b KQ - 2 12,g4h5 g5h7 f6h7 h1h5,2288,84,88,46,advantage deflection middlegame short,https://lichess.org/zyZrM8LU/black#24,Englund_Gambit_Complex_Declined Englund_Gambit_Complex_Declined_Other_variations
wP7QA,2rr2k1/pp3p1p/4b1p1/4Q3/4R3/P2B4/qPPK1PPP/4R3 w - - 5 22,e4h4 c8c2 d2c2 a2b3 c2c1 b3d3,2264,75,91,3780,attraction crushing deflection long master middlegame pin sacrifice,https://lichess.org/kSlv9v6E#43,
lj6yp,5rk1/1R4p1/1p4P1/2p1K2p/P7/3P4/8/8 b - - 1 48,f8f6 b7b8 f6f8 b8b6 f8a8 a4a5,2244,115,73,17,crushing defensiveMove deflection endgame long rookEndgame,https://lichess.org/39lkDnCE/black#96,
20VCL,r1q3r1/1b1nbpk1/pp1p1n2/4p1B1/P1B1P3/2N3RP/1PP1QPP1/R5K1 b - - 4 18,g7f8 g5h6 f8e8 g3g8 f6g8 c4f7,2257,79,85,268,attackingF2F7 crushing deflection discoveredAttack long middlegame,https://lichess.org/9gwZIavK/black#36,Sicilian_Defense Sicilian_Defense_Najdorf_Variation
guwTF,2kr2nr/ppp2p2/2n2qp1/4p3/1PNbP3/P2P2Pp/2P1NP1P/1RBQ1RK1 w - - 1 18,c2c3 f6f3 e2f4 d4f2 f1f2 f3d1,2222,76,95,249,crushing deflection kingsideAttack long middlegame,https://lichess.org/P2Un5Ur6#35,Elephant_Gambit Elephant_Gambit_Other_variations
ynCK0,8/8/2pk4/3bpp2/3R3P/2R1K3/1r3P2/8 w - - 2 48,d4a4 f5f4 e3d3 b2f2,2217,88,90,976,crushing deflection endgame short,https://lichess.org/XmLiixsh#95,
19aqJ,r2q1rk1/p1p3pp/1p3B2/5P2/7P/2PB4/PPQ2P2/2Kb2R1 b - - 0 21,d1c2 d3c4 f8f7 g1g7 g8h8 g7f7 d8f6 f7f6,2276,90,89,421,crushing deflection discoveredAttack kingsideAttack middlegame pin veryLong,https://lichess.org/Mq5LIEMd/black#42,
walzY,6rk/1pp4p/2n1b3/p1p1p2q/4Pp2/P1PP1N1P/1P2QPPK/R4R2 w - - 7 21,f3g1 g8g2 h2g2 e6h3 g1h3 h5e2,2283,116,93,40,attraction deflection equality long middlegame sacrifice,https://lichess.org/3fDIfme2#41,
QgtER,r3rk2/p5p1/bp2qpP1/2nRp1P1/2P4Q/4P3/P4PB1/2K4R b - - 0 26,a8c8 h4h8 e6g8 g5f6,2245,76,80,117,crushing deflection master middlegame short,https://lichess.org/5jHd8keL/black#52,
i2lU2,2rq1rk1/p4p1n/4n1pR/3p2p1/1p1B1bP1/2P2N2/PPQN1P2/2K4R b - - 3 22,e6d4 h6g6 g8h8 g6g8 f8g8 c2h7,2219,76,89,613,discoveredAttack kingsideAttack long mate mateIn3 middlegame,https://lichess.org/Kk1KflVi/black#44,
BlJMM,r5k1/pR3pp1/4p2p/2Qnq3/8/P2B1nP1/5P1P/2R3K1 w - - 3 31,g1g2 f3e1 c1e1 d5f4 g3f4 e5c5,2252,79,90,1361,advantage discoveredAttack fork long middlegame sacrifice,https://lichess.org/wJ7rRolV#61,
YHaq6,r5k1/pp3p1p/3p2p1/2pPb3/4Pn1q/2NBQ2b/PP3PP1/3RR1K1 w - - 0 18,g2h3 h4g5 e3g3 f4h3 g1g2 e5g3,2207,79,87,134,crushing discoveredAttack kingsideAttack long middlegame pin,https://lichess.org/LAbIN8uC#35,Benoni_Defense Benoni_Defense_Classical_Variation
e70o3,r4rk1/ppp3pp/2n5/3R4/7q/2P2PN1/PP3bKP/R1BQ4 b - - 2 16,f2b6 d1b3 h4e7 d5d7 g8h8 d7e7,2236,107,86,35,crushing discoveredAttack long master middlegame,https://lichess.org/6juAgFFz/black#32,Vienna_Game Vienna_Game_Frankenstein-Dracula_Variation
lWWEz,7r/5rk1/ppq2pp1/2p1nB1p/P1R5/2B1P1Q1/2P4P/5RK1 b - - 0 35,e5c4 f5g6 c6d6 g6f7 d6g3 h2g3 g7f7 f1f6 f7e7 f6f4,2291,84,86,49,crushing discoveredAttack master middlegame veryLong,https://lichess.org/HiARjeAS/black#70,
w4ZHa,r3rk1q/ppp1np2/3b2n1/3p1PN1/6Q1/2NP4/PP4PP/R4R1K b - - 0 20,g6e5 g5e6 f7e6 f5e6 e7f5 g4f5,2226,77,82,133,advantage discoveredAttack long middlegame sacrifice,https://lichess.org/2vkdSrKY/black#40,
Zi3bf,4r1k1/pQ3pp1/3b3p/4nPq1/3p2P1/7P/PP2rPBN/R4RK1 w - - 0 23,b7a6 g5f4 a6e2 e5f3 h2f3 e8e2,2268,78,93,90,advantage discoveredAttack kingsideAttack long middlegame sacrifice,https://lichess.org/k2llSUkk#45,
NhB1j,2k4r/pppb2pp/8/1N2B3/2B1n2q/1Q2P3/PP3rP1/RN3RK1 w - - 0 17,b1c3 f2g2 g1g2 d7h3 g2h1 h3f1,2283,78,84,73,advantage attraction discoveredAttack kingsideAttack long middlegame sacrifice skewer,https://lichess.org/P5ti1o4V#33,Englund_Gambit_Complex Englund_Gambit_Complex_Soller_Gambit
4Ebor,7k/8/P1Rp3b/3Pp3/4P2p/r4p2/5K2/6R1 w - - 2 48,c6d6 h6e3 f2f3 e3g1 f3g4 h4h3 d6h6 h8g7 h6h3 a3a6 g4f5 g1d4 h3g3 g7f7,2289,160,79,25,crushing defensiveMove discoveredAttack endgame exposedKing quietMove skewer veryLong,https://lichess.org/QEGJdIVu#95,
apj4r,2b2rk1/4n1r1/P2q2Bb/3P1p1N/2p1pN1P/2P3Q1/1P4P1/3R2K1 b - - 2 32,h6f4 g6h7 g8f7 g3g7 f7e8 h5f4,2230,77,97,334,advantage discoveredAttack exposedKing kingsideAttack long middlegame pin,https://lichess.org/hSSYhVxl/black#64,
aTH8r,r2qk2r/1p2bpp1/p1bppn1p/8/4PP1B/2N5/PPP1Q1PP/2KR1B1R b kq - 1 12,f6e4 c3e4 e7h4 e4d6 e8f8 d6f7 f8f7 d1d8,2238,83,87,513,crushing discoveredAttack opening veryLong,https://lichess.org/IBsK9b7C/black#24,Sicilian_Defense Sicilian_Defense_Modern_Variations
J9tr2,4r1rk/pppn4/2n4B/5Q2/1b1q4/2N4P/PPP3P1/R4R1K b - - 2 20,b4c3 f5h5 e8e7 h6e3 e7h7 e3d4,2284,84,82,142,advantage discoveredAttack exposedKing long middlegame,https://lichess.org/yOujI6QH/black#40,
X4Zha,r1bq1rk1/1p2bpp1/2p1pn1p/4N3/p2P3B/P1P5/B1P1QPPP/R3R1K1 b - - 0 16,f6d7 e5f7 f8f7 e2e6,2218,77,93,5428,capturingDefender crushing discoveredAttack master middlegame short,https://lichess.org/khbg4rjd/black#32,Scandinavian_Defense Scandinavian_Defense_Mieses-Kotroc_Variation
VNWP7,8/pp2rk2/2bQpnr1/5p2/2P5/6P1/P3RK1P/4R3 w - - 1 36,e2e6 f6g4 f2g1 g6e6 e1e6 e7e6,2273,127,87,26,crushing discoveredAttack long middlegame,https://lichess.org/VUqKH8e6#71,
npCU4,2k2b2/pp1nrN2/1q2p3/3pPQ2/PPpP3R/N1P5/5K2/8 b - - 2 27,d7e5 f7d6 b6d6 f5f8 d6d8 f8d8,2245,77,86,89,advantage discoveredAttack long middlegame queensideAttack,https://lichess.org/pjoiNx0T/black#54,
gghgJ,r4rk1/p1q1bppp/2ppbn2/4p3/N1B1P3/BP6/P1P1QPPP/3R1RK1 w - - 4 14,f1e1 e6c4 e2c4 d6d5 e4d5 e7a3,2210,79,87,224,advantage discoveredAttack long master masterVsMaster middlegame,https://lichess.org/sS36v6qr#27,Sicilian_Defense Sicilian_Defense_Classical_Variation
jUVNi,5rk1/p2R1ppp/1p6/3B4/8/2P1b3/r5PP/5R1K b - - 1 24,a2a3 f1f7 a3a1 f7f1 g8h8 f1a1,2229,75,95,664,advantage discoveredAttack endgame long,https://lichess.org/KshaM1AO/black#48,
8lTJC,3rr1k1/ppp1qpP1/2n1bn2/2b3N1/4Q3/2P4P/PP2PPB1/R1B1KN1R w KQ - 3 16,e4h4 d8d1 e1d1 e6b3 a2b3 e7e2,2235,76,93,6637,attraction discoveredAttack long mate mateIn3 middlegame sacrifice,https://lichess.org/6q8Ed4oq#31,Saragossa_Opening Saragossa_Opening_Other_variations
k6SBO,2r1qrk1/ppQ1bpp1/5n1p/1B3b2/7B/2N5/PPP2PPP/2KR3R w - - 3 14,c7f4 e8b5 c3b5 c8c2 c1b1 c2f2 f4f5 f2f5,2207,81,91,880,advantage discoveredAttack middlegame sacrifice veryLong,https://lichess.org/wsNsWK6c#27,Four_Knights_Game Four_Knights_Game_Scotch_Variation_Accepted
7d2PM,r1b4r/pp2ppkp/3p1np1/8/2PnP3/2N5/Pq1BBPPP/1R1Q1RK1 b - - 5 13,b2c2 d2h6 g7h6 d1d4 e7e5 d4e3,2202,77,68,170,crushing discoveredAttack long middlegame,https://lichess.org/co1U3zlF/black#26,Modern_Defense Modern_Defense_Other_variations
JnsRf,3r2k1/pp3p2/1bb1p2Q/2q1p3/4P1P1/P5N1/1P1r1PBP/R4RK1 w - - 7 24,g3h5 c5f2 f1f2 b6f2 g1h1 d2d1 a1d1 d8d1 g2f1 c6e4,2274,79,95,2975,doubleBishopMate kingsideAttack mate mateIn5 middlegame pin sacrifice veryLong,https://lichess.org/ckvcvUT7#47,
wd4JU,rnbr4/1pp2Qp1/p1k5/8/4B3/B7/P1P3PP/b6K b - - 2 23,c6b6 f7b3 b6a7 b3b7 c8b7 a3c5,2294,101,96,15272,doubleBishopMate long mate mateIn3 middlegame sacrifice,https://lichess.org/GN12UP04/black#46,
6ziym,r3k2r/pp2bppp/1q1p4/3Pn2b/8/5N1P/PPQN1PP1/R3KB1R w KQkq - 1 14,f3e5 b6e3 f2e3 e7h4 g2g3 h4g3,2295,87,94,176199,doubleBishopMate long mate mateIn3 middlegame sacrifice,https://lichess.org/5JhTTlDw#27,Alekhine_Defense Alekhine_Defense_Exchange_Variation
VJw3X,r4rk1/8/1q3b2/pP1b3p/2p3B1/2B3P1/1P5P/R2QNRK1 w - - 1 30,f1f2 b6f2 g1f2 f6d4 f2e2 f8f2,2296,79,92,6582,attraction doubleCheck kingsideAttack long mate mateIn3 middlegame sacrifice,https://lichess.org/yTDgKUNX#59,
pkxGh,r2q2k1/pb1p1p2/1p1p1pQp/2bNrN2/2B5/7R/P4PPP/5RK1 b - - 0 21,f7g6 d5e7 g8f8 e7g6 f8e8 f5g7,2272,80,88,566,doubleCheck exposedKing fork long mate mateIn3 middlegame,https://lichess.org/yt1EcfX1/black#42,
QZA3s,4r1k1/1q3pp1/5P2/1pb1N3/2prP1Q1/p5BK/P1P4P/4R3 b - - 0 33,g7g6 e5g6 b7d7 g6e7 g8f8 e7f5,2226,80,100,60,crushing doubleCheck kingsideAttack long middlegame,https://lichess.org/UFfFuCm7/black#66,
Epm7U,2rk3r/2b2p2/2Q2n2/7p/P1PN4/4q1P1/3R3P/2K5 b - - 1 32,c7a5 d4e6 d8e7 c6d6 e7e8 e6g7,2248,76,93,8999,doubleCheck exposedKing long mate mateIn3 middlegame,https://lichess.org/jRulXyMB/black#64,
odxHr,r4r2/1p3pk1/p1b1p1p1/3n4/4N2Q/5qP1/PP3P1P/RB3RK1 w - - 3 23,e4g5 f3g2 g1g2 d5f4 g2g1 f4e2,2222,77,95,2555,attraction doubleCheck kingsideAttack long mate mateIn3 middlegame sacrifice,https://lichess.org/CoRw7Vif#45,
THUXX,3kr3/1p1b1ppp/pN1B1n2/8/B3P3/2q2P2/P1PRKP1P/7R w - - 6 19,h1d1 f6e4 d6c7 d8c7 b6d5 c7b8 d5c3 e4c3,2240,75,93,2342,crushing doubleCheck middlegame sacrifice veryLong,https://lichess.org/jFN6xBi7#37,Three_Knights_Opening Three_Knights_Opening_Other_variations
PH4ux,2rr2k1/pb2n2p/1p2R1pB/7P/3P4/1BqQ4/P4PPb/R6K b - - 1 21,c3d3 e6g6 g8h8 h6g7,2210,76,81,279,doubleCheck kingsideAttack mate mateIn2 middlegame short,https://lichess.org/un8DpUUX/black#42,
C9HLL,1R6/2p2ppk/2P3qp/2p5/2B1rPn1/6K1/2QB2P1/5R2 w - - 3 31,c4d3 g4e3 g3f2 g6g2 f2e1 e3c2,2254,78,87,244,crushing discoveredAttack doubleCheck fork long middlegame,https://lichess.org/8fvJH8Qd#61,
ezzRr,r1b5/pp1kbQ1p/8/3Pp3/4q3/P7/1n1BNPPP/R2K1B1R w - - 0 18,d1c1 b2d3 c1c2 d3b4 c2d1 e4c2 d1e1 b4d3,2232,74,93,9092,doubleCheck exposedKing mate mateIn4 middlegame queensideAttack veryLong,https://lichess.org/O2XYnF6H#35,Queens_Gambit_Declined Queens_Gambit_Declined_Austrian_Defense
FWOTZ,r2q1r2/ppp2pp1/2n5/2b1P1k1/5Nb1/4n1Q1/PP4PP/R1B2R1K b - - 3 18,e3f1 f4e6 g5f5 e6g7 f5e4 g3g4,2237,76,97,185,advantage deflection doubleCheck long middlegame pin,https://lichess.org/OQDs8DzG/black#36,Kings_Gambit_Declined Kings_Gambit_Declined_Classical_Variation
SrcMr,5rk1/p3q2p/1p2p1PQ/4Pr2/P5R1/3R2KP/8/8 b - - 0 33,f5e5 g6h7 g8h8 d3d7,2263,82,90,907,advancedPawn crushing doubleCheck endgame master short,https://lichess.org/9557p1Pz/black#66,
CdvKa,r3kbnr/ppp2ppp/2n1b3/8/3Nq3/2P5/PP3PPP/RNBQR1K1 b kq - 2 9,e4d5 d4e6 d5d1 e6g7 e8d7 e1d1,2275,75,92,7500,advantage doubleCheck long opening sacrifice,https://lichess.org/nfjEeT6z/black#18,Danish_Gambit Danish_Gambit_Other_variations
yuApq,r2q2r1/pb1Nk2p/8/1Bb1p3/8/8/PPP2PPP/R2Q1RK1 w - - 1 16,d7c5 g8g2 g1h1 g2g1 h1g1 d8g8 d1g4 g8g4,2244,77,99,566,attraction doubleCheck kingsideAttack mate mateIn4 middlegame sacrifice veryLong,https://lichess.org/D2QC6HWX#31,Sicilian_Defense Sicilian_Defense_Lowenthal_Variation
wW62w,2k3rr/pp3p2/2p1pp2/8/3P4/2PQ3p/PP2Bq2/R5RK w - - 0 24,d3f3 f2g2 g1g2 h3g2 h1g1 h8h1 g1f2 h1a1 f3g2 g8g2,2260,74,94,6240,advancedPawn crushing doubleCheck exposedKing kingsideAttack middlegame sacrifice skewer veryLong,https://lichess.org/AD59kfmr#47,
Y4a9r,r1bq1b1r/ppp1k1pp/8/3Bp3/8/1PNQ4/P2P1PPP/n1B2K1R b - - 0 13,c7c6 c1a3 e7d7 d5c6 d7c7 c3b5,2275,76,92,7545,crushing doubleCheck exposedKing long middlegame,https://lichess.org/pfg5cvEJ/black#26,Italian_Game Italian_Game_Two_Knights_Defense
NM1jD,2r3rk/5p1p/5PpQ/p3Pb1P/1ppP4/2P5/Pq1B1K2/R6R b - - 2 34,b4c3 h6h7 h8h7 h5g6 h7g6 h1h6,2243,80,91,1184,attraction doubleCheck kingsideAttack long mate mateIn3 middlegame sacrifice,https://lichess.org/Hr7NFTY8/black#68,
BYcj3,rnb1k1nr/pppp1Nqp/7b/7Q/2BP4/3K4/PPP4P/RNB5 b kq - 0 15,h6c1 f7d6 e8e7 d6f5 e7d8 f5g7,2217,77,90,713,crushing doubleCheck fork long middlegame,https://lichess.org/nxgYI87x/black#30,Kings_Gambit_Accepted Kings_Gambit_Accepted_Rosentreter_Gambit
IdfsA,6rk/1pp2r1q/3p1p1N/3Pp2Q/p1P1P3/P5RP/1P3P2/7K b - - 0 34,h7e4 h1h2 g8g3 h6f7 h8g7 h2g3,2231,81,82,54,advantage defensiveMove doubleCheck endgame exposedKing long master,https://lichess.org/kipBXrYd/black#68,
