PuzzleId,FEN,Moves,Rating,RatingDeviation,Popularity,NbPlays,Themes,GameUrl,OpeningTags
uWgPR,8/8/1p6/p5pp/P1Q2p1k/5P1P/1P1q2PK/8 w - - 1 50,c4c3 d2c3 b2c3 g5g4,2048,76,88,891,crushing endgame master queenEndgame short,https://lichess.org/nGBLtCzX#99,
y252c,8/8/4K1k1/5pq1/8/3Q4/8/8 b - - 13 53,g5g4 e6e5,2081,139,45,27,endgame equality oneMove queenEndgame,https://lichess.org/Ex65AwIM/black#106,
VLxgA,8/6K1/5Q1p/8/8/1k6/7P/q7 b - - 1 46,a1a7 f6f7 a7f7 g7f7 h6h5 h2h4 b3c4 f7g6 c4d5 g6h5,2078,75,89,465,crushing endgame queenEndgame quietMove veryLong,https://lichess.org/gkoWZQmP/black#92,
Ggpuk,8/4P3/5K2/8/Q1kpqP2/8/1p6/8 b - - 5 57,c4d3 a4b3 d3d2 b3b2,2041,77,90,281,crushing endgame master queenEndgame short,https://lichess.org/k0BsZyfC/black#114,
bQJtg,8/5pk1/4p3/3p1qP1/3Q1P2/6K1/8/8 b - - 2 47,g7g6 d4h8 f5d3 g3h4,2036,76,82,76,crushing defensiveMove endgame queenEndgame quietMove short,https://lichess.org/mczY1SBf/black#94,
MPoHL,1r4k1/p3pR2/4P1pQ/4p2p/1K2P3/1P5P/r5P1/8 w - - 1 36,b4c5 a2c2 c5d5 b8b5,2038,79,79,267,endgame mate mateIn2 queenRookEndgame short,https://lichess.org/1ZdmeWFO#71,
6GCza,2r3k1/1Q3pp1/7p/P7/2p5/2P4P/r4PPK/8 b - - 2 35,c8c5 b7b8 g8h7 b8b1 f7f5 b1a2,2049,75,93,6559,crushing endgame fork long master queenRookEndgame,https://lichess.org/sh1uXX2Q/black#70,
97eAn,8/8/2q5/pp3k2/4R3/1P3K1P/4R3/8 w - - 0 46,h3h4 a5a4 e2f2 c6e4,2028,78,91,768,crushing endgame master masterVsMaster queenRookEndgame short,https://lichess.org/UgTlRRAX#91,
CBq6e,1r6/p1R2ppp/2R2k2/3p4/8/4PqPP/P4P2/6K1 b - - 2 34,f6e5 c7e7 e5f5 e7f7 f5e4 c6e6 e4d3 f7f3,2035,83,84,51,crushing endgame interference queenRookEndgame veryLong,https://lichess.org/qRl4OIHi/black#68,
jfv2c,k1r3r1/P2p4/8/5Q2/8/4PpK1/5P2/RR6 w - - 1 33,g3h2 g8g2 h2h3 c8h8 f5h5 h8h5,2012,109,52,41,endgame exposedKing long mate mateIn3 queenRookEndgame,https://lichess.org/5Va79PDb#65,
ySW3U,4R3/8/7P/r7/3k4/6P1/3p1PK1/8 b - - 0 54,d2d1q h6h7 a5h5 e8d8,2061,86,80,44,advancedPawn crushing endgame master queenRookEndgame short,https://lichess.org/asuQdqi8/black#108,
G2Y5c,q7/2PR1pkp/8/6p1/p7/6PK/5P1P/8 b - - 1 35,a4a3 d7d8 g5g4 h3h4 a8g2 c7c8q,2034,79,90,961,advancedPawn crushing endgame long promotion queenRookEndgame,https://lichess.org/XE4JVY3E/black#70,
G9eID,1Q6/7k/P5p1/8/7P/3pp3/5r2/3K4 w - - 0 46,b8b7 h7h6 b7b4 e3e2 d1d2 f2f1 d2d3 e2e1q b4e1 f1e1,2034,81,87,603,advancedPawn crushing defensiveMove endgame exposedKing promotion queenRookEndgame quietMove veryLong,https://lichess.org/AbtZMdd3#91,
mKX3Y,6k1/p2R4/1p2P2P/2p3K1/4q3/2P1P1P1/PP6/8 w - - 3 41,e6e7 e4e5 g5h4 e5f6,2017,85,92,386,crushing endgame queenRookEndgame short,https://lichess.org/S0RXnLG0#81,
NdfCe,8/3R1P2/6kp/p5p1/6K1/Pr4P1/1P2r2P/8 w - - 0 37,f7f8q h6h5 g4h3 g5g4 h3h4 e2h2,2025,77,86,265,deflection endgame long mate mateIn3 queenRookEndgame,https://lichess.org/qUt5AkAg#73,
BIlBF,8/pp3p1p/7k/4PR2/2p2PR1/7P/P5K1/4q3 b - - 1 35,e1d2 g2h1 d2e1 h1h2,2077,130,4,21,crushing defensiveMove endgame master queenRookEndgame short,https://lichess.org/Oc91w3TM/black#70,
U2IEN,6r1/6k1/p5r1/1p5P/2p5/P3Q3/1KP2P2/8 b - - 0 46,g6f6 e3e7 f6f7 h5h6 g7h6 e7f7,2040,77,88,67,crushing deflection endgame exposedKing long pin queenRookEndgame,https://lichess.org/HXChObTq/black#92,
hXTb8,1R4R1/5p1k/4p3/p2pP3/P2P3p/2P4P/6K1/4q3 b - - 7 40,e1c3 g8h8 h7g6 b8g8 g6f5 h8h5 f5e4 h5h4 e4f5 h4h5,2001,77,86,115,crushing endgame exposedKing queenRookEndgame veryLong,https://lichess.org/q2Z9SxRT/black#80,
weDKi,3R4/1p3pkp/p1p5/4p2p/2P1P3/1P1R1PK1/1P4PP/6q1 w - - 4 30,h2h3 h5h4 g3h4 g1g2,2079,77,86,112,crushing deflection endgame queenRookEndgame short,https://lichess.org/vQke6T9d#59,
4uSdg,1r6/Rp4R1/5p1p/4p2k/4P3/8/1p4PK/8 b - - 0 37,b2b1q a7a3 b1e4 a3h3 e4h4 g2g4,2001,71,94,12167,endgame long mate mateIn3 pin queenRookEndgame quietMove,https://lichess.org/7I10rbth/black#74,
CBTRI,7R/1p3R1p/6pk/8/8/3p3P/P1q2P2/6K1 b - - 1 38,d3d2 h8h7 h6g5 f2f4,2012,77,84,272,endgame master mate mateIn2 queenRookEndgame short,https://lichess.org/1m3Jspqs/black#76,
t1qw0,8/p6p/1p2R3/4P1k1/8/4qRK1/7P/8 w - - 3 60,e6f6 e3g1 g3h3 g1g4,2068,78,84,444,endgame master mate mateIn2 queenRookEndgame short,https://lichess.org/fBBgrFtN#119,
O8XxI,6r1/ppp2p1k/3p1Q2/3P1K2/1r3P2/8/6P1/8 b - - 15 40,b4b5 f6f7 g8g7 f7h5 h7g8 h5e8,2067,77,86,794,crushing endgame exposedKing long queenRookEndgame,https://lichess.org/nHHBBg0A/black#80,
p2AaF,4Q3/6pk/5p1p/8/4P1P1/r4P1P/p3K3/8 w - - 28 50,g4g5 f6g5 e8e5 a2a1q e5a1 a3a1,2012,77,65,229,advancedPawn crushing endgame long promotion queenRookEndgame,https://lichess.org/Af1HTZXL#99,
c9dOx,8/pp5R/5pk1/2p5/5P2/2P2PK1/Pq6/7R b - - 0 47,b2c3 g3g4 f6f5 g4g3 c3g7 h7g7,2067,82,87,44,crushing defensiveMove endgame long master queenRookEndgame,https://lichess.org/784iqb2N/black#94,
XhIVg,1k6/p1p5/1pb1p2q/4Bp2/2P1p2r/1P2b2P/P3B1P1/3R1Q1K b - - 1 24,f5f4 d1d8 b8b7 c4c5 a7a6 e2a6,2044,94,81,27,crushing long middlegame queensideAttack,https://lichess.org/ClNM9ExI/black#48,
nPKTg,2krr3/p1p3pp/1ppb1p2/5b2/2B5/2P1B2P/PP1RKPP1/7R b - - 1 16,d6f4 c4a6 c8b8 d2d8 e8d8 e3f4,2023,77,92,133,advantage deflection long middlegame queensideAttack,https://lichess.org/4eYkZzOw/black#32,Four_Knights_Game Four_Knights_Game_Scotch_Variation
DBfm2,2kr3r/1ppq2pp/P1n1p3/1B1p3n/1b1P1p1P/1Np1BP2/2Q2P2/R3K2R b KQ - 0 16,f4e3 a6a7 c6a7 b5d7,2027,77,88,496,advancedPawn advantage middlegame queensideAttack short,https://lichess.org/2wnzUws6/black#32,Queens_Pawn_Game Queens_Pawn_Game_Symmetrical_Variation
wYLRF,2kr4/1pp2q2/3b4/5p2/Bn2b2Q/P4N1P/1PP2PP1/2KR3R w - - 1 21,a4b3 b4a2 c1b1 f7b3,2097,171,29,17,equality middlegame pin queensideAttack short,https://lichess.org/Nkursv8E#41,
XgEz2,1r4k1/3Q1p1p/p3pp2/q7/4P2P/2r2P2/PPP3P1/2K2B1R w - - 0 20,b2c3 a5c3 d7d1 c3e3 d1d2 b8b1 c1b1 e3d2,2080,176,87,12,crushing deflection endgame master queensideAttack veryLong,https://lichess.org/EU9eCu7O#39,
bEgx6,2kr3r/pp3pp1/2p1pnbp/4B3/4P2P/P1QBq3/1P1RN1P1/2K4R b - - 3 22,f6e4 c3c6 b7c6 d3a6,2061,77,74,245,master mate mateIn2 middlegame queensideAttack sacrifice short,https://lichess.org/TFzoOe1J/black#44,
MKL32,2kr1bnr/ppp3p1/5p2/qb5p/Pn6/1PN1B3/2P1QPPP/2KR1B1R w - - 0 15,e2b5 b4a2 c3a2 f8a3 c1b1 d8d1,2000,123,61,29,clearance crushing deflection long opening queensideAttack sacrifice,https://lichess.org/QZkuzuZG#29,Elephant_Gambit Elephant_Gambit_Other_variations
k1XLR,2kr1b1r/pb4pp/1pp5/4Bp2/QP2n3/2P1P2P/P2qBP2/3R1KR1 b - - 3 18,d2b2 d1d8 c8d8 a4a7,2047,74,90,435,advantage middlegame queensideAttack short,https://lichess.org/HzlGlkR3/black#36,Dutch_Defense Dutch_Defense_Other_variations
uFaEO,4rr2/3k2p1/4p3/pN2P1Pp/qp3N1P/3Q4/PPPp4/1K6 b - - 3 34,d7c8 d3c4 c8b7 c4c7 b7a6 c7c6,2014,77,93,4995,endgame exposedKing long mate mateIn3 queensideAttack,https://lichess.org/GaY5Tseb/black#68,
bc6eV,1r3rk1/5p2/n1p5/p1qpp2p/6pP/P2QP1P1/1P2BRP1/1K1R4 w - - 0 28,d3a6 b8b2 b1b2 f8b8 e2b5 b8b5,2086,77,86,50,advantage attraction long middlegame queensideAttack sacrifice,https://lichess.org/RfJ9RZgz#55,
aftJi,2kr4/2p2p1p/p4q2/1p2n3/1P1p4/P2Pn1Q1/1B1NP1bP/R1K3R1 w - - 8 24,b2d4 e5d3 e2d3 f6d4,2013,75,91,1025,crushing discoveredAttack master middlegame queensideAttack short,https://lichess.org/ThxWu1yi#47,
ZrcMs,r4k1r/p3pp1p/4bnpP/q1p5/np2P1P1/P4P2/1PPQ4/1KNR1BNR w - - 1 19,g4g5 a4c3 b2c3 b4c3 c1b3 e6b3,2093,77,89,590,crushing long middlegame queensideAttack sacrifice,https://lichess.org/PTOy6Lx3#37,
xz2cI,6Q1/4kp1r/1r1pn3/2p1p3/4P2N/q2P2P1/PR5P/2K2R2 w - - 2 32,f1f2 a3c3 c1d1 c3d3,2011,86,73,31,crushing middlegame queensideAttack short,https://lichess.org/QZqMp5iR#63,
JiFvU,1k1rr3/1pp1Np2/5P1p/1p1B2p1/bP6/2P5/3n2PP/R3R1K1 b - - 4 30,a4b3 e7c6 b7c6 e1e8 d8e8 d5c6 b3a4 c6e8,2060,76,91,2544,attraction crushing discoveredAttack middlegame pin queensideAttack sacrifice veryLong,https://lichess.org/LrAHFdTl/black#60,
JJQWW,r5k1/1pqbpp1p/3p1npQ/7P/p1r1P1P1/1NN2P2/PPP5/2KR3R w - - 0 19,h5g6 a4b3 c2b3 c4c3,2005,75,88,117,advantage middlegame queensideAttack short,https://lichess.org/U8immzLU#37,Sicilian_Defense Sicilian_Defense_Dragon_Variation
86ft3,1kr5/pp1r2pp/2nq1p2/2P2Q2/5P2/1R2P3/7P/1R4K1 b - - 0 30,d6d5 b3b7 d7b7 b1b7 b8b7 f5d5,2048,75,95,1339,advantage long middlegame queensideAttack,https://lichess.org/U4tl5wc5/black#60,
kdH8q,2kr1b1r/pp1n1ppp/5n2/1QpP3q/4p1b1/2N2NBP/PPP2PP1/R3KB1R b KQ - 1 12,e4f3 b5c6 b7c6 f1a6,2079,80,94,1522,bodenMate clearance master mate mateIn2 middlegame queensideAttack sacrifice short,https://lichess.org/aGCighqD/black#24,Scandinavian_Defense Scandinavian_Defense_Mieses-Kotroc_Variation
DfDcC,6k1/1p2bp1p/6p1/3P2P1/2PB1P2/p3Q3/P1rq3P/1K4R1 w - - 0 33,e3e5 c2b2 d4b2 d2d3 b1a1 a3b2,2005,91,73,32,advancedPawn advantage endgame long queensideAttack sacrifice,https://lichess.org/u0KbRILN#65,
bvuce,2kr1b1R/p2n1pr1/1pp1p3/4NpP1/5B2/8/PPP2P2/3RK3 b - - 3 21,d7e5 d1d8 c8d8 f4e5,2067,76,87,189,crushing intermezzo master middlegame pin queensideAttack short,https://lichess.org/J5XHNeVx/black#42,
PkzNK,1r5k/2n3pP/1q4B1/3ppP1P/8/Pr1Q1P2/1PR4R/2K5 w - - 1 36,d3d2 b3a3 d2f2 a3a1,2096,77,86,388,crushing middlegame queensideAttack short,https://lichess.org/0pKzmdeR#71,
OqeqL,8/8/4NKP1/3k1n2/2p5/8/8/8 b - - 0 56,c4c3 f6f5 c3c2 e6f4 d5c4 f4e2 c4d3 e2c1,2007,74,92,6268,crushing endgame hangingPiece knightEndgame master masterVsMaster quietMove veryLong,https://lichess.org/u0F4YgQ0/black#112,
09SDg,r1bqrb1k/5Qpp/2p4B/p3p3/4P3/3B1R2/PPP3PP/R6K b - - 6 18,g7h6 f3g3 c8g4 g3g4,2052,75,94,9856,crushing middlegame quietMove short,https://lichess.org/uMdmip9d/black#36,Sicilian_Defense Sicilian_Defense_Taimanov_Variation
CSTrt,8/8/1p2pk2/6p1/p1K3P1/2P4P/1P6/8 w - - 0 34,c4b5 e6e5 b5a4 e5e4 a4b3 f6e5 b3c2 e5f4 c2d2 f4f3,2080,181,45,7,crushing endgame pawnEndgame quietMove veryLong,https://lichess.org/CMHqxDyg#67,
J2gV1,2r3k1/6p1/p6p/1b3P2/1B1P3P/2P2P2/6r1/R2K3R w - - 0 28,f3f4 c8e8 c3c4 b5c4,2065,76,79,192,advantage endgame quietMove short,https://lichess.org/TbELzz9i#55,
E6xem,8/8/7p/p1pk2p1/5pP1/1P1K1P1P/P7/8 b - - 1 36,d5d6 d3c4 d6c6 a2a4 c6d6 c4b5 d6d5 b5a5,2028,75,92,180,crushing endgame pawnEndgame quietMove veryLong zugzwang,https://lichess.org/irD4E8OY/black#72,
8w1Qn,4k3/1p1r3p/pR3bpB/2PBp3/3nP3/P2p1P1P/6P1/6K1 w - - 0 32,b6b7 d7b7 d5b7 g6g5 g1f1 d3d2,2046,124,67,12,advancedPawn advantage endgame long quietMove,https://lichess.org/gVyyPlXc#63,
lR4gy,5b2/1N3pk1/2p5/2P5/P3P1p1/3K1bBp/P7/8 b - - 0 34,g7f6 a4a5 f3g2 d3e2,2043,78,89,707,advantage defensiveMove endgame quietMove short,https://lichess.org/BP0gGoOe/black#68,
LdWqG,7k/1p3Qp1/1q2p2p/p3P3/8/6NP/r4RP1/6K1 w - - 0 35,g3h5 b6f2 f7f2 a2f2 g1f2 a5a4 h5f4 a4a3 f4e6 a3a2,2067,75,91,1228,advancedPawn crushing endgame quietMove veryLong,https://lichess.org/YyOTLoZr#69,
pxVVN,r4rk1/2R3p1/p2p3p/1p2pBb1/1P1q4/P4P2/2Q3PP/5R1K b - - 2 27,g5f6 f5e6 g8h8 c2g6 d4f4 e6f5 f4f5 g6f5,2036,76,82,63,clearance crushing kingsideAttack middlegame quietMove veryLong,https://lichess.org/Jck2HRCI/black#54,
P4w4H,8/8/1p1k4/2p4p/P1K2p1P/1P3P2/8/8 b - - 3 45,d6e5 c4b5 e5d4 b5b6 d4e3 a4a5 e3f3 a5a6,2017,75,99,117,crushing endgame pawnEndgame quietMove veryLong,https://lichess.org/3gqo4iGl/black#90,
1xQ8W,6k1/5pp1/p2R3p/8/P5r1/1P6/2P5/1K6 b - - 1 31,g4g6 d6g6 f7g6 b3b4 g8f8 b4b5 a6b5 a4a5,2002,77,91,1368,crushing defensiveMove endgame quietMove rookEndgame veryLong,https://lichess.org/vmxum84g/black#62,
7uWLL,2q3k1/5ppp/3Qp3/P2p1b2/2p5/4P2P/5PP1/6K1 b - - 0 34,c8f8 d6f8 g8f8 a5a6 d5d4 f2f3 f8e7 a6a7,2035,72,94,10519,advancedPawn advantage endgame quietMove veryLong,https://lichess.org/gpkxY5OI/black#68,
KOIHJ,3r3k/6b1/p5Qp/q7/8/1B1p3P/P5P1/3R2K1 b - - 0 35,d3d2 b3c2 a5b6 g6b6 g7d4 b6d4,2076,75,88,756,crushing endgame long quietMove,https://lichess.org/TaFQA2K0/black#70,
jF4O7,8/8/pp3pk1/2p4p/2Pr1R1P/1P4P1/P5K1/8 w - - 0 43,a2a4 d4f4 g3f4 g6f5 g2f3 a6a5 f3e3 f5g4 e3e4 g4h4,2094,76,87,581,crushing endgame quietMove rookEndgame veryLong zugzwang,https://lichess.org/hkvz9a7V#85,
UQEi7,3r4/1b4k1/1q2ppp1/1Pp1p2p/P1Q5/3rNP2/2N3PP/1R4K1 b - - 0 35,b7d5 c4d3 d5a2 d3f1 a2b1 f1b1,2009,76,92,3349,advantage hangingPiece long middlegame quietMove,https://lichess.org/Q2yZZbo9/black#70,
DltUv,6k1/p1p3p1/1ppqp1Qp/8/P4R2/2P3PP/3r1P1K/8 b - - 1 37,e6e5 g6e8 g8h7 f4f8 d6f8 e8f8,2091,75,81,97,crushing endgame long quietMove,https://lichess.org/fQLvt9BL/black#74,
2O8Yu,2k5/1pp3p1/1B3p1p/nP6/r3p3/8/5PPP/2R3K1 b - - 1 28,c7c6 c1d1 a4a1 d1a1,2091,116,60,13,crushing endgame quietMove short,https://lichess.org/lp5D4Bc8/black#56,
DOjmH,8/5rk1/3p1pp1/p1pB2P1/1qP5/1P6/PQ4K1/8 b - - 2 45,f7f8 b2e2 f8e8 e2e8,2082,82,61,36,advantage endgame quietMove short,https://lichess.org/BPfyDFC4/black#90,
i0qLp,r4r1k/1p2bppB/p1q1p3/8/1P4P1/P2Q4/2P2PP1/R1B3K1 b - - 2 23,a8d8 d3h3 d8d1 g1h2 e7d6 f2f4,2044,75,90,872,advantage defensiveMove long middlegame quietMove,https://lichess.org/oy51dAHf/black#46,
1AA16,8/5p1R/p1k1p3/2BpP1r1/PP1KbP2/8/8/8 w - - 0 35,h7f7 g5g3 b4b5 a6b5 a4b5 c6b5 f7b7 b5c6 b7b6 c6c7 b6b3 g3b3,2032,106,100,23,crushing endgame quietMove veryLong,https://lichess.org/KxJn9eoo#69,
mJB5T,8/P1R5/6k1/1K6/6p1/8/8/r7 b - - 1 53,g6f5 c7c5 f5e6 c5c6,2072,132,18,11,crushing endgame rookEndgame short,https://lichess.org/GkNqG2ev/black#106,
nLTuC,8/6k1/R7/5Kpp/8/4P3/5P2/7r b - - 1 50,h1g1 a6g6 g7f7 g6g5,2079,89,66,31,crushing endgame rookEndgame short,https://lichess.org/dXg9YWQD/black#100,
NaIOB,3K4/3P4/R5pp/4kp2/8/6r1/8/8 b - - 0 40,g6g5 d8e7 g3d3 a6e6 e5f4 e6d6 d3d6 e7d6,2054,75,96,3760,crushing endgame rookEndgame veryLong,https://lichess.org/Dudx46Bd/black#80,
blz37,8/8/2R4P/4Kp2/8/5rP1/3pk3/8 w - - 0 52,c6d6 f3d3 d6d3 e2d3 h6h7 d2d1q,2082,131,81,31,advancedPawn crushing endgame long promotion rookEndgame,https://lichess.org/hcVCdU1k#103,
aa9xG,8/P7/2R3k1/4p1p1/r1p4p/5PP1/8/6K1 b - - 1 44,g6f5 g3g4 f5f4 c6c4 a4c4 a7a8q,2007,75,75,244,advancedPawn crushing deflection endgame long promotion rookEndgame,https://lichess.org/iKK31Xoi/black#88,
YR81b,8/5pk1/8/5KP1/r4PR1/8/8/8 w - - 1 61,g5g6 a4a5 f5e4 f7f5,2011,74,86,448,crushing endgame master masterVsMaster rookEndgame short,https://lichess.org/r5sP6wvE#121,
iDwlt,6r1/3R4/7k/pp1p4/8/2P1p3/P1P5/2K5 w - - 0 33,d7d5 g8g1 d5d1 g1d1 c1d1 h6g5,2095,74,96,918,crushing defensiveMove endgame long rookEndgame,https://lichess.org/TBhZcNoF#65,
3iCMR,r5k1/6p1/3P3p/1R6/p1p5/2P1R1P1/6KP/r7 b - - 0 36,a4a3 d6d7 g8f7 b5f5 f7g6 e3e8,2031,76,86,259,advancedPawn crushing endgame long rookEndgame,https://lichess.org/n820w3zU/black#72,
TknLI,8/7p/6pP/4R3/2p1kP2/3r2PK/8/8 b - - 6 57,e4d4 e5e7 c4c3 e7h7 c3c2 h7c7 d3c3 c7c3 d4c3 h6h7,2077,76,84,81,advancedPawn crushing endgame rookEndgame veryLong,https://lichess.org/ATXufir8/black#114,
C5Dbf,4r3/1p6/3kPK2/8/8/2p5/P6R/8 w - - 2 48,h2c2 e8e6 f6f5 e6e3 f5f4 e3h3,2055,76,82,57,crushing defensiveMove endgame long quietMove rookEndgame,https://lichess.org/COCmQ7eN#95,
wPGXa,8/1K3p2/P1p5/8/3P4/1P4kp/5r2/7R b - - 1 54,g3g2 h1a1 h3h2 a6a7,2058,79,92,4139,advancedPawn crushing endgame quietMove rookEndgame short,https://lichess.org/aJ4XQFMb/black#108,
BBO8A,8/4K2k/6p1/4P3/3P1P2/4rP2/7P/8 b - - 0 47,e3f3 d4d5 g6g5 f4g5 f3f5 e7e6 f5g5 d5d6,2083,100,91,23,crushing endgame quietMove rookEndgame veryLong,https://lichess.org/4pECrnat/black#94,
ir0aW,8/8/8/P7/1P5k/1R3Pp1/r7/5K2 w - - 0 50,b4b5 h4h3 f3f4 h3h2 b3g3 h2g3,2031,75,85,86,crushing endgame long master rookEndgame,https://lichess.org/Xoxy7OUS#99,
E8RO1,3r4/p7/1p6/3Pk1p1/1PK3P1/P7/8/3R4 w - - 6 39,d1d4 b6b5 c4c3 d8d5 d4d5 e5d5,2071,75,92,565,crushing deflection endgame long rookEndgame,https://lichess.org/9pqCS1vq#77,
7JRe1,8/2p2r2/1p2k3/1P2pRp1/4P2p/2P2K1P/6P1/8 w - - 4 43,f3g4 f7f5 e4f5 e6f6 g2g3 h4g3,2078,79,85,61,crushing endgame long rookEndgame,https://lichess.org/oWtjinDh#85,
42CS4,6R1/6R1/4p2P/4P3/2r5/p4P1K/r4kP1/8 w - - 10 46,h6h7 a2a1 f3f4 c4f4 g2g3 a1h1,2006,75,95,3230,endgame long mate mateIn3 quietMove rookEndgame,https://lichess.org/GxTMREad#91,
MMNwV,3rk3/7R/4P3/1p6/7p/pP3r2/P7/1K2R3 b - - 0 32,d8d2 e6e7 d2b2 b1a1 b2e2 h7h8,2082,75,85,237,advancedPawn crushing endgame long rookEndgame,https://lichess.org/fMBNHfzo/black#64,
aKqLl,8/8/1r6/p2pR3/P1p3k1/1P2Kp2/2P5/8 w - - 0 50,e5d5 b6e6 e3f2 e6e2 f2f1 c4c3,2080,197,-16,5,crushing endgame exposedKing long rookEndgame,https://lichess.org/q6yqu8FB#99,
UcVTV,8/4p1k1/3p4/3P1R1P/1p5r/p4P2/2P3P1/1K6 w - - 3 45,g2g4 h4h1 b1a2 h1c1 a2b3 c1b1,2027,85,78,48,crushing endgame long rookEndgame,https://lichess.org/1DRBez9f#89,
Ol84W,8/8/4K3/4R1p1/r4p2/3k1P2/5P2/8 w - - 9 65,e5g5 d3e2 g5c5 e2f2,2000,76,82,89,advantage endgame rookEndgame short,https://lichess.org/PUi93s2g#129,
vQika,r4r1k/4q2p/4Bn2/1bN1pP2/1p2P2Q/2p2P2/2P5/1K4RR b - - 0 32,e7c5 g1g8 f8g8 h4f6 g8g7 h1h7 h8h7 f6h4,2046,77,93,7638,attraction deflection discoveredAttack master mate mateIn4 middlegame pin sacrifice veryLong,https://lichess.org/fhJc3R67/black#64,
9iGyn,2r3k1/5p1p/p3b1pP/4P3/2rp4/4Q3/P1PRK1P1/8 w - - 0 34,e3f3 e6g4 f3g4 d4d3 c2d3 c4g4,2079,98,85,25,crushing discoveredAttack endgame exposedKing long pin sacrifice,https://lichess.org/zJ9IzCpR#67,
4Sd37,k2q1rr1/pp2b3/4Q3/PP1p1p2/3B3p/7N/3n1PP1/R1R3K1 b - - 2 30,d2b3 a5a6 b3d4 a6b7,2065,75,84,198,advancedPawn crushing middlegame queensideAttack sacrifice short,https://lichess.org/cMJJMeFP/black#60,
9TKfj,2r5/p3q1kP/1p2p3/2Pn1pN1/5Pn1/P3P3/1RQP2P1/4K3 b - - 0 27,c8c5 c2c5 e7c5 g5e6 g7h7 e6c5,2032,77,91,1003,attraction crushing exposedKing fork long master middlegame sacrifice,https://lichess.org/8wBFFGss/black#54,
Tugk1,k7/1b5p/pB1Q4/Pp1p1p2/1P1q4/4RP1P/1K3P2/3r4 w - - 12 42,e3c3 d1d2 b2b3 d4c4 c3c4 d5c4 b3c3 d2d6,2073,83,70,45,crushing endgame exposedKing sacrifice veryLong,https://lichess.org/PKy8ofXt#83,
wsfJz,r2qknnr/pp2p1b1/2pp2pp/8/2PPP1b1/2NB1N2/PP4PP/R1BQ1RK1 b kq - 5 10,g7d4 f3d4 g4d1 f1f8 e8f8 d4e6 f8f7 e6d8,2052,78,79,281,advantage attraction discoveredAttack fork opening sacrifice veryLong,https://lichess.org/vhviSe72/black#20,Queens_Pawn_Game Queens_Pawn_Game_Anglo-Slav_Opening
7Dc8z,r2q1br1/3npkp1/3p1BNp/2pP4/1pP5/pP6/P1Q2P1P/2K1R1R1 b - - 0 22,d7f6 g6e5 d6e5 c2g6,2083,75,95,1951,clearance mate mateIn2 middlegame sacrifice short,https://lichess.org/cKiwa1cZ/black#44,
jFVAx,r1bqkb2/1p3pp1/p1p1pn2/6B1/3PN1r1/2P5/PP2PPBP/R2QR1K1 w q - 3 14,h2h3 g4g2 g1g2 d8d5 f2f3 f6e4,2022,75,86,488,advantage kingsideAttack long middlegame pin sacrifice,https://lichess.org/5gv5aFKm#27,Kings_Indian_Attack Kings_Indian_Attack_Other_variations
Bifk0,5k2/1b1q2p1/2p1p2p/1pP1B3/1P1P4/6QP/6P1/6K1 b - - 0 33,d7f7 e5g7 f7g7 g3b8 f8f7 b8b7,2009,76,88,441,crushing endgame interference long sacrifice,https://lichess.org/qmzqWjOm/black#66,
cHUb8,1B4k1/4Qpbp/p2P2p1/1p3q2/8/8/PPr2PPP/3R2K1 w - - 3 25,d1f1 f5f2 f1f2 c2c1 f2f1 g7d4 e7e3 d4e3 g1h1 c1f1,2079,82,91,319,backRankMate endgame mate mateIn5 sacrifice veryLong,https://lichess.org/5Y639IwB#49,
FzSrT,2k5/p6p/5p2/2p2P2/2q3r1/P2p3Q/5PPP/4R1K1 w - - 0 26,h3f3 g4e4 f3e4 c4e4 e1e4 d3d2,2044,195,82,5,advancedPawn advantage endgame long sacrifice,https://lichess.org/4Vs9oHZp#51,
qxctG,3r1rk1/1p3p2/5n1Q/p1qPp3/4n2N/P6P/1P4P1/R4R1K b - - 2 23,e4f2 f1f2 c5f2 h6g5 g8h8 h4f5 f2f5 g5f5,2094,78,95,1231,advantage middlegame quietMove sacrifice veryLong,https://lichess.org/fDTIqnYe/black#46,
MHpCu,r4rk1/pp4pp/n1b1p3/q7/3PNB2/4P2P/P4PP1/R2Q1RK1 w - - 1 17,e4d6 f8f4 e3f4 a5d5,2022,76,92,613,advantage middlegame sacrifice short,https://lichess.org/2CaPSHlB#33,Indian_Defense Indian_Defense_Normal_Variation
7WnIf,1k1r1b1r/ppp1npp1/6q1/3p1nN1/3P1PB1/2P5/PPQ3P1/RNB1R1K1 w - - 5 15,e1e5 h8h1 g1h1 f5g3 h1g1 g6c2,2002,76,84,90,advantage attraction discoveredAttack long opening sacrifice,https://lichess.org/pskTGO6C#29,French_Defense French_Defense_La_Bourdonnais_Variation
KXopn,5rk1/1p2pp1p/1qbp1npQ/4r1P1/p1P5/P1N2P2/1P2B3/1K1R3R b - - 0 21,f6h5 h1h5 g6h5 e2d3,2006,75,90,906,crushing master middlegame sacrifice short,https://lichess.org/QCt9JQ2h/black#42,
wkczm,1k1r4/ppp1bpp1/q4np1/3nN3/2P1p2P/PP2P1P1/KB2QPB1/3R4 w - - 1 22,e5f7 d5c3 b2c3 a6a3 a2b1 a3b3,2084,76,93,5754,crushing deflection long middlegame sacrifice,https://lichess.org/t6gqmJPz#43,
5DjsK,r1b1k2r/1p2np1p/pq1p2p1/1N1P4/2B3n1/5N2/PP2QP1P/R3R1K1 b kq - 1 17,b6d8 e2e7 d8e7 b5c7 e8d8 e1e7,2033,81,87,73,crushing long middlegame pin sacrifice,https://lichess.org/rEKMsM49/black#34,Sicilian_Defense Sicilian_Defense_Modern_Variations
5W2mt,3rr1k1/R6p/4q1p1/1p3p2/2pP1P2/2Pbp1RP/1P2B1P1/4Q1K1 b - - 1 26,e6e4 g3g6 h7g6 e1h4,2020,76,91,1178,clearance crushing kingsideAttack middlegame sacrifice short,https://lichess.org/VWBnzERb/black#52,
Fghyw,1k1r4/p1p2R2/1p1p2p1/1P2p1q1/Q1B1p3/2PP3r/P5P1/4R1K1 w - - 0 24,c4d5 h3h1 g1h1 g5h4 h1g1 h4e1 f7f1 e1e3,2028,100,70,56,attraction crushing fork middlegame sacrifice veryLong,https://lichess.org/0WsGbRk9#47,
YDMGU,r3r2k/pRQ3pp/8/5Np1/2P2nP1/8/P1q2PKP/5R2 w - - 5 24,g2h1 c2e4 f2f3 e4f3 f1f3 e8e1 f3f1 e1f1,2042,76,73,72,clearance mate mateIn4 middlegame sacrifice veryLong,https://lichess.org/41lzyw2W#47,
w0wxL,r1b2rk1/ppp2ppp/3p4/6q1/3QPn2/2N2B2/PPP2PPP/R4RK1 w - - 0 13,f1e1 f4g2 f3g2 c8h3,2093,108,79,22,crushing master middlegame pin sacrifice short,https://lichess.org/S80yskqg#25,Ruy_Lopez Ruy_Lopez_Cozio_Defense
ytFIB,2r3k1/R1P3pp/8/1r2pp2/1b2N3/4P2P/6P1/2R3K1 w - - 0 28,e4g5 b4c5 c1c5 b5c5,2044,76,93,900,crushing endgame pin short,https://lichess.org/UjL6DYR4#55,
FuZlm,4rRk1/Q2rB1p1/2p1p2p/3q4/8/P7/1PP5/1K3R2 b - - 1 29,e8f8 f1f8 g8h7 a7c5,2084,75,91,379,crushing endgame short,https://lichess.org/wQM8fo7l/black#58,
A06zN,r1k2bnr/ppp2ppp/8/4N3/4n1b1/2P1B3/PP2BPPP/2KRR3 b - - 0 12,g4e6 e5f7 e4d6 f7h8,2008,75,94,13278,advantage middlegame short trappedPiece,https://lichess.org/XOubmSpB/black#24,Nimzowitsch_Defense Nimzowitsch_Defense_Scandinavian_Variation
or9Ut,8/5pk1/3P3p/2R3p1/2p5/5PKP/2r2P2/8 b - - 0 45,g7f6 c5d5 f6e6 d6d7,2003,75,86,550,advancedPawn crushing endgame master rookEndgame short,https://lichess.org/L2RhCQUM/black#90,
EIQRz,3r4/6kp/1p2n1p1/2p1Np2/p1P2P2/PP2P3/2R2RKP/4r3 w - - 1 33,f2e2 a4b3 c2b2 e1e2,2003,75,81,98,crushing endgame master short,https://lichess.org/hneIKlGK#65,
XVRUO,2q3k1/5ppp/3Qb3/8/Pn3P2/6P1/4P1BP/6K1 b - - 0 44,c8c1 g1f2 b4d3 d6d3,2009,75,87,646,advantage defensiveMove endgame short,https://lichess.org/HfQWKRNz/black#88,
BudPm,3rr1k1/q2b1pb1/2p3p1/2N1p2p/2P1P2Q/1P4PP/P3BP1K/3RR3 w - - 11 31,c5d7 a7f2 h2h1 d8d7,2009,76,91,1321,advantage intermezzo middlegame short,https://lichess.org/jr8aVO5c#61,
lvSA8,5k2/pp3p2/2p2p2/5PpQ/2P2b2/6q1/PP6/1K1R4 b - - 11 37,f4c7 h5h8 f8e7 h8c8,2001,78,91,360,crushing endgame master masterVsMaster short,https://lichess.org/modBcatm/black#74,
jFTsx,3rr1k1/pbq2pp1/3RP2p/1p3p2/2p5/2Pn1NB1/PP2QPPP/3R2K1 w - - 1 23,d6d7 c7d7 e6d7 e8e2,2089,76,86,56,crushing master masterVsMaster middlegame short,https://lichess.org/hhktU0f3#45,
01hsz,r4rk1/pp3ppp/8/2P1q3/1Q1n4/1P2p3/b1PN1PPP/2KR1B1R w - - 0 17,d2c4 d4e2 f1e2 e5a1,2037,77,85,216,clearance mate mateIn2 middlegame queensideAttack sacrifice short,https://lichess.org/VdlMjcA3#33,French_Defense French_Defense_Exchange_Variation
5vyZY,r1b2r2/p4pk1/1qpp2p1/8/1p1P1N1P/2n2P2/PPPQ4/1K1R1B1R w - - 1 20,b1c1 c3a2 c1b1 a2c3,2018,76,92,2928,crushing middlegame queensideAttack short,https://lichess.org/Jd0aX2qm#39,
8JtXD,3r2k1/p4ppp/1q3b2/3p3b/5BN1/7P/PP3PP1/2R1Q1K1 b - - 0 21,h5g4 f4c7 b6e6 c7d8,2076,76,87,837,advantage fork middlegame short,https://lichess.org/uD3xXddb/black#42,
VCH0j,6r1/2kp1p2/p4Q1p/8/8/7P/6P1/3q1R1K b - - 3 33,d1d5 f1c1 c7b7 c1b1,2067,76,87,207,crushing endgame short,https://lichess.org/YOiK9S41/black#66,
myNm6,1r4k1/2r1pp1p/pq1p2P1/3P4/2P1Q3/6R1/P5PP/2R2K2 b - - 0 28,h7g6 g3b3 b6b3 a2b3,2061,77,79,65,advantage endgame short,https://lichess.org/gxptzy50/black#56,
PQken,8/2P5/3R1pk1/4p3/1r1bP3/5P2/4K3/8 b - - 0 52,b4b2 e2d1 b2b1 d1c2,2026,77,87,65,crushing defensiveMove endgame short,https://lichess.org/7qVudQAH/black#104,
FvhWU,r3r1k1/1p3pp1/1p1B3p/pP4q1/P3P1b1/2P4n/Q4PPP/R3RBK1 w - - 1 22,g2h3 g4e6 d6g3 e6a2,2028,79,100,58,advantage discoveredAttack middlegame short,https://lichess.org/AuS51bai#43,
4q8ht,6rq/kpp2p2/p2P1p2/3p4/1P1NpPQ1/P6P/6PK/2R2R2 w - - 1 35,g4h4 h8h4 d4f5 h4h7,2046,81,79,34,advantage endgame hangingPiece short,https://lichess.org/Bljr6bLd#69,
gR5XR,2kr2nr/ppp2ppp/2qb4/4N3/4N1b1/PP2P1P1/2P1BP1P/R2Q1RK1 b - - 0 14,g4e2 e5c6 e2d1 c6d8,2084,76,92,1923,advantage opening short,https://lichess.org/loZyBiKc/black#28,Englund_Gambit_Complex Englund_Gambit_Complex_Englund_Gambit
OS8Bh,r4rk1/1b2q1pp/p2b1p2/1pp5/3p1PN1/2P3Q1/PP1B2PP/R4RK1 b - - 1 18,e7e2 g4h6 g8h8 h6f5,2064,78,94,8260,advantage middlegame pin short,https://lichess.org/OWajYZ0a/black#36,Sicilian_Defense Sicilian_Defense_Closed
MQmr2,5k2/2q3rp/4pQ2/3p4/2pPb2N/4P1P1/1R5P/6K1 b - - 0 35,g7f7 b2b8 c7b8 f6h8 f8e7 h8b8,2091,76,95,2421,advantage endgame exposedKing long sacrifice skewer,https://lichess.org/SlxcZsrl/black#70,
hLtId,R7/7P/8/2k3Pr/8/1p6/p4PK1/8 b - - 0 44,h5g5 g2f3 g5h5 a8a5 c5b4 a5h5,2033,75,72,104,crushing defensiveMove endgame long master rookEndgame skewer,https://lichess.org/MdsORpqw/black#88,
kJFvt,2n2r2/ppp3k1/1q5p/1N1P2p1/2P5/1P1b2P1/P2Q2BP/4R1K1 w - - 5 27,d2e3 f8e8 e3b6 e8e1 g1f2 e1e2,2054,77,91,1355,advantage kingsideAttack long middlegame pin sacrifice skewer,https://lichess.org/DTwZyD5k#53,
xgYtz,1r1qkb1r/p2n1pp1/1pQ1p2p/3p4/3P4/3PPN2/PP3PPP/RN2K2R w KQk - 1 11,f3e5 b8c8 c6d7 d8d7 e5d7 c8c1 e1e2 c1h1,2047,114,47,15,advantage middlegame sacrifice skewer veryLong,https://lichess.org/fKsQPTpc#21,Queens_Pawn_Game Queens_Pawn_Game_Zukertort_Variation
ccvj1,r1bq4/ppp1kp1r/3p1P1B/8/2P1P3/3B1N2/PP3PP1/R3K3 b Q - 0 17,e7f6 h6g5 f6g6 g5d8 h7h1 d3f1 c8e6 d8c7,2056,76,91,903,advantage middlegame skewer veryLong,https://lichess.org/q5N3ysH8/black#34,Kings_Indian_Defense Kings_Indian_Defense_Other_variations
k9qc0,r4k2/pp2N1rp/4p3/1qnpPp2/5P1Q/P2P4/1P4P1/1K1R3R b - - 3 26,g7e7 h4f6 f8e8 f6h8 e8d7 h8a8 c5d3 d1d2,2076,75,90,512,crushing exposedKing middlegame skewer veryLong,https://lichess.org/qRUHqQAn/black#52,
