PuzzleId,FEN,Moves,Rating,RatingDeviation,Popularity,NbPlays,Themes,GameUrl,OpeningTags
32UGI,3b4/1p3k2/p2P4/1PP3p1/2PBpp2/8/5KP1/8 b - - 1 39,f7e6 c5c6 b7c6 b5a6 e6d6 a6a7,2062,75,97,1819,advancedPawn bishopEndgame crushing deflection endgame long,https://lichess.org/uH1fTuB4/black#78,
3VAow,8/8/5N1p/5Pp1/pk4P1/7P/1K6/5b2 b - - 0 46,f1h3 f6d5 b4c4 f5f6 c4d5 f6f7,2011,75,91,953,advancedPawn crushing endgame long sacrifice,https://lichess.org/1vWkHnZ6/black#92,
f1NjR,8/8/8/3pK3/1pkN4/8/8/8 w - - 6 64,d4e2 b4b3 e2d4 b3b2 d4c2 c4b3,2064,77,91,1580,advancedPawn crushing endgame knightEndgame long,https://lichess.org/NwO8Xxfd#127,
2EYOy,3k3r/5N2/3P4/p1p2Pp1/Pp2P3/7r/4QKR1/q7 b - - 4 55,d8d7 e2b5 d7c8 d6d7,2027,78,87,547,advancedPawn crushing endgame master short,https://lichess.org/H1uv2CdL/black#110,
g0dt7,8/8/1k1K1b2/p3p3/P1P5/5B1p/8/8 b - - 1 49,h3h2 c4c5 b6a7 c5c6 e5e4 f3e4 a7b6 c6c7 f6e5 d6e5,2009,78,77,178,advancedPawn bishopEndgame crushing endgame veryLong,https://lichess.org/ds5YZtcs/black#98,
RiFFN,2b2k2/p1P2p2/8/PP6/7p/8/5P1K/8 b - - 0 41,h4h3 a5a6 f8e8 b5b6 a7b6 a6a7 e8d7 a7a8q,2015,74,94,5198,advancedPawn bishopEndgame crushing endgame promotion veryLong,https://lichess.org/zZuohLze/black#82,
3oNKW,8/6p1/PR2p3/2rk2p1/4p3/6PP/5PK1/8 b - - 0 41,d5e5 a6a7 c5a5 b6b5 a5b5 a7a8q,2000,429,-60,8,advancedPawn advantage deflection endgame long promotion rookEndgame,https://lichess.org/y1hiPsFr/black#82,
ZC3Dj,5rk1/2R1Q3/3P2qp/p5pb/4P3/P6P/5Pp1/6K1 b - - 0 34,f8e8 e7e8 g6e8 d6d7 e8e4 d7d8q,2046,75,92,150,advancedPawn advantage endgame long promotion sacrifice,https://lichess.org/s7xMesDO/black#68,
CAfhz,r6k/6p1/1Pp2p1p/2P5/4q2n/7Q/6PP/B2R3K b - - 0 31,a8a2 b6b7 h8h7 b7b8q,2031,76,92,6110,advancedPawn crushing endgame master promotion short,https://lichess.org/qGpNYlqS/black#62,
GQ3iu,8/8/1P6/R5p1/1B3k1p/P6b/1r6/6K1 b - - 2 45,g5g4 b6b7 f4f3 a5f5,2079,75,92,1580,advancedPawn crushing endgame short,https://lichess.org/cPkx4ELk/black#90,
jrQiJ,r4rk1/1pp3pp/4p3/2Pp1P2/1q1P2P1/4PQ2/5R2/5RK1 b - - 0 31,a8a3 f5e6 f8f3 f2f3 h7h6 e6e7,2076,75,87,589,advancedPawn crushing endgame long sacrifice,https://lichess.org/MYdXuak3/black#62,
3EjE7,8/8/P7/4p2N/6k1/1R4p1/KP4r1/2b5 b - - 0 44,g2b2 b3b2 c1b2 a6a7,2042,76,92,232,advancedPawn crushing endgame short,https://lichess.org/Vcpcwtd7/black#88,
qJgMp,8/p5k1/3P2p1/7p/2P5/1P4BP/r7/6K1 b - - 0 41,a2d2 c4c5 g7f7 c5c6 f7e6 d6d7,2007,74,91,808,advancedPawn advantage endgame long quietMove,https://lichess.org/IfdDvhvI/black#82,
rjpQb,7k/4R2p/p1B3p1/8/3r4/2p5/P5PP/6K1 w - - 0 45,c6f3 c3c2 e7e1 d4b4 g1f2 b4b1,2041,75,92,385,advancedPawn advantage endgame long master quietMove,https://lichess.org/VI1ocKYa#89,
y4gTv,3r4/6k1/1p3p2/5Rp1/PP1p2P1/2P4P/5K2/8 w - - 0 32,f5b5 d4c3 b5b6 d8c8 b6e6 c3c2,2000,74,85,85,advancedPawn crushing endgame long quietMove rookEndgame,https://lichess.org/A4CWH7yK#63,
ToCIg,8/8/8/3R1K2/pkP5/1r1P4/8/8 w - - 0 53,f5e4 a4a3 d5b5 b4a4 b5h5 a3a2,2074,76,89,1078,advancedPawn crushing endgame long rookEndgame,https://lichess.org/DyiMLV9p#105,
OcbXW,1k1b4/pp4pp/3NQ1b1/8/P6P/1pq5/5PP1/4R1K1 w - - 2 36,e1e3 c3c1 g1h2 b3b2,2016,77,95,12316,advancedPawn crushing endgame short,https://lichess.org/gAJRiexQ#71,
89P60,5r2/1pk1b2p/1pppPp2/5PP1/4N2B/r7/7P/3R2K1 b - - 0 31,a3a4 g5f6 e7f6 e4f6 a4h4 e6e7,2010,85,85,34,advancedPawn advantage endgame long,https://lichess.org/MPToQ0lm/black#62,
NhkLy,8/8/1k2P3/3p4/1r1N4/3K4/8/8 b - - 0 62,b4b1 e6e7 b1d1 d3e3 d1e1 d4e2,2027,74,90,1243,advancedPawn crushing defensiveMove endgame long,https://lichess.org/aXXgvlO2/black#124,
gel8J,5rk1/4q2p/1p2P2Q/4P3/p2p3P/P2B2P1/1P6/3K4 b - - 0 35,e7b7 h6g5 g8h8 e6e7,2049,77,91,3118,advancedPawn crushing endgame master masterVsMaster short,https://lichess.org/Ige6DLVB/black#70,
Jpilj,2r3k1/pp3ppn/2pqr3/3p1Qp1/PP1P4/2N1P2P/5PP1/1RR3K1 w - - 4 21,c3d5 g7g6 f5f3 g5g4 h3g4 h7g5 f3f4 d6d5,2045,75,75,90,advantage master middlegame veryLong,https://lichess.org/wqzuoFBv#41,
KeZVX,2r3k1/2p2p2/p1p3p1/1p1P2q1/8/8/PPK1N1P1/R2Q4 w - - 0 30,d5c6 c8d8 d1e1 g5f5,2000,120,83,10,advantage endgame short,https://lichess.org/FVImsH7C#59,
0vDwN,r1b1k2r/ppppnppp/2n3q1/1Bb5/3N4/2P1BN2/PP3PPP/R2Q1RK1 b kq - 3 10,e8g8 d4c6 d7c6 e3c5,2013,77,89,1115,advantage discoveredAttack opening short,https://lichess.org/9uoHvR1F/black#20,Scotch_Game Scotch_Game_Paulsen_Attack
1BeVf,7r/pppq2k1/3p1bn1/3Pp1p1/PPP1Pp1r/3Q1P1P/4N1PB/R4RK1 w - - 1 25,c4c5 h4h3 g2h3 d7h3 f1f2 g5g4,2092,76,92,1861,advantage long middlegame sacrifice,https://lichess.org/GYSKyVWK#49,
uV1mf,3r1rk1/5ppp/pq3n2/1p6/1P1b4/P1N2Q2/1B3PPP/2RR2K1 w - - 3 19,c3a4 b5a4 b2d4 d8d4 d1d4 b6d4,2033,80,100,42,advantage hangingPiece long middlegame,https://lichess.org/x1Hm0eIz#37,
AFspl,2r1k2r/p2p2pp/1p1Ppp1q/1B1b4/5P2/4Q1P1/PPPK3P/4R1B1 b k - 3 22,c8d8 c2c4 d5c4 b5c4,2045,76,91,1424,advantage middlegame short,https://lichess.org/dHD2jhzd/black#44,
8fkBb,8/4qpk1/3p1b2/2pB1Qp1/4P1P1/8/1r2PRK1/8 b - - 1 36,e7e5 f5d7 e5e7 d7e7 f6e7 f2f7,2005,75,91,190,advantage endgame long,https://lichess.org/8Zj4aMo5/black#72,
9mFfa,rnbk1b1r/pp4pp/4P3/2pp1P1B/4n3/8/PqPB1PPP/RN1Q1RK1 b - - 3 13,b2a1 d2a5 b7b6 d1d5,2033,75,90,382,advantage discoveredAttack opening short,https://lichess.org/BxlB83cT/black#26,Latvian_Gambit_Accepted Latvian_Gambit_Accepted_Other_variations
cYL7S,2r4k/2r3p1/7p/3p1Q2/1q1PpP2/8/1P1R2PP/3R2K1 w - - 1 35,f5d5 e4e3 d2e2 c7c1 h2h3 c1d1,2049,75,92,563,advantage endgame long,https://lichess.org/SIAX2KaO#69,
ZPA0a,r4rk1/1pp2pp1/p2b3p/4p3/Q3N2q/5P2/PPP3PP/2R2R1K b - - 0 19,f7f5 a4c4 g8h7 e4d6 h4c4 d6c4,2048,76,92,1395,advantage long middlegame,https://lichess.org/MDGXNbcp/black#38,Center_Game Center_Game_Normal_Variation
3ful8,1qr1brk1/4bppp/1pP1pn2/pN1pN3/Q2P1B2/P7/1P3PPP/R3R1K1 b - - 6 17,f6h5 e5g6 h5f4 g6e7,2063,76,85,62,advantage kingsideAttack master middlegame short,https://lichess.org/AwJGCP8A/black#34,Caro-Kann_Defense Caro-Kann_Defense_Panov_Attack
dpejq,2kr3r/ppp1qp1p/5n2/6p1/1Pbn4/P1NP1B2/5PPP/R1BQ1RK1 b - - 1 13,d4e6 d1a4 d8d3 a4a7,2009,222,50,5,advantage middlegame short,https://lichess.org/vA0LvOJd/black#26,Scandinavian_Defense Scandinavian_Defense_Icelandic-Palme_Gambit
rdJD0,2r5/p2r2p1/1p1k1p1p/3Pp2P/1PP3P1/2K5/P2R4/3R4 w - - 2 32,d1c1 c8c4 c3c4 d7c7 c4b5 c7c1,2075,75,94,2264,advantage attraction endgame long master rookEndgame sacrifice skewer,https://lichess.org/SETazp4N#63,
RuyRT,r6r/1b4k1/p6p/1p2N1p1/2p2q2/3B4/1PQ2PPP/4R1K1 b - - 0 26,c4d3 c2c7 g7g8 c7b7 a8f8 b7d5,2000,74,91,427,advantage fork long middlegame,https://lichess.org/hFOecZI5/black#52,
4IhW4,r2qkb1r/p4p1p/Bp1p2p1/2pNp1P1/3nP3/BP6/P1PP1PbP/R2QK1R1 b Qkq - 3 13,d4f3 d1f3 g2f3 a6b5 d8d7 d5f6,2056,77,88,485,advantage long middlegame pin sacrifice,https://lichess.org/0AoTeQMT/black#26,Grob_Opening Grob_Opening_Other_variations
a4AsH,1q5r/N3kNpp/2Qppn2/8/4b1P1/7P/P1P1KP2/3R4 w - - 0 25,c6d6 e7f7 d6b8 h8b8,2020,76,92,1302,advantage hangingPiece master middlegame short,https://lichess.org/UOt5jbyC#49,
8QugB,6k1/3n2pp/p1n5/8/2Ppp3/R4NP1/4PP1P/1r3BK1 w - - 0 26,f3g5 d7c5 g5e4 c5e4,2090,77,88,477,advantage endgame master masterVsMaster quietMove short,https://lichess.org/JqtacNW4#51,
2LkKs,2r2k2/ppr2p1p/b3p2B/3pP3/P5Q1/RP1q3P/5PP1/6K1 b - - 2 24,f8e8 g4g8 e8d7 g8f7 d7c6 f7e6 c6c5 b3b4,2035,75,82,98,advantage deflection interference middlegame veryLong,https://lichess.org/Hmqe8Srb/black#48,
me8YW,3r1rk1/pp3ppp/2p2b1B/4q3/2p2Q2/2P2P1P/PPP2P2/1K4RR w - - 4 19,h6g7 d8d1 g1d1 e5f4 g7f8 g8f8,2032,128,69,11,advantage long middlegame,https://lichess.org/ft7kCAXJ#37,
LvNqP,r1b2rk1/ppp3pp/5qp1/8/3P2n1/1PN1P1P1/P4PBP/R2Q1RK1 w - - 2 17,g2b7 c8b7 d1g4 f6c6 d4d5 c6c3,2025,80,83,38,advantage long middlegame,https://lichess.org/Oh7QXpkD#33,Nimzo-Larsen_Attack Nimzo-Larsen_Attack_Modern_Variation
cCnMF,rn3rk1/ppp2ppn/3p4/3N4/4P1b1/3P1Nq1/PPPKB3/R2Q3R b - - 9 16,g4f3 d5e7 g8h8 h1h7 h8h7 d1h1 f3h1 a1h1 g3h2 h1h2,2001,79,92,6341,anastasiaMate attraction kingsideAttack mate mateIn5 middlegame sacrifice veryLong,https://lichess.org/h2xxzE3y/black#32,Alekhine_Defense Alekhine_Defense_Maroczy_Variation
SiHuz,8/1Q4pk/5p1p/3Pq3/1p1nP3/5PP1/6PK/2R5 w - - 6 46,b7b4 d4e2 f3f4 e5h5,2063,82,87,2011,anastasiaMate endgame mate mateIn2 short,https://lichess.org/7Sm3i5sY#91,
ADW81,2r2r2/1p2NNp1/p6k/4R2b/P6Q/1q5P/1P3PK1/8 b - - 0 30,b3f7 h4g5 h6h7 g5h5 f7h5 e5h5,2042,81,96,22839,anastasiaMate deflection exposedKing long mate mateIn3 middlegame,https://lichess.org/8AjYOiQ5/black#60,
wucWl,8/6qk/4p3/2N1Pp1B/1PQ2P2/4n1BK/4P2P/6r1 w - - 5 43,c4e6 g7g3 h2g3 g1h1,2082,81,93,153561,anastasiaMate mate mateIn2 middlegame sacrifice short,https://lichess.org/13w7bUPa#85,
yGGqR,2k5/5R2/1p3p1p/1N2p3/8/8/Pr5r/2R2K2 b - - 1 38,c8b8 f7f8 b8b7 b5d6 b7a7 c1c7 a7a6 f8a8,2019,79,95,2841,anastasiaMate endgame exposedKing mate mateIn4 veryLong,https://lichess.org/YkO6Wnsu/black#76,
Ccs05,3r1rk1/pp3ppp/2p1b3/5N1Q/1P2R3/P5P1/2q2P1P/4R1K1 b - - 3 26,d8d5 f5e7 g8h8 h5h7 h8h7 e4h4 d5h5 h4h5,2015,79,94,2634,anastasiaMate attraction fork mate mateIn4 middlegame sacrifice veryLong,https://lichess.org/QArB23mP/black#52,
HZRvs,q4r1k/4Nppp/5b2/p7/1p6/1PnQ2P1/2PR4/2K1R3 b - - 2 30,a5a4 d3h7 h8h7 d2h2 f6h4 h2h4,2072,81,96,10280,anastasiaMate attraction long mate mateIn3 middlegame sacrifice,https://lichess.org/XsLh1P8d/black#60,
FPfGr,Q4k2/3R1p1p/p3ppr1/1pN1b3/1P6/P5P1/2q2P2/6K1 b - - 3 36,f8g7 c5e6 g7h6 a8h1,2042,84,93,134157,anastasiaMate endgame mate mateIn2 pin short,https://lichess.org/aUXP0cJ2/black#72,
BZo2D,1r3rk1/5ppp/p1p5/3p1N2/7q/3Q1P2/PPP2P2/1K4R1 b - - 1 23,h4f2 f5e7 g8h8 d3h7 h8h7 g1h1 f2h2 h1h2,2040,83,94,18437,anastasiaMate attraction discoveredAttack endgame mate mateIn4 sacrifice veryLong,https://lichess.org/TD5irfzy/black#46,
j8auX,2r2rk1/1p3ppp/p2p2b1/2qNp3/3bP1P1/3Q3R/PPP5/1K5R b - - 5 22,c8c6 d5e7 g8h8 h3h7 g6h7 h1h7 h8h7 d3h3,2045,76,96,2295,anastasiaMate attraction fork mate mateIn4 middlegame sacrifice veryLong,https://lichess.org/nno7DlMf/black#44,
m4fQH,3r1rk1/1p3ppp/p2p4/3NpP2/3n1q2/3Q4/PPP1BP2/1K5R b - - 7 18,f4f2 d5e7 g8h8 h1h7 h8h7 d3h3 f2h4 h3h4,2042,77,94,4198,anastasiaMate attraction kingsideAttack mate mateIn4 middlegame sacrifice veryLong,https://lichess.org/qvL65wMq/black#36,Sicilian_Defense Sicilian_Defense_Najdorf_Variation
kBGDs,q4r2/r3N1pk/1p1Q4/1P2p1p1/4Pp1n/3P1P2/3BK3/3R4 b - - 0 35,g5g4 d6g6 h4g6 d1h1 g6h4 h1h4,2085,80,91,558,anastasiaMate long mate mateIn3 middlegame sacrifice,https://lichess.org/3Sd6bCAt/black#70,
0QIlz,r1b2rk1/3p1ppp/p3n3/1p1N3Q/2B5/4R3/PPP2qPP/1K1R4 b - - 1 21,b5c4 d5e7 g8h8 h5h7 h8h7 e3h3 f2h4 h3h4,2019,79,94,25238,anastasiaMate attraction kingsideAttack mate mateIn4 middlegame sacrifice veryLong,https://lichess.org/GEHVaRvt/black#42,
HlSum,5Rk1/pp3r1p/6p1/2NQ4/3p4/P2P2P1/1P1q3P/6K1 b - - 0 27,g8f8 d5d8 f8g7 c5e6 g7h6 d8h4,2006,83,94,177397,anastasiaMate endgame exposedKing long mate mateIn3,https://lichess.org/Fja0BocV/black#54,
g95bj,5r1k/7p/1p6/pP4p1/P2NP3/R2Pn1PK/7P/8 w - - 0 32,d4e6 f8f6 e6f4 f6h6 f4h5 h6h5,2095,85,92,154450,anastasiaMate endgame long mate mateIn3,https://lichess.org/qNfg94WM#63,
qQce1,r4rk1/ppp2pp1/5q1p/4pN2/4P3/4PP2/PPP1K1Q1/R7 b - - 0 19,f6g5 g2g5 h6g5 f5e7 g8h7 a1h1,2040,85,93,149706,anastasiaMate endgame kingsideAttack long mate mateIn3,https://lichess.org/bDO8nk6r/black#38,
nqH6V,1kr4r/p4p2/1p1P4/4P3/8/3R2P1/PQ2nqBP/1R5K w - - 1 33,d6d7 h8h2 h1h2 c8h8,2059,79,94,14154,anastasiaMate attraction master masterVsMaster mate mateIn2 middlegame sacrifice short,https://lichess.org/IIPWqQIN#65,
p0xIx,1k1r3q/ppp5/6Q1/2b1p3/3n4/2N5/PPPP1PPP/R1B2RK1 w - - 4 16,c3d5 d4e2 g1h1 h8h2 h1h2 d8h8 g6h5 h8h5,2027,77,92,491,anastasiaMate attraction kingsideAttack mate mateIn4 middlegame sacrifice veryLong,https://lichess.org/jdcLc9RH#31,Italian_Game Italian_Game_Two_Knights_Defense
xLeaV,3r4/6R1/2P5/R5p1/8/4k1n1/6P1/6K1 w - - 1 47,c6c7 g3e2 g1h2 d8h8 g7h7 h8h7,2050,79,94,7623,anastasiaMate endgame long mate mateIn3,https://lichess.org/lHz9eD2j#93,
1M6gJ,2n3kr/1pr1pR2/3p2p1/p2P2N1/P1P4Q/1q6/6PP/5RK1 b - - 2 29,h8h4 f7f8 g8g7 g5e6 g7h7 f1f7 h7h6 f8h8,2087,79,95,11553,anastasiaMate exposedKing fork mate mateIn4 middlegame veryLong,https://lichess.org/V8ElcsU1/black#58,
wUTer,4r2k/p1Q3p1/6qp/8/3p1p1n/1P1P1P1P/PBP2PPK/5R2 w - - 1 23,f1g1 g6g2 g1g2 h4f3 h2h1 e8e1 g2g1 e1g1,2022,81,92,216,arabianMate endgame mate mateIn4 sacrifice veryLong,https://lichess.org/JP3VbKIH#45,
L7HPV,2Q4k/pp6/3p3p/3qrn2/1P2Np2/8/P4P1P/6RK b - - 1 32,h8h7 c8g8 d5g8 e4f6 h7h8 g1g8,2028,76,94,10273,arabianMate attraction endgame fork long mate mateIn3 sacrifice,https://lichess.org/efqrvORc/black#64,
8yeGi,r3r3/1pR3k1/4P1p1/p4pNp/3n3P/P5q1/1B4P1/6K1 b - - 1 35,g7f8 g5h7 f8g8 h7f6 g8h8 c7h7,2077,80,93,141546,arabianMate exposedKing fork long mate mateIn3 middlegame,https://lichess.org/5f4j6cFH/black#70,
cKgq2,6k1/p2p2p1/Q3p3/5p2/8/2qB1n2/P4PR1/2rR3K w - - 8 34,a6a4 c3e1 d1e1 c1e1 d3f1 e1f1 g2g1 f1g1,2003,81,91,141588,arabianMate exposedKing mate mateIn4 middlegame sacrifice veryLong xRayAttack,https://lichess.org/W9R92r9o#67,
Rtgu1,5r2/1kp4Q/1p1p4/3Np3/4P3/2P3PP/r2n2B1/6qK w - - 0 32,h1g1 f8f1 g2f1 d2f3 g1h1 a2h2,2086,82,94,142235,arabianMate endgame exposedKing long mate mateIn3 sacrifice,https://lichess.org/bd2WBNec#63,
7mVWd,3Q2n1/5q1k/6Rb/4pP1N/4r3/3p2KP/8/8 b - - 1 46,e4d4 d8g8 f7g8 h5f6 h7h8 g6g8,2014,78,92,148326,arabianMate attraction exposedKing fork long mate mateIn3 middlegame sacrifice,https://lichess.org/frQppocE/black#92,
tWyk1,r1b1q1r1/5Rbk/p2p1R1p/1p5N/3pP1n1/4P2Q/PPP3P1/6K1 b - - 3 24,g4f6 h5f6 h7h8 h3h6 g7h6 f7h7,2052,83,94,21551,arabianMate discoveredAttack fork long mate mateIn3 middlegame sacrifice,https://lichess.org/U9hFO14e/black#48,
vuUy6,2r2b1k/1p3pp1/5N1n/3pPpN1/3P4/r1Pq4/p4QR1/R6K b - - 23 42,a3c3 g5f7 h6f7 f2h4 f7h6 h4h6 g7h6 g2g8,2037,81,96,22702,arabianMate kingsideAttack mate mateIn4 middlegame sacrifice veryLong,https://lichess.org/1CROfnot/black#84,
VbO1E,5b2/1R4k1/7p/p3p3/4N1N1/4PPP1/1pq3PK/8 b - - 1 38,g7g8 g4f6 g8h8 b7h7,2019,84,91,6004,arabianMate endgame mate mateIn2 short,https://lichess.org/Sb3796YG/black#76,
LR8Re,6k1/2R3p1/p5p1/2Q1p3/b1Pn1p2/5P1P/2rr2PK/6R1 w - - 4 32,c5e7 d2g2 g1g2 d4f3 h2h1 c2c1 g2g1 c1g1,2094,77,97,748,arabianMate mate mateIn4 middlegame pin sacrifice veryLong,https://lichess.org/paMVgmZZ#63,
WI4cL,2k4r/pp3pp1/4p1p1/1PP1nn2/Q1B5/7P/P2r1BPK/2R5 w - - 1 28,f2e1 e5f3 h2h1 h8h3 g2h3 d2h2,2008,77,95,11662,arabianMate deflection long mate mateIn3 middlegame pin sacrifice,https://lichess.org/qdEN9b9L#55,
7ZOI9,7r/bpkR4/p6n/P3N3/QPB1P3/2P4b/4KPq1/8 b - - 1 32,c7c8 a4c6 b7c6 c4a6 c8b8 e5c6 b8a8 d7a7,2049,72,92,146741,arabianMate deflection intermezzo mate mateIn4 middlegame queensideAttack sacrifice veryLong,https://lichess.org/TtpD0Cp6/black#64,
TbrSQ,6k1/1p4pp/3b4/2pRn3/4n3/2P4P/PP3r2/R1B2NK1 w - - 2 29,c1e3 e5f3 g1h1 e4g3 f1g3 f2h2,2036,99,84,87,arabianMate exposedKing long mate mateIn3 middlegame sacrifice,https://lichess.org/6weGn9WN#57,
TaluB,6k1/r1q2rp1/4p2p/pp1pP2N/2pPb3/2P3RP/PP1Q4/2K3R1 b - - 1 30,g8h7 g3g7 f7g7 h5f6 h7h8 d2h6 e4h7 h6h7 g7h7 g1g8,2069,79,94,3516,arabianMate deflection mate mateIn5 middlegame sacrifice veryLong,https://lichess.org/cp07tBic/black#60,
NweWi,r5k1/1p3ppp/2p4r/p1Q5/N2Pp2n/P3PqNP/1PR2P1K/6R1 w - - 9 26,c5g5 f3g2 g1g2 h4f3 h2h1 h6h3 g2h2 h3h2,2041,75,92,157793,arabianMate deflection discoveredAttack fork mate mateIn4 middlegame sacrifice veryLong,https://lichess.org/3PlZtK6Z#51,
bXllX,7k/1ppq1prp/8/P2P4/1b5n/2Q4P/5PP1/R3RBK1 w - - 3 26,c3b4 h4f3 g1h1 d7h3 g2h3 g7g1,2081,79,89,1503,arabianMate long mate mateIn3 middlegame pin sacrifice,https://lichess.org/bsTSuEa2#51,
ieH6K,r3k3/pbp1R3/2p1P3/3pN1Bp/8/2K5/PPP5/6q1 b - - 1 35,e8f8 e5d7 f8g8 d7f6 g8h8 e7h7,2019,75,93,2218,arabianMate endgame exposedKing long mate mateIn3,https://lichess.org/ZaZXdSvX/black#70,
QYEAx,q4bk1/5pp1/3Pp2p/1p2P2N/1Pp5/6RP/5Pb1/rBQ3K1 b - - 3 31,g2e4 h5f6 g8h8 c1h6 g7h6 g3g8,2054,76,92,2883,arabianMate kingsideAttack long mate mateIn3 middlegame pin sacrifice,https://lichess.org/j9uuP9j4/black#62,
Q44Uo,1k5r/1pp2N2/3p1P2/p1bNp3/3nQ3/P2P2Pq/1P3P1P/2R2RK1 w - - 1 24,e4g2 d4f3 g1h1 h3h2 g2h2 h8h2,2008,81,87,242,arabianMate kingsideAttack long mate mateIn3 middlegame,https://lichess.org/uadDGpwM#47,
GLhOA,2r4k/4R1bp/p7/1p6/1Pr1Np1P/P1P5/6R1/2K5 b - - 6 38,g7f8 g2g8 h8g8 e4f6 g8h8 e7h7,2075,79,95,5327,arabianMate attraction endgame long mate mateIn3 sacrifice,https://lichess.org/dktA6YHu/black#76,
pbiw5,r2qkb1r/1bp2pp1/p6p/1p1nP3/8/1B2B3/PPPQ2PP/R4RK1 b kq - 0 14,d5e3 b3f7 e8e7 d2e3,2082,83,74,49,attackingF2F7 crushing intermezzo middlegame short,https://lichess.org/dvcdIV83/black#28,Philidor_Defense Philidor_Defense_Other_variations
TvwPL,r1b1kbnr/pp1p1ppp/2p5/4P1N1/1nB5/2N1P2q/PPP2P1P/R2QK1R1 b Qkq - 3 13,h3h2 c4f7 e8d8 g5e6 d8e7 d1d6 e7f7 d6f8,2013,78,89,1929,attackingF2F7 crushing fork opening pin veryLong,https://lichess.org/9hvewbch/black#26,Englund_Gambit_Complex Englund_Gambit_Complex_Englund_Gambit
fcyia,rn1qkbnr/pp3ppp/2p1p3/3pPbN1/3P4/2N2Q2/PPP2PPP/R1B1KB1R b KQkq - 0 7,f8e7 g5f7 e8f7 g2g4,2067,75,86,129,advantage attackingF2F7 opening pin sacrifice short,https://lichess.org/IjQvoV0J/black#14,Caro-Kann_Defense Caro-Kann_Defense_Two_Knights_Attack
JNdJj,3qkb1r/1pB1nbpp/p4p2/2rN4/P5PN/7P/BPn1RP2/3Q2K1 b k - 3 19,c5c7 d5f6 g7f6 a2f7 e8f7 d1d8,2065,73,94,8759,attackingF2F7 crushing discoveredAttack exposedKing long middlegame,https://lichess.org/8eCMuJvv/black#38,Sicilian_Defense Sicilian_Defense_Closed
H2Bem,1q5r/1p1r4/1Nb2pk1/6p1/8/1Q1R2b1/PPP2PP1/3R2K1 w - - 2 30,b6d7 h8h1 g1h1 b8h8 h1g1 h8h2 g1f1 h2g2 f1e1 g2f2,2022,75,95,742,attackingF2F7 attraction master mate mateIn5 middlegame sacrifice veryLong,https://lichess.org/NFWYrjSk#59,
PfHXr,2k3nr/1p3pp1/p2bp1b1/3p2Pp/7P/1PB1qP2/P1P1N3/R2QKR2 w Q - 4 22,c3d4 d6g3 f1f2 g3f2 e1f1 e3f3,2063,78,93,381,advantage attackingF2F7 exposedKing long middlegame pin,https://lichess.org/j0wNZdE6#43,
pQKBz,rn1qk2r/ppp1bppp/4b3/4N3/2Bp1P2/4B3/PPP3PP/RN1Q1RK1 b kq - 0 9,d4e3 c4e6 d8d1 e6f7 e8f8 f1d1,2009,78,91,1368,attackingF2F7 crushing long opening sacrifice,https://lichess.org/wxP41rcx/black#18,Bishops_Opening Bishops_Opening_Urusov_Gambit
g3qkp,r1b1k2r/5ppp/p7/1p1pq3/2p5/2P1bQP1/PPB4P/RN3R1K b kq - 1 17,c8b7 f3f7 e8d8 f7b7 a8a7 b7c6,2045,77,96,1036,advantage attackingF2F7 fork long middlegame,https://lichess.org/ID5CJz8B/black#34,Sicilian_Defense Sicilian_Defense_Old_Sicilian
G246v,r2qkb1r/pp1n1ppp/2p1pnb1/6N1/2BP3N/8/PPP1QPPP/R1B1K2R b KQkq - 5 9,f8e7 h4g6 h7g6 g5f7,2056,76,91,1881,attackingF2F7 crushing master opening short,https://lichess.org/CKcS3VrP/black#18,Caro-Kann_Defense Caro-Kann_Defense_Main_Line
XgW4B,rnbq1rk1/ppp2ppp/1b3n2/6B1/4p3/1QP2N2/PP1NPPPP/R3KB1R w KQ - 0 9,d2e4 f6e4 g5d8 b6f2 e1d1 f8d8,2055,80,91,3463,attackingF2F7 crushing long opening sacrifice,https://lichess.org/rDAYkWSn#17,Mieses_Opening Mieses_Opening_Reversed_Rat
lrJXM,rnb1k2r/3p1ppp/p1q1pn2/4P3/2p5/2N1PN2/P1P1Q1PP/R4RK1 b kq - 0 13,f6e4 c3e4 c6e4 f3g5 e4g6 g5f7,2021,95,39,21,advantage attackingF2F7 long middlegame,https://lichess.org/LULH7lLl/black#26,Sicilian_Defense Sicilian_Defense_Bowdler_Attack
2VWee,rnbqkbnr/1p1ppppp/p7/8/2B1P3/8/PB1N1PPP/R2QK1NR b KQkq - 1 6,b7b5 c4f7 e8f7 d1h5 g7g6 h5d5 e7e6 d5a8,2075,78,92,2224,advantage attackingF2F7 attraction fork opening sacrifice veryLong,https://lichess.org/kSj9VJla/black#12,Sicilian_Defense Sicilian_Defense_Smith-Morra_Gambit
RNsSj,r2qkb1r/pp2npp1/3p3p/2pNN3/2B1P1b1/3PB3/PPP2P2/R2Q1RK1 b kq - 0 12,g4d1 d5f6 g7f6 c4f7,2088,79,91,150438,attackingF2F7 discoveredAttack mate mateIn2 middlegame sacrifice short,https://lichess.org/ePmERcxA/black#24,Sicilian_Defense Sicilian_Defense_Old_Sicilian
SouaK,r3k1nr/1pp1bpp1/p1np2qp/4P3/Q1B1P1b1/2PPB1P1/PP1N1R1P/R5K1 b kq - 0 15,d6e5 c4f7 g6f7 f2f7 e8f7 a4b3,2098,75,95,588,advantage attackingF2F7 attraction fork long middlegame,https://lichess.org/W4M3RBsq/black#30,Philidor_Defense Philidor_Defense_Other_variations
iRaPo,r3k1nr/1b1p1p1p/p1q1P3/1pp5/3n3N/P1NP4/BP3QPP/5RK1 b kq - 0 18,d7e6 f2f7 e8d8 f7g7 g8e7 g7h8,2042,201,60,6,attackingF2F7 equality long middlegame trappedPiece,https://lichess.org/n07aHDB7/black#36,
sFfVS,r3k2r/1bqnbpp1/p3pn2/1pp1N2p/5B2/2NP4/PPP1QPPP/R3RBK1 b kq - 0 13,e7d6 e5f7 e8f7 e2e6,2017,78,87,178,attackingF2F7 attraction crushing discoveredAttack middlegame short,https://lichess.org/vPS72Etg/black#26,Sicilian_Defense Sicilian_Defense_French_Variation
KN7Rk,8/p1p1kp1p/8/4p3/6n1/N7/PPPPPPr1/R1BQKNr1 w - - 15 23,a1b1 g2f2 d2d4 f2f1 e1d2 f1d1,2065,90,69,36,attackingF2F7 crushing long middlegame skewer,https://lichess.org/CbG3kxcG#45,
ZvO5C,4k2r/2n2pp1/2pqp1p1/1p1pN3/1P1Pn3/2PQP3/r2N1PPP/1K1R3R b k - 4 17,e4f2 d3f1 a2d2 d1d2 f2h1 f1f7,2091,81,89,106,advantage attackingF2F7 long middlegame sacrifice,https://lichess.org/MmNZ3DPN/black#34,Queens_Pawn_Game Queens_Pawn_Game_Other_variations
HEZam,3rkb1r/pB1npppp/8/8/3q4/2N2Q1P/PPP3P1/R3KR2 b Qk - 2 13,d7e5 b7c6 e5c6 f3f7 e8d7 a1d1,2028,75,95,13819,attackingF2F7 crushing deflection long middlegame pin sacrifice,https://lichess.org/twTvy4fI/black#26,Blackmar-Diemer_Gambit Blackmar-Diemer_Gambit_Pietrowsky_Defense
WuphC,rnbq1rk1/pp3pp1/3p1n1p/3Pp3/3bP3/P1N4P/1P2BPP1/R1BQK1NR w KQ - 1 10,c3b5 d4f2 e1f2 f6e4,2014,77,83,156,advantage attackingF2F7 attraction opening short,https://lichess.org/MzzD99mF#19,Englund_Gambit_Complex_Declined Englund_Gambit_Complex_Declined_Other_variations
XTIEd,r5rk/pbqnb3/1p2p2P/2pp2p1/3PpP2/PPP1P3/6R1/1NBQK1R1 b - - 0 21,g5f4 g2g8 a8g8 g1g8 h8g8 d1g4 g8f8 g4g7 f8e8 h6h7 d7f8 h7h8q,2072,85,92,6798,advancedPawn attraction crushing exposedKing kingsideAttack middlegame promotion veryLong,https://lichess.org/ZsdebJ3p/black#42,
YEJQE,rnbq2k1/ppp2ppp/8/4N3/1b1P4/2NBr2P/PP4P1/R2Q1RK1 b - - 1 14,c8e6 d3h7 g8h7 d1h5 h7g8 e5f7 e6f7 h5f7,2082,84,89,1456,attraction crushing kingsideAttack opening sacrifice veryLong,https://lichess.org/URWorn5S/black#28,French_Defense French_Defense_Steiner_Variation
cawVv,6k1/6r1/p2P4/1p6/2p1r3/3n2R1/P3N1P1/5K2 w - - 0 43,g3g7 g8g7 d6d7 e4e2 f1e2 d3f4 e2e1 f4e6,2099,74,88,214,attraction crushing defensiveMove endgame veryLong,https://lichess.org/ntvYSp85#85,
BMtR6,R2bk2r/6pp/4bP2/6B1/8/4PP2/5P1P/6K1 b k - 0 26,g7f6 a8d8 e8d8 g5f6 d8d7 f6h8,2068,76,78,247,attraction crushing endgame exposedKing fork intermezzo long,https://lichess.org/EydF65so/black#52,
yAQhH,r1bqk2r/pp2ppb1/3p2p1/2p1P3/5Pnp/2NP1QP1/PPP1N1BP/R4RK1 w kq - 0 15,g2h3 g4h2 g1h2 h4g3,2036,79,91,3738,attraction crushing kingsideAttack middlegame short,https://lichess.org/Cw2GD512#29,Sicilian_Defense Sicilian_Defense_Closed
RPmDa,2r2rk1/p4p1p/1qn1p1p1/1bp5/2B1P3/PNQ2P1P/1P4P1/R2R2K1 w - - 1 25,a1c1 b5c4 c3c4 c6e5 c4c3 c5c4,2072,77,84,340,attraction crushing discoveredAttack long master middlegame,https://lichess.org/hbPQaqN0#49,
aoSQV,2b2r1k/1p3Bpp/p7/8/3B3q/1Q6/PP5R/7K b - - 2 26,h4d4 h2h7 h8h7 b3c2 d4d3 c2d3,2064,75,85,386,attraction crushing endgame long sacrifice,https://lichess.org/8R4zllTN/black#52,
gZz9i,r1r3k1/7p/6p1/3QPpq1/p5P1/P2R4/2P5/3K3R b - - 0 29,g8h8 h1h7 h8h7 d5f7 h7h6 d3h3,2083,78,91,770,attraction crushing endgame long sacrifice,https://lichess.org/nMWKtgdN/black#58,
2Nvme,2R3rk/1Q5p/4N1p1/p4p2/1p6/4n2P/5qPK/8 b - - 4 43,f2b2 c8g8 h8g8 b7c8 g8f7 c8d7 f7f6 d7g7 f6e6 g7b2,2090,77,84,87,advantage attraction endgame skewer veryLong,https://lichess.org/dsqUWPsH/black#86,
gKBAU,5r2/pp3nk1/2p1Q1B1/6Pp/2P2q1N/7P/PP6/7K b - - 0 34,f4h4 e6f6 g7g8 g6h7 g8h7 g5g6 h7h6 f6h4,2065,75,91,934,attraction crushing discoveredAttack endgame exposedKing fork master sacrifice veryLong,https://lichess.org/NHdmaX9T/black#68,
5dNNe,2r3r1/4P1pk/1p4Rp/p4Q2/1q3P2/4P2P/6PK/8 b - - 0 54,c8e8 g6h6 h7h6 f5g5 h6h7 g5h5,2029,75,94,6418,attraction doubleCheck endgame long mate mateIn3 sacrifice,https://lichess.org/dhGmcX74/black#108,
sOpil,3r4/2p1kpp1/p1P1b2p/Pp2P3/1P6/6P1/4K1BP/3R4 w - - 1 26,e2e1 d8d1 e1d1 e6g4 d1d2 e7e6,2087,77,87,1122,attraction crushing endgame exposedKing long,https://lichess.org/UXfGvFCl#51,
hJYs3,1k6/ppp4p/3p2p1/4p3/4P3/P2P3P/qPPRrrP1/1NK4Q b - - 12 28,f2g2 d2e2 g2e2 h1f1 a2e6 f1e2,2004,75,92,1603,advantage attraction endgame long,https://lichess.org/JYkr46Zm/black#56,
3ZDFL,6Q1/k1q1r1p1/pRp2b1p/2P5/3P2P1/P3r3/KR6/8 b - - 3 46,e3e2 b6a6 a7a6 g8a8 c7a7 a8c6 a7b6 c6b6,2013,76,81,188,attraction deflection master mate mateIn4 middlegame sacrifice veryLong,https://lichess.org/xOxOBZYX/black#92,
RgxQC,r4r2/pp3p1k/1q2pPpp/1b2P3/6Q1/P1N2R2/1PP1p1PP/4R2K b - - 1 23,a8d8 f3h3 b6f2 h3h6 h7h6 g4h3 h6g5 c3e4 g5f4 e4f2,2091,76,90,1931,attraction crushing fork middlegame sacrifice veryLong,https://lichess.org/NQhHjzXe/black#46,
7FO9u,3b1rk1/pp4p1/2p1p2p/8/4P1PP/1P3N1K/P7/5R2 b - - 3 27,g8h7 f3g5 h7g8 f1f8 g8f8 g5e6 f8e7 e6g7,2016,79,95,13611,advantage attraction deflection discoveredAttack endgame fork veryLong,https://lichess.org/4kzTOzJA/black#54,
cWdFk,2r1nrk1/p1q5/1p4p1/3Pp1Qp/2P1P1p1/6Kb/P3B3/B1R1R3 b - - 1 27,e8d6 g5g6 c7g7 g6g7 g8g7 a1e5,2073,90,100,56,advantage attraction exposedKing kingsideAttack long middlegame,https://lichess.org/2pZltdNp/black#54,
ki5ty,r2q1rk1/ppp2pp1/3b2np/4N3/4P3/2N5/PPP1bPPP/R1BQ1RK1 w - - 0 12,e5f7 d6h2 g1h2 d8h4 h2g1 e2d1,2012,77,94,6005,attraction crushing kingsideAttack long opening sacrifice,https://lichess.org/ypIkjIVc#23,Italian_Game Italian_Game_Anti-Fried_Liver_Defense
RoG24,1k1q2r1/1pp5/p2b4/3n3Q/3P4/7P/PP1N1PP1/3R1RK1 w - - 0 23,d2c4 g8g2 g1g2 d5f4 g2f3 f4h5,2046,75,95,1685,advantage attraction fork long middlegame sacrifice,https://lichess.org/3JA27lFH#45,
Cimsu,5k2/r5pp/1p1PQ3/2q5/5PP1/8/2r1B3/4RK2 b - - 0 31,a7f7 e6e8 f8e8 e2b5 e8f8 e1e8,2034,92,87,73,attraction doubleCheck endgame long mate mateIn3 sacrifice,https://lichess.org/smnzXoQP/black#62,
x7Lvf,1r3k1r/Q4ppp/2pb4/3p4/6bq/6P1/P1PB1P1P/R3R1K1 b - - 0 20,h4h3 a7b8 d6b8 d2b4 c6c5 b4c5 b8d6 c5d6 f8g8 e1e8,2012,77,90,1031,backRankMate mate mateIn5 middlegame sacrifice veryLong,https://lichess.org/1OLEQROm/black#40,
8o0CX,4r2r/pQp4k/6pp/8/6q1/P1P5/5PKP/R1B3R1 w - - 1 25,g2f1 g4h3 g1g2 h3d3 f1g1 e8e1,2037,76,91,1934,backRankMate long mate mateIn3 middlegame,https://lichess.org/AqMDkUnt#49,
