PuzzleId,FEN,Moves,Rating,RatingDeviation,Popularity,NbPlays,Themes,GameUrl,OpeningTags
9bgoi,5r2/p3p2p/1p4p1/P7/2Ppk3/3Nb1P1/1R2K3/8 b - - 0 40,f8c8 b2b5 c8c5 d3c5,2115,75,92,1763,advantage endgame master masterVsMaster short,https://lichess.org/tS4SvSdY/black#80,
JFQss,8/6p1/5p2/2k2P2/1p4P1/P1nK4/6N1/8 b - - 0 42,b4a3 d3c3 c5d5 g2f4,2101,75,88,464,crushing endgame hangingPiece knightEndgame master short,https://lichess.org/AADDjZb6/black#84,
kSwVf,r3r3/4bppk/ppb1p2p/2pq4/4NB2/3P2RQ/PPP2PPP/4R1K1 b - - 5 18,d5f5 g3g7 h7g7 h3h6 g7g8 e1e3,2112,75,92,3436,attraction crushing defensiveMove long master middlegame sacrifice,https://lichess.org/42CQei1w/black#36,Sicilian_Defense Sicilian_Defense_Modern_Variations
0ifrC,2r1r1k1/pb4b1/1p3pp1/3qp2p/3p1P2/P2P1NQ1/1PP1R1PP/4RBK1 b - - 1 20,e5f4 e2e8 c8e8 e1e8 g8f7 g3e1,2113,76,91,4084,crushing defensiveMove exposedKing kingsideAttack long master middlegame,https://lichess.org/z8RuutI1/black#40,
QP5LP,r5qr/p4p2/3P1nk1/1Pb1p3/4P1p1/P2B2P1/1B2QPK1/2R1R3 w - - 0 48,c1c5 g8h7 f2f4 h7h2 g2f1 h2h1 f1f2 h8h2 f2e3 h2e2,2179,75,91,120,advantage master middlegame quietMove skewer veryLong,https://lichess.org/08o0b2uC#95,
Sk5MB,3r3k/p3qp1p/1p6/3rpp2/6R1/1P2QPP1/P4P1P/2R3K1 w - - 0 25,g4g5 d5d3 e3d3 d8d3 c1c8 d3d8 c8d8 e7d8,2191,78,90,631,crushing endgame master veryLong,https://lichess.org/Fsa0gnuz#49,
ZQSJl,3r4/1b2kR2/p3p3/1p2N1r1/3pP1p1/3P4/PBP3P1/6K1 b - - 1 32,e7e8 b2a3 g5e5 f7e7,2111,81,92,343,advantage endgame master masterVsMaster quietMove sacrifice short,https://lichess.org/MllBD8hQ/black#64,
S3RNo,2r3r1/3bp2k/p7/2pPpPBP/1q2B3/1P6/P1Q2P2/5RK1 w - - 1 30,f5f6 h7h8 f2f4 e7f6,2144,218,43,12,advantage defensiveMove master middlegame pin short,https://lichess.org/BJJ91UJy#59,
h7qn8,r5k1/1p3pb1/1q1p2pp/p2n4/P2N1P2/2P1R1Q1/1P4PP/R5K1 w - - 3 26,e3e4 b6b2 a1e1 d5c3,2103,76,84,217,crushing master middlegame short,https://lichess.org/fdCF2XWx#51,
EA4qF,8/R7/4rk1p/P2p4/3P1p2/2PR2p1/2n3P1/6K1 w - - 0 39,d3d1 e6e2 d1b1 c2e3,2158,79,86,144,crushing endgame master short,https://lichess.org/6PPVQouA#77,
P3IV8,5r2/3bkp1R/4p1p1/KP4P1/2r2P2/8/2p1N1B1/3R4 w - - 0 29,d1c1 f8b8 g2c6 d7c6,2158,78,87,66,advantage master middlegame short,https://lichess.org/u0tjQqTU#57,
3gLIw,4r3/5kp1/5p2/1p1p3p/2pP1P1P/PpP3P1/1P1K4/4R3 w - - 1 30,e1a1 f7g6 a3a4 b5a4 a1a4 g6f5,2158,113,86,41,crushing endgame long master rookEndgame,https://lichess.org/49DoVah1#59,
6xLOY,5r1r/pb1q2k1/1p2p1p1/4PpQ1/3PP3/3B4/P4RP1/5RK1 w - - 6 26,g2g4 d7d4 g4f5 e6f5,2117,77,72,90,crushing master middlegame short,https://lichess.org/U1F75SRh#51,
pwskg,r2q1rk1/pbp1p2p/4Q1p1/6N1/4p3/4B2P/PbP2PP1/R3K2R b KQ - 1 16,g8g7 e6b3 b2a1 g5e6 g7h8 e6d8,2192,120,76,12,crushing fork long master middlegame sacrifice,https://lichess.org/v13U2V8x/black#32,Pirc_Defense Pirc_Defense_Classical_Variation
tt51j,rnbk1b1r/pp3ppp/3pp3/3NN3/2B1n3/4B3/PPP2PPP/2KR3R b - - 1 11,e6d5 e5f7 d8e8 c4d5,2147,76,94,3972,crushing fork intermezzo master masterVsMaster middlegame short,https://lichess.org/hzU68Pn4/black#22,Sicilian_Defense Sicilian_Defense_Smith-Morra_Gambit
ufdAH,r1b1k2r/pp2bp1p/2n5/2pNP3/5Bn1/3P1N2/Pq3PPP/R2QKB1R w KQkq - 0 12,d5c7 e8d8 f1e2 d8c7,2181,80,91,146,advantage defensiveMove master middlegame short,https://lichess.org/z2nH6HZu#23,Sicilian_Defense Sicilian_Defense_Kramnik_Variation
JeVhR,2r1r1k1/5p2/p3p1p1/1p2Pnq1/3P3p/B1P3PR/P3QPK1/2R5 b - - 1 27,h4g3 c1h1 g3f2 g2f2,2134,76,92,278,advantage master middlegame quietMove short,https://lichess.org/3rrCPXNQ/black#54,
SvrCo,r1bqr1k1/1pp2pb1/p5pp/4N3/1P6/P1nB3P/3N1PP1/R1BQR1K1 w - - 0 15,d1b3 e8e5 e1e5 g7e5,2122,77,88,409,advantage master masterVsMaster opening short,https://lichess.org/ERCLTppf#29,Zukertort_Opening Zukertort_Opening_Kingside_Fianchetto
CWYJz,6k1/1PP2pp1/8/3p4/1Q2p3/4P2K/5q2/8 b - - 4 59,f2e3 h3g2 e3e2 g2g1,2197,78,86,606,advantage defensiveMove endgame master masterVsMaster queenEndgame short,https://lichess.org/YGrmkkW2/black#118,
LnjY0,6k1/2p5/1p2r1PP/6K1/2b1pR2/4P3/P4P2/8 b - - 8 40,e6e7 h6h7 g8g7 f4f8,2148,82,93,8990,advancedPawn crushing defensiveMove endgame master masterVsMaster short superGM,https://lichess.org/ynzEKQ3U/black#80,
2I695,7k/4NR2/1p5p/pr4p1/8/6KP/8/8 b - - 1 37,a5a4 g3g4 b5b4 g4h5,2149,74,91,102,crushing defensiveMove endgame master masterVsMaster short,https://lichess.org/9nfZEjpc/black#74,
CQaUo,r1r5/p2kq1p1/2b1p3/3nQ3/1PRPB3/5P2/6PP/2R3K1 b - - 4 34,a7a6 c4c6 c8c6 c1c6 d7c6 e4d5 c6d7 d5a8,2125,77,91,2388,attraction crushing master masterVsMaster middlegame skewer veryLong,https://lichess.org/tTAVGpUT/black#68,
9VeC3,5r2/Q1p3pk/3p4/3P4/1P1Pqprp/4PRP1/3B1R1P/6K1 w - - 3 35,a7a2 f4g3 f3f8 g3f2,2185,76,92,1150,advancedPawn crushing doubleCheck kingsideAttack master masterVsMaster middlegame short,https://lichess.org/qlILiMKS#69,
pfMX4,2k5/2r2p2/1R4p1/4P1Pp/1pp2P2/8/P1K4P/8 b - - 3 42,c7b7 b6b7 c8b7 f4f5 b7c6 e5e6 c6d6 e6f7,2140,84,91,2701,advancedPawn crushing endgame master masterVsMaster rookEndgame superGM veryLong,https://lichess.org/c4SNM1Ov/black#84,
hOKXU,2r1r1k1/5pp1/1p5p/p1bpN3/3B1q2/P1P1R2b/1P1Q2P1/4R1K1 w - - 0 24,g2h3 e8e5 d4e5 f4e5,2118,74,86,133,crushing master masterVsMaster middlegame pin short,https://lichess.org/QBktdLRH#47,
00W3Q,3r1k2/5p2/Np3P1p/1P2pR2/2p1N3/b1P1n3/P5PP/6K1 w - - 0 32,f5e5 d8d1 g1f2 e3g4 f2e2 d1d3,2157,92,83,62,advantage endgame fork long master masterVsMaster,https://lichess.org/aznxTSjS#63,
njPuR,5rk1/pp1q4/2n2p1P/2pp2pQ/8/3BR1P1/PP3P2/6K1 b - - 3 33,c6e5 e3e5 f6e5 h5g5 g8h8 g5e5,2129,76,92,994,crushing deflection endgame exposedKing long master masterVsMaster,https://lichess.org/i749rsy1/black#66,
NVUd6,6k1/Q4p1p/3P2pb/4P1n1/2qN4/6PP/1r3B2/4R1K1 w - - 2 38,a7a8 g8g7 a8g2 b2f2 g1f2 c4d4,2144,75,83,104,advantage attraction capturingDefender defensiveMove long master masterVsMaster middlegame,https://lichess.org/O71w0SEF#75,
UYrYC,4qrk1/5ppp/p2pb3/2p1n2Q/4P3/1B6/Pr3PPP/R1B2RK1 b - - 3 19,g7g6 h5d1 b2b3 a2b3,2175,75,91,4302,advantage master masterVsMaster middlegame short trappedPiece,https://lichess.org/ho11OyX6/black#38,Benko_Gambit_Accepted Benko_Gambit_Accepted_Pawn_Return_Variation
OTPnS,8/3r3p/3k4/3P1r1p/1R6/1P4PK/3R4/8 b - - 0 49,f5d5 b4d4 d7f7 d4d5,2101,75,95,777,crushing endgame master masterVsMaster rookEndgame short,https://lichess.org/qVePfnaL/black#98,
MdjpU,3q2r1/p6k/1pbbR1Rp/2p2p1P/P1P2P2/6Q1/1n4P1/6K1 b - - 1 36,d6f8 g6g8 d8d1 e6e1 d1e1 g3e1,2176,76,90,779,crushing long master masterVsMaster middlegame,https://lichess.org/tkiNQRoy/black#72,
BsdRi,8/pp1r1kp1/2p1n3/4p2p/4Pq2/PQ2NP2/KPP5/6R1 b - - 1 30,a7a5 e3f5 f7f6 g1g6 f6g6 b3e6 g6g5 e6d7,2149,75,86,148,attraction crushing deflection endgame fork master masterVsMaster sacrifice veryLong,https://lichess.org/ltmjeaCa/black#60,
9kbxi,1R6/p4pk1/5qp1/3Bp2p/2P1P2P/6P1/5P2/6K1 b - - 0 30,a7a5 c4c5 f6e7 c5c6,2110,78,78,64,crushing endgame master masterVsMaster quietMove short,https://lichess.org/Cv2UUX6q/black#60,
g2J7s,r1b2rk1/1pq1pNbp/p1p1P1p1/3B3n/5P2/2N1B2P/PPP5/R2QK2R b KQ - 0 17,c6d5 c3d5 c7a5 b2b4,2139,77,85,476,crushing master masterVsMaster middlegame short,https://lichess.org/0bvvaKdC/black#34,Modern_Defense Modern_Defense_Standard_Defense
PZsFx,8/8/8/1p6/1P1k2pR/6P1/2K2r2/8 w - - 0 71,c2d1 d4d3 d1e1 f2e2,2176,76,79,198,crushing endgame master masterVsMaster rookEndgame short,https://lichess.org/IpkvJ8os#141,
J1R5g,r3k2r/pb5p/1p1Bp1p1/3q1p1Q/3P4/8/PP3PPP/R3R1K1 w kq - 0 20,h5g5 d5d6 g5f6 e8d7,2149,77,46,507,advantage defensiveMove hangingPiece master masterVsMaster middlegame short,https://lichess.org/hOPx7LB5#39,
5SyPG,rn1q1rk1/1b2ppbp/pn4p1/2p5/2B5/PQN1PN2/1P1B1PPP/2R1K2R w K - 2 13,e1g1 b7f3 g2f3 b6c4,2121,81,90,1053,crushing master masterVsMaster middlegame short,https://lichess.org/v0RsZXif#25,Grunfeld_Defense Grunfeld_Defense_Three_Knights_Variation
Bc4Br,1rqr3k/p4p1p/2n5/2P5/QP1PpP2/4B3/P5R1/1R4K1 b - - 0 28,c6d4 a4e8 d8e8 e3d4 e8e5 d4e5 f7f6 e5f6,2117,78,85,495,deflection fork mate mateIn4 middlegame sacrifice veryLong,https://lichess.org/kSVo5rz7/black#56,
Q7IkY,2b5/2k4R/5p2/p3q1b1/P7/2P5/K1n1p1B1/1R6 b - - 6 49,c7d6 b1b6 d6c5 b6c6,2171,78,90,1373,mate mateIn2 middlegame short,https://lichess.org/eaM1xZMu/black#98,
CMVFL,3n2r1/pp1Rk2p/4pp1b/2N5/4N3/7P/Pq4P1/7K b - - 6 23,e7e8 e4d6 e8f8 c5e6 d8e6 d7f7,2191,75,93,9058,exposedKing long mate mateIn3 middlegame sacrifice,https://lichess.org/X5xOo8eg/black#46,
4EiX7,1k6/ppp5/3pBp2/4n3/4P3/P2PBbN1/1PP4r/R4K2 w - - 1 30,g3f5 f3e2 f1e1 e5f3,2153,76,94,4658,mate mateIn2 middlegame short,https://lichess.org/hMyi5gDx#59,
s9OJ8,8/p7/5ppk/2N4p/1PR1P2K/6PP/1r3rP1/6R1 w - - 4 33,g3g4 f2g2 g1g2 b2g2 c5e6 g6g5 e6g5 f6g5,2140,84,82,79,endgame mate mateIn4 veryLong,https://lichess.org/ipXKRtqJ#65,
Qhp5g,2r5/7p/1p2Rk2/p4P2/6P1/4pK2/7P/2b5 b - - 2 40,f6g5 f3g3 e3e2 h2h4,2127,77,87,214,endgame mate mateIn2 short,https://lichess.org/7dk81Cx4/black#80,
YgDzM,8/1Q3p2/3pbk2/pNp1p3/2P1P3/1P6/P2q1K1P/1R5R w - - 2 29,f2g1 d2e3 g1f1 e6h3,2170,77,89,679,endgame mate mateIn2 short,https://lichess.org/mSOa6t3q#57,
PgRMm,8/ppn1ppkp/1q1p1np1/3P2P1/1PrN1P2/P6P/1Q4B1/3R1K2 b - - 0 30,f6h5 d4f5 g7g8 f5h6 g8f8 b2h8,2159,76,93,5839,doubleCheck long mate mateIn3 middlegame,https://lichess.org/x5BHlrdp/black#60,
HqOQz,r3rnk1/pp3pp1/6q1/4p3/8/2NP4/PP1Q1P2/2K3RR b - - 1 23,g6f5 g1g7 g8g7 d2h6 g7g8 h6h8,2121,83,85,783,attraction long mate mateIn3 middlegame sacrifice,https://lichess.org/Sd3v76zf/black#46,
DFrCX,6rk/p3r2p/2Q5/2p2p2/3p2q1/PP1P4/2P5/1KB4R b - - 8 44,e7e5 h1h7 h8h7 c6h6,2181,78,76,291,attraction endgame mate mateIn2 sacrifice short,https://lichess.org/USzA6W82/black#88,
2L34h,5R2/k1p3Q1/pp6/8/q1n1P3/2P5/3K4/8 w - - 2 43,d2d3 a4d1 d3c4 b6b5 c4b4 d1a4 b4c5 a4c4,2181,106,72,44,endgame mate mateIn4 sacrifice veryLong,https://lichess.org/dyLppSmc#85,
BYPo2,r1bqr1k1/4bp1p/pn2p1pB/P2pP3/2pN2B1/2P1PQ2/5PPP/R3K2R b KQ - 0 18,b6d7 f3f7 g8f7 g4e6,2153,97,56,36,attraction kingsideAttack mate mateIn2 middlegame sacrifice short,https://lichess.org/lyi1j0PQ/black#36,Queens_Pawn_Game Queens_Pawn_Game_London_System
wKgiQ,6k1/4Q2p/p2p2p1/1pq5/5Pn1/P1P3P1/1P5P/3R2K1 w - - 1 27,g1g2 c5f2 g2h3 f2h2 h3g4 h2h5,2180,76,88,696,endgame long mate mateIn3 sacrifice,https://lichess.org/wVAPy0dB#53,
lzjJ9,3r3k/p1R5/4B1p1/1p4K1/8/3b4/P7/8 b - - 2 44,d8d6 g5h6 d6e6 c7c8 e6e8 c8e8,2174,79,90,2075,endgame exposedKing long mate mateIn3 sacrifice,https://lichess.org/H0RYxLNH/black#88,
UKBAf,rnbqkbnr/pp1p2p1/7p/2p4Q/2BpP3/8/PPP2PPP/RNB1K2R b KQ - 3 7,e8e7 h5e5,2156,77,93,6068,mate mateIn1 oneMove opening,https://lichess.org/BKQatbPb/black#14,Center_Game Center_Game_Kieseritzky_Variation
16meG,1r3rk1/p3pp2/6B1/7R/2p2P2/4b1Q1/P3K1PP/q7 b - - 1 24,b8b2 g6c2,2104,78,95,4559,discoveredAttack mate mateIn1 middlegame oneMove,https://lichess.org/fBiCRfvn/black#48,
RedMy,8/6pk/6p1/p6P/Pq4P1/5QK1/8/8 b - - 0 53,b4a4 h5g6 h7h6 f3f5 a4a3 g3h4 a3e7 g4g5 e7g5 f5g5,2147,183,100,24,endgame mate mateIn5 queenEndgame veryLong,https://lichess.org/Vwl0yKCZ/black#106,
ebpH8,r3rk2/pbq3pQ/3b3p/1p1ppN2/2pP4/2P5/PP4PP/RBB3K1 b - - 3 22,e5d4 h7h8 f8f7 h8g7 f7e6 f5d4,2112,76,94,8239,long mate mateIn3 middlegame,https://lichess.org/UpD5GXH8/black#44,
bR6h2,4kr2/ppq1b1QR/4p1P1/4P1B1/3r4/1P4P1/P5bK/8 b - - 3 30,d4d7 g7f7 f8f7 g6f7 e8f8 g5h6,2103,77,93,10787,advancedPawn attackingF2F7 exposedKing long mate mateIn3 middlegame sacrifice,https://lichess.org/AQVrbjvR/black#60,
fjpHv,4rk2/1p5p/b4PP1/p1p2n2/P4P2/1BP2NK1/4r1P1/2R4R w - - 1 29,g3g4 e2g2 g4h3 g2g3 h3h2 e8e2,2162,75,94,4859,fork long mate mateIn3 middlegame,https://lichess.org/N7OCqoQB#57,
CQK2V,r3kbnr/pp3Ppp/8/3Qn1B1/8/2P5/P4PPP/qN3RK1 b kq - 0 14,e5f7 d5b5,2119,78,94,2171,mate mateIn1 middlegame oneMove,https://lichess.org/EnT2EDKv/black#28,Caro-Kann_Defense Caro-Kann_Defense_Other_variations
3uOg6,1k1r4/1b2N1p1/p2p2p1/q3p3/4P2P/2n4B/2PNQ3/2KRR3 w - - 3 31,e2c4 a5a3,2113,81,92,7607,mate mateIn1 middlegame oneMove,https://lichess.org/6k3WEFO8#61,
k0Akb,r3k2r/ppqbbp2/5n2/2pp1PN1/6n1/P1PPB3/1P2B2N/R2Q1RK1 w kq - 0 19,h2g4 c7g3,2160,84,90,1339,mate mateIn1 middlegame oneMove,https://lichess.org/1cMcMcd1#37,
bbPrV,7k/7p/4B3/7P/1r3Pp1/qNprb1P1/P1Q4R/1K6 w - - 0 37,c2d3 a3c1,2103,77,70,222,mate mateIn1 middlegame oneMove pin,https://lichess.org/dcAwQHHi#73,
8PiDR,1r1q1r2/pb1n4/4p1Q1/3pb3/5k1R/1PN5/P4PPP/R5K1 b - - 5 25,d8h4 c3e2,2107,78,92,921,master mate mateIn1 middlegame oneMove,https://lichess.org/TtFwqpQW/black#50,
mJ1Ut,2r1k2r/1Q1b1ppp/1p2pn2/4N2q/1b1n4/2N3P1/PP2PPBP/R1B1K2R w KQk - 0 16,e5d7 h5e2,2187,77,93,631,mate mateIn1 middlegame oneMove pin,https://lichess.org/vb0GjhCd#31,Indian_Defense Indian_Defense_Knights_Variation
KqCLP,3r1b1r/5kp1/p2p1R2/1q1Q3p/2p2B1P/8/P4PP1/4R1K1 b - - 0 24,f7f6 d5e6,2105,80,89,731,master masterVsMaster mate mateIn1 middlegame oneMove,https://lichess.org/9HIZUpdw/black#48,
XY1DQ,7r/2R4p/5nqn/1B6/P2kbB2/2P5/6PP/1R4K1 b - - 0 29,d4d5 b5c4,2174,81,83,761,mate mateIn1 middlegame oneMove,https://lichess.org/K4HDCrfj/black#58,
weG9B,r5nQ/pp2pk2/n2pN1p1/2pP2p1/2P5/8/q3PPPP/3K1B1R b - - 1 19,g8f6 e6g5,2108,79,91,1397,mate mateIn1 middlegame oneMove,https://lichess.org/F26z9U7E/black#38,
Gwwsr,3Qbkr1/bpp2q1p/p7/8/2B5/8/Pp3PPP/4R2K b - - 10 28,f7c4 d8e7,2152,83,92,8997,endgame master mate mateIn1 oneMove,https://lichess.org/gbxkkKdr/black#56,
94R0P,1rr5/Q7/2P5/1k1R3p/1b3q2/8/1P3P1P/1K5R b - - 1 34,b5c4 a7a2,2151,80,93,6980,mate mateIn1 middlegame oneMove,https://lichess.org/0sNa2up2/black#68,
WqT12,1r1k3r/5p2/p3pN2/4Pp1p/7q/P3P2P/8/2RQ2K1 b - - 1 27,d8e7 d1d6,2110,75,93,2811,endgame master mate mateIn1 oneMove,https://lichess.org/7W6SLATM/black#54,
b744k,4N3/p4p1p/3BB1pk/8/2Pp3K/8/Pr2r3/R7 b - - 0 36,e2e6 d6f8,2123,76,94,18483,endgame mate mateIn1 oneMove,https://lichess.org/2OqqRW2e/black#72,
4JfID,3Q4/7p/p5pk/P2Pp3/1R6/3K3P/8/3q4 w - - 26 52,d3e4 d1e2,2164,78,96,1661,endgame master mate mateIn1 oneMove,https://lichess.org/haRfKn2K#103,
Gsyzs,r4r1k/pp2Np2/3p3Q/4pb2/4q3/8/PPP1B3/2KR4 b - - 0 22,f5h7 h6f6,2161,83,90,1968,mate mateIn1 middlegame oneMove,https://lichess.org/H3sIempR/black#44,
mpQr2,6k1/2R2p1p/8/2b1N3/2P3p1/3PK3/1rn2PPP/4R3 w - - 4 30,e3e2 c2e3,2130,79,94,14862,discoveredAttack endgame mate mateIn1 oneMove,https://lichess.org/fqdf27tK#59,
YB1yc,2rk2nr/pp3ppp/2p5/2Qp4/8/5P2/PP2qP1P/1K1RR3 b - - 1 20,e2f3 c5d6,2107,85,82,253,mate mateIn1 middlegame oneMove,https://lichess.org/hvvNHsJo/black#40,
vyVOt,3r1r2/pp3kQp/2p2p2/4Pp1N/8/P7/2q3PP/4R2K b - - 3 25,f7e6 h5f4,2150,77,94,2141,endgame mate mateIn1 oneMove,https://lichess.org/g5APtbSa/black#50,
ng2y1,8/5p2/Q3k1p1/3pP3/5P2/4K3/8/7q b - - 9 59,e6f5 a6c8,2114,82,93,15754,endgame mate mateIn1 oneMove queenEndgame,https://lichess.org/CSaISgKg/black#118,
if4IV,r2qr1k1/3nbB1p/2p2npB/pp6/3PN3/3Q1R2/PP4PP/5RK1 b - - 0 19,g8f7 d3b3,2111,80,85,155,mate mateIn1 middlegame oneMove pin,https://lichess.org/zWttWa3W/black#38,
aWr0k,r1b2k1r/pppp2Rp/3n3B/3P1p2/8/2P5/P2n1PPP/4R1K1 b - - 3 20,d6f7 g7g8 f8g8 e1e8,2138,78,85,340,attraction doubleCheck mate mateIn2 middlegame sacrifice short,https://lichess.org/5eX0tK0n/black#40,
jUg8N,2r3k1/1b4P1/p6p/1pP1P3/5nP1/7P/PB1r4/1BR1R1K1 w - - 1 35,c1c2 f4h3 g1f1 b7g2,2117,79,84,286,mate mateIn2 middlegame short,https://lichess.org/s6SP5ofe#69,
FRz2b,4Qnk1/p5p1/4p3/P1rb3p/3p4/4b2P/P5P1/5R1K b - - 5 29,c5c2 f1f8 g8h7 f8h8,2154,76,93,723,endgame master mate mateIn2 short,https://lichess.org/K8pcF1qY/black#58,
l2uPb,8/8/1k4R1/1p1np1p1/3N4/P7/KPP3r1/8 b - - 1 42,b6c5 d4b3 c5c4 g6c6,2108,76,94,10829,endgame mate mateIn2 short,https://lichess.org/MGjjSgSI/black#84,
NLbX7,r1k4N/pp1b2pp/1qnQp3/3pP3/8/4nN2/PPP1B1PP/3RKR2 w - - 1 19,h8f7 e3g2 e1d2 b6e3,2107,78,90,1018,mate mateIn2 middlegame short,https://lichess.org/5q1AD8jd#37,
1VQlE,8/1R6/3k1p1p/3p3B/p2P1R1P/PnP5/1P3PK1/3r2r1 w - - 1 43,g2f3 d1d3 f3e2 b3c1,2144,80,95,12791,endgame mate mateIn2 short,https://lichess.org/OGtEZYv7#85,
GkRMP,2k1r3/ppp2p1p/2n5/5b2/3q4/3P1N2/P1P1K1PP/R2Q1B1R w - - 10 20,e2d2 d4f4 d2c3 f4b4,2195,79,84,361,mate mateIn2 middlegame short,https://lichess.org/WDF2JjeB#39,
cIB7f,8/3R4/p3Npk1/1pb4p/2p4P/5KP1/PPr5/8 b - - 1 34,c5g1 e6f8 g6f5 d7d5,2165,78,91,1223,endgame mate mateIn2 short,https://lichess.org/eDpwHn3g/black#68,
jnFCu,6r1/R1P2p2/1p1p2r1/1N1Pk2n/4P3/4RK2/8/8 w - - 1 46,a7b7 g6g2 c7c8q g8g3,2161,74,93,7307,clearance endgame mate mateIn2 quietMove short,https://lichess.org/uNIs56P8#91,
MsfeU,8/8/4kbp1/3p3p/pr1P1K1P/4BPP1/1P1R4/8 w - - 1 40,d2e2 g6g5 h4g5 f6e5,2193,75,93,3190,endgame mate mateIn2 pin short,https://lichess.org/Dzq7I3Pc#79,
n7OSm,r4r2/ppq2pk1/2p2Np1/7p/3Q1bbP/2P5/PP4P1/R3R1K1 b - - 3 22,a8d8 f6e8 g7g8 d4g7,2106,76,95,1862,doubleCheck fork mate mateIn2 middlegame short,https://lichess.org/YcevbXUi/black#44,
PQf0B,6Q1/p1r1q3/1p3p2/4pk2/r7/2PR4/6PK/5R2 b - - 6 37,a4f4 g2g4 f5e4 g8d5,2157,76,94,1360,endgame mate mateIn2 short,https://lichess.org/GN5fMze9/black#74,
ROs1p,r3k2r/ppR2pp1/8/3P4/4PQq1/5nB1/PP2NPpP/R5K1 w kq - 5 20,g1g2 h8h2 g2f1 g4h3,2186,82,93,7586,mate mateIn2 middlegame pin short,https://lichess.org/4XWGtYcR#39,
5lZ81,8/4Q3/2p1P1kp/1p4p1/1P1PK1P1/8/2q5/8 w - - 9 53,e4e5 c2h2 e5e4 h2e2,2157,80,68,158,endgame mate mateIn2 queenEndgame short,https://lichess.org/l8B6O7Lm#105,
bfoNO,6r1/p3kp2/1p2p2p/1B2n2Q/P2B4/5b2/1qr2PPP/3R1RK1 w - - 0 29,d4b2 g8g2 g1h1 g2g4,2145,77,92,174,discoveredAttack kingsideAttack mate mateIn2 middlegame short,https://lichess.org/IzTDyshF#57,
jDDp4,7k/5Rp1/4B1Q1/p6p/1p2P3/2p3P1/PP4KP/3r2q1 w - - 10 35,g2f3 g1f1 f3e3 d1d3,2149,107,52,61,endgame killBoxMate mate mateIn2 short,https://lichess.org/53bZGYOu#69,
lWnD7,6k1/2R5/p3q2p/2b1p1p1/P1N1P3/1Q1p3P/2P2rK1/1R6 w - - 1 33,g2g3 f2f3 g3f3 e6h3,2132,77,86,244,attraction deflection mate mateIn2 middlegame sacrifice short,https://lichess.org/usdgxwKc#65,
nZRII,6q1/kb6/p4P2/2p5/3p4/7P/PPP1QPr1/3RRK2 w - - 4 32,e2e7 g2f2 f1f2 g8g2,2165,76,94,9271,attraction endgame mate mateIn2 sacrifice short,https://lichess.org/BrEGhul5#63,
8PD6P,r7/2p2k2/1p1p1prP/3PpR1K/2P1P1P1/P1R5/8/8 w - - 5 57,c3f3 g6h6 h5h6 a8h8,2137,78,82,312,attraction endgame mate mateIn2 rookEndgame sacrifice short,https://lichess.org/3vJi5gWO#113,
ynmFY,6rr/kQ3p2/p4q2/3Rp3/8/P3P3/1P4BP/2R3K1 b - - 0 25,a7b7 d5b5 b7a7 c1c7,2168,76,96,8158,doubleCheck endgame mate mateIn2 short,https://lichess.org/y1d8Dw1w/black#50,
cbpnc,r3kr2/p2p1pR1/1pnBpQ1p/8/3PP3/2q5/5PKP/8 b q - 1 25,c3d4 f6f7 f8f7 g7g8 f7f8 g8f8,2112,75,94,4608,attackingF2F7 long mate mateIn3 middlegame sacrifice,https://lichess.org/OCzXB1t4/black#50,
CMVFL,3n2r1/pp1Rk2p/4pp1b/2N5/4N3/7P/Pq4P1/7K b - - 6 23,e7e8 e4d6 e8f8 c5e6 d8e6 d7f7,2191,75,93,9058,exposedKing long mate mateIn3 middlegame sacrifice,https://lichess.org/X5xOo8eg/black#46,
gyanl,2r5/pp2kp1p/2n5/3p4/4b3/2P1P3/P2NBPrP/3R1RK1 w - - 0 18,g1h1 g2g1 h1g1 c8g8 e2g4 g8g4,2144,100,12,29,attraction doubleCheck kingsideAttack long mate mateIn3 middlegame sacrifice,https://lichess.org/VuanYHuf#35,Slav_Defense Slav_Defense_Other_variations
8GbOM,4r1k1/5p1p/p2bqPB1/1p5r/3p1RR1/6QP/PPP3P1/7K b - - 0 31,h7g6 g4g6 g8h7 g6h6 h5h6 g3g7,2139,79,90,1426,clearance kingsideAttack long mate mateIn3 middlegame sacrifice,https://lichess.org/Erf2JxqQ/black#62,
s1CBk,2rq1r2/p4pbk/1p1p2pp/3Nn3/4PQ2/1R4PR/P4P1P/6K1 b - - 0 27,d8d7 d5f6 g7f6 f4h6 h7g8 h6h7,2120,77,91,1308,deflection fork long mate mateIn3 middlegame sacrifice,https://lichess.org/RQ2Uzq9A/black#54,
etZul,3r4/4p1k1/p4npr/2pP3p/5q1P/1P3PNK/P5P1/1R1Q2R1 w - - 3 28,d1c1 f4g4 f3g4 h5g4 h3h2 h6h4,2173,76,95,6303,long mate mateIn3 middlegame sacrifice,https://lichess.org/BdxRuPF6#55,
OMhjH,5r2/3b1pk1/pq4p1/3B1P2/2p5/6Q1/P5K1/5R2 b - - 5 28,d7c6 f5f6 g7h8 f1h1 h8g8 g3g6,2153,76,94,4204,endgame long master mate mateIn3 pin,https://lichess.org/1xkt0qx8/black#56,
tReRg,2rr4/ppqnbkp1/8/1P1p2P1/P7/2P1nQ2/5KB1/RN5R b - - 1 28,f7g8 f3d5 e3d5 g2d5 g8f8 h1h8,2142,76,87,436,kingsideAttack long mate mateIn3 middlegame sacrifice,https://lichess.org/xze2PHMM/black#56,
9Pc5k,r1b1rnk1/pp3Rp1/3P3p/2q1P3/7P/2pB4/PPQ3P1/5R1K b - - 1 24,c5e5 f7f8 e8f8 d3h7 g8h8 f1f8,2174,103,90,31,deflection kingsideAttack long mate mateIn3 middlegame sacrifice,https://lichess.org/4iqYa60v/black#48,
tGkG7,5r2/1RR2p1p/3pk1p1/6P1/2p1P2P/1bPr1P2/7K/8 b - - 2 43,d6d5 c7e7 e6d6 e4e5 d6c5 e7c7,2161,76,98,155,endgame long mate mateIn3,https://lichess.org/TSmsZNeC/black#86,
92hB0,r1bk2nr/ppp1qR1p/2np4/7Q/2BbP3/8/PPP3P1/RNB4K b - - 1 13,e7e4 f7f8 d8d7 h5f7 c6e7 f7e8,2126,78,93,4995,long mate mateIn3 opening,https://lichess.org/UJrBJrNP/black#26,Kings_Gambit_Accepted Kings_Gambit_Accepted_Fischer_Defense
0z9Wy,6k1/p4pp1/7p/5q2/7n/1PP3PK/P3QP1P/5B2 w - - 0 38,h3h4 g7g5 h4h5 g5g4 h5h6 f5g6,2104,75,95,12054,discoveredAttack endgame long mate mateIn3,https://lichess.org/acMbJ63H#75,
RDKpL,7k/pR4p1/4B2p/2q1b3/4P3/8/PP2QrPP/6K1 w - - 0 26,e2f2 c5c1 f2f1 e5d4 g1h1 c1f1,2104,84,90,214,deflection endgame long mate mateIn3,https://lichess.org/SmRELXbP#51,
G1xW0,r3r1k1/4bpp1/2p5/1p1n3Q/7P/P2P3B/4PPR1/1qBK3R b - - 3 30,e7a3 g2g7 g8g7 h5h6 g7g8 h1g1,2174,79,90,5051,attraction kingsideAttack long mate mateIn3 middlegame sacrifice,https://lichess.org/U9Tl11ke/black#60,
XfGgf,2r5/R5R1/p1r3p1/7k/1p5P/2p3P1/PP4K1/8 b - - 2 41,c3b2 g2h3 g6g5 g3g4 h5h6 h4g5,2124,76,87,741,endgame long master mate mateIn3 rookEndgame,https://lichess.org/xKP6A1Vf/black#82,
aYbuk,2r3k1/5pB1/1p1p2p1/1P1B2q1/4Pp1p/3PnR1P/1Q4P1/6K1 w - - 3 25,g7h8 c8c1 g1h2 g5g3 f3g3 h4g3,2138,74,93,9860,kingsideAttack long mate mateIn3 middlegame sacrifice,https://lichess.org/tl8lmVJ5#49,
n2N4k,2k2q1r/p4p1p/1p3Qp1/3Rp1P1/r3P3/5P2/PKP4P/7R w - - 1 27,h1d1 f8a3 b2b1 a4b4 b1a1 a3b2,2115,76,91,1881,endgame long mate mateIn3,https://lichess.org/r1aivwe3#53,
SoXKn,6k1/5pp1/7p/1p6/4P1N1/3P2QP/q1r3PK/8 b - - 2 31,b5b4 g4f6 g8h8 g3b8 c2c8 b8c8,2101,80,91,1560,endgame long mate mateIn3 pin,https://lichess.org/FpIQCigx/black#62,
C9pYF,rb3r1k/pp3p1p/6p1/8/3B4/1P3QqP/P2P2P1/2R2RK1 b - - 0 26,h8g8 f3f7 f8f7 c1c8 f7f8 f1f8,2147,84,52,56,kingsideAttack long mate mateIn3 middlegame sacrifice,https://lichess.org/mkPk6Vjp/black#52,
5H0Ih,3r2k1/4Rp1p/p2n2pP/8/1p1N4/4RQP1/1q3PK1/2r5 b - - 2 40,b2d4 f3f7 d6f7 e7e8 d8e8 e3e8,2107,76,96,3754,long mate mateIn3 middlegame sacrifice,https://lichess.org/yChbasZO/black#80,
XiCiP,5r1k/Qbp3pp/4B3/8/2P5/2q5/P5PP/R5K1 w - - 1 23,a1b1 c3c2 a7b7 c2f2 g1h1 f2f1 b1f1 f8f1,2121,76,95,10061,backRankMate endgame mate mateIn4 sacrifice veryLong,https://lichess.org/ZyyhuKfY#45,
vD9xS,3q2k1/pr3p1p/3prbp1/1pp1p1B1/4P2Q/3P3R/PP4PP/5RK1 b - - 1 27,f6g5 h4h7 g8f8 h7h8 f8e7 f1f7 e7f7 h3h7,2126,73,94,10270,attraction kingsideAttack mate mateIn4 middlegame sacrifice veryLong,https://lichess.org/MHB8ehZN/black#54,
nciEA,4r3/1ppkbQ2/3qp3/p2pBp2/3P1P2/4P3/P7/2R3K1 b - - 0 29,d6a3 c1c7 d7d8 c7c8 d8c8 f7e8 e7d8 e8e6,2143,79,92,1989,attraction deflection endgame mate mateIn4 veryLong,https://lichess.org/bBWYpANn/black#58,
YXnxy,5Nr1/p2R1Qpk/5p1p/2p1pP2/4b3/2P4P/4q1PK/8 b - - 7 36,h7h8 f8g6 h8h7 f7g8 h7g8 d7d8 g8f7 d8f8,2191,75,93,767,attraction endgame hookMate mate mateIn4 sacrifice veryLong,https://lichess.org/FsTuz3L4/black#72,
76Wf2,5k2/1b4b1/p2pQ3/1p2p3/1P1q4/P3nP1P/6P1/2R4K b - - 6 36,e3g2 c1c7 d4d1 h1h2 d1f3 e6e7 f8g8 e7g7,2121,76,89,512,endgame exposedKing mate mateIn4 veryLong,https://lichess.org/NUneOm3u/black#72,
KGJ2O,r3r1k1/pQ3ppp/3B4/q2p4/2pP2P1/4P3/P3n1PP/2R2R1K b - - 3 22,e2c1 b7f7 g8h8 d6f8 e8f8 f7f8 a8f8 f1f8,2176,82,90,2312,backRankMate mate mateIn4 middlegame veryLong,https://lichess.org/hX2U6Nza/black#44,
cPdmV,3r2r1/1p3R2/p1kb4/3pp1q1/1PN1b3/B1P4Q/P5PP/3R2K1 b - - 0 30,e4g2 c4a5 c6b5 h3d3 b5a4 d3c2 a4a3 c2b3,2133,76,93,6642,mate mateIn4 middlegame sacrifice veryLong,https://lichess.org/ofM4CeRb/black#60,
TgtLK,r1b3nr/ppppk1N1/2n2pp1/4P1Bp/1bB2Q2/8/P1qNKPPP/R6R b - - 1 13,b4d2 g5f6 e7f8 f6e7 f8e7 f4f7 e7d8 f7f8,2186,76,79,299,attraction doubleCheck mate mateIn4 middlegame sacrifice veryLong,https://lichess.org/gxSJ07N2/black#26,Scotch_Game Scotch_Game_Classical_Variation
e4gda,1r4k1/p6p/Q5p1/6r1/3P4/2P2q2/P4PRP/4R2K w - - 9 32,e1g1 f3g2 g1g2 b8b1 a6f1 b1f1 g2g1 f1g1,2144,77,93,5953,endgame mate mateIn4 sacrifice veryLong,https://lichess.org/Gwdjw8QA#63,
csUAI,7k/r2qp2n/p2p2Qp/2pP2pN/8/3PP3/1b4PP/5RK1 b - - 3 28,a7a8 f1f7 h7f8 g6h6 h8g8 f7g7 b2g7 h6g7,2100,79,91,110,exposedKing kingsideAttack mate mateIn4 middlegame veryLong,https://lichess.org/lM9TXw55/black#56,
MPKiW,2r1r3/5pk1/p6p/b1qp1N1Q/2b2P2/2P1p1P1/6KP/R1R5 b - - 1 35,g7f6 h5h6 f6f5 g3g4 f5e4 h6h7 f7f5 h7f5,2169,76,87,257,exposedKing mate mateIn4 middlegame sacrifice veryLong,https://lichess.org/dZNpR7Rr/black#70,
Ob7d5,5rk1/p4ppp/b7/3N4/1b1q4/8/PP1B1PPP/R2QK2R w KQ - 0 16,d5b4 f8e8 d2e3 e8e3 f2e3 d4e3 d1e2 e3e2,2118,78,91,775,mate mateIn4 middlegame veryLong,https://lichess.org/N7S9Cb0e#31,French_Defense French_Defense_Exchange_Variation
8fuUj,4kbr1/1b1n1p2/2n1p3/3pP3/1PpP3B/2q2N2/Q4PPP/R2B2K1 b - - 2 25,c6d4 a2a8 b7a8 a1a8 d7b8 d1a4 d4c6 a4c6,2150,87,94,171427,bodenMate mate mateIn4 middlegame pin sacrifice veryLong,https://lichess.org/IG9esLpd/black#50,
QSbcR,3r4/q6p/3P1kp1/p1b2b2/1pN2QPR/7K/PP5P/6r1 b - - 4 37,a7b7 f4e5 f6g5 h4h5 g6h5 e5f5 g5h6 f5f6,2144,77,94,4270,deflection fork mate mateIn4 middlegame sacrifice veryLong,https://lichess.org/ob6AxllH/black#74,
nmVmM,2r1r3/pp6/2b4p/P1P1B1p1/1P4k1/5p1P/2B5/4R1K1 b - - 0 32,g4h3 c2f5 g5g4 g1f2 h3h4 e5f6 h4h5 e1h1,2167,74,94,7770,endgame fork mate mateIn4 veryLong,https://lichess.org/kkZLQ1bP/black#64,
tNDI8,r4r2/1bp5/1p1n2kp/pP3qp1/2PbN3/P2B3P/2QR3B/3RN2K w - - 1 28,h2d6 f5h3 d6h2 f8f1 d3f1 h3f1 h2g1 f1g1,2103,79,91,128263,exposedKing kingsideAttack mate mateIn4 middlegame pin veryLong,https://lichess.org/tWrguPkg#55,
CP8CC,8/6q1/5p2/3q1B2/6Pk/7Q/5P1K/8 b - - 2 49,h4g5 h3e3 g5h4 e3g3 h4g5 f2f4 g5h6 g3h3,2177,96,86,72,endgame mate mateIn4 veryLong,https://lichess.org/NNNPRY5U/black#98,
cbk7J,8/pp6/6kp/2P3p1/1P6/1Q4P1/P4q1K/8 w - - 0 43,h2h3 g5g4 h3h4 f2f6 h4g4 f6f5 g4h4 f5h5,2195,75,94,1163,endgame mate mateIn4 queenEndgame veryLong,https://lichess.org/UQLjZbyw#85,
