PuzzleId,FEN,Moves,Rating,RatingDeviation,Popularity,NbPlays,Themes,GameUrl,OpeningTags
HQKgS,2r2k1r/B3ppb1/3p1nn1/1P1P4/8/1NP2PPq/1P2B2p/R2Q1R1K w - - 1 26,a7f2 g6f4 g3f4 f6h5 f1e1 g7c3 e2f1 h3g3,2871,95,76,137,advantage discoveredAttack master middlegame sacrifice veryLong,https://lichess.org/ySkH3bnP#51,
HYxD7,r1b2rk1/1pp2pp1/p1n4B/6Qn/PPB5/3P4/6PK/1q6 b - - 1 20,g7g6 g5g6 g8h8 g6h5 c8g4 h5h4 b1a1 d3d4 a1d4 h6e3,2806,97,62,88,advantage discoveredAttack kingsideAttack middlegame pin quietMove veryLong,https://lichess.org/sL5RTs1c/black#40,
HvxyW,Q6k/6b1/3p1qBp/4pP2/4P3/6PK/8/8 b - - 12 62,f6f8 a8f8 g7f8 f5f6 d6d5 e4d5 e5e4 h3g4 e4e3 g6d3 h8g8 g4f5 g8f7 d3c4 f8b4 d5d6,2842,92,88,139,crushing discoveredAttack endgame master quietMove veryLong,https://lichess.org/SIX02FFN/black#124,
I6Di5,r1k1b3/P7/1KpBp3/3pP3/5P2/1P3B1p/8/8 b - - 1 40,h3h2 f4f5 e8h5 f3g2 c8d7 f5e6 d7e6 g2h3 e6f7 e5e6 f7f6 d6h2,2889,95,93,605,attraction crushing discoveredAttack endgame exposedKing master veryLong,https://lichess.org/ent0y1xE/black#80,
I6zb7,1r6/1r1k3p/1qp2pp1/pb1pp3/8/Q6P/P1PN1PP1/3RR1K1 b - - 1 29,b6d4 c2c4 b5c4 d2e4 d5e4 d1d4 e5d4 e1e4,2866,109,90,1001,advantage discoveredAttack middlegame veryLong,https://lichess.org/GGDRPTbr/black#58,
I7qYp,8/p2k4/2p1p3/1P2P3/P2PK2B/b7/8/8 b - - 0 43,c6b5 a4b5 d7c7 h4f2 c7b6 d4d5 b6b5 d5e6,2877,103,89,852,bishopEndgame crushing discoveredAttack endgame quietMove veryLong,https://lichess.org/BJRur370/black#86,
IF4bp,2r3k1/1b2r1b1/p3p1Q1/1p4N1/3qPP1p/P3p2P/1P2R1P1/5RK1 b - - 0 33,c8c2 f4f5 c2e2 f5f6 e2f2 g6h7 g8f8 g5e6 e7e6 h7g7 f8e8 f6f7 f2f7 g7d4 f7f1 g1f1,2863,108,82,334,advancedPawn advantage deflection discoveredAttack exposedKing fork middlegame sacrifice veryLong,https://lichess.org/cRWQIpyW/black#66,
IFWWP,8/8/p6R/1p5P/1P4r1/P4p2/3K1k2/8 w - - 3 43,h6a6 g4g2 a6g6 f2f1 d2e3 f3f2,2891,119,87,1460,advancedPawn crushing discoveredAttack endgame exposedKing long quietMove rookEndgame,https://lichess.org/zWx2nGLv#85,
IS9YS,5r2/5r2/p2p1pk1/1p1PpR1p/1P1qP1pP/3P2P1/3Q2K1/5R2 b - - 4 40,d4b6 f5h5 g6h5 f1f6,2893,112,90,2229,crushing deflection discoveredAttack endgame sacrifice short,https://lichess.org/4jjM7zUy/black#80,
IlDjb,r1b1k2r/pp5p/n1p2np1/2b2p2/2BNpNq1/8/PPP2QPP/1K1RR3 b kq - 3 16,a6c7 d4c6 b7c6 f2c5 g4f4 g2g3 f6d7 d1d7 c8d7 g3f4,2825,104,86,297,crushing discoveredAttack middlegame sacrifice veryLong,https://lichess.org/vPYVgwMd/black#32,Blackmar-Diemer_Gambit Blackmar-Diemer_Gambit_Netherlands_Variation
IwRnC,r4r2/1pq2ppk/4p2p/p2p3Q/P3n1R1/1PP1PN2/6PP/5RK1 b - - 5 24,e4f6 f3g5 h7g8 f1f6 c7c3 g5f7 c3f6 f7h6,2804,88,93,1308,advantage discoveredAttack middlegame pin veryLong,https://lichess.org/YQQWuhCQ/black#48,
JQBa9,7r/3q2k1/2p3p1/pp1p4/3Pp3/1PP1B1Qb/P4P1K/R2B4 w - - 8 33,f2f4 h3f5 h2g2 h8h3,2825,113,91,1386,advantage clearance discoveredAttack middlegame short,https://lichess.org/DqRqoCM6#65,
Jek03,4r3/1P6/8/8/3K3p/4pk2/7P/4R3 b - - 2 48,f3g2 e1e3 e8d8 d4e4 g2h2 e4f3 d8b8 e3b3 h2h3 f3f4,2893,112,84,219,crushing discoveredAttack endgame quietMove rookEndgame veryLong,https://lichess.org/SnTNFp4A/black#96,
JiwFd,2r4r/kp4bp/3p2p1/3N2q1/3nB3/P7/5QpP/1R1R2K1 b - - 0 27,h8f8 b1b7 a7b7 f2b2 b7c6 d5f6 d6d5 b2d4,2829,99,91,595,advantage attraction discoveredAttack interference middlegame sacrifice veryLong,https://lichess.org/1517YngY/black#54,
JvRQ8,r2q1rk1/pp3ppp/2nbpn2/3pN1B1/3P4/2NQ4/PPP2PPP/R3R1K1 b - - 5 11,d6e5 d4e5 h7h6 g5h4 g7g5 e5f6 g5h4 e1e6,2808,108,87,388,crushing discoveredAttack middlegame veryLong,https://lichess.org/z2xw6MHp/black#22,Caro-Kann_Defense Caro-Kann_Defense_Other_variations
JxcWM,1r2r1kb/4p2p/p2q1npB/2pP4/2B5/2N4N/PP4P1/2K1R3 b - - 0 24,d6b6 d5d6 f6d5 c4d5 e7e6 e1e6 b6b2 c1d1 b2a1 d1e2 b8b2 e2d3 b2d2 h6d2,2848,113,83,376,crushing discoveredAttack middlegame veryLong,https://lichess.org/9AucGDh9/black#48,
JzfM5,r4rk1/P5pp/4pb2/1Q1b3q/2P1p3/N3Bn2/PP3PPP/R3NR1K w - - 3 20,g2f3 f6e5 f3f4 f8f4 e3d4 e4e3 b5d5 e6d5,2824,97,86,578,crushing discoveredAttack kingsideAttack master middlegame veryLong,https://lichess.org/PNzyo3qW#39,
K2KIQ,r2q1rk1/ppp2ppp/3bbn2/6Q1/8/1PN5/PBP2PPP/2KR1B1R b - - 2 12,d8e7 d1d6 c7d6 c3e4 h7h6 b2f6 h6g5 f6e7,2874,104,86,396,crushing discoveredAttack middlegame pin sacrifice veryLong,https://lichess.org/aCVh6hUW/black#24,Scotch_Game Scotch_Game_Other_variations
K8mEt,4r3/5Q2/2q2n1k/p6p/1b4pP/2N1p1P1/KP1nN3/2B1R3 b - - 3 39,d2f3 e2d4 f3d4 e1e3 c6c4 f7c4,2848,104,86,501,crushing discoveredAttack long middlegame sacrifice,https://lichess.org/HawRtMRQ/black#78,
KCbUJ,r3rbk1/1R3p1p/p3nBp1/4P3/3p4/2qB1Q2/5PPP/5RK1 b - - 1 30,e6c5 e5e6 e8e6 f6d4 c5b7 d4c3,2827,88,88,288,crushing discoveredAttack long middlegame,https://lichess.org/gEzOaYUO/black#60,
KCfsm,2r1r1k1/pp2b1p1/4p1PB/3pP3/3p3P/nPqB1R2/P1P4Q/2K2R2 b - - 0 30,g7h6 h2f4 e8f8 f4g4 g8g7 f3f7 f8f7 g6f7 g7h8 g4g6,2860,92,94,140,advancedPawn advantage discoveredAttack exposedKing fork middlegame veryLong,https://lichess.org/Lj02WHSZ/black#60,
KP07c,5r2/1p4k1/p3p2p/4P3/2PP1qP1/P4b2/1P1RQ3/4R1K1 w - - 2 37,e2f2 g7h7 g1f1 f4g4 e1e3 f3g2 f1e1 f8f2,2873,109,87,1509,advantage attackingF2F7 discoveredAttack endgame exposedKing pin veryLong,https://lichess.org/9T6amin1#73,
Kadas,2r4r/p1pk1R2/1p2p1np/3p3q/2nP4/P1PQ3P/P2B2N1/4R1K1 b - - 4 24,d7d6 e1e6 d6e6 d3f1 g6f4 g2f4 e6f7 f4h5,2851,97,85,342,advantage discoveredAttack fork middlegame sacrifice veryLong,https://lichess.org/q9VFF3zK/black#48,
Kp5qw,7r/1kpQ4/p2b4/6pq/3P1pp1/2P1B1P1/PP3P2/R3RK2 w - - 0 23,g3f4 g4g3 f1g2 g5f4 e3f4 h5d5 f2f3 h8h2 g2g3 d6f4 g3f4 d5d7,2874,109,88,694,clearance crushing discoveredAttack intermezzo middlegame veryLong,https://lichess.org/G83pcMjw#45,
KruXd,2r2r1k/6pp/p3Q3/2b3PP/8/pP1qP3/2R1N3/1K5R w - - 3 30,h5h6 c5d6 e2d4 c8c2,2879,106,88,1349,crushing discoveredAttack middlegame quietMove short,https://lichess.org/m9nsnHdq#59,
Kstab,5rk1/p5p1/3p2r1/3PP2p/2Q1Nqb1/P7/1P3PPP/4RR1K w - - 5 24,e4d6 g4h3 c4f4 h3g2 h1g1 f8f4 f2f3 g2f3 g1f2 f3g2,2865,99,90,1694,advantage discoveredAttack fork middlegame sacrifice veryLong,https://lichess.org/n7PJUCnA#47,
Kv2Qy,6r1/ppN2k2/3p2n1/3P3r/2P2P2/P2P4/1P6/R4RK1 w - - 1 29,b2b4 g6h4 g1f2 g8g2 f2e1 h4f5,2802,117,88,246,crushing defensiveMove discoveredAttack endgame exposedKing long,https://lichess.org/NNJCG3jT#57,
Kzlpc,r5nr/1p2k3/5pqp/2p3p1/P3P3/2P2QP1/3R1P1P/5RK1 b - - 1 23,e7f7 e4e5 f7f8 f3b7 a8e8 d2d7,2888,107,87,467,advantage defensiveMove discoveredAttack long middlegame pin,https://lichess.org/ci8rP1Jo/black#46,
L46kc,r1q1r1k1/pR1nB2p/4R1pP/3p1pP1/3p1P2/8/1Q6/6K1 b - - 4 32,d7c5 e6g6 h7g6 h6h7 g8h7 e7c5 h7g8 c5d4 e8e1 g1f2,2815,120,88,558,advancedPawn advantage discoveredAttack middlegame sacrifice veryLong,https://lichess.org/bIlLDzRK/black#64,
LIyqd,2r5/p7/1p6/6k1/3P2q1/P3P1P1/1P1K4/R2Q2Nr b - - 0 28,g4g3 g1f3 g5f5 d1h1 g3f2 d2d1 c8h8 h1g1 f2g1 f3g1,2871,110,88,151,crushing discoveredAttack endgame veryLong,https://lichess.org/wkR2qrVr/black#56,
Lyyw7,2kr4/pp3pp1/4pnp1/2b2q2/2NP4/1P1P3r/PB3PP1/R2Q1RK1 w - - 0 18,g2h3 f5h3 d1e2 f6g4 f2f3 d8d4 a1c1 c8d8 e2g2 d4d3,2868,112,84,246,advantage discoveredAttack middlegame veryLong,https://lichess.org/ccxDRgbG#35,Caro-Kann_Defense Caro-Kann_Defense_Other_variations
M0QIA,4rr1k/p5p1/1p6/3q3p/3bN3/3Q2P1/P3RP1K/4R3 b - - 5 32,h5h4 e4g5 d5g5 e2e8 h4g3 d3g3 g5h5 g3h3 h5h3 h2h3 f8e8 e1e8,2830,98,88,958,crushing discoveredAttack middlegame pin quietMove veryLong,https://lichess.org/Mu5k4imx/black#64,
MJeXB,6rk/5p1p/7R/3p2Q1/8/4PN1P/1qr2nP1/5RK1 w - - 3 29,g5f5 g8g2 g1g2 f2e4 f3d2 b2g7,2877,106,88,600,crushing discoveredAttack long middlegame pin sacrifice,https://lichess.org/cVrBsFo4#57,
MRYwN,4r1k1/p4pp1/2pQ4/2N5/PP4q1/6Pb/5P1K/3R4 w - - 9 30,d1d4 g4h5 d4e4 e8e4 c5e4 h3f5 h2g1 f5e4,2841,101,88,185,crushing discoveredAttack endgame master veryLong,https://lichess.org/vB8VRlWD#59,
Mc6sN,2r3k1/pp5p/2pn1rpP/q3Q3/3P4/1PN2P2/P7/1K1R3R b - - 0 27,a5e5 d4e5 f6f3 d1d6 f3c3 d6d7,2841,109,90,1157,capturingDefender crushing discoveredAttack fork long master middlegame,https://lichess.org/YhN2iWe2/black#54,
Mh1m1,N2k1r2/pp1b2pp/3p3q/4P3/2B4n/6b1/PPP3PQ/3R1R1K w - - 1 22,h2g3 f8f1 c4f1 h4f5 g3h3 f5g3,2811,102,88,191,advantage discoveredAttack kingsideAttack long middlegame pin,https://lichess.org/lxThMXkL#43,
MtaIQ,r4rk1/2p2pp1/p1pqb2p/8/1P2NN2/P2P4/2P3PP/Q4RK1 b - - 0 19,d6d7 e4f6 g7f6 f4h5 d7d8 f1f6 g8h7 f6e6,2862,109,91,1529,crushing discoveredAttack kingsideAttack middlegame sacrifice veryLong,https://lichess.org/RtmVAk1d/black#38,Ruy_Lopez Ruy_Lopez_Steinitz_Defense
NoojB,3b2k1/5pBp/pp2qP2/2ppnN1N/P7/3P3K/1PP5/5R2 b - - 2 32,e5d7 h3g2 h7h6 f5h6 g8h7 h5f4 e6c6 f1h1 d5d4 g2g1 d7f6 h6f5 c6h1 g1h1,2845,96,88,534,advantage discoveredAttack middlegame quietMove veryLong,https://lichess.org/AZDRVf90/black#64,
NqIgq,r4br1/1p4kb/p3q1pp/2pR4/3n1Q1N/2NP4/PPPB2PP/R5K1 b - - 4 19,e6d5 f4c7 d5f7 d2h6 g7h8 c7f7,2835,95,93,1113,crushing deflection discoveredAttack long middlegame,https://lichess.org/4lRfqV5P/black#38,Sicilian_Defense Sicilian_Defense_McDonnell_Attack
O4k7P,5r1k/ppp3pp/1b1p4/8/3q4/1BNb2Q1/PP3RPP/5RK1 w - - 7 21,c3d1 d4e4 g1h1 b6f2 d1f2 e4e2 f1g1 f8f2,2817,104,91,1528,advantage discoveredAttack middlegame pin veryLong,https://lichess.org/O8nBh47B#41,
OMDRz,kb1q2rr/N2b1p1p/P1p5/3p1p2/1P2p3/2P1B3/4BPPP/R2Q1RK1 w - - 1 21,b4b5 b8h2 g1h2 d8h4 h2g1 g8g2 g1g2 h8g8 e2g4 f5f4 e3f4 d7g4 d1g4 h4g4,2845,92,85,118,attraction crushing discoveredAttack kingsideAttack master middlegame pin sacrifice veryLong,https://lichess.org/Xgac5x6g#41,
OfhRg,r4rk1/p4ppp/p1p5/3p4/3Nb1P1/P4PqP/1P6/R1BQR1K1 w - - 1 21,g1f1 f7f5 f3e4 f5g4 d4f5 g4h3,2892,107,88,551,crushing discoveredAttack exposedKing long middlegame pin sacrifice,https://lichess.org/lVjxC4sz#41,
OkD3M,r3r1k1/1pqB1pp1/p1p3p1/2Pp4/N2P3b/1Q3Pn1/PP1B1K2/R5R1 w - - 0 20,d7e8 g3f5 f2e2 f5d4,2815,98,85,547,crushing discoveredAttack master middlegame short,https://lichess.org/AP2gOJsy#39,
Os1GS,r5k1/pbR3pp/1p4r1/3q4/3P4/B3QP2/6PP/2R3K1 w - - 4 24,e3e5 g6g2 g1h1 d5e5 d4e5 b7f3 c7c8 g8f7,2846,93,94,315,advantage discoveredAttack middlegame veryLong,https://lichess.org/amYqmhnr#47,
Ovj3D,r2qr1k1/ppp2ppp/4b3/3nP3/4B3/5QR1/PB4PP/5RK1 b - - 0 22,c7c6 e4h7 g8h7 f3h5 h7g8 g3g7 g8g7 f1f7 e6f7 e5e6 d8f6 h5f7 g7h6 b2f6 d5f6 f7f6,2884,116,88,409,attraction crushing discoveredAttack intermezzo kingsideAttack middlegame pin sacrifice veryLong,https://lichess.org/mIUKpp9Z/black#44,
P0mCa,1Q2Nbk1/4n3/2q1p2P/2p2pN1/2Pp1nP1/5PK1/8/8 b - - 2 50,f4e2 g3f2 f8h6 e8c7 h6f8 c7e6,2894,98,86,610,advantage defensiveMove discoveredAttack exposedKing long master middlegame,https://lichess.org/C5t4VbXF/black#100,
P2O49,r4rk1/p5pp/2p5/3p1p2/1P1Bb1Pq/P3P2P/5P1K/R2Q1R2 w - - 0 20,f2f3 f5g4 f3e4 f8f1 d1f1 a8f8,2844,110,88,606,clearance crushing discoveredAttack long middlegame sacrifice,https://lichess.org/2ST1X1lf#39,
P6fvR,1kr2b2/3b4/p2ppQ2/1p2N3/1q2P3/3R2PB/PPr4P/1K1N1R2 w - - 0 28,d3c3 b4e4 e5d7 b8a7 d1f2 c2f2,2831,101,93,343,advantage discoveredAttack long middlegame sacrifice,https://lichess.org/vMczQzhm#55,
PAeTt,2k3r1/Bbpn1p1p/3b2r1/2p5/3q3N/2N3PQ/PPP2P1P/R3R1K1 w - - 4 19,a1d1 d6g3 d1d4 g3h4 g1f1 c5d4,2808,97,88,453,advantage discoveredAttack kingsideAttack long middlegame pin sacrifice,https://lichess.org/b4B0iMMF#37,
PLV3c,5rk1/1b4p1/pp2p3/7q/2P1Pn2/1P2QNpP/P2R2Bb/4R2K w - - 5 32,d2d7 f4h3 g2h3 f8f3 h3e6 g8f8 d7d8 f8e7,2813,110,91,858,crushing deflection discoveredAttack master middlegame veryLong,https://lichess.org/4iYrUJ45#63,
PT0iY,6rk/R5bp/5r2/2Q4p/3B1q1N/1P1P1p1b/2P2P2/4R2K w - - 2 36,e1e4 h3g2 h4g2 f3g2 h1g2 g7f8 g2f1 f4f2 d4f2 f8c5,2880,94,94,1622,advancedPawn crushing discoveredAttack exposedKing middlegame pin veryLong,https://lichess.org/lQDrINCd#71,
PnsA1,r1b2b1r/ppp1kBp1/5n1p/6N1/3n4/N3B3/PP3PPP/R3K2R b KQ - 1 11,d4c6 e3c5 e7d8 c5f8 h8f8 e1c1 c8d7 g5e6 d8e7 e6f8,2877,119,88,1193,castling crushing deflection discoveredAttack exposedKing fork middlegame veryLong,https://lichess.org/9gRj40GW/black#22,French_Defense French_Defense_Knight_Variation
QDKKd,8/8/6R1/4prp1/4k1K1/8/8/8 b - - 1 44,e4e3 g4f5 e3f3 g6f6 e5e4 f5e5,2800,107,87,233,crushing discoveredAttack endgame hangingPiece long quietMove rookEndgame,https://lichess.org/WmwHpgRm/black#88,
QI019,2kr4/5p1p/p4p2/1p6/1Kp5/N1P1P3/r4PPP/2R2R2 w - - 0 23,a3c2 d8d5 c2a3 a2b2 b4a5 b5b4 a5b6 b4a3,2840,95,92,713,crushing discoveredAttack endgame quietMove veryLong,https://lichess.org/IBByqB5w#45,
QKwPV,r2q2k1/1p3pp1/1bn4B/pB1p1N2/P2Pr2P/5p2/1PPQ1P2/R4RK1 w - - 1 21,h6g7 e4g4 g1h2 b6c7 g7e5 c6e5 f1g1 e5g6,2896,118,91,2146,advantage discoveredAttack middlegame veryLong,https://lichess.org/7hIVZqSD#41,
Ql2IE,4rrk1/8/6pQ/4b3/p3N3/P3P1RP/1PR3PK/5q2 w - - 1 40,e4g5 e5g3 h2g3 e8e3 g5f3 f1d3,2830,105,79,167,advantage attraction discoveredAttack long middlegame,https://lichess.org/Uyd0rX6t#79,
QtEmn,r4r2/pq2bp1k/b3p3/4P1N1/6R1/1Q6/PPP4P/2K5 b - - 1 23,h7g6 g5e6 g6f5 e6g7 f5e5 b3c3 e5d6 g4d4,2871,106,86,328,crushing discoveredAttack exposedKing middlegame veryLong,https://lichess.org/v6q8UKVc/black#46,
R8FLB,rnb2rk1/ppp2ppp/8/4P2q/2B1p1nP/2N3P1/PPP1N3/R2Q1RK1 b - - 0 12,g4e3 f1f7 e3d1 f7f5 h5f7 f5f7 f8f7 a1d1 b8c6 e5e6,2802,106,80,173,crushing discoveredAttack kingsideAttack opening pin sacrifice veryLong,https://lichess.org/DLRkV7Nr/black#24,Kings_Gambit_Declined Kings_Gambit_Declined_Falkbeer_Countergambit
RM4Oq,3rr3/1p1k1ppp/2N2n2/7q/QbBp1B2/5b2/PP3PPP/R4K1R b - - 0 16,f3e2 f1g1 e2c4 c6d4 c4b5 a4b4,2837,110,88,421,crushing discoveredAttack exposedKing long middlegame sacrifice,https://lichess.org/czbVuRm8/black#32,Sicilian_Defense Sicilian_Defense_Alapin_Variation
RM5Iv,2qk1r2/p6r/R1n1p1p1/2NpP1Pp/3P1PbP/4Q3/1R6/2B1K3 w - - 16 33,c5b7 h7b7 b2c2 b7b3 e3b3 c8a6,2897,105,90,498,advantage discoveredAttack long middlegame,https://lichess.org/wabkTxM5#65,
RP6Vn,3rr3/pp3pk1/1bb1pp1p/7q/2P5/1PQ2NP1/P4PBP/3RR1K1 w - - 10 24,f3d4 e6e5 g2c6 e5d4 c3f3 e8e1 d1e1 h5a5,2875,99,88,423,crushing discoveredAttack middlegame veryLong,https://lichess.org/AMl6CouI#47,
RP8kR,1k6/pB1r4/P2p3Q/1q3p2/1n6/7P/1PP1rPP1/2KR3R w - - 3 24,d1d6 e2c2 c1b1 c2b2 b1b2 b4a6 b2c1 b5c5 c1d1 d7d6 h6d6 c5d6,2850,97,87,239,crushing discoveredAttack fork middlegame sacrifice veryLong,https://lichess.org/HmnNfBCE#47,
RPqmr,r3k2r/pp3ppp/4p3/1P4Q1/2pP1B2/P1P2bP1/5R1P/1qN3K1 b kq - 0 26,f3e4 g5g7 h8f8 f4g5 b1b5 f2f7 f8f7 g7g8 e8d7 g8f7 d7c8 f7e6,2876,108,87,187,advantage attackingF2F7 attraction deflection discoveredAttack middlegame quietMove sacrifice veryLong,https://lichess.org/Fu2SNfKp/black#52,
RWLqO,3r3r/1k3ppp/6qn/1pbPN3/p1p5/P5P1/BP2NPQP/3R2K1 b - - 2 24,g6h5 d5d6 b7a7 g2d5 c5f2 g1f1,2863,117,88,1278,advantage clearance discoveredAttack long middlegame,https://lichess.org/0IyzYlJX/black#48,
RjmPm,6rk/p1Q5/1pn5/5N1q/3pP1n1/P1P5/6PP/2B1R1K1 w - - 3 29,c7c6 h5h2 g1f1 h2h1 f1e2 h1g2 e2d1 g4f2 d1c2 f2e4 c1d2 d4d3,2893,111,91,710,crushing deflection discoveredAttack middlegame veryLong,https://lichess.org/K9dgBebb#57,
RtulK,4nk2/1p2bp1r/2p5/4QR1p/2P1PN2/pP2K3/P7/3q4 b - - 11 37,e7b4 f4e6 f8e7 e6g7 e7d7 f5f7 d7c8 e5e8,2858,97,92,1524,crushing deflection discoveredAttack middlegame pin veryLong,https://lichess.org/8bDkEIOE/black#74,
S3ZzO,4r1k1/2p2pbp/r2p1np1/8/2Pnp3/2N2PPq/P2PP2P/1RBQNRK1 w - - 0 16,e2e3 e4f3 e3d4 f6g4 e1f3 g7d4 g1h1 d4c3,2835,97,88,625,crushing discoveredAttack master middlegame sacrifice veryLong,https://lichess.org/5gaX3Nlm#31,English_Opening English_Opening_Great_Snake_Variation
S76RV,6rk/7p/1PPp1nq1/p3p3/4Ppr1/P4Q2/3B1PP1/1R2R1K1 w - - 1 30,c6c7 g4g2 g1f1 f6g4 f3g2 g4e3 d2e3 g6g2 f1e2 f4e3 e2e3 d6d5 b6b7 g2e4,2801,100,77,322,crushing discoveredAttack kingsideAttack middlegame pin sacrifice veryLong,https://lichess.org/vE8u7S5x#59,
SBRvW,1rr3k1/3p1p1p/2bQ2p1/4Pp2/p7/P1N5/1P1R1qPP/1KR5 b - - 6 27,f2b6 c3d5 b6d8 c1c6 c8c6 d5e7 d8e7 d6e7,2898,104,84,277,crushing discoveredAttack fork middlegame sacrifice veryLong,https://lichess.org/k2rzFAt7/black#54,
Subxd,r1b2rk1/ppq1bppp/2n1p1n1/3pP3/8/1PN2NB1/P1P1BPPP/R2QR1K1 b - - 10 13,g6e5 f3e5 c6e5 c3b5 c7b8 e2d3 f7f6 e1e5 f6e5 d1h5,2863,96,93,2581,advantage discoveredAttack opening sacrifice veryLong,https://lichess.org/iFqnOMLw/black#26,French_Defense French_Defense_Advance_Variation
T96PG,r2qr2k/1p3p1p/p4b1B/4p3/3nN2p/3BQP2/PPP2P2/2K3R1 b - - 9 22,d4f5 e4f6 d8f6 d3f5 e8g8 g1g5 g8g5 e3g5 f6g5 h6g5,2812,117,88,939,advantage discoveredAttack middlegame veryLong,https://lichess.org/sbhu48yG/black#44,
TEWlW,r2q2r1/1pp2ppk/1b1p2np/4pN2/p2PP2P/2P1RNP1/PP3P1Q/2R3K1 b - - 0 32,g6e7 f3g5 h6g5 h4g5 h7g6 h2h3 f7f6 g5f6 g7f6 h3g4 g6f7 f5h6 f7e8 h6g8,2871,117,91,1400,crushing discoveredAttack fork middlegame quietMove sacrifice veryLong,https://lichess.org/J7nx5IHE/black#64,
TVGng,6R1/1k6/p3B2p/1P6/3pNr1r/P3nn2/1PP4P/R1B3K1 w - - 1 33,g1f2 f3g1 f2e1 f4f1 e1d2 f1d1,2852,107,86,448,discoveredAttack exposedKing hookMate long mate mateIn3 middlegame,https://lichess.org/h449Iggd#65,
Tky56,8/8/3R2p1/5pKp/5P2/5kPr/8/8 w - - 82 98,g5g6 f3g4 d6d5 h3g3 d5f5 h5h4 f5f7 h4h3 f4f5 g4f4,2881,99,88,266,crushing discoveredAttack endgame quietMove rookEndgame veryLong,https://lichess.org/bYRjSqV7#195,
Tqp2z,1r3rk1/pb2q2p/3p2n1/2p3N1/1p1bNP2/3P3Q/PPP1B1R1/2K4R b - - 4 21,g6f4 g5h7 f4g2 h7f6 d4f6 e4f6 f8f6 h3h8 g8f7 h1h7 f7e6 h7e7 e6e7 h8b8,2832,94,87,555,advantage discoveredAttack kingsideAttack master middlegame sacrifice skewer veryLong,https://lichess.org/4OMRKoSH/black#42,
TtTAR,1r3rk1/4Rppp/p7/P1p5/3p1Q2/5RK1/1q4PP/8 b - - 5 32,f7f6 f4g4 f8f7 g4e6 b8f8 e7f7 b2b8 f7c7,2845,117,88,246,advantage discoveredAttack endgame veryLong,https://lichess.org/DahDxdlU/black#64,
Tznx3,5r2/6n1/1PPp3k/2q4p/4Bp2/5P1b/5RpN/3Q2K1 b - - 2 31,c5b6 d1d6 g7e6 h2g4 h5g4 d6e6 h6h5 e6e7 b6e3 f3g4 h3g4 e4g6 h5g6 e7e3 f4e3 f2f8 e3e2 f8e8,2882,111,90,1205,crushing discoveredAttack fork interference middlegame pin veryLong,https://lichess.org/tb1JZB8C/black#62,
U0QSa,r1bq2k1/p4rpp/4p3/3pN3/8/8/PPpQ1P1P/2K3RR b - - 1 18,f7f5 g1g7 g8g7 h1g1 g7f6 d2d4 d8e8 e5c6 e6e5 d4h4 f6e6 c6d8 e8d8 h4d8,2809,113,88,362,advantage attraction discoveredAttack kingsideAttack master middlegame sacrifice veryLong,https://lichess.org/vDpUwCnK/black#36,French_Defense French_Defense_Winawer_Variation
U7Qst,8/8/8/1P2R3/8/5p1K/1r3k2/8 w - - 4 61,h3h2 f2f1 h2g3 b2b3 g3f4 f1f2,2821,116,88,974,crushing defensiveMove discoveredAttack endgame long rookEndgame,https://lichess.org/u7JU7POV#121,
UCiUR,3r4/k7/qp1B2p1/b2NPp2/3P1Pp1/3r2P1/7P/QR4K1 b - - 0 38,a6c4 d6c5 a7b7 d5b6 c4c2 b6c4,2877,105,90,358,crushing discoveredAttack long middlegame,https://lichess.org/RCLxZJ0g/black#76,
UaAsY,8/p3r1p1/1p6/2kp3p/3N1R2/PKP1n3/1P6/8 b - - 5 34,g7g5 f4f6 e7c7 d4e6 c5c6 e6c7 c6c7 f6f3 e3c4 f3f5 c7d6 f5g5,2802,98,92,893,crushing discoveredAttack endgame fork veryLong,https://lichess.org/ADodxvH8/black#68,
Ubd5W,2q3k1/p1p2p2/1b1p3p/5rp1/8/2N2QP1/PP3PP1/R3R1K1 w - - 4 22,f3c6 b6f2 g1f1 f2b6 f1e2 c8a6,2817,116,91,847,crushing discoveredAttack fork long middlegame,https://lichess.org/QAFezSxc#43,
UkIKI,1q2rbk1/rp3pp1/1Nn1b2p/pB6/P5PP/2N2P2/1P3Q2/3RR1K1 w - - 7 28,b6d7 e6d7 d1d7 e8e1 f2e1 c6e5,2806,90,88,506,crushing discoveredAttack exposedKing long middlegame,https://lichess.org/goAx7S13#55,
Ul09I,2r5/R6p/3N2pk/5p2/p7/4P2P/5PPK/r7 b - - 1 36,c8c6 d6f7 h6h5 f7d8 c6c4 a7h7 h5g5 f2f4,2882,112,89,618,crushing discoveredAttack endgame veryLong,https://lichess.org/xTNzEmUs/black#72,
UvKbj,Q7/p3np1p/2p1k3/2P3q1/3p1np1/P2P2PP/3KPPB1/R7 w - - 1 25,g2h1 f4d3 d2d3 g5c5 h3g4 c5c3 d3e4 c3a1 h1f3 a1c3,2822,94,87,130,crushing discoveredAttack endgame fork sacrifice veryLong,https://lichess.org/o2iXRbBm#49,
V64pD,R7/5pk1/4pbp1/1NPp3p/3P1Q2/6P1/5P2/3qnK2 w - - 6 40,a8g8 g7g8 f4f6 e1c2 f1g2 d1e2 b5d6 c2e1,2808,100,73,107,advantage discoveredAttack endgame veryLong,https://lichess.org/1cyCcVNv#79,
V8qCT,2q2r1k/2r2npp/8/1B2p1b1/1P2Q1P1/P6P/1B3P2/3RRK2 w - - 3 33,b5a4 g5h4 e4d5 f7g5 e1e5 f8f2 f1g1 g5f3 d5f3 f2f3 e5e8 c8e8,2849,115,91,257,advantage discoveredAttack fork middlegame veryLong,https://lichess.org/tWU4CE6Z#65,
VCmdq,2r3k1/3nbrp1/p3P2p/1p3q2/1Pp3R1/P1B5/4Q1PP/6K1 b - - 0 31,f7f8 g4g7 g8h8 g7g5 f5f6 e2h5 h8h7 c3f6 f8f6 e6d7 c8f8 h2h4,2861,109,89,196,advancedPawn advantage defensiveMove discoveredAttack fork middlegame pin veryLong,https://lichess.org/WujYRGlu/black#62,
VDmWN,r4rk1/pp3pb1/3p1Np1/4p2p/3n2bQ/P2B4/1qPB1P1R/2R1K3 b - - 5 25,g8h8 h4g4 g7f6 h2h5 h8g8 d3c4,2879,111,89,558,advantage discoveredAttack exposedKing long middlegame pin,https://lichess.org/2ejE3sxM/black#50,
VFx0e,r7/p1R5/1p1r1pkp/8/5PP1/P2p3P/1P1N4/6K1 b - - 0 29,a7a5 f4f5 g6g5 c7c4 h6h5 d2e4 g5f4 e4d6,2851,99,92,1694,advantage discoveredAttack endgame fork quietMove veryLong,https://lichess.org/Ru7JQUPG/black#58,
VGA38,r2qk1nr/pp2pp1p/2n3p1/3N2B1/B7/5Q1P/P1P2PP1/b4RK1 b kq - 0 13,g8f6 a4c6 b7c6 d5e7 d8e7 f3c6 e8f8 g5h6 f8g8 c6a8,2834,110,86,1060,crushing discoveredAttack fork middlegame veryLong,https://lichess.org/b8PCA5ur/black#26,Modern_Defense Modern_Defense_Other_variations
VGX1m,8/pp4pk/7p/3Np1r1/PPPp4/3P3r/4Q2n/5R1K w - - 0 38,e2e4 g5g6 e4f5 h3h4 f5f2 h2f3 f2h4 f3h4,2865,102,91,508,advantage defensiveMove discoveredAttack endgame exposedKing quietMove veryLong,https://lichess.org/DNBddNcC#75,
VKe3E,6r1/5q1k/1p2R1p1/2p5/3p2Pn/1Q3P1P/PPP5/5RK1 w - - 4 34,f1e1 h4f3 g1f2 f3e1 f2e1 c5c4 b3c4 g8e8 e6e8 f7c4,2847,114,89,1086,crushing discoveredAttack endgame exposedKing fork pin veryLong,https://lichess.org/HYUN8Y67#67,
VUG7q,2r1k2r/1p1q2p1/p4p2/3pp3/8/5NQ1/1B3P1p/4R2K b k - 1 33,g7g5 f3e5 d7h3 e5c4,2898,107,91,1716,advantage discoveredAttack middlegame short,https://lichess.org/gj6ll1ND/black#66,
VVtWH,6k1/r4rNn/2p2pR1/4pP2/3pP1QP/6R1/2q3PK/q7 b - - 1 34,h7g5 g7e6 f7g7 e6g7 c2d1 g7e6 g8h8 g6h6 a7h7 h6h7 h8h7 g4d1 a1d1 h4g5 f6g5 f5f6 h7g6 g3f3 d1f3 g2f3,2844,110,85,299,crushing discoveredAttack exposedKing middlegame quietMove veryLong,https://lichess.org/FnW6K5cm/black#68,
VZ8U2,1r1r1bk1/1p1b1pp1/p6p/4PN2/qP2Q3/P3B3/6PP/R4RK1 b - - 0 24,a6a5 f5h6 g7h6 f1f7 g8f7 e4h7,2826,105,82,190,attraction crushing discoveredAttack kingsideAttack long middlegame sacrifice,https://lichess.org/vFAvEgPp/black#48,
VmF7g,r2q1r1k/p4p1P/1p5Q/2pnb2N/1n1pN1P1/3P1B2/bPP2P2/2K1R2R b - - 8 24,d8d7 e4f6 e5f6 f3d5 b4d5 g4g5 f8e8 e1e8 d7e8 g5f6,2800,110,78,458,advantage discoveredAttack exposedKing kingsideAttack master middlegame sacrifice veryLong,https://lichess.org/Rh9Caihx/black#48,
VpdEy,6k1/p1r2pp1/2P4p/5P2/8/q6P/2Q3P1/3R2K1 b - - 0 35,a3a6 d1d8 g8h7 f5f6 g7g6 c2c1 c7c8 d8c8,2802,101,91,949,crushing discoveredAttack endgame veryLong,https://lichess.org/cboPPYbz/black#70,
W3Lzb,r5k1/4ppb1/2p3p1/2pq4/3Pn1P1/1p3Q1P/PBPP4/2KR3R w - - 0 24,c2b3 a8a2 h1e1 a2b2 c1b2 d5d4 b2c2 d4b2 c2d3 e4g3 d1c1 b2b3 c1c3 c5c4 d3e3 g7c3 e3f2 c3d2 e1e7 b3f3,2822,103,81,426,advantage attraction capturingDefender discoveredAttack middlegame queensideAttack quietMove veryLong,https://lichess.org/fs2BVUE3#47,
W3wyp,1q6/1k6/2p1p2p/1pP1PnQ1/pP1p4/Pn6/1K3P2/6RR w - - 0 39,h1h6 b8e5 g5h5 d4d3 b2a2 e5f4,2873,104,91,1046,crushing discoveredAttack endgame long,https://lichess.org/uTPqj0zO#77,
W4wIH,1k3r2/ppp3Qp/1q4p1/1B6/5r2/2NP3P/PPP4P/4RRK1 w - - 1 21,g1g2 f4f2 g2g3 f2f1 e1f1 b6e3 g3g4 h7h5 g4h4 f8f4 h4g5 f4f1,2884,117,90,1510,crushing deflection discoveredAttack middlegame veryLong,https://lichess.org/8hg71w0r#41,
WGMHu,r2kr3/p2pb2Q/1p1q4/2pb4/2B5/5P2/PPP4P/2KRR3 w - - 0 19,c4d5 e7g5 f3f4 e8e1 d1e1 g5f4 c1b1 d6d5 h7h4 f4g5,2824,101,79,172,advantage discoveredAttack middlegame veryLong,https://lichess.org/RlsZGXQ7#37,Sicilian_Defense Sicilian_Defense_Smith-Morra_Gambit
WSAEV,r1bq1r1k/1pp3pB/2n1p3/p2P4/2p5/P1B2N2/1PQ3PP/2K4R b - - 0 16,e6d5 c3g7 h8g7 c2g6 g7h8 g6h6 d8e7 h7e4 h8g8 e4d5,2886,95,92,1030,attraction clearance crushing discoveredAttack kingsideAttack middlegame sacrifice veryLong,https://lichess.org/LqNUhYdr/black#32,Dutch_Defense Dutch_Defense_Bellon_Gambit
WWdgZ,7R/3k1p2/6pp/1pBr4/1Pp2q2/2P5/2Q3PP/6K1 w - - 0 27,c5b6 f4e5 h8d8 d7e7 c2c1 d5d8 b6d8 e7d8,2893,100,88,162,advantage defensiveMove discoveredAttack endgame master veryLong,https://lichess.org/ea7OuouR#53,
WncHv,1k2r2r/1pp5/p6p/P4Q2/2qp4/1Nb5/5PPP/1R3RK1 b - - 4 25,e8e6 b3c5 e6c6 b1b7 b8a8 f5f3 h8e8 f1b1 c4c5 b7c7 e8e6 c7c8 a8a7 f3f7 c5e7 f7e7 e6e7 c8c6,2884,110,90,1050,crushing discoveredAttack middlegame pin queensideAttack quietMove veryLong,https://lichess.org/Az10gO8S/black#50,
Ws0qM,8/4q2k/1p3p1P/3Q4/2P2P1K/p7/6P1/8 w - - 2 52,d5d3 f6f5 h4h3 a3a2 d3c3 e7f8,2848,97,83,234,advancedPawn crushing discoveredAttack endgame long queenEndgame,https://lichess.org/GDA771LW#103,
Wxazk,1Q6/4rpkp/3p1bpq/R3pb2/3P1P2/1BP3P1/1P5P/1N2K1NR w K - 0 23,b1a3 e5f4 e1d1 h6h5 d1c1 f4g3,2811,125,91,1575,crushing discoveredAttack exposedKing long middlegame,https://lichess.org/mZpVJTdY#45,
XAzwZ,r1b1rk2/ppq5/1nnbp1Q1/3p2N1/2pP1P2/2P1P1B1/PP4PP/R3K2R b KQ - 4 17,e8e7 f4f5 e7g7 g3d6 c7d6 g6h6,2814,96,91,1103,crushing discoveredAttack exposedKing long middlegame,https://lichess.org/UBCQbxzg/black#34,Queens_Pawn_Game Queens_Pawn_Game_London_System
XSyId,4rr2/6pk/5q1p/3b4/QP1p4/P4PP1/1BP1p1P1/R3R1K1 w - - 2 25,b4b5 f6g5 a4d4 f8f3,2820,100,91,1510,crushing discoveredAttack middlegame short,https://lichess.org/6zfYIloW#49,
XUcg4,3r1rk1/pQ3ppp/2pb3q/4n3/1P6/P1N1P1P1/1B3P1P/R4RK1 w - - 0 18,c3e4 e5g4 h2h4 d6g3 e4g3 h6h4 g1g2 d8d2,2855,110,90,1291,capturingDefender crushing discoveredAttack middlegame veryLong,https://lichess.org/9jl7OZhb#35,Queens_Pawn_Game Queens_Pawn_Game_Colle_System
XqgOw,r3r1k1/p2b2bp/3p1nN1/2pP2B1/1nP3P1/1p1B1P2/1P1Q4/qNK1R2R b - - 2 21,f6g4 g6e7 g8f8 d3h7 g7b2 c1d1,2866,94,92,504,crushing deflection discoveredAttack long middlegame,https://lichess.org/ru9Lt7E9/black#42,
Xt2nL,r6k/P6p/8/4p1N1/2pq2p1/R7/5R2/6K1 b - - 0 50,g4g3 g5f7 h8g8 a3g3 g8f8 f7h6 f8e7 h6f5 e7e6 f5d4,2874,105,94,478,advantage discoveredAttack endgame fork master veryLong,https://lichess.org/j2Ktuvri/black#100,
XyPRE,5r2/1q4k1/3p1p2/2p2Pp1/1pPpPbP1/3P4/R1P2QB1/5K2 b - - 2 43,f8a8 e4e5 a8a2 g2b7 b4b3 f2e1 f4e5 c2b3,2889,109,83,309,crushing discoveredAttack endgame quietMove veryLong,https://lichess.org/Lp2cdXCQ/black#86,
