PuzzleId,FEN,Moves,Rating,RatingDeviation,Popularity,NbPlays,Themes,GameUrl,OpeningTags
43cp9,r7/2nr3p/2p2p2/p2p1p2/1p1P1k2/1PP2RR1/P4P1P/1K2Nb2 b - - 3 30,f4e4 f3e3 e4f4 e3e2 f1e2 e1g2 f4e4 g3e3,2831,97,93,3081,mate mateIn4 middlegame quietMove sacrifice veryLong,https://lichess.org/8nV2M5ya/black#60,
LHW7k,1r1K2k1/p4p2/5Qp1/1q2P1Np/7P/8/5P2/3R3R w - - 7 35,d8e7 b8b7 e7d8 b7d7 d1d7 b5b8 d8e7 b8f8,2822,95,93,1487,clearance endgame mate mateIn4 sacrifice veryLong,https://lichess.org/fwlVJ52A#69,
WIUn2,3rr1k1/1R3ppp/p2P4/2p3P1/n1P2P2/2qB1Q2/5RKP/8 b - - 0 33,d8d6 f3e4 e8e4 b7b8 d6d8 b8d8 e4e8 d8e8,2862,104,93,1578,master mate mateIn4 middlegame sacrifice veryLong,https://lichess.org/OQbwz5Wx/black#66,
j7srG,8/6pk/8/1Q4Kp/1Pp3nP/2B1q1P1/1P1N4/8 w - - 5 39,g5h5 g4f6 c3f6 e3g3 b5f5 g7g6 f5g6 g3g6,2843,107,90,3116,endgame fork mate mateIn4 sacrifice veryLong,https://lichess.org/Z2bN0u23#77,
l7u9R,6k1/p1p5/1p2p3/2nr2p1/3B1rQ1/5R2/P1P3P1/5RK1 b - - 0 27,f4g4 f3f8 g8h7 f8f7 h7g6 f1f6 g6h5 f7h7,2884,99,92,1989,endgame exposedKing mate mateIn4 veryLong,https://lichess.org/jQilDF2D/black#54,
pEpjL,1R1r3k/Q4Ppp/8/8/5P2/4BK1q/P7/8 w - - 4 39,f3e4 h3h1 e4f5 h1h5 f5e6 h5d5 e6e7 d5d6,2807,106,90,1455,endgame mate mateIn4 veryLong,https://lichess.org/LVU7WkHd#77,
rpsSL,r3k2r/pp3pp1/2nqp3/5b1p/2B3n1/P1NP2KP/1PP1N1P1/R1BQ3R w kq - 1 12,c1f4 h5h4 g3f3 d6d4 h3g4 c6e5 f4e5 f5g4,2864,101,84,1010,intermezzo mate mateIn4 middlegame sacrifice veryLong,https://lichess.org/wihCPcKK#23,Alekhine_Defense Alekhine_Defense_Scandinavian_Variation
tQBPV,r2q4/bppr3k/p6p/2P4b/PP2N2N/1Q1n4/5RP1/3R2K1 b - - 0 24,h5d1 f2f7 h7g8 f7e7 d1b3 e4f6 g8h8 h4g6,2842,108,88,559,discoveredAttack fork mate mateIn4 middlegame sacrifice veryLong,https://lichess.org/nf5V27xJ/black#48,
zvTgC,4rrk1/pp1N2pp/8/2b5/4p3/P1N2p1P/1PnP1Pq1/R1BQKR2 w Q - 0 25,d1c2 c5f2 f1f2 g2h1 f2f1 f3f2 e1d1 h1f1,2800,114,91,1132,advancedPawn attackingF2F7 deflection mate mateIn4 middlegame sacrifice veryLong,https://lichess.org/iW5tHhjo#49,
