PuzzleId,FEN,Moves,Rating,RatingDeviation,Popularity,NbPlays,Themes,GameUrl,OpeningTags
aKKoj,4r1k1/ppR2ppp/8/8/1n6/8/PP3PPP/3Rr1K1 w - - 1 19,d1e1 e8e1,607,92,78,136,backRankMate endgame master mate mateIn1 oneMove,https://lichess.org/feBc5qic#37,
8XuDS,k7/P7/1K4p1/3N4/5P2/8/7p/8 b - - 1 56,h2h1q d5c7,654,105,93,557,endgame master mate mateIn1 oneMove,https://lichess.org/tHnQd7Ex/black#112,
vpPcI,8/8/7p/4k3/4P3/4K3/1r1N4/8 b - - 2 50,h6h5 d2c4 e5f6 c4b2,678,87,92,518,crushing endgame fork master short,https://lichess.org/D9r3va4G/black#100,
l9OAL,7K/8/7P/4k3/4b3/8/8/8 b - - 2 63,e4h7 h8h7 e5f6 h7g8,691,89,100,298,endgame master,https://lichess.org/ufT3ihrq/black#126,
KIacl,8/6k1/2p5/2Pp2PB/b2PrN2/6P1/8/6K1 b - - 2 46,e4d4 f4e6 g7h8 e6d4,656,97,92,572,crushing endgame fork master masterVsMaster short,https://lichess.org/zMzov8L0/black#92,
RbZHk,8/1N1k4/p2P2p1/2p3Kp/2b5/P6P/6P1/8 b - - 4 45,c4d3 b7c5 d7d6 c5d3,635,84,86,272,crushing endgame fork master short,https://lichess.org/1i3Tyzmg/black#90,
Tt2IR,3r4/kq4p1/p3R2p/8/1rpp3P/Q5P1/1PP5/2KR4 w - - 0 39,e6a6 b7a6 a3a6 a7a6,617,96,91,102,crushing endgame master masterVsMaster short,https://lichess.org/2XTjN3Lq#77,
TqCga,2rR1b2/2P4p/4kNp1/4p3/4P2P/5K2/8/8 w - - 12 53,d8f8 c8f8 c7c8q f8c8,684,79,97,1063,crushing endgame hangingPiece master masterVsMaster pin short,https://lichess.org/nSBG8ex3#105,
kNa3g,7Q/kpp5/p4p2/8/8/4q1NQ/P5PK/4r3 w - - 1 40,h8f6 e3g1,664,82,85,173,endgame master masterVsMaster mate mateIn1 oneMove,https://lichess.org/PKFGyXvA#79,
a2DTy,2rkr3/6q1/3pp3/p2n4/4bP2/Q7/1PP2R1P/5K2 b - - 1 39,g7d4 a3d6,616,79,97,592,master masterVsMaster mate mateIn1 middlegame oneMove,https://lichess.org/pAiX9qKZ/black#78,
bhjZe,2r2k2/5pp1/4p3/p2p4/5PNQ/7P/1n1q2P1/6RK b - - 4 45,b2d3 h4h8 f8e7 h8c8,659,96,96,529,crushing endgame master masterVsMaster short skewer,https://lichess.org/7rZqNTsa/black#90,
OIKbW,r1b2rk1/5pp1/4p2n/3pP1N1/2p2qP1/5N1P/P1Q5/R2R3K b - - 0 26,a8a3 c2h7,685,96,84,470,master masterVsMaster mate mateIn1 middlegame oneMove,https://lichess.org/uj5YCTKf/black#52,
vNar4,4r1k1/7p/p5p1/1p3pN1/b1nR3P/P1B3P1/8/6K1 b - - 0 35,e8e3 d4d8 e3e8 d8e8,676,89,68,105,endgame master masterVsMaster mate mateIn2 short,https://lichess.org/3WoTA2ky/black#70,
n9UGZ,8/2rBkp2/3Rp1p1/7p/7P/3K2P1/5P2/8 w - - 0 45,d6d4 c7d7 d4d7 e7d7,699,78,100,812,crushing endgame master masterVsMaster short,https://lichess.org/4s9G8f3U#89,
tyMaj,1n2r1k1/4q1b1/pp1p2Q1/2pp2p1/P7/2N4P/1P3PPB/3R2K1 w - - 0 23,c3d5 e7e1 d1e1 e8e1,659,98,67,172,backRankMate master masterVsMaster mate mateIn2 middlegame sacrifice short,https://lichess.org/s8jYms30#45,
7pAGk,5Qk1/r1n2ppp/1p5q/8/5P2/1P4PP/2P3BK/3RR3 b - - 0 29,g8f8 d1d8 c7e8 e1e8,689,76,98,727,endgame master masterVsMaster mate mateIn2 short,https://lichess.org/xvQEyRKd/black#58,
ckUP6,R7/8/8/8/8/5K2/6p1/5k2 b - - 1 78,g2g1q a8a1,653,84,73,176,endgame master masterVsMaster mate mateIn1 oneMove queenRookEndgame,https://lichess.org/xc0tiaAa/black#156,
KYrjT,4b3/5pk1/4p2p/2n3p1/P3P3/5P2/1R3KPP/8 w - - 1 40,a4a5 c5d3 f2e3 d3b2,672,93,78,187,advantage endgame fork master masterVsMaster short,https://lichess.org/t90aoW2J#79,
AGCbG,2r3k1/5p1p/6p1/8/3B4/1P2Pp2/1P3PPP/5qK1 w - - 0 28,g1f1 c8c1,640,88,80,210,endgame master masterVsMaster mate mateIn1 oneMove,https://lichess.org/a0LDHrA9#55,
u8X29,5k2/8/1r6/2K3Np/1p5P/1P4P1/8/8 b - - 1 55,b6f6 g5h7 f8f7 h7f6,668,80,86,268,crushing endgame fork master masterVsMaster short,https://lichess.org/1QXDtXPc/black#110,
geLow,8/1p2r1k1/4b3/2P1N3/3PpK2/7p/8/6R1 b - - 3 51,g7f6 g1g6,681,79,97,1124,endgame hookMate master masterVsMaster mate mateIn1 oneMove,https://lichess.org/AqER4j7C/black#102,
wbtro,8/2kbRN2/p2p4/2pP1P2/2r5/8/6PK/8 w - - 0 44,f7h6 c4h4 h2g3 h4h6,681,97,94,280,crushing endgame fork master masterVsMaster short,https://lichess.org/3AxojYH4#87,
VTNt0,r2qk2r/1pp2ppp/2b1pb2/p3N2Q/P3n3/1P6/1BPP1PPP/2KR1B1R b kq - 6 14,e4f2 h5f7,668,96,90,1339,attackingF2F7 master masterVsMaster mate mateIn1 oneMove opening,https://lichess.org/z1prmh07/black#28,French_Defense French_Defense_Horwitz_Attack
IE054,8/2r2nkp/p1P2pp1/1pNBp3/1P4P1/P3P3/7P/6K1 b - - 0 35,f7d6 c5e6 g7g8 e6c7,621,86,97,357,crushing discoveredAttack endgame fork master masterVsMaster short,https://lichess.org/4BB5aLMN/black#70,
maOaw,5k2/2q2p2/4p3/8/1p5R/1P3BPP/7K/8 b - - 0 57,c7b8 h4h8 f8e7 h8b8,623,105,75,532,crushing endgame master masterVsMaster short skewer,https://lichess.org/6cSrqd9C/black#114,
mSiLs,3r1r1k/7p/p6p/P1Q2p2/3b1q2/1P1P2NR/5PPP/4RK2 w - - 1 35,c5c6 f4f2,640,79,78,121,master masterVsMaster mate mateIn1 middlegame oneMove,https://lichess.org/3C01Ak5G#69,
LBMMu,6k1/5p2/p3p1p1/3p2P1/2pB1KP1/2P4r/r7/1R6 b - - 9 37,a6a5 b1b8 g8h7 b8h8,612,97,76,330,endgame mate mateIn2 short,https://lichess.org/twEHqQzC/black#74,
3Weif,r4rk1/1bqnbpp1/p1p1pn2/1p4P1/3P2N1/P3P3/1PQ2PP1/R1B1K2R b KQ - 0 18,f6g4 c2h7,602,85,100,210,mate mateIn1 middlegame oneMove,https://lichess.org/3ojmcyOX/black#36,Reti_Opening Reti_Opening_Other_variations
uUwjz,5k2/R7/7R/p7/n7/4r1r1/7K/8 b - - 1 49,g3f3 h6h8,665,79,81,279,endgame mate mateIn1 oneMove,https://lichess.org/SbEwtIRA/black#98,
jqb2O,3k1r2/p2n4/b2bR1Q1/3P4/1p5p/1B5P/PP4P1/2R2q1K w - - 2 28,c1f1 f8f1,637,84,100,70,mate mateIn1 middlegame oneMove,https://lichess.org/KDt6KuuX#55,
Tgtds,2kr1b1r/ppqbpp2/2n5/7p/P5np/2NP2P1/1PP1NPB1/R1BQ1RK1 w - - 0 12,g3h4 c7h2,684,82,100,116,mate mateIn1 oneMove opening,https://lichess.org/gmIE2weN#23,Scandinavian_Defense Scandinavian_Defense_Blackburne_Gambit
QvnNs,5Q2/pb3B1p/6p1/2r4k/8/4P3/2q2PPP/1R4K1 w - - 3 31,b1a1 c2c1 a1c1 c5c1,627,97,93,339,endgame mate mateIn2 sacrifice short,https://lichess.org/CJwyxf0e#61,
wJngV,r2qk2r/p1p1bp1p/1pp2np1/4P3/2B3b1/5Q2/PPP2PPP/RNB1K2R w KQkq - 1 10,f3f4 d8d1,621,84,58,67,mate mateIn1 oneMove opening,https://lichess.org/XvDY4iY2#19,Scotch_Game Scotch_Game_Benima_Defense
LjCLK,n3Nk2/3r1p1p/p4npB/2pP4/2Pq4/PP4PP/4QPK1/8 b - - 6 35,f8g8 e8f6 d4f6 e2e8,623,87,100,198,clearance kingsideAttack mate mateIn2 middlegame short,https://lichess.org/KatAKYDX/black#70,
qKCy5,K3q3/1Pk5/P7/8/8/8/8/8 w - - 1 53,b7b8q e8b8,654,99,89,708,endgame master masterVsMaster mate mateIn1 oneMove queenEndgame,https://lichess.org/oIlEDXrV#105,
Edvjs,rn2k2r/ppp2ppp/3bp3/7q/4P3/5b2/PPP1BPPP/R1BQ1RK1 w kq - 0 10,e2f3 h5h2,678,106,92,152,kingsideAttack mate mateIn1 middlegame oneMove,https://lichess.org/ae8VKtlw#19,Scandinavian_Defense Scandinavian_Defense_Modern_Variation
Wcs9n,6k1/2Rb1ppp/3Pp3/p2qP3/8/P2p2P1/1B3P1P/K7 b - - 5 39,d7a4 c7c8 a4e8 c8e8,696,97,87,773,backRankMate endgame mate mateIn2 short,https://lichess.org/TfhisqRL/black#78,
mFpqU,4r2k/pppq2pp/6r1/8/4P3/B7/P6P/5Q1K b - - 0 33,e8e4 f1f8,614,93,83,877,endgame mate mateIn1 oneMove,https://lichess.org/BqcG1HzT/black#66,
uCZbD,r4rk1/2p2pbp/1pb1pnp1/3q4/8/N2B4/PPP1QPPP/R1B2RK1 w - - 2 16,d3c4 d5g2,669,93,93,337,kingsideAttack mate mateIn1 middlegame oneMove,https://lichess.org/7GyYSiZB#31,Pirc_Defense Pirc_Defense_Other_variations
xtRJP,1r3rk1/p5pn/6Rp/8/3N2Q1/1P6/5qPP/2R3K1 w - - 0 28,g1h1 f2f1 c1f1 f8f1,610,100,78,323,backRankMate mate mateIn2 middlegame sacrifice short,https://lichess.org/2lrs1yUa#55,
7OTH7,3r1rk1/p3npbp/2p1p1p1/q1p1P3/2PpNP2/3P1R2/PPQ3PP/1RB4K w - - 5 19,a2a3 a5e1 f3f1 e1f1,682,101,79,121,kingsideAttack mate mateIn2 middlegame short,https://lichess.org/yOJwggPB#37,Sicilian_Defense Sicilian_Defense_McDonnell_Attack
MSjtZ,3r3k/6bp/p4p2/4pP2/1P4p1/P7/R4PPP/4R1K1 w - - 0 39,e1e2 d8d1 e2e1 d1e1,635,101,87,34,backRankMate endgame mate mateIn2 short,https://lichess.org/CqlP7qwD#77,
Zvotg,B3r1k1/p4ppp/8/8/1P6/P1q3P1/5Q2/5RK1 b - - 0 23,e8a8 f2f7 g8h8 f7f8 a8f8 f1f8,665,93,81,546,backRankMate endgame long mate mateIn3 sacrifice,https://lichess.org/mgceSiLk/black#46,
tb1c4,8/2B3k1/5p2/p1P5/1pB3bp/1P2r3/1PPR2PP/3K4 w - - 0 35,d1c1 e3e1 d2d1 e1d1,635,101,67,119,endgame mate mateIn2 short,https://lichess.org/4vQMZM2x#69,
oi5nr,1r2Rk2/3P1pb1/p4pp1/2p5/B7/1p3P2/8/2K5 b - - 1 35,b8e8 d7e8q,644,80,94,219,advancedPawn endgame mate mateIn1 oneMove promotion,https://lichess.org/4Ux3Tc7K/black#70,
khOx5,3r1rk1/ppq1bppp/2p1pB2/8/3P3Q/2PB3P/PP3PP1/R3K2R b KQ - 0 15,e7f6 h4h7,652,82,100,134,kingsideAttack mate mateIn1 middlegame oneMove,https://lichess.org/ykV5PIsv/black#30,Caro-Kann_Defense Caro-Kann_Defense_Two_Knights_Attack
1ndDz,r4rk1/ppqn1ppp/2p5/3p4/1PPP4/P2QP1P1/1B1N1P1b/R3K2R b KQ - 0 15,h2g3 d3h7,638,80,100,118,kingsideAttack mate mateIn1 middlegame oneMove,https://lichess.org/hivABYIL/black#30,Polish_Opening Polish_Opening_Other_variations
VUCAU,2kr3r/ppp2ppp/3bpn2/4q3/6B1/2N5/PPPB1PPP/R2Q1RK1 w - - 1 12,g4f3 e5h2,607,82,99,881,kingsideAttack mate mateIn1 middlegame oneMove,https://lichess.org/JcQA92MA#23,Scandinavian_Defense Scandinavian_Defense_Main_Line
LjwR0,r1b1r1kb/2qnpp1p/2pp2pB/p7/N1B1PQ2/2P5/PP3PPP/R3R1K1 b - - 5 16,c8a6 c4f7,610,85,85,61,kingsideAttack mate mateIn1 middlegame oneMove,https://lichess.org/4JFd3UQM/black#32,Sicilian_Defense Sicilian_Defense_Open
7PLyP,r1b2k1r/p3ppb1/2p2n2/2Nq4/3PN1P1/4B2p/PP4PP/R2Q1RK1 w - - 1 18,e4f6 d5g2,695,82,100,567,kingsideAttack mate mateIn1 middlegame oneMove,https://lichess.org/jHD65mtk#35,Sicilian_Defense Sicilian_Defense_Delayed_Alapin_Variation
5Bwk6,5r1k/ppp3pp/8/3QP3/4B3/PP5q/2P4P/R4r1K w - - 6 27,a1f1 h3f1,621,96,78,537,endgame mate mateIn1 oneMove,https://lichess.org/6MlCOr0b#53,
dymQw,r2q1rk1/p4ppp/1p6/4Q3/1bP5/4PP2/5P1P/R3KB1R w KQ - 0 18,e1e2 d8d2,662,97,85,149,mate mateIn1 middlegame oneMove,https://lichess.org/lAQXXtAN#35,Indian_Defense Indian_Defense_London_System
QHslj,1b1rr1k1/1p2qpp1/p3b2p/3p4/1P1QN3/P3P1PP/1B3PBK/2R2R2 b - - 0 19,d5e4 d4g7,617,99,96,189,kingsideAttack mate mateIn1 middlegame oneMove,https://lichess.org/tCTF5yfX/black#38,
36OaY,r1b3r1/1pp2Q2/p1k1p3/2npP1q1/8/2P1P3/PP1N1PPP/R4RK1 w - - 7 17,d2f3 g5g2,670,92,80,112,kingsideAttack mate mateIn1 middlegame oneMove,https://lichess.org/BlNgXM0o#33,Queens_Pawn_Game Queens_Pawn_Game_Accelerated_London_System
zZcc5,5rk1/pp4p1/2nb3p/7P/3Pp3/2P5/PP1BQ1P1/3RNq1K w - - 0 28,e2f1 f8f1,631,85,76,61,kingsideAttack mate mateIn1 middlegame oneMove,https://lichess.org/TTgM7nNz#55,
nOxn6,r5k1/p2nrp2/1p1b3Q/2p3N1/1P6/7P/P4PP1/2R1q1K1 w - - 0 24,c1e1 e7e1,669,93,70,239,mate mateIn1 middlegame oneMove,https://lichess.org/56B518y7#47,
CIWcV,5k2/1p3p1p/pr2Nn2/1P1p4/3P4/Q3P3/6qP/4K3 b - - 0 32,f8g8 a3f8,619,86,100,57,endgame mate mateIn1 oneMove,https://lichess.org/sYUZy3nc/black#64,
MO5NQ,6rk/3R4/2p5/4p2K/3bBp2/8/8/8 b - - 3 42,d4e3 d7h7,666,78,96,145,endgame mate mateIn1 oneMove,https://lichess.org/55OV1zZq/black#84,
EjVTr,1r4k1/1b2pp1p/4n1p1/QPP5/3pq3/4B3/P4PPP/R4RK1 w - - 0 23,e3h6 e4g2,618,85,68,63,kingsideAttack mate mateIn1 middlegame oneMove,https://lichess.org/liIlxl4r#45,
JzYjJ,8/6pp/3N1p2/3R4/8/2P2P2/5rPP/4k1K1 w - - 1 32,d6e4 f2f1,610,85,100,51,endgame mate mateIn1 oneMove,https://lichess.org/gPnpfM5h#63,
MdfEt,8/p5r1/1p2R1k1/4P1p1/PP1P3p/5PnP/6K1/8 b - - 0 48,g6f5 e6f6,684,98,83,148,endgame mate mateIn1 oneMove,https://lichess.org/IUi7X2vS/black#96,
Uib2k,r2k1b1r/pp3ppp/2p1p3/4Pb2/1nP5/N7/PP1B1PPP/R3KB1R w KQ - 0 11,e1c1 b4a2,636,79,98,1416,mate mateIn1 middlegame oneMove queensideAttack,https://lichess.org/Bjcj46gm#21,Sicilian_Defense Sicilian_Defense_Morphy_Gambit
2QzkQ,r4rk1/1b1p2pp/pp2p1q1/4Pp2/2P2n2/P1NBbP2/1B1Q2PP/R4R1K w - - 0 18,d2e3 g6g2,601,97,84,254,kingsideAttack mate mateIn1 middlegame oneMove,https://lichess.org/fmmBO2NI#35,Dutch_Defense Dutch_Defense_Queens_Knight_Variation
ZlhSH,4rrk1/pb4bp/1p3qp1/2ppn1N1/8/P1PP3Q/1P3PP1/RNB2RK1 b - - 5 18,b7a6 h3h7,666,85,83,235,kingsideAttack mate mateIn1 middlegame oneMove,https://lichess.org/hTtFWzdM/black#36,Sicilian_Defense Sicilian_Defense_Bowdler_Attack
Gx5cK,rnb1k1r1/ppp2p1p/3p3n/2b1N1q1/2B1P1p1/3P2B1/PPP1K1PP/RN1Q1R2 w q - 2 12,e5f7 g5e3,669,80,100,111,mate mateIn1 oneMove opening,https://lichess.org/8kfCcIAM#23,Kings_Gambit_Accepted Kings_Gambit_Accepted_Salvio_Gambit
R0RzF,1Q6/2p3kp/6p1/p2P1p2/1pR5/1P5q/1r2r1P1/6RK w - - 0 42,g2h3 e2h2,625,94,85,1025,endgame mate mateIn1 oneMove queenRookEndgame,https://lichess.org/RHPV7wWY#83,
ZY772,7k/1q6/p1n3Qp/5B2/4P3/6b1/P5P1/2R4K w - - 1 33,c1c6 b7b1 c6c1 b1c1,646,80,100,317,endgame mate mateIn2 short,https://lichess.org/JsgcH0Ct#65,
U8Vdg,1r4k1/1p1q3p/p2p1nbB/2pp4/2PbP1P1/3B1Q2/PP5P/5R1K b - - 5 27,f6g4 f3f8 b8f8 f1f8,683,106,92,1049,kingsideAttack mate mateIn2 middlegame sacrifice short,https://lichess.org/BHL3NDt4/black#54,
y7GDG,2r4k/pb4pp/5r2/5p2/PPQ1pP2/8/4n1PP/3R1R1K b - - 0 30,c8c4 d1d8 f6f8 d8f8,625,100,100,34,backRankMate endgame mate mateIn2 short,https://lichess.org/AUKxYHlp/black#60,
y36Uf,r3r1k1/ppp1qppp/5N2/8/5n2/2P5/PP2Q2P/4R1RK b - - 1 29,e7f6 e2e8 a8e8 e1e8,677,96,68,185,mate mateIn2 middlegame short,https://lichess.org/eLETb1WO/black#58,
H1xK2,5rk1/p2Q1p1p/2p1p1p1/6q1/2N5/1P6/2P2PPP/R5K1 w - - 0 22,a1a7 g5c1 d7d1 c1d1,693,92,92,273,backRankMate endgame mate mateIn2 short,https://lichess.org/ojQi3XVI#43,
cfXbM,r5k1/5pp1/4p2p/3n4/8/1R1QP1P1/5PKP/2q5 b - - 6 34,a8a1 b3b8 c1c8 b8c8,607,106,83,132,endgame mate mateIn2 short,https://lichess.org/QkuWCnbV/black#68,
6RU1P,2k1rr2/p1p5/P1p5/3b1Npp/1R6/6P1/1PP2RPP/6K1 w - - 4 27,f5g7 e8e1 f2f1 e1f1,680,88,94,556,endgame mate mateIn2 short,https://lichess.org/IJkFEe7x#53,
XW9Rn,2r4k/p4p2/1p3Nqp/7R/8/5Q2/PPP2PP1/1K6 w - - 2 29,g2g4 g6c2 b1a1 c2c1,626,81,98,335,endgame mate mateIn2 short,https://lichess.org/Rc71fv8t#57,
jYyET,8/3p3k/1r3p1p/4B1p1/3R4/4P2P/5PP1/6K1 w - - 0 36,e5h2 b6b1 d4d1 b1d1,624,85,73,123,backRankMate endgame mate mateIn2 short,https://lichess.org/RSOaTu15#71,
HRpyj,4rR1k/6p1/1p2r1Pp/p1b1P3/2Pp1Q1N/3P4/2q5/5RK1 b - - 3 41,c5f8 f4f8 e8f8 f1f8,623,96,83,186,mate mateIn2 middlegame short,https://lichess.org/oWtJszEt/black#82,
4JjgC,2R5/6k1/p1PN2p1/3p2Pp/4b3/6P1/r4P2/6K1 w - - 1 40,c6c7 a2a1 g1h2 a1h1,606,85,99,945,endgame master mate mateIn2 short,https://lichess.org/W9kN4z2H#79,
Tkzps,6k1/2r2ppp/4p3/R7/Pp1P4/1B3P1P/1Pb3P1/6K1 b - - 0 29,c2b3 a5a8 c7c8 a8c8,642,103,78,84,backRankMate endgame mate mateIn2 short,https://lichess.org/jpuTaMm7/black#58,
6YWUO,5r2/ppp2p2/2p2K1k/4P3/1P4p1/2P3P1/P6r/3R4 b - - 0 28,h2a2 d1h1 a2h2 h1h2,672,106,95,304,endgame mate mateIn2 rookEndgame short,https://lichess.org/Ty1tj7kR/black#56,
hSvuh,1k2r3/pp2r3/2n5/2p3Q1/8/2P2PPP/PP4B1/5nK1 w - - 0 35,g1f1 e7e1 f1f2 e8e2,692,95,94,1649,endgame mate mateIn2 short,https://lichess.org/efguky12#69,
uDAiM,6rk/p5Qp/8/5p2/2P2P2/1P5P/P1q5/3R2RK b - - 0 38,g8g7 d1d8 g7g8 g1g8,691,85,100,332,endgame mate mateIn2 queenRookEndgame short,https://lichess.org/SYLiJ04z/black#76,
CGsO1,5r2/1pk4p/p4rp1/8/3p4/3PnN2/PPP1R1PP/4R1K1 w - - 6 28,f3d4 f6f1 e1f1 f8f1,682,89,88,272,endgame mate mateIn2 short,https://lichess.org/gSGrvK6C#55,
bOEXU,6kr/b2q1ppp/Q7/8/3R1P2/8/PP4PP/7K b - - 0 29,a7d4 a6a8 d7c8 a8c8,669,99,75,215,backRankMate endgame mate mateIn2 short,https://lichess.org/9RopwJyX/black#58,
cwO6x,k2r4/pp3p2/8/1PPQ3n/3p3p/P4P2/5P2/6RK b - - 1 32,d8d5 g1g8 d5d8 g8d8,693,107,77,405,backRankMate endgame mate mateIn2 short,https://lichess.org/16QtNm7t/black#64,
mYthU,4r3/6kp/2p2p2/ppNb2p1/8/PP4PP/B2b1P2/3R2K1 w - - 1 30,d1d2 e8e1 g1h2 e1h1,663,86,93,272,endgame mate mateIn2 short,https://lichess.org/SKJXzLjb#59,
lBSuN,4r2k/2R3pp/2p2p2/3p4/8/2P3P1/5PP1/6K1 b - - 1 32,e8e6 c7c8 e6e8 c8e8,659,113,76,218,backRankMate endgame mate mateIn2 rookEndgame short,https://lichess.org/qyKTeDYv/black#64,
JIjOf,r5k1/p1p2ppp/2p5/8/8/5Q2/Pq4PP/5R1K b - - 1 22,a8b8 f3f7 g8h8 f7f8 b8f8 f1f8,677,95,96,385,backRankMate endgame long mate mateIn3 sacrifice,https://lichess.org/gTBqkTzq/black#44,
WZrel,3r2k1/p3pp1p/2q3p1/8/5P2/2BQ2PP/P6b/1R3K2 b - - 0 31,d8d3 b1b8 d3d8 b8d8 c6e8 d8e8,636,82,97,272,endgame long mate mateIn3,https://lichess.org/8GnA8Zf3/black#62,
GLcMg,4r1k1/4q1p1/2p3Pp/p1Pp1Q1P/1p6/8/PPP1r3/1K1R3R w - - 0 32,d1f1 e2e1 f1e1 e7e1 h1e1 e8e1,672,98,79,445,backRankMate endgame long mate mateIn3 sacrifice,https://lichess.org/YLfOGTJq#63,
zH4n5,2r3k1/R4pp1/4p2p/3n4/1r2B1P1/5P2/4K2P/2R5 b - - 2 32,c8c1 a7a8 b4b8 a8b8 c1c8 b8c8,668,86,80,211,endgame long mate mateIn3,https://lichess.org/pRUxXkRe/black#64,
lUsNY,5r1k/ppp3p1/2b1p3/4P3/2q2P2/2P5/PBQ3PP/3R2K1 b - - 0 21,f8f4 d1d8 c6e8 d8e8 f4f8 e8f8,668,96,95,1550,endgame long mate mateIn3,https://lichess.org/J75fBukh/black#42,
fuXsC,5Q2/8/1r4p1/2R5/3P2k1/6Pp/5P1P/6K1 w - - 5 43,f8e7 b6b1 c5c1 b1c1 e7e1 c1e1,659,93,69,91,endgame long mate mateIn3 queenRookEndgame,https://lichess.org/3eRRpILm#85,
hDGTm,6k1/5ppp/3r4/R1p5/2P5/1B2r1P1/6K1/8 b - - 0 38,e3b3 a5a8 b3b8 a8b8 d6d8 b8d8,692,111,69,42,backRankMate endgame long mate mateIn3 rookEndgame,https://lichess.org/NEBOkrka/black#76,
ydN3T,6k1/5pp1/2p1bn1p/8/2P5/3B1P1P/2r5/1R4K1 b - - 2 26,c2c3 b1b8 e6c8 b8c8 f6e8 c8e8,625,95,87,404,endgame long mate mateIn3,https://lichess.org/z9ut5VvJ/black#52,
gkJpw,6k1/3n2pp/4P3/1R6/5P2/1pr3P1/r5P1/3K4 b - - 0 37,d7f6 b5b8 c3c8 b8c8 f6e8 c8e8,661,105,80,222,endgame long mate mateIn3,https://lichess.org/QaCUDZq5/black#74,
cLavc,8/pp3rkp/6qB/4p3/4P1p1/3r4/PP3PK1/2R4R b - - 1 31,g7g8 c1c8 d3d8 c8d8 f7f8 d8f8,635,100,79,263,endgame long mate mateIn3,https://lichess.org/D8k2Oeum/black#62,
mwmcC,1k6/1pp3p1/p4r2/4R3/3P2q1/2P5/PP2Q1P1/K7 w - - 7 31,e2g4 f6f1 e5e1 f1e1 g4d1 e1d1,632,105,68,167,backRankMate endgame long mate mateIn3 queenRookEndgame,https://lichess.org/vsgbMSi1#61,
MVEqS,8/q3r1k1/2ppP2p/2b2Pp1/2Qp4/1N4B1/1PP3PP/7K w - - 2 26,b3c5 a7a1 g3e1 a1e1 c4f1 e1f1,642,86,83,105,endgame long mate mateIn3,https://lichess.org/d4gxL02v#51,
fKt4o,3r3k/2p1B1pp/5pb1/3Pq3/8/1Q6/1b4P1/3R3K b - - 5 32,d8d7 b3b8 d7d8 b8d8 g6e8 d8e8,666,77,86,212,backRankMate long mate mateIn3 middlegame,https://lichess.org/2gFJg3vg/black#64,
cPoW9,rr4k1/2p2ppp/4P3/8/5B2/pN3Q2/5PPP/q5K1 w - - 0 26,b3a1 b8b1 f4c1 b1c1 f3d1 c1d1,617,104,78,379,backRankMate endgame fork long mate mateIn3,https://lichess.org/U8s2Utb5#51,
H48c5,2r3k1/1p3ppp/p7/4P3/4q3/5Q2/1P3RK1/1R6 b - - 1 35,e4b1 f3f7 g8h8 f7f8 c8f8 f2f8,694,79,96,790,backRankMate endgame long mate mateIn3 sacrifice,https://lichess.org/Ki7qwW1W/black#70,
YiL8b,r4rk1/pp3Rpp/1q1p4/4p3/4P3/3PPQ2/P5PP/5RK1 b - - 0 16,f8f7 f3f7 g8h8 f7f8 a8f8 f1f8,652,95,76,97,backRankMate endgame long mate mateIn3,https://lichess.org/aaZ59mHW/black#32,Italian_Game Italian_Game_Giuoco_Piano
x3yiL,r6k/4qp1p/3p1p2/1p1bp3/7N/1P2Q3/2P2PPP/3R2K1 w - - 0 26,d1d5 a8a1 d5d1 a1d1 e3e1 d1e1,619,97,77,261,backRankMate endgame long mate mateIn3,https://lichess.org/32mZqWwe#51,
Dtjwd,4r1k1/p2q1ppp/1pn1n3/2pp4/8/2P1Q2P/P3RPP1/4R1K1 b - - 0 25,e6c7 e3e8 c7e8 e2e8 d7e8 e1e8,652,101,85,224,backRankMate long mate mateIn3 middlegame,https://lichess.org/rWOco4rg/black#50,
eOOKl,5k1r/7p/1p2Q1p1/pP5B/P2R4/8/2r2PPP/6K1 w - - 0 33,h5g6 c2c1 d4d1 c1d1 e6e1 d1e1,622,107,81,418,backRankMate endgame long mate mateIn3,https://lichess.org/cR9l9aFa#65,
uFvyY,2q3k1/Rn3p1p/1pN2PpB/6P1/1p6/1P5P/2PK1P2/8 b - - 2 37,c8c6 a7a8 b7d8 a8d8 c6e8 d8e8,639,96,83,397,endgame long mate mateIn3,https://lichess.org/etiIZDzo/black#74,
vaAfE,1r3k2/pr1p1ppp/8/1N2R3/8/2p5/P1R2PPP/6K1 w - - 4 26,b5c3 b7b1 c3b1 b8b1 c2c1 b1c1 e5e1 c1e1,653,94,94,516,backRankMate endgame mate mateIn4 sacrifice veryLong,https://lichess.org/IBscyXfW#51,
nVmOb,1r4k1/p4ppp/5n2/8/1P1q4/P5QP/4p1PK/2rB1R2 b - - 1 31,e2f1q g3b8 c1c8 b8c8 d4d8 c8d8 f6e8 d8e8,693,104,92,897,hangingPiece master mate mateIn4 middlegame veryLong,https://lichess.org/1xEW0Olv/black#62,
1dHYp,6k1/p1p2ppp/2p3n1/5q2/7Q/2P1r3/P1Pr3P/1R4KR b - - 7 25,g6h4 b1b8 f5c8 b8c8 d2d8 c8d8 e3e8 d8e8,610,101,84,224,backRankMate endgame mate mateIn4 veryLong,https://lichess.org/dd6BV18u/black#50,
A0zZW,2r3k1/p2q2pp/3Rp3/4Q3/8/1P3R2/P5PP/7K w - - 1 30,d6d7 c8c1 d7d1 c1d1 e5e1 d1e1 f3f1 e1f1,625,105,41,109,backRankMate endgame mate mateIn4 queenRookEndgame veryLong,https://lichess.org/rSnBUBJw#59,
ZnhqP,r1b1R3/pP3ppk/6qp/3N4/5Bn1/1Q6/PP3PP1/6K1 w - - 1 26,b7a8q g6b1 f4c1 b1c1 b3d1 c1d1 e8e1 d1e1,649,98,80,1543,mate mateIn4 middlegame veryLong,https://lichess.org/BB758eJL#51,
WNZhp,7k/p5pp/3p1b2/4pP1P/8/3N1Q2/q5PK/1r6 b - - 4 31,a2a4 f3a8 b1b8 a8b8 f6d8 b8d8 a4e8 d8e8,616,100,83,233,backRankMate endgame mate mateIn4 veryLong,https://lichess.org/UvBZiseC/black#62,
G9625,8/2R4p/3R2pk/8/8/5N2/r4PPP/6K1 w - - 3 30,d6d7 a2a1 c7c1 a1c1 d7d1 c1d1 f3e1 d1e1,661,102,83,410,backRankMate endgame mate mateIn4 veryLong,https://lichess.org/KhYk2hOW#59,
1u2QZ,3r2k1/3q1p1p/p3bRp1/1p4Q1/8/P2B4/1Pr1R1PP/7K w - - 0 26,d3c2 d7d1 c2d1 d8d1 e2e1 d1e1 f6f1 e1f1,646,98,81,380,backRankMate mate mateIn4 middlegame sacrifice veryLong,https://lichess.org/2gatMXwr#51,
QP8AT,6k1/2b2ppp/pqrp1n2/1p2N3/4P3/P1PQ4/1P1R1PPP/3R2K1 b - - 0 23,d6e5 d3d8 c7d8 d2d8 b6d8 d1d8 f6e8 d8e8,641,106,84,610,backRankMate mate mateIn4 middlegame sacrifice veryLong,https://lichess.org/m0soB9t2/black#46,
IW4xX,r5k1/2p1q1p1/1b5B/2p2p1Q/1P1P4/2P5/5PPP/4R1K1 w - - 0 24,e1e7 a8a1 h6c1 a1c1 h5d1 c1d1 e7e1 d1e1,638,85,82,400,backRankMate endgame mate mateIn4 veryLong,https://lichess.org/eVp02QBo#47,
BSjIN,r5k1/3R1ppp/8/3b2B1/8/5N2/1PP2PPP/6K1 w - - 1 22,d7d5 a8a1 g5c1 a1c1 d5d1 c1d1 f3e1 d1e1,673,99,83,105,backRankMate endgame mate mateIn4 veryLong,https://lichess.org/Bt65flWc#43,
DkZDt,5rn1/ppp4k/3p1rp1/3Pp2p/4P3/2N3Q1/PPP3R1/K3Rq2 w - - 9 29,e1f1 f6f1 c3b1 f1b1 a1b1 f8f1 g3e1 f1e1,632,95,40,201,attraction backRankMate mate mateIn4 middlegame veryLong,https://lichess.org/21wZeOLy#57,
HU5NQ,6k1/5ppp/4p3/3r3P/2r2PK1/R7/1p6/8 b - - 0 49,b2b1q a3a8 b1b8 a8b8 c4c8 b8c8 d5d8 c8d8,638,102,33,77,backRankMate endgame mate mateIn4 queenRookEndgame veryLong,https://lichess.org/1cgKiZwM/black#98,
acOA2,5r1k/5ppp/1p3n2/1PpP1N2/r1P5/1R3Q2/1R3PPP/6K1 w - - 2 32,b3c3 a4a1 b2b1 a1b1 c3c1 b1c1 f3d1 c1d1,652,96,85,134,backRankMate mate mateIn4 middlegame veryLong,https://lichess.org/fCoY9v64#63,
eIV39,7k/6p1/b5Pp/6b1/q7/5pQ1/1PP3R1/1K6 b - - 1 37,f3g2 g3b8 a6c8 b8c8 g5d8 c8d8 a4e8 d8e8,682,95,88,445,endgame mate mateIn4 veryLong,https://lichess.org/hsLUydha/black#74,
1iNQO,2r2k2/1p2bp1p/p1r3p1/P2pP3/3q1B2/1P6/Q3RPPP/3R2K1 w - - 0 30,d1d4 c6c1 f4c1 c8c1 d4d1 c1d1 e2e1 d1e1,639,107,86,420,backRankMate mate mateIn4 middlegame sacrifice veryLong,https://lichess.org/Nl5IscBl#59,
0fbnf,2q1kb1r/1b3ppp/4pn2/1pPpN3/1n1P1B2/2N5/4PPPP/Q3KB1R w Kk - 0 14,c3b5 b4c2 e1d1 c2a1,673,80,93,206,crushing fork middlegame short,https://lichess.org/VPlRTr2Q#27,Queens_Gambit_Declined Queens_Gambit_Declined_Other_variations
786Sp,r3kb1r/pp1nppp1/2p4p/8/5qb1/3Q1N1P/PPP2PP1/3RKB1R b Kkq - 0 11,g4f3 d3d7,662,79,40,83,mate mateIn1 middlegame oneMove,https://lichess.org/VQ12xWu4/black#22,Caro-Kann_Defense Caro-Kann_Defense_Main_Line
4j30u,r3r1k1/1b3ppp/p1n5/1p6/2pNR3/P1P5/BP3PPP/4R1K1 b - - 2 25,c6d4 e4e8 a8e8 e1e8,693,94,81,241,backRankMate mate mateIn2 middlegame short,https://lichess.org/sn0sfJJW/black#50,
xDiH7,r1bq2k1/1pp2Qpp/2np4/p7/2n1P2P/2N5/PP4P1/R4RK1 b - - 0 17,g8h8 f7f8 d8f8 f1f8,699,93,96,776,backRankMate mate mateIn2 middlegame short,https://lichess.org/oJMqXuK8/black#34,Italian_Game Italian_Game_Classical_Variation
jJezj,rnq2rk1/2b2ppp/p3p1b1/1pP5/1PPQ4/5N2/PB3KPP/R4B1R b - - 0 17,b8c6 d4g7,604,126,57,38,kingsideAttack mate mateIn1 middlegame oneMove,https://lichess.org/dqMW4RLk/black#34,Nimzo-Larsen_Attack Nimzo-Larsen_Attack_Other_variations
26bGj,1r3rk1/5pp1/3p3p/p1p1p1q1/P1P1P3/1PPbnR2/3N2PP/RNQ3K1 w - - 2 21,b1a3 g5g2,626,88,90,286,kingsideAttack mate mateIn1 middlegame oneMove,https://lichess.org/xQ56H1kO#41,
sHnJv,r1b1nQ1k/1pqn2pp/p7/2p1P1B1/8/2N5/PPP3PP/R4RK1 b - - 2 18,d7f8 f1f8,675,99,100,37,backRankMate mate mateIn1 middlegame oneMove,https://lichess.org/gCxTtGFd/black#36,Vienna_Game Vienna_Game_Other_variations
goPJ3,5r1k/p6p/1p1Q2pq/4P3/1P3bbN/P7/6BP/5R1K b - - 1 33,h6h4 d6f8,669,101,68,342,hangingPiece mate mateIn1 middlegame oneMove,https://lichess.org/fUvVDAVb/black#66,
VgFvY,3rr1k1/p1p1qppp/1pn5/8/3PpP2/PNP4P/2Q2PP1/R3R1K1 w - - 2 20,e1e4 e7e4 c2e4 e8e4,690,109,96,693,crushing middlegame short,https://lichess.org/Bn2reCrH#39,
nkKN2,1k4r1/1p4qR/p2N4/3Q4/5p2/4b3/PP5P/R5rK w - - 2 30,a1g1 g7g1,674,81,100,84,mate mateIn1 middlegame oneMove,https://lichess.org/kRS1pJJF#59,
DMOHb,1k1rn2r/p2q1pp1/2pp1b1p/Pp6/1PPQP3/N3B3/5PPP/R3R1K1 w - - 1 19,d4a7 d7a7 e3a7 b8a7,683,98,87,900,advantage middlegame short,https://lichess.org/CL4Hbuzv#37,Ruy_Lopez Ruy_Lopez_Steinitz_Defense
MgS5w,3r2k1/p2r2p1/4p2p/2RbQp2/P2P4/5P1P/1q4PK/1B2R3 w - - 7 34,f3f4 b2g2,692,92,94,208,master mate mateIn1 middlegame oneMove,https://lichess.org/zX2jmwLZ#67,
GlnbR,r4rk1/ppp2ppp/2nb4/4q1N1/6n1/1N2B3/PPQ2PPP/2KR3R b - - 5 14,g4e3 c2h7,671,95,90,631,kingsideAttack mate mateIn1 middlegame oneMove,https://lichess.org/ZfTlgZDq/black#28,Elephant_Gambit Elephant_Gambit_Paulsen_Countergambit
4wEsd,2r2Q1k/6pp/1q6/1Pr1b3/4P1PP/pP6/N1P5/1K1R1R2 b - - 2 35,c8f8 f1f8,652,93,88,235,backRankMate mate mateIn1 middlegame oneMove,https://lichess.org/ddCDfKS7/black#70,
rSws8,r4rk1/ppp2ppp/2n5/2Ppp1q1/Q2P4/2PBP2b/P2N1PPP/R4RK1 w - - 4 13,d2f3 g5g2,662,86,86,301,kingsideAttack mate mateIn1 middlegame oneMove,https://lichess.org/GWXPZpWW#25,Queens_Gambit_Declined Queens_Gambit_Declined_Ragozin_Defense
L8WwX,8/p2RQ1pk/1b5p/8/2qr3r/P7/1K2R3/8 b - - 9 44,h4h3 e7g7,698,79,70,166,master mate mateIn1 middlegame oneMove,https://lichess.org/Bf7pdpdt/black#88,
fiVjf,2rq1rk1/1b2bpp1/p3p2p/1p1n4/1P2Q3/P2B4/1BP1NPPP/R3R1K1 b - - 4 17,d8c7 e4h7,693,82,85,73,mate mateIn1 middlegame oneMove,https://lichess.org/P8yKXd5r/black#34,Sicilian_Defense Sicilian_Defense_Open
txur2,r1b1k2r/ppp2ppp/2p2n2/4q3/1bB5/1PN1B3/P1PQ1PPP/2KR3R b kq - 6 11,b4c3 d2d8,692,98,94,1219,mate mateIn1 middlegame oneMove,https://lichess.org/Ol9YFAdj/black#22,Scotch_Game Scotch_Game_Steinitz_Variation
CSnhA,6rk/1b2R2Q/pqp2n2/1p1n1pN1/8/1B5P/PP3N2/R1B3K1 b - - 0 25,f6h7 e7h7,692,86,100,338,kingsideAttack mate mateIn1 middlegame oneMove,https://lichess.org/Nxm2tOpn/black#50,
9uXIR,rb3rk1/1b3p1p/p4p2/1p1q1N2/6Q1/3P4/PP3PPP/R4RK1 b - - 1 17,g8h8 g4g7,679,97,74,170,mate mateIn1 middlegame oneMove,https://lichess.org/Bj2MajsR/black#34,Alekhine_Defense Alekhine_Defense_Scandinavian_Variation
