PuzzleId,FEN,Moves,Rating,RatingDeviation,Popularity,NbPlays,Themes,GameUrl,OpeningTags
VLgzD,8/3K4/8/7p/P7/7k/8/8 b - - 0 58,h3g3 a4a5 h5h4 a5a6 g3f2 a6a7 h4h3 a7a8q,581,86,100,129,advancedPawn crushing endgame pawnEndgame promotion quietMove veryLong,https://lichess.org/T3yrMMbC/black#116,
HXJcG,8/8/7K/7P/p7/1k6/8/8 w - - 0 58,h6g6 a4a3 h5h6 a3a2 g6g7 a2a1q,588,96,69,197,advancedPawn crushing endgame long master pawnEndgame promotion,https://lichess.org/pTXoAv9L#115,
waniH,8/4p3/3p4/3k1K2/6P1/8/8/8 b - - 0 70,e7e5 g4g5 e5e4 g5g6 e4e3 g6g7 e3e2 g7g8q,583,85,99,860,advancedPawn crushing endgame pawnEndgame promotion quietMove veryLong,https://lichess.org/pVeSJto7/black#140,
WkxLD,8/8/PK6/7p/6pk/8/8/8 b - - 0 53,h4h3 a6a7 h3h2 a7a8q,596,96,79,286,advancedPawn crushing endgame pawnEndgame promotion short,https://lichess.org/st9oSFz2/black#106,
XNhTn,8/8/8/2k1p1PK/4Pb2/8/8/8 b - - 0 56,c5d4 g5g6 f4d2 g6g7,588,86,82,89,advancedPawn bishopEndgame crushing endgame short,https://lichess.org/jkSJt085/black#112,
2FZb4,5b2/8/8/2PK4/1p6/1P3P2/k7/8 b - - 0 79,a2b3 c5c6 b3a2 c6c7 b4b3 c7c8q,573,85,90,214,advancedPawn bishopEndgame crushing endgame long promotion,https://lichess.org/bG2jt575/black#158,
8BIOe,8/7p/8/pp3P2/8/2k1K3/7P/8 b - - 0 50,a5a4 f5f6 a4a3 f6f7,573,85,92,145,advancedPawn crushing endgame pawnEndgame short,https://lichess.org/fbTwXSTi/black#100,
88iOS,8/6k1/8/3P4/K4p2/8/8/8 w - - 0 64,a4b5 f4f3 d5d6 f3f2 d6d7 f2f1q,575,106,80,601,advancedPawn crushing endgame long master pawnEndgame promotion,https://lichess.org/Ls1vYqOB#127,
anZTL,5rk1/p1pP1ppp/1p6/n7/8/2P2P2/PP3P1P/4R1K1 b - - 0 22,f8d8 e1e8 d8e8 d7e8q,583,98,82,597,advancedPawn endgame mate mateIn2 promotion short,https://lichess.org/qOIcxnxs/black#44,
R8oRd,8/2P5/8/1P6/1P4p1/4kp2/4p2P/4K3 w - - 2 54,c7c8q f3f2,544,99,99,720,advancedPawn endgame mate mateIn1 oneMove queenEndgame,https://lichess.org/q2hO8Mun#107,
Ezdo6,8/8/8/3P4/2p5/2k2K2/8/8 b - - 0 79,c3d2 d5d6 c4c3 d6d7 c3c2 d7d8q,526,106,95,1744,advancedPawn crushing endgame long pawnEndgame promotion,https://lichess.org/BlSF51GT/black#158,
rVauo,8/8/8/1pK4p/1P4k1/8/P7/8 w - - 0 41,c5b5 h5h4 b5a6 h4h3 b4b5 h3h2 b5b6 h2h1q,543,108,79,299,advancedPawn crushing endgame pawnEndgame promotion quietMove veryLong,https://lichess.org/7HX89cg2#81,
WrkCj,6B1/8/8/2k5/p1P2P1P/8/8/6K1 w - - 1 47,h4h5 a4a3 g1f2 a3a2,592,99,92,863,advancedPawn bishopEndgame crushing endgame short,https://lichess.org/UYo18VQO#93,
IkGwc,8/p7/6K1/1p6/1k3P2/8/8/8 b - - 0 41,b4c5 f4f5 b5b4 f5f6 b4b3 f6f7 c5c4 f7f8q,575,97,54,168,advancedPawn crushing endgame pawnEndgame promotion quietMove veryLong,https://lichess.org/eDmaSzpU/black#82,
qTJ1u,8/8/8/7p/4P2k/4K3/8/8 b - - 0 44,h4g3 e4e5 h5h4 e5e6 h4h3 e6e7,579,84,100,173,advancedPawn crushing endgame long pawnEndgame quietMove,https://lichess.org/NlTzDkaL/black#88,
oUG0s,8/8/8/6p1/8/1PK2k2/8/8 w - - 2 54,c3d3 g5g4 b3b4 g4g3 b4b5 g3g2 b5b6 g2g1q,582,87,75,171,advancedPawn crushing endgame pawnEndgame promotion quietMove veryLong,https://lichess.org/j3u9AXG2#107,
Rdr3u,8/7K/8/7P/pk6/8/8/8 w - - 1 48,h7g6 a4a3 h5h6 a3a2 g6g7 a2a1q,598,90,83,304,advancedPawn crushing endgame long pawnEndgame promotion,https://lichess.org/UTgtwiT2#95,
FEheB,8/3P4/8/2pP4/2P5/6kp/5p2/7K w - - 0 59,d7d8q f2f1q,540,110,89,651,advancedPawn endgame mate mateIn1 oneMove promotion queenEndgame,https://lichess.org/c5KtaCXD#117,
pSMbh,8/5b2/7P/5k2/2pK1P2/8/8/8 b - - 0 56,f5f4 h6h7 f7g6 h7h8q,512,94,90,177,advancedPawn bishopEndgame crushing endgame master promotion short,https://lichess.org/psqXofx1/black#112,
87ZSM,8/6K1/7P/p7/Pp6/1k6/8/8 b - - 0 52,b3a4 h6h7 b4b3 h7h8q,529,111,85,1115,advancedPawn crushing endgame pawnEndgame promotion short,https://lichess.org/Lvy1MEIw/black#104,
PxjBO,3r1rk1/ppqn1ppp/2p5/3p4/5PPN/7P/PPP1Q1K1/4RR2 b - - 1 20,d8e8 e2e8 f8e8 e1e8,507,94,94,1212,advantage kingsideAttack middlegame short,https://lichess.org/ZPmvEc9F/black#40,
Zmv4A,r2q1rk1/1pp2pb1/3p2pp/p1nPpb2/2P1N3/3B1N1P/PPQB1PP1/R3K2R b KQ - 2 15,c5d3 c2d3,584,111,72,305,advantage middlegame oneMove,https://lichess.org/NkyOUFlA/black#30,Kings_Indian_Defense Kings_Indian_Defense_Petrosian_Variation
rdLTz,3r2k1/pp1q1pb1/6pp/8/1P5P/PQ2PRP1/4K3/8 b - - 0 34,d7d3 b3d3 d8d3 e2d3,595,77,100,302,advantage endgame short,https://lichess.org/xlvol37t/black#68,
fwDz7,4r1k1/p3Npbp/1p4p1/8/3P4/3r2P1/P4P1P/R3R1K1 b - - 0 27,g8h8 e7g6 h7g6 e1e8,599,82,100,160,advantage discoveredAttack endgame master short,https://lichess.org/CnoGFLjz/black#54,
km2Ox,r1r3k1/p4p1p/2R1p1p1/q2pP3/8/P6Q/1P3PPP/2R3K1 b - - 2 22,a8b8 c6c8 b8c8 c1c8,572,81,96,189,advantage endgame short,https://lichess.org/OkhCiJBJ/black#44,
5VEq0,r4rk1/p5bp/qp1p1npB/2nPp3/4P1P1/2N2P2/PP1QN3/2KR3R b - - 2 17,c5d3 d2d3 a6d3 d1d3,569,117,81,41,advantage middlegame short,https://lichess.org/5EAJd2Kh/black#34,Kings_Indian_Defense Kings_Indian_Defense_Normal_Variation
smA92,r7/p1n2r1k/1p2np1p/5NpP/1P6/P2R2P1/8/2BR2K1 b - - 0 37,a8d8 d3d8 e6d8 d1d8,525,90,98,506,advantage middlegame short,https://lichess.org/cbdGAMFD/black#74,
9gbB1,6k1/1p3p2/5P1p/3N1n2/8/8/1PP5/3K4 b - - 1 32,h6h5 d5e7 g8h7 e7f5,583,110,64,200,advantage endgame knightEndgame short,https://lichess.org/SzfPz9wH/black#64,
dn4Aq,r4rk1/pp3pp1/2p3Np/4q3/4p3/5R1P/PP3QP1/5R1K b - - 1 25,f7g6 f3f8 a8f8 f2f8,573,97,100,40,advantage endgame short,https://lichess.org/qAhRV7EX/black#50,
pk9ge,4R3/5pk1/2p2r1p/1p4b1/4Q3/7P/5PPK/8 w - - 1 49,e4e5 g5f4 e5f4 f6f4,529,87,100,84,advantage endgame fork short,https://lichess.org/Fz4SFGky#97,
A0Hk8,5k2/5pp1/2p1qb2/4pN2/p2pP3/P5Q1/r1P2PPP/R5K1 w - - 3 26,a1a2 e6a2,595,107,70,91,advantage endgame oneMove,https://lichess.org/c0rCJojD#51,
4jXBN,r7/pp1k2q1/2n1pp1p/3p4/3P4/2P2BP1/PP3P1K/4RQ2 w - - 2 20,f3g4 g7g4,592,98,76,172,advantage endgame hangingPiece oneMove,https://lichess.org/HRnZPgSx#39,
snDcc,6k1/4q2p/b1n1p1p1/3pPpP1/1B1P4/3r4/1Q4R1/1R4K1 b - - 0 33,e7b4 b2b4 c6b4 b1b4,518,100,96,1512,advantage middlegame short,https://lichess.org/k6ZKNF2R/black#66,
oDA24,8/5Rk1/4p1p1/p5P1/P1r1N3/3nPK2/5P2/8 b - - 0 38,g7f7 e4d6 f7e7 d6c4,586,102,77,319,advantage endgame fork master short,https://lichess.org/U857AfRw/black#76,
Ii0wr,4r1k1/5pp1/2p2b2/2P5/3Pq1p1/2B5/3Q1PP1/3R2K1 w - - 2 32,d1e1 e4e1 d2e1 e8e1,582,97,85,481,advantage endgame short,https://lichess.org/oh0x1dKv#63,
6eLy9,3b1k2/4q1pB/3p4/p1pQ4/2P1PKP1/8/8/8 b - - 4 54,e7g5 d5g5 d8g5 f4g5,548,82,100,239,advantage endgame short,https://lichess.org/smt2OwpF/black#108,
DhLry,r1bqkb1r/pp2pppp/2np1n2/2p5/2B1P3/3P1N2/PPP2PPP/RNBQK2R w KQkq - 1 5,c4f7 e8f7,537,107,74,129,advantage hangingPiece oneMove opening,https://lichess.org/NFZ2uzRi#9,Sicilian_Defense Sicilian_Defense_Modern_Variations
DtnpE,r3kb1r/ppp2ppp/2np3q/3Bp3/4P3/3P3Q/PPPN1PPP/R3K2R w KQkq - 6 12,d5f7 e8f7 h3h6 g7h6,593,106,76,198,advantage hangingPiece middlegame short,https://lichess.org/KKABk3HE#23,Italian_Game Italian_Game_Other_variations
xFp4f,8/1p3p1k/2p3pp/8/Pp2n1P1/1PR4P/1P6/5K2 w - - 0 39,c3c4 e4d2 f1e2 d2c4,598,83,100,305,advantage endgame fork master short,https://lichess.org/emoJGAOL#77,
aW5je,3r1rk1/6bp/p5p1/1pp1P3/3p1P2/1PNR2P1/P6P/3R2K1 b - - 1 26,d4c3 d3d8 f8d8 d1d8,517,96,84,624,advantage endgame short,https://lichess.org/MoqC32Pq/black#52,
Xga70,1R6/5pp1/4N2k/7p/6r1/6r1/7K/8 b - - 6 64,g4g6 b8h8,588,88,91,1834,anastasiaMate endgame master mate mateIn1 oneMove,https://lichess.org/5a1HSGhg/black#128,
K9ouI,6k1/p3N1p1/1p1K4/8/8/r7/5R2/8 b - - 24 65,g8h7 f2h2 a3h3 h2h3,556,83,68,255,anastasiaMate endgame master mate mateIn2 short,https://lichess.org/bOb0Ki7u/black#130,
hab22,r3qr1k/pp2N1pQ/3p1p2/2p1n3/4PP2/2PP1R2/PP5P/R1B3K1 b - - 0 19,h8h7 f3h3 e8h5 h3h5,508,94,89,1684,anastasiaMate mate mateIn2 middlegame short,https://lichess.org/yJ4NDsRd/black#38,Sicilian_Defense Sicilian_Defense_Closed
gMVCF,8/8/4R3/7k/r1n1N1p1/5p2/5K2/8 b - - 9 74,h5h4 e6h6,509,103,92,1563,anastasiaMate endgame master mate mateIn1 oneMove,https://lichess.org/295nA3yx/black#148,
Ry3uB,8/3R3p/3P4/4Nppk/4n3/p6P/2r3PK/8 b - - 5 49,a3a2 d7h7,557,89,86,1579,anastasiaMate endgame mate mateIn1 oneMove,https://lichess.org/ox9AIfMD/black#98,
6JrdN,4rr1k/pp2N1pQ/5p2/8/4R3/3p2P1/Pq3PP1/3R2K1 b - - 0 25,h8h7 e4h4,544,86,87,299,anastasiaMate endgame mate mateIn1 oneMove,https://lichess.org/9iLGppwn/black#50,
51Bqj,r6k/p1p3pp/2Qp4/4r3/2R5/B7/P3nPPq/5R1K w - - 0 24,h1h2 e5h5 c4h4 h5h4,547,92,83,373,anastasiaMate mate mateIn2 middlegame short,https://lichess.org/64Lsxs5C#47,
fsg4R,1R3Bk1/R4p1p/6p1/4P3/2b1r3/8/4nPP1/6K1 w - - 3 40,g1h2 e4h4,554,101,81,1069,anastasiaMate endgame master mate mateIn1 oneMove,https://lichess.org/ooFx6zAJ#79,
dpcqT,8/Q5pp/2p1ppk1/8/Pr6/8/4nPPq/B3R2K w - - 0 41,h1h2 b4h4,558,90,100,278,anastasiaMate endgame mate mateIn1 oneMove,https://lichess.org/7rnURL5n#81,
qz9Hc,4k2r/Qp3ppp/2b1p3/3r4/8/5P2/PP1Pn1Pq/R1B1NR1K w k - 0 21,h1h2 d5h5,591,84,97,1562,anastasiaMate mate mateIn1 middlegame oneMove,https://lichess.org/DZJIopSp#41,
f13i6,6k1/5p1p/R7/1pr5/4P3/3Bn1PK/P1P4P/8 w - - 1 37,a6a5 c5h5,564,93,93,1302,anastasiaMate endgame mate mateIn1 oneMove,https://lichess.org/pfuIv5X4#73,
DVSJh,8/5p2/1R6/6p1/1P2N2k/4K2n/8/6r1 b - - 0 56,g1g4 b6h6,556,93,95,1141,anastasiaMate endgame mate mateIn1 oneMove,https://lichess.org/mOEDgNl8/black#112,
vV7gB,7k/pp1P1pp1/2p5/8/3Pr3/8/PPQ1n1Pq/5R1K w - - 0 28,h1h2 e4h4,527,92,97,718,anastasiaMate endgame master mate mateIn1 oneMove,https://lichess.org/oOeXrEdj#55,
sdwET,4R3/1p6/6k1/1r6/5pN1/5P2/4n1P1/6K1 w - - 2 49,g1h2 b5h5,575,88,83,370,anastasiaMate endgame master mate mateIn1 oneMove,https://lichess.org/JUj05qSn#97,
NDICa,5r1k/ppn1NqpQ/3p4/2pP4/8/P3R3/1P4PP/1K6 b - - 0 26,h8h7 e3h3 f7h5 h3h5,540,95,86,713,anastasiaMate endgame mate mateIn2 short,https://lichess.org/a3OICpJv/black#52,
aCb9F,5r2/4Nppk/8/8/3P3Q/1n6/r3q1PP/5R1K b - - 1 36,e2h5 h4h5,526,97,95,1036,anastasiaMate hangingPiece mate mateIn1 middlegame oneMove,https://lichess.org/zPAjklku/black#72,
vV1zz,4r2k/p3NppQ/4b3/2R5/5P2/6P1/P3r2P/6K1 b - - 0 24,h8h7 c5h5,519,94,100,615,anastasiaMate endgame mate mateIn1 oneMove,https://lichess.org/RQYPsa7X/black#48,
z6VWy,8/1p2n1k1/p2pN1p1/3p4/3p2r1/8/PPP5/2K2R2 b - - 0 30,g7h6 f1h1 g4h4 h1h4,560,93,94,2162,anastasiaMate endgame mate mateIn2 short,https://lichess.org/Bx7UzEO8/black#60,
X1nKd,r1bq1r1k/ppppN1pQ/5p2/1n2R3/8/8/PPPP1PPP/R1B3K1 b - - 0 12,h8h7 e5h5,587,96,57,66,anastasiaMate mate mateIn1 middlegame oneMove,https://lichess.org/IcqLeCEn/black#24,Ruy_Lopez Ruy_Lopez_Berlin_Defense
gLpL7,1r3r2/2p1Nppk/6p1/p7/P2R3Q/1P2P2q/2P5/5RK1 b - - 3 25,h3h4 d4h4,591,88,97,792,anastasiaMate endgame master mate mateIn1 oneMove,https://lichess.org/gaWWexWr/black#50,
TuxUS,1k6/pppr2p1/6rp/1P3p2/PB2P3/2Q2n1q/5PP1/2R2B1K w - - 0 30,g2h3 g6g1,588,96,94,818,arabianMate master mate mateIn1 middlegame oneMove,https://lichess.org/yrP36Bvj#59,
QRIhI,3q3k/1p3prQ/p4N2/3ppP2/4P1p1/P2B1n2/1PP3K1/7R b - - 0 31,g7h7 h1h7,570,92,97,563,arabianMate endgame master mate mateIn1 oneMove,https://lichess.org/HdbWsPa8/black#62,
JkKe8,7r/3R1pk1/3p2p1/p5r1/2p2P2/P1P2n2/B1P4P/3R3K w - - 1 34,f4g5 h8h2,540,95,95,3037,arabianMate endgame mate mateIn1 oneMove,https://lichess.org/8BXUFEXs#67,
niu6Z,4r2k/5p1p/p1np1N2/1p4RP/3P4/2PB2P1/P1PK4/r7 b - - 9 33,e8e1 g5g8,532,99,89,813,arabianMate endgame mate mateIn1 oneMove,https://lichess.org/ixHmROer/black#66,
R1IqA,r1b5/1pp4k/p4N1p/2PP1n1N/3b1p1P/8/PP5P/6RK b - - 5 29,h7h8 g1g8,586,94,91,1832,arabianMate master mate mateIn1 middlegame oneMove,https://lichess.org/gyjaLOZl/black#58,
5VidU,r1b4k/ppq2pr1/4pN1Q/5p2/2B2b1R/8/PPP2PPP/1K5R b - - 0 22,f4h6 h4h6 g7h7 h6h7,579,93,94,1472,arabianMate kingsideAttack mate mateIn2 middlegame short,https://lichess.org/pk4Fshl9/black#44,
ivCtC,7k/1p3pr1/5N1p/p3R3/2P5/PP1q1R1P/6B1/6K1 b - - 0 33,d3f3 e5e8 g7g8 e8g8,541,86,100,1650,arabianMate endgame mate mateIn2 short,https://lichess.org/zcoMiwtO/black#66,
5tcmZ,4r2k/R7/5N1p/p7/5p2/1P5P/P4PPK/2r5 b - - 5 44,e8f8 a7h7,597,88,95,5491,arabianMate endgame mate mateIn1 oneMove,https://lichess.org/8OsFjM2U/black#88,
cyKJf,5rQk/1r6/3pPN1p/p2Pp3/2P5/4q2P/P5RK/8 b - - 2 36,f8g8 g2g8,567,84,88,248,arabianMate endgame mate mateIn1 oneMove,https://lichess.org/UcpqR47D/black#72,
MUB40,5r1k/p2p1q1Q/1p2pNp1/8/3P2P1/7R/Pr3P1P/6K1 b - - 0 24,f7h7 h3h7,546,84,100,375,arabianMate endgame mate mateIn1 oneMove,https://lichess.org/azH8LwT0/black#48,
560bL,r4r1k/p3R2p/4pN2/5Q2/3p4/8/PPP2PPP/6K1 b - - 0 22,e6f5 e7h7,597,91,90,1314,arabianMate endgame mate mateIn1 oneMove,https://lichess.org/P8ve7HoX/black#44,
n1sgE,6rk/pR5p/2p2Nn1/4p3/4P1b1/3P4/PPP2K1P/8 b - - 0 31,g8f8 b7h7,563,92,79,291,arabianMate endgame mate mateIn1 oneMove,https://lichess.org/zFrawTbZ/black#62,
0J9yJ,r1b4k/2p1qprQ/p2p1N2/1pn3PR/4PP2/8/PPP5/2KR2N1 b - - 0 22,g7h7 h5h7,522,100,93,1703,arabianMate kingsideAttack mate mateIn1 middlegame oneMove,https://lichess.org/MBjge9Y8/black#44,
uxRkH,5b1k/2R5/5Npp/4P3/1p4P1/4r2P/P7/1K6 b - - 2 37,e3e5 c7h7,536,86,96,2658,arabianMate endgame master masterVsMaster mate mateIn1 oneMove,https://lichess.org/SGOW8Jud/black#74,
qzh58,4R2k/2p2pr1/5Np1/8/3P3p/8/1PPK3P/7r b - - 5 38,g7g8 e8g8,531,85,95,1586,arabianMate endgame mate mateIn1 oneMove,https://lichess.org/HiTnLodH/black#76,
yu1tR,1r5k/1p4qQ/p2p1N2/2p1p2R/PnP5/4P1P1/1P5P/6K1 b - - 0 25,g7h7 h5h7,548,97,80,463,arabianMate endgame master mate mateIn1 oneMove,https://lichess.org/i1iXBxtO/black#50,
hliN2,5r1k/5p1p/p2p1N2/1p1PpP2/7R/4bP1P/r5P1/5R1K b - - 0 27,b5b4 h4h7,532,101,93,1272,arabianMate endgame mate mateIn1 oneMove,https://lichess.org/sxwMRzJD/black#54,
gOnw0,5r1k/1R3p2/1p2RNn1/p7/2P3p1/P7/1P6/1K6 b - - 0 39,f7e6 b7h7,594,89,92,372,arabianMate endgame master mate mateIn1 oneMove,https://lichess.org/zPLa7bTi/black#78,
4DPPJ,7k/p1p2prQ/2p1bNr1/4P3/P2P3R/6P1/1P1q3P/R5K1 b - - 0 25,g7h7 h4h7,560,92,86,1112,arabianMate mate mateIn1 middlegame oneMove,https://lichess.org/AqQbuhKS/black#50,
OD0UD,r4n1k/p1b4p/2p2N2/1p1p4/1P1P4/7P/PB1r1P2/R5RK b - - 0 32,d2b2 g1g8,552,96,79,746,arabianMate mate mateIn1 middlegame oneMove,https://lichess.org/kytKY4Mn/black#64,
FrZtt,1r1qk2r/ppp2ppp/2n2n2/4p1N1/2Q5/3P2P1/PP2PPBP/R3K2R b KQk - 2 12,c6d4 c4f7,513,85,100,160,attackingF2F7 mate mateIn1 middlegame oneMove,https://lichess.org/DnMWS5Jv/black#24,Zukertort_Opening Zukertort_Opening_Black_Mustang_Defense
LZeNd,rnbqk2r/pppp1ppp/8/3Qp3/2B1n3/2P5/PPP2PPP/R1B1K1NR b KQkq - 1 6,e4f6 d5f7,581,95,91,197,attackingF2F7 mate mateIn1 oneMove opening,https://lichess.org/s52v10l9/black#12,Vant_Kruijs_Opening Vant_Kruijs_Opening_Other_variations
dz76i,r2qkbnr/pp3ppp/4p3/1bppN2Q/8/2P5/PP1P1PPP/RNB2RK1 b kq - 1 8,g8f6 h5f7,514,91,85,178,attackingF2F7 mate mateIn1 oneMove opening,https://lichess.org/ski1iRb5/black#16,French_Defense French_Defense_Knight_Variation
JqbBk,r1bqk2r/ppp2pb1/2np2pp/3Bp3/4P3/3P1Q1P/PPP2PP1/R1B1K1NR b KQkq - 0 9,c6d4 f3f7,545,96,93,944,attackingF2F7 mate mateIn1 oneMove opening,https://lichess.org/EvUHfpZd/black#18,Bishops_Opening Bishops_Opening_Other_variations
70lja,r2qk2r/pppb1pbp/3pP3/n6Q/2B1P3/2N1B3/PPP2PP1/R3K1N1 b Qkq - 0 11,a5c4 h5f7,508,93,89,567,attackingF2F7 mate mateIn1 middlegame oneMove,https://lichess.org/T6D7av1v/black#22,Pirc_Defense Pirc_Defense_Other_variations
ptzHP,3rk1nr/p4p1p/2B1p1p1/4n3/5Q2/4P2P/PqP3P1/RN3RK1 b k - 2 17,e5c6 f4f7,579,86,68,91,attackingF2F7 mate mateIn1 middlegame oneMove,https://lichess.org/wx72g6h3/black#34,Caro-Kann_Defense Caro-Kann_Defense_Other_variations
siSY7,r3nrk1/pp2p2p/2n3pb/3p1q1P/3P4/2P1B3/PP1NBP2/R2QK2R w KQ - 3 17,e3h6 f5f2,515,107,83,246,attackingF2F7 mate mateIn1 oneMove opening,https://lichess.org/xSjFu6Pg#33,Queens_Pawn_Game Queens_Pawn_Game_Modern_Defense
1IlhZ,rnb1k1nr/pppp1p1p/5q2/2b1p3/4P1p1/3P1NP1/PPP2PBP/RNBQK2R w KQkq - 0 6,f3d2 f6f2,569,85,100,495,attackingF2F7 mate mateIn1 oneMove opening,https://lichess.org/pvVM3bc7#11,Kings_Pawn_Game Kings_Pawn_Game_McConnell_Defense
lTJgL,r2qk2r/1p3Np1/p1ppb2p/3N3n/4P3/1P1PP2P/1PP2QP1/R4RK1 b kq - 0 16,e6f7 f2f7,542,95,95,761,attackingF2F7 mate mateIn1 middlegame oneMove,https://lichess.org/UkM5srRi/black#32,Italian_Game Italian_Game_Giuoco_Pianissimo
h7lHj,r1bqk1nr/p2pppbp/2p3p1/8/2B1P3/5Q2/PPP2PPP/RNB1K2R b KQkq - 3 7,e7e5 f3f7,514,88,71,151,attackingF2F7 mate mateIn1 oneMove opening,https://lichess.org/Povy2ONw/black#14,Sicilian_Defense Sicilian_Defense_Accelerated_Dragon
y2kpm,r2qk1nr/ppp3p1/4p2p/2b1n2Q/3p4/8/PPP3PP/RNB2R1K b kq - 1 13,e5f7 h5f7,559,99,92,906,attackingF2F7 mate mateIn1 oneMove opening,https://lichess.org/Pni8nRbQ/black#26,Kings_Gambit_Declined Kings_Gambit_Declined_Queens_Knight_Defense
ZYdhE,r2qk2r/3bppbp/p2p2p1/1pp3N1/4PN2/1QPP4/PP3PPP/R4RK1 b kq - 4 16,h7h6 b3f7,580,96,92,1670,attackingF2F7 mate mateIn1 middlegame oneMove,https://lichess.org/9BZTN2KL/black#32,Sicilian_Defense Sicilian_Defense_Bowdler_Attack
PRlBm,2rqk1nr/1b1nbppp/p2p4/1pp1pP1Q/4P3/P2P2N1/BPP3PP/RNB2RK1 b k - 1 11,g8f6 h5f7,543,99,94,914,attackingF2F7 mate mateIn1 oneMove opening,https://lichess.org/UV61fbBF/black#22,Sicilian_Defense Sicilian_Defense_Bowdler_Attack
pAta6,r1bqk1nr/pp1p1pbp/2n3p1/3Q4/2B1P3/5N2/PP3PPP/RNB1K2R b KQkq - 0 8,g8e7 d5f7,522,91,100,885,attackingF2F7 mate mateIn1 oneMove opening,https://lichess.org/n9G0QJi4/black#16,Sicilian_Defense Sicilian_Defense_Bowdler_Attack
ALAxR,r1bqk2r/pp1n1pbp/4pnp1/2pPN1P1/2P4P/2B2Q2/PP3P2/RN2KB1R b KQkq - 0 13,f6h5 f3f7,539,93,98,907,attackingF2F7 mate mateIn1 oneMove opening,https://lichess.org/1VRto1BS/black#26,Sicilian_Defense Sicilian_Defense_Other_variations
NZgfZ,r3k2r/ppp2pp1/3p1q2/7p/3bP1b1/2N5/PPP1BPP1/R1BQK2R w KQkq - 0 13,e2g4 f6f2,536,85,100,393,attackingF2F7 mate mateIn1 middlegame oneMove,https://lichess.org/5EBgyMHY#25,Russian_Game Russian_Game_Three_Knights_Game
vKaD8,r2qk2r/ppbn1pp1/2p1pn2/7p/3PN3/P2B1Q1P/1PP3P1/R1B2RK1 b kq - 4 13,f6e4 f3f7,554,90,99,1480,attackingF2F7 mate mateIn1 oneMove opening,https://lichess.org/jxPuBN02/black#26,Blackmar-Diemer_Gambit_Declined Blackmar-Diemer_Gambit_Declined_OKelly_Defense
f95kQ,r1bqkb1r/pp3ppp/3p4/3Qp3/2B1n3/8/PPP2PPP/RNB2RK1 b kq - 1 9,e4f6 d5f7,595,83,93,182,attackingF2F7 mate mateIn1 oneMove opening,https://lichess.org/iV0x6WZq/black#18,Sicilian_Defense Sicilian_Defense_Other_variations
68CBR,r1bqk1nr/ppNp1p1p/3b2p1/4p3/2BnP3/5Q2/PPPP1PPP/R1B1K1NR b KQkq - 0 7,d6c7 f3f7,520,83,81,177,attackingF2F7 mate mateIn1 oneMove opening,https://lichess.org/vox3rULI/black#14,Vienna_Game Vienna_Game_Max_Lange_Defense
ZSFbv,rnbqkbnr/ppp2p2/3p3p/6pQ/1PBPPp2/8/P1P3PP/RNB1K1NR b KQkq - 1 6,g8f6 h5f7,564,94,91,246,attackingF2F7 mate mateIn1 oneMove opening,https://lichess.org/L0SZninI/black#12,Kings_Gambit_Accepted Kings_Gambit_Accepted_Bishops_Gambit
7fTgI,r5k1/5ppp/4p3/2B5/3PP3/1P6/5PPP/r1R4K w - - 1 31,c1g1 a1g1 h1g1 a8a1,538,102,65,100,attraction backRankMate endgame mate mateIn2 short,https://lichess.org/pcRZkS3s#61,
0EkrH,2R3nk/pp3ppp/8/3p4/4p3/1P2P2P/Pq3PP1/2R3K1 b - - 2 25,b2a2 c8g8 h8g8 c1c8,564,85,80,222,attraction backRankMate endgame mate mateIn2 sacrifice short,https://lichess.org/gPEjuLNk/black#50,
ybUkc,3r2k1/Q1p2ppp/2p5/4p3/4P3/2P2N2/PP2RPPP/3r3K w - - 0 23,f3g1 d1g1 h1g1 d8d1 e2e1 d1e1,573,101,78,136,attraction backRankMate endgame long mate mateIn3 sacrifice,https://lichess.org/UicF9mJu#45,
hBMnO,6k1/5p1p/p2R1Ppb/1p2p3/4B3/1P2q1PP/P7/3R1K2 b - - 2 38,e3e4 d6d8 h6f8 d8f8 g8f8 d1d8,527,85,78,92,attraction endgame long mate mateIn3 sacrifice,https://lichess.org/JKYPyodR/black#76,
dsdk0,r5Qk/4Rp1p/3p1P2/2p5/6RK/7P/6P1/7q b - - 0 35,a8g8 g4g8 h8g8 e7e8,556,85,63,138,attraction endgame mate mateIn2 queenRookEndgame short,https://lichess.org/06Z31aW2/black#70,
Fc7kx,2r5/6PR/5B2/3p4/6k1/P4b2/5P2/2rR2K1 w - - 1 37,d1f1 c1f1 g1f1 c8c1,554,83,97,708,attraction endgame mate mateIn2 short,https://lichess.org/6aEr522c#73,
2ZV00,7k/pbq2Bpp/1p1n1n2/8/8/8/PPP1QPPP/4R1K1 b - - 0 23,d6f7 e2e8 f6g8 e8g8 h8g8 e1e8,572,90,98,3809,attraction backRankMate endgame long master mate mateIn3 sacrifice,https://lichess.org/sKWaxmur/black#46,
ngJA1,6k1/1p1R1p1p/p4Kp1/2b1Pp2/P1p2P2/8/6qP/3R4 b - - 3 34,g2h2 d7d8 c5f8 d8f8 g8f8 d1d8,596,90,98,513,attraction endgame long mate mateIn3 sacrifice,https://lichess.org/ODZzg30J/black#68,
UEbTj,8/1r6/8/5k2/7p/6pP/p5P1/Rr4RK w - - 4 54,a1a2 b1g1 h1g1 b7b1,563,99,95,585,attraction endgame mate mateIn2 rookEndgame short,https://lichess.org/yTqTp6Og#107,
hcsa9,3R1rk1/5ppp/8/2p5/2P1qP2/6P1/7P/3Q2K1 b - - 4 36,e4c4 d8f8 g8f8 d1d8,588,98,78,376,attraction endgame mate mateIn2 short,https://lichess.org/R1p4qhdL/black#72,
8ahEB,8/5Qpk/7p/5p2/1B2p3/P7/3p1PPP/3q1BK1 w - - 0 37,b4f8 d1f1 g1f1 d2d1q,599,82,97,936,advancedPawn attraction endgame mate mateIn2 promotion short,https://lichess.org/LCswUhGQ#73,
bAgMu,8/2P2pk1/R2B3p/6p1/P1r5/5pP1/5P1P/2r2RK1 w - - 1 44,a6b6 c1f1 g1f1 c4c1,518,88,85,287,attraction endgame mate mateIn2 short,https://lichess.org/GnEL9pYJ#87,
f0FTs,3R2rk/6p1/5pPp/P1N1nP1P/8/8/1PP2q2/1K1R4 b - - 0 37,f2c5 d8g8 h8g8 d1d8 c5f8 d8f8,596,103,89,570,attraction crushing endgame long,https://lichess.org/HVIxEaDf/black#74,
ijCzj,4R1r1/2q2pkp/3p1bpP/p2P2P1/1p3P2/8/PPP1R3/2K5 b - - 0 28,g7h8 e8g8 h8g8 e2e8,525,93,100,398,attraction endgame kingsideAttack mate mateIn2 short,https://lichess.org/1PQpPWp0/black#56,
tzC5j,4rrk1/pR3pp1/2p4p/6bR/P7/8/2P3QP/7K w - - 1 28,b7a7 e8e1 g2g1 e1g1 h1g1 g5e3,566,96,75,67,advantage attraction endgame long,https://lichess.org/kKoADAIW#55,
Zxj7J,3R1Qk1/5p1p/5Ppb/8/1p6/1q6/6PP/3R2K1 b - - 0 31,h6f8 d8f8 g8f8 d1d8,540,87,83,1062,attraction endgame mate mateIn2 sacrifice short,https://lichess.org/WuRPvoil/black#62,
Ua5Gm,2k5/pp3p2/7p/8/4pQ2/1qP5/1P3PPP/3r1R1K w - - 1 28,h1g1 d1f1 g1f1 b3d1,584,94,94,443,attraction endgame mate mateIn2 short,https://lichess.org/r76JSbZs#55,
9Unqk,3nR1rk/pp4pp/8/1P6/8/r5P1/P6P/4R2K b - - 2 28,d8f7 e8g8 h8g8 e1e8,596,103,76,237,attraction backRankMate endgame mate mateIn2 short,https://lichess.org/bVIYZpWg/black#56,
jqpk2,4Rrk1/5qpp/2p1Bbp1/3p4/2pP4/r1P4P/P3QPP1/4R1K1 b - - 5 28,f8e8 e6f7 g8f7 e2e8,597,83,100,197,attraction discoveredAttack kingsideAttack mate mateIn2 middlegame short,https://lichess.org/CS9PEJSI/black#56,
ck4DM,4r1k1/p4ppp/2p2P2/6B1/Nb1p4/8/PPQ2PPP/4rBK1 w - - 4 21,a2a3 e1f1 g1f1 e8e1,588,90,94,437,attraction kingsideAttack mate mateIn2 middlegame sacrifice short,https://lichess.org/GBQFXhlt#41,
jMALW,1k1r3r/ppp4p/q2b4/8/4Q3/3P4/PPP2PPP/R3R1K1 b - - 0 20,d8e8 e4e8 h8e8 e1e8,538,91,87,372,backRankMate mate mateIn2 middlegame short,https://lichess.org/7zEriufT/black#40,
989xt,1r4k1/2Qp1pp1/3Ppn1p/8/8/2NP4/Pq3PPP/5RK1 w - - 2 24,f1b1 b2b1 c3b1 b8b1 c7c1 b1c1,564,81,100,285,backRankMate endgame long mate mateIn3,https://lichess.org/JJY1nnuH#47,
3MC1t,4r1k1/5p2/1R4pp/r1ppq3/8/P5R1/2P3PP/2BQ3K w - - 1 25,c1h6 e5e1 d1e1 e8e1,550,103,89,373,backRankMate mate mateIn2 middlegame short,https://lichess.org/8HnYxEJ6#49,
JCvtN,8/pp2Qrkp/4b3/8/6PR/8/PP6/K7 w - - 3 33,e7e6 f7f1 e6e1 f1e1,528,104,83,450,backRankMate endgame mate mateIn2 queenRookEndgame short,https://lichess.org/q2THunIZ#65,
4SQH1,1r4k1/1Q2qppp/p2Rp3/1p6/5P2/4B3/PPP3PP/3R2K1 b - - 0 21,e7b7 d6d8 b8d8 d1d8,580,102,75,808,backRankMate endgame mate mateIn2 short,https://lichess.org/YG64Xs5w/black#42,
Ko87s,2r3k1/5ppp/4p3/P3P3/8/3R2P1/3p2KP/8 b - - 1 31,c8c2 d3d8,500,98,91,1036,backRankMate endgame mate mateIn1 oneMove rookEndgame,https://lichess.org/ISRMYS7X/black#62,
gAX9L,8/4ppkp/6p1/2n1P3/5P2/8/r5PP/2R4K w - - 0 35,c1c5 a2a1 c5c1 a1c1,564,91,63,144,backRankMate endgame mate mateIn2 rookEndgame short,https://lichess.org/r6vDY4BJ#69,
e4YsR,3r3k/p4Qpp/1p6/2q5/8/P6P/1P4P1/5R1K b - - 0 24,c5b5 f7f8 d8f8 f1f8,535,99,90,642,backRankMate endgame mate mateIn2 sacrifice short,https://lichess.org/4gdTz2ys/black#48,
Tdby7,r1b1r1k1/ppp1qp2/6pp/3p2NR/3Q4/8/PPP2PPP/R5K1 w - - 2 18,h5h6 e7e1 a1e1 e8e1,582,87,79,240,backRankMate mate mateIn2 middlegame sacrifice short,https://lichess.org/0Udbidft#35,Italian_Game Italian_Game_Two_Knights_Defense
cgIJR,4r2k/1p3Qpp/p4p2/q1p5/4P3/2P5/1P4PP/4R1K1 b - - 3 28,a5b6 f7e8,585,80,100,144,backRankMate endgame hangingPiece mate mateIn1 oneMove,https://lichess.org/6GFmBQPN/black#56,
kUcz1,2rR3k/2P3pp/1p6/p3p3/8/8/6PP/7K b - - 2 33,c8d8 c7d8q,508,98,91,1189,advancedPawn backRankMate endgame mate mateIn1 oneMove promotion,https://lichess.org/4Y4GilgM/black#66,
9xE9l,3r2k1/5pbp/6p1/p1p5/Bp6/1P6/P1P1QPPP/3q2K1 w - - 0 25,e2d1 d8d1,541,93,72,554,backRankMate endgame mate mateIn1 oneMove,https://lichess.org/BF1BdJ4q#49,
Ozsyd,2r3k1/p4ppp/5q2/2R1b3/4b3/P3PNPP/1P1rQPK1/5R2 b - - 0 30,d2e2 c5c8 f6d8 c8d8,585,97,72,231,backRankMate hangingPiece mate mateIn2 middlegame short,https://lichess.org/VICA9Byb/black#60,
4N9Cm,1r3Q1k/6pp/pq6/2p5/4P3/1P1P4/P1P3PP/R4R1K b - - 2 24,b8f8 f1f8,592,86,60,220,backRankMate endgame mate mateIn1 oneMove queenRookEndgame,https://lichess.org/kZzxXy0q/black#48,
Tdxh1,2r5/p4ppk/1p5p/8/8/8/P4PPP/Q1q3K1 w - - 0 33,a1c1 c8c1,584,89,67,203,backRankMate endgame mate mateIn1 oneMove,https://lichess.org/C9GcxodK#65,
1TnAD,6k1/5ppb/p4n1p/1B3P2/6P1/P6P/1r6/2R3K1 b - - 0 35,b2b5 c1c8 f6e8 c8e8,558,96,93,245,backRankMate endgame mate mateIn2 short,https://lichess.org/s59Nrxce/black#70,
abTM6,5rk1/ppp3pp/6b1/2pPQ3/8/8/PP4PP/4Rq1K w - - 2 26,e1f1 f8f1,569,151,33,20,backRankMate endgame mate mateIn1 oneMove,https://lichess.org/5c8kI8eN#51,
0AO2l,6k1/p4pp1/7p/8/1P1B4/r2P4/5PPP/2R3K1 w - - 1 28,c1c3 a3a1 c3c1 a1c1,524,109,91,1165,backRankMate endgame mate mateIn2 short,https://lichess.org/boeOcqXC#55,
aWR40,rn1Q1rk1/pp3ppp/8/4p3/8/4PP2/PPP2P1P/3RK2R b K - 0 14,f8d8 d1d8,548,96,75,42,backRankMate endgame mate mateIn1 oneMove,https://lichess.org/6xS63Xg0/black#28,Englund_Gambit_Complex_Declined Englund_Gambit_Complex_Declined_Other_variations
1RTW4,3r2k1/p1p1r1p1/1pR2n1p/8/3P4/1P3B2/5PPP/R5K1 w - - 1 26,a1a7 e7e1,506,93,100,599,backRankMate endgame mate mateIn1 oneMove,https://lichess.org/294kfrHe#51,
45iWq,8/5kpp/pbPK4/7P/1P6/2P5/8/8 b - - 4 44,f7e8 c6c7 b6c7 d6c7,540,87,93,308,advancedPawn bishopEndgame crushing endgame short,https://lichess.org/DJY2McV6/black#88,
