PuzzleId,FEN,Moves,Rating,RatingDeviation,Popularity,NbPlays,Themes,GameUrl,OpeningTags
Ak743,r4r1k/1R4np/6pN/2PQ4/p7/2P5/5qPP/R5K1 w - - 0 33,g1h1 f2f1 a1f1 f8f1,555,87,76,95,backRankMate mate mateIn2 middlegame sacrifice short,https://lichess.org/48FeSXze#65,
CUq2x,r3r1k1/4qpp1/p2p3p/3R4/Q1P2Bn1/1P6/P4PPP/R5K1 w - - 4 22,h2h3 e7e1 a1e1 e8e1,563,106,93,503,kingsideAttack mate mateIn2 middlegame sacrifice short,https://lichess.org/0zctrzcc#43,
C4r5A,r5k1/p4ppp/4r3/3p4/P2Pp2P/R3PqP1/2Q2P2/2R2K2 b - - 4 27,e6g6 c2c8 a8c8 c1c8,586,88,74,424,backRankMate endgame mate mateIn2 sacrifice short,https://lichess.org/7ZTqlcpS/black#54,
w5rQJ,r5k1/pp3ppp/5n2/2PpR3/1P4r1/2P3Pq/P3QP1P/4R1K1 b - - 3 24,g4g6 e5e8 f6e8 e2e8 a8e8 e1e8,538,104,96,937,backRankMate long mate mateIn3 middlegame sacrifice,https://lichess.org/0n1dxoAO/black#48,
GJnj9,2r2k2/4Qppp/p7/B1p5/P1Pp4/1q1b1P2/6PP/4R1K1 b - - 5 27,f8g8 e7e8 c8e8 e1e8,569,95,75,106,backRankMate endgame mate mateIn2 sacrifice short,https://lichess.org/8yW5Plqj/black#54,
J7BKo,5rk1/6p1/3p1q2/p1p1p3/P3P1Pp/1P1P2bP/3QN1P1/1R5K w - - 3 33,e2c3 f6f1 b1f1 f8f1,573,108,76,372,endgame kingsideAttack mate mateIn2 sacrifice short,https://lichess.org/71QgQwXr#65,
79YVa,k2rR3/pp4p1/1q5p/5p2/3P1n2/P1Q2P1P/1B4P1/2R3K1 b - - 0 28,d8e8 c3c8 e8c8 c1c8,540,90,100,98,backRankMate endgame mate mateIn2 sacrifice short,https://lichess.org/TxKnvg8t/black#56,
dwNFy,4r1k1/1pp2ppp/p7/4q3/8/5Q2/PP3PPP/3R2K1 w - - 0 21,f3b7 e5e1 d1e1 e8e1,565,110,74,502,backRankMate endgame mate mateIn2 sacrifice short,https://lichess.org/QjUOuJOJ#41,
uOtY2,5rk1/ppp2ppp/2n5/3r4/7q/5P2/PPPBQ1Bb/R2KR3 b - - 1 16,f8d8 e2e8 d8e8 e1e8,518,96,85,214,backRankMate mate mateIn2 middlegame sacrifice short,https://lichess.org/ceZpn2nG/black#32,Russian_Game Russian_Game_Damiano_Variation
Mebmb,1q4k1/B4ppp/2p2n2/p2p4/8/P1P1QP2/2r3PP/4R1K1 b - - 3 23,b8b7 e3e8 f6e8 e1e8,599,90,73,147,backRankMate endgame mate mateIn2 sacrifice short,https://lichess.org/VSiDDpvX/black#46,
BqnUc,3qr1k1/5ppp/bpQ5/8/P1P5/1P3B2/5PPP/R5K1 w - - 1 21,a1d1 d8d1 f3d1 e8e1,586,92,93,1421,backRankMate endgame mate mateIn2 sacrifice short,https://lichess.org/EYLWPDtC#41,
r4B9r,2r3k1/p2q1p1p/1p1p2pB/2pP4/2Pb4/PP5P/4QPP1/4R1K1 b - - 0 28,d7f5 e2e8 c8e8 e1e8,548,85,80,67,endgame kingsideAttack mate mateIn2 sacrifice short,https://lichess.org/qTBylLxp/black#56,
hxFER,2B2r1k/pp4pp/1q3b2/3p4/3N4/2P1Q2P/PP4P1/4R1K1 b - - 0 25,f8c8 e3e8 c8e8 e1e8,521,105,80,737,backRankMate endgame mate mateIn2 sacrifice short,https://lichess.org/S3qFcOdt/black#50,
K0AJL,r1B5/1Q3rkp/p2p1qp1/4b3/8/1N5P/P1P3P1/4R2K w - - 1 24,b7a8 f6f1 e1f1 f7f1,564,100,94,795,mate mateIn2 middlegame sacrifice short,https://lichess.org/ouHsCga9#47,
9OXJ6,1k5r/p6r/Pp1Q4/1q2p3/6p1/6P1/6RP/3R3K b - - 1 35,b8a8 d6d8 h8d8 d1d8,537,93,98,678,endgame mate mateIn2 sacrifice short,https://lichess.org/g3qAQhK4/black#70,
Txfz3,3r2k1/1Q3pbp/p1Pq2p1/4p3/2P1P3/4B3/P4PPP/1R4K1 w - - 1 30,c6c7 d6d1 b1d1 d8d1,588,90,94,332,backRankMate endgame mate mateIn2 sacrifice short,https://lichess.org/wy6TOOxm#59,
uhZP7,2r3k1/1p3ppp/p1n3r1/4p3/5P1q/2P1Q3/P1P2PBP/R3R1K1 b - - 0 21,e5f4 e3e8 c8e8 e1e8,529,101,91,418,backRankMate mate mateIn2 middlegame sacrifice short,https://lichess.org/XoyfIKAZ/black#42,
vWu7O,5r1k/p5p1/5qp1/1pp5/2QnP3/1PN5/PB1P2PP/1R5K w - - 0 23,c4c5 f6f1 b1f1 f8f1,539,97,96,279,backRankMate mate mateIn2 middlegame sacrifice short,https://lichess.org/CkwsSNi0#45,
A1DCS,r5k1/5n1p/pp4p1/2pq1pP1/5P2/2BP3P/1P2Q2K/4R3 b - - 2 32,b6b5 e2e8 a8e8 e1e8,593,92,86,71,endgame mate mateIn2 sacrifice short,https://lichess.org/QP9AZ2gT/black#64,
UNV47,2r5/2rb4/1p2p1Q1/pP6/Pk1B4/8/1q3PPP/6K1 w - - 0 36,d4b2 c7c1 b2c1 c8c1,542,94,93,1488,backRankMate endgame mate mateIn2 sacrifice short,https://lichess.org/1Q83fYyC#71,
LNrwi,1kr5/7p/p2b1p2/3B4/8/1P1Q1P2/P5PP/2R4K w - - 3 29,d3a6 c8c1 a6f1 c1f1,599,94,71,353,endgame hangingPiece mate mateIn2 short,https://lichess.org/gCCbYq5u#57,
N1Kzz,2kr3r/p1p2ppp/2p1p3/8/4n3/2P5/P1P2PPP/R1B1R1K1 w - - 0 16,e1e4 d8d1 e4e1 d1e1,591,105,71,426,backRankMate endgame mate mateIn2 short,https://lichess.org/12lRDyJe#31,Scandinavian_Defense Scandinavian_Defense_Mieses-Kotroc_Variation
Iqiid,2r5/p2R4/8/1P2R3/P7/1k4p1/6P1/6K1 w - - 1 41,d7a7 c8c1 e5e1 c1e1,598,99,57,163,endgame mate mateIn2 rookEndgame short,https://lichess.org/mO9QmLbl#81,
NK82E,2r2k2/1R2pp1p/3p2pP/4n3/4P3/2R2P2/6PK/8 b - - 0 31,c8c3 b7b8 c3c8 b8c8,538,90,73,31,endgame mate mateIn2 short,https://lichess.org/lAjuAzyj/black#62,
ee76y,3r4/pp4kp/2p3p1/4p3/P7/1n4R1/5RPP/7K w - - 0 38,g3b3 d8d1 f2f1 d1f1,572,100,62,241,backRankMate endgame mate mateIn2 rookEndgame short,https://lichess.org/L5r3a2Kt#75,
rzctO,2kr3r/ppp3pp/8/3q1p2/1n6/N4N2/PP3PQP/2R2RK1 w - - 2 19,f1d1 d5d1 c1d1 d8d1,565,96,89,809,crushing kingsideAttack middlegame short,https://lichess.org/w5iKii48#37,Russian_Game Russian_Game_Classical_Attack
fUmRr,4r1k1/1p3ppp/2p5/8/5P2/1B6/5qPP/5R1K w - - 0 30,f1f2 e8e1 f2f1 e1f1,595,102,76,212,backRankMate endgame mate mateIn2 short,https://lichess.org/Fs0Y98UB#59,
2cq5X,8/4K1k1/6P1/5P2/5n2/8/8/8 b - - 18 64,f4h3 f5f6 g7g6 f6f7,564,86,71,476,advancedPawn crushing endgame knightEndgame master short,https://lichess.org/a7ZS929s/black#128,
S5ajv,1k6/ppp3p1/8/3rP1P1/8/7R/PP6/2K5 b - - 0 28,d5e5 h3h8 e5e8 h8e8,588,104,79,108,backRankMate endgame mate mateIn2 rookEndgame short,https://lichess.org/14p78Pgs/black#56,
NYvwY,1k1q2r1/pp2R1Pp/8/8/2Qp4/7P/PPP2PP1/6K1 w - - 1 25,c4c7 d8c7 e7c7 b8c7,567,96,95,734,crushing endgame short,https://lichess.org/JzEo7Yz2#49,
90hmK,4r1k1/1pp1q1pp/p4p2/3p4/P2P4/1nPP2B1/3Q1PPP/1R4K1 w - - 5 22,d2b2 e7e1 b1e1 e8e1,592,81,100,138,backRankMate endgame mate mateIn2 sacrifice short,https://lichess.org/FDxIvey4#43,
ApRGu,8/k7/P7/1P3p2/4pK2/8/8/8 w - - 5 51,f4f5 e4e3 f5e4 e3e2,569,97,91,751,advancedPawn crushing endgame master masterVsMaster pawnEndgame short,https://lichess.org/pFgPmpDW#101,
h2q1d,6k1/pp3p1p/2p3p1/4P3/2Q5/PP2q1P1/5RKP/3r4 b - - 5 28,e3e5 c4f7 g8h8 f7f8,598,84,98,1202,endgame mate mateIn2 short,https://lichess.org/Ht2Xru0C/black#56,
kZCBW,1r4k1/2p2pp1/p4np1/6N1/1P1R4/8/1P4PP/6K1 b - - 2 29,b8b5 d4d8 f6e8 d8e8,574,97,76,275,endgame mate mateIn2 short,https://lichess.org/CIhBVKBM/black#58,
2uKfW,6k1/5ppp/8/8/1n1pr1PP/5NK1/5P2/1R6 b - - 1 28,b4d5 b1b8 e4e8 b8e8,549,100,86,755,backRankMate endgame mate mateIn2 short,https://lichess.org/6rGzHrmi/black#56,
xTLjT,b4rk1/p5p1/Pp2R2p/4P3/5r2/2P5/1B4PP/R6K w - - 0 33,b2a3 f4f1 a1f1 f8f1,518,113,96,679,endgame mate mateIn2 short,https://lichess.org/a7035FUO#65,
6SIm9,3r3k/2R3pp/5p2/4p3/2p5/6P1/5P2/6K1 b - - 1 35,d8d4 c7c8 d4d8 c8d8,567,99,78,169,backRankMate endgame mate mateIn2 rookEndgame short,https://lichess.org/9WPwJYKx/black#70,
L6lyY,2k2r2/p4pB1/7p/3Q2p1/5r2/2N5/PPP2qPP/1R4K1 w - - 0 23,g1h1 f2f1 b1f1 f4f1,512,94,86,207,backRankMate mate mateIn2 middlegame sacrifice short,https://lichess.org/RVbJwRSi#45,
WaoYK,4r1k1/p1p1Q1pp/1p2b3/4N3/8/7P/PP3PP1/3R2K1 b - - 0 25,e8e7 d1d8 e7e8 d8e8,522,97,95,1393,endgame mate mateIn2 short,https://lichess.org/CxfVfCZ7/black#50,
pJvd2,2r2k2/pR3pp1/3K2b1/8/1P6/P1P5/7P/8 b - - 0 47,c8c3 b7b8 c3c8 b8c8,599,106,58,275,endgame mate mateIn2 short,https://lichess.org/McCxpFiS/black#94,
dpX89,4b3/2k5/4P3/1pK5/1P3p2/5B2/8/8 w - - 0 59,c5d5 e8c6 d5e5 c6f3,564,80,74,153,bishopEndgame crushing endgame short skewer,https://lichess.org/EDPvipTr#117,
bVT82,3r1k2/5Pr1/pp1P3R/8/2P5/1P4PK/P7/8 b - - 0 41,g7f7 h6h8 f8g7 h8d8,569,110,81,210,crushing endgame rookEndgame short skewer,https://lichess.org/uzyFmRn4/black#82,
wQ6ZB,8/P4k2/r4p2/8/1K6/8/7R/8 b - - 4 59,a6a7 h2h7 f7e6 h7a7,580,86,57,99,crushing endgame rookEndgame short skewer,https://lichess.org/CTqwmUfM/black#118,
2V8UH,8/1r3k2/5P2/1P4KR/6P1/6P1/r3R3/8 b - - 0 49,a2e2 h5h7 f7e6 h7b7,596,86,97,1106,crushing endgame rookEndgame short skewer,https://lichess.org/GCUZa5k5/black#98,
Aw2LS,4k2r/1bp3pp/p4p2/P1P1p3/8/B2P4/5PPP/1R4K1 b k - 1 22,b7c6 b1b8 e8d7 b8h8,596,92,86,587,advantage endgame short skewer,https://lichess.org/oDXuXVqr/black#44,
UyKJr,2b5/p7/1p4k1/2p1p2p/2p1P1PP/2P2KP1/PP6/3N4 w - - 0 35,g4g5 c8g4 f3f2 g4d1,511,97,74,593,advantage endgame short skewer,https://lichess.org/6402y7AE#69,
WjFqo,8/4k1pp/1R6/4p3/4P1PP/1p2K3/4P3/6r1 w - - 1 46,b6b3 g1g3 e3d2 g3b3,597,97,90,923,crushing endgame master rookEndgame short skewer,https://lichess.org/UvuyWIcF#91,
gGWC9,1r6/p3k2R/2p1p3/3pP3/1P1P4/4K3/8/8 b - - 1 49,e7e8 h7h8 e8d7 h8b8,566,95,81,183,crushing endgame master rookEndgame short skewer,https://lichess.org/jIoqPfOk/black#98,
aFzYk,r4k1Q/ppp2p2/3p2p1/8/2PqrP2/KP6/P7/R6R b - - 3 34,d4h8 h1h8 f8e7 h8a8,530,94,95,1060,crushing endgame short skewer,https://lichess.org/8VLqZ4DR/black#68,
TChvH,r2R1k1r/6p1/p4p2/1pp3p1/4P3/8/PPP2PPP/2KR4 b - - 1 22,a8d8 d1d8 f8e7 d8h8,536,102,82,323,crushing endgame rookEndgame short skewer,https://lichess.org/wDVg0ced/black#44,
MscO4,8/pp3kb1/2b1p1p1/3pP1P1/1P1P1P2/8/P7/1K1R4 w - - 1 31,b1c2 c6a4 c2c1 a4d1,584,95,97,1185,crushing endgame short skewer,https://lichess.org/TLahSitm#61,
R1DZN,5k1r/p2R2p1/1pn1p3/4N3/4P1p1/2N1P3/PPP5/1K6 b - - 0 27,c6e5 d7d8 f8f7 d8h8,575,98,82,645,crushing endgame short skewer,https://lichess.org/AFn9a0fR/black#54,
aRUya,1R6/1P6/3k4/5pp1/7p/2r4P/6PK/8 b - - 0 43,d6c7 b8c8 c7b7 c8c3,586,87,96,867,crushing endgame rookEndgame short skewer,https://lichess.org/d7HYHgzF/black#86,
6k7Af,r5k1/1p1bnppp/1Pp1p3/8/2BPP1PP/1nN1B3/2p5/2K4R w - - 6 23,c4b3 a8a1 c1c2 a1h1,575,94,92,1457,advantage middlegame short skewer,https://lichess.org/n76f0eUj#45,
cNJAt,rnr5/3kp1pp/p4n2/B7/2RN4/4P3/1P3PPP/4K2R w K - 1 23,c4b4 c8c1 e1e2 c1h1,597,103,80,569,advantage middlegame short skewer,https://lichess.org/tOBckEvL#45,
TdgiA,2r3k1/pp3ppp/4p3/1P1p4/8/8/3N1PPP/Q1q1K2R w K - 1 22,a1c1 c8c1 e1e2 c1h1,564,104,75,334,crushing endgame short skewer,https://lichess.org/Y0xrofRV#43,
IOqj3,8/8/1P2k3/4Pp1R/6p1/1r6/5K2/8 b - - 0 49,b3b6 h5h6 e6d5 h6b6,579,100,80,791,crushing endgame rookEndgame short skewer,https://lichess.org/kofFCBl1/black#98,
LeB6j,6R1/kr6/8/8/3K2p1/8/8/8 w - - 6 65,g8g4 b7b4 d4c5 b4g4,577,84,96,244,crushing endgame rookEndgame short skewer,https://lichess.org/XpEJGQbY#129,
UautT,5n2/5k2/p3b1p1/Pp2p2p/1P2P2P/3KB1P1/8/5B2 w - - 6 59,e3d2 e6c4 d3e3 c4f1,575,93,65,596,crushing endgame master short skewer,https://lichess.org/FNck7DZQ#117,
Dw7Ew,7r/1RPkpp2/3p4/7p/7P/4PP2/4K3/8 b - - 3 44,d7c8 b7b8 c8c7 b8h8,588,106,74,194,crushing endgame master masterVsMaster rookEndgame short skewer,https://lichess.org/NSkxGhXp/black#88,
9PJWA,r5rk/p3q1np/1p1p1n2/1PpP2N1/1P2ppB1/P6P/2Q2PRK/6R1 b - - 1 28,e7e5 g5f7,589,84,97,1385,master mate mateIn1 middlegame oneMove smotheredMate,https://lichess.org/zVtvVNSU/black#56,
iKmcq,r1b2rk1/pp1p1pbp/3Q2p1/1N2p3/PB6/6Pn/1PP1PnBP/R4RNK w - - 1 17,f1f2 h3f2,561,89,62,124,hangingPiece kingsideAttack mate mateIn1 middlegame oneMove smotheredMate,https://lichess.org/rdzC6slJ#33,Indian_Defense Indian_Defense_Przepiorka_Variation
32iri,5rk1/5ppp/2r5/p3p3/1pp1P3/6Pn/PP2QnBP/RN4RK w - - 1 26,e2f2 h3f2,575,87,100,198,hangingPiece kingsideAttack mate mateIn1 middlegame oneMove smotheredMate,https://lichess.org/qPJ4OhcT#51,
skQwV,3q2rk/5prp/8/p3N3/1p2P3/6P1/1Q5P/4R2K b - - 1 37,d8g5 e5f7,570,96,82,935,endgame mate mateIn1 oneMove pin smotheredMate,https://lichess.org/EUaxh5up/black#74,
xUg63,r7/1p1k2pp/p3p3/4p3/3bP1n1/3Q4/PP4PP/2R2RqK w - - 4 23,f1g1 g4f2,556,107,63,441,endgame mate mateIn1 oneMove smotheredMate,https://lichess.org/Fjw1nFlh#45,
IkG0V,4r1rk/p4Npp/8/3pN3/3P4/3K4/PP3q2/R1B1R3 b - - 1 32,f2f7 e5f7,592,97,76,451,hangingPiece mate mateIn1 middlegame oneMove smotheredMate,https://lichess.org/Wuz12OWH/black#64,
Fs1Ba,r1bq1rQk/ppp1b1pp/2n2n2/4p1N1/4p3/2PPB3/PP1N1PPP/R3K2R b KQ - 3 11,f8g8 g5f7,574,93,71,148,mate mateIn1 middlegame oneMove smotheredMate,https://lichess.org/7UwuODeN/black#22,Bishops_Opening Bishops_Opening_Berlin_Defense
K1962,rn3rQk/p2qp1bp/1p1p4/2p3Np/8/2P3P1/PP3PK1/R1B1R3 b - - 4 17,f8g8 g5f7,556,88,83,359,mate mateIn1 middlegame oneMove smotheredMate,https://lichess.org/hEFjgbDT/black#34,Owen_Defense Owen_Defense_Other_variations
8tf8N,2r2r1k/p5pp/2b2p2/2p2P2/4P3/2Pn1N2/P5BP/R5RK w - - 0 26,f3d2 d3f2,507,102,86,492,mate mateIn1 middlegame oneMove smotheredMate,https://lichess.org/VtdZCPDu#51,
1BhEH,r1b2Q2/p4p1k/1p2pPpp/8/2B1P1n1/2NP4/PPP3PP/R4RqK w - - 3 20,f1g1 g4f2,521,90,83,322,mate mateIn1 middlegame oneMove smotheredMate,https://lichess.org/Ln6RrKfC#39,
5Ex9L,2r2rk1/5ppp/8/p7/4pP2/1Q5n/PPP3PP/RN2R1qK w - - 8 22,e1g1 h3f2,580,108,86,294,mate mateIn1 middlegame oneMove smotheredMate,https://lichess.org/g4o9DWkP#43,
CJkVO,r3r1k1/pp3pp1/1qpb3p/3p4/3Pn3/1PPQ1PP1/P4nBP/R1B2RNK w - - 1 19,f1f2 e4f2,501,85,83,308,hangingPiece kingsideAttack mate mateIn1 middlegame oneMove smotheredMate,https://lichess.org/eBbzvXaK#37,
ZOsDO,r1bq1r1k/ppp1n1bp/3p1n2/3PppN1/2P5/2N4P/PP2BPP1/R1BQ1RK1 b - - 6 12,f8g8 g5f7,596,97,86,483,mate mateIn1 oneMove opening smotheredMate,https://lichess.org/RiGZpdC0/black#24,
7D9gs,r4rQk/ppp3pp/2p5/5bN1/8/3P2P1/1q2B2P/n2K3R b - - 5 22,f8g8 g5f7,514,99,94,1502,mate mateIn1 middlegame oneMove smotheredMate,https://lichess.org/m6VXhOId/black#44,
AosR4,4b1rk/p2Q2pp/8/6N1/7q/6NP/PP3PP1/5RK1 b - - 0 28,e8d7 g5f7,558,100,86,559,endgame mate mateIn1 oneMove smotheredMate,https://lichess.org/HSyX4JeV/black#56,
hY5dg,r3r1k1/5ppp/p1n1b3/1p1p4/6n1/1PN5/PBQNB1PP/3R1RqK w - - 2 18,f1g1 g4f2,521,98,85,475,mate mateIn1 middlegame oneMove smotheredMate,https://lichess.org/28DmwX1z#35,Queens_Pawn_Game Queens_Pawn_Game_Krause_Variation
y5d1H,rnb3qr/4bk2/p2p4/2pPp3/2P1Ppnp/2N5/P1B1N1PP/R1BQ2RK w - - 0 18,e2f4 g4f2,582,100,77,424,mate mateIn1 middlegame oneMove smotheredMate,https://lichess.org/plTiAs3v#35,Benoni_Defense Benoni_Defense_Old_Benoni
3B8K1,r3r1k1/6bp/6p1/1p2p3/1Pp2p2/2P4n/P1Q1B1PP/2B1R1qK w - - 6 35,e1g1 h3f2,590,101,76,380,mate mateIn1 middlegame oneMove smotheredMate,https://lichess.org/wc3g0bTg#69,
n9cJU,r3k2r/pp4p1/2n2p2/3p1b1p/P4Pn1/3p4/1P1N2PP/R2Q1RbK w kq - 0 18,f1g1 g4f2,516,91,89,675,mate mateIn1 middlegame oneMove smotheredMate,https://lichess.org/4BMHEFtX#35,Bird_Opening Bird_Opening_Dutch_Variation
iWHft,1B4k1/1B3pp1/2N1pb1p/8/P7/3n4/4b1PP/5R1K w - - 1 30,f1g1 d3f2,597,102,94,266,master mate mateIn1 middlegame oneMove smotheredMate,https://lichess.org/h7FgGIZP#59,
XPKjf,8/6kp/6p1/4Kpn1/8/P7/8/7R w - - 4 54,h1g1 g5f3 e5d6 f3g1,546,114,83,725,crushing endgame fork master masterVsMaster short superGM,https://lichess.org/iMuZqqJ0#107,
RnnA4,6k1/5pp1/1N2p2p/4b3/6P1/1P3K1P/5P2/8 b - - 1 46,g8f8 b6d7 f8e7 d7e5,509,113,83,687,crushing endgame fork master masterVsMaster short superGM,https://lichess.org/hlNUyK18/black#92,
YMd85,5N2/pp1k2p1/6bp/8/2KN3r/PP6/8/8 b - - 1 46,d7e7 f8g6 e7f6 g6h4,501,110,81,1103,advantage endgame fork hangingPiece master masterVsMaster short superGM,https://lichess.org/8ejQQ3cf/black#92,
xsbmQ,5r2/6k1/4Q1p1/5pP1/8/8/5PK1/8 w - - 1 65,e6f6 f8f6 g5f6 g7f6,591,109,69,364,crushing endgame master masterVsMaster short superGM,https://lichess.org/OHp8E4Nb#129,
uqiqx,1r4k1/1N3pp1/3Rbn2/6p1/8/7P/5PP1/1B4K1 b - - 0 34,b8b7 d6d8 f6e8 d8e8,574,114,74,801,endgame master masterVsMaster mate mateIn2 short superGM,https://lichess.org/QsO2AWJU/black#68,
UIRx0,8/2K5/1P6/5b2/2k5/8/8/8 b - - 0 59,c4c5 b6b7 f5e4 b7b8q,543,106,84,935,advancedPawn bishopEndgame crushing endgame master masterVsMaster promotion short superGM,https://lichess.org/L6sU7Rac/black#118,
QolDo,8/8/4n3/5pk1/8/5KP1/1R6/8 w - - 0 47,b2b5 e6d4 f3e3 d4b5,511,110,79,1070,crushing endgame fork master masterVsMaster short superGM,https://lichess.org/D7Ilw56o#93,
n4eEg,8/p1p3p1/1p1rR1nk/7p/4B2P/2P2PK1/PP6/8 w - - 2 33,e6g6 d6g6 e4g6 h6g6,578,89,85,273,crushing endgame master short superGM,https://lichess.org/RMT9ID6t#65,
RhysM,8/5qk1/6p1/5pQ1/1P2N2p/K2R4/P3r3/8 w - - 0 51,e4d6 e2a2,567,91,95,2071,endgame master masterVsMaster mate mateIn1 oneMove superGM,https://lichess.org/6yP3JyCC#101,
EDmbR,6k1/p1Q2ppp/8/pq3n2/8/P7/1B3PPP/4N1K1 b - - 0 25,b5b2 c7d8,531,94,100,339,backRankMate endgame master masterVsMaster mate mateIn1 oneMove superGM,https://lichess.org/Zs567wGM/black#50,
kO8at,8/2p3rk/1b6/8/P1PPRp2/2n2N1P/5PP1/6K1 w - - 1 40,e4f4 c3e2 g1f1 e2f4,508,110,83,804,advantage endgame fork master masterVsMaster short superGM,https://lichess.org/AGzFqkxR#79,
Hw9qa,rbb2r1k/1p4p1/4Pq1p/p1pp2N1/6Q1/2P5/PPBB2P1/R3R2K w - - 2 31,e1f1 f6f1 a1f1 f8f1,518,109,85,1297,kingsideAttack master mate mateIn2 middlegame short superGM,https://lichess.org/3vA7cnKb#61,
Nj46L,2kr4/2p4p/np1r3P/8/1P4b1/K2N2R1/3Q4/8 w - - 1 55,g3g4 d6d3 d2d3 d8d3,596,105,82,957,crushing endgame fork master short superGM,https://lichess.org/5VD8eSgy#109,
SY3tS,3r2k1/ppq1bp1Q/2p3B1/4p3/2P3r1/7P/PP3PP1/R5K1 b - - 5 24,g8f8 h7f7,514,103,92,1750,master mate mateIn1 middlegame oneMove superGM,https://lichess.org/tRB0mVyN/black#48,
HWX1d,3k4/3rr3/1p4P1/pP1Qp3/2P5/3P1P2/4K3/8 w - - 3 55,d5g8 e7e8 g8e8 d8e8,570,84,88,277,crushing endgame master queenRookEndgame short trappedPiece,https://lichess.org/8AkGkEOH#109,
CaKRv,r1b3r1/ppp1k1bp/5q2/3pp1BB/4p2Q/3P4/PP1K1PPP/nN5R w - - 0 15,g5f6 g7f6 h4f6 e7f6,570,84,68,125,advantage middlegame short trappedPiece,https://lichess.org/QwWbWNLB#29,Nimzowitsch_Defense Nimzowitsch_Defense_Colorado_Countergambit
E16tz,r7/rb1nk3/3RN3/Rp1P1p1p/1P3P2/7P/5NP1/5K2 w - - 1 39,a5a7 a8a7 d6d7 e7d7,575,88,82,289,advantage master middlegame short trappedPiece,https://lichess.org/RJNyPDGt#77,
ghZiM,rn1q1b1r/ppp1k2p/3p1p1n/4p1BQ/2B1P1bN/3P4/PPP2PPP/RN2K2R w KQ - 1 8,g5f6 e7f6 h5g4 h6g4,587,92,77,1340,crushing hangingPiece opening short trappedPiece,https://lichess.org/D3EgefWX#15,Philidor_Defense Philidor_Defense_Other_variations
xOtCx,r1b1r2Q/ppp1qkp1/3p1b1p/8/2PP1p2/5N2/PP3PPP/1BR2RK1 w - - 6 18,b1g6 f7g6 h8e8 e7e8,502,91,100,392,crushing hangingPiece middlegame short trappedPiece,https://lichess.org/7aPaWQ6j#35,Dutch_Defense Dutch_Defense_Other_variations
uJCg9,8/8/2k3p1/4K1Pp/1pp1P2P/8/1P6/8 w - - 0 41,e5f6 c4c3 b2c3 b4c3 f6g6 c3c2 g6h7 c2c1q,593,84,96,1882,advancedPawn crushing endgame master pawnEndgame promotion veryLong,https://lichess.org/j80ccb4K#81,
cP196,8/8/8/5bKp/5P2/5k2/8/8 w - - 0 62,g5f5 h5h4 f5e5 h4h3 f4f5 h3h2 f5f6 h2h1q,587,90,80,158,advancedPawn crushing endgame pawnEndgame promotion quietMove veryLong,https://lichess.org/F9jaJXbr#123,
txEbI,8/8/8/4p1K1/4k2P/8/8/8 b - - 0 67,e4d4 h4h5 e5e4 h5h6 e4e3 h6h7 e3e2 h7h8q,591,106,81,168,advancedPawn crushing endgame pawnEndgame promotion quietMove veryLong,https://lichess.org/svuDWYgX/black#134,
wa8R4,8/p7/8/1p6/1k5P/6K1/8/8 b - - 0 46,a7a5 h4h5 b4a4 h5h6 b5b4 h6h7 b4b3 h7h8q,507,83,77,130,advancedPawn crushing endgame pawnEndgame promotion quietMove veryLong,https://lichess.org/zEpydAbg/black#92,
TwO3E,8/8/1p6/pP1K4/P5kp/6p1/6B1/8 w - - 2 48,d5c6 h4h3 g2h3 g4h3 c6b6 g3g2 b6a6 g2g1q,583,86,95,1402,advancedPawn bishopEndgame crushing endgame promotion veryLong,https://lichess.org/tEPKsiK4#95,
GAOl3,8/6p1/8/8/P7/4pk2/8/4K3 b - - 0 60,g7g5 a4a5 g5g4 a5a6 g4g3 a6a7 g3g2 a7a8q,528,97,79,197,advancedPawn crushing endgame pawnEndgame promotion quietMove veryLong,https://lichess.org/Hyp3iWt4/black#120,
67QkR,8/8/8/1pR4r/1P6/3k4/5K2/8 b - - 4 58,h5c5 b4c5 b5b4 c5c6 b4b3 c6c7 b3b2 c7c8q,589,92,93,118,advancedPawn crushing endgame promotion veryLong,https://lichess.org/TY1kBubZ/black#116,
Oh0Zc,8/8/2K4p/8/1P6/7k/8/8 b - - 0 54,h3g3 b4b5 h6h5 b5b6 h5h4 b6b7 h4h3 b7b8q,549,113,100,35,advancedPawn crushing endgame pawnEndgame promotion quietMove veryLong,https://lichess.org/j1lFFhcs/black#108,
rQYI1,8/8/2K3k1/7p/8/8/1P6/8 w - - 0 60,b2b4 h5h4 b4b5 h4h3 b5b6 h3h2 c6c7 h2h1q,594,110,58,230,advancedPawn crushing endgame pawnEndgame promotion quietMove veryLong,https://lichess.org/rZg0KvlJ#119,
Jojrp,8/5p1p/6p1/1K2p3/P4k2/5P2/7P/8 b - - 2 44,f4f3 a4a5 e5e4 a5a6 e4e3 a6a7 e3e2 a7a8q,596,98,90,542,advancedPawn crushing endgame pawnEndgame promotion quietMove veryLong,https://lichess.org/CDHIIbzl/black#88,
zv50I,8/8/8/7p/5P2/6k1/4K3/8 b - - 0 56,g3g2 f4f5 h5h4 f5f6 h4h3 f6f7 h3h2 f7f8q,597,108,74,346,advancedPawn crushing endgame pawnEndgame promotion quietMove veryLong,https://lichess.org/okTjLrLj/black#112,
WNn5U,8/3k4/8/2p1K3/7P/8/8/8 w - - 0 60,e5f6 c5c4 h4h5 c4c3 h5h6 c3c2 h6h7 c2c1q,590,92,98,644,advancedPawn crushing endgame pawnEndgame promotion quietMove veryLong,https://lichess.org/PAGto11g#119,
Jb6jS,8/K7/7p/8/6k1/P7/8/8 w - - 1 57,a7b6 h6h5 a3a4 h5h4 a4a5 h4h3 a5a6 h3h2 b6c7 h2h1q,587,95,78,58,advancedPawn crushing endgame master pawnEndgame promotion quietMove veryLong,https://lichess.org/TQwrGYPU#113,
guGok,8/8/2K4p/8/8/2P5/8/6k1 w - - 0 44,c6d5 h6h5 c3c4 h5h4 c4c5 h4h3 c5c6 h3h2,551,108,82,471,advancedPawn crushing endgame pawnEndgame quietMove veryLong,https://lichess.org/ch1Q2MDe#87,
eGf6p,8/2p5/2p3K1/8/p6P/P7/1k6/8 b - - 1 37,b2a3 h4h5 a3a2 h5h6 a4a3 h6h7 a2b1 h7h8q,593,86,71,120,advancedPawn crushing endgame master pawnEndgame promotion quietMove veryLong,https://lichess.org/O3Uh64H1/black#74,
0hGmm,8/8/1K6/5k1p/1P6/8/8/8 w - - 0 64,b6c6 h5h4 c6c7 h4h3 b4b5 h3h2 b5b6 h2h1q,536,101,95,814,advancedPawn crushing endgame pawnEndgame promotion quietMove veryLong,https://lichess.org/0ka5OOx5#127,
EFfJ7,8/8/1p6/p1k5/P5K1/7P/8/8 b - - 2 54,c5b4 h3h4 b4a4 h4h5 b6b5 h5h6 b5b4 h6h7 b4b3 h7h8q,538,91,91,593,advancedPawn crushing endgame pawnEndgame promotion quietMove veryLong,https://lichess.org/JkOEykKi/black#108,
mgkCZ,8/8/K7/6p1/1P6/6k1/8/8 b - - 1 42,g3h2 b4b5 h2h1 b5b6 g5g4 b6b7 g4g3 b7b8q,567,96,67,149,advancedPawn crushing endgame pawnEndgame promotion quietMove veryLong,https://lichess.org/Xh4vCtsI/black#84,
dgTrV,8/8/8/3p4/1P2k1KP/8/6P1/8 w - - 2 49,g4h5 d5d4 h5g6 d4d3 h4h5 d3d2 h5h6 d2d1q,554,100,93,629,advancedPawn crushing endgame pawnEndgame promotion quietMove veryLong,https://lichess.org/eEfuUH7j#97,
1Of6Q,8/6p1/7p/2p5/PK1k1PPP/8/8/8 w - - 0 40,b4b5 c5c4 a4a5 c4c3 a5a6 c3c2 a6a7 c2c1q,532,90,81,445,advancedPawn crushing endgame pawnEndgame promotion quietMove veryLong,https://lichess.org/DynFd9CB#79,
ZO2Kw,8/7p/5p2/8/5P2/r5NK/1R3k1P/3q4 b - - 8 47,f2g1 b2g2,552,92,98,411,endgame mate mateIn1 oneMove vukovicMate,https://lichess.org/PGKl6Icf/black#94,
IPumF,5r2/pp6/2p4p/3p1rk1/2nP1N2/P1P1P2P/5K2/1R4R1 b - - 4 25,g5h4 g1g4,521,97,97,271,endgame mate mateIn1 oneMove vukovicMate,https://lichess.org/6jrDrYah/black#50,
sbU8U,5rk1/R4ppp/p3pn2/1p1b4/1P6/5B1P/P1P2PPN/6K1 b - - 5 23,f8a8 a7a8 d5a8 f3a8,568,96,85,450,crushing endgame short xRayAttack,https://lichess.org/osT5qYgp/black#46,
gcoyu,5rk1/ppp5/7p/5Rp1/2N5/1PPQ3R/6PP/q6K w - - 1 28,d3f1 a1f1 f5f1 f8f1,557,93,89,1384,backRankMate endgame mate mateIn2 short xRayAttack,https://lichess.org/iBM41hwt#55,
rVpVt,4Q2k/p4rpp/8/P1p5/3p3P/6P1/2q2r2/5RK1 b - - 1 40,f7f8 e8f8 f2f8 f1f8,592,97,79,473,backRankMate endgame mate mateIn2 short xRayAttack,https://lichess.org/dsFjUxmI/black#80,
F1iTb,r5k1/p4ppp/1p1p1q2/1QpPr3/2P3b1/6P1/PP3PP1/R3RBK1 b - - 1 20,a8e8 b5e8 e5e8 e1e8,594,84,97,975,backRankMate mate mateIn2 middlegame short xRayAttack,https://lichess.org/gJaoGg0k/black#40,
bdd2W,6k1/3q1p2/Qp2p2p/p2pB1p1/1r1Pn3/2r1P3/P4PPP/R1R3K1 b - - 1 23,d7c8 a6c8 c3c8 c1c8,532,91,85,234,advantage middlegame short xRayAttack,https://lichess.org/C2pVs1T3/black#46,
U4Ity,3Q2k1/5ppp/8/1p3P2/2p1qB2/4r2P/1b4P1/4R2K b - - 3 32,e4e8 d8e8 e3e8 e1e8,583,101,92,718,backRankMate endgame mate mateIn2 short xRayAttack,https://lichess.org/yEaMPQS1/black#64,
6f2Ty,R6k/6pp/2p3r1/2P1p1q1/4Pp2/3r1P1P/1P1R2P1/6K1 b - - 1 33,g5d8 a8d8 d3d8 d2d8,596,91,63,73,backRankMate endgame mate mateIn2 short xRayAttack,https://lichess.org/qgg1fNpL/black#66,
7RulM,4r1k1/1p3p1p/p2p2p1/8/4R3/1PQ5/P1P2PPP/3q2K1 w - - 0 22,c3e1 d1e1 e4e1 e8e1,556,90,96,1147,backRankMate endgame mate mateIn2 short xRayAttack,https://lichess.org/pTOVY8mX#43,
vAusQ,3R2k1/4rppp/p4q2/1pp1r3/8/1P2Q2P/P1P3P1/3R2K1 b - - 1 23,e7e8 d8e8 e5e8 e3e8,593,82,100,164,endgame mate mateIn2 short xRayAttack,https://lichess.org/WUTL80n7/black#46,
jvG5e,r5k1/1p3p1p/6p1/1P2n3/4P3/P1Q5/1P1p1qP1/3R3K b - - 1 31,f2e1 d1e1 d2e1q c3e1,537,83,98,994,advantage endgame short xRayAttack,https://lichess.org/l8fuRCec/black#62,
2OypE,4Q2k/ppq3pp/5rb1/8/2pP4/2P4P/PP3rPN/4RRK1 b - - 1 31,g6e8 e1e8 f6f8 e8f8 f2f8 f1f8,582,98,82,487,backRankMate long mate mateIn3 middlegame xRayAttack,https://lichess.org/1jXCOcyj/black#62,
6G3oD,k2r4/1p4p1/2b5/5B2/3R2P1/8/3R1P1P/2r3K1 w - - 1 40,d2d1 c1d1 d4d1 d8d1,580,80,81,176,endgame mate mateIn2 short xRayAttack,https://lichess.org/zbs70MkB#79,
fCRTm,8/8/4k2p/p2pp1p1/1p1PP1P1/1P2K2P/P7/8 w - - 0 35,e4d5 e6d5 d4e5 d5e5,580,108,77,365,crushing endgame pawnEndgame short zugzwang,https://lichess.org/znaLXCRm#69,
ZkBT8,5k2/8/4p1p1/3pP2P/3P2K1/8/8/8 b - - 0 52,g6h5 g4h5 f8g7 h5g5,577,92,83,399,crushing defensiveMove endgame master masterVsMaster pawnEndgame short zugzwang,https://lichess.org/Jc02ltHC/black#104,
3DRw3,8/5R2/7p/4p1kP/4P1P1/1r4K1/8/8 w - - 2 42,f7f3 b3f3 g3f3 g5h4,599,86,86,219,crushing endgame master rookEndgame short zugzwang,https://lichess.org/uj1AzHWB#83,
mTxDW,8/8/p1k1p1p1/P3P1P1/2K5/8/8/8 b - - 0 42,c6c7 c4c5 c7d7 c5b6,515,90,100,158,crushing endgame pawnEndgame short zugzwang,https://lichess.org/n7UUUvLE/black#84,
Wqcdo,8/2k5/1p1p4/p2Pp1p1/P1K1P1Pp/7P/8/8 b - - 2 65,c7b7 c4b5 b7a7 b5c6,579,111,66,150,crushing endgame pawnEndgame short zugzwang,https://lichess.org/I8Ezei43/black#130,
X6A4u,8/8/2p1p1k1/p1PpP2p/P2P1K1P/8/8/8 w - - 0 48,f4f3 g6f5 f3e3 f5g4,535,91,55,106,crushing endgame pawnEndgame short zugzwang,https://lichess.org/jitqKA4c#95,
vwi0G,8/8/4k1p1/1p3pP1/1P3P1p/4K2P/8/8 w - - 2 38,e3d3 e6d5 d3e3 d5c4,543,102,86,232,crushing endgame master pawnEndgame short zugzwang,https://lichess.org/A7dP9jko#75,
CjqDz,8/8/4p3/1k2P2p/1p1K2pP/1P4P1/8/8 w - - 1 43,d4e4 b5c5 e4e3 c5d5 e3d3 d5e5,591,93,94,1155,crushing endgame long pawnEndgame zugzwang,https://lichess.org/bf1RgjWt#85,
XhmCc,8/2b1B3/8/1p1k1p2/1P3Pp1/3K2P1/8/8 b - - 0 48,c7d6 e7d6 d5d6 d3d4 d6e6 d4c5,586,84,100,206,bishopEndgame crushing endgame long zugzwang,https://lichess.org/ikTVyQ1n/black#96,
