PuzzleId,FEN,Moves,Rating,RatingDeviation,Popularity,NbPlays,Themes,GameUrl,OpeningTags
Hz4oD,3r1k2/1p3pp1/8/p1PP3p/5p2/P2R1P2/1P4rP/2K1R3 w - - 1 27,d3d2 g2d2 c1d2 d8d5,783,78,98,2837,attraction capturingDefender crushing endgame queensideAttack rookEndgame short,https://lichess.org/PHWAPoRT#53,
iDU1a,rnb1kb1r/pp1p1ppp/8/q2n4/8/2N2N2/PP1BP1PP/R2QKB1R b KQkq - 1 9,f8b4 c3d5 a5d5 d2b4,781,87,88,1245,capturingDefender crushing discoveredAttack opening short,https://lichess.org/z40OPm2Q/black#18,Englund_Gambit_Complex_Declined Englund_Gambit_Complex_Declined_Other_variations
piaBo,r1b1k2r/pp1n1p1p/2pb2p1/4q3/4Q3/2N5/PPP1BPPP/R1B2RK1 w kq - 6 14,c1f4 e5e4 c3e4 d6f4,764,99,84,316,advantage capturingDefender discoveredAttack middlegame short,https://lichess.org/5ZrOofr8#27,Russian_Game Russian_Game_Damiano_Variation
58H4V,r2qk2r/ppp2pbp/1nn1p1p1/4P3/2P3b1/BP3N2/P2NBPPP/R2Q1RK1 b kq - 2 11,c6e5 f3e5 g7e5 e2g4,765,86,94,1957,capturingDefender crushing discoveredAttack opening short,https://lichess.org/tJ01XjuL/black#22,Alekhine_Defense Alekhine_Defense_Modern_Variation
EbZz5,r4b1r/1pp1k1pp/p3n3/4Q3/3qnB2/2N5/PPP2PPP/R4RK1 w - - 0 16,e5e4 d4e4 c3e4 e6f4,723,84,87,309,advantage capturingDefender middlegame short,https://lichess.org/2dQcVosi#31,Zukertort_Opening Zukertort_Opening_Tennison_Gambit
347SK,4r1k1/p5r1/P3P1Q1/1P4Kp/7P/6P1/8/8 w - - 19 73,g5h5 g7g6 h5g6 e8e6,798,79,39,101,attraction capturingDefender crushing endgame master short,https://lichess.org/7s6XynwZ#145,
IPxMG,r4rk1/p2qbppp/2p1p3/1np5/Q7/2N3P1/PP1PPP1P/R1BR2K1 w - - 2 14,b2b3 b5c3 d2c3 d7d1,739,95,79,245,advantage capturingDefender middlegame short,https://lichess.org/1MXl62A1#27,English_Opening English_Opening_Symmetrical_Variation
DMJKF,r2qr1k1/pppnbppp/5n2/6B1/3Pp3/2P5/PP1N1PPP/RN1QR1K1 w - - 2 13,d2e4 f6e4 e1e4 e7g5 e4e8 d8e8,788,146,57,25,advantage capturingDefender discoveredAttack long opening,https://lichess.org/zbOXt2tG#25,French_Defense French_Defense_Knight_Variation
HvCPR,rnb1k2r/pp1p1ppp/5n2/q2Pp3/1b6/2N5/PP1BPPPP/R2QKBNR b KQkq - 6 7,f6d5 c3d5 a5d5 d2b4,768,85,84,96,advantage capturingDefender discoveredAttack opening short,https://lichess.org/vUZnBLRC/black#14,Englund_Gambit_Complex_Declined Englund_Gambit_Complex_Declined_Other_variations
RklBm,5rk1/pp3pp1/2pq2np/4p3/4P1QP/P1NP2R1/1P3PP1/6K1 b - - 1 23,d6e6 g4e6 f7e6 g3g6,786,90,76,380,capturingDefender crushing discoveredAttack endgame short,https://lichess.org/qVV9uu6c/black#46,
3cypK,8/6b1/4k1p1/3p1p1p/1p1P1P1P/1p1K1PP1/rB6/1R6 b - - 0 37,a2a3 b2a3 b4a3 b1b3,788,91,91,1067,capturingDefender crushing discoveredAttack endgame short,https://lichess.org/x1UAcHF9/black#74,
s53Tm,8/pp4pk/3qp1rp/3p4/3P1PQ1/2P4P/PP6/R4RK1 w - - 1 24,g1f2 g6g4 h3g4 d6f4,799,83,85,185,advantage capturingDefender endgame short,https://lichess.org/5YXi25S5#47,
4hd3N,4rrk1/1p1n1ppp/p1p1b3/8/3N4/1PP2N1P/P4KP1/R2R4 b - - 1 20,c6c5 d4e6 e8e6 d1d7,791,90,89,770,advantage capturingDefender discoveredAttack middlegame short,https://lichess.org/L2fxgvZD/black#40,
T2C31,3r1rk1/pp3nbp/4b1p1/8/3Qp3/6BP/PP3PPN/3RRBK1 b - - 0 20,d8d4 d1d4 g7d4 e1e4,755,86,88,835,capturingDefender crushing master middlegame short,https://lichess.org/dsZLSt3v/black#40,
mOgP6,2r4k/5p1p/5p2/1p1p4/pP2pn2/8/P5PP/2R1R1K1 b - - 1 37,c8c4 c1c4 d5c4 e1e4,769,79,100,225,advantage capturingDefender endgame short,https://lichess.org/v4yWXMvh/black#74,
2VJwa,2kr1bnr/ppp1pppp/2n5/1P5q/6b1/2N2N2/P1PPBPPP/R1BQ1RK1 b - - 0 8,c6e5 f3e5 h5e5 e2g4,737,94,80,184,capturingDefender crushing discoveredAttack opening short,https://lichess.org/UQxwm6gP/black#16,Scandinavian_Defense Scandinavian_Defense_Main_Line
gTdKm,3r1rk1/1p1nbppp/p3p3/2P2b2/2PR4/2N1B2P/PP2BPP1/5RK1 b - - 0 15,e7c5 d4d7 d8d7 e3c5,714,142,74,62,capturingDefender crushing discoveredAttack middlegame short,https://lichess.org/dNwAjxL8/black#30,Scandinavian_Defense Scandinavian_Defense_Mieses-Kotroc_Variation
fXWxU,8/5p2/2k1p3/1p1r2p1/1P5p/2K1BR2/5P2/8 b - - 2 50,d5f5 f3f5 e6f5 e3g5,739,90,92,594,capturingDefender crushing endgame short,https://lichess.org/0R2hHGMQ/black#100,
3bW1X,r3rb1k/1ppq2pp/5p2/1P1np3/p1BPR2N/2P5/PQ3PPP/4R1K1 b - - 2 21,d5b6 h4g6 h7g6 e4h4,793,79,88,245,clearance kingsideAttack mate mateIn2 middlegame sacrifice short,https://lichess.org/3Gygl43n/black#42,
FU05S,3r2k1/2p4p/4P1p1/P1P2p2/7Q/8/4p1PP/3qR2K w - - 6 42,h2h3 d1e1 h4e1 d8d1 h1g1 d1e1,772,161,100,10,attraction clearance crushing endgame long pin sacrifice,https://lichess.org/d9RteqJa#83,
ba2lv,6k1/7p/pN2n1pB/P1pBbq2/2P5/6P1/2nQ2KP/8 b - - 9 34,c2b4 d5e6 f5e6 d2d8 e6e8 d8e8,798,77,100,427,clearance long mate mateIn3 middlegame,https://lichess.org/S26KM8r7/black#68,
nN4mM,b1r3k1/5pp1/2q4p/8/P2QP3/5P2/6PP/3R2K1 b - - 2 29,c6c5 d4c5 c8c5 d1d8 g8h7 d8a8,752,98,95,1826,advantage clearance endgame fork long,https://lichess.org/KDiZOIwO/black#58,
pH1Fv,2kr2r1/ppp2p1p/3p4/8/4PPn1/2NB1n2/PPP3RP/R1B4K w - - 1 17,h2h3 g4f2 g2f2 g8g1,790,79,98,1964,arabianMate clearance kingsideAttack mate mateIn2 middlegame sacrifice short,https://lichess.org/MwBitKCG#33,Three_Knights_Opening Three_Knights_Opening_Other_variations
7beP3,6k1/1p3pbp/2b1p1p1/pB1pP3/3P4/1R2B1PP/5PK1/r7 b - - 3 28,g7f8 b5c6 b7c6 b3b8,796,84,84,162,advantage clearance endgame short,https://lichess.org/QuPAapT4/black#56,
WMznC,r1bq1rk1/p2p1pp1/1pn1pn1p/8/4N3/2PQ4/PPB2PPP/RN3RK1 b - - 1 15,d7d5 e4f6 g7f6 d3h7,752,80,81,142,clearance kingsideAttack mate mateIn2 opening short,https://lichess.org/8QEMs8EQ/black#30,Sicilian_Defense Sicilian_Defense_Delayed_Alapin_Variation
VNFOu,1k6/Ppp5/5p2/8/2Nr3n/6pP/4r1P1/R1R3K1 b - - 0 31,b8a8 c4b6 c7b6 c1c8,778,92,88,543,clearance endgame mate mateIn2 sacrifice short,https://lichess.org/Q8hTHSOU/black#62,
MAWs1,r1bq1rk1/bpp2pp1/p2p2np/3PN3/2P1N3/P2Q3P/1PB2PP1/R1B1R1K1 b - - 0 17,g6e5 e4f6 d8f6 d3h7,757,96,96,4572,clearance kingsideAttack mate mateIn2 opening sacrifice short,https://lichess.org/TXs1HxsG/black#34,English_Opening English_Opening_Kings_English_Variation
xOvmB,7k/5p2/bQ5b/3P1p2/5q1p/2N5/PPBr1PPP/1K1R4 w - - 0 35,b6a6 d2d1 c3d1 f4c1,702,80,84,137,clearance mate mateIn2 middlegame queensideAttack short,https://lichess.org/1GoCI2Eu#69,
kHSda,r4rk1/4qpp1/2p1pb1p/8/1p1PN3/2PQ4/p1B2PPP/R5K1 b - - 1 26,b4c3 e4f6 e7f6 d3h7,793,95,87,335,clearance kingsideAttack mate mateIn2 middlegame short,https://lichess.org/01yLMATg/black#52,
Is8TD,1r3r1k/pp2PB1p/3p2p1/2p5/8/2P2R1P/P5P1/7K b - - 0 23,f8e8 f7e8 b8e8 f3f8 h8g7 f8e8,799,85,100,46,attraction clearance crushing endgame long,https://lichess.org/sQO3yY4n/black#46,
Ntyrx,1k2rQ2/pp2b3/2p5/2P5/5RnP/3q2P1/PP1B2B1/2KR4 b - - 2 29,e8f8 f4f8 e7f8 d2f4 b8c8 d1d3,792,78,100,598,clearance crushing discoveredAttack long middlegame,https://lichess.org/DF7fdVkS/black#58,
SkiZA,2rq1rk1/p4pp1/1pn1p2p/3b4/3PN3/3Q4/PPB2PPP/R3R1K1 b - - 5 17,c6b4 e4f6 d8f6 d3h7,737,77,97,1413,clearance kingsideAttack mate mateIn2 middlegame sacrifice short,https://lichess.org/7qhrCmSc/black#34,Queens_Indian_Defense Queens_Indian_Defense_Spassky_System
Ql1gR,r2q1rk1/2pb1pp1/p3pb1p/1p6/P1nPN3/2PQ1N2/1PB2PPP/R4RK1 b - - 4 15,c4b2 e4f6 g7f6 d3h7,739,96,93,190,clearance kingsideAttack mate mateIn2 middlegame short,https://lichess.org/yOmgre1j/black#30,Queens_Pawn_Game Queens_Pawn_Game_Veresov_Attack
omnTZ,8/R1r1bk2/2p2r2/1p1p2p1/1P1Pp1Pp/4P2P/R4PK1/4B3 b - - 3 37,e7d6 a7c7 d6c7 a2a7 f7g6 a7c7,716,83,93,326,advantage clearance endgame long pin,https://lichess.org/tAUsPDA5/black#74,
mVvpz,r2q1rk1/p4pp1/1p1pbnnp/2p5/2P1N2B/4PP2/P1Q3PP/1BR2RK1 b - - 4 19,g6h4 e4f6 d8f6 c2h7,702,105,88,754,clearance kingsideAttack mate mateIn2 middlegame short,https://lichess.org/RyrG8FiU/black#38,Nimzo-Indian_Defense Nimzo-Indian_Defense_Leningrad_Variation
hhQoV,8/ppp1kp2/5p2/1PPr4/P6Q/5P2/4p1PP/3rR2K w - - 4 36,h2h3 d1e1 h4e1 d5d1 h1g1 d1e1,751,88,92,542,attraction clearance crushing endgame long pin queenRookEndgame,https://lichess.org/hCoTbSWu#71,
74bBS,2k4r/ppp3p1/6r1/4nN2/6n1/P3PN2/1P2BP1p/R1B2R1K w - - 1 21,f3e5 g4f2 f1f2 g6g1,740,79,79,137,clearance kingsideAttack mate mateIn2 middlegame sacrifice short,https://lichess.org/yLGIv8hY#41,
bAKU6,2k3r1/pbpp4/1p6/6rp/P3PRn1/1PNP4/2P1R1BP/7K w - - 1 30,g2f3 g4f2 e2f2 g5g1,726,84,76,309,clearance kingsideAttack mate mateIn2 middlegame sacrifice short,https://lichess.org/Sv9N8oUl#59,
U4pz7,8/p3p3/8/2k5/3p4/6PK/PP6/8 w - - 0 40,g3g4 d4d3 h3g3 d3d2,777,83,68,111,advancedPawn crushing endgame pawnEndgame short,https://lichess.org/fmX1foWF#79,
xNJOU,3r4/2k3p1/p1p2p2/4p3/P4n1p/1P2N2P/2P2PP1/2KR4 w - - 3 27,d1g1 f4e2 c1b2 e2g1,777,83,73,78,crushing endgame fork master short,https://lichess.org/b6cWmmPJ#53,
fr7be,r3qrk1/3n1ppp/2N1p3/p2pP3/5PQ1/4B3/PPP3PP/5R1K b - - 0 19,e8c8 c6e7 g8h8 e7c8,794,85,90,353,crushing fork middlegame short,https://lichess.org/mw7SPylx/black#38,Caro-Kann_Defense Caro-Kann_Defense_Campomanes_Attack
i87cM,8/6p1/5k2/5p2/1r3P2/3pN2K/3R4/8 b - - 2 45,b4f4 e3d5 f6e5 d5f4,765,84,78,207,crushing endgame fork short,https://lichess.org/u02iKDrX/black#90,
Y1B6h,8/6R1/4k1p1/6P1/8/1K6/5r2/8 b - - 1 55,e6f5 g7f7 f5g4 f7f2,741,89,94,145,crushing endgame rookEndgame short skewer,https://lichess.org/AQegPGfX/black#110,
HP5Mh,8/pp3kpp/2p5/P5n1/1P1PK3/6P1/7P/4R3 w - - 5 37,e4e5 g5f3 e5d6 f3e1 d4d5 c6d5,782,90,81,406,crushing endgame fork long,https://lichess.org/3Wel0oj7#73,
qJqRu,8/8/6k1/8/6PP/pr6/R5K1/8 w - - 0 49,g2f2 b3b2 a2b2 a3b2,776,78,68,92,advancedPawn crushing endgame rookEndgame short,https://lichess.org/bl3QHwpj#97,
sk9x4,r5k1/1b3pp1/p6p/1p2P3/4nP2/1P5P/P1P1Q1P1/7K w - - 1 30,e2d1 e4f2 h1g1 f2d1,710,96,96,2162,crushing endgame fork short,https://lichess.org/BGzh8t25#59,
A5eni,8/6pk/2b4p/8/p2R1P2/2P5/P5PP/2n3K1 w - - 3 41,a2a3 c1e2 g1f1 e2d4,752,77,100,606,crushing endgame fork master masterVsMaster short,https://lichess.org/MBj8th36#81,
JC1JU,3r2k1/5ppp/b1N5/2p5/8/P6P/5PP1/4R1K1 b - - 0 26,d8c8 c6e7 g8f8 e7c8,796,77,97,3222,crushing endgame fork short,https://lichess.org/4Cwuz9wX/black#52,
esBn3,8/1K6/2R5/1k6/8/8/8/7r w - - 44 82,b7c7 h1h7 c7d6 h7h6,773,87,97,2089,crushing endgame master rookEndgame short,https://lichess.org/iqz2DSpT#163,
xTMaK,3b4/3Pk1np/R5p1/p7/8/1P4P1/P6P/6K1 w - - 2 33,a6a7 d8b6 g1g2 b6a7 d7d8q e7d8,797,85,82,126,crushing endgame fork long,https://lichess.org/tLWfhz0o#65,
VKP3j,1r4k1/1r3ppp/4p3/p2p4/1pPP4/2P3P1/PR3P1P/1R4K1 b - - 0 25,b4c3 b2b7 b8b7 b1b7,725,112,67,56,crushing endgame rookEndgame short,https://lichess.org/i6ZrWRBn/black#50,
U1N9q,7R/2r2B2/3p1k2/p3p3/b3P2P/1P3P2/5K2/8 b - - 0 41,f6f7 h8h7 f7g6 h7c7,758,79,79,137,crushing endgame short skewer,https://lichess.org/FMPPbpzp/black#82,
KB2lP,2k4r/1p1n1p2/p1qp4/2pNRPr1/P1P5/7P/1P3PP1/R2Q2K1 b - - 0 29,d7e5 d5e7 c8c7 e7c6,705,130,82,34,crushing fork middlegame short,https://lichess.org/fqQSZOlA/black#58,
hdJAR,8/8/2bnk3/7p/1R2PPp1/4K1P1/7P/8 w - - 0 35,b4b6 d6c4 e3d4 c4b6,723,79,83,83,crushing endgame fork short,https://lichess.org/9BoiIcNQ#69,
7ehSb,8/3b4/2Bk4/1P1P1p2/5Kp1/8/8/8 w - - 2 56,b5b6 d7c6 d5c6 d6c6,775,79,100,216,bishopEndgame crushing endgame master short,https://lichess.org/dWnPPLOU#111,
apYan,1Q6/5pk1/6p1/3KP3/8/8/8/6r1 w - - 1 54,b8d8 g1d1 d5e4 d1d8,741,79,100,143,crushing endgame queenRookEndgame short skewer,https://lichess.org/WLV7QE0D#107,
7kkhD,8/7r/Rp1k1p2/1Pp1bP2/2Kp4/8/8/2B5 b - - 1 38,d6c7 a6a7 c7d6 a7h7,722,94,88,45,crushing endgame short skewer,https://lichess.org/zL9EDYqe/black#76,
dBNcG,1Q6/4p3/4kp2/6p1/5q2/8/PP2b3/K6R w - - 9 43,b8f4 g5f4 h1e1 f4f3,790,93,88,367,crushing endgame short,https://lichess.org/605pVzSK#85,
TW0KU,2kr1r2/Q2b1p2/2p5/8/8/3P3P/PqP2KP1/R3R3 b - - 0 22,b2c2 e1e2 c2e2 f2e2,774,79,72,132,crushing defensiveMove middlegame short,https://lichess.org/4FWxdQnQ/black#44,
KRCIl,8/1p4k1/pN1pQ1p1/2pP1r2/2P3n1/1P4P1/q4P2/2R3K1 w - - 6 34,e6e7 f5f7 e7f7 g7f7,731,88,88,693,crushing defensiveMove endgame master masterVsMaster short,https://lichess.org/qyEYJoC7#67,
loOYp,5K2/7p/6kP/8/8/8/8/8 w - - 1 69,f8g8 g6h6 g8h8 h6g6,769,143,47,11,crushing defensiveMove endgame master pawnEndgame short,https://lichess.org/QbCpCTjQ#137,
chnkh,4r1k1/1pp2p2/p5Pp/8/8/2P2RQ1/4q3/6K1 b - - 0 31,e2d1 f3f1 d1f1 g1f1,730,95,38,83,advantage defensiveMove endgame short,https://lichess.org/Weuc9CW7/black#62,
xGSHJ,8/8/6kp/p1p3p1/P1P1K1P1/1P6/8/8 w - - 3 43,e4d5 h6h5 g4h5 g6h5 d5c5 g5g4,748,91,87,458,crushing defensiveMove endgame long pawnEndgame,https://lichess.org/NzhoWoZ0#85,
lRutt,4r2k/6pp/p3N3/1p2QP2/1P1p2Pr/PB5q/5R2/6K1 b - - 1 37,h3g4 f2g2 h4h1 g1h1,728,102,95,449,crushing defensiveMove middlegame short,https://lichess.org/FrZkAoPn/black#74,
i1Zgl,8/8/8/6kp/6pb/3B4/6PK/8 b - - 3 57,g4g3 h2h3 g5f4 h3h4,730,86,95,596,bishopEndgame crushing defensiveMove endgame master short,https://lichess.org/iqU2ckm9/black#114,
teDbv,8/8/3p4/3Pp3/1pk1Pp2/5P2/1P1K4/3B1b2 w - - 36 66,b2b3 c4d4,759,90,92,311,bishopEndgame crushing defensiveMove endgame oneMove,https://lichess.org/vlXnno1l#131,
CAlAA,8/8/1p1k4/1P3pp1/2K4P/6P1/1P6/8 b - - 0 44,g5h4 g3h4 d6e5 h4h5,746,93,94,679,crushing defensiveMove endgame master pawnEndgame short,https://lichess.org/RLwoAXJZ/black#88,
RFStG,8/1p6/p3p3/4k2p/P1Pr2pP/1P1R2P1/4K3/8 w - - 2 43,d3e3 d4e4 e3e4 e5e4,761,103,93,159,crushing defensiveMove endgame rookEndgame short,https://lichess.org/s7auA9wp#85,
r9DN5,8/8/1p2k1p1/1p4P1/1Pp1K3/P1P5/8/8 w - - 0 40,e4f4 e6d5 f4f3 d5e5,744,82,90,672,crushing defensiveMove endgame pawnEndgame short zugzwang,https://lichess.org/h2RdQhF8#79,
Qcjqu,8/1pk5/p1p2pB1/2Pp2n1/1P1P1KP1/8/1P6/8 b - - 4 54,g5e6 f4f5 e6d4 f5f6,773,104,87,542,crushing defensiveMove endgame master masterVsMaster short,https://lichess.org/JZ9V8m2M/black#108,
SeyWX,8/p1q1r1pk/7p/3Q1p2/4p2P/2PR1PP1/PP4K1/8 w - - 2 32,d5f5 g7g6 f5e4 e7e4,788,84,87,136,advantage defensiveMove endgame master short,https://lichess.org/DkVFS1Br#63,
jKuOT,8/6p1/1K5p/7k/8/8/P7/8 b - - 1 51,h5g6 a2a4 g6f5 a4a5,773,97,86,362,crushing defensiveMove endgame pawnEndgame quietMove short,https://lichess.org/Xpo9sPBJ/black#102,
doqqZ,6R1/4k3/6p1/4Pp1p/p2KbN1P/r5P1/8/8 w - - 0 72,f4g6 e7f7 g8f8 f7g6,702,82,76,92,advantage defensiveMove endgame master masterVsMaster short,https://lichess.org/6tO28ZKr#143,
hgEYx,8/8/1K1nk3/P7/8/1P6/8/8 b - - 0 65,e6d7 a5a6 d6c8 b6b7,751,79,85,264,crushing defensiveMove endgame knightEndgame master masterVsMaster short,https://lichess.org/pOYZ3t4O/black#130,
sp27J,8/6R1/7p/2p1r2k/P2pp3/1P6/2P1K3/8 b - - 0 42,e5g5 g7g5 h6g5 a4a5,723,79,98,578,crushing defensiveMove endgame rookEndgame short,https://lichess.org/DITkYpfz/black#84,
kBTQ6,6q1/3Q3k/6p1/7p/8/P7/5P2/5K2 b - - 2 65,g8g7 d7g7 h7g7 a3a4,757,81,78,137,crushing defensiveMove endgame queenEndgame short,https://lichess.org/fJVcF6rB/black#130,
AiJIT,6k1/6p1/p7/8/1q6/1P1Q2P1/5PK1/8 w - - 5 47,d3c4 b4c4 b3c4 a6a5,744,96,94,750,crushing defensiveMove endgame queenEndgame short,https://lichess.org/3qxWiRtQ#93,
zjJvJ,2R5/3k1p2/3r4/2p1K3/5PP1/8/8/8 w - - 2 57,c8d8 d7d8 e5d6 c5c4,796,99,91,999,crushing defensiveMove endgame master rookEndgame short,https://lichess.org/gKvuZKYB#113,
ffyOI,2r5/4q1kp/2r2bp1/R3p3/P7/4Q1P1/4NP1P/2R3K1 w - - 0 33,a5a7 c6c1 e2c1 c8c1 e3c1 e7a7,777,77,99,2425,advantage deflection long middlegame,https://lichess.org/2hJc05vm#65,
s2azv,2r3k1/R4ppp/8/8/p1n5/4P1P1/PP3P1P/1KN5 w - - 4 39,a7a4 c4d2 b1a1 c8c1,723,80,79,83,backRankMate deflection discoveredAttack endgame mate mateIn2 short,https://lichess.org/NiszODXf#77,
Fqx0F,8/8/6K1/6p1/2RP1k2/5Pr1/8/8 b - - 0 45,f4f3 c4c3 f3e4 c3g3,735,89,98,434,crushing deflection endgame rookEndgame short skewer,https://lichess.org/LQm4WXQx/black#90,
zK5F7,3r4/ppQ2kp1/2p1p3/8/3P2p1/2PB3q/PP6/6K1 b - - 1 35,f7e8 d3g6 e8f8 c7d8,707,95,85,26,deflection endgame mate mateIn2 short,https://lichess.org/aEfD7F5G/black#70,
Ixsxq,4r1k1/1pb2pp1/2pq3p/p7/4p1P1/2B1N3/PP2QPB1/4R1Kr w - - 2 26,g2h1 d6h2 g1f1 h2h1,742,78,100,299,deflection kingsideAttack mate mateIn2 middlegame short,https://lichess.org/VqLfbzFE#51,
h91Be,8/p1pkr1p1/1pR4p/3KP3/8/8/P1P3PP/8 w - - 1 36,c2c4 e7e5 d5e5 d7c6,716,80,98,1903,crushing deflection endgame rookEndgame short,https://lichess.org/thoJ33be#71,
oOAC3,8/7p/4p1p1/2k1P3/p1r5/R2K1P1P/6P1/8 b - - 6 34,c5b4 a3a4 b4a4 d3c4,773,107,93,823,crushing deflection endgame rookEndgame short,https://lichess.org/yR4p4fzI/black#68,
xbAY7,4r3/3r1p2/p1knpBpp/1p6/3R1P2/8/PPP3PP/3R2K1 w - - 0 24,g1f2 d6e4 d4e4 d7d1,738,85,60,58,advantage deflection discoveredAttack endgame master masterVsMaster short,https://lichess.org/dBdT93ii#47,
3j9UV,5k2/2pK2p1/1p2P2p/p7/8/1P2P3/r5PP/8 b - - 0 32,a2g2 e6e7 f8g8 e7e8q,790,90,77,157,advancedPawn crushing deflection endgame promotion rookEndgame short,https://lichess.org/lE6eR11F/black#64,
4ni7z,8/8/4k3/3R4/4K3/8/4r3/8 w - - 28 71,e4d4 e2d2 d4e3 d2d5,708,81,74,148,crushing deflection endgame rookEndgame short skewer,https://lichess.org/8pcssdcP#141,
uE2a2,8/R7/8/8/4r3/3K1k2/8/8 b - - 11 71,f3f4 a7f7 f4e5 f7e7 e5d6 e7e4,797,88,85,292,crushing deflection endgame long master rookEndgame skewer,https://lichess.org/D4aNFsuF/black#142,
gEdJU,5bk1/p4p1p/5Kp1/3Q4/3p2P1/6qP/8/8 b - - 3 40,d4d3 d5f7 g8h8 f7f8,733,77,79,173,deflection endgame mate mateIn2 short,https://lichess.org/Ad4OuXro/black#80,
5cyZi,3b2k1/1Q3pp1/4p2p/p1N1B3/1p4n1/1P2P3/P2q1PPP/5BK1 w - - 3 28,e5d4 d2f2 g1h1 f2f1,734,78,83,79,deflection kingsideAttack mate mateIn2 middlegame short,https://lichess.org/QYRJn6XI#55,
ERjq2,8/3N4/4p3/3pPk2/1n1P3p/3K2pP/6P1/8 w - - 5 56,d3e3 b4c2 e3d2 c2d4,723,108,93,1126,crushing deflection endgame knightEndgame short,https://lichess.org/3lwyrINJ#111,
7nSxa,5qk1/2Q3pp/b1p5/3p4/1P6/P1P5/4K1PP/4N3 w - - 4 40,e2d2 f8f2 d2c1 f2e1,780,84,100,624,advantage deflection endgame short,https://lichess.org/3Gs39WY5#79,
eLeb0,5r2/ppp2P1k/3pp1q1/4n1r1/4P3/2P4P/PPPQ1RP1/5RK1 b - - 0 20,f8f7 f2f7 e5f7 f1f7 g6f7 d2g5,790,94,81,193,crushing deflection exposedKing long middlegame,https://lichess.org/ZpWMSVza/black#40,
M4mDB,8/8/4k3/3R4/4K3/8/5r2/8 w - - 27 63,e4d4 f2d2 d4e3 d2d5,748,79,79,358,crushing deflection endgame rookEndgame short skewer,https://lichess.org/BFD1FL5K#125,
iA6JO,8/5pkp/4p1p1/b7/nNBP4/3KPP2/6PP/8 w - - 5 39,b4c2 a4b2 d3e2 b2c4,758,92,94,1971,advantage deflection endgame short,https://lichess.org/Wrimd3Bp#77,
HAtYk,8/8/p4k1q/4bp2/PpPpB3/3P3p/2P4P/5Q1K b - - 1 46,h6h4 f1f5 f6e7 f5e5,776,77,100,174,crushing deflection endgame master short,https://lichess.org/xRCNnDZg/black#92,
C9MGh,5nk1/2Q2ppp/4P3/5PP1/1q6/3P3P/r5BK/8 b - - 0 37,b4d2 c7f7 g8h8 f7f8,786,93,94,914,deflection endgame mate mateIn2 short,https://lichess.org/avGwrWyc/black#74,
XXbLd,1r4k1/5pp1/1nq2b1p/r1Pp4/pR1P4/P3P3/1B1Q2PP/R5K1 b - - 0 27,b6d7 b4b8 d7b8 d2a5,760,93,85,83,advantage discoveredAttack middlegame short,https://lichess.org/Y0KQcayh/black#54,
ii7s7,r4rk1/pp2qpp1/3p3p/2p1p2n/B3P3/P2P1n1P/1PP1NP2/R2Q1K1R b - - 1 16,f3d4 e2d4 c5d4 d1h5,795,78,98,669,advantage discoveredAttack middlegame short,https://lichess.org/rsGTGLkx/black#32,Philidor_Defense Philidor_Defense_Other_variations
PLfSS,r3r1k1/p4pp1/1p1B3p/4nb2/8/1B6/PRP2PPP/5RK1 w - - 1 20,f1e1 e5f3 g2f3 e8e1,757,98,91,930,crushing discoveredAttack kingsideAttack middlegame short,https://lichess.org/1u1mbsl1#39,
C919P,r1b1k2r/pp1p1ppp/4p3/q1b1n3/8/1BN5/PP2QPPP/R1B2RK1 w kq - 2 12,e2e5 c5f2 f1f2 a5e5,797,99,93,704,advantage discoveredAttack kingsideAttack opening short,https://lichess.org/fqHS7DSb#23,Sicilian_Defense Sicilian_Defense_Smith-Morra_Gambit
7xHwE,7r/1p6/1N1p2kb/pb2p3/4P3/4B3/PP1K1PP1/R7 w - - 6 34,a1h1 h6e3 d2e3 h8h1,718,98,90,1180,crushing discoveredAttack endgame short,https://lichess.org/BbwwnF3l#67,
G29t5,5k2/5ppp/Pb2p3/3pP3/1P1p4/7P/3PBPP1/6K1 w - - 1 28,f2f4 d4d3 g1f1 d3e2,798,94,81,136,advancedPawn advantage bishopEndgame discoveredAttack endgame short,https://lichess.org/LGLwxANR#55,
rG7nM,k3r2r/pp6/2pp2p1/4b1Bp/8/6P1/P3BP1P/1R3RK1 w - - 3 26,f2f4 e5d4 g1g2 e8e2,761,103,94,1371,advantage discoveredAttack middlegame short,https://lichess.org/J5NzNYfs#51,
TuA4V,3r2k1/pp2np1p/5qp1/2rBp3/1P2P3/P6P/5PP1/R2QR1K1 b - - 0 22,c5c7 d5f7 g8f7 d1d8,763,78,100,290,advantage discoveredAttack kingsideAttack middlegame short,https://lichess.org/8EAaA8kH/black#44,
6qLpI,8/4qp1k/p1p2r2/4p1QP/4P3/1P1B2PK/P1P5/8 w - - 17 42,h3g2 f6f2 g2f2 e7g5,768,84,74,209,advantage discoveredAttack endgame master short,https://lichess.org/rpupunWU#83,
AkLXG,rnb2rk1/ppp3bp/5pp1/3q4/3PN3/8/PPP1QPPP/2KR2NR b - - 1 10,f8e8 e4f6 g7f6 e2e8 g8g7 e8c8,797,94,96,789,crushing discoveredAttack fork long opening,https://lichess.org/EDnXpxsa/black#20,Dutch_Defense Dutch_Defense_Raphael_Variation
QbBUz,3B4/2R5/pk1p4/P7/2K1P3/1P4rr/8/8 b - - 0 69,b6a5 c7g7,708,94,100,72,discoveredAttack endgame mate mateIn1 oneMove,https://lichess.org/hi0LTupd/black#138,
3YtDV,r3r1k1/p3Bppp/p7/2R5/1n6/4R3/5PPP/6K1 b - - 3 22,a8c8 c5c8 e8c8 e7b4,764,78,83,59,crushing discoveredAttack endgame short,https://lichess.org/h4W70hb2/black#44,
AquaZ,r7/p2n2pk/4p2p/1p1p3r/2pP1PN1/P1q1P3/5K1P/R2Q1R2 b - - 1 30,d7f6 g4f6 g7f6 d1h5,730,100,95,2205,advantage discoveredAttack middlegame short,https://lichess.org/wvcJDg0r/black#60,
s83W6,r2q1rk1/1b2bppp/p1n5/1ppN4/4N3/5B2/PPP3PP/R3QR1K b - - 5 20,d8d5 e4f6 e7f6 f3d5,769,99,93,1407,advantage discoveredAttack middlegame short,https://lichess.org/msP8RI4V/black#40,
1gOdJ,r7/pppkq2p/2n1p3/3p2rQ/3P4/2NPP3/PP3PPP/1R3RK1 w - - 4 16,h5h4 g5g2 g1g2 e7h4,793,86,97,502,crushing discoveredAttack kingsideAttack middlegame short,https://lichess.org/xcS8hdJn#31,Queens_Pawn_Game Queens_Pawn_Game_London_System
piaBo,r1b1k2r/pp1n1p1p/2pb2p1/4q3/4Q3/2N5/PPP1BPPP/R1B2RK1 w kq - 6 14,c1f4 e5e4 c3e4 d6f4,764,99,84,316,advantage capturingDefender discoveredAttack middlegame short,https://lichess.org/5ZrOofr8#27,Russian_Game Russian_Game_Damiano_Variation
Zd9uv,2kr1b1r/1pp2pp1/p1np3p/5q2/4N3/P2QB3/1PP2PPP/R4RK1 b - - 3 15,d6d5 e4d6 f8d6 d3f5,760,82,75,183,advantage discoveredAttack middlegame short,https://lichess.org/yH6UwAfU/black#30,Four_Knights_Game Four_Knights_Game_Spanish_Variation
BpyME,r4rk1/2p3pp/1p1p1n2/3Pp2q/p1P1P3/Pn1NBRP1/1P2Q2P/4R1K1 b - - 0 25,f6e4 f3f8 a8f8 e2h5,798,84,88,119,crushing discoveredAttack kingsideAttack master middlegame short,https://lichess.org/1LKTfKjg/black#50,
H1Tq3,4r3/5pkp/p3n2p/3N4/1pP1K3/1P4P1/P6P/4R3 w - - 11 35,e4f5 e6d4 f5f4 e8e1,767,100,93,1146,crushing discoveredAttack endgame master short,https://lichess.org/4M46AJn5#69,
Ve1Y9,3r1k2/8/3b3p/5pp1/R7/8/P4P1P/4R1K1 w - - 0 38,a4d4 d6h2 g1h2 d8d4,778,90,75,326,advantage discoveredAttack endgame short,https://lichess.org/vik2y8Ht#75,
cNbjb,r1b2N2/p2p2k1/1b4Bp/1p2P1n1/2p5/1QP3P1/PP5P/R4R1K w - - 0 28,b3b4 c8b7 g6e4 b7e4 f1f3 e4f3,796,83,88,760,doubleBishopMate kingsideAttack long mate mateIn3 middlegame,https://lichess.org/e3boRpTE#55,
rttSC,r1b1kbnr/pppp2p1/7p/6BB/8/4P3/PqPN2PP/R2QK2R b KQkq - 1 11,g7g6 h5g6,728,149,100,88,doubleBishopMate mate mateIn1 oneMove opening,https://lichess.org/TVeNa4M4/black#22,Englund_Gambit Englund_Gambit_Other_variations
L2sQw,Q2q1kr1/p4pb1/1p1pp2p/nB5P/8/2P2NB1/PP3PP1/2K4R b - - 0 21,d8a8 g3d6,737,102,94,803,doubleBishopMate master mate mateIn1 middlegame oneMove,https://lichess.org/mRhZTJsm/black#42,
pdobB,r2qkb1r/pppbp1pp/5n2/3p2B1/3P4/3B1P2/PP4PP/RN1QK2R b KQkq - 2 10,h7h6 d3g6,721,78,100,426,doubleBishopMate mate mateIn1 oneMove opening,https://lichess.org/5TA5U7VE/black#20,Nimzowitsch_Defense Nimzowitsch_Defense_Scandinavian_Variation
643qg,r1bqkb1r/pp1np1pp/2p1pn2/3p2B1/3P4/3B1N2/PPP2PPP/RN1QK2R b KQkq - 4 8,h7h6 d3g6,771,95,96,1195,doubleBishopMate mate mateIn1 oneMove opening,https://lichess.org/uyAALlMX/black#16,Caro-Kann_Defense Caro-Kann_Defense_Other_variations
JegQw,r6k/pp5p/2p4b/8/2B2P2/P7/KPP1p2P/4B3 b - - 0 32,h6f4 e1c3 f4e5 c3e5,769,97,92,337,doubleBishopMate endgame mate mateIn2 short,https://lichess.org/mZbOhPTL/black#64,
JXRuN,2kr3r/Bppbnppp/3p4/8/1P2PP2/3B2P1/P1P2K2/R6R b - - 0 16,b7b6 d3a6,741,85,87,468,doubleBishopMate mate mateIn1 middlegame oneMove,https://lichess.org/vURx2Oo9/black#32,Three_Knights_Opening Three_Knights_Opening_Other_variations
T06nI,r1br3k/ppp4p/6p1/3B1p2/2P5/1Pb1P3/P4PPP/1RB1R1K1 b - - 3 18,c3e1 c1b2 e1c3 b2c3,791,97,88,721,doubleBishopMate mate mateIn2 middlegame short,https://lichess.org/ewFNM1xI/black#36,Old_Indian_Defense Old_Indian_Defense_Other_variations
V9hsn,5bk1/1p1Q3p/p1b3p1/8/4B3/2B2P2/3K2PP/8 b - - 0 40,c6d7 e4d5 d7e6 d5e6,722,111,90,1002,bishopEndgame doubleBishopMate endgame mate mateIn2 short,https://lichess.org/zc0nZiCp/black#80,
4qQlo,r6k/pp3B1p/3p2q1/2p3BQ/3nP3/3PK3/P4P2/8 b - - 0 26,g6h5 g5f6,735,81,88,291,doubleBishopMate endgame mate mateIn1 oneMove,https://lichess.org/YO5QOnMc/black#52,
hrobq,r4rk1/1p4pp/2n1b3/p3pp2/Pb1p3N/1P1P2P1/1B2PPBP/R2K3R w - - 4 18,b2c1 e6b3,720,101,91,1070,doubleBishopMate mate mateIn1 middlegame oneMove,https://lichess.org/uDtevrUj#35,Hungarian_Opening Hungarian_Opening_Indian_Defense
q0Rtg,r1b2r1k/ppp4p/8/2b2p2/5B2/1BP3PP/PP4PK/3n4 b - - 1 30,d1b2 f4e5 f8f6 e5f6,753,76,100,159,doubleBishopMate mate mateIn2 middlegame short,https://lichess.org/sojvDrsw/black#60,
MiMpO,R4r1k/1p5p/1pn3p1/3B2B1/5p2/1P5P/5PP1/6K1 b - - 1 27,f8a8 g5f6,725,81,100,186,doubleBishopMate endgame mate mateIn1 oneMove,https://lichess.org/53yId8r8/black#54,
vuXCD,r3r3/pp1nkpp1/2pb1q2/8/3P1p1Q/3B1N2/bPPB1PPP/2KR3R w - - 0 18,b2b3 d6a3,797,143,84,244,doubleBishopMate mate mateIn1 middlegame oneMove,https://lichess.org/XSfWEnHs#35,Caro-Kann_Defense Caro-Kann_Defense_Forgacs_Variation
yIUuW,r4rk1/pp3pp1/2pp2p1/2b5/4P3/3BN1Pq/bPPNQ2P/2KR3R w - - 0 18,b2b3 c5a3,765,86,85,336,doubleBishopMate mate mateIn1 middlegame oneMove,https://lichess.org/L3JN6Zoe#35,Scotch_Game Scotch_Game_Classical_Variation
xQEGj,5rk1/1R3np1/p7/3P4/5P1p/2B1b1P1/PP2b2P/5R1K w - - 6 34,f1e1 e2f3,722,95,80,491,doubleBishopMate mate mateIn1 middlegame oneMove,https://lichess.org/yk4OS8Wo#67,
OdOIw,4r1k1/ppp2ppp/2p5/8/2P3bq/3Bb1P1/PPQ1N2P/R6K w - - 1 20,g3h4 g4f3,745,97,93,499,doubleBishopMate mate mateIn1 middlegame oneMove,https://lichess.org/5mC9S0iW#39,
