PuzzleId,FEN,Moves,Rating,RatingDeviation,Popularity,NbPlays,Themes,GameUrl,OpeningTags
N8OTv,r3k2r/pppb1ppp/8/8/5P2/B1P3P1/P1P1Q3/R3KB1q b Qkq - 1 15,e8d8 e1c1 h8e8 e2d3 h1c6 f1h3 e8e6 d3h7,3094,120,89,1491,castling crushing middlegame pin veryLong,https://lichess.org/xTjQLsjf/black#30,Three_Knights_Opening Three_Knights_Opening_Other_variations
RE3si,r3k2r/pppq1ppp/2p2n2/2b5/4P1b1/2PP2Q1/PP3PPP/RNB1KB1R w KQkq - 1 9,e4e5 f6e4 e5e6 d7e6 d3e4 e8c8 f1e2 g4e2,3051,103,92,1229,castling crushing master middlegame sacrifice veryLong,https://lichess.org/u9xWIsN0#17,Russian_Game Russian_Game_Stafford_Gambit
Xmucj,r3k2r/pQ1n2pp/4p3/8/1b6/4BN2/1PPK1PPP/q2R3R w kq - 3 18,c2c3 a1b2 d2d3 b2c3 d3e2 c3c4 d1d3 a8d8 h1d1 e8g8,3016,125,87,495,advantage castling defensiveMove middlegame quietMove veryLong,https://lichess.org/rsHwN16W#35,Kings_Pawn_Game Kings_Pawn_Game_Napoleon_Attack
kgFTE,2k2b1r/ppp1pQpp/2n5/r7/4q3/4B3/PP3P1P/R3KB1R b KQ - 1 14,e4h1 e1c1 c6d8 f1h3 c8b8 f7f3,3039,115,92,261,advantage castling long middlegame,https://lichess.org/RWeecq23/black#28,Queens_Gambit_Declined Queens_Gambit_Declined_Chigorin_Defense
tEfhc,rn2k2r/pb1p1pp1/3Pp3/1p2P1N1/7p/PB1QB3/1PP2Pqn/R3KR2 b Qkq - 1 17,b7a6 e1c1 h2f1 b3e6 f1e3 e6f7,3016,115,84,535,advantage attackingF2F7 castling long middlegame sacrifice,https://lichess.org/0SGCRK3U/black#34,French_Defense French_Defense_Queens_Knight
yDTBZ,r3k2r/ppp1b1pp/2np2q1/4Pb2/2NPnB2/2N2Q2/PPP3PP/R3KB1R w KQkq - 3 12,f1d3 c6d4 f3e3 g6g2 e1c1 e4c3 e5d6 e8g8,3010,109,91,3040,advantage castling defensiveMove middlegame veryLong,https://lichess.org/LfvCja11#23,Latvian_Gambit_Accepted Latvian_Gambit_Accepted_Bilguer_Variation
