PuzzleId,FEN,Moves,Rating,RatingDeviation,Popularity,NbPlays,Themes,GameUrl,OpeningTags
A4UWq,6k1/4R3/3P2PP/3r4/6n1/8/6K1/8 b - - 2 61,g4f6 e7e6 d5g5 g2f1 g5g6 d6d7 g8f7 h6h7 f7e6 d7d8n e6d5 h7h8q,3002,129,87,1338,advancedPawn advantage defensiveMove endgame exposedKing promotion sacrifice underPromotion veryLong,https://lichess.org/5FyrcxbA/black#122,
FhyeW,8/b7/P3p3/4p1Pp/1p3k1P/5P2/3p2K1/1R6 w - - 2 46,b1b4 e5e4 b4b1 e4e3 g5g6 e3e2 g6g7 d2d1q g7g8q e2e1n,3013,109,92,2432,advancedPawn crushing defensiveMove endgame promotion underPromotion veryLong,https://lichess.org/SJ1ivDph#91,
QvEoq,r2k2r1/p7/1ppPp3/4qpp1/1P1R4/P5P1/3QBPb1/2R1K3 b - - 1 30,g8h8 d2g5 d8c8 d4d3 e5b2 d6d7 c8b7 d7d8n,3053,120,89,2103,advancedPawn advantage deflection exposedKing middlegame promotion quietMove underPromotion veryLong,https://lichess.org/zqUafoSD/black#60,
a5AgW,k7/1p5p/p7/2P1Q3/P3pp2/1P1rq2P/6P1/3R3K w - - 0 36,e5e8 a8a7 d1d3 e3d3 e8e6 f4f3 e6b6 a7b8 g2f3 e4f3 h1h2 f3f2 c5c6 f2f1n h2g1 d3e3 b6e3 f1e3,3057,114,94,470,advancedPawn crushing endgame master masterVsMaster promotion underPromotion veryLong,https://lichess.org/FrQ2HXZ6#71,
mlyoH,1k6/p1q5/1pPp4/3P4/1P1r4/Q5pP/8/R5K1 b - - 0 38,d4d5 a3a2 d5g5 a1f1 c7e7 c6c7 b8b7 a2a7 b7a7 c7c8n,3066,141,88,1500,advancedPawn attraction crushing deflection endgame promotion quietMove sacrifice underPromotion veryLong,https://lichess.org/y9Zr6Tcj/black#76,
w5GLb,5Q2/p3P3/1p4pk/7p/2P5/4q2P/P4pPK/8 b - - 1 51,h6g5 g2g3 h5h4 f8f4 e3f4 g3f4 g5f6 e7e8n f6f7 h2g2 f7e8 g2f2 e8f7 f2f3,3026,127,91,1064,advancedPawn crushing defensiveMove endgame master masterVsMaster promotion queenEndgame quietMove underPromotion veryLong,https://lichess.org/9H2sXhWP/black#102,
