PuzzleId,FEN,Moves,Rating,RatingDeviation,Popularity,NbPlays,Themes,GameUrl,OpeningTags
USHoH,8/8/3Q1kp1/7p/8/5KP1/8/1q6 b - - 8 56,f6g5 d6f4,961,77,98,968,endgame mate mateIn1 oneMove queenEndgame,https://lichess.org/2bZwcfPL/black#112,
UUwum,8/8/2Q2k2/1p2p2p/7P/1qP3PK/8/8 b - - 5 50,b3e6 c6e6 f6e6 g3g4,976,82,96,516,crushing endgame queenEndgame short,https://lichess.org/lF2hbcjd/black#100,
UV9Le,6k1/6q1/8/3P3Q/p3Pp2/P4Pp1/1P1K2P1/8 w - - 3 43,h5g4 g7g4 f3g4 f4f3 g2f3 g3g2,912,95,93,1030,advancedPawn crushing endgame long queenEndgame,https://lichess.org/cDEGWT4H#85,
UYG15,8/5Q2/p6k/1p1P4/8/P2KP2p/1P4q1/8 w - - 1 45,f7f6 g2g6 f6g6 h6g6 d3e4 h3h2,966,76,100,108,advancedPawn crushing endgame long queenEndgame,https://lichess.org/65rwCzDq#89,
UZRj3,8/p4pk1/4p1p1/3q3p/P4P2/1PQ3PK/8/8 b - - 2 33,g7h6 c3h8,900,90,94,274,endgame mate mateIn1 oneMove queenEndgame,https://lichess.org/XcqLVR16/black#66,
UdzIL,8/7p/5p1k/6p1/6P1/6PK/2pq4/Q7 b - - 2 51,c2c1q a1f6,993,132,88,13,endgame mate mateIn1 oneMove queenEndgame,https://lichess.org/lyPPD6NV/black#102,
UeOFE,1Q6/8/3kp1p1/5p1p/7P/1p4P1/1P1q1P1K/8 b - - 13 60,d6d5 b8d8 d5c4 d8d2,958,91,93,918,crushing endgame queenEndgame short skewer,https://lichess.org/02oEheWD/black#120,
UfwsZ,4k3/5p2/4p3/1p1p4/1P1P3p/2P1QP1K/6P1/5q2 w - - 4 48,e3g5 f1h1 h3g4 h1g2,971,86,95,2396,crushing deflection endgame queenEndgame short,https://lichess.org/9jKbgcvm#95,
UgFaP,8/7k/8/6pp/2q5/1p4PP/1Q3P2/4K3 b - - 8 46,c4c2 b2c2 b3c2 e1d2,960,88,86,372,crushing endgame queenEndgame short,https://lichess.org/CYfx0BVM/black#92,
UgmKq,8/5Q2/1p5K/1k6/5P2/8/8/6q1 b - - 6 61,g1h2 f7h5 h2h5 h6h5 b5c6 f4f5,917,99,95,1941,crushing defensiveMove endgame long master queenEndgame,https://lichess.org/cj2lRPJg/black#122,
UjVkM,8/5Qpk/4p2p/3p4/8/1P5P/6PK/q7 b - - 4 47,a1f6 f7f6 g7f6 b3b4 h7g7 b4b5,952,75,83,290,crushing defensiveMove endgame long queenEndgame quietMove,https://lichess.org/JtdVZ7ko/black#94,
UlyQ1,3Q4/2p2pk1/p2p4/4p3/P1P1P3/K2P4/5q2/8 w - - 2 39,d8c7 f2c5 c7c5 d6c5,966,86,92,1311,crushing endgame queenEndgame short,https://lichess.org/NQGPCIeY#77,
Um7jO,8/1Q6/8/pp3k2/2p5/8/2P2PKP/1q6 w - - 13 40,c2c3 b1e4 b7e4 f5e4,991,83,91,135,crushing endgame queenEndgame short,https://lichess.org/7TCJYnVn#79,
Up7fM,8/8/5pQ1/pp6/2q1P3/4KPk1/8/8 b - - 0 37,g3h4 g6g4,997,80,91,1656,endgame mate mateIn1 oneMove queenEndgame,https://lichess.org/tkPYkRL7/black#74,
Uq0ek,7Q/8/3p4/8/3k3p/3P3K/8/1q6 b - - 1 53,d4d3 h8h7 d3e3 h7b1,998,112,63,39,crushing endgame queenEndgame short skewer,https://lichess.org/tWgiemxF/black#106,
Uqbz1,8/6k1/6p1/8/5P1K/6Q1/8/7q w - - 9 61,h4g4 h1h5,947,150,91,35,endgame mate mateIn1 oneMove queenEndgame,https://lichess.org/2PWEU1yX#121,
UuLzA,8/8/1kq2QK1/6p1/6Pp/8/8/8 w - - 4 55,g6g5 c6f6 g5f6 h4h3 g4g5 h3h2 g5g6 h2h1q,993,87,96,190,advancedPawn crushing endgame promotion queenEndgame veryLong,https://lichess.org/4yVE2itr#109,
Uubcc,8/1p3q1k/p1p1p2P/P1Pp2Q1/1P1P2K1/8/8/8 b - - 2 50,f7f1 g5g7,992,81,85,92,endgame master mate mateIn1 oneMove queenEndgame,https://lichess.org/dmDpQBvS/black#100,
UuogI,K7/P1k4P/1q6/8/8/8/8/8 w - - 1 64,h7h8q b6c6,956,83,89,338,endgame mate mateIn1 oneMove queenEndgame,https://lichess.org/tpUEEEJB#127,
UyVxr,8/7k/p1p2ppp/1p1qR3/1P3QP1/P3K2P/8/8 b - - 0 37,d5e5 f4e5 f6e5 e3e4 h7g8 e4e5,956,97,95,400,crushing endgame long queenEndgame,https://lichess.org/hOmMwaND/black#74,
UyjgX,1k6/1P4pp/PK6/5p2/6P1/5P2/4p2P/8 b - - 0 47,e2e1q a6a7,981,128,100,17,advancedPawn endgame mate mateIn1 oneMove queenEndgame,https://lichess.org/KZPAXrwO/black#94,
Uyq2v,8/Q4pp1/1p3k2/2q5/8/7P/5PPK/8 w - - 1 37,a7a1 c5e5 a1e5 f6e5,975,95,89,41,crushing endgame queenEndgame short,https://lichess.org/0mZ8ud0g#73,
V0Vat,1k6/8/1p6/2p4p/Q6P/1P1K2P1/8/4q3 w - - 16 78,a4d7 e1d1 d3e4 d1d7,985,98,90,63,crushing endgame master queenEndgame short skewer,https://lichess.org/jdbPOESB#155,
V18bv,6k1/2p2p1p/3p2p1/p1pPq3/P7/1P6/2PQ1PPP/5K2 w - - 3 33,f1g1 e5a1 d2c1 a1c1,927,104,81,31,backRankMate endgame mate mateIn2 queenEndgame short,https://lichess.org/6VvMGjXe#65,
V1rrb,8/P7/2p5/2P5/8/7K/5k2/6q1 w - - 0 63,a7a8q g1g3,929,80,100,60,endgame mate mateIn1 oneMove queenEndgame,https://lichess.org/9OCJGZSR#125,
V2lwN,6k1/6p1/7p/p3Q3/5P2/1P1p2P1/6KP/3q4 b - - 6 49,d1e2 e5e2 d3e2 g2f2 e2e1b f2e1,934,91,91,343,crushing endgame long queenEndgame,https://lichess.org/SpTHHpJJ/black#98,
V4ihp,8/7p/p7/8/8/1P1p4/P3q3/1K1k2Q1 b - - 21 71,d1d2 g1c1,938,86,90,225,endgame mate mateIn1 oneMove queenEndgame,https://lichess.org/R3MNSL5p/black#142,
V52QS,1k6/4q1pp/1pP5/4p3/4P3/2Q4P/6P1/6K1 w - - 0 35,c3c4 e7c5 c4c5 b6c5,903,92,93,1462,crushing endgame master queenEndgame short,https://lichess.org/tsZNnf4g#69,
V7dXc,8/8/ppk5/7p/1pP1Q3/P1q2Pp1/6P1/1K6 b - - 3 44,c6c5 e4d5,915,94,95,1519,endgame mate mateIn1 oneMove queenEndgame,https://lichess.org/7TZEZGla/black#88,
V90vu,8/8/K6p/p5k1/8/6QP/q7/8 b - - 1 45,g5h5 g3g4,950,80,91,152,endgame master mate mateIn1 oneMove queenEndgame,https://lichess.org/Cw4iL8AQ/black#90,
V9x15,8/k6p/2ppp1p1/P2q1p2/1Q6/4P1P1/2PP3P/6K1 b - - 0 30,a7a6 b4b6,937,82,85,116,endgame mate mateIn1 oneMove queenEndgame,https://lichess.org/OtqAPqQC/black#60,
VAjVc,8/8/5pkp/1P4p1/8/5q2/2Q2P1K/8 b - - 8 46,f6f5 c2c6 f3c6 b5c6,910,80,83,220,crushing endgame queenEndgame short,https://lichess.org/4j7PNnKY/black#92,
VBDc6,8/3K2pk/8/5pqp/3PQ3/4P3/PP6/8 w - - 0 37,e4f4 g5f4 e3f4 h5h4 d4d5 h4h3,940,85,92,387,crushing endgame long queenEndgame quietMove,https://lichess.org/KlP4oqe5#73,
VBG1f,8/8/2KQ4/p6p/P6P/8/2q2k2/8 w - - 0 44,d6c5 c2c5 c6c5 f2g3,992,76,90,352,crushing endgame queenEndgame short,https://lichess.org/fpVpMKCO#87,
VClHU,6Q1/3K4/8/2p5/2k5/8/8/1q6 b - - 1 66,c4b4 g8b8 b4c3 b8b1,995,78,96,1779,crushing endgame master queenEndgame short skewer,https://lichess.org/40AsBp8c/black#132,
VDBIU,1Q6/p4kpp/8/8/8/KP6/5P2/4q3 w - - 0 45,b8a7 e1e7 a7e7 f7e7,974,81,100,53,crushing endgame queenEndgame short,https://lichess.org/mMdLPuFY#89,
VE9P3,5k2/7p/1p3Pp1/p2Q1p2/3P1K2/8/1P4PP/3q4 b - - 4 38,d1d2 f4e5 d2e1 e5d6,936,79,73,68,crushing defensiveMove endgame master queenEndgame short,https://lichess.org/uNbQO5Rk/black#76,
VEMuI,1Q6/8/7p/4K1k1/8/7P/5p2/8 b - - 0 50,f2f1q b8g8 g5h5 g8g4,967,83,94,595,endgame mate mateIn2 queenEndgame short,https://lichess.org/CMGtjqxf/black#100,
VETIY,6k1/pppq1ppp/8/3pQ3/3P4/2P5/PP3PPP/6K1 b - - 0 21,c7c6 e5b8 d7c8 b8c8,969,93,100,43,backRankMate endgame mate mateIn2 queenEndgame short,https://lichess.org/dBMRKJl6/black#42,
VGVz0,6Q1/8/4p3/8/4P3/1q2K3/k7/8 w - - 2 49,e3f4 e6e5 f4f5 b3g8,976,83,92,271,crushing discoveredAttack endgame queenEndgame short,https://lichess.org/2qojLrSY#97,
VJVbF,8/7P/5p2/8/8/1p4P1/p1k2P2/K7 w - - 2 61,h7h8q b3b2 a1a2 b2b1q a2a3 b1b3,951,82,80,321,advancedPawn endgame exposedKing long mate mateIn3 promotion queenEndgame,https://lichess.org/gbfdT0rP#121,
VKDKs,6k1/5p2/1Q4p1/1p5p/2P5/8/q5PP/7K w - - 0 32,b6b5 a2a1 b5b1 a1b1,970,167,33,12,backRankMate endgame mate mateIn2 queenEndgame short,https://lichess.org/cU67YPlU#63,
VKI6X,8/kPK5/6p1/8/8/8/7p/8 b - - 1 59,h2h1q b7b8q a7a6 b8b6,915,83,96,2904,advancedPawn endgame mate mateIn2 promotion queenEndgame short,https://lichess.org/Jom87538/black#118,
VKi3W,8/5p2/6p1/3qp1k1/Q7/6P1/5P1P/6K1 b - - 11 38,f7f5 a4h4,938,77,84,105,endgame mate mateIn1 oneMove queenEndgame,https://lichess.org/2BXa8KuG/black#76,
VLLVc,6k1/6pp/8/pQ1p4/Pq1P4/2p2K2/2P3PP/8 b - - 2 32,b4d4 b5e8,931,100,93,893,endgame mate mateIn1 oneMove queenEndgame,https://lichess.org/KQDIjmB3/black#64,
VN9fn,8/7p/5p1k/2n3p1/5q1P/P3Q2K/5PP1/8 w - - 5 39,e3c5 g5g4,931,97,95,598,endgame mate mateIn1 oneMove queenEndgame,https://lichess.org/31aRcNb1#77,
VQFWZ,6k1/6pp/p1Q2p2/1p6/8/8/PPp2KPP/3q4 b - - 3 34,c2c1q c6e8,948,76,100,318,endgame mate mateIn1 oneMove queenEndgame,https://lichess.org/RnllOtF3/black#68,
VRSf8,7k/1p5p/p7/4R3/6P1/7P/P3qQK1/8 b - - 0 30,e2e5 f2f8,970,178,82,18,endgame mate mateIn1 oneMove queenEndgame,https://lichess.org/8q71pEF8/black#60,
VRVBl,8/Q7/2pp3k/P3p2p/2P1q1p1/5RP1/5P1P/6K1 b - - 0 42,g4f3 a7e3 e4e3 f2e3,985,76,100,200,crushing endgame master queenEndgame short,https://lichess.org/wbnCBwIz/black#84,
VRfrp,6k1/6p1/4pp1p/P7/4q3/1P1p2P1/3Q3P/6K1 b - - 1 37,e4e2 d2e2 d3e2 g1f2 e2e1b f2e1,980,94,94,566,crushing endgame long queenEndgame,https://lichess.org/OwVaUh58/black#74,
VShZO,6k1/p6p/1pqPp1p1/4Qp2/3p4/7P/PP3PPK/8 b - - 1 29,c6d5 e5d5 e6d5 d6d7,958,99,93,1054,advancedPawn crushing endgame queenEndgame short,https://lichess.org/1tLXduFQ/black#58,
VTYUk,8/8/1Q6/P7/4qppk/8/8/6K1 b - - 7 74,h4g3 b6f2 g3h3 f2h2,989,81,95,1083,endgame mate mateIn2 queenEndgame short,https://lichess.org/brGjNk0S/black#148,
VTnlu,8/2Q4p/6pk/8/2pq1PP1/7P/7K/8 b - - 0 39,c4c3 g4g5 h6h5 c7h7,997,76,98,652,deflection endgame master mate mateIn2 queenEndgame short,https://lichess.org/KvNRZVwk/black#78,
VYiko,8/2p2Q1k/6pp/8/8/P7/1q4PK/8 b - - 1 48,b2g7 f7g7 h7g7 a3a4 g7f6 a4a5,913,93,89,300,crushing defensiveMove endgame long queenEndgame quietMove,https://lichess.org/T50bJYbl/black#96,
VYkCB,5Q2/1k4pp/1p3p2/8/P5P1/1q5K/5P1P/8 w - - 0 31,h3h4 g7g5 h4h5 b3h3,997,84,91,754,endgame mate mateIn2 queenEndgame short,https://lichess.org/sQSjD1xs#61,
VcMxC,1Q6/8/7p/p1K5/P3k3/2P5/5q1P/8 w - - 1 47,c5b5 f2b2 b5c6 b2b8,950,79,74,175,crushing endgame queenEndgame short skewer,https://lichess.org/iYLHIJVN#93,
VeqVI,8/1p6/1k1p4/1P2pQ2/1P2P1P1/K7/2q5/8 b - - 3 55,b6b5 f5d7 c2c6 d7c6,951,94,92,385,crushing endgame queenEndgame short,https://lichess.org/DjaPhvhn/black#110,
VfuJT,8/5kp1/1Q3p1p/1P2q3/6P1/5p2/P4P1P/6K1 w - - 2 43,b6e3 e5a1 e3c1 a1c1,955,77,83,153,endgame mate mateIn2 queenEndgame short,https://lichess.org/iePFJ3Yg#85,
VgoL2,8/3P3p/8/6p1/4P1P1/1p5P/p1k5/K7 w - - 2 48,d7d8q b3b2 a1a2 b2b1q a2a3 b1b3,992,99,100,49,advancedPawn endgame exposedKing long mate mateIn3 promotion queenEndgame,https://lichess.org/P6Phwl5t#95,
VhHc0,8/5Q2/1k6/1p1p1p2/2qP2p1/4P3/1P3PK1/8 b - - 3 52,b6a5 f7a7 a5b4 a7a3,986,80,94,921,endgame mate mateIn2 queenEndgame short,https://lichess.org/VfnMcEr3/black#104,
VhIbu,2Q5/8/3q2P1/p6K/1k6/8/8/8 b - - 0 49,d6d1 c8g4 d1g4 h5g4,985,77,97,2779,crushing endgame queenEndgame short,https://lichess.org/41sEwXaW/black#98,
VoMWi,4kQ2/4q3/p3P3/8/2pQ4/8/1p2K1P1/8 b - - 0 45,e7f8 d4d7,920,77,90,450,endgame mate mateIn1 oneMove queenEndgame,https://lichess.org/g5NVILZ6/black#90,
VoMdY,8/6kp/p1Q2qp1/3P4/4Pp2/3p3P/5PP1/6K1 w - - 0 36,g1f1 f6a1 c6c1 a1c1,966,85,91,268,endgame mate mateIn2 queenEndgame short,https://lichess.org/BTjundci#71,
Vqq4U,6Q1/8/8/p6K/k6P/8/8/1q6 b - - 0 42,b1d1 g8g4 d1g4 h5g4 a4b3 h4h5 b3a2 h5h6 a2b1 h6h7 a5a4 h7h8q,965,78,100,345,advancedPawn crushing endgame promotion queenEndgame quietMove veryLong,https://lichess.org/KtOOm69d/black#84,
VsAlu,Q7/5p1p/6pk/p7/5P1K/6P1/7P/4q3 b - - 0 37,e1d2 a8f8,953,77,90,559,endgame mate mateIn1 oneMove queenEndgame,https://lichess.org/BV7SYf87/black#74,
Vt9Vl,1Q6/7k/6p1/pp6/8/8/q1P2PPP/6K1 w - - 0 41,b8b5 a2a1 b5f1 a1f1 g1f1 a5a4,932,82,60,56,crushing defensiveMove endgame long queenEndgame,https://lichess.org/HXDKuPBC#81,
Vv2Vr,5Rk1/5p1p/p4Pp1/3q4/8/2p4P/4Q1P1/7K b - - 0 33,g8f8 e2e7 f8g8 e7e8,947,78,95,210,endgame mate mateIn2 queenEndgame short,https://lichess.org/fvzpHS8T/black#66,
Vv7Fs,3Q4/5kp1/8/7p/1K6/1P6/P3q3/8 w - - 4 47,d8d7 e2e7 d7e7 f7e7 b4c5 h5h4,991,83,90,133,crushing defensiveMove endgame long queenEndgame,https://lichess.org/5gWHbywI#93,
VvCam,8/8/3p2pp/3P3k/8/q6P/4Q3/5K2 b - - 9 54,h5h4 e2g4,972,76,97,1596,endgame mate mateIn1 oneMove queenEndgame,https://lichess.org/klvBdTPi/black#108,
VwUIU,8/p7/2p4Q/8/5k2/2q5/5P2/6K1 b - - 3 67,f4f3 h6h3 f3e4 h3c3,991,79,90,102,crushing endgame queenEndgame short skewer,https://lichess.org/prBFW6fA/black#134,
VwX6b,4K3/8/8/5Qpk/8/5P2/P7/4q3 w - - 1 56,f5e4 e1e4 f3e4 g5g4 e4e5 g4g3 e8d7 g3g2 e5e6 g2g1q,907,102,65,30,advancedPawn crushing endgame master masterVsMaster promotion queenEndgame quietMove veryLong,https://lichess.org/mC3Ek9rJ#111,
VxWCG,8/6k1/5p2/p5pQ/3q4/7P/5PP1/6K1 w - - 0 55,h5e2 d4a1 e2f1 a1f1,937,76,98,633,crushing endgame queenEndgame short,https://lichess.org/r7t0wyuw#109,
Vxyqo,8/6pk/1p5p/p7/5P2/2QP2P1/1P2q1KP/8 w - - 5 38,g2h1 e2f1,980,97,95,289,endgame mate mateIn1 oneMove queenEndgame,https://lichess.org/mU6aUDOm#75,
Vy5Zn,7k/2q1PQ2/7p/1pK5/1P4P1/8/5P2/8 w - - 3 67,c5d5 c7c4 d5d6 c4f7,968,75,97,4689,crushing endgame master queenEndgame short skewer,https://lichess.org/DSRXCflD#133,
W0bWm,6k1/p4p2/2p5/5KpP/1PQP3q/P4P2/8/8 w - - 7 34,c4c6 h4f4,921,76,97,1448,endgame mate mateIn1 oneMove queenEndgame,https://lichess.org/hwC4ZFJ2#67,
W1PoW,8/2p5/1p1qQ1pk/p2Pp3/P1P1P1KP/8/8/8 w - - 0 37,h4h5 d6e6 d5e6 g6h5,956,88,87,565,crushing endgame master queenEndgame short,https://lichess.org/am7oyQH6#73,
W2Hkf,7k/5K1P/6P1/2p5/p1P5/P7/3p4/8 b - - 2 49,d2d1q g6g7 h8h7 g7g8q h7h6 g8g6,957,93,79,110,advancedPawn endgame exposedKing long mate mateIn3 promotion queenEndgame,https://lichess.org/Yo4Ky17O/black#98,
W2xJ2,6k1/5p1p/6p1/1P2p3/q2p4/5P1P/1Q3KP1/8 b - - 1 40,f7f5 b5b6 d4d3 b6b7,913,94,94,992,advancedPawn crushing endgame queenEndgame short,https://lichess.org/O3JulDjw/black#80,
W3Sek,8/8/1p1Q1p2/1p3p1p/5P2/4K1PP/8/1q1k4 b - - 15 48,d1e1 d6d2 e1f1 d2f2,948,85,96,3065,endgame mate mateIn2 queenEndgame short,https://lichess.org/wo6Yz59k/black#96,
W3kLF,4Q3/1pp2ppk/3p3p/8/2PP4/3PK3/6PP/1q6 w - - 10 36,e8f7 b1e1 e3f3 e1f1,973,199,-5,10,crushing endgame queenEndgame short,https://lichess.org/jSY72vZ8#71,
W4301,3q2k1/Q6p/2p1p3/2P3pK/6P1/7P/P7/8 w - - 2 49,h5h6 d8f6 h6h5 f6g6,914,79,96,1215,endgame mate mateIn2 queenEndgame short,https://lichess.org/KuE3njLf#97,
W5I1F,8/6pk/7p/4Q3/2Pp4/3q1P1P/6PK/8 w - - 0 40,e5e4 d3e4 f3e4 d4d3,954,85,71,155,crushing endgame queenEndgame short,https://lichess.org/L3NY91dv#79,
W5vGA,8/4k1p1/1p2Pp1p/p2p3Q/3P3P/3P2PK/3q4/8 b - - 4 45,d2f2 h5f7 e7d6 f7d7,980,88,94,866,endgame mate mateIn2 queenEndgame short,https://lichess.org/TnjtXnmA/black#90,
W6nKu,8/8/3p4/8/p2q3P/k5P1/6K1/1Q6 b - - 0 50,d4b2 b1b2 a3b2 h4h5 a4a3 h5h6 a3a2 h6h7,923,80,91,100,advancedPawn crushing endgame master queenEndgame quietMove veryLong,https://lichess.org/b2vXplMo/black#100,
W7AjZ,8/6Q1/k7/1p1p2P1/3P1Pq1/8/PP6/1K6 w - - 4 39,g7e5 g4d1,911,82,95,471,endgame mate mateIn1 oneMove queenEndgame,https://lichess.org/navxae5j#77,
W7u1v,3Q4/pp5p/5kp1/4p3/3p4/7P/PP3qPK/8 b - - 5 36,f6f5 d8f8 f5e4 f8f2,946,96,70,74,crushing endgame queenEndgame short skewer,https://lichess.org/ll0F1HPh/black#72,
W8gmc,6k1/1p5p/3p2p1/p1pP4/P1P5/K1P3P1/1Q5P/5q2 w - - 5 32,b2b7 f1a1 a3b3 a1b1,990,95,94,608,crushing endgame master queenEndgame short,https://lichess.org/ds557FjZ#63,
WBR5Q,8/1pk1Q3/p6p/2Pp2p1/3P1p2/2p2P1P/P5PK/1q6 b - - 1 40,c7c6 e7d6 c6b5 d6b6 b5c4 b6b1,982,76,96,2403,crushing endgame long queenEndgame skewer,https://lichess.org/LhxpLkFD/black#80,
WCtuc,7Q/8/2q5/1k6/8/6P1/5PK1/8 w - - 2 44,g2h3 c6h1 h3g4 h1h8,949,86,81,300,crushing endgame queenEndgame short skewer,https://lichess.org/bLvmfRrr#87,
WDjOt,8/3kq1p1/5p1p/p2p1P2/1ppP1QP1/P1P4P/KP6/8 w - - 0 31,f4b8 b4b3 b8b3 c4b3,954,90,96,2001,crushing endgame queenEndgame short,https://lichess.org/tP3099OG#61,
WDoEE,8/Q7/7k/6pp/4q3/8/PP3PPP/6K1 w - - 0 29,a7e3 e4b1 e3c1 b1c1,943,79,86,251,backRankMate endgame mate mateIn2 queenEndgame short,https://lichess.org/rMsXpexZ#57,
WDpww,8/p2Q1pk1/4p1p1/7p/4PP1K/1P4P1/P4q1P/8 w - - 2 37,d7e7 f2h2 h4g5 h2g3,972,77,100,132,deflection endgame mate mateIn2 queenEndgame short,https://lichess.org/MGSnT4VI#73,
WEV4Y,8/3Qpqk1/1p1p1p2/p7/2P1Pp2/1P3PK1/P7/8 w - - 0 35,g3f4 e7e5 f4g3 f7d7,948,87,76,33,crushing discoveredAttack endgame master queenEndgame short,https://lichess.org/PuzOYfps#69,
WI33i,4Q2k/p5p1/1p5p/4P1P1/8/4q2P/1P4K1/8 b - - 1 40,h8h7 g5g6,977,79,95,1263,endgame master mate mateIn1 oneMove queenEndgame,https://lichess.org/IidVQYGA/black#80,
WJEtZ,8/7p/pp4p1/3p1p1k/1P3Q1P/6PK/1q6/8 b - - 3 44,b2e2 f4g5,968,165,91,34,endgame mate mateIn1 oneMove queenEndgame,https://lichess.org/EoA4vMec/black#88,
WJqhf,8/1P3pk1/2Q3p1/8/2P5/PK3P1p/8/5q2 w - - 0 50,b7b8q f1b1 b3a4 b1b8,946,78,100,591,crushing endgame queenEndgame short skewer,https://lichess.org/MUTz2GyF#99,
WKTG0,8/2Q3pk/p6p/1p3p2/5P1Q/2P3PK/4qP1P/8 w - - 3 39,c7e5 e2f1,987,80,94,428,endgame mate mateIn1 oneMove queenEndgame,https://lichess.org/CkPJcjnu#77,
WKXas,8/5ppk/7p/2pQ4/4P3/1P5P/2q3PK/8 b - - 0 32,c2f2 d5f5 f2f5 e4f5,927,82,86,180,crushing endgame master masterVsMaster queenEndgame short,https://lichess.org/sMZwr2r7/black#64,
WOmEN,4Q3/p7/1p6/1P6/P7/7K/5k2/3q4 w - - 0 64,e8f7 d1f3 f7f3 f2f3,972,81,94,328,crushing endgame master queenEndgame short,https://lichess.org/prySs5CV#127,
WQ88Z,3k4/1K5p/2P5/1P6/8/P6P/2q5/8 b - - 2 58,c2f2 c6c7 d8e7 c7c8q,966,122,82,15,advancedPawn crushing deflection endgame promotion queenEndgame short,https://lichess.org/IvgqB9cx/black#116,
WR6lR,5Q2/6p1/2p4k/5p1p/p3q3/8/5K2/8 b - - 3 50,h6g5 f8g7 g5f4 g7g3,916,77,100,123,endgame master masterVsMaster mate mateIn2 queenEndgame short,https://lichess.org/4unZ3i3F/black#100,
WR9Ju,8/7k/2p1P1pp/q1Pp4/8/7P/5QK1/8 b - - 0 42,a5d8 f2f7 h7h8 e6e7 d8e7 f7e7,993,81,92,594,advancedPawn crushing endgame long queenEndgame,https://lichess.org/Er1RxYWi/black#84,
WSEfI,8/7k/4q1pp/8/7P/3p1PP1/3Q4/6K1 b - - 0 43,e6e2 d2e2 d3e2 g1f2 e2e1q f2e1,998,87,92,211,crushing endgame long queenEndgame,https://lichess.org/LHjwogrG/black#86,
WScQd,5k2/1pp5/p2q4/6Q1/P5Pp/7K/1PP3P1/8 w - - 2 36,h3h4 d6h2,901,110,94,65,endgame mate mateIn1 oneMove queenEndgame,https://lichess.org/XCSVa3j3#71,
WWPgm,k5q1/1p6/p6p/8/3Qr2K/3P3P/P1P5/8 w - - 0 39,d4e4 g8g5,936,79,100,71,endgame mate mateIn1 oneMove queenEndgame,https://lichess.org/18qRLJsN#77,
WZ4aC,3k4/1p6/2pPQ3/3pP3/Pp1P1qPp/1P6/7K/8 w - - 1 49,h2h3 f4g3,945,83,93,245,endgame mate mateIn1 oneMove queenEndgame,https://lichess.org/mEt8OJtc#97,
WcUZc,3k4/pQq4p/2P2p2/8/8/7P/5PPK/8 w - - 1 37,g2g3 c7b7 c6b7 d8c7,972,86,92,253,crushing endgame queenEndgame short,https://lichess.org/NcdUfASj#73,
Wdc7n,4Q3/8/3P2p1/3K1p2/8/1q3PP1/7P/2k5 w - - 7 53,d5e5 b3e3 e5d5 e3e8,913,88,81,44,crushing endgame queenEndgame short skewer,https://lichess.org/PQUwyvuS#105,
WfiDD,8/5Qpk/7p/2q2K2/4P3/5P2/2P5/8 w - - 7 56,f5f4 c5g5,926,85,78,348,dovetailMate endgame mate mateIn1 oneMove queenEndgame,https://lichess.org/ZzkUmFGA#111,
WgmKE,6K1/2q4P/4k3/8/8/8/8/8 w - - 3 55,h7h8q c7f7,997,76,100,275,endgame mate mateIn1 oneMove queenEndgame,https://lichess.org/F26CC8Zn#109,
Wj072,8/6pk/2Q4p/5p1P/P2P4/4PpPK/6q1/8 w - - 2 38,h3h4 g2h1,930,77,89,394,endgame mate mateIn1 oneMove queenEndgame,https://lichess.org/de73EDB6#75,
Wlgqp,8/8/7k/P5pp/8/6P1/5q1K/1Q6 w - - 6 56,h2h3 g5g4 h3h4 f2h2,940,97,84,335,endgame mate mateIn2 queenEndgame short,https://lichess.org/5QS7Vqhg#111,
WoID9,8/8/7Q/3P2p1/p5Pk/q3P3/7K/8 b - - 2 58,h4g4 h6h3,912,78,89,332,endgame mate mateIn1 oneMove queenEndgame,https://lichess.org/w3xrZbb7/black#116,
WrqNl,8/2q1k1p1/1p3p1p/2pP4/6Q1/1P4PP/6PK/8 b - - 1 40,e7d6 g4e6,921,78,97,772,endgame mate mateIn1 oneMove queenEndgame,https://lichess.org/JuQZgs6x/black#80,
Wt6R4,8/6pk/7p/5q2/P1Q5/3p1P1P/6PK/8 w - - 0 37,h2g1 d3d2,993,85,91,144,advancedPawn crushing endgame oneMove queenEndgame,https://lichess.org/WOVpi0t0#73,
WuEUg,8/2p5/1p1p2P1/p1kP4/P3pQKp/1P6/8/4q3 b - - 0 54,e4e3 f4c4,926,77,71,122,endgame mate mateIn1 oneMove queenEndgame,https://lichess.org/bsMeJJlq/black#108,
Wuwek,5Q2/8/1q2K3/8/8/1k6/8/8 w - - 4 72,e6f5 b6f2 f5e5 f2f8,991,89,79,127,crushing endgame master queenEndgame short skewer,https://lichess.org/4TEokTPz#143,
WwAk1,2Q5/8/6p1/1K6/6k1/8/5P2/7q b - - 0 46,g4h5 c8h8 h5g4 h8h1,934,90,93,758,crushing endgame queenEndgame short skewer,https://lichess.org/TcLpfTbF/black#92,
X05Gh,6k1/6p1/8/1p1Q4/6qp/1P4P1/2P3K1/8 b - - 0 47,g8h8 d5d8 h8h7 d8h4 g4h4 g3h4,978,75,100,218,crushing endgame long master queenEndgame,https://lichess.org/KCHUwr3X/black#94,
X0ZED,8/8/4p3/3p3q/k1pP1Pp1/1pP1P3/1P3QK1/8 w - - 8 67,f2g1 h5h3 g2f2 h3f3,989,77,100,324,crushing endgame queenEndgame short,https://lichess.org/xYBGMfvM#133,
X1055,2Q5/5pkp/4p1p1/1P6/3p4/1K6/7P/q7 b - - 0 41,d4d3 c8c3 a1c3 b3c3,987,86,93,2214,crushing endgame queenEndgame short,https://lichess.org/YNw8V5UH/black#82,
X1bUj,8/8/8/5pqp/7k/6p1/6K1/3Q4 b - - 1 79,f5f4 d1h1 h4g4 h1h3,962,95,94,225,endgame mate mateIn2 queenEndgame short,https://lichess.org/DRBLe538/black#158,
X1cz9,7Q/8/2p3q1/2Pp2pk/3Pp3/4P3/5PK1/8 b - - 5 49,h5g4 h8h3,971,84,93,926,endgame master mate mateIn1 oneMove queenEndgame,https://lichess.org/BLbAcniF/black#98,
X1sMc,2q3k1/5p2/1Q2p1p1/1p1pP2p/8/2K2P2/PP4PP/8 w - - 1 29,c3b4 c8c4 b4a3 c4a4,940,98,95,1096,endgame mate mateIn2 queenEndgame short,https://lichess.org/Kbjdo6aY#57,
X1toL,8/4P2p/2pP2pk/2P2q2/8/6P1/4p1KP/8 w - - 0 39,e7e8q f5f1,938,79,98,285,dovetailMate endgame mate mateIn1 oneMove queenEndgame,https://lichess.org/U5h0RkNF#77,
X4kJr,8/6k1/5p2/8/1p1Q4/7P/5PPK/4q3 w - - 0 37,d4b2 e1e5 b2e5 f6e5,989,78,96,3189,crushing endgame queenEndgame short,https://lichess.org/BIxDGNOM#73,
X5ZVy,6k1/5pp1/1p2p3/7p/4P1q1/2PQ2P1/PP4K1/8 b - - 0 29,h5h4 d3d8 g8h7 d8h4 g4h4 g3h4,980,77,86,86,advantage endgame long queenEndgame,https://lichess.org/Xc5N5n7G/black#58,
X6vZP,8/1kp2Q2/1p6/pP2p1p1/P1Pq4/6P1/6KP/8 b - - 5 38,e5e4 f7d5 d4d5 c4d5,978,82,83,84,crushing endgame queenEndgame short,https://lichess.org/SNG7hTiW/black#76,
X7EJT,6k1/5ppp/2p5/p2p4/4q3/2P5/PP1Q1PPP/6K1 w - - 0 24,a2a3 e4b1 d2c1 b1c1,987,82,91,478,backRankMate endgame mate mateIn2 queenEndgame short,https://lichess.org/zSwOcyYz#47,
X7TJ4,4Q3/1kp4q/pp1p4/8/1P6/6P1/P4P2/5K2 w - - 1 32,e8e2 h7h1,985,79,89,379,endgame mate mateIn1 oneMove queenEndgame,https://lichess.org/UlEqab48#63,
X8Mwp,k5q1/1p6/1P1Qp3/p3Pp2/2P2P2/7p/2P5/5K2 w - - 0 48,d6d2 g8g2 d2g2 h3g2,930,81,93,544,advancedPawn crushing endgame queenEndgame short,https://lichess.org/d0b2mpBa#95,
X8jyr,8/5QK1/2pk1p2/1p4p1/6P1/P6P/1q6/8 w - - 0 49,f7f6 b2f6 g7f6 c6c5,977,92,100,44,crushing defensiveMove endgame queenEndgame short,https://lichess.org/9CIVkk2W#97,
XBodR,8/5p2/6pk/6p1/3Q4/3K1PP1/3p4/3B2q1 b - - 3 40,g1d1 d4h8,960,92,100,42,endgame mate mateIn1 oneMove queenEndgame,https://lichess.org/s4JTwoUm/black#80,
XDUHW,8/8/8/8/2K5/3Q4/8/qk6 b - - 6 76,b1a2 d3b3,977,77,97,1339,endgame mate mateIn1 oneMove queenEndgame,https://lichess.org/hbx0UK6W/black#152,
XEP2R,1k2Q3/p7/1p3q2/6p1/3P2K1/1P6/P7/8 b - - 0 45,b8c7 e8e5 f6e5 d4e5,966,86,95,1193,crushing endgame queenEndgame short,https://lichess.org/FEpBpV3B/black#90,
XFCrh,8/p4Q2/1kp5/1q6/4PKP1/8/8/8 w - - 1 55,g4g5 b5f1 f4e3 f1f7,978,81,88,113,crushing endgame queenEndgame short skewer,https://lichess.org/rcKF0C2e#109,
XH6R9,8/1p2pp1k/p2p2p1/3P4/3qPPp1/1P4K1/P1Q3PP/8 b - - 8 36,f7f5 e4f5 g6f5 c2f5,988,77,97,1059,advantage endgame master queenEndgame short,https://lichess.org/N2d6lYjP/black#72,
XK7mO,8/8/1qpQp3/1k1pP3/pp6/1P6/P1P5/1K6 w - - 0 57,d6e6 b6g1 b1b2 a4a3,950,79,89,303,endgame mate mateIn2 queenEndgame short,https://lichess.org/zh6nNz3W#113,
XP7j8,2k5/pp3pp1/4p3/3q2P1/8/4Q3/PP3P2/1K6 w - - 0 26,e3a7 d5d1,910,93,100,40,endgame master mate mateIn1 oneMove queenEndgame,https://lichess.org/BGyY8avL#51,
XQi6P,1Q6/K6p/6p1/8/6P1/4k2P/P7/5q2 b - - 0 39,f1h3 b8b3 e3f4 b3h3,995,80,94,1051,crushing endgame master queenEndgame short skewer,https://lichess.org/xKRtlkIN/black#78,
XS480,8/5KPk/8/2p5/8/8/2p5/8 b - - 1 55,c2c1q g7g8q h7h6 g8g6,981,78,96,897,advancedPawn endgame mate mateIn2 promotion queenEndgame short,https://lichess.org/UO7PdW1t/black#110,
XSBpm,8/6pp/p4k2/5P2/4Q3/5P2/6P1/q5K1 w - - 2 39,g1h2 a1e5 e4e5 f6e5,946,90,100,30,crushing endgame queenEndgame short,https://lichess.org/QPmB0X21#77,
XV9Nn,8/1p6/6kp/3P2p1/2Pq1p2/1P6/4Q1P1/4K3 b - - 3 47,g6f5 e2e6,954,76,100,174,dovetailMate endgame master mate mateIn1 oneMove queenEndgame,https://lichess.org/mZU5lyXF/black#94,
XVWbi,2Q5/5p2/pK5p/8/8/8/PP4pk/8 w - - 1 45,c8g4 g2g1q g4g1 h2g1,963,91,89,147,advancedPawn crushing endgame promotion queenEndgame short,https://lichess.org/cIGT6fne#89,
XW0vg,3Q4/8/6pp/6k1/1p2qpP1/7P/P4P1K/8 b - - 11 52,e4e7 d8e7,985,88,52,69,endgame hangingPiece master mate mateIn1 oneMove queenEndgame,https://lichess.org/fPhRMk6F/black#104,
XY5Fj,4Q3/2p2ppk/p6p/1pPP4/5KP1/5P2/P7/6q1 b - - 12 41,g7g5 f4f5 h7g7 e8e5,994,82,94,1237,advantage defensiveMove endgame queenEndgame short,https://lichess.org/uvvPYAfH/black#82,
XYB9h,8/4P3/p7/8/P2P4/8/5kpK/8 w - - 1 51,e7e8q g2g1q h2h3 g1g3,953,94,93,1961,advancedPawn endgame mate mateIn2 promotion queenEndgame short,https://lichess.org/8wQWp8PV#101,
XYVpm,8/2k5/3p1p2/3Pp1p1/QK2P2p/5P1P/1q4P1/8 w - - 3 56,b4a5 b2b6,905,88,88,260,endgame mate mateIn1 oneMove queenEndgame,https://lichess.org/MGBoE6Mj#111,
XaKPg,8/5p1k/p5pp/P4P1K/3Q2P1/7P/8/4q3 w - - 0 68,f5g6 f7g6,945,84,100,42,endgame master mate mateIn1 oneMove queenEndgame,https://lichess.org/8CARVVNT#135,
XaoyD,7k/6p1/1p4Qp/p1p5/2P2KP1/1P3P2/P6q/8 w - - 2 41,f4f5 h2c2 f5e5 c2g6,973,75,96,1813,crushing deflection endgame queenEndgame short skewer,https://lichess.org/Q4Y0J1gT#81,
XbUXD,8/1p3KPk/p7/8/P7/8/2p5/8 b - - 1 69,c2c1q g7g8q h7h6 g8g6,965,92,94,1627,advancedPawn endgame mate mateIn2 promotion queenEndgame short,https://lichess.org/iYrVmS0I/black#138,
Xbgi1,6k1/pp2qppp/2p1P3/2P1Q3/1P6/P5P1/6KP/8 b - - 2 30,e7e6 e5b8 e6c8 b8c8,969,82,88,319,backRankMate endgame mate mateIn2 queenEndgame short,https://lichess.org/P2ooWaCc/black#60,
Xc40H,8/8/8/8/7P/2p3P1/1kq2QK1/8 w - - 0 57,h4h5 c2f2 g2f2 c3c2 h5h6 c2c1q,942,169,67,21,advancedPawn crushing endgame long promotion queenEndgame,https://lichess.org/Lgt6Qsfi#113,
XcFMv,8/pp6/8/4qk2/8/P3p1PP/1P2Q1K1/8 w - - 7 45,g2f3 e5e4,951,76,99,1470,endgame master mate mateIn1 oneMove queenEndgame,https://lichess.org/PgsUNgfG#89,
XdkcA,5Q2/1p2p3/k2pP2p/1p1P4/1K3P2/1P6/P6p/8 b - - 0 45,h2h1q f8a8 a6b6 a8a5,954,80,81,45,endgame mate mateIn2 queenEndgame short,https://lichess.org/RHYJ3VF0/black#90,
XeGU9,8/p5k1/2q5/8/1P3P2/P5PQ/4K2n/8 w - - 1 50,h3h2 c6c2 e2f3 c2h2,921,77,100,78,crushing endgame queenEndgame short skewer,https://lichess.org/amFxMKoW#99,
