PuzzleId,FEN,Moves,Rating,RatingDeviation,Popularity,NbPlays,Themes,GameUrl,OpeningTags
0KuxT,3q1r2/1b1nbp1k/4p2p/3pP2Q/2pP1PPN/1pP5/1P6/rNKR3R b - - 0 25,f8g8 h5h6 h7h6 h4f5 h6g6 h1h6,2193,85,92,141605,attraction doubleCheck hookMate long mate mateIn3 middlegame sacrifice,https://lichess.org/3XrMPwVW/black#50,
1oZTf,3r1k2/5p2/5Np1/6P1/1P2bB2/p3PpK1/1b3P2/7R b - - 1 32,a3a2 f4d6 d8d6 h1h8 f8e7 h8e8,2128,79,91,1327,endgame hookMate long mate mateIn3 sacrifice,https://lichess.org/hFk5KR8r/black#64,
4OsFp,r5k1/pp4pp/5r2/4pp2/1NPp1n1q/1P1P1Q2/P2N1P1P/R5RK w - - 7 21,b4d5 h4h2 h1h2 f6h6 f3h5 h6h5 h2g3 h5h3,2139,76,93,1391,attraction hookMate kingsideAttack mate mateIn4 middlegame sacrifice veryLong,https://lichess.org/0YhUy1gH#41,
5JKNl,3R1R2/pp2p1r1/2k3p1/1Np3Pp/2P1r3/1P5P/n4K2/8 b - - 5 29,a7a6 f8f6 e7e6 d8d6,2127,77,97,468,endgame hookMate mate mateIn2 short,https://lichess.org/x3wikcCt/black#58,
5k64J,r2r1b2/1p6/p2p4/2pR1Nkp/2P1P1p1/1PP5/P4PP1/6K1 b - - 3 40,g5f4 f5g3 h5h4 d5f5,2162,81,91,1221,clearance endgame hookMate mate mateIn2 short,https://lichess.org/cqKWLMyU/black#80,
62Wx0,7r/p1q1kp2/2nNp1b1/4P3/3P2Pr/2P1PQ2/P4RK1/8 b - - 1 34,c7d8 f3f7 g6f7 f2f7,2104,80,94,14729,hookMate mate mateIn2 middlegame sacrifice short,https://lichess.org/M7yguF2a/black#68,
6QruL,r4r2/6kp/2n1pNpn/1q2P3/pp3P1Q/1B6/PP3B2/2KR4 b - - 3 31,a4b3 h4h6 g7h6 d1h1 h6g7 h1h7,2135,97,100,74,attraction hookMate long mate mateIn3 middlegame sacrifice,https://lichess.org/yYHMcZTt/black#62,
6V3UV,5r2/ppp1brp1/4k2p/6N1/7P/2P4K/PP4P1/4R3 b - - 4 27,e6f6 e1e6 f6f5 g2g4 f5f4 e6e4,2101,84,90,1045,endgame exposedKing hookMate long mate mateIn3,https://lichess.org/btYt0zlC/black#54,
6lMQK,N7/Bpk3pp/2p1pn2/2P2p2/1P3b2/6rP/P3K3/3R4 b - - 3 28,c7c8 a8b6 c8c7 a7b8 c7b8 d1d8 b8a7 d8a8,2174,80,94,11554,attraction endgame hookMate mate mateIn4 queensideAttack sacrifice veryLong,https://lichess.org/TAKnssPy/black#56,
8CU4s,3N4/pB4kp/6p1/3p2K1/3PnP2/1P6/P2b3r/R6R w - - 6 43,g5g4 h7h5 g4f3 h2f2,2124,75,93,11737,hookMate master masterVsMaster mate mateIn2 middlegame short,https://lichess.org/8drv2AqD#85,
Cpk1e,6k1/5p2/Q7/1p6/P1p5/8/1P4P1/1Kn1r3 w - - 3 39,a6b5 c1b3 b1c2 e1c1,2105,78,94,2862,discoveredAttack endgame hookMate master mate mateIn2 short,https://lichess.org/KCvFkU8R#77,
FqjWL,4k3/1p4R1/4B2p/pN1pP3/4b3/2r4P/r5PK/8 b - - 6 35,c3c2 b5d6 e8f8 g7g8 f8e7 g8e8,2117,81,93,154890,endgame exposedKing hookMate long mate mateIn3,https://lichess.org/rliVQ1Lm/black#70,
HWD97,8/8/p2R4/5pk1/R3p3/1n1nPP2/1Pr1K1B1/8 w - - 3 46,e2f1 c2c1 f1e2 c1e1,2172,77,92,1272,endgame hookMate mate mateIn2 short,https://lichess.org/fD9h8RsM#91,
HjrJr,r5k1/2RR1pp1/p3r1qp/1p6/1P2p3/PQ2Pn1P/B4PP1/6K1 w - - 3 25,g1h1 g6g2 h1g2 e6g6 g2f1 g6g1 f1e2 g1e1,2149,81,91,130067,attraction hookMate kingsideAttack mate mateIn4 middlegame sacrifice veryLong,https://lichess.org/5iXKP9rA#49,
JnUZD,2r3b1/4R3/5kPp/p2p1N2/Pp4P1/3p3P/5BK1/1r6 b - - 3 46,d3d2 f2h4 f6g6 e7g7,2176,77,88,1341,endgame hookMate mate mateIn2 short,https://lichess.org/T2Fx6dQf/black#92,
JrkAR,2k4r/p7/1p1R1Qp1/1N6/P1q1p3/2P2nNb/1P5K/R7 w - - 1 36,h2h1 h3g2 h1g2 h8h2,2171,80,94,11578,attraction doubleCheck hookMate mate mateIn2 middlegame sacrifice short,https://lichess.org/kQrU3dbX#71,
K6xhT,1r5r/p7/2R2n1p/3pkpp1/4p3/1P1nP1P1/P3N1PP/5RK1 b - - 0 28,f6g4 f1f5 e5f5 e2d4 f5e5 c6e6,2153,77,90,1519,attraction hookMate long mate mateIn3 middlegame sacrifice,https://lichess.org/sKKQO4JM/black#56,
KPtgG,1k4r1/p4p2/2Q1p3/3n4/3P4/4BK1b/PP4r1/R4R2 w - - 3 29,f1g1 g8g3 f3e4 g3e3,2126,77,94,8212,hookMate mate mateIn2 middlegame short,https://lichess.org/oiglhiia#57,
KgzKQ,5k2/6R1/3pN1pB/pb1P1p2/2p5/7P/1P3qPK/4r3 b - - 3 35,f8e8 g7g8 e8d7 g8d8 d7e7 h6g5 e7f7 d8f8,2159,77,92,2822,endgame exposedKing hookMate mate mateIn4 veryLong,https://lichess.org/GfJNnXx7/black#70,
Nh6W7,4r3/2p4p/4rnp1/4N1R1/ppkP4/8/KP2RPPP/8 b - - 11 34,c4d4 e5f3 d4c4 e2c2 c4d3 c2d2 d3e4 d2d4,2101,76,94,6992,endgame hookMate mate mateIn4 veryLong,https://lichess.org/HtJkreHM/black#68,
Oh260,r7/1p2k1R1/4N3/r2pN3/1qpP1PP1/2p1P3/1n6/2K5 b - - 6 31,e7f6 g7f7 f6e6 f4f5 e6d6 f7d7,2148,77,89,1379,exposedKing hookMate long mate mateIn3 middlegame sacrifice,https://lichess.org/IZm2mHpG/black#62,
PXfT6,5r2/4Qpkp/4pNp1/4P1P1/p2P4/Pr2nq2/1P6/KRR5 b - - 3 34,e3d5 e7f8 g7f8 c1c8 f8e7 c8e8,2103,79,93,140010,attraction hookMate long mate mateIn3 middlegame sacrifice,https://lichess.org/gdlJit3V/black#68,
Q45YR,6k1/Q1p3p1/3p3r/5p2/1PPRn3/P3P1P1/2R1K3/6r1 w - - 1 35,a7c7 h6h2 e2f3 g1f1 c2f2 f1f2,2103,83,84,581,endgame hookMate long mate mateIn3,https://lichess.org/DqT9JjhR#69,
Q9obr,8/1R6/4kp2/p4Np1/P5P1/1PKp1P2/2b1r3/8 b - - 4 43,e2f2 c3d4 d3d2 b7e7,2145,76,95,11724,endgame hookMate mate mateIn2 short,https://lichess.org/lZiB2pr9/black#86,
QTPqa,2r5/2pkp3/R1RpNp2/1p1N1P1p/1P2r2P/3n2p1/6P1/5K2 b - - 0 53,e4e5 c6c7 c8c7 d5b6 d7e8 a6a8 c7c8 a8c8 e8f7 c8f8,2174,212,53,8,hookMate mate mateIn5 middlegame sacrifice veryLong,https://lichess.org/7cjK81tK/black#106,
QhpFT,7r/5pk1/4pN1p/3pP2P/1qpP1p1R/1n3P2/2Q2KP1/8 b - - 1 35,b3d4 c2h7 h8h7 h4g4 g7f8 g4g8 f8e7 g8e8,2160,78,92,6888,endgame hookMate mate mateIn4 sacrifice veryLong,https://lichess.org/KZIA4imc/black#70,
QzQRw,5r2/1p1r2R1/2p1kp2/1p2pN2/2q1P3/P6P/1P1Q1PP1/6K1 b - - 8 33,f8d8 d2d6 d7d6 g7e7,2135,77,94,3625,endgame hookMate mate mateIn2 sacrifice short,https://lichess.org/8O4gFxTv/black#66,
S8i7v,8/3R1P2/1p2n1kp/6pN/4p1P1/3p4/r6P/6K1 b - - 0 42,d3d2 f7f8n e6f8 d7g7,2107,80,88,185,advancedPawn endgame hookMate mate mateIn2 promotion short underPromotion,https://lichess.org/U8QehE2E/black#84,
TBsLD,8/2R5/4pk1p/3b2p1/3Pn1N1/4P2P/6PK/r7 b - - 7 38,f6g6 g4e5 g6f5 g2g4 f5f6 c7f7,2137,79,96,5118,endgame hookMate long mate mateIn3,https://lichess.org/OJQI6Dbf/black#76,
V4Vtx,2k5/1ppr1R2/p2N4/2q1P3/7p/1P5P/P3r1P1/2R4K b - - 4 28,c8d8 f7f8 d8e7 f8e8,2153,76,93,10613,endgame hookMate mate mateIn2 short,https://lichess.org/RLK1yQQM/black#56,
Vbg0G,7r/pp3pk1/8/2PN2p1/3np3/P7/1P3PPb/R4R1K w - - 2 24,g2g3 h2g1 h1g1 d4f3 g1g2 h8h2,2148,78,92,9169,attraction discoveredAttack endgame exposedKing hookMate long mate mateIn3 sacrifice,https://lichess.org/jdfPVU13#47,
XrZjL,6r1/1b1p1p1k/p3p2N/1p6/2p1PK1R/P1P3r1/1PB3P1/8 b - - 2 30,g3g2 h6f5 h7g6 h4h6,2132,76,97,225,discoveredAttack endgame hookMate mate mateIn2 short,https://lichess.org/4iqugWDv/black#60,
YXnxy,5Nr1/p2R1Qpk/5p1p/2p1pP2/4b3/2P4P/4q1PK/8 b - - 7 36,h7h8 f8g6 h8h7 f7g8 h7g8 d7d8 g8f7 d8f8,2191,75,93,767,attraction endgame hookMate mate mateIn4 sacrifice veryLong,https://lichess.org/FsTuz3L4/black#72,
Ye8rJ,4r3/2Pr1k2/1pR3p1/pN1nKp1p/7P/P5P1/1P3P2/2R5 w - - 1 48,e5d4 e8e4 d4d3 d5b4 d3c3 d7d3,2179,99,80,65,doubleCheck endgame hookMate long mate mateIn3,https://lichess.org/YVbBSjzY#95,
YvvVk,1k3r2/2p5/1pQ1p3/p2pN1b1/P2Pn3/1P3KP1/5P1r/3RR3 w - - 10 34,f3e2 f8f2 e2d3 f2d2 d1d2 h2d2,2119,80,89,227,hookMate long mate mateIn3 middlegame,https://lichess.org/1A8ScwNX#67,
ZM0mT,8/2R3p1/1P3p1k/3N4/4n2p/7P/6PK/1r6 w - - 4 42,b6b7 e4g3 c7c1 b1c1 b7b8q c1h1,2129,76,94,11934,endgame hookMate long mate mateIn3 quietMove,https://lichess.org/2jtpHtoc#83,
aULab,2r4r/pp1k1Bpp/8/bN2R1P1/P7/B1pb4/7K/3n4 b - - 1 28,c3c2 e5d5 d7c6 d5d6,2195,75,94,6785,fork hookMate mate mateIn2 middlegame short,https://lichess.org/pfXcudI2/black#56,
aflqT,2kr4/2p5/p5n1/1p2p3/1P1NP1P1/1PP1K3/7r/1R3R2 w - - 0 34,d4f3 d8d3 e3d3 g6f4 d3e3 h2e2,2143,76,93,4797,attraction endgame hookMate long master masterVsMaster mate mateIn3 sacrifice,https://lichess.org/49amwvlV#67,
bG5ET,r4rk1/2p2pbN/4p1n1/p3Pn2/4N3/Q1Pq4/PP3PP1/K6R b - - 0 24,a8d8 h7f6 g7f6 e4f6 g8g7 h1h7,2123,77,87,290,hookMate kingsideAttack long mate mateIn3 middlegame,https://lichess.org/1VbvsSYn/black#48,
bLuK1,r5k1/1p4pp/p2p1r2/3P1p1q/2P1p3/5nPP/PPQ1BPK1/R4R2 w - - 1 23,c2d1 h5h3 g2h3 f6h6 h3g2 h6h2,2168,256,5,7,attraction hookMate long mate mateIn3 middlegame sacrifice,https://lichess.org/SCvAr8NY#45,
djMbE,6k1/pQ3p2/6p1/4p1Pb/4Pn1P/1P6/PBr2K2/RN1r1B1R w - - 3 25,f2g3 d1d3 f1d3 c2g2,2142,82,86,770,hookMate master mate mateIn2 middlegame sacrifice short,https://lichess.org/D7JFxcCm#49,
e1DlE,8/5p2/R1p3k1/1pN3n1/1P4P1/P5Kr/5P2/8 w - - 3 46,g3f4 f7f6 f2f3 h3f3,2115,77,91,430,endgame hookMate mate mateIn2 quietMove short,https://lichess.org/tqOoCb6m#91,
eW32n,2r1k3/pp4p1/3bp1p1/1p3pP1/2nPnP2/P2KBR2/1PP3r1/1R1Q4 w - - 10 27,d1h1 c4b2 b1b2 c8c3,2125,77,94,12210,clearance hookMate mate mateIn2 middlegame sacrifice short,https://lichess.org/SHsnEBXp#53,
g6J9S,r2k3r/b1R3p1/Qp1p4/1P1Ppq2/3nN1p1/6P1/1B3P1P/2R3K1 w - - 17 33,e4d6 d4f3 g1f1 f5d3 f1g2 h8h2,2127,76,95,8246,hookMate kingsideAttack long mate mateIn3 middlegame,https://lichess.org/INO3xwBg#65,
ioezT,4r3/2pkpp2/2Np4/2BP1q1r/2P1n1p1/1p2Q1Pp/5P1P/R3R1K1 b - - 0 31,e4c5 e3e7 e8e7 e1e7 d7c8 e7e8 c8b7 e8b8,2112,83,81,1131,hookMate mate mateIn4 middlegame sacrifice veryLong,https://lichess.org/tXgXODLf/black#62,
kvpkr,4r2b/4pk1p/3pNppB/1Q1Pn3/8/5P2/1Pq2PKP/R7 b - - 3 28,c2d3 b5e8 f7e8 a1a8 e8d7 a8d8,2118,299,25,4,attraction hookMate long master mate mateIn3 middlegame sacrifice,https://lichess.org/2grLWaJA/black#56,
lBSLw,8/pp1k1R2/2np4/2pNp3/2B1P3/P2P4/1PP1q1r1/2K5 b - - 14 34,c6e7 c4b5 d7e6 f7e7,2126,86,90,1994,endgame hookMate mate mateIn2 short,https://lichess.org/CD5P7ipM/black#68,
mWXN3,5rk1/p5bp/2p1p3/2qpP1p1/3P2Pn/6KP/PP1B4/1R1Q4 w - - 0 24,d4c5 g7e5 d2f4 f8f4 a2a3 f4f3,2140,77,95,2391,doubleCheck endgame hookMate long mate mateIn3,https://lichess.org/aAhQ0dgi#47,
n25QE,8/pp6/6p1/4k2p/4N1nP/1P2P1K1/P1P1b2r/2R3R1 w - - 1 32,e4c3 g6g5 c3e2 g5h4 g3f3 h2f2,2143,75,94,6827,endgame hookMate long mate mateIn3 sacrifice,https://lichess.org/hN6zaXJt#63,
oM9h0,r1k2b2/1bNp1P2/p1qP3r/2ppB1Qp/8/8/PP3P1P/4R1K1 b - - 2 26,d5d4 g5d8 c8d8 e5f6 h6f6 e1e8,2188,85,90,2978,attraction clearance hookMate long mate mateIn3 middlegame queensideAttack sacrifice,https://lichess.org/97i1nlYn/black#52,
pTx5M,4r3/p4pk1/b1p2Np1/2P3P1/1Pn4R/P7/6P1/6K1 b - - 5 30,e8e5 h4h7 g7f8 h7h8 f8e7 h8e8,2102,78,90,1800,endgame hookMate long mate mateIn3,https://lichess.org/i8hxXydq/black#60,
qwhlN,6k1/p4p1p/1p2qp1B/1Pp5/P2p3P/4nQ2/4P2N/R3K1r1 w - - 14 36,e1d2 e6a2 a1a2 g1d1,2170,77,94,1041,hookMate mate mateIn2 middlegame sacrifice short,https://lichess.org/HIhBgHrp#71,
sJXaP,2q4k/1p4pp/3B3r/pP2r3/P3P1P1/1QP2pRn/5P1K/3R4 w - - 0 30,d6e5 h3f4 h2g1 f4e2 g1f1 h6h1 g3g1 h1g1,2151,75,94,146432,discoveredAttack exposedKing fork hookMate mate mateIn4 middlegame veryLong,https://lichess.org/t2jZzAna#59,
sQNR7,3Q1qk1/r4p1p/4bNp1/4P1P1/2P4P/1p6/rB1R4/2K5 b - - 13 36,g8g7 d8f8 g7f8 d2d8 f8e7 d8e8,2132,85,94,87,attraction hookMate long mate mateIn3 middlegame,https://lichess.org/ATaO69vm/black#72,
tPYjU,6k1/p4R1p/3N4/1p6/n6B/P2P4/K5PP/2rr1B1R w - - 11 37,f7f2 c1a1 a2b3 d1b1 f2b2 b1b2,2121,82,88,533,hookMate long mate mateIn3 middlegame,https://lichess.org/rTR8O7zx#73,
v8774,6r1/pb1p2qk/1p2p1np/n3P2N/2pP1rR1/B1P1K2Q/P1P3P1/7R b - - 1 27,f4g4 h5f6 h7h8 h3h6 g7h6 h1h6 h8g7 h6h7,2125,76,94,3041,deflection discoveredAttack fork hookMate mate mateIn4 middlegame veryLong,https://lichess.org/0xKEamMz/black#54,
wCxNy,3r4/pp6/6rk/4P2N/3b3R/P5Pp/1P5P/5K2 b - - 1 36,d8f8 h5f6 h6g5 h4h5,2156,77,94,2923,discoveredAttack endgame hookMate mate mateIn2 short,https://lichess.org/wjrjl1yc/black#72,
ygoni,8/6p1/4p1kn/2P2p1p/4NP2/R3PKPP/P1r5/8 w - - 0 35,e4g5 h6g4 e3e4 c2f2,2131,75,95,1652,endgame hookMate master mate mateIn2 short,https://lichess.org/XJmFUkys#69,
