PuzzleId,FEN,Moves,Rating,RatingDeviation,Popularity,NbPlays,Themes,GameUrl,OpeningTags
jxWYG,8/p5k1/2R2bp1/q4n1p/2B2P2/P5P1/1PQr1B1P/7K w - - 1 41,f2e1 d2c2 e1a5 c2c1,2191,76,94,2461,crushing master masterVsMaster middlegame short,https://lichess.org/5RwCsfY9#81,
jzBBy,6k1/1p3p2/p1pq2p1/4P2p/P6P/1P2QRP1/3r1PK1/8 b - - 0 31,d6d5 e5e6 f7e6 e3h6 d5f3 g2f3,2191,79,87,486,crushing endgame long master masterVsMaster,https://lichess.org/HZhyxhSc/black#62,
k0I7Z,3k4/1pp2p2/1b1p1P2/4pQ2/2q5/p1P3P1/PP5P/K2R4 w - - 2 29,h2h4 c4e2 b2a3 e2d1,2183,88,89,714,crushing endgame master masterVsMaster short,https://lichess.org/vqho07n3#57,
k0tR6,r3r2k/4P1pp/p5q1/1p4B1/3p4/3P1Q1P/PP4P1/5RK1 b - - 2 28,h7h6 f3a8 e8a8 f1f8 a8f8 e7f8q,2149,78,93,9697,advancedPawn advantage clearance endgame long master masterVsMaster promotion sacrifice,https://lichess.org/ajVDnRht/black#56,
k3LAi,rn1q2k1/6b1/3Bp2p/1Bp2rp1/P3b3/5N2/1P3PPP/R2QK2R w KQ - 1 18,e1g1 e4f3 g2f3 f5d5,2124,79,91,667,advantage master masterVsMaster middlegame short,https://lichess.org/8rkRMlnZ#35,Benko_Gambit Benko_Gambit_Zaitsev_System
k5qMf,6k1/1p3p2/p3p1p1/Pr2Pq2/8/4Q2P/5PP1/2R3K1 b - - 2 26,b5b2 g2g4 f5c2 c1c2,2195,74,84,180,crushing endgame master masterVsMaster short,https://lichess.org/bVfiLcq7/black#52,
k8quu,1r6/p1p1k1p1/2B4p/2n1p3/8/2P5/PP3P1P/1K2R3 b - - 1 24,b8b2 b1b2 c5d3 b2c2 d3e1 c2d2,2119,76,91,1977,advantage endgame hangingPiece long master masterVsMaster,https://lichess.org/s43s7OeQ/black#48,
kB6XI,8/5Qpk/3R3p/1r6/5P2/6PK/7P/5q2 w - - 1 47,h3g4 f1e2 g4h3 b5h5 f7h5 e2h5,2150,78,83,127,crushing endgame long master masterVsMaster,https://lichess.org/5FZWMAZI#93,
kBYz8,4Q3/8/p3N1kp/1p1pq1p1/3n4/8/5PP1/6K1 b - - 1 37,g6f5 e8f7 e5f6 e6d4,2111,87,78,29,crushing endgame master masterVsMaster pin short,https://lichess.org/AgJNB0vI/black#74,
kHGKe,8/1n1PPN2/p7/8/5p1k/8/P1p1B3/6K1 b - - 0 47,c2c1q g1h2 c1e1 e7e8q,2195,107,82,15,advancedPawn advantage defensiveMove endgame master masterVsMaster promotion short,https://lichess.org/MItd6sA7/black#94,
kHLIl,5k2/1pr3pp/pN1p1r2/P1PPpqnQ/1P6/2R2pP1/5P1P/4R2K w - - 1 30,c5d6 c7c3 d6d7 g5f7 h5f7 f8f7,2191,81,88,771,crushing hangingPiece long master masterVsMaster middlegame quietMove,https://lichess.org/Clht8pYM#59,
kHyFE,3r2k1/p4p2/1pn1q1pp/3p4/3P4/2N2Q1P/PP3PP1/4RK2 b - - 3 25,c6d4 f3f4 e6c6 f4d4,2174,75,86,337,advantage endgame master masterVsMaster short,https://lichess.org/kcr6TgfE/black#50,
kIY8z,r4r2/1p4k1/3p2pp/p2pn3/2PQ1P1q/3B4/PP4P1/4RRK1 b - - 1 26,f8f4 d4f4 h4f4 f1f4,2136,75,93,2487,advantage master masterVsMaster middlegame short,https://lichess.org/Uq1yY01l/black#52,
kIeEj,r2k4/4p3/7R/3P2pP/5p2/8/p7/K7 b - - 0 47,f4f3 h6h8 d8d7 h8a8 g5g4 a8f8,2117,78,91,4101,crushing endgame long master masterVsMaster rookEndgame skewer,https://lichess.org/AB2G3WYh/black#94,
kL41r,r7/5Np1/1k5p/3p2PP/p2P1P2/PbN5/3K4/8 b - - 0 33,a8f8 g5g6 b6c6 f4f5 c6d7 f5f6 d7e6 f6g7,2171,94,63,24,advancedPawn crushing endgame master masterVsMaster quietMove veryLong,https://lichess.org/RaIoexFH/black#66,
kMj1d,1r3k2/1p3p1p/6p1/1PpP4/5P2/2K3P1/7P/4R3 b - - 1 31,b8e8 e1e8 f8e8 b5b6,2148,84,43,30,crushing endgame master masterVsMaster rookEndgame short,https://lichess.org/OV6TGAsH/black#62,
kMs8N,3k4/1p4p1/p3pp1p/2B4P/2n2PP1/8/PPK5/8 b - - 1 31,b7b6 c2c3 b6b5 b2b3,2181,108,86,17,advantage endgame master masterVsMaster short,https://lichess.org/yTM9HR1M/black#62,
kMsnp,8/2k5/2p1p2p/b1PpP1pP/1p1P2P1/2PK4/1B6/8 b - - 0 55,b4c3 b2c1 c7d8 c1g5,2160,76,77,194,bishopEndgame crushing endgame master masterVsMaster short,https://lichess.org/HSzTjvNW/black#110,
kOJ2V,r2q1r1k/p4R1p/1p2N3/2b4n/2P5/1P6/PB3PPP/R5K1 b - - 0 22,d8f6 b2f6 h5f6 e6f8,2111,78,79,99,advantage kingsideAttack master masterVsMaster middlegame short,https://lichess.org/SKcLt8EN/black#44,
kOYeq,6k1/4pp1p/3p2p1/2qP4/rnpNP3/2Q1R2P/5PP1/6K1 b - - 1 37,a4a2 d4f5 e7e5 d5e6,2138,77,51,89,crushing enPassant endgame master masterVsMaster short,https://lichess.org/OmJtz5hR/black#74,
kQtSB,3r3r/1p3pk1/p3bq1p/2Q4R/5R2/4PBP1/5KP1/8 b - - 3 30,f6a1 h5g5 h6g5 c5g5 g7f8 g5d8 f8g7 d8g5,2199,77,73,192,crushing interference master masterVsMaster middlegame sacrifice veryLong,https://lichess.org/28ZnPVDk/black#60,
kTzlg,8/1r6/1Pk2pp1/3p3p/3P3P/2K3P1/4RP2/8 b - - 4 54,b7b6 e2e6 c6b5 e6b6 b5b6 c3b4 g6g5 f2f3,2196,82,90,1013,crushing defensiveMove endgame master masterVsMaster rookEndgame veryLong zugzwang,https://lichess.org/oipE4EmF/black#108,
kU318,6k1/p3b1pp/2pp1r2/2p1pq2/8/3P1P1b/PPPBQ1N1/R4RK1 w - - 3 19,f3f4 h3g2 g1g2 f6g6,2141,75,63,122,advantage attraction master masterVsMaster middlegame short,https://lichess.org/oItToVxk#37,Sicilian_Defense Sicilian_Defense_Moscow_Variation
kUF8A,8/8/6R1/6pp/1r2P1k1/6P1/8/5K2 w - - 0 43,e4e5 g4f3 g6f6 f3g3,2103,83,80,42,endgame master masterVsMaster,https://lichess.org/IXKiBww5#85,
kUkKt,4r1k1/1p3Rp1/p5n1/2pq1NN1/P6P/3n4/1P3P2/1Q4K1 b - - 2 28,e8e1 b1e1 d5f7 e1e4,2108,75,65,106,crushing master masterVsMaster middlegame short,https://lichess.org/RWTtO81T/black#56,
kUm5O,1r4k1/pb4pp/4P3/8/6r1/8/PP3PBP/1R1R2K1 w - - 1 30,e6e7 g4g2 g1f1 b8e8 d1d8 g8f7 d8e8 f7e8,2119,82,85,173,crushing endgame master masterVsMaster veryLong,https://lichess.org/s9jfUZFx#59,
kVcjj,8/1Rp2ppk/r1pp3p/5P2/4P1P1/3PK2P/8/8 b - - 3 33,d6d5 e4e5 c6c5 b7c7,2141,96,83,29,crushing endgame master masterVsMaster quietMove rookEndgame short,https://lichess.org/8yeAbm1T/black#66,
kVzhI,8/8/8/6p1/1P1k1pP1/3P1P1P/P1K5/6b1 w - - 1 47,b4b5 d4e3 h3h4 g5h4,2131,77,86,66,advantage bishopEndgame endgame master masterVsMaster short,https://lichess.org/xeBrktTI#93,
kWNeo,8/8/5BK1/3k3P/p2n4/8/8/8 b - - 1 44,a4a3 f6d4 d5d4 h5h6 d4c3 h6h7 c3b2 h7h8q,2188,77,90,421,advancedPawn crushing endgame master masterVsMaster promotion veryLong,https://lichess.org/bTUELQJn/black#88,
kXOcN,1r1k3R/4p3/3pQ3/2pPb1P1/1rq5/p5P1/1p3PK1/4R3 b - - 7 33,d8c7 e6e7 c7b6 h8b8 b6a5 b8a8,2154,75,93,8432,crushing deflection interference long master masterVsMaster middlegame,https://lichess.org/ysSMordn/black#66,
kXxEh,8/7p/1p4p1/p2k4/Pb6/1P2Q2P/5PP1/3qNK2 w - - 13 41,f2f4 d1e1 e3e1 b4e1 f1e1 d5e4 h3h4 e4f4,2153,76,63,73,crushing endgame master masterVsMaster veryLong,https://lichess.org/tFmhhV2k#81,
kZNjS,5r1k/1p1r1pp1/p3p2N/3pP2P/3P1Q2/5PR1/4q1PK/8 b - - 0 36,e2d3 g3g7 h8g7 f4f6 g7h7 h6g4,2196,121,86,16,attraction crushing defensiveMove endgame long master masterVsMaster sacrifice,https://lichess.org/MYyGFliy/black#72,
kZh6z,4r2k/3b1r1p/p1p4B/3ppq2/7Q/7P/PP2R1P1/4R2K w - - 1 27,e2e5 e8e5 h4d4 f7e7 h6f4 f5f4 d4f4 e5e1,2190,75,85,297,advantage master masterVsMaster middlegame quietMove veryLong,https://lichess.org/4epIuSWW#53,
kZnJX,2rr2k1/pp3ppp/8/3NP3/3nPn2/8/PP1K1P1P/R4B1R w - - 0 18,d2e3 f4d5 e4d5 d4c2,2150,77,84,298,crushing master masterVsMaster middlegame short,https://lichess.org/44373AV4#35,Queens_Gambit_Declined Queens_Gambit_Declined_Chigorin_Defense
kbwnB,8/7p/8/7R/1p3kp1/1P3n2/2P2PK1/4rB2 b - - 9 51,f3d2 f1d3 e1e5 h5h7,2146,74,85,134,crushing endgame master masterVsMaster short,https://lichess.org/8RbGpZt6/black#102,
kcasI,4r1k1/pp3p2/5Bp1/n2bP2p/1q1p2PQ/3P1N2/1Pr4P/3R1RK1 b - - 4 29,d5f3 f1f3 b4b2 g4h5 c2g2 g1h1,2100,78,86,252,crushing long master masterVsMaster middlegame,https://lichess.org/S5HmQllX/black#58,
kcqsR,5rk1/p3p2p/q1np2p1/3R2P1/P4P1P/1pQ1B1K1/1P3N2/1b6 b - - 0 29,b1c2 f2g4 g8f7 d5d6 e7d6 c3f6 f7e8 f6e6 e8d8 e6d6 d8c8 d6f8,2127,154,82,19,crushing fork master masterVsMaster middlegame quietMove sacrifice veryLong,https://lichess.org/BvrvZVub/black#58,
kdnnl,2rr2k1/1qN2ppp/3Bp1n1/8/n7/1P6/P2Q1P1P/1K1RR3 w - - 7 29,d2b4 c8c7 b4a4 c7d7,2165,76,72,49,crushing master masterVsMaster middlegame short,https://lichess.org/RBqbsjhD#57,
kf4vw,4rr2/q5kp/2R1p1n1/p2p2N1/P2P2N1/4p3/6PP/1R4K1 b - - 1 29,a7d4 c6c7 g6e7 g5e6 g7h8 e6d4,2107,82,81,50,advantage fork interference long master masterVsMaster middlegame,https://lichess.org/GpXTD8SA/black#58,
kgtu7,4r1k1/2p3p1/8/p2BB1qp/2P2rPn/P5QP/8/4R1K1 b - - 1 33,g8h7 e5f4 e8e1 g3e1 g5f4 e1h4,2145,131,56,26,crushing long master masterVsMaster middlegame pin,https://lichess.org/dlnDVBC3/black#66,
kht0p,4r1k1/1p1q2p1/4b3/p1bpB1pQ/3N4/2P4P/PP4P1/5RK1 b - - 1 24,g5g4 e5g7 g8g7 h5g5,2179,81,91,193,advantage attraction kingsideAttack master masterVsMaster middlegame sacrifice short,https://lichess.org/ZeIEApOX/black#48,
kkreW,8/8/1p4k1/4K2p/1p3P2/8/2P5/8 b - - 0 41,g6f7 e5f5 f7e7 f5g5 e7e6 f4f5 e6e7 g5h5 e7f6 h5g4,2187,76,84,182,crushing defensiveMove endgame exposedKing master masterVsMaster pawnEndgame veryLong,https://lichess.org/8SFB0QI9/black#82,
klSQJ,6k1/2p2q1p/pb1p2p1/3P1PQP/1p2r3/2R5/PP4P1/5R1K w - - 0 32,g5d8 e4e8 d8g5 b4c3,2151,79,91,2093,crushing defensiveMove endgame master masterVsMaster short,https://lichess.org/3h3XqQyB#63,
klg2j,7k/p2n3p/1q2N1p1/8/2B5/4B2P/1r3PP1/5RK1 b - - 2 39,b6c6 e3d4 h8g8 e6c5 g8f8 c5d7,2103,76,82,189,advantage discoveredAttack fork long master masterVsMaster middlegame,https://lichess.org/IZwRpBpH/black#78,
kmzWP,2r3k1/5ppp/1B6/P2n4/4q3/6P1/Q1p1PP1P/2R3K1 w - - 0 32,a2b3 d5c3 b3c2 c3e2 c2e2 c8c1,2155,80,86,60,crushing deflection discoveredAttack endgame fork long master masterVsMaster skewer,https://lichess.org/pXRu3hTf#63,
kq3I0,6k1/6b1/6Qp/p3Pp1P/5B2/P4qP1/2r3R1/7K w - - 9 39,g6e8 g7f8 e8g6 g8h8,2105,76,86,460,crushing endgame master masterVsMaster pin short,https://lichess.org/7ltYy4o0#77,
kqpre,8/7p/1p3pp1/5P2/1Nk3P1/4K2P/8/8 b - - 0 58,c4b4 f5g6 h7g6 h3h4 b6b5 h4h5 g6h5 g4h5,2117,88,90,2656,crushing endgame master masterVsMaster pawnEndgame quietMove veryLong,https://lichess.org/9zCvEuqQ/black#116,
ksUi1,r1bqr2k/p1p2Qp1/2pp3p/6N1/8/7P/PPP2PP1/4RRK1 b - - 1 16,e8f8 e1e7 d8e7 f7e7,2183,74,93,4159,crushing master masterVsMaster middlegame short,https://lichess.org/UGr3Glql/black#32,Scotch_Game Scotch_Game_Scotch_Gambit
kt1Dt,6k1/r4pP1/1p2nB2/3BP1P1/8/pP5P/n7/4R1K1 w - - 1 41,e1d1 a2c3 g5g6 c3d5,2139,91,66,29,advantage endgame master masterVsMaster short,https://lichess.org/PPHKMXue#81,
kvWYG,2q5/3r1p1k/p4Qp1/Ppp1R2p/3p3P/1P1P2P1/2P2PK1/8 w - - 3 32,f6g5 c8c6 g2g1 f7f6 e5c5 c6d6,2102,74,91,1285,crushing endgame fork long master masterVsMaster,https://lichess.org/RrMLl6rp#63,
kvaZA,r2r2k1/1b1p1p1p/p2R4/1p4B1/8/1B3P2/PP3PK1/8 b - - 2 26,d8e8 d6d7 b7c8 b3f7,2150,81,91,2183,advantage endgame master masterVsMaster short,https://lichess.org/xJ5bWjCp/black#52,
kzIdi,4kr2/3r4/Q3p3/3q1pR1/5n1P/8/PP3PP1/4R1K1 b - - 2 35,d7d6 a6a4 e8f7 a4f4,2197,86,91,666,crushing fork master masterVsMaster middlegame short,https://lichess.org/RrvjBmDY/black#70,
kzakG,8/1R3p2/p4Pp1/5b1p/p7/4p2P/2p3P1/k1K5 b - - 1 55,a1a2 b7f7 a4a3 f7e7,2173,79,88,1186,crushing endgame master masterVsMaster short,https://lichess.org/t1dleymh/black#110,
l1KlQ,r5k1/1ppr3p/p1p3p1/4p1BP/4P3/1qPP1N2/bbR2PQ1/2K4R w - - 0 27,c2b2 b3c3 b2c2 c3a3,2126,76,90,408,crushing master masterVsMaster middlegame queensideAttack short,https://lichess.org/voqDG3e4#53,
l34KB,6k1/1R5p/p2p4/q2Pr1P1/P2Q1p1P/5r2/8/1K1R4 b - - 0 29,a5c3 d1c1 c3b3 b7b3,2191,95,90,6227,crushing endgame master masterVsMaster short superGM,https://lichess.org/Y5KQXVAm/black#58,
l4FVt,2r1r1k1/3b1pp1/p1Np1qn1/7p/5P2/6PP/PP1QP1B1/2R1R1K1 w - - 0 27,d2d4 c8c6 d4f6 c6c1 e1c1 g7f6,2151,80,84,238,advantage long master masterVsMaster middlegame superGM,https://lichess.org/BMcHFprS#53,
l4cuo,r3nrk1/p1pq2p1/1pnp3p/4pb2/Q1P5/P1PP1B1P/5PPN/R1B2RK1 b - - 3 16,c6d4 f3d5 g8h7 a4d7,2118,75,93,1070,advantage fork master masterVsMaster middlegame short,https://lichess.org/SB1sdTce/black#32,English_Opening English_Opening_Four_Knights_System
l5PYM,2r2rk1/1p4p1/pq2p1Qp/3pPP2/1P6/P7/1Bb3PP/2R2R1K b - - 1 23,c2f5 c1c8 f8c8 f1f5,2154,75,86,490,advantage master masterVsMaster middlegame short,https://lichess.org/zHTgYgZh/black#46,
l6UsO,r6k/pp4pp/1q6/1P2pbB1/P6P/1Q1PnBP1/7K/R7 w - - 2 25,a4a5 e3g4 h2h3 b6f2 f3g4 f5g4,2156,83,89,727,clearance crushing long master masterVsMaster middlegame,https://lichess.org/sLvIrfzy#49,
l7tzZ,r1b4k/3n1Qpp/pp1b1n2/8/P1BPNq2/8/1P3PPP/R2R2K1 w - - 3 18,d1e1 f4h2 g1f1 c8b7,2161,172,41,8,crushing master masterVsMaster middlegame short,https://lichess.org/v8O414ii#35,Queens_Gambit_Declined Queens_Gambit_Declined_Modern_Variation
l88ZT,4r1k1/Q4p2/R7/3p1q1p/5P2/2P2bP1/P6P/3R2K1 w - - 1 30,d1f1 f5h3 a7f2 e8e2 a6a8 g8h7,2169,74,76,293,advantage defensiveMove endgame long master masterVsMaster,https://lichess.org/dxDE3QY4#59,
l8e4L,r3r1k1/ppq2pp1/3b2p1/2n2P2/2B4B/P3p3/1PP1Q1PP/R4R1K b - - 1 21,e8e4 f5g6 e4h4 f1f7 g8h8 f7c7,2128,75,93,1159,crushing discoveredAttack long master masterVsMaster middlegame pin,https://lichess.org/8tstxXga/black#42,
lB4ZM,8/8/p6R/1b1k1pp1/3B4/2P1K3/1r3PP1/8 w - - 2 40,h6g6 f5f4 e3f3 b5e2,2108,78,96,12872,endgame master masterVsMaster mate mateIn2 short,https://lichess.org/8Eh9uT9Z#79,
lBsPU,8/p6p/5p2/8/P1p5/k5q1/3Q4/3B2K1 w - - 2 48,g1h1 g3h4 h1g1 h4g5,2197,74,93,5227,crushing endgame master masterVsMaster short,https://lichess.org/YdxDuWNB#95,
lCE5H,2r2r2/pq4kp/6p1/1np2p2/1p1N1P1Q/3P2P1/PP5P/3RR1K1 b - - 1 25,f8f7 d4e6 g7h8 e6d8 c8d8 h4d8,2163,81,93,7044,crushing fork long master masterVsMaster middlegame superGM,https://lichess.org/Tz5HglDS/black#50,
lCRIZ,r1b1r1k1/1p3pp1/4q2p/1Pn5/p2Q4/P3B3/1K3PPP/3R1B1R w - - 2 24,d4c5 e6b3 b2c1 c8e6,2188,94,91,50,advantage clearance defensiveMove fork master masterVsMaster middlegame short,https://lichess.org/QEEbzuhE#47,
lEz0R,4r1k1/p5p1/1p3p2/3P3p/1QpP1PbP/P7/1PB1r1PK/8 w - - 2 30,b4c4 e8c8 c4e2 g4e2,2114,77,88,1145,crushing endgame master masterVsMaster short,https://lichess.org/u1apGMuO#59,
lF98X,5rk1/pp4bp/3Q2p1/2pNn3/2P1PB2/6N1/PP2BK1q/R7 w - - 4 19,f2e3 f8f4 d5f4 h2g3 e3d2 g3f4,2141,78,85,388,advantage capturingDefender deflection long master masterVsMaster middlegame,https://lichess.org/KmiJINZx#37,Benoni_Defense Benoni_Defense_Other_variations
lFGNg,2r1r1k1/1p6/p4Qp1/5b1p/2qp4/2P5/3B1PPP/R3R1K1 b - - 0 26,d4c3 e1e8 c8e8 d2c3,2108,79,90,1155,crushing intermezzo master masterVsMaster middlegame short,https://lichess.org/hv7yQ2Ej/black#52,
lFQd1,8/p3k3/Pp2p1p1/1Pp1P1P1/5PP1/2p1K3/8/8 b - - 1 80,c5c4 e3e2 c3c2 e2d2,2191,79,90,770,crushing endgame master masterVsMaster pawnEndgame short,https://lichess.org/ZjR24r3l/black#160,
lGDf6,6k1/p2q1pb1/3p2p1/2pBn1P1/2P2NbP/3P2K1/P3QB2/8 w - - 3 37,e2b2 g4d1 g3g2 d7g4 f2g3 d1f3,2161,152,87,22,crushing fork long master masterVsMaster middlegame quietMove,https://lichess.org/a9rDf2vI#73,
lIHjQ,5Q2/6pk/2p2pp1/1p1p4/2qB4/2P2P1P/p3r1P1/R6K w - - 0 40,f8f7 e2b2 a1g1 b2b1,2184,75,92,1365,advantage endgame master masterVsMaster short,https://lichess.org/J6eQG7J4#79,
lJzXY,1k6/1p3Q2/p3p3/3pP3/P2P3R/1P1q2P1/5PK1/2r5 w - - 1 43,h4h7 d3e4 f2f3 e4c2,2141,75,91,4749,crushing endgame master masterVsMaster short,https://lichess.org/Gw714dgz#85,
lLe2Q,3r4/p1pqnrk1/1p3pp1/5n1p/3PR2P/2N2QP1/PP3PB1/4R1K1 b - - 0 26,f5d4 e4d4 d7d4 e1d1 d4d1 c3d1,2131,75,94,120,advantage long master masterVsMaster middlegame sacrifice,https://lichess.org/d9Kjxvrm/black#52,
lMhL7,2rr4/1p3ppk/p2p3p/P2Np3/2q1P3/3R1Q1P/5PPK/8 b - - 1 35,h7g8 d3c3 c4c3 d5c3,2123,81,92,2143,advantage endgame master masterVsMaster short,https://lichess.org/tWH2skgO/black#70,
lMhzk,r1b2rk1/p4pp1/5q1p/2bp4/Q4B2/3B4/PP3PPP/R4RK1 w - - 4 16,b2b3 c5d4 a1d1 f6f4 d3b5 d4e5 a4f4 e5f4,2134,75,94,2555,crushing interference master masterVsMaster middlegame quietMove veryLong,https://lichess.org/poOf6W7D#31,Sicilian_Defense Sicilian_Defense_Taimanov_Variation
lNC5L,8/1pp5/3p1k2/1PnP2p1/5K2/4P1P1/8/3B4 w - - 0 35,f4g4 c5e4 d1e2 e4c3,2126,76,81,187,crushing endgame master masterVsMaster short,https://lichess.org/MCEWxZE1#69,
lRdQE,2kr2r1/p6p/2b2p2/p1p5/4qP2/P1PnB1R1/2B1Q1PP/1R4K1 b - - 5 25,h7h5 c2d3 e4d3 e2d3 d8d3 g3g8,2136,77,91,537,crushing long master masterVsMaster middlegame,https://lichess.org/4QM091AL/black#50,
lSsdM,4r2k/6p1/1p2r3/3nN2Q/4q3/2P2R1P/PP3PP1/7K b - - 0 31,e4h7 e5f7 h8g8 h5d5,2164,75,91,1977,crushing discoveredAttack master masterVsMaster middlegame short,https://lichess.org/5E1iQ49o/black#62,
lTRve,8/3r1k2/6pp/p7/1p1PR1P1/7P/1P3P2/6K1 w - - 0 32,f2f4 d7e7 e4e7 f7e7,2163,78,90,693,crushing endgame master masterVsMaster rookEndgame short,https://lichess.org/1lZT3XUI#63,
lU090,8/7p/4Rnrk/8/P7/3p1KN1/1P6/8 w - - 0 61,e6e5 g6g3 f3g3 d3d2,2178,76,94,11351,advancedPawn crushing endgame master masterVsMaster sacrifice short superGM,https://lichess.org/HstgxIj9#121,
lVFHN,8/8/6Q1/7P/8/8/pq4P1/k6K w - - 0 67,h1h2 b2e5 h2h3 a1b2,2106,76,80,147,crushing defensiveMove endgame master masterVsMaster queenEndgame short superGM,https://lichess.org/mytseuSs#133,
lWB08,1k1r3r/1p2np2/p1nb1qpp/4p3/4P3/1B2BNQP/PP3PP1/2R2K1R b - - 0 19,c6d4 e3d4 e5d4 e4e5,2103,76,91,799,advantage master masterVsMaster middlegame short,https://lichess.org/ZaWZpPqB/black#38,
lXksU,8/7p/8/4ppp1/1k6/5PP1/1PK4P/8 w - - 0 42,h2h4 f5f4 g3f4 g5h4 f4f5 b4c5 f5f6 c5d6,2186,82,91,1616,crushing defensiveMove deflection endgame master masterVsMaster pawnEndgame veryLong,https://lichess.org/qfCeLldG#83,
lYlP9,6k1/2B1bb1p/5pp1/3p4/2pP1QP1/4RBKP/5P2/r1q5 b - - 3 38,c4c3 e3e7 c1f4 c7f4 g6g5 f4e3,2141,81,91,2004,crushing hangingPiece long master masterVsMaster middlegame,https://lichess.org/noG8wVXK/black#76,
lZOOh,8/2R4p/pp1p1qnk/3P4/4PpQ1/P4BnP/3p2K1/8 b - - 1 41,g6e5 g4g8 f6g6 g8f8,2143,86,63,46,crushing endgame master masterVsMaster short,https://lichess.org/we0LRMhx/black#82,
lcYPl,3r4/5R1p/8/2prB1k1/6Pn/8/1P3P2/4R1K1 b - - 0 39,g5g4 e1e4 g4g5 e5f6 g5g6 f6d8,2105,76,86,139,advantage endgame fork long master masterVsMaster,https://lichess.org/azHXSNd0/black#78,
ldBc9,4R3/6k1/5p2/4pP2/5rP1/6K1/8/8 b - - 6 67,g7h6 e8g8 h6h7 g8g6,2141,76,94,1601,crushing endgame master masterVsMaster quietMove rookEndgame short,https://lichess.org/XOFGdUya/black#134,
ldbyP,6k1/1b1q2b1/6Q1/1p1p1N1p/6nP/1P4PK/1B4B1/8 b - - 9 40,g4h6 g6g7 d7g7 f5g7,2183,78,76,66,crushing fork master masterVsMaster middlegame short,https://lichess.org/TtOQXepv/black#80,
leYBZ,6k1/5p2/p2p4/2pP2P1/2Qbq3/7P/P5RK/8 w - - 0 40,c4e2 e4f4 h2h1 f4c1,2112,79,86,804,crushing endgame master masterVsMaster short,https://lichess.org/x3QSI7Om#79,
levSv,1r3rk1/3nbppp/b1p1p3/p1q3P1/2N1PP2/1PN5/PBP1Q2P/R4R1K w - - 3 18,b2a3 c5a3 c4a3 a6e2,2160,76,92,6366,advantage master masterVsMaster middlegame short,https://lichess.org/3Xqh5Yee#35,Sicilian_Defense Sicilian_Defense_Closed
lfoai,8/2P5/1K2P3/1B1p3p/8/2r4k/pr6/6R1 b - - 0 64,c3b3 c7c8q b3b5 b6a6 b5b6 a6a7 b6b3 c8f8,2107,270,-6,15,advancedPawn crushing defensiveMove endgame master masterVsMaster promotion veryLong,https://lichess.org/HJCfg2Az/black#128,
lguvO,4r2k/p1p5/1pPb1R2/8/2KP2Q1/8/PP3PP1/1q6 b - - 2 32,b1c2 c4d5 c2h7 f6d6 c7d6 g4h3 h8g8 h3h7,2194,146,85,17,crushing endgame master masterVsMaster sacrifice veryLong,https://lichess.org/630evLbw/black#64,
lhYLt,r2q1rk1/5pp1/b2p4/1p4PN/1nn1P2P/2N5/2P1BQ2/1K1R3R b - - 1 26,d8a5 h5f6 g7f6 g5f6,2156,77,89,1756,crushing kingsideAttack master masterVsMaster middlegame sacrifice short,https://lichess.org/4VGO6Xtw/black#52,
lipxR,r1bqk2r/4npp1/p1n1p2p/1pbpP3/5P2/P1NB1N2/1PP1Q1PP/R1B1K2R w KQkq - 0 11,c1e3 c5e3 e2e3 d5d4,2160,77,85,353,advantage master masterVsMaster middlegame short,https://lichess.org/HT1uoVHf#21,Caro-Kann_Defense Caro-Kann_Defense_Advance_Variation
lktCP,2R5/6r1/1kPp4/5KP1/8/p7/8/8 w - - 0 55,f5f6 a3a2 f6g7 a2a1q,2117,76,94,2360,advancedPawn crushing endgame master masterVsMaster promotion rookEndgame short,https://lichess.org/QBMZZAb4#109,
lmUN4,3r1k2/3B4/4Qbq1/3Pp3/1P2P3/5p2/P4pP1/2R2K2 w - - 2 39,g2g4 g6h6 f1f2 f6h4,2103,78,90,625,crushing endgame master masterVsMaster short,https://lichess.org/a87Wp6AP#77,
ln6Gq,3r1nk1/1pq1rpp1/p2Np2p/3P4/3N4/1P4QP/P4PP1/3RR1K1 b - - 0 25,c7d6 g3d6 d8d6 d4f5 d6d7 f5e7,2184,115,83,19,crushing kingsideAttack long master masterVsMaster middlegame,https://lichess.org/uwmsaHQZ/black#50,
loxA3,1r6/Rpk3bp/n1p2pp1/N3p3/2N1P3/2P3P1/1P3P1P/5K2 b - - 4 26,g7f8 a5b7 b8b7 a7a6,2118,75,91,1402,advantage capturingDefender endgame master masterVsMaster short,https://lichess.org/PscsFyJA/black#52,
lpsiS,3r4/R1Q2pkp/1p1P2p1/8/8/5PP1/4q1KP/8 w - - 1 31,g2h3 e2f1 h3g4 h7h5 g4f4 g6g5,2172,91,75,30,crushing endgame long master masterVsMaster,https://lichess.org/5cbjTy7o#61,
lrK0s,r2qkb1r/pp1b1p1p/n4p2/1N1Np3/Q1Pp4/8/PP2PPPP/R3KB1R w KQkq - 4 11,a4a6 f8b4 d5b4 b7a6,2123,78,92,3854,crushing intermezzo master masterVsMaster opening short,https://lichess.org/4oAnJR5p#21,Queens_Gambit_Declined Queens_Gambit_Declined_Semi-Tarrasch_Defense
lryMT,1k1n2r1/1pqbbp2/P3p1r1/2P1Pp1p/3p1Q2/3B1N1P/P2B1PP1/1R3RK1 w - - 3 22,f1c1 g6g2 g1f1 d7c6,2110,89,60,23,advantage master masterVsMaster middlegame short,https://lichess.org/MBFEPm6D#43,
ltYUJ,8/8/p2B1b2/2pPpP2/2P1K1k1/P6p/7P/8 w - - 0 67,d6e7 f6e7 e4e5 g4g5 f5f6 e7f6,2197,79,90,2102,bishopEndgame crushing endgame long master masterVsMaster,https://lichess.org/TgFtFwb6#133,
lv5W0,Q5k1/8/4r1p1/1pq2p2/1p6/4N1P1/1bP2PK1/3R4 b - - 1 34,g8f7 d1d7 e6e7 a8a2,2107,80,67,66,crushing endgame master masterVsMaster short,https://lichess.org/WitTUOMT/black#68,
lyzcG,r5k1/3R3N/5Pp1/2p5/pp1b2P1/8/P6P/5K2 b - - 0 34,b4b3 a2b3 g8h8 b3a4,2154,179,57,18,crushing endgame master masterVsMaster short,https://lichess.org/P3p5hOnM/black#68,
lzjwL,1r3k2/p2r1p1p/1p4p1/2pB4/2Pn3P/1P2R3/P4PP1/3R1K2 b - - 0 23,b8e8 e3e8 f8e8 d1d4 c5d4 d5c6 e8e7 c6d7,2151,79,91,990,crushing endgame master masterVsMaster pin sacrifice veryLong,https://lichess.org/ex7uR2ld/black#46,
m2sEQ,1r4k1/4bppp/p2pb3/q3p1Pn/1rp1P3/P1N1BP2/1PPQN2P/K2R2R1 w - - 1 20,c3a2 c4c3 a2b4 c3d2,2108,76,91,463,advancedPawn advantage master masterVsMaster middlegame short,https://lichess.org/yWxogkdt#39,
m9W1A,6k1/5p2/4p1B1/3p1P1p/1p1P2nP/pPq3P1/P3QPK1/8 b - - 0 35,c3d4 g6h5 g4f6 f5e6,2167,111,87,26,advantage endgame master masterVsMaster short,https://lichess.org/nvOm42GY/black#70,
mCrSO,3R4/8/1p6/3P2kp/p1P3p1/6P1/1r4PK/8 b - - 1 37,b2b4 d5d6 g5f5 d8e8,2167,77,90,896,crushing defensiveMove endgame master masterVsMaster rookEndgame short,https://lichess.org/jKT5xveq/black#74,
mEKu9,2k1r3/1b4R1/4nB2/p2pP3/1pp3B1/8/PPPK4/8 b - - 0 40,b7c6 g7g8 c8b7 g8e8 c6e8 g4e6,2126,75,93,5528,capturingDefender crushing endgame long master masterVsMaster,https://lichess.org/O4FoB3wn/black#80,
mGi5C,6k1/pq2ppbp/1p3np1/1Qr5/2P2B2/2N1PPP1/PP4KP/2R5 w - - 1 21,b5b3 g6g5 f4g5 c5g5,2189,77,91,1149,advantage master masterVsMaster middlegame short trappedPiece,https://lichess.org/Q6gT5YHg#41,
mGuCM,4r1k1/B4p1p/1PP3p1/4b3/2P5/6P1/5P1P/5K2 b - - 0 34,e5d4 b6b7 d4a7 c6c7,2150,78,89,1066,advancedPawn crushing endgame master masterVsMaster sacrifice short,https://lichess.org/j3bjH5HQ/black#68,
mGwLI,8/8/2bp2k1/p1p2p2/2P1pPP1/1P4K1/P7/3B4 b - - 1 42,e4e3 d1c2 g6g7 c2f5,2167,75,91,796,bishopEndgame crushing endgame master masterVsMaster short,https://lichess.org/MuRoY1A0/black#84,
mHdVj,8/2b5/2k1K3/3p4/P2B1p2/5P2/8/8 w - - 5 47,e6e7 c7b6 d4e5 b6e3 e7e6 d5d4 e5d4 e3d4,2157,81,90,1250,bishopEndgame crushing endgame master masterVsMaster quietMove veryLong,https://lichess.org/2Gb25lo5#93,
mIce5,2k5/2q2p2/p2r3p/N3Q3/1pb5/3p2P1/PP3K1P/2R5 b - - 1 34,d3d2 c1c4 d2d1q e5e8 d6d8 c4c7,2137,76,93,6905,crushing endgame exposedKing long master masterVsMaster pin,https://lichess.org/ef1dDg7T/black#68,
mJ5IY,2rk3r/1p1n4/p3p1Q1/N1P1Pp1p/1P5q/8/P5P1/3R2K1 b - - 1 33,h4g4 d1d7 d8d7 g6f7 d7d8 a5b7,2126,82,79,311,attraction exposedKing long master masterVsMaster mate mateIn3 middlegame sacrifice,https://lichess.org/qoIvV7Aw/black#66,
mKdUP,8/4n3/1p5p/p3k2P/P3N1PK/1P2p3/8/8 w - - 2 50,e4c3 e7d5 c3e2 d5f4,2159,76,86,284,crushing endgame knightEndgame master masterVsMaster short,https://lichess.org/VeSdiLOs#99,
mNAko,8/8/3n3p/p1pp4/P5k1/1PPBK1P1/8/8 w - - 2 48,e3f2 d6e4 f2g2 e4c3,2147,78,87,1098,crushing endgame master masterVsMaster short,https://lichess.org/rzxGEA10#95,
mNiTj,6k1/4pp2/3p1np1/5q2/3B3Q/7P/1r4P1/4R2K b - - 5 30,b2b7 e1e7 b7e7 d4f6 e7e1 h1h2 f5f6 h4f6,2117,77,91,548,advantage endgame master masterVsMaster veryLong,https://lichess.org/P0LxyaR4/black#60,
mP3zj,8/8/p3p3/Ppp1P1pk/4K3/1P4PP/8/8 w - - 1 38,e4f3 g5g4 h3g4 h5g5,2165,76,90,193,crushing endgame master masterVsMaster pawnEndgame short zugzwang,https://lichess.org/8Tul2pkV#75,
mQNWY,2q2k1r/6b1/3R1p2/p2Q2pp/7P/2PP4/5KP1/8 b - - 1 33,f8e7 d6c6 c8d7 d5c5 e7f7 c6c7 d7c7 c5c7,2115,75,94,3111,crushing endgame master masterVsMaster pin veryLong,https://lichess.org/i2L8aM26/black#66,
mS6a6,4r1k1/ppp5/4rp2/2Pp1ppn/3P1P2/R3B2P/P2N2K1/5R2 w - - 1 26,f1f3 g5g4 h3g4 f5g4,2126,77,86,91,advantage master masterVsMaster middlegame short,https://lichess.org/UvnEOEno#51,
mSDBq,8/5pkp/3pp1pR/p5Pn/3PPP2/4Nb2/1KP5/8 w - - 2 32,f4f5 e6f5 e4f5 f7f6 h6g6 h7g6,2199,108,82,49,advantage endgame long master masterVsMaster,https://lichess.org/rU7td8DY#63,
mSQUf,2r5/3k2p1/p2pp3/r5Pp/1p2PN1P/1Pb5/P1P5/1K1R1R2 w - - 3 31,f4h5 a5a2 b1a2 c8c5 f1f5 e6f5,2151,101,82,39,crushing endgame long master masterVsMaster sacrifice,https://lichess.org/CS8tFm6h#61,
mT5Oz,r2q1rk1/2p1ppb1/p5pn/1bn1P3/2B2B2/2P2NN1/4Q1PP/3R1RK1 b - - 5 21,d8c8 c4b5 a6b5 e2e3,2142,73,96,7117,advantage master masterVsMaster middlegame short,https://lichess.org/Nqg8O3z4/black#42,
mUJwR,8/4kpp1/B3p2p/4b2P/8/KN6/2r3P1/5R2 w - - 1 37,a6b7 e5d6 a3a4 c2c4 a4a5 c4b4 b7f3 b4b3,2192,74,96,4574,advantage endgame exposedKing fork master masterVsMaster veryLong,https://lichess.org/jSsrJmxY#73,
mVkc6,2r5/pbPR1pk1/1p4pp/n7/4N3/P7/5PPP/1B4K1 b - - 3 28,b7e4 b1e4 g7f6 e4d5,2177,78,91,1017,crushing endgame master masterVsMaster short,https://lichess.org/RcmwnKur/black#56,
mXckP,2R5/5pk1/1p1r1np1/1P2q2p/3pP3/6NP/3Q1PP1/6K1 b - - 1 32,h5h4 g3f5 g6f5 d2g5 g7h7 g5h4 h7g6 c8h8 f5e4 h4h6 g6f5 g2g4 f5e6 h8e8 e6d5 e8e5,2117,79,82,43,advantage endgame master masterVsMaster pin quietMove sacrifice skewer veryLong,https://lichess.org/EkloQ7rs/black#64,
maW1t,3r1rk1/pb2q2p/2p5/2p2p2/3pP3/1P1P2N1/P1P1QP1P/R1B3K1 b - - 1 21,f5f4 e2g4 g8h8 c1f4 f8g8 g4h5,2103,125,85,26,advantage long master masterVsMaster middlegame,https://lichess.org/rSIMvbJ3/black#42,
