PuzzleId,FEN,Moves,Rating,RatingDeviation,Popularity,NbPlays,Themes,GameUrl,OpeningTags
EmtwN,1r3r1k/3R2bp/1q4P1/1p1Bp3/8/3P2p1/1P1B1P2/3QR1K1 w - - 0 28,e1f1 f8f2 d2e1 f2d2,2156,76,86,275,crushing discoveredAttack master masterVsMaster middlegame short,https://lichess.org/OESA7nev#55,
EpnGx,5rk1/p2Ppp1p/b1p3p1/q7/1r3P1n/1BN2Q2/PPP3PP/R3K2R w KQ - 13 22,f3c6 a6b7 c6b7 b4b7,2134,75,91,475,advantage master masterVsMaster middlegame short trappedPiece,https://lichess.org/JgPwBkLz#43,
Erb4D,8/7P/5BK1/8/6k1/8/6r1/8 b - - 0 73,g4f4 g6h5 g2h2 f6h4,2132,78,82,52,crushing defensiveMove endgame master masterVsMaster short,https://lichess.org/lheumeLU/black#146,
EreAh,1R6/5p1p/p5pk/5q2/3Q3P/P3P1P1/r1r2P2/5RK1 w - - 11 33,g3g4 c2f2 g4g5 h6h5 d4d1 h5h4,2129,75,90,1513,crushing endgame long master masterVsMaster,https://lichess.org/hNS7GohP#65,
Etolm,r1b2rk1/p3pp1p/2p3p1/3n4/q3NP2/3B2PP/2P2Q2/1R3RK1 b - - 0 22,c8f5 b1a1 a4b4 f1b1 b4e4 d3e4,2128,107,43,22,advantage clearance long master masterVsMaster middlegame trappedPiece,https://lichess.org/Wgd94Mxa/black#44,
EuCyL,rnb1Kb1r/pp1p1p1p/q1p1p1pn/4k3/6P1/5P1P/PPPPP3/RNBQ1BNR b - - 11 14,e5f4 d2d4 f4g3 d1e1,2123,79,76,294,discoveredAttack master masterVsMaster mate mateIn2 opening short,https://lichess.org/hFxzRfrp/black#28,Gedults_Opening Gedults_Opening_Other_variations
EwCoM,8/1R5p/5ppk/3r4/4p1PP/4P3/5K2/8 b - - 0 42,f6f5 g4g5 h6h5 f2g3 f5f4 g3h3 h7h6 b7h7 d5g5 h4g5,2165,125,47,33,crushing endgame master masterVsMaster pin rookEndgame veryLong,https://lichess.org/yqC1JiAQ/black#84,
Exp2q,5k2/4bp2/p3pn1p/Pb2N3/1p1r4/1B2Q2P/1P3PPK/2r5 b - - 1 26,c1d1 e3h6 f8g8 b3e6,2199,91,70,46,advantage master masterVsMaster middlegame short,https://lichess.org/bNWgnaOn/black#52,
Ez0C9,8/2p3k1/1p1b1qp1/1P1P1b1p/8/4QBP1/6K1/5R2 w - - 0 33,f3e4 f5h3 g2h3 f6f1,2198,81,91,244,attraction crushing deflection discoveredAttack endgame master masterVsMaster short,https://lichess.org/fHCEPOld#65,
EzNy9,4r1k1/pp3p1p/1qp5/4N2p/8/2N5/PP4PP/3Q3K w - - 0 24,d1h5 b6f2 h5g5 g8h8,2122,76,89,611,crushing endgame master masterVsMaster short,https://lichess.org/iqw4BNFU#47,
EzW72,r2q1r1k/2p1bppB/1p3n2/p2p2N1/2P5/PPB5/2QP1P1P/2K4R w - - 0 18,c3f6 e7a3 c1b1 d8f6,2150,89,90,1028,crushing discoveredAttack master masterVsMaster middlegame short,https://lichess.org/QFDXKkHa#35,Nimzo-Larsen_Attack Nimzo-Larsen_Attack_Symmetrical_Variation
F0X37,r2qk1r1/pp1n1pP1/2p1p3/b6p/5P2/P1pP1bPP/1PP3B1/R1BQ1RK1 w q - 0 14,d1f3 c3b2 c1b2 d8b6 g1h2 b6b2,2197,77,87,123,advancedPawn advantage exposedKing fork long master masterVsMaster middlegame,https://lichess.org/rKHRcUrD#27,Bird_Opening Bird_Opening_Other_variations
F2bYX,1r1qr2k/1p2pQ1p/p2P1nnB/2p5/2P5/2N5/PP4PP/4R1K1 b - - 4 24,e8g8 e1e7 d8f8 h6f8,2188,74,93,531,advantage master masterVsMaster middlegame short,https://lichess.org/KGAe5jcj/black#48,
F3n7q,3rr1k1/p3p1b1/1p3pN1/2p2Rp1/P1P1q1PP/2P3Q1/1P6/R5K1 w - - 0 32,h4g5 d8d3 g3g2 e4e3,2133,78,81,207,advantage master masterVsMaster middlegame short,https://lichess.org/GM9Ex9Ta#63,
F3zHG,3Q4/8/4pk2/8/pp3qPK/7P/P7/8 b - - 1 63,f6e5 d8b8 e5e4 b8b4 e4f3 b4f4,2171,75,93,2567,crushing endgame interference long master masterVsMaster queenEndgame,https://lichess.org/R2Oe29k8/black#126,
F4RT0,5rk1/4pp1p/3p1npQ/7P/3pP3/qp3PN1/7R/1K3RN1 w - - 0 23,h5g6 f8a8 g6h7 g8h8 h6g7 h8g7 h7h8q a8h8,2171,79,85,68,crushing master masterVsMaster middlegame quietMove veryLong,https://lichess.org/ORIVdzqU#45,
F4Tap,r3k2r/3bbp2/p1nppp2/qp3P1p/4P3/2N2N2/PPPQ2PP/1K1R1B1R w kq - 0 14,f1e2 b5b4 f5e6 f7e6 c3d5 e6d5,2149,77,83,420,advantage long master masterVsMaster middlegame trappedPiece,https://lichess.org/uz1Q5xUW#27,Sicilian_Defense Sicilian_Defense_Richter-Rauzer_Variation
F5gxw,5r1k/2p1r1q1/1p5p/p2P4/2P4P/1P1Q2N1/P3RPP1/6K1 w - - 0 36,g3f5 g7a1 g1h2 e7e2 d3e2 f8f5,2120,75,83,266,advantage endgame long master masterVsMaster,https://lichess.org/n3gCgy4D#71,
F5xNY,3r1r1k/p5qp/1p1N1p2/8/3RNn2/2P2Q2/PP4PP/6K1 b - - 1 26,f6f5 f3f4 f5e4 d6f7 g7f7 f4f7 f8f7 d4d8,2147,81,90,1086,crushing fork master masterVsMaster middlegame veryLong,https://lichess.org/kOWRHes1/black#52,
F6weS,r6r/p2n1pk1/1pp1p1p1/3qPn1p/N1NP4/Q7/PP3PPP/2R2RK1 w - - 1 23,f1d1 b6b5 a4c3 d5c4 b2b3 b5b4 a3a5 c4c3 c1c3 b4c3,2122,75,81,72,advantage fork interference master masterVsMaster middlegame veryLong,https://lichess.org/ZIbE4H2y#45,
F7SeD,8/3b3p/pp1n4/3k1p2/1P1p4/P3PP1B/1N3K1P/8 b - - 0 39,d6c4 e3e4 f5e4 f3e4 d5e4 h3g2 e4f4 b2c4,2184,87,75,31,endgame master masterVsMaster,https://lichess.org/0yh6mdHa/black#78,
F8cOx,4k3/7p/1N6/3pr1b1/P7/3K1pP1/2R4P/8 w - - 0 48,a4a5 e5e3 d3d4 e3e2 c2c8 e8f7,2161,77,82,187,crushing defensiveMove endgame long master masterVsMaster,https://lichess.org/CK8PboTV#95,
F8rKq,2r2rk1/pp1Rb1pp/1q2p3/8/4N3/8/PP2Q1PP/4R2K b - - 5 22,e7b4 e2g4 f8f7 e4f6,2117,76,90,847,crushing master masterVsMaster middlegame pin short,https://lichess.org/RL6MUudG/black#44,
F9F4j,r5k1/4R2p/3B2p1/p2p4/2b5/5P2/2r3PP/3R2K1 b - - 1 25,a8a6 d1b1 c2c1 b1c1,2182,73,93,7776,advantage endgame master masterVsMaster quietMove short,https://lichess.org/eWUq7ubW/black#50,
F9yIs,5r1k/6p1/2r1b2p/q2pPp1P/3Q1R2/4N3/6P1/5RK1 w - - 0 28,e3f5 c6c4 f5e7 f8f4 e7g6 h8h7,2118,75,89,131,advantage long master masterVsMaster middlegame,https://lichess.org/w9cWaMiy#55,
FA0jM,r3qrk1/pbp2Nbp/1p2p1p1/4P3/4n3/1Q2B1PB/PP3P1P/3R1RK1 b - - 0 17,f8f7 h3e6 g7e5 d1d7,2100,78,87,691,advantage master masterVsMaster middlegame pin short,https://lichess.org/aVdd2JJ4/black#34,Neo-Grunfeld_Defense Neo-Grunfeld_Defense_Classical_Variation
FAa1v,8/5p2/7p/5k2/6p1/1K2PPP1/7P/8 w - - 0 40,f3g4 f5g4 b3c4 g4h3,2145,75,88,451,crushing endgame master masterVsMaster pawnEndgame short,https://lichess.org/TDQxSkQU#79,
FAt6I,2r5/5p1k/N2p1q1p/2bPp1pn/1P2P1R1/5P2/2Q2P1P/r4BRK w - - 1 31,b4c5 f6f3 f1g2 a1g1 h1g1 f3g4,2123,78,92,2939,crushing kingsideAttack long master masterVsMaster middlegame,https://lichess.org/tmREfJnL#61,
FB51y,6k1/1q4p1/3p1r1p/2p1pP2/2PnP1Q1/4B1P1/5R1P/6K1 w - - 7 35,g1g2 h6h5 g4h4 d4f5 f2f5 f6f5,2110,75,93,7030,crushing endgame long master masterVsMaster pin,https://lichess.org/mNUeQHcg#69,
FC9cq,4r1k1/1p3pp1/2p1r1qp/8/p1nPN3/P4Q1P/1P2RPP1/4R1K1 w - - 7 25,e4c5 c4d2 e2d2 e6e1,2118,76,93,3062,crushing deflection kingsideAttack master masterVsMaster middlegame short,https://lichess.org/g0wD7PTa#49,
FCp7d,8/p7/4k3/7Q/1P6/3q4/P2p1K2/8 w - - 4 46,h5h6 e6d7 h6g7 d7c6 g7f6 c6b5 f6e5 b5b4,2190,134,87,26,crushing defensiveMove endgame master masterVsMaster queenEndgame veryLong,https://lichess.org/MvTQKkVB#91,
FD3Rz,3r3r/pp3k2/2nR1bnp/1N1p4/3P1Bq1/5NP1/PP1Q1P2/R5K1 w - - 5 24,d2e2 g6f4 f3e5 c6e5 d6f6 f7f6,2122,75,71,176,crushing long master masterVsMaster middlegame pin,https://lichess.org/MDnhalxG#47,
FFGjK,8/7p/1pP1n3/1B4p1/PK1kp1P1/7P/8/8 w - - 0 39,a4a5 b6a5 b4a5 d4c5,2156,87,67,70,crushing endgame master masterVsMaster short superGM,https://lichess.org/gXPIG0mX#77,
FH91G,r4rk1/1p4pp/p1q1bp2/P1b1p3/4N3/1Q2n1B1/1P2BPPP/2R2RK1 w - - 2 21,c1c5 e6b3 c5c6 e3f1,2156,75,92,4079,advantage master masterVsMaster middlegame short,https://lichess.org/6zm2YOUZ#41,
FHA6w,r1bq2k1/pp4pp/2n2r2/2p3B1/3P4/P4NQ1/2p2PPP/R3R1K1 b - - 1 18,c5d4 g5f6 d8f6 e1e8 g8f7 a1e1,2107,76,80,161,clearance crushing defensiveMove long master masterVsMaster middlegame pin,https://lichess.org/HNsVQmBe/black#36,French_Defense French_Defense_Winawer_Variation
FIbzw,2N5/8/5k2/pp1p2p1/2pP4/2Pn1K1P/PP4P1/8 w - - 2 45,b2b3 c4b3 a2b3 a5a4 b3a4 b5a4,2123,80,90,1881,crushing endgame knightEndgame long master masterVsMaster,https://lichess.org/l682wNZJ#89,
FImED,8/4bk2/p4p2/3rp3/2Q2R1p/3qBK2/PP3P1P/8 w - - 0 34,f4d4 d3f5 d4f4 e5f4,2149,84,88,1052,crushing endgame master masterVsMaster short superGM,https://lichess.org/fzoz4Rqt#67,
FInxz,r4rk1/6bp/3N2p1/3Pp3/1n6/pP5N/P1Q2Pq1/1K1R3R w - - 3 24,c2e4 f8f2 h3f2 g2f2,2187,78,86,226,crushing master masterVsMaster middlegame short,https://lichess.org/zFUTaoq8#47,
FJOu0,4r1rk/1pq1bppp/p3bn2/4p1B1/P3P2Q/2NB1R2/1PP3PP/5R1K b - - 9 18,c7d8 c3d5 f6d5 e4d5,2100,80,76,42,crushing master masterVsMaster middlegame short,https://lichess.org/Vazpaf5B/black#36,Sicilian_Defense Sicilian_Defense_Najdorf_Variation
FJv6N,8/6R1/1p1Bpb2/6p1/8/3kp1P1/5PK1/8 w - - 0 51,d6e5 f6g7 e5g7 e3e2,2157,85,90,1414,advancedPawn crushing endgame master masterVsMaster short,https://lichess.org/0raSnXET#101,
FKKhf,8/8/3b2p1/6p1/2P1p1P1/2N3kP/4K3/8 b - - 2 54,g3h3 c3e4 d6e5 e2f3,2151,76,90,274,crushing defensiveMove endgame master masterVsMaster short,https://lichess.org/X4wurURg/black#108,
FOLdx,2r3k1/p1p2ppp/4P3/8/3Q4/q7/P1r2PPP/R4RK1 b - - 0 18,f7e6 d4e4 g8h8 e4c2,2150,88,87,49,crushing endgame master masterVsMaster short,https://lichess.org/UPqOYfwd/black#36,Scotch_Game Scotch_Game_Scotch_Gambit
FPBqq,8/8/8/1P1N1pk1/3K4/8/5R2/2rb4 b - - 2 57,c1b1 d5c3 b1b3 d4c4,2159,111,76,24,crushing endgame master masterVsMaster short,https://lichess.org/etRultpB/black#114,
FQwOm,r1r2bk1/pq3pp1/4pB1p/8/1p6/6R1/PPP1QPPP/4R1K1 b - - 3 22,b7d5 g3g7 f8g7 e2g4 d5g5 f6g5,2125,77,92,4089,advantage kingsideAttack long master masterVsMaster middlegame pin sacrifice superGM,https://lichess.org/qmzluwtd/black#44,
FSBpX,r4k1r/p2Q3p/2p3b1/2R1p1P1/8/8/PPP2qP1/2K4R b - - 1 20,a8e8 c5c6 f2f4 c1b1,2126,122,88,16,crushing defensiveMove master masterVsMaster middlegame short,https://lichess.org/F5Mlrqvy/black#40,
FTY2P,1r2r1k1/pP3ppp/1b6/q4b2/4nP2/P1N2N2/1P2BPPP/2QRK2R w K - 1 17,d1d5 e4c3 d5a5 e8e2,2189,81,89,598,crushing discoveredAttack master masterVsMaster middlegame sacrifice short,https://lichess.org/oLHOuvZE#33,Queens_Gambit_Declined Queens_Gambit_Declined_Harrwitz_Attack
FULrQ,8/3k2p1/P6p/7P/2NbPK2/1p6/8/8 b - - 2 59,d7c6 c4a5 c6b5 a5b3,2129,82,90,1619,crushing endgame master masterVsMaster short,https://lichess.org/cLy1Kq1e/black#118,
FUhog,2r3k1/1p3p2/pq3Bp1/n3P2p/7N/P3p3/1P1Q2PP/5RK1 w - - 0 24,d2e2 c8c2 e5e6 f7e6 f6d4 b6d4,2163,80,73,44,advantage long master masterVsMaster middlegame,https://lichess.org/UmsQwONC#47,
FYGrI,8/8/p1P3p1/5k1p/1PK1p2P/4R1P1/8/3r4 b - - 0 49,d1c1 c4d5 c1d1 d5c5,2129,78,87,75,advantage defensiveMove endgame master masterVsMaster rookEndgame short,https://lichess.org/JkSW7zlT/black#98,
FYW5C,3r1r1k/1pp3pp/p1n5/2PR1b2/2B2p2/7P/PB3PP1/3R2K1 b - - 1 27,f5e4 d5d7 d8d7 d1d7,2118,74,94,3064,crushing master masterVsMaster middlegame short,https://lichess.org/R897RO5R/black#54,
Fa3j0,1r6/1Pk5/PR1pp3/5p1p/r6K/8/6P1/1R6 w - - 4 43,h4h5 a4g4 b1c1 c7b6,2130,113,54,24,crushing endgame master masterVsMaster rookEndgame short,https://lichess.org/B4IohBw6#85,
Fa745,8/8/6R1/1pPp2R1/p2P4/P6k/3K2p1/5q2 b - - 7 53,f1f4 d2c3 b5b4 c3b4 f4d4 b4b5,2120,78,88,212,crushing defensiveMove endgame long master masterVsMaster queenRookEndgame,https://lichess.org/XNlSr8eA/black#106,
Fbymb,r3k2r/1p1b1p1p/1q2pQp1/3pP3/pN5P/P2B4/1P3PP1/1R3nK1 b kq - 1 20,e8g8 b4d5 e6d5 f6b6,2172,77,87,114,advantage master masterVsMaster middlegame short,https://lichess.org/okjXfKBC/black#40,
Fcmty,5r2/4kp1p/3PpRpP/4P1r1/2p5/5R2/8/4K3 b - - 0 38,e7d7 f6f7 f8f7 f3f7 d7c6 f7c7,2133,78,91,2350,crushing endgame long master masterVsMaster rookEndgame,https://lichess.org/BMZTIVXA/black#76,
FdB8I,2r3k1/1b2p1np/pq3ppQ/1p2p3/3rP2P/P1NB2R1/1PP2PP1/3R2K1 b - - 4 22,c8d8 h4h5 g7h5 h6h5,2174,76,87,595,advantage master masterVsMaster middlegame pin short,https://lichess.org/eptc7ANk/black#44,
FdNTF,8/1R6/K1p4k/P2p4/1P6/1r6/8/8 b - - 0 64,h6g5 b4b5 c6b5 b7b5,2146,77,91,560,crushing endgame master masterVsMaster pin rookEndgame short,https://lichess.org/NBTj2Sby/black#128,
FgD27,8/5k2/1n3p2/4PP2/p1pK1P2/6Bp/P7/8 w - - 0 40,a2a3 b6d5 g3h2 c4c3,2184,76,86,795,crushing endgame master masterVsMaster short,https://lichess.org/qpiatIRi#79,
FhEh6,4r1k1/pp2R1bp/2q2pp1/3p4/2pP1B2/2PbQ2P/PP3PPN/6K1 b - - 2 21,g8f8 f4d6 e8e7 e3e7,2115,76,86,399,crushing master masterVsMaster middlegame quietMove short,https://lichess.org/x6Rc054P/black#42,
Fj5l9,8/p4p1p/1p3p1k/2p2Pp1/2P1P2P/5KP1/PP6/8 b - - 1 28,g5h4 g3h4 h6h5 f3g3 a7a6 a2a4,2135,78,80,59,crushing defensiveMove endgame long master masterVsMaster pawnEndgame,https://lichess.org/AzicVRev/black#56,
FjY2p,2rq1r2/p6k/bpn1RPp1/3p1nQp/7P/2N3P1/PP3PB1/3R2K1 b - - 0 22,d8d7 g2d5 c6d4 d1d4 f5d4 e6e7 d7e7 f6e7,2151,78,89,1677,advancedPawn crushing fork master masterVsMaster middlegame veryLong,https://lichess.org/yXROzCyj/black#44,
FjZXH,4r1k1/pq3pb1/3P3p/8/4P1p1/2nB1NP1/P1QB1PKP/8 w - - 0 29,d2c3 g4f3 g2f3 e8c8 c2b3 b7b3,2167,76,91,3684,advantage long master masterVsMaster middlegame,https://lichess.org/REbfE8qM#57,
Fk5oV,1n2kr2/r3pp1Q/bqp3p1/3nP3/1p6/3B1N2/1PP1NPPP/R3K2R w KQ - 1 17,e5e6 a6d3 a1a7 b6a7 f3e5 a7a1 e1d2 a1h1 e6f7 e8d8,2197,80,87,609,advantage master masterVsMaster middlegame skewer veryLong,https://lichess.org/TPw2ouq6#33,Pirc_Defense Pirc_Defense_Other_variations
FlpJk,8/4qpk1/2Qp2p1/2pPp2p/1pPbP2P/1P4PB/5PK1/8 w - - 7 34,c6c8 e7a7 c8d7 a7a2,2111,78,91,4757,crushing endgame master masterVsMaster quietMove short,https://lichess.org/I4KNy3Bn#67,
Fm3ja,4rn1k/1p1q2p1/p2PNp1p/P2n3P/6Q1/8/1P1B1PP1/4R1K1 w - - 1 32,e6f8 e8e1 d2e1 d7g4 d6d7 d5f4 f8g6 h8h7,2107,79,70,300,advantage kingsideAttack master masterVsMaster middlegame superGM veryLong,https://lichess.org/d13G7ePO#63,
Fm7zJ,5rk1/pp2bpB1/4pn2/1qp1N2P/8/3r4/PPP1QPP1/1K5R w - - 0 22,g7f8 d3h3 e2d1 h3h1,2165,79,93,5452,crushing master masterVsMaster middlegame pin short,https://lichess.org/0UEv5P9K#43,
FmIBR,R1rn2k1/1p4pp/3Pbp2/4p3/1P1p4/3P2P1/5P1P/R5K1 b - - 3 32,d8f7 a8c8 e6c8 d6d7 c8d7 a1a8,2108,75,87,99,advancedPawn crushing endgame long master masterVsMaster,https://lichess.org/nh1mp7km/black#64,
FmUJ5,8/1q5k/3QNpp1/7p/2p4P/6P1/4nP1K/8 b - - 3 35,c4c3 e6f8 h7g8 f8d7,2198,95,88,27,crushing endgame master masterVsMaster short,https://lichess.org/t1Twj6iE/black#70,
Fnadu,2r1qBk1/pp3ppp/3R4/8/b3p3/P2BP3/1PnK1PPP/1Q5R w - - 0 23,b2b3 e8f8 d3c2 f8d6,2190,76,84,82,advantage hangingPiece master masterVsMaster middlegame short,https://lichess.org/n7N6pQEC#45,
FogAW,r1r3k1/p3ppb1/3p2p1/qp5R/3BP1p1/1PN2P2/PP1Q4/1K1R4 b - - 0 18,g6h5 d4g7 g8g7 d2g5,2109,76,81,289,attraction crushing kingsideAttack master masterVsMaster middlegame short,https://lichess.org/V6YoEz71/black#36,Sicilian_Defense Sicilian_Defense_Accelerated_Dragon
FpLgm,5rk1/1p3p2/p1r5/2nNpb1p/P6q/4Q2P/1PP2PP1/R2R2K1 b - - 3 24,g8h8 e3e5 f7f6 e5f5,2176,82,91,1359,crushing fork master masterVsMaster middlegame short,https://lichess.org/s8fzutTz/black#48,
FpN2m,3r4/pp5k/7p/3p3B/3bpq2/1P5Q/1P2K1P1/2R4R w - - 0 33,c1c7 f4c7 h5g6 h7g8,2132,81,88,108,advantage defensiveMove hangingPiece master masterVsMaster middlegame short,https://lichess.org/CYsQQVWe#65,
FpsQY,r2q1b1r/pppk1Ppp/2n1p3/8/7n/NQP1pP2/PP4PP/R3KBNR w KQ - 0 14,b3b7 h4g2 f1g2 d8h4,2166,98,82,30,advantage clearance master masterVsMaster middlegame sacrifice short,https://lichess.org/HXieWDia#27,Trompowsky_Attack Trompowsky_Attack_Edge_Variation
Fqeae,3r3k/4bp2/p5pp/2qpP2P/6Q1/3B1N2/5PP1/6K1 b - - 2 32,g6g5 g4f5 c5c1 f3e1 c1e1 g1h2 e1e5 f5e5,2197,76,93,1073,crushing defensiveMove endgame master masterVsMaster sacrifice veryLong,https://lichess.org/yi5GctER/black#64,
FsbyU,8/6k1/6r1/1pp5/1P6/p7/B4P2/5KR1 w - - 9 57,a2b1 g6g1 f1g1 c5c4,2138,76,90,223,crushing defensiveMove endgame master masterVsMaster short,https://lichess.org/H3k5TnMj#113,
Fsr0h,7r/p1k4q/1p3P2/2pRP1p1/6P1/6K1/PP2Q3/8 w - - 1 47,e5e6 h7h4 g3f3 h4h1 e2g2 h8h3 f3f2 h3h2 g2h2 h1h2,2183,85,54,42,clearance crushing endgame master masterVsMaster pin veryLong,https://lichess.org/aO5JDDqZ#93,
FtEiR,8/2R5/1p2p2P/4P3/2n2kp1/8/2b5/6K1 b - - 2 52,c4e5 c7c2 f4g5 h6h7 e5g6 c2c8,2168,81,91,1007,advancedPawn crushing defensiveMove endgame hangingPiece long master masterVsMaster,https://lichess.org/bkXRdMhz/black#104,
Fu9Tu,2Qr2k1/p4ppp/1q3n2/8/4P3/P3pP2/6PP/R1R3K1 w - - 0 22,c8c7 d8d1 c1d1 b6c7,2142,76,80,83,advantage deflection endgame master masterVsMaster short,https://lichess.org/I8MGrWJd#43,
FxNcT,r2qr1k1/1p3pp1/7p/pN6/3Q4/P4P1n/1P2N3/3R1RK1 w - - 0 26,g1h2 e8e2 h2h3 d8g5,2156,75,91,5999,advantage master masterVsMaster middlegame short,https://lichess.org/9Khiv6i6#51,
Fxtca,r4B1k/p2n1p1p/b3p3/q2pb1Q1/8/1P6/Pp2N1PP/1K1R1B1R w - - 1 22,f8h6 a6d3 d1d3 a5e1 e2c1 a8c8,2189,77,94,2296,crushing long master masterVsMaster middlegame sacrifice,https://lichess.org/RiUQ4cgW#43,
FypD4,4Q3/8/8/5pp1/P4k2/1P1p4/3q1P2/5K2 w - - 4 60,f1g2 d2e2 e8b8 e2e5 b8e5 f4e5,2139,80,91,570,crushing defensiveMove endgame long master masterVsMaster queenEndgame,https://lichess.org/zwcoPviC#119,
FzNon,7k/7p/p3N2p/4PP2/3bB3/P5K1/5r2/8 b - - 1 35,f2d2 e6d4 d2d4 g3f4,2186,80,90,969,advantage defensiveMove endgame master masterVsMaster short,https://lichess.org/6e39EfG8/black#70,
FzpIc,r5k1/1b2b3/p3N1p1/1p2Bp1p/2pP4/2Pq4/5PPP/R1Q3K1 b - - 11 39,g8f7 e6c7 g6g5 c7a8,2187,102,76,72,advantage master masterVsMaster middlegame short,https://lichess.org/9JzUleco/black#78,
G0eRU,1r3rk1/p3q2p/1bp1Ppp1/2pp1b2/2P2P2/5NQ1/PBP4P/4R1RK b - - 1 22,f5e4 e1e4 d5e4 f3h4,2153,79,87,121,advantage master masterVsMaster middlegame sacrifice short,https://lichess.org/pp7ny4vW/black#44,
G2tcP,rnb1r1k1/ppp1qpbp/5pp1/8/3P1B2/5N2/PPPQBPPP/R3K2R w KQ - 8 10,e1g1 e7e2 f1e1 e2b5,2136,78,90,1082,advantage master masterVsMaster middlegame short,https://lichess.org/X7StV8a4#19,Modern_Defense Modern_Defense_Other_variations
G7UTq,8/8/2p1kp1r/2Pp1R1P/1P6/P5R1/r5p1/6K1 w - - 2 49,g3g6 e6f5 g6h6 d5d4,2133,142,100,15,crushing defensiveMove endgame master masterVsMaster rookEndgame short,https://lichess.org/QzJpXKND#97,
G7ezu,r1b2rk1/ppp2ppp/3p4/3Nn3/3QP3/1P2P3/P1PKB1qP/5R1R b - - 1 16,c8g4 d5f4 e5f3 f1f3 g2h1 f3g3,2169,81,91,2613,advantage long master masterVsMaster middlegame sacrifice,https://lichess.org/QEwp29yw/black#32,Nimzo-Larsen_Attack Nimzo-Larsen_Attack_Modern_Variation
G7hMU,5rk1/pp1nn1p1/3qpr2/6Qp/P1P4P/R4NP1/3N1P2/5RK1 w - - 3 23,a3e3 f6f5 d2e4 d6b4,2172,76,87,97,crushing master masterVsMaster middlegame short,https://lichess.org/v1faEh2q#45,
GAGD7,8/8/3pk3/1p2p2p/p3PppP/P1PP1P2/5P2/5K2 b - - 3 34,d6d5 e4d5 e6d5 f3g4,2172,80,87,653,crushing endgame master masterVsMaster pawnEndgame short,https://lichess.org/KDNnKyOj/black#68,
GBS2i,4r1k1/1R3pb1/2p3p1/2Pbr1Pp/4B3/4BP1P/6K1/2R5 w - - 1 43,e3f4 e5e4 f3e4 e8e4 b7b8 g8h7 g2g3 h5h4,2184,78,85,75,crushing master masterVsMaster middlegame veryLong,https://lichess.org/PGZBQGyK#85,
GBYgn,r3k2r/1p3p1p/p2pb3/3n2q1/4R2N/3B1Q2/P1P3PP/1R5K b kq - 6 21,d5c3 e4e6 f7e6 b1b7,2162,78,90,323,crushing master masterVsMaster middlegame short,https://lichess.org/yVLHpcQr/black#42,
GC7aV,1r6/2rP1bkp/R4pp1/8/B7/K5P1/3R3P/8 w - - 7 49,d2d3 c7c1 a4b3 c1a1 a3b2 a1a6,2102,77,75,59,crushing endgame exposedKing long master masterVsMaster quietMove skewer,https://lichess.org/LlhzBOAU#97,
GCUfx,4r3/2p4k/1p1p2p1/8/2PQ1P1p/1P3RnP/P1N1q1PK/8 w - - 8 32,f3f2 e2e1 c2e1 e8e1,2157,75,95,6406,crushing endgame master masterVsMaster sacrifice short,https://lichess.org/rLbMzGrc#63,
GCWyJ,8/6k1/p4R2/6Bp/1P4pP/3K1b2/r7/8 b - - 0 44,g4g3 f6f3 g3g2 g5f6,2187,80,91,2138,crushing endgame hangingPiece master masterVsMaster short,https://lichess.org/vM9l98Vx/black#88,
GCd8p,2br1rk1/2p1q3/1p3p2/p1nPp2Q/P1P1P3/R5p1/3N1PB1/4R1K1 b - - 1 27,f8f7 a3g3 f7g7 e1e3,2175,80,89,1250,crushing defensiveMove master masterVsMaster middlegame short,https://lichess.org/ghAGhuMz/black#54,
GDuGF,r4rk1/pp1b1p1p/1q2pbpQ/8/3P4/2BB4/PP3PPP/R3R1K1 b - - 3 18,f6d4 e1e4 d4f2 g1h1,2143,76,84,87,advantage master masterVsMaster middlegame short,https://lichess.org/0BUPcRh7/black#36,Caro-Kann_Defense Caro-Kann_Defense_Main_Line
GFLnJ,6k1/3nqpp1/4Pb1p/p7/6PP/P2Q1N2/1rr2PB1/3RR1K1 b - - 0 22,c2f2 e6d7 f2g2 g1h1,2106,82,80,32,advancedPawn crushing master masterVsMaster middlegame short,https://lichess.org/xEDv1XpB/black#44,
GGAdm,6k1/1p2R1p1/2p2p1p/2Pb4/r5PK/P3Q2P/1B3P2/6q1 b - - 8 34,a4f4 e7g7 g8g7 e3f4,2143,92,37,24,crushing endgame master masterVsMaster short,https://lichess.org/pVAcZMGI/black#68,
GGOk2,r5k1/pp4b1/4N2p/1PBppr2/6pq/2NP2n1/P3P1B1/2R1Q1K1 b - - 1 24,a8c8 c5f2 c8c3 c1c3 g3e2 e1e2,2156,78,85,74,advantage long master masterVsMaster middlegame,https://lichess.org/LWIU2Qbx/black#48,
GGPYK,1k5r/pp6/3qb1p1/2r2p2/3pn2p/3BPN1P/PP2QPP1/KR5R w - - 0 23,e3d4 c5a5 b2b3 e4c3 e2d2 a5a2,2119,77,78,131,crushing fork long master masterVsMaster middlegame,https://lichess.org/JQJdmonn#45,
GHtXI,8/6p1/p7/1pN2p2/1Pk2P1P/P3K3/6b1/8 b - - 8 48,c4c3 c5e6 g7g6 e6f8,2196,100,74,39,crushing endgame master masterVsMaster short,https://lichess.org/SwrcSqzW/black#96,
GIikW,8/8/6p1/3PKpP1/5P2/4P3/2r5/k7 b - - 0 62,c2e2 e5f6 a1b2 f6g6,2161,76,91,2459,crushing endgame master masterVsMaster rookEndgame short,https://lichess.org/eGZlcSGT/black#124,
GKc3N,1r2r1k1/3b1p1p/Q2p2p1/3P4/3bPP2/1qN5/1P3RB1/R1B3K1 w - - 1 27,a6d6 b3c2 g1h2 c2f2,2116,77,87,203,crushing master masterVsMaster middlegame pin short,https://lichess.org/GPkybnjp#53,
GKxy1,8/4k1p1/2P1P2p/1p2N2P/1P1p4/4b3/4Kp2/8 b - - 0 67,e7e6 c6c7 d4d3 e2f1,2105,76,97,972,advancedPawn advantage defensiveMove endgame master masterVsMaster short,https://lichess.org/KE0y0xEw/black#134,
GLTRZ,8/5p1k/6pp/8/2P1q3/1PBnbN1P/6P1/4Q2K w - - 6 42,e1e2 d3f2 h1g1 f2d1,2130,81,90,1945,advantage discoveredAttack endgame master masterVsMaster short,https://lichess.org/8GJ3CGnO#83,
GLjVa,1r6/p3P1k1/3p3p/1p5p/2P2p2/3B3b/PP3P2/1K2R3 b - - 1 30,b8e8 c4c5 d6c5 d3b5 g7f7 b5e8,2179,77,90,800,crushing discoveredAttack endgame long master masterVsMaster,https://lichess.org/dZ19NiD2/black#60,
GPuUr,3k4/2R5/8/3PP1p1/1p5p/3r3P/7K/8 w - - 3 35,c7c5 d3d2 h2g1 b4b3,2146,77,81,68,crushing endgame master masterVsMaster rookEndgame short,https://lichess.org/gbTbfFdz#69,
GRw51,r5k1/2N5/2p2p1q/1p1b1N1p/3P2p1/P7/1P3PnP/2R1Q1K1 b - - 1 31,h6h7 c7d5 g2e1 d5f6 g8f7 f6h7,2106,78,92,559,advantage exposedKing fork long master masterVsMaster middlegame sacrifice,https://lichess.org/b6p5WKlh/black#62,
GUFr8,4rk2/6p1/p5p1/3Q1p2/3P2PP/P4P2/3q1K2/R7 w - - 0 32,f2g3 f5f4 g3h3 d2f2 d5d6 f8g8,2124,77,91,1038,crushing defensiveMove endgame long master masterVsMaster,https://lichess.org/34TXsMpH#63,
GVpYa,5rk1/5p1p/p4Rp1/1p6/n1p5/2qp4/5QPP/5RK1 b - - 1 27,c3c2 f2a7 c2e2 f6f7 e2f1 f7f1,2197,85,90,991,crushing endgame long master masterVsMaster,https://lichess.org/JEevAOzQ/black#54,
GXDRM,r1bq1rk1/pp2b3/2p1p2p/3pnp2/2PPn1p1/2NBP3/PP1N1PPP/2RQ1RK1 w - - 0 14,d4e5 e4d2 d1d2 d5c4,2155,75,92,4171,crushing master masterVsMaster opening short,https://lichess.org/vlPdboiH#27,Queens_Gambit_Declined Queens_Gambit_Declined_Lasker_Defense
Gaxyq,8/3n3Q/6pP/4p3/4Pk2/1PPq1P2/1P1r4/1K4R1 w - - 3 38,b1a2 d3c3 h7f7 f4e3 g1e1 e3f2,2162,83,90,729,crushing endgame long master masterVsMaster pin,https://lichess.org/FZe94k5m#75,
GblVC,8/2k5/b3Bp1p/2p1P1p1/5P1P/2K3P1/8/8 b - - 0 46,f6e5 f4g5 h6g5 h4h5,2130,84,8,39,advantage bishopEndgame defensiveMove endgame master masterVsMaster short,https://lichess.org/hM0a190U/black#92,
GelzG,2kr4/3rp2p/p1pq1pp1/P7/3P1n2/2P5/1RP2PPP/1R3QK1 b - - 1 28,c6c5 b2b6 d7a7 b6d6,2174,79,88,1182,crushing master masterVsMaster middlegame short,https://lichess.org/cFxRlNFX/black#56,
Gferg,1rb3kr/2q2p2/3p1Pp1/3Pn1Q1/1p2PN1p/2P1R2P/2B3P1/5R1K b - - 0 32,b4c3 f4g6 f7g6 f6f7,2199,76,58,59,advancedPawn crushing kingsideAttack master masterVsMaster middlegame sacrifice short,https://lichess.org/4Tuy19h8/black#64,
GhKeX,1r6/3b1r1p/ppkPp1pP/3pBpK1/PRpP1P2/2P3P1/8/3B4 b - - 1 58,b8d8 b4c4 c6b7 c4c7,2196,75,100,87,crushing endgame master masterVsMaster short,https://lichess.org/yzr9jIZT/black#116,
GhLFs,5rk1/R2nqpp1/1p2p3/1Pnpr3/1B1Q3p/4PPP1/7P/1R3BK1 b - - 4 27,h4g3 d4e5 d7e5 a7e7,2135,76,87,310,advantage master masterVsMaster middlegame short,https://lichess.org/TpFJ8B26/black#54,
GhLOP,2r3k1/pp1R1p1p/q4bbB/8/8/1B3P2/PP2rQPP/5R1K w - - 3 25,f2g3 e2d2 b3f7 g8h8 f1e1 d2d7,2121,76,71,111,advantage long master masterVsMaster middlegame,https://lichess.org/vXWTgs3p#49,
GjBzW,8/1pp5/5k2/p2P4/2P1K3/1P6/8/8 b - - 1 45,c7c6 d5c6 b7c6 e4d4 f6e6 d4c5 e6d7 c5b6,2129,74,85,152,crushing endgame master masterVsMaster pawnEndgame veryLong,https://lichess.org/MbNHl3ab/black#90,
GjW2Z,5rk1/1p2ppb1/p2pb1p1/Q1r4p/4P2P/P3nP2/1PPR2P1/1K3B1R w - - 2 18,a5b4 e3f1 h1f1 c5b5,2197,76,93,4777,crushing master masterVsMaster middlegame short,https://lichess.org/RJElHqkd#35,Sicilian_Defense Sicilian_Defense_Najdorf_Variation
Gjt4t,5k2/3n1p2/p3p2P/8/3R4/3b4/1P3P2/6K1 b - - 2 37,d7e5 d4d8 f8e7 d8d3,2198,76,94,9349,crushing endgame master masterVsMaster short,https://lichess.org/QPVuMaYp/black#74,
GjwDH,1rb2rk1/p1q2ppp/2pb1n2/3p2B1/8/1PNB1Q1P/P1P2PP1/R3R1K1 b - - 2 14,d6e5 e1e5 c7e5 g5f4 e5c3 d3h7 g8h7 f3c3,2167,79,77,105,advantage discoveredAttack kingsideAttack master masterVsMaster middlegame sacrifice veryLong,https://lichess.org/F378TBMh/black#28,Four_Knights_Game Four_Knights_Game_Scotch_Variation_Accepted
Gl2RC,6k1/1N3pp1/p1K1n3/2p4p/4r3/6P1/PPNR3P/5b2 w - - 0 36,b7c5 e4c4 b2b4 c4c2 d2c2 e6d4 c6b6 d4c2,2196,73,95,6037,advantage attraction endgame fork master masterVsMaster pin sacrifice veryLong,https://lichess.org/YahBfYQt#71,
GlPZq,3b4/1p1k1p2/4p1p1/PK2P1Pp/5P1P/1N6/8/8 b - - 0 45,d8c7 b3c5 d7c8 c5e4,2107,87,73,40,crushing defensiveMove endgame master masterVsMaster short,https://lichess.org/1yC3uE6s/black#90,
GlvEs,3r1bk1/1pR2p2/p3p1p1/1b1qP3/3B1Q2/P4N2/5PP1/6K1 b - - 5 33,d8d7 c7c8 d5c6 c8c6,2181,78,85,698,crushing master masterVsMaster middlegame pin short superGM,https://lichess.org/d8sfig1m/black#66,
GnNyq,r1b2r2/pp2npk1/4q1p1/3Np1Q1/4P2R/8/PPP3PP/3R3K b - - 1 28,e7d5 g5h6 g7f6 h6f8,2187,91,89,2815,crushing deflection master masterVsMaster middlegame short skewer,https://lichess.org/LRJWv6sa/black#56,
Guqw7,3r2k1/6p1/1R5p/4P3/8/p5P1/4P1BP/3nK3 w - - 0 34,b6d6 d8d6 e5d6 g8f8 d6d7 f8e7 e1d1 a3a2 d7d8q e7d8,2177,75,88,127,advancedPawn crushing endgame master masterVsMaster veryLong,https://lichess.org/WhWZk7LE#67,
GwKcL,8/2k5/P1p4p/4p3/1PKnP3/3N1p2/7P/8 w - - 0 41,c4c5 d4b3 c5c4 b3d2 c4c3 d2e4,2115,79,91,3464,crushing endgame knightEndgame long master masterVsMaster,https://lichess.org/ZXCeRJXI#81,
