PuzzleId,FEN,Moves,Rating,RatingDeviation,Popularity,NbPlays,Themes,GameUrl,OpeningTags
ShYSW,r1bqk2r/pppn1ppp/P1nb4/1B2p3/Q3P3/5N2/1P1P1PPP/RNB1K2R b KQkq - 3 9,d7b6 a6b7 c8b7 b5c6 b7c6 a4c6,2104,75,70,79,advancedPawn crushing long master masterVsMaster opening pin,https://lichess.org/Cd8R3qe7/black#18,English_Opening English_Opening_Anglo-Indian_Defense
Si0AU,r4rk1/p3qppp/1p1Nb1n1/2pPP2n/2B5/8/PPQ1N1PP/R4RK1 b - - 0 19,e6d7 d6f7 g6e5 d5d6,2125,75,92,6495,advantage master masterVsMaster middlegame short,https://lichess.org/Wjfn933p/black#38,Queens_Gambit_Declined Queens_Gambit_Declined_Exchange_Variation
SjDbK,6k1/p2q1rp1/1p5p/2b1Rp2/8/2B2Q2/PP3PKP/8 b - - 1 29,c5d4 e5d5 d4c3 d5d7,2103,75,93,6832,advantage endgame master masterVsMaster short superGM,https://lichess.org/I0c38Y3t/black#58,
Sjnkl,r4rk1/5ppp/p2Ppq2/P2n4/Q7/B3Pb2/1P3P1P/R3KBR1 w Q - 4 18,f1e2 d5c3 a4d4 f6d4 e3d4 c3e2,2146,80,90,1147,advantage long master masterVsMaster middlegame,https://lichess.org/qpTCzrT6#35,Queens_Pawn_Game Queens_Pawn_Game_Symmetrical_Variation
Slati,5rk1/pp2p2p/1q6/2p2r2/2P2N2/1P1Q2P1/P6P/4R1K1 b - - 6 35,b6f6 f4d5 f5d5 d3d5,2183,74,93,1086,advantage endgame master masterVsMaster short,https://lichess.org/jrYt8YCT/black#70,
SnNy8,8/ppk4P/2p5/8/1P3pQ1/4bP2/P2p2RK/q7 w - - 1 45,g4g8 d2d1q g8g7 c7b6 g7a1 d1a1,2172,76,92,1878,advancedPawn crushing defensiveMove endgame long master masterVsMaster promotion,https://lichess.org/UOlNYuKK#89,
SplfK,8/pp6/2p1k3/P1P5/1P2K3/8/8/8 w - - 1 41,e4e3 e6e5 e3d3 e5d5 d3c3 d5e4,2107,79,91,2447,crushing defensiveMove endgame long master masterVsMaster pawnEndgame zugzwang,https://lichess.org/4qJyO2w8#81,
SqUjk,8/5Kpk/5p1p/4pPPP/1b2P3/3R4/3p4/8 b - - 0 63,h6g5 h5h6 g7h6 f7f6 g5g4 d3d7,2182,77,90,799,crushing deflection endgame long master masterVsMaster,https://lichess.org/YcZTFtjh/black#126,
Sr7GD,r1b2qk1/pp2b2N/1n3rp1/2ppn3/5N1P/P1PB2P1/1P3P2/R1BQK2R b KQ - 0 16,g8h7 d1h5 h7g8 h5e5,2190,75,94,545,advantage master masterVsMaster middlegame pin short,https://lichess.org/246bjcNZ/black#32,French_Defense French_Defense_Classical_Variation
StCa0,r4rk1/pp2nppp/2q3b1/4PpB1/3Q4/P5N1/1P4PP/R4R1K b - - 2 22,f8d8 d4h4 h7h6 g5e7,2120,75,91,3612,advantage master masterVsMaster middlegame short,https://lichess.org/6um6VO52/black#44,
Su8jb,5rk1/p3r1pp/2p2n2/1pNnP3/2p2q2/5B2/PP3PPP/R2QR1K1 b - - 0 21,e7e5 c5e6 e5e6 e1e6,2180,75,93,1310,advantage fork master masterVsMaster middlegame short xRayAttack,https://lichess.org/qKlk1xuZ/black#42,
SvrCo,r1bqr1k1/1pp2pb1/p5pp/4N3/1P6/P1nB3P/3N1PP1/R1BQR1K1 w - - 0 15,d1b3 e8e5 e1e5 g7e5,2122,77,88,409,advantage master masterVsMaster opening short,https://lichess.org/ERCLTppf#29,Zukertort_Opening Zukertort_Opening_Kingside_Fianchetto
SxhWf,r5k1/pp1P1p2/4p1r1/4Qp2/2q4p/6P1/P4P1P/4RRK1 b - - 0 25,a8d8 e1c1 c4a4 f1d1,2182,79,90,1663,advantage clearance defensiveMove endgame master masterVsMaster short,https://lichess.org/37cLPyvw/black#50,
SyLGn,3r4/p3n1k1/1p1rqpp1/7p/3RP3/1P2QBP1/P6P/5RK1 w - - 1 28,f1d1 d6d4 d1d4 e7f5 d4d8 f5e3,2140,79,91,3671,crushing long master masterVsMaster middlegame,https://lichess.org/myX7ssOa#55,
T2zTs,5r2/1r3pR1/4p1p1/p1ppP3/P1k2PP1/2P1P3/1PK5/7R w - - 3 32,h1h7 f8b8 b2b4 a5b4,2109,80,86,58,crushing endgame master masterVsMaster quietMove rookEndgame short,https://lichess.org/STF7CWjp#63,
T3he3,4r1kr/8/p5b1/1p2p1Qp/2q3nP/P1B5/1PP3P1/2KRR3 b - - 5 28,c4e6 c3e5 e6f5 g5f5 g6f5 e5h8 e8e1 d1e1,2188,78,87,614,advantage master masterVsMaster middlegame veryLong,https://lichess.org/GYV1QScp/black#56,
T3kA5,5r2/p4p1p/1p2p1k1/4Qp1P/3Pq3/4P3/PP4P1/5RK1 b - - 0 24,g6h6 e5f6 h6h5 f1f3 e4f3 g2f3,2146,74,92,4071,crushing endgame long master masterVsMaster,https://lichess.org/jqWJNb8H/black#48,
T59gk,6rk/p6p/Pp4r1/3P1p2/1P2p3/2q2P2/R4Q1P/4R2K w - - 0 30,f3e4 g6g2 a2c2 c3c2 f2c2 g2c2,2114,76,89,381,crushing endgame long master masterVsMaster xRayAttack,https://lichess.org/y5Fos1Hb#59,
T6ENS,8/6kp/2q2p2/p2p2p1/R5P1/1PPQ2P1/5P1K/4r3 w - - 1 38,a4d4 f6f5 h2g2 c6h6 d3f1 e1f1,2184,79,91,4039,clearance crushing endgame long master masterVsMaster quietMove,https://lichess.org/YebdAT4B#75,
T7UAk,1r4k1/Rbr3p1/1p2pp1p/3n4/3P4/3NP2P/1R2BPP1/6K1 b - - 1 25,b7c6 a7c7 d5c7 b2c2,2129,76,85,59,crushing master masterVsMaster middlegame short,https://lichess.org/RwzWwL8I/black#50,
T8AEu,8/8/3pk3/1P2p1p1/1P2K3/6P1/8/8 b - - 2 55,e6d7 e4f5 e5e4 f5e4,2147,80,91,167,crushing endgame master masterVsMaster pawnEndgame short,https://lichess.org/WxGcr3qm/black#110,
T8U2a,2r3r1/7k/1p2pp1n/p3b2R/4Np1P/2P2P2/PP1B4/1K4R1 w - - 4 36,e4g5 h7g6 h5h6 g6h6,2145,75,94,1869,advantage defensiveMove master masterVsMaster middlegame short trappedPiece,https://lichess.org/lmcHketi#71,
T9GTl,6k1/p2nBpp1/2r1p1p1/3pP3/5PKP/3B2P1/r2n4/3RR3 b - - 2 31,d7c5 e7c5 c6c5 e1e2,2113,76,92,875,advantage master masterVsMaster middlegame short,https://lichess.org/Xgh6dw5r/black#62,
TB11F,8/p7/1p6/1Pp5/2Pn1k2/2BB3p/5K2/8 w - - 0 54,f2g1 f4e3 d3f1 d4e2 f1e2 e3e2 c3e5 e2d3 g1h2 d3c4 h2h3 c4b5,2160,100,76,31,crushing endgame exposedKing fork master masterVsMaster veryLong,https://lichess.org/hPqq1ylb#107,
TBEEx,r1b2rk1/ppqnppnp/2p3p1/8/2B1N1P1/5N1P/PPPQ1P2/2KR3R b - - 2 15,b7b5 d2h6 d7f6 f3g5,2196,75,85,105,crushing master masterVsMaster middlegame short,https://lichess.org/RpMz78v3/black#30,Modern_Defense Modern_Defense_Other_variations
TCTDj,6k1/4b1pp/p7/6q1/Pp1QB1n1/1P4P1/1B3r1P/4R1K1 b - - 0 27,e7c5 e4d5 g8h8 d4c5,2105,75,95,2872,crushing interference master masterVsMaster middlegame short,https://lichess.org/4ZbYAvTD/black#54,
TCgYm,5r1k/p5pp/2RN1p2/4p3/1P1p4/1Q4Pn/P3KP1P/q7 b - - 3 30,h3g1 e2d2 g1f3 b3f3,2104,83,91,3432,advantage endgame master masterVsMaster short superGM,https://lichess.org/HLIp1sti/black#60,
TCm06,2r2rk1/4p1b1/p4q2/1pnP4/4BB1P/P1N3Q1/1n3P2/3RK1R1 b - - 0 27,b2d1 f4e5 f6f2 g3f2,2143,75,77,160,advantage master masterVsMaster middlegame pin short,https://lichess.org/fEnQc7so/black#54,
TEBr5,3r1b1k/1p3p2/2p2Np1/p3Pq1p/7P/P1Q2PP1/1P4K1/4R3 w - - 0 31,e5e6 d8d3 c3d3 f5d3,2130,81,89,1578,advantage endgame master masterVsMaster short,https://lichess.org/62aTNxlQ#61,
THOzk,6k1/5pp1/2p4p/1pQ5/1P1P2q1/4rpP1/5P1P/1R5K w - - 0 30,f2e3 g4e4 c5f5 e4f5,2159,75,92,4890,crushing endgame master masterVsMaster short,https://lichess.org/eHeufRtt#59,
THxgH,5rk1/1b3rpp/p2qp3/3n4/Pp1N2B1/1P2P2P/1B3PPb/2RQ1R1K b - - 4 22,f7f2 g4e6 g8h8 d4f5,2119,169,75,7,crushing kingsideAttack master masterVsMaster middlegame short,https://lichess.org/5teaCiMI/black#44,
TJuuL,r5k1/1p5p/3q4/3P1p2/2P1pN2/1PQ1P2P/1K4P1/8 w - - 4 34,c4c5 d6a6 b2c2 a6f1,2167,74,73,84,advantage endgame master masterVsMaster quietMove short,https://lichess.org/Koeayp8I#67,
TLnYO,r4rk1/p2B2pp/8/2P5/Q2Ppp1n/4P1q1/1P2KN2/R1B5 w - - 0 24,a4b3 g8h8 f2e4 g3f3,2122,80,81,210,advantage master masterVsMaster middlegame short,https://lichess.org/gSrKFNBn#47,
TNHhK,r1b2rk1/q2n1ppp/p7/1pbNP3/1P3P2/5R2/P1P1B1PP/R2Q3K b - - 0 17,c5d4 d5e7 g8h8 e7c6 a7c7 c6d4,2187,77,93,3807,advantage long master masterVsMaster middlegame,https://lichess.org/r82GT6wO/black#34,French_Defense French_Defense_Steinitz_Variation
TOrAo,8/5p2/4p1p1/3kP3/3b1PP1/3K4/3B4/8 w - - 6 57,d2e3 d4e3 d3e3 g6g5,2171,75,84,405,bishopEndgame crushing endgame master masterVsMaster short,https://lichess.org/bBwr7K3m#113,
TT1sF,2r5/pk6/1np5/4p3/4p3/b3PqRP/P1Q2P1P/1R3K2 b - - 0 33,f3h1 f1e2 h1h2 c2e4,2161,99,75,27,crushing master masterVsMaster middlegame short,https://lichess.org/fQToZmuc/black#66,
TVTEh,8/6p1/2k1pp2/1p1pPn1p/2pP1P1P/P1P3P1/4K3/5N2 w - - 3 36,e2f3 f6e5 f4e5 c6b6,2116,105,-64,23,crushing defensiveMove endgame knightEndgame master masterVsMaster short superGM,https://lichess.org/x50spHXw#71,
TX5EX,r1b2r1k/1p4pp/p3pp2/2Nn3P/3P1q2/Q7/5PP1/1R2R1K1 b - - 3 24,f4g5 c5e4 f8g8 e4g5,2137,77,85,56,advantage master masterVsMaster middlegame short,https://lichess.org/Avr4grFJ/black#48,
TXhn6,5R2/4p2P/4k1K1/4p3/3p4/6P1/7r/8 b - - 0 59,d4d3 h7h8q h2h8 f8h8 e5e4 h8d8,2156,76,91,1988,advancedPawn crushing endgame long master masterVsMaster promotion,https://lichess.org/395P8WgF/black#118,
TYEKJ,1r1qb2r/n1k1bp2/4p3/3pP1NN/p1pP1PQ1/PnP1B3/R1B3K1/7R b - - 0 29,a7b5 h5g7 e8d7 g5f7,2140,77,90,1203,advantage master masterVsMaster middlegame short,https://lichess.org/5G8yX2Z4/black#58,
TYmlv,r3qrk1/4R1b1/pppR2pp/4ppQ1/P2n4/1PN1N1P1/1BP2PK1/8 w - - 0 29,d6d7 e8d7 e7d7 h6g5,2106,76,84,114,crushing master masterVsMaster middlegame short,https://lichess.org/AGjhcuhH#57,
TaH3J,4R3/pb3k1p/1p4p1/8/7q/2P5/P3Q1P1/3r1NK1 b - - 4 32,h4f6 e8b8 f6f1 e2f1 d1f1 g1f1,2121,84,81,29,advantage endgame long master masterVsMaster,https://lichess.org/c1MdtPnk/black#64,
Tbn77,r1b1k2r/2p1bNpp/p1q2n2/np6/3Q4/1B6/PPP2PPP/RNB1R1K1 b kq - 0 13,a5b3 d4d8 e8f7 e1e7,2162,75,93,4554,crushing master masterVsMaster opening pin short,https://lichess.org/osp0Xwm2/black#26,Ruy_Lopez Ruy_Lopez_Morphy_Defense
TcBjM,1r3r2/6k1/6pp/2pP2p1/1p3q2/6N1/2P2PP1/2Q1RBK1 w - - 0 33,c1d1 f4f2 g1h2 f8f4 d1a1 g7g8,2128,78,91,922,crushing defensiveMove fork long master masterVsMaster middlegame quietMove,https://lichess.org/2gEyKORq#65,
TcX24,3b1r2/7k/2R3pP/4pr2/4Q1R1/2PPB3/2P2PK1/4q3 w - - 5 33,c6g6 f5f2 e3f2 f8f2 g2h3 e1f1 e4g2 f2g2,2100,77,90,847,advantage master masterVsMaster middlegame veryLong,https://lichess.org/VVgG9Kaw#65,
TdD2W,1r2nbk1/p2Q1p1p/4p1pP/2p1P1B1/2PpNP2/P2P2PK/7N/7q b - - 0 39,h1b1 g5d8 b8d8 d7d8,2195,150,68,32,crushing master masterVsMaster middlegame quietMove short,https://lichess.org/cu4FWIES/black#78,
TdneQ,8/8/1p3kp1/pPp4p/P1PpBP1P/3P4/5K2/3b4 w - - 4 37,f2g3 d1a4 g3f2 a4d1,2189,82,91,678,bishopEndgame crushing defensiveMove endgame master masterVsMaster short,https://lichess.org/ygUd3GbX#73,
Tf8Is,5b2/8/1N4P1/8/pk6/3K4/8/8 w - - 0 51,b6d5 b4b3 d5f4 a4a3 f4e2 b3b2,2111,75,94,1676,crushing defensiveMove endgame long master masterVsMaster,https://lichess.org/keASubiQ#101,
Ti3Zr,3q3r/4kppp/p3b3/4p2Q/4BP2/4N3/P2rnP1P/R4R1K b - - 3 21,e2f4 h5e5 f4g6 e3f5,2174,75,69,86,master masterVsMaster middlegame,https://lichess.org/j7xhXSHd/black#42,
Tign6,r2q3k/7p/2pn1pp1/pp1b4/3P4/1PP1R2P/P4QP1/4R1K1 b - - 4 26,a8a7 e3e7 a7e7 f2f6,2127,75,94,2432,advantage interference kingsideAttack master masterVsMaster middlegame sacrifice short,https://lichess.org/NovngLkL/black#52,
TjKxa,8/8/8/5rpR/7P/6k1/8/5K2 w - - 1 52,f1e2 f5f2 e2e1 g5g4,2160,80,82,37,advantage defensiveMove endgame master masterVsMaster rookEndgame short,https://lichess.org/hjBoQJ4n#103,
TllMR,r3kb1r/1p1q1pp1/nnp4p/p2pPb2/P2P3B/2NB1N2/1PP4P/R2Q1RK1 b kq - 3 15,a6b4 e5e6 f5e6 f3e5,2170,77,75,92,advantage master masterVsMaster middlegame short,https://lichess.org/CV5oob3u/black#30,Alekhine_Defense Alekhine_Defense_Samisch_Attack
TltBK,6k1/pqr2p1p/1pRr2N1/2b5/4Q3/P5P1/4PP1P/2R3K1 b - - 0 29,d6g6 e4e8 g8g7 e8e5 g7f8 c6c7 b7c7 e5c7,2114,77,84,222,crushing master masterVsMaster middlegame veryLong,https://lichess.org/TwXPIrJ1/black#58,
Tn6jB,r5rk/2Q2Rp1/p4Npp/1p2p3/2n3Pq/2P4P/P1P2PK1/4R3 b - - 9 28,g8c8 c7e7 h4f6 f7f6,2156,81,79,52,crushing master masterVsMaster middlegame short,https://lichess.org/hmNwdXS9/black#56,
Tqbko,8/2r5/P3P3/1B4k1/K7/1P6/5p2/8 w - - 5 45,a4a5 c7c5 e6e7 c5b5 a5b5 f2f1q,2138,75,71,163,advancedPawn attraction crushing endgame long master masterVsMaster promotion,https://lichess.org/qQpesHRi#89,
Tqtf2,8/5k2/1p2q3/p2p1p2/P2Q2p1/1PP3P1/5PK1/8 w - - 0 38,b3b4 e6e4 d4e4 d5e4 b4a5 b6a5,2165,79,98,440,crushing endgame long master masterVsMaster queenEndgame,https://lichess.org/IS6pipny#75,
TrnBv,2k3rr/ppp5/3qb3/2Nnp1B1/P2n3N/3P2P1/1PP2PB1/R3Q1K1 w - - 3 19,c5e6 d6e6 e1e4 g8g5 e4d5 e6d5,2143,76,73,97,advantage capturingDefender long master masterVsMaster middlegame,https://lichess.org/dmCyatSA#37,Zukertort_Opening Zukertort_Opening_Black_Mustang_Defense
TsawB,3r4/pp1r2k1/6pQ/8/4q3/3p4/PPP5/1K4RR b - - 1 30,g7f6 g1g6 e4g6 h1f1,2181,77,92,5684,crushing endgame master masterVsMaster sacrifice short,https://lichess.org/h2alLQ8w/black#60,
Tt4S4,3R4/8/2p1k2P/5p2/3Bn1p1/4P3/2r3PK/8 b - - 0 40,c2c1 d8e8 e6f7 e8e4 g4g3 h2g3 f5e4 h6h7,2161,76,86,64,advancedPawn crushing endgame master masterVsMaster veryLong,https://lichess.org/XQVQfcHi/black#80,
TtaHh,r5k1/pp3rbp/4p3/3qBp1R/3P4/2P3Q1/6PP/5RK1 b - - 3 23,g8h8 g3g6 g7e5 g6f7,2128,77,91,3358,crushing master masterVsMaster middlegame pin short,https://lichess.org/Mo5y320c/black#46,
TtiDg,1r2nk2/r4pbQ/1q2p1pB/1b1p4/6P1/1PN2PN1/P7/1K1R3R b - - 0 33,g7h6 h7h6 f8e7 d1d5,2198,123,74,24,crushing master masterVsMaster middlegame short,https://lichess.org/98ejgEqH/black#66,
Tu0xo,6k1/p6p/5rp1/2PQp3/1P3p1P/P1N3Pq/5P2/6K1 b - - 1 39,f6f7 c3e4 f4g3 d5f7 g8f7 e4g5 f7e7 g5h3,2167,71,93,11357,attraction crushing endgame fork master masterVsMaster quietMove sacrifice veryLong,https://lichess.org/uz6BsfWb/black#78,
TuAo1,4R1N1/p2b1pkp/6p1/2q5/8/P1N5/1P5P/K1R5 w - - 14 36,e8d8 c5g5 d8d7 g5c1,2143,79,95,9808,advantage endgame fork master masterVsMaster short,https://lichess.org/gQJsPiW9#71,
Tv0ng,1q2r1k1/p6p/1p2pbpB/3rnpNP/5Q2/P3R3/1P3PP1/4R1K1 b - - 0 26,e5g4 e3e6 e8e6 f4b8 d5d8 b8d8,2103,75,96,2031,crushing deflection kingsideAttack long master masterVsMaster middlegame,https://lichess.org/SIHmRIWV/black#52,
TvSKd,r2qkb1r/pp3ppp/1n2p3/2P1nb2/8/P1N1B3/1P2B1PP/2RQK1NR b Kkq - 0 14,b6c4 d1a4 d8d7 e2c4 d7a4 c3a4,2130,81,92,8176,advantage long master masterVsMaster opening,https://lichess.org/4PhbWbwx/black#28,Alekhine_Defense Alekhine_Defense_Four_Pawns_Attack
Tvhzi,8/1p6/p3p3/3k2P1/8/2P1K1Pp/PP6/8 w - - 0 36,e3f2 e6e5 g5g6 d5e6,2101,76,95,619,crushing defensiveMove endgame master masterVsMaster pawnEndgame quietMove short,https://lichess.org/mhqzXEMo#71,
TxoWk,2q1Q1r1/7k/2pQR2p/2Bp1p2/pP1P4/P7/5Pr1/6K1 w - - 0 36,g1f1 g2g1 f1e2 g8e8,2175,88,90,1437,crushing master masterVsMaster middlegame short,https://lichess.org/PdXIIyU5#71,
TyXMq,r5k1/P2r1p2/5n1R/4q1p1/3Nn3/2P1P1P1/1P2QPP1/R3K3 w Q - 1 25,e2a6 d7a7 a6a7 a8a7,2199,78,89,382,crushing master masterVsMaster middlegame short,https://lichess.org/LZusHj5H#49,
U0C7x,5kr1/5p2/2n1pNp1/3pP2P/2pP4/qpP4R/rP3PP1/1Q1RK3 b - - 6 28,a2b2 b1c1 b2a2 c1h6 f8e7 f6g8,2131,79,86,48,crushing long master masterVsMaster middlegame,https://lichess.org/wsTQSaf5/black#56,
U113t,r5k1/3P1pbp/rp2p1p1/4P3/8/1n2BN2/p1R2PPP/R5K1 b - - 0 29,a8d8 c2c8 a6a8 c8a8 d8a8 a1a2,2198,92,81,33,advantage long master masterVsMaster middlegame pin,https://lichess.org/BHLTM03m/black#58,
U1K1x,5rk1/1p1nb1p1/7p/p7/P1q5/Q3BB2/6PP/3R2K1 w - - 0 29,d1d7 f8f3 a3d3 c4d3 d7d3 f3e3 d3e3 e7c5,2184,75,93,2991,crushing master masterVsMaster middlegame pin veryLong,https://lichess.org/Xv7W5tVX#57,
U1cmz,r2k1b1r/2q1pppp/p3b3/3nN3/B1n5/2P5/P2PQPPP/1RB1K2R w K - 2 16,e5c4 d5f4 e2e4 e6d5,2130,76,93,654,advantage clearance master masterVsMaster opening short,https://lichess.org/BsHoo7dk#31,Sicilian_Defense Sicilian_Defense_Moscow_Variation
U1zvo,2r2rk1/5ppp/p3p3/qp1nN3/3R2P1/1P1Q4/1PP2P1P/1K1R4 w - - 1 20,c2c3 d5c3 b2c3 c8c3 e5c6 c3c6,2152,79,89,1263,advantage long master masterVsMaster middlegame queensideAttack,https://lichess.org/5UCF5NkS#39,
U2jKE,8/8/2p5/2P5/p1k2K2/P7/1P6/8 w - - 5 42,f4e5 c4c5 e5e6 c5c4 e6d6 c4b3 d6c5 b3b2 c5b4 c6c5,2150,76,89,107,crushing endgame master masterVsMaster pawnEndgame veryLong,https://lichess.org/IL7wuwBb#83,
U37DW,4q1k1/2n2pbp/1pN1p1p1/2pP3P/2P1N3/1P6/5P1P/4Q1K1 w - - 2 29,h5h6 e6d5 c4d5 c7d5,2110,76,90,970,advantage endgame master masterVsMaster short,https://lichess.org/SywJrSYI#57,
U3ix7,r1kq2n1/pp4p1/4N3/1Bbpn3/6pr/8/PPP2P2/R1BQK1R1 b Q - 0 17,d8f6 e6c5 e5f3 e1f1,2110,76,81,117,advantage defensiveMove hangingPiece master masterVsMaster middlegame short,https://lichess.org/WEtcPl6Y/black#34,Caro-Kann_Defense Caro-Kann_Defense_Advance_Variation
U4BXw,2r2qk1/r2n1p2/4p3/2p1P2P/ppbn1QN1/6P1/PP3PB1/3RR1K1 b - - 4 26,d4e2 e1e2 c4e2 d1d7 a7d7 g4f6,2183,76,84,111,advantage long master masterVsMaster middlegame sacrifice,https://lichess.org/FMFD6xzZ/black#52,
U75LL,1kr5/1p2b3/pB1p2p1/N2Pp2n/1PP1R2P/PK3r2/2R5/8 w - - 5 39,c2c3 f3c3 b3c3 h5f6,2114,79,71,106,crushing master masterVsMaster middlegame short,https://lichess.org/57Qduv3Y#77,
U9SR9,3r3r/1pb2p2/2p2k1N/p1n1p1p1/4Pn2/1B3PB1/PPP3P1/2KR3R b - - 1 22,h8h6 h1h6 f6g7 d1d8,2161,77,90,1093,advantage hangingPiece master masterVsMaster middlegame short,https://lichess.org/M7Bakjux/black#44,
UAHXw,8/5p2/3k3p/1pN5/1PbpPP2/7P/5K2/8 b - - 0 46,c4e6 c5e6 f7e6 f2e2,2188,75,94,3269,crushing defensiveMove endgame master masterVsMaster short,https://lichess.org/skRfdHHG/black#92,
UBtDt,6k1/p5p1/3P2p1/7p/1pN2P1P/1PnR1Q2/6PK/q3r3 w - - 3 48,d6d7 e1h1 h2g3 a1e1 f3f2 c3e4 g3f3 e1f2,2112,76,93,10828,crushing endgame fork master masterVsMaster pin veryLong,https://lichess.org/TTlI0g2t#95,
UE1uS,2rr4/5pk1/p4qpp/4n3/4Q3/1P6/P1PN1PPP/1K1R3R w - - 1 26,d2f3 e5c4 f3d4 c4a3,2140,80,84,36,advantage master masterVsMaster middlegame quietMove short,https://lichess.org/UePyAC1z#51,
UMKPZ,4rn1k/pQ3bpp/5N2/5P2/8/8/PPB1q3/1K1R4 b - - 0 31,f7a2 b1a2 g7f6 d1g1,2124,78,77,54,advantage defensiveMove master masterVsMaster middlegame short,https://lichess.org/0soGFxn5/black#62,
UNOzH,2r1k3/p3bp1p/4q3/4PN2/6QP/2p5/6P1/2R4K b - - 2 34,c8c4 f5g7 e8d7 g4d1 d7c8 g7e6,2127,84,90,722,crushing endgame fork long master masterVsMaster,https://lichess.org/ormS68AQ/black#68,
UOICo,3n4/pbrP2kp/1p2p1p1/2q1bpN1/8/P3QPP1/1P5P/3RR1K1 b - - 3 29,e5f6 e3c5 b6c5 g5e6 d8e6 e1e6,2152,76,95,1052,advantage fork long master masterVsMaster middlegame,https://lichess.org/jXJEJdHQ/black#58,
UOw1a,k6r/pp1R1p2/1q6/2b1Bpp1/2B1n3/2P2Q2/PP3PP1/1K6 b - - 1 26,h8h1 b1c2 c5a3 c4b3,2106,76,75,66,advantage defensiveMove master masterVsMaster middlegame short,https://lichess.org/9Th9OotY/black#52,
UOzok,5k2/5rp1/2R4p/4p3/8/5PKP/6P1/8 b - - 7 54,f7f6 c6f6 g7f6 g3g4 f8e7 g4f5,2168,76,91,984,crushing endgame long master masterVsMaster rookEndgame,https://lichess.org/9vgI09W6/black#108,
URe2y,8/8/7p/5pp1/R4Pk1/4P3/4r3/6K1 w - - 8 46,f4g5 g4g3 g1f1 e2f2 f1e1 h6g5,2163,79,91,1079,crushing defensiveMove endgame exposedKing long master masterVsMaster rookEndgame,https://lichess.org/EUEWgGC8#91,
US4EN,rBr5/1RP5/2Pn2k1/4p1p1/4PpP1/5P2/6B1/6K1 w - - 0 40,g2f1 d6b7 c6b7 a8b8 c7b8q c8b8,2168,76,96,655,crushing endgame long master masterVsMaster,https://lichess.org/DIFvPev9#79,
UWCVG,3r2k1/1pq2pp1/2b1Nn1p/p1br4/P7/1PP1B2P/2BRQPP1/3R2K1 b - - 0 24,d5d2 e6c7 d2e2 d1d8,2175,80,70,62,capturingDefender crushing master masterVsMaster middlegame short,https://lichess.org/er2PD22m/black#48,
UYeBv,8/p7/4p1k1/2p2p1p/2P2Pp1/P5P1/1P1K2P1/8 b - - 0 40,g6f6 b2b4 e6e5 f4e5,2138,74,74,109,crushing endgame master masterVsMaster pawnEndgame short,https://lichess.org/urzk7obV/black#80,
UYrYC,4qrk1/5ppp/p2pb3/2p1n2Q/4P3/1B6/Pr3PPP/R1B2RK1 b - - 3 19,g7g6 h5d1 b2b3 a2b3,2175,75,91,4302,advantage master masterVsMaster middlegame short trappedPiece,https://lichess.org/ho11OyX6/black#38,Benko_Gambit_Accepted Benko_Gambit_Accepted_Pawn_Return_Variation
UZHys,3k4/2rn1R1p/3KB1p1/8/8/p7/7P/8 b - - 5 47,c7a7 e6d7 a7a6 d7c6 a6c6 d6c6,2144,97,74,18,crushing endgame long master masterVsMaster,https://lichess.org/2YLhaiSh/black#94,
UcLkr,5b2/8/4p3/kpp1Pp1p/2P2B1P/1P1K2P1/8/8 b - - 2 43,a5b4 f4d2 b4b3 c4b5,2112,76,95,6481,bishopEndgame crushing deflection endgame master masterVsMaster short,https://lichess.org/Gkt4hvSk/black#86,
UcTaa,1Q6/r3p1k1/p2p2p1/1p1P3p/7P/4RP2/2P3PK/q7 b - - 2 32,a1d4 e3e4 d4c5 e4f4,2121,76,89,262,crushing defensiveMove endgame master masterVsMaster short,https://lichess.org/7SBPnnyu/black#64,
Ud0Ey,3r2k1/p4pp1/bp1qpn1B/3pQ3/n1r3PP/1NP1PP2/P1P3B1/R2R2K1 w - - 3 23,e5g5 f6e8 h6g7 e8g7,2177,77,92,1188,advantage master masterVsMaster middlegame quietMove short,https://lichess.org/jDFGgB1z#45,
UdcIq,r2q1rk1/5pbp/1p1N2p1/p1pPp3/P3PP2/3b3P/1P4P1/1RBQR1K1 w - - 0 18,d6f7 d8h4 f7g5 d3b1,2177,77,88,73,advantage master masterVsMaster middlegame short,https://lichess.org/MsZT86T0#35,Kings_Indian_Defense Kings_Indian_Defense_Normal_Variation
UetUT,8/5pkp/2N5/3P1pQ1/6PP/5B2/5P1K/b4qr1 b - - 1 45,g7f8 g5h6 f8e8 h6e3,2175,137,-53,16,crushing endgame master masterVsMaster short,https://lichess.org/ZmPpxdOf/black#90,
UgE0R,8/1bq4k/p5pp/bp1p4/3Nn3/1P1QP1P1/1B3PB1/6K1 b - - 1 33,a5b4 d4e6 c7f7 g2e4,2148,79,62,57,crushing master masterVsMaster middlegame short,https://lichess.org/iQiumVXx/black#66,
UhhSm,b5k1/4p3/pp4p1/2pP1r1p/P1P1QB1q/2P4P/6P1/5RK1 b - - 1 33,h4f6 g2g4 e7e5 g4f5,2116,75,94,8856,crushing endgame master masterVsMaster short,https://lichess.org/eJ1IBqbg/black#66,
UhkZc,6r1/3k1p1p/pRb2r2/3p4/2P5/7P/P4PB1/5R1K w - - 1 29,c4d5 c6d5 g2d5 f6b6,2147,75,94,5638,advantage discoveredAttack endgame master masterVsMaster short,https://lichess.org/vRyweLXa#57,
UhvCv,6r1/p2k1p1p/1nrNp3/1Q6/2Pq4/5p2/PP3RPP/R1B3K1 w - - 3 24,g2g3 d4d1 f2f1 d1e2 f1f3 e2f3,2157,117,83,23,advantage fork long master masterVsMaster middlegame,https://lichess.org/jzBMSzHz#47,
UhxW9,r3k2r/pp1qppb1/6p1/3pP2p/4n1bP/4BB2/PPPQN1P1/1K1R3R w kq - 1 17,f3e4 d5e4 d2d7 g4d7,2137,76,78,77,advantage master masterVsMaster middlegame short,https://lichess.org/FD1vrAR2#33,Modern_Defense Modern_Defense_Other_variations
UjKb4,6R1/8/8/3kp3/3p4/5PP1/r3K3/8 w - - 1 59,e2e1 d4d3 g8d8 d5c4 g3g4 c4c3,2118,76,74,58,crushing defensiveMove endgame long master masterVsMaster rookEndgame,https://lichess.org/4n4noJVN#117,
UjXWY,4r1k1/1q3ppp/p4n2/2p2b2/2Bp4/N1P3QP/PP3PP1/1R4K1 w - - 1 23,c4d3 f6h5 g3g5 f5d3,2179,79,89,1546,crushing master masterVsMaster middlegame short,https://lichess.org/esoL34bd#45,
UjnAj,8/2p2ppk/1p3b1p/1P5P/2PP4/5QP1/rB2RPK1/1q6 w - - 1 35,f3b3 f6d4 b3f3 a2b2 e2b2 d4b2,2180,77,78,81,advantage endgame long master masterVsMaster,https://lichess.org/aBWYSOTR#69,
UlWo6,8/1rpn1kp1/R4p1p/2B5/1P6/5PK1/6PP/8 w - - 9 37,a6c6 d7b8 c6c7 b7c7,2129,75,95,6876,crushing endgame master masterVsMaster short trappedPiece,https://lichess.org/IeBTfW9T#73,
UmYg7,1r5k/pb1r2pp/1pRpp3/1B3p2/3Pp3/4P1P1/PP3PP1/3R2K1 w - - 4 30,c6b6 d7d8 b6b7 b8b7,2108,75,92,7053,advantage endgame master masterVsMaster quietMove short trappedPiece,https://lichess.org/v8l5sCj6#59,
Umeue,1rk4r/5p2/4PNp1/ppq2bP1/2nR4/P5Q1/1PP5/2KR4 b - - 0 28,c4e3 d4d8 h8d8 d1d8 c8d8 g3b8 d8e7 b8e8,2193,88,84,43,attraction crushing exposedKing master masterVsMaster middlegame queensideAttack veryLong,https://lichess.org/luNnVNH3/black#56,
UmvRn,8/2k2pp1/4pn1p/8/Nq1P3P/p4PP1/2BR4/2K1R3 w - - 0 38,c2d1 a3a2 d2a2 b4e1,2123,77,91,1271,advancedPawn advantage endgame master masterVsMaster short,https://lichess.org/vpXrPuTx#75,
UoA1Q,r1r3k1/1q2bppp/4p3/p2p4/1p1P1B2/1PnQ1NP1/P1R1PPKP/2R5 b - - 5 21,c3a2 c2a2 c8c1 f4c1,2104,77,90,2117,advantage hangingPiece master masterVsMaster middlegame short,https://lichess.org/fOmgJ3lC/black#42,
UpuoH,4rb1k/3q1pp1/p1b1p2p/1pPrB3/1P3PQ1/P2B4/2P3PP/3RR1K1 w - - 5 25,d3e4 f7f5 d1d5 c6d5,2109,77,82,208,advantage fork master masterVsMaster middlegame short,https://lichess.org/pq42BZ9O#49,
Uqp5Y,5R2/ppp1k2p/5q1B/3b1pp1/3n4/3P2P1/PPPQ1PpP/6K1 w - - 3 22,d2b4 e7d7 f8f7 d5f7,2178,77,91,254,crushing defensiveMove endgame master masterVsMaster short,https://lichess.org/gLP8jZg6#43,
UrkqV,1r6/5p1p/6p1/1Pk5/8/4K2P/1R3PP1/8 b - - 2 39,b8b5 b2b5 c5b5 e3d4 b5c6 d4e5,2117,92,77,25,endgame master masterVsMaster,https://lichess.org/wQle07Kv/black#78,
UuB0B,2r3k1/6bp/pq3np1/2pp2N1/P4B2/7P/P1Q2PP1/4R1K1 b - - 2 23,c8e8 e1e8 f6e8 c2e2 e8f6 e2e7,2131,76,91,1360,advantage long master masterVsMaster middlegame,https://lichess.org/igSekreY/black#46,
UucxW,Nnb1r1k1/p4p2/3p1qp1/2p1b2p/6P1/5B2/PPP3KP/R1B1Q2R w - - 4 22,e1f2 e5d4 h1e1 d4f2,2192,76,85,88,advantage master masterVsMaster middlegame short,https://lichess.org/tDeHRGLP#43,
UusX7,B1q1r1k1/5p1p/1Q1p1bp1/2B1p3/2P5/6PP/P3NP1K/1b3R2 b - - 0 26,c8a8 f1b1 d6c5 b6f6,2149,75,91,1317,master masterVsMaster middlegame,https://lichess.org/FHaFdC8z/black#52,
UwaC0,4rrk1/1p2bq1p/p1p1p2P/3n1p2/3B3R/PB1P1Q2/1P3P2/4R2K b - - 3 30,e7f6 e1g1 g8h8 g1g7,2170,73,93,10163,advantage master masterVsMaster middlegame short superGM,https://lichess.org/Pxs1YBYw/black#60,
UxFki,2R5/6P1/4K3/8/8/7p/1kp3rP/8 w - - 1 63,e6f7 c2c1q c8c1 b2c1,2135,76,87,170,advancedPawn crushing endgame master masterVsMaster promotion short,https://lichess.org/mgAlQgwN#125,
UztJl,5k1r/4np1p/p3p1p1/1p6/3NQ3/8/Pq3PPP/3R2K1 b - - 5 26,e7f5 e4e5 f5d4 e5h8,2177,77,92,574,crushing endgame master masterVsMaster short,https://lichess.org/HCRE01J0/black#52,
UzvyV,8/4k3/8/1n1K2P1/3P1P2/8/8/8 b - - 0 49,b5c3 d5e5 c3b5 f4f5,2121,75,94,2072,crushing defensiveMove endgame knightEndgame master masterVsMaster short,https://lichess.org/1I8z1Cya/black#98,
V08P6,r2qkb1r/1pp3pp/p1n2p2/4pb2/1n1P4/1P2PN2/PB2BPPP/RN1Q1RK1 b kq - 0 11,b4c2 f3h4 c2a1 h4f5,2137,77,92,1362,advantage master masterVsMaster opening sacrifice short,https://lichess.org/l17xn3PA/black#22,Nimzo-Larsen_Attack Nimzo-Larsen_Attack_Classical_Variation
V6h3u,4r1k1/1R3pp1/7p/2n4P/p1p5/1PP3B1/P4PP1/6K1 w - - 1 40,b7b4 c4b3 a2b3 a4a3,2160,74,93,10358,advantage endgame master masterVsMaster short,https://lichess.org/m4kscQE5#79,
V7z3t,3r1q1k/p5bp/4Q1p1/4B3/8/2r3P1/PP1p1P1P/3R2K1 w - - 0 31,e5c3 g7c3 b2c3 d8e8,2163,83,91,3993,advantage endgame master masterVsMaster short,https://lichess.org/ANPXri7f#61,
V9ea6,2R5/7k/5K2/8/8/5P1p/8/6r1 w - - 2 69,c8c4 g1g6 f6f5 h3h2,2121,76,94,11094,advancedPawn crushing endgame master masterVsMaster rookEndgame short,https://lichess.org/QsXnJyXu#137,
VAdeT,Bnb1kb1r/p1q2ppp/1np1p3/8/Q1P5/6P1/PP2PP1P/RNB1K2R w KQk - 1 11,c1f4 e6e5 f4e5 c7e5,2103,76,89,381,crushing master masterVsMaster opening short,https://lichess.org/ifkBQrCF#21,English_Opening English_Opening_Anglo-Indian_Defense
VB4wu,8/pp1bpp1P/3p3R/3Pq1k1/4P1p1/5r2/PP6/K6Q b - - 1 31,f3h3 h1c1 e5f4 c1f4,2100,76,86,608,advantage endgame master masterVsMaster short,https://lichess.org/mGj4O3H8/black#62,
VCalC,4r3/p5pk/4r1qp/2PQ4/3B4/6Pb/PP3P1P/R3R1K1 w - - 2 26,d4e5 e6e5 e1e5 e8e5,2155,83,87,90,advantage master masterVsMaster middlegame short,https://lichess.org/Uvg2i7nn#51,
VCvO4,2R5/p3r3/Pp4P1/1P6/3b3P/3p1K2/3k1P2/8 b - - 0 52,d2e1 c8d8 d4g7 d8d3,2112,107,60,21,advantage endgame master masterVsMaster short skewer,https://lichess.org/SdYk05zu/black#104,
