PuzzleId,FEN,Moves,Rating,RatingDeviation,Popularity,NbPlays,Themes,GameUrl,OpeningTags
PDmWm,2r4r/R1B1k1pp/4bp2/2p5/4P3/2P5/6PP/1R4K1 b - - 0 28,c8a8 c7d8 e7e8 a7a8,2035,77,93,695,advantage doubleCheck endgame interference master short,https://lichess.org/JUqYpXTJ/black#56,
PEIy4,r1bk1b1r/ppNp3p/2n2p2/8/8/5N2/PqP1PPPP/R2QKB1R w KQ - 1 10,c7a8 f8b4 f3d2 b4d2 e1d2 b2d4 d2c1 d4a1,2005,80,89,482,advantage attraction interference opening veryLong,https://lichess.org/NJ2b2WKx#19,Englund_Gambit_Complex Englund_Gambit_Complex_Englund_Gambit
PHw6K,4rr1k/2p4p/p5q1/np1p2pN/3P2P1/P1P5/1P1QR2P/2K1R3 w - - 1 30,e2e8 a5b3 c1d1 g6b1 d1e2 f8e8 e2f2 e8f8 f2g2 b3d2 e1b1 d2b1,2009,94,86,22,crushing fork interference middlegame veryLong,https://lichess.org/KolDM4Lu#59,
PJm0N,r2q1rk1/pp1nbp2/2p1pn1p/7b/3PN2N/3B3P/PPP3P1/R3QRK1 b - - 1 15,f6e4 e1e4 f7f5 e4e6 h5f7 e6f5,2034,77,93,3381,advantage interference kingsideAttack long opening,https://lichess.org/ktYSi2as/black#30,Blackmar-Diemer_Gambit_Accepted Blackmar-Diemer_Gambit_Accepted_Ziegler_Defense
PLujC,4rk2/pp3p2/4q1b1/2p1n3/8/8/3N1KQ1/1B1R2R1 w - - 0 31,b1g6 e5d3 f2g3 e6g6,2052,74,74,166,crushing interference intermezzo middlegame short,https://lichess.org/r9cJUFIs#61,
PN9vm,r6r/1p3kp1/pq1p4/4nbB1/8/1B4Q1/PP3PPP/R5K1 b - - 11 24,f7f8 g5e7 f8e7 g3g7 e7d8 g7h8,2069,76,89,821,attraction crushing deflection discoveredAttack interference long middlegame sacrifice,https://lichess.org/Ril2gDR7/black#48,
PRcy3,r4rk1/2b2pp1/p1pq3p/2Nn4/3N4/2P4P/PP3P2/R1BQR1K1 w - - 1 20,c5e4 d6h2 g1f1 h2h1 f1e2 h1e4 e2f1 e4h1,2062,75,93,2190,crushing interference kingsideAttack middlegame veryLong,https://lichess.org/NuJFZIle#39,
PckDW,r1b1k2r/pp2bppp/2n1p3/4N3/3q4/2NB4/PP3KPP/R1BQR3 w kq - 0 13,f2f1 e7c5 c1e3 d4e5,2047,82,91,949,advantage interference opening quietMove short,https://lichess.org/dSa3U22f#25,Alekhine_Defense Alekhine_Defense_Mokele_Mbembe
PfjN2,r1b2k2/pp1p3p/4p2P/2q1np2/2PN1Q2/2nBK3/2P2PP1/R6R w - - 0 23,e3d2 c3e4 d3e4 c5d4,2001,82,92,1468,advantage interference middlegame short,https://lichess.org/Q6YCmogu#45,
PnXtb,2r5/pp6/8/1k1r4/4Q3/1Pq1P1P1/PR3P2/K2b4 b - - 2 34,d5d2 e4b7 b5c5 b7c8 c5b6 c8c3,2082,76,80,51,crushing endgame interference long skewer,https://lichess.org/rIarKf3E/black#68,
Pr3qG,1r1r2k1/1bp1qp1p/1p4p1/8/3bP3/4BPP1/4Q1BP/1RR3K1 b - - 1 20,f7f5 e2c4 b7d5 c4d4,2012,76,94,4780,crushing interference middlegame short,https://lichess.org/h0Qu7zVL/black#40,
PxF3b,r5k1/pp1q2p1/3B4/3p2PQ/2nb4/8/PPP4P/5R1K b - - 0 23,c4d6 g5g6 d4f6 h5h7 g8f8 f1f6 f8e7 h7g7,2040,75,99,168,advantage deflection endgame interference veryLong,https://lichess.org/3lAHAcqi/black#46,
Py3qv,2r1qk2/3R1pbQ/6P1/p1p4p/4P2P/8/P1P5/1K1R4 w - - 3 34,g6f7 c8b8 b1c1 g7b2 c1d2 e8d7 d2e2 d7g4,2069,75,92,113,crushing endgame interference veryLong,https://lichess.org/J2U9PsPV#67,
PyiOL,r3k2r/p5pp/bbq2p2/4n2Q/2P5/B7/P4PPP/RN2R1K1 b kq - 2 20,g7g6 e1e5 f6e5 h5e5 e8d7 e5g7 d7c8 g7h8,2037,75,91,2111,advantage exposedKing fork interference middlegame veryLong,https://lichess.org/zbrowUKM/black#40,
Q4SUQ,6k1/p6p/6p1/6P1/3Bq3/2P5/Pn1KN3/3R3R w - - 0 29,d1b1 b2c4 d2c1 e4h1,2044,111,83,28,crushing endgame interference master short,https://lichess.org/ZtqC7gU3#57,
Q6K83,r2q3r/2p1kpbp/ppQ1p1p1/1P1nP3/P2P2PP/2P2P2/8/RNB1K1Nb b Q - 4 18,d8d7 c1a3 e7d8 c6a8,2052,74,95,9306,advantage interference middlegame short,https://lichess.org/ELKq2FH8/black#36,French_Defense French_Defense_Advance_Variation
QC4ys,3Q4/B5pk/6q1/5p1r/6p1/4PP1P/PP6/6RK w - - 3 33,f3g4 h5h3 h1g2 g6g4 g2f1 h3f3 f1e2 f3g3,2005,75,95,1432,crushing discoveredAttack endgame exposedKing interference intermezzo veryLong,https://lichess.org/UpFF8GOS#65,
QE3Hl,6k1/2q1pp1p/6p1/2n1P3/1pP2R2/1P3Q1P/5BPK/r7 b - - 1 31,c7e5 f2d4 e5b8 d4a1 c5e6 g2g3,2007,75,85,106,crushing defensiveMove endgame fork interference long master,https://lichess.org/YHeREvNK/black#62,
QEnCt,r4r2/2p1k1p1/2Q1pq1p/2b1p3/8/P1P5/1PP2PPP/3R1RK1 b - - 1 22,c5d6 d1d6 c7d6 c6b7 e7e8 b7a8,2038,75,94,3051,crushing interference long middlegame sacrifice,https://lichess.org/5TKvig0W/black#44,
QGmAf,r7/5r1k/7p/p7/4NpPq/3QbR1P/PP4K1/8 b - - 6 32,a8d8 e4g5 h7g8 d3d8 f7f8 d8d5,2011,79,91,2217,advantage doubleCheck interference long middlegame,https://lichess.org/YqZdkKA1/black#64,
QHFcS,2r3k1/pprn1pp1/1q2p3/3p2pP/3P4/2P5/PP1Q1P2/2KR2NR w - - 0 20,d2g5 c7c3 b2c3 c8c3 c1d2 b6d4,2009,76,83,265,advantage interference long middlegame queensideAttack sacrifice,https://lichess.org/kGLHbBaF#39,
QMk2G,1r4k1/3b1p2/2p2Q1p/2q3p1/4pP1N/6RP/6PK/8 b - - 3 38,g5g4 f4f5 c5f8 g3g4,2060,134,86,22,crushing endgame interference pin quietMove short,https://lichess.org/wOSly8OZ/black#76,
QNt0x,2r1nrk1/1p1qnppp/pB1p4/3NpPb1/2B1P1Q1/1P5P/1PP3P1/R4R1K b - - 8 18,h7h6 f5f6 d7g4 d5e7 g8h7 h3g4,2083,76,92,2580,crushing fork interference intermezzo long middlegame sacrifice,https://lichess.org/C9Q4VX9y/black#36,Sicilian_Defense Sicilian_Defense_Closed
QVjzk,2br4/6R1/7p/Pp3p2/2p2k2/2P1B3/5P1P/3rR1K1 b - - 3 42,f4f3 g7g3 f3e4 f2f3 e4e5 e3d4 e5d5 e1d1,2020,76,88,294,crushing doubleCheck endgame interference veryLong,https://lichess.org/kvLmy5sG/black#84,
QWPdx,r3k2r/pb5p/2pQp1p1/4Pp2/4pP2/2P1q3/PP3RPP/R5K1 b kq - 1 17,e3b6 d6e6 e8d8 e6f6 d8c7 f6g7 c7c8 g7h8,2004,81,80,55,advantage exposedKing fork interference middlegame veryLong,https://lichess.org/5EQ53F7c/black#34,Horwitz_Defense Horwitz_Defense_Other_variations
QXg1i,rn2kbnr/pQ3p1p/8/2p1p3/8/3PB1P1/PPP1qP2/R5K1 b kq - 0 16,g8f6 b7c8 e8e7 e3c5,2021,77,91,1331,interference mate mateIn2 middlegame short,https://lichess.org/607rBffD/black#32,Sicilian_Defense Sicilian_Defense_Other_variations
QYmJw,r2q1b1r/pp1bkBp1/2np1n1p/4p3/4P3/1QN2N2/PPP2PPP/R1B1K2R w KQ - 3 10,e1g1 c6a5 c3d5 e7f7,2037,75,83,158,advantage interference opening short,https://lichess.org/SQGBcojK#19,Sicilian_Defense Sicilian_Defense_Chekhover_Variation
QbjDW,8/3R3p/6pk/1p2p3/1P2q3/1Q4P1/5R1P/r1r2NK1 w - - 3 40,b3b2 c1f1 f2f1 a1f1 g1f1 e4h1 f1f2 h1h2,2062,81,91,308,attraction crushing interference middlegame sacrifice veryLong,https://lichess.org/hTvcWwXN#79,
QeXB1,r2r4/5pk1/p3p3/Pp5Q/5q2/2P2P2/1P6/R2R3K w - - 3 36,d1g1 g7f6 g1g4 f4f3,2014,75,91,414,crushing defensiveMove endgame interference master short,https://lichess.org/HFMCkuw4#71,
QeryM,3r1r1k/p1p1Q1pp/8/2p2p2/2n3q1/P1P5/6PP/2B1RRK1 b - - 5 26,h7h5 f1f4 g4g6 f4c4 f8e8 e7h4,2023,74,93,10203,advantage interference long master middlegame,https://lichess.org/jvoYmsRF/black#52,
Qf4nr,4rrk1/1q4bp/6n1/pP2p3/2PpN1p1/P5P1/1B2QP1P/R3K2R w KQ - 3 24,e2g4 f8f4 g3f4 b7e4,2053,93,82,29,advantage interference master middlegame sacrifice short,https://lichess.org/8IZdMUxg#47,
Qhn91,8/p3kp2/2Q4p/1p4p1/3P1K2/2Pq4/PP4P1/8 w - - 0 35,f4e5 d3g3 e5d5 g3g2 d5c5 g2c6,2099,75,93,435,crushing endgame interference long queenEndgame,https://lichess.org/vsea6Zpn#69,
QssMO,r5k1/ppp2r2/3p3p/3Pp3/1P2N1bb/R5N1/1P3P1K/6R1 b - - 5 25,g4f3 g3f5 g8h7 a3f3,2015,74,92,2638,advantage discoveredAttack interference middlegame short,https://lichess.org/jSC9unsT/black#50,
QuftA,r2q3r/2p1k2b/pp1p1b1Q/3Pp1B1/PPP3P1/5P2/7P/R4RK1 b - - 2 22,f6g5 h6g7 e7e8 g7h8 e8d7 h8h7,2090,76,96,3073,advantage fork interference long middlegame,https://lichess.org/o89wnxZc/black#44,
REjcZ,2kr4/2p5/p2q4/6p1/Pp1p3p/3Q2nP/2R3P1/2R3K1 b - - 1 38,d8d7 c2c6 d6e5 d3a6 c8d8 c6e6,2073,75,92,2440,advantage endgame interference long,https://lichess.org/XX4JnccV/black#76,
RHbnd,r1b2rk1/pp2ppbp/3p2p1/8/4N3/4BN2/qPPQ1PPP/2KR1B1R w - - 0 12,d2d5 g7b2 c1d2 a2d5,2004,78,88,73,crushing interference opening queensideAttack short,https://lichess.org/Jn932Twz#23,Modern_Defense Modern_Defense_Other_variations
RNDb4,r6k/1p1brppB/p1q5/3p4/5BP1/P2Q4/1PP2P1P/2K3R1 b - - 0 21,g7g6 d3h3 f7f6 h7g6,2027,77,86,167,advantage discoveredAttack interference middlegame quietMove short,https://lichess.org/B7v0Glid/black#42,
RShqw,5r2/1b3pk1/4pq2/3p2NQ/1npP4/r1pn2B1/5PP1/1BR1R1K1 b - - 1 31,f6g6 g3e5 f7f6 g5e6 g7f7 h5g6,2011,74,85,178,crushing deflection fork interference long master middlegame,https://lichess.org/3z7WarjP/black#62,
RTcTO,r2qrk2/pp3p1Q/2pb1n1p/4B1p1/3P4/5P2/PPB2P1P/R4RK1 b - - 0 19,d6e5 h7h6 f8e7 d4e5,2002,75,90,311,advantage interference intermezzo middlegame short,https://lichess.org/fYUBYX4F/black#38,
Rase5,r1b2rk1/p4pp1/2p4p/n1b1p3/3qB3/P7/1PPP1PPP/RNBQ1RK1 w - - 1 13,d1f3 f7f5 e4c6 e5e4 f3c3 a5c6,2075,80,87,1164,crushing interference intermezzo long opening,https://lichess.org/Z3U2w3Yl#25,Italian_Game Italian_Game_Two_Knights_Defense
RgkGp,5b1r/rkpq3p/1p1p1p1n/3P2p1/1Q1N4/8/PP3PPP/R1R3K1 b - - 1 20,a7a4 c1c7 b7c7 d4b5 c7b8 b4a4 f8e7 a1c1,2071,76,86,293,attraction crushing defensiveMove interference middlegame sacrifice veryLong,https://lichess.org/I5C9zXsM/black#40,
RkbVz,r3k2r/6p1/2Qp4/pp4p1/4PN1p/P1PP1P2/1PK5/7q b kq - 0 32,e8f7 c6d5 f7e8 d5a8,2070,78,80,69,crushing endgame interference short,https://lichess.org/FvhqznKO/black#64,
RlWc5,2r3k1/3p2p1/2b1p2p/1p6/2NPB1nP/2P3r1/8/RNB1R1K1 w - - 3 27,g1f1 c8f8 f1e2 c6e4,2053,76,89,293,crushing interference master middlegame short,https://lichess.org/2EJ0I719#53,
Ro462,7r/2q3kN/4p1p1/pp1pP1P1/3P2P1/7R/PP5Q/6K1 w - - 3 33,h7f6 c7c1 g1g2 c1b2,2099,78,88,666,crushing endgame interference master masterVsMaster short,https://lichess.org/c9AoqjHM#65,
RtclL,4r1k1/p4pp1/1q4bp/3Q4/5B2/2r2P2/P2R2PP/3R3K w - - 0 23,f4e5 c3c5 e5d4 c5d5 d4b6 d5d2 d1d2 a7b6,2075,77,95,10768,advantage interference middlegame veryLong,https://lichess.org/HAjU6sjv#45,
RttBv,2kr3r/ppp2ppp/2nb2n1/q4bQ1/8/2N1PN2/PP1B1PPP/R3KB1R b KQ - 12 12,h7h5 c3b5 d6b4 g5f5,2061,75,91,2165,advantage interference middlegame short,https://lichess.org/USugwNnM/black#24,Queens_Gambit_Declined Queens_Gambit_Declined_Albin_Countergambit
Rzq9O,r3k2r/pp3ppp/4p3/8/3PQB2/P1q4P/5PP1/2KR3R w kq - 0 19,e4c2 c3a1 c1d2 a1d4 d2e2 d4f4,2001,78,95,10161,advantage exposedKing fork interference long middlegame,https://lichess.org/yq9gqt6r#37,Indian_Defense Indian_Defense_Spielmann-Indian
S4S9s,r4rk1/pbp2ppp/1pn4q/4Pn2/2P3PP/Q3PN2/PP1N4/2KR1B1R b - - 0 16,f5e3 g4g5 h6g6 a3e3 c6b4 e3b3,2069,76,84,103,crushing interference intermezzo long middlegame,https://lichess.org/6rKnjGmH/black#32,Queens_Gambit_Declined Queens_Gambit_Declined_Albin_Countergambit
S4iRe,2r3k1/ppr4p/6pP/3Qp3/3p1p2/1P6/PKPR3R/4q3 b - - 5 35,g8h8 h2e2 e1h4 d5e5 h8g8 e5e6,2067,86,68,41,crushing endgame interference long,https://lichess.org/CrBjTZPv/black#70,
S6rYh,2r1k3/ppq1nr1p/4R1p1/8/1P1Q2P1/P6P/5P2/4R1K1 b - - 1 28,e8f8 e6e7 f7e7 d4h8 f8f7 h8h7,2005,79,90,704,advantage exposedKing interference long middlegame sacrifice,https://lichess.org/TEqY06cY/black#56,
S7XHY,3r2k1/Q4p2/B5p1/3p2qp/1P1N4/P3p3/5K2/5R2 w - - 0 42,f2e2 g5g2 e2e3 d8e8 e3d3 g2f1,2081,75,91,94,advantage endgame exposedKing interference long,https://lichess.org/0TCepkEg#83,
S8WI5,6r1/1r3pk1/Rp2p3/1n1pPp2/1N3Pq1/2P1Q1Pp/1P5P/R5K1 w - - 0 37,a6b6 d5d4 e3d3 b7b6,2010,75,88,80,crushing interference intermezzo middlegame short,https://lichess.org/WbM4D3dj#73,
SCeaZ,3r2k1/pb5p/1p2p1p1/2n2p2/2B1q3/P5P1/1P1KQ2P/3RR3 w - - 8 37,d2c1 d8d1 c1d1 e4b1 d1d2 b1b2,2092,75,94,279,attraction crushing interference long middlegame queensideAttack,https://lichess.org/7kWiN9O0#73,
SHCtm,5r1k/p1p3p1/8/2pP2q1/8/7P/PP2Q3/5RK1 w - - 7 31,e2g2 f8f1 g1f1 g5c1 f1f2 c1b2,2090,75,95,1981,attraction crushing endgame exposedKing interference long pin,https://lichess.org/XcMp7DIv#61,
SI0Mb,7k/6p1/7p/5p2/2B1qPb1/6P1/Q5KP/8 w - - 5 34,g2f1 e4h1 f1f2 h1h2 f2e3 h2g3,2056,89,80,31,advantage deflection endgame exposedKing interference long,https://lichess.org/2AU3Qfq8#67,
SKJix,3r2k1/2q2ppp/1Np1pn2/8/PQPr4/7P/5PP1/1RR3K1 b - - 0 26,d4d2 b6d5 f6d5 b4d2,2021,75,92,1158,advantage interference master middlegame short,https://lichess.org/8ijQGTEV/black#52,
SQkHr,r2q1rk1/2pnb1pp/1pbpp1P1/8/p1PP4/2N1PN2/PPQ1BP2/2KR2R1 b - - 0 16,c6f3 g6h7 g8h8 c2g6 e7f6 e2f3,2056,75,94,4859,advancedPawn advantage interference long middlegame,https://lichess.org/Z7F3Fkf2/black#32,Dutch_Defense Dutch_Defense_Normal_Variation
SeMgS,r1bq4/ppp3p1/3p2k1/4p1NR/4Pbn1/P1NP3Q/1PP1K3/R7 b - - 2 19,f4g5 h5h8 g4f6 h8d8 c8h3 d8a8,2055,82,82,53,advantage interference long middlegame,https://lichess.org/pHtuFOEz/black#38,Four_Knights_Game Four_Knights_Game_Italian_Variation
SgN4u,2kr2nr/ppp2ppp/6q1/3Pp3/3n4/2B2NPb/PPP1BP1P/R2QK2R w KQ - 1 13,f3e5 d4c2 e1d2 d8d5 e2d3 d5d3 e5d3 c2a1,2068,103,84,22,advantage fork interference opening veryLong,https://lichess.org/oJPKnLth#25,Scandinavian_Defense Scandinavian_Defense_Mieses-Kotroc_Variation
SnBjU,2kr3r/5p1q/p1p1p3/6Q1/2pP1PP1/2P1P2p/PP5P/1R3RK1 w - - 5 26,g5c5 h7e4 g1f2 e4c2 f2e1 c2b1,2028,69,91,133214,crushing endgame interference long,https://lichess.org/Ub9hCZaO#51,
SqXDI,8/1p2r3/1P2pk2/2Q2p1p/P2R4/3KPn2/2P3r1/8 w - - 2 40,d4d6 f3e1 d3d4 g2d2 d4c4 d2c2 c4b5 c2c5,2090,87,86,38,advantage endgame interference skewer veryLong,https://lichess.org/mM6OkXX1#79,
Ss5PH,2r2rk1/pq1bbppp/1p2p1n1/1Nnp4/1P6/4PN2/PBRPBPPP/1QR3K1 b - - 0 16,c5a4 c2c7 b7b8 c7d7,2051,74,91,1582,advantage interference middlegame short,https://lichess.org/SU4uTfgO/black#32,English_Opening English_Opening_Caro-Kann_Defensive_System
SufrF,5k2/5p2/1p6/4p3/4P2Q/2P4P/3q1K2/8 w - - 13 62,f2g3 d2e1 g3g4 e1e4,2082,76,83,138,crushing endgame interference master queenEndgame short,https://lichess.org/BOxTJ0gh#123,
SuxKc,2r3k1/5p2/p5p1/2bP1pQ1/P7/1p4P1/1P2rPK1/3R4 w - - 0 37,d1d2 c5e3 g5e7 e2d2,2035,74,88,104,crushing endgame interference master pin short,https://lichess.org/38XSuYXG#73,
T1GjL,8/pp3r1k/5q1p/8/3pP3/P2P4/1PPK2RQ/8 w - - 13 51,g2e2 f6g5 d2d1 f7f1 e2e1 f1e1 d1e1 g5c1 e1f2 c1c2 f2g3 c2d3,2011,73,95,6889,attraction crushing endgame interference veryLong,https://lichess.org/J8PfqQio#101,
T1duf,8/p2Q1kq1/6p1/5p2/6p1/P5P1/1PP5/1K6 b - - 0 37,f7f6 d7d4 f6f7 d4a7,2089,76,99,251,crushing endgame interference queenEndgame short,https://lichess.org/b6B6iVrB/black#74,
T7eBI,3rr3/2q2kpp/p4p2/1pbRpP1Q/2p5/P1P1N2P/1P1R2P1/7K b - - 4 29,f7g8 d5d7 c7d7 d2d7,2099,78,89,1953,advantage interference middlegame short,https://lichess.org/rgu0ZYgm/black#58,
TD5bP,4rbk1/5pp1/3p3p/3P4/3Qnq2/2N1N2P/5PP1/4R1K1 w - - 0 33,e3c4 e4c3 d4f4 e8e1 g1h2 e1e4 f4f5 e4c4,2099,75,85,122,advantage discoveredAttack interference master middlegame veryLong,https://lichess.org/LLPkXu7o#65,
TDB95,8/1p1bkp2/p2p4/2pPn1R1/P1P1P3/1PN5/3KB2r/8 w - - 3 30,g5h5 e5f3 d2e3 h2h5,2099,75,85,145,crushing endgame interference master pin short,https://lichess.org/4kZu3uw7#59,
TEF9k,3kr3/pp2q2p/2p3p1/5p1P/4p3/1P2P1Q1/1PP2P2/2K4R b - - 3 22,g6g5 g3b8 d8d7 b8b7,2048,75,90,627,crushing endgame interference master short,https://lichess.org/wAZhn804/black#44,
TEmcB,3r2k1/5p1p/4bp2/PP2p3/1K6/1p3P2/2r1B1PP/3R3R b - - 6 27,d8d1 e2d1 c2c4 b4b3,2052,75,56,92,crushing endgame interference short,https://lichess.org/9llswP7V/black#54,
TEt8N,2r3k1/pq4p1/5pP1/4pP1Q/3bb2P/1P4K1/P7/1RB5 b - - 0 41,e4b1 h5h7 g8f8 h7h8 f8e7 h8g7 e7d6 g7b7,2088,76,94,1663,crushing deflection endgame interference skewer veryLong,https://lichess.org/EDmCjVVW/black#82,
TNfPi,5rk1/pp1b2p1/4p3/3p4/5q1P/P1PQ4/2P3P1/R3K2R w KQ - 2 21,d3e2 f4g3 e1d1 f8f2 e2d3 g3g2,2042,77,88,352,clearance crushing endgame interference long,https://lichess.org/DNKMWzwo#41,
TNt2a,r3rk2/8/2p3R1/p6R/P3n2P/5K2/2P2P2/8 b - - 0 39,a8c8 h5f5 f8e7 f3e4,2097,75,92,1022,crushing endgame interference short,https://lichess.org/hxNQvr5p/black#78,
TXu8I,2k5/p1p2ppp/1rp5/2Q2N2/2P1P3/B5Pb/P1KR3P/q7 w - - 7 26,c2d3 h3f1 d3c2 a1a2 c2d1 b6b1 a3c1 a2b3,2086,105,84,43,crushing interference middlegame veryLong,https://lichess.org/RYAScQoY#51,
TYt83,2k5/1p3q2/1pp1pP1p/4Qb2/2PR4/7P/PP1r2P1/7K b - - 2 33,d2b2 d4d8 c8d8 e5b8 d8d7 b8b7,2062,79,90,463,attraction crushing endgame interference long sacrifice,https://lichess.org/l6cLn7rz/black#66,
Ta0ee,2b1r1k1/3n1p1p/3q2pQ/r1pN4/p2PP3/2P1R2P/2P3P1/5RK1 b - - 3 28,c5d4 f1f7 g8f7 h6h7 f7e6 h7g6 d7f6 d5f6,2036,132,100,33,advantage attraction deflection fork interference middlegame sacrifice veryLong,https://lichess.org/ly8ojrtA/black#56,
TfMz0,Q7/5pkp/8/3PR2r/2P3Pq/6K1/8/4R3 w - - 4 41,g3f4 h4f2 f4e4 f2e1,2046,78,61,49,crushing endgame interference short,https://lichess.org/88XkBl0a#81,
TmnVp,4k3/1p5Q/1q2p3/pN1nbpB1/P7/1P4P1/5PKP/2r5 b - - 2 33,c1c2 h7g8 e8d7 g8f7 d7c6 f7e6,2034,76,91,2125,crushing deflection exposedKing interference long middlegame,https://lichess.org/j6G6BvIB/black#66,
TrQHP,1r2r1k1/pP3ppp/8/4P1q1/2BBQn2/2P4b/PPP1K2P/R6R w - - 3 20,e2d1 h3g2 e4e3 g2h1,2010,76,88,789,crushing fork interference middlegame short,https://lichess.org/Kx4yaKfF#39,
U2aGB,2r3k1/1p1q1rb1/p5pp/3Ppb2/4N2B/8/PP2QPPP/R4RK1 w - - 3 21,f1d1 f5e4 e2e4 f7f4 e4g6 f4h4,2067,76,91,2411,advantage clearance interference long middlegame,https://lichess.org/zPV16oHh#41,
U5DgR,r4r2/1p3p1k/pq5p/3p1Q2/3PP3/2P3RR/1p4PP/6K1 b - - 3 28,h7h8 f5e5 f7f6 h3h6,2053,78,83,601,endgame interference mate mateIn2 short,https://lichess.org/31PAWjBi/black#56,
U6ujC,3Q4/1p4pk/p4p2/5B2/8/6q1/P5Pn/6K1 b - - 4 38,h7h6 d8h8 h6g5 h8g7 g5f4 g7c7 f4f5 c7g3,2034,76,91,319,crushing deflection endgame exposedKing interference skewer veryLong,https://lichess.org/AWkEQ9j2/black#76,
UGA61,2r2rk1/ppq2ppp/3b4/8/4R1P1/1P3N2/P1n2P2/1RBQ1K2 b - - 1 24,c7c6 e4c4 d6c5 c4c2,2036,82,66,49,advantage interference middlegame short,https://lichess.org/sDEsdl4S/black#48,
UGvOI,2r2rk1/5ppp/p1nb1q2/1p1Q4/4p1P1/4P2P/PP2BP2/2KR2NR w - - 2 19,d5d6 c6d4 c1b1 f6d6,2014,75,95,15768,crushing discoveredAttack interference intermezzo middlegame short,https://lichess.org/LUYlikcu#37,Clemenz_Opening Clemenz_Opening_Other_variations
UJ763,r5k1/4b1pp/3p1p2/1b1Pp3/nP2P1P1/2P1NN1P/q1B2P2/3Q2RK w - - 1 29,c2a4 b5e2 d1e1 e2f3,2029,74,96,1101,advantage interference kingsideAttack middlegame short,https://lichess.org/gB1n1Gaf#57,
UL5s2,2kr1b1r/Qpp2ppp/4p3/4n3/2PP2b1/4q1P1/PP4BP/RN3R1K b - - 0 14,e3d4 g2b7 c8d7 a7d4,2080,75,97,847,advantage interference intermezzo opening queensideAttack short,https://lichess.org/bDgTaUjU/black#28,Scandinavian_Defense Scandinavian_Defense_Modern_Variation
ULhje,Br4k1/p1p2ppp/3p4/4Pb2/5P2/2P3P1/q1P1Q2P/2KR3R w - - 0 18,a8d5 b8b1 c1d2 a2d5,2038,77,70,62,advantage interference middlegame queensideAttack short,https://lichess.org/cuzs7gh9#35,Scotch_Game Scotch_Game_Schmidt_Variation
UOwgk,2bqr1k1/rp6/pb2Pn1p/5Qp1/3p1B2/6P1/PP3PBP/1R2R1K1 b - - 2 22,g5f4 f5g6 g8h8 e6e7 e8e7 g6f6,2032,75,94,7135,advancedPawn crushing interference kingsideAttack long master middlegame,https://lichess.org/i5riopHz/black#44,
UU9Cf,r5k1/pp1q2r1/2p2R2/3pP2Q/3Pb1P1/2P4P/PP6/R5K1 b - - 4 32,a8f8 f6f8 g8f8 h5h8 f8e7 h8g7,2076,78,93,9024,attraction crushing deflection exposedKing interference kingsideAttack long middlegame,https://lichess.org/JAbA8zim/black#64,
UWfR0,r2qk2r/5pp1/2bbpn2/pp1p2N1/2pP3P/2P1P3/PPQNBP2/2K3RR b kq - 0 17,b5b4 g5f7 e8f7 c2g6 f7e7 g6g7 e7e8 g7h8,2092,78,79,86,attackingF2F7 attraction crushing deflection interference middlegame sacrifice veryLong,https://lichess.org/rQ8KHSeq/black#34,Queens_Pawn_Game Queens_Pawn_Game_Accelerated_London_System
UaQpX,3k2r1/8/Q3p3/2pq1p2/Pp6/3P1Pbp/1PP4P/4RRK1 w - - 0 31,e1e6 g3d6 g1h1 d5e6,2057,99,86,34,crushing discoveredAttack endgame interference intermezzo short,https://lichess.org/DwzTITh5#61,
UgaMz,r1bq1rk1/pp1n1pbp/5npB/3ppN1P/8/2N5/PPPQPPP1/R3KB1R b KQ - 1 10,g6f5 d2g5 f6e8 g5d8,2052,78,92,7189,advantage interference opening short,https://lichess.org/193zPEnk/black#20,Torre_Attack Torre_Attack_Fianchetto_Defense
UmpeP,4r2k/pp3p1p/3p4/8/2P1q1p1/5nPP/PP3PK1/R2Q3R w - - 0 28,h3g4 f3e1 g2f1 e4h1,2041,92,86,96,deflection discoveredAttack doubleCheck endgame interference mate mateIn2 short,https://lichess.org/5Ia1dj58#55,
UyQmC,3r4/1P6/8/P5p1/2Rb2Pp/7k/4K3/8 b - - 0 40,d4e5 a5a6 e5b8 c4c8 d8d6 c8b8,2015,85,91,320,crushing endgame interference long,https://lichess.org/bXw1TIHa/black#80,
V16fo,1k1qr3/pNp5/5p2/PP1n4/2QP4/6pP/6P1/R5K1 b - - 0 29,b8b7 c4c6 b7c8 c6a8 c8d7 a8d5,2066,76,88,285,advantage endgame interference long,https://lichess.org/TY8kSum1/black#58,
V7Lau,r1bqkbnr/ppp4p/2n3p1/4pN2/2BpPp2/1P6/PBPP1PPP/R2QK1NR b KQkq - 1 8,g6f5 d1h5 e8d7 h5f5 d7d6 b2a3 c6b4 a3b4 c7c5 b4c5 d6c5 f5e5,2028,80,92,5830,attraction crushing deflection exposedKing interference opening veryLong,https://lichess.org/bC1NCX4g/black#16,Nimzo-Larsen_Attack Nimzo-Larsen_Attack_Modern_Variation
VDaMf,r1b2k1r/3pnpbp/p1pNp1p1/4q1B1/1P3Q2/8/P1P1NPPP/R3K2R b KQ - 1 15,e5a1 e1d2 f7f6 h1a1,2081,76,86,284,advantage defensiveMove discoveredAttack interference middlegame pin short,https://lichess.org/7N4SLEoU/black#30,Sicilian_Defense Sicilian_Defense_Closed
VF5uo,r6r/p2kn2p/2qn1Q2/2b1p3/1p6/1B3NB1/Pp3PPP/1R4K1 b - - 0 25,d6e4 f3e5 d7c8 f6h8,2069,78,90,1222,crushing fork interference middlegame short,https://lichess.org/7G7WgS8w/black#50,
VFtuY,6k1/3rn2p/p2r2p1/1qRP1p2/1P2p3/P3N2Q/Bb4PP/5R1K b - - 4 31,b5e2 c5c2 e2d3 c2b2,2051,75,82,199,advantage interference middlegame short,https://lichess.org/wxl2QOCN/black#62,
VLdrg,r4rk1/5ppp/pp6/6q1/P2PRn2/N4Q2/1P4PP/4R1K1 b - - 5 28,f4d5 e4e5 g5h4 f3d5,2024,94,65,37,advantage discoveredAttack interference middlegame short,https://lichess.org/GmLpkqZ8/black#56,
VUyA9,2k2r2/ppp4p/2n1p3/4rq2/2Qp2p1/8/PPPBRPPP/R3N1K1 w - - 4 19,a2a4 d4d3 e1d3 e5e2,2062,80,91,1446,advantage interference master middlegame short,https://lichess.org/Y0botEp6#37,Italian_Game Italian_Game_Two_Knights_Defense
Vcc72,5rk1/1q2ppbp/6p1/2R5/1nQ1P3/5N1P/r2N1PP1/3R2K1 b - - 1 23,a2c2 c5b5 b7a6 c4b4,2057,76,91,1219,crushing interference master middlegame short,https://lichess.org/ztYaoEP3/black#46,
VdtzR,2k4r/ppq1pp2/8/2pPb3/2P1N3/3BP2r/PPKB2Q1/R7 w - - 2 28,e4g5 h3g3 g2f2 g3g5,2017,78,86,80,advantage interference middlegame short,https://lichess.org/nAukIw3y#55,
VfpMI,r4rk1/3q2pp/ppb1p3/2p1B3/2Pp4/P1n2N2/2QN1PPP/R3R1K1 w - - 4 23,d2e4 c3e4 e1e4 d4d3 c2b3 c6e4,2047,178,-44,12,advantage interference intermezzo long middlegame,https://lichess.org/YXpkrFC2#45,
Vikjx,3r3k/8/1p1P1pBp/4p2q/Pp1b3r/3Q1R1P/8/5R1K b - - 1 35,h5g5 f3g3 e5e4 d3d4,2058,84,80,33,crushing interference master middlegame short,https://lichess.org/GgYmquQl/black#70,
Vknpu,5r1k/3bNppp/2p5/p1n4q/2BQP3/P4N1P/1R4P1/4bK2 b - - 0 26,e1g3 e7f5 d7f5 d4c5,2058,76,93,5604,crushing interference middlegame short,https://lichess.org/xL45wEop/black#52,
VmUcR,r2qkb1r/pp1b1ppp/2np1n2/4p3/4P3/1QN2N2/PPP2PPP/R1B1KB1R w KQkq - 2 8,f1c4 c6a5 c4f7 e8e7 c3d5 e7f7,2075,77,82,78,advantage interference long opening,https://lichess.org/tH8jB0ur#15,Sicilian_Defense Sicilian_Defense_Chekhover_Variation
VqH5u,2r4r/pp2pk2/3pNbp1/3P4/2P2PQ1/1P6/P3R1K1/4q1B1 b - - 2 32,e1b1 e6g5 f6g5 g4e6 f7e8 e6c8,2098,75,91,1170,clearance crushing interference long master masterVsMaster middlegame sacrifice,https://lichess.org/FAEc9YOv/black#64,
VquoK,4r1k1/pp4p1/2p2p1p/3p1R2/Q7/5BP1/PP2Pq1P/7K w - - 4 25,f3g4 f2e1 h1g2 e8e4 a4a7 e4g4,2060,76,87,181,advantage endgame interference long,https://lichess.org/iXgU0RL6#49,
VslPm,r1bq1rk1/4bppp/2n5/p2p4/PpN5/1P2Q3/2P2PPP/R1B1RBK1 w - - 0 16,c4b6 d5d4 e3e4 d8b6 f1d3 g7g6,2042,78,92,2745,crushing defensiveMove interference long master opening,https://lichess.org/Cx0niDL0#31,Sicilian_Defense Sicilian_Defense_Nyezhmetdinov-Rossolimo_Attack
Vu1rD,r2qr1k1/ppp2p1p/2nn2p1/5b2/B4Q2/2b1BN2/PPP2PPP/R2R2K1 w - - 0 14,b2c3 e8e4 f4h6 e4a4 f3g5 d8f6,2023,74,89,989,advantage interference long middlegame,https://lichess.org/6ZT5v6OL#27,Russian_Game Russian_Game_Modern_Attack
W3DLs,r2q1rk1/p4ppp/2b2n2/b1p2Q2/3p4/2N1P2P/PPNB1PP1/R2R2K1 w - - 0 17,e3d4 a5c3 d2c3 c6e4 f5f4 e4c2,2059,75,93,4757,advantage interference long middlegame,https://lichess.org/0YgBEomh#33,Semi-Slav_Defense Semi-Slav_Defense_Main_Line
W3wKC,8/8/1R6/p4r1p/1kP5/3KP3/8/8 b - - 2 50,b4a3 b6b5 f5f1 b5a5,2028,76,92,5701,crushing endgame interference master rookEndgame short,https://lichess.org/DNlysARQ/black#100,
W5LzF,3r1bk1/3n1p1p/b1p5/q3nNP1/1p2PB2/6QP/1PP3B1/4R2K b - - 4 31,e5g6 f4c7 a5c5 c7d8,2066,75,83,82,advantage fork interference master middlegame short,https://lichess.org/G2pHWJhY/black#62,
W6AeR,1r1q3r/2p1kp2/ppBbp2p/8/4NP2/P1Q1n3/1P5P/3R1RK1 b - - 5 23,e3d1 c3f6 e7f8 f6h8 f8e7 h8f6,2030,78,92,803,crushing interference long middlegame,https://lichess.org/Cf2DKUvS/black#46,
WB8cL,r4b2/p1kn2p1/1pp1p2p/4q3/4N3/2PQ4/PP4PP/5RK1 b - - 0 22,d7c5 f1f7 c7c8 f7f8 c8c7 f8f7,2042,168,87,17,advantage interference long middlegame,https://lichess.org/fKmCk7Ag/black#44,
WJQ8j,1q1k4/p7/1p3r2/2pQbN2/8/2P4P/PP4P1/6K1 b - - 1 31,d8c8 f5e7 c8c7 d5e5 f6d6 e7f5,2071,76,92,1427,crushing endgame exposedKing fork interference long,https://lichess.org/sYRCZizr/black#62,
WM4oM,6r1/pp3k2/2p5/4RNpp/4Pn2/2PP2K1/PP6/8 b - - 5 37,f4d3 f5h6 f7g7 e5g5 g7h6 g5g8,2002,88,100,34,advantage deflection discoveredAttack endgame exposedKing fork interference long skewer,https://lichess.org/RTZjyjdm/black#74,
WayNV,1k1r1r2/pp6/1q4p1/2p1n3/3p2P1/N2Pn2Q/PPP4P/R1B2RK1 w - - 1 18,f1f8 d8f8 c1e3 e5f3 g1h1 d4e3,2069,233,-50,5,advantage interference intermezzo long middlegame,https://lichess.org/qBufcIBX#35,Sicilian_Defense Sicilian_Defense_McDonnell_Attack
WbPPz,3r1rk1/1pp2pp1/p3qn1p/2b1pN2/4P3/2P1B2P/PP2QPP1/R3R1K1 b - - 1 19,f6e4 e2g4 g7g6 f5h6,2078,77,91,4045,advantage interference kingsideAttack middlegame short,https://lichess.org/zGx3qCzR/black#38,Philidor_Defense Philidor_Defense_Steinitz_Variation
WgBtx,2kr4/pb1r1pp1/1p2pb1p/q1P5/2Q1B3/P1N3P1/1PPR1P1P/2KR4 b - - 0 23,d7d2 c5b6 c8d7 d1d2,2074,86,70,39,crushing discoveredAttack interference intermezzo middlegame queensideAttack short,https://lichess.org/S0zE9Ygt/black#46,
WinsR,r1bq2k1/pp3p1p/3b1p1Q/2pP2r1/2B5/2N5/PPP2PPP/R4RK1 w - - 4 17,g2g3 d6f8 h6h4 g5g4 h4h5 g4c4,2056,75,96,745,advantage interference long middlegame,https://lichess.org/Ra4fHUDt#33,Philidor_Defense Philidor_Defense_Other_variations
Wq202,2kr4/ppp2P1p/6n1/q4b2/8/1BP2N2/P1P2PPP/1K1R3R b - - 0 18,d8f8 d1d5 a5c3 d5f5,2017,75,88,734,advantage interference master masterVsMaster middlegame short,https://lichess.org/28CigAV1/black#36,Scandinavian_Defense Scandinavian_Defense_Main_Line
