PuzzleId,FEN,Moves,Rating,RatingDeviation,Popularity,NbPlays,Themes,GameUrl,OpeningTags
kWLp0,r3rnk1/1b3qp1/p2P1p1p/1p3N2/2p4R/2P5/2Q1BPPP/3R2K1 w - - 4 25,h4h6 b7e4 c2d2 e4f5,2008,76,94,10210,crushing interference middlegame short,https://lichess.org/597fG96y#49,
kbrwr,3r1rk1/ppq1np2/5n1B/5b2/2p4P/2P2NP1/PP3PB1/R1Q3K1 b - - 1 20,g8h8 c1g5 f6e8 h6f8,2067,93,68,22,advantage interference middlegame short,https://lichess.org/PhvVM3pm/black#40,
kepyA,2k3rr/pppn4/3qp3/P2p4/3P2Q1/2PB2P1/1P5P/RN2R1K1 w - - 1 21,g4e6 g8g3 g1h1 g3e3 e6d6 e3e1 h1g2 c7d6,2022,181,-71,10,advantage interference kingsideAttack middlegame sacrifice veryLong,https://lichess.org/4yAiUE69#41,
kgS3F,r2qk2r/p4p1p/4pPp1/1pQp4/2P5/3P1P2/PP1NKP1P/R7 b kq - 0 22,d8f6 c5c6 e8e7 c6b7 e7f8 b7a8,2029,80,91,1591,advantage endgame fork interference long,https://lichess.org/DjeVypsa/black#44,
knx9I,3r1rk1/pp1qb1pp/n7/3pPP2/1P6/P5RP/4Q1BK/5R2 b - - 0 26,f8f5 e5e6 d7d6 f1f5,2034,76,87,92,advantage interference intermezzo middlegame short,https://lichess.org/OQyWgCyv/black#52,
koFJu,2r5/1p2bkp1/4P2p/q2pP2P/3P2K1/5N2/P1r2Q2/R4R2 b - - 0 30,f7e6 f3g5 e6d7 f2f5 d7c7 f5c2,2023,75,91,882,crushing interference long middlegame,https://lichess.org/fMzAfreA/black#60,
krFnO,5q1k/p5p1/1p4Bp/5N2/8/2P5/Pr4PP/3Q3K w - - 2 29,f5d6 b2d2 d1e1 d2d6,2067,79,80,89,crushing endgame interference short,https://lichess.org/AzNHw09R#57,
ktDN1,r3r1k1/pp2qpp1/2b4p/3p4/5R2/2P2NQ1/PP4PP/5R1K b - - 9 23,e7e3 f4f7 g8f7 f3e5 f7g8 g3e3,2008,75,94,2515,advantage attraction discoveredAttack doubleCheck interference long master masterVsMaster middlegame sacrifice,https://lichess.org/HO93C7s5/black#46,
l0Pec,2r5/pp3k1p/8/4B3/3PPp1q/3B1P2/P4KP1/2R2R2 w - - 1 32,g2g3 h4h2 f2e1 c8c1,2090,189,38,21,endgame interference mate mateIn2 short,https://lichess.org/MPezIuS9#63,
l4klq,3r2k1/2b5/p3p1q1/1p2P1pR/1PpB4/2P5/P5PP/5QK1 w - - 6 36,f1f3 g5g4 f3f6 g6h5,2099,78,83,48,advantage endgame interference short,https://lichess.org/92P9agIM#71,
lEANX,r4rk1/p5p1/7Q/3qP3/5p2/1P1BpK1P/P7/R5R1 w - - 1 26,f3e2 f4f3 e2e3 d5e5 e3d2 e5b2 d2d1 b2a1,2069,112,87,18,crushing exposedKing interference middlegame veryLong,https://lichess.org/9ScqRp2h#51,
lGg4Z,3r3k/Q1p2p1p/8/4bNq1/8/8/PP1r1RPP/4R2K w - - 4 23,b2b3 e5d4 f5d4 d2f2,2045,79,81,55,advantage fork interference middlegame short,https://lichess.org/7mXaebWT#45,
lH8xo,r1bqk2r/ppp4p/2np3b/3Bpp2/8/3P1Q2/PPP1NPPP/R1B1K2R b KQkq - 0 10,h6c1 f3h5 e8d7 h5f5 d7e7 f5f7,2048,82,76,116,exposedKing interference long mate mateIn3 middlegame,https://lichess.org/i9VB7fIY/black#20,Kings_Pawn_Game Kings_Pawn_Game_Wayward_Queen_Attack
lPdiS,r4r1k/p5pn/1pbNpq1p/5p2/2BR4/4Q1P1/PPP2P1P/5RK1 w - - 5 22,c4e6 h7g5 e6d5 f6d6,2018,147,-25,14,crushing interference middlegame short,https://lichess.org/dHiyc7tQ#43,
lRGir,1qkr2nr/1p4pp/2nb1p2/2p2P2/Q3P3/2P1B3/PP2B1PP/2KR3R b - - 5 19,d6f4 a4c6 b7c6 e2a6 c8c7 e3f4 c7b6 f4b8,2066,74,92,4287,advantage interference middlegame queensideAttack sacrifice skewer veryLong,https://lichess.org/j5PiLVPg/black#38,Philidor_Defense Philidor_Defense_Albin-Blackburne_Gambit
lThU5,r3k3/pppnqpp1/6b1/3P2P1/1b1NP3/8/PP1BPP2/R2QK2B w Qq - 5 17,f2f3 e7g5 d2b4 g5g1 e1d2 g1d4,2016,75,91,179,advantage fork interference long middlegame pin sacrifice,https://lichess.org/S6ccaval#33,Grob_Opening Grob_Opening_Spike
lWsAR,5rk1/6pn/p5q1/1p1N4/3Pp1PB/1PP2r2/1P4QK/8 b - - 0 37,e4e3 d5e7 g8f7 g2f3 h7f6 e7g6,2066,74,87,481,crushing fork interference long middlegame,https://lichess.org/oQDUX8Pa/black#74,
lbETB,8/pp1RQ1pp/7q/1P3k2/P7/4P3/6Pb/7K w - - 4 34,d7d5 h2e5 h1g1 h6e3 g1f1 e3f4,2096,78,52,51,crushing discoveredAttack endgame interference long,https://lichess.org/Gh5PMFQU#67,
lbWQR,Q7/3r2kp/p4pp1/1pp5/4N3/3q2P1/PP2R1KP/8 w - - 2 35,g2f1 d3f3 f1e1 f3h1 e1f2 h1h2,2025,77,87,502,advantage endgame exposedKing interference long master,https://lichess.org/LLEN7V6k#69,
lcxBx,1rq1r1k1/2p2ppp/p1n2P2/3p2PP/p7/2PPp3/2P1Q3/2K2R1R b - - 0 20,g7g6 h5g6 c8b7 g6f7 g8f7 h1h7 f7e6 e2e3,2074,77,80,92,advancedPawn advantage attraction interference kingsideAttack middlegame veryLong,https://lichess.org/uKllKWqb/black#40,
lhnBl,8/6p1/3p2k1/4p1p1/1Q2P3/1P1K2PP/8/5q2 w - - 4 54,d3c3 f1e1 c3c4 e1e4,2071,75,84,225,crushing endgame interference queenEndgame short,https://lichess.org/uy1aPMuF#107,
lzVWZ,r4r1k/pp4pp/4b3/4P3/Q4P2/1Pp1q1P1/P6P/1K1R1B1R w - - 0 27,a4d4 e6f5 f1d3 e3d4,2003,76,90,1025,crushing interference middlegame short,https://lichess.org/0uFbyP1K#53,
lzklZ,4r1k1/5pp1/1p1R3p/pb2P3/q4b2/P1B2N1P/1P4P1/4Q2K b - - 3 37,b5c6 d6d4 a4c2 d4f4,2020,75,92,786,advantage interference master middlegame short,https://lichess.org/FDMdUlD3/black#74,
m5E3U,2r2rk1/pp6/4pqB1/3p4/5PQ1/2P5/P5P1/R5K1 b - - 0 24,f6f4 g6f7 g8f7 g4f4,2086,107,68,26,attraction crushing doubleCheck endgame interference intermezzo short,https://lichess.org/BBp3Om4k/black#48,
m6niM,4r1k1/1pR2pp1/1p3n1p/5N2/4PR2/3r3P/PP4P1/6K1 b - - 0 24,f6e4 f5e7 g8h7 f4e4,2009,74,89,256,advantage endgame interference intermezzo short,https://lichess.org/v80F8uEZ/black#48,
m9qlO,4r3/pp4kp/2p2p2/5bPP/7n/1PNPr3/PBP1BK2/R7 b - - 0 32,f6g5 c3e4 g7h6 f2e3 f5e4 d3e4,2098,94,100,31,advantage discoveredAttack interference long middlegame,https://lichess.org/MczHEllz/black#64,
mA0Gp,4r1k1/3R2pp/3P4/p1B1bp2/1p6/6PP/3R1PK1/r7 b - - 0 39,b4b3 d7e7 e8d8 e7e5,2060,74,84,570,advantage endgame interference short,https://lichess.org/yGIfseCr/black#78,
mD6YI,rn1qkb1r/ppp1pppp/5n2/3P4/6b1/N6N/PPPPBPPP/R1BQK2R b KQkq - 0 5,d8d5 e2g4 d5e4 g4e2 e4g2 e2f3 g2h3 f3b7,2072,101,57,17,crushing interference opening veryLong,https://lichess.org/VEWSjwby/black#10,Pirc_Defense Pirc_Defense_Other_variations
mIOE7,2k4r/pp2bQp1/2p1p1pq/8/2PPR1P1/1B4B1/PP3PKr/4R3 w - - 1 24,g3h2 h6h3 g2g1 h3h2 g1f1 h2h1 f1e2 h1e4,2038,76,91,1374,crushing interference middlegame veryLong,https://lichess.org/LEeDYdij#47,
mIxMj,r3kb1r/pp3pp1/4pnp1/q2N4/2B5/8/PPP1Q1PP/2KR3R b kq - 0 14,f6d5 d1d5 f8c5 c4b5 e8f8 d5c5,2073,78,88,591,crushing interference long middlegame pin,https://lichess.org/Lani89CA/black#28,Blackmar-Diemer_Gambit_Declined Blackmar-Diemer_Gambit_Declined_OKelly_Defense
mL1Cz,8/7k/r7/P4R1P/1n4P1/8/7K/8 b - - 0 39,h7h6 f5b5 b4c6 b5b6 a6a5 b6c6 h6g5 c6g6,2041,74,83,314,crushing endgame exposedKing interference master masterVsMaster pin veryLong,https://lichess.org/SSyMZyjc/black#78,
mLqI0,2r3k1/5p1p/Qp4pP/3p1qP1/1P1P4/P3PpK1/5P2/6R1 w - - 3 32,g3h4 c8e8 h4g3 f5g5,2078,75,100,81,advantage endgame interference short,https://lichess.org/gbhgreEt#63,
mNSS3,3r2k1/p4p1p/4pQ2/2pq4/7n/5PPP/1B2b3/4R2K b - - 0 31,e2f3 h1g1 g8f8 f6h8 f8e7 b2f6 e7d6 h8d8,2055,74,95,8170,crushing defensiveMove deflection fork interference middlegame veryLong,https://lichess.org/YZrRT3sO/black#62,
mOdXL,r3k2r/pp4p1/2pp2Qp/q7/1n1Pn3/8/PPP1BPPP/2KR3R b - - 1 17,e8d7 g6g7 d7d8 g7h8,2012,80,88,980,crushing interference middlegame short,https://lichess.org/BquigndQ/black#34,Kings_Pawn_Game Kings_Pawn_Game_McConnell_Defense
mOszA,1br2rk1/1b2qpp1/p6p/1p6/3R2Q1/P1N1B2P/1P3PP1/2R3K1 b - - 3 23,c8c6 d4d7 e7e5 d7b7,2090,76,87,127,advantage interference master middlegame short,https://lichess.org/2TtOikP2/black#46,
mPI0f,r6k/5r1p/pp1pqpp1/3Rn3/4N1Pn/PP5P/1Q3PB1/3R2K1 w - - 2 26,d5d6 e5f3 g1h1 e6e4 d6f6 h8g8 f6f7 g8f7,2015,88,85,39,advantage discoveredAttack interference middlegame veryLong,https://lichess.org/qoqQwmLh#51,
mRTwG,r6r/ppp2kp1/2np4/2b1p3/4P1Q1/2PP3P/Pq4P1/RN1K1R2 b - - 1 14,f7e7 g4g7 e7d8 g7h8 d8d7 h8a8,2010,76,79,100,crushing interference long middlegame skewer,https://lichess.org/uNiZqulI/black#28,Italian_Game Italian_Game_Two_Knights_Defense
mTQoc,3r4/pp2k3/2prp2p/4N1p1/4P3/4K2P/PPP3P1/5R2 b - - 4 28,d6d2 e5g6 e7d6 e3d2,2010,98,85,30,advantage endgame interference master short,https://lichess.org/HeilQTCb/black#56,
mUgva,2krq2r/1pp2np1/p3p3/1N1pPp2/5P2/Q1PB2PP/PP3P2/3K3R b - - 1 24,a6b5 a3a8 c8d7 d3b5 d7e7 a8a3,2041,76,95,3389,advantage interference intermezzo long middlegame queensideAttack,https://lichess.org/p7hcVmvT/black#48,
mVJug,r2r4/ppQ3p1/2n5/1P3p1p/k2B1P1P/6PK/2q5/R7 b - - 1 34,a4b5 c7b7 b5c4 b7c6 c4d4 c6c2,2065,76,95,388,crushing deflection interference long middlegame skewer,https://lichess.org/UCOOdpun/black#68,
mcHOt,5nk1/p2r2p1/3q3p/3P4/2P5/1Q4P1/P4P1P/4R1K1 b - - 2 33,f8g6 e1e6 d6c5 e6g6,2075,73,95,11762,crushing endgame interference short,https://lichess.org/HkKmrxS4/black#66,
mfyKN,2kr1r2/pp2b2p/6p1/2p5/3nB1q1/3Q2P1/PPP2P1P/R1B1R1K1 w - - 3 20,d3a3 d4e2 g1f1 g4e4,2015,75,91,590,advantage interference kingsideAttack middlegame short,https://lichess.org/MGQ2CoK9#39,
my0pY,7Q/2p1kp2/1p2pNpp/4P3/5PP1/3q3K/P6P/8 w - - 1 33,h3h4 g6g5 f4g5 h6g5 h4g5 d3d2 g5h5 d2h2,2072,75,93,3461,attraction crushing endgame interference master masterVsMaster veryLong,https://lichess.org/Hs6zY7QT#65,
mzb80,3r1r1k/pp5p/2pNBn2/4n1p1/4P2q/P1N4P/1PP5/R2Q1R1K w - - 1 23,e6f5 g5g4 d1d2 h4h3,2098,119,87,12,advantage interference kingsideAttack middlegame pin short,https://lichess.org/gWc9YNVU#45,
n34QX,r5k1/2q2ppp/1p1b1n2/1r6/3P4/P2b1NP1/1P1N1P1P/R1BQR1K1 w - - 1 30,d2b3 d3c2 d1e2 b5b3,2014,77,91,1644,advantage interference middlegame short,https://lichess.org/j4f5lrTB#59,
n3w0F,r5k1/1p4pp/1b1pb3/4p3/2PnPr1P/Pp3BK1/R1nN2P1/1Q5R w - - 0 27,d2b3 d4e2 f3e2 b6f2 g3h2 f4h4,2088,80,62,113,clearance deflection interference long master mate mateIn3 middlegame sacrifice,https://lichess.org/y3vk7TVO#53,
n6xGi,r3k2r/pp1q1pp1/3p4/2p3b1/2P1P1bp/2NP4/PP2NQB1/R4RK1 w kq - 0 19,e2f4 h4h3 g2f3 g5f4,2069,77,85,288,advantage interference middlegame short,https://lichess.org/qGCnlVBe#37,Sicilian_Defense Sicilian_Defense_Staunton-Cochrane_Variation
n9saq,3r2k1/2Q2p2/3P2p1/7p/2P1p2P/p7/P1KR4/4q3 b - - 4 38,e1h4 c7e7 h4f4 e7d8,2046,75,95,5825,crushing endgame interference short,https://lichess.org/gcx01ZPy/black#76,
nAJmC,r4rk1/p3ppbp/2p3p1/8/Q3P3/B5N1/b2q1PPP/2R2RK1 b - - 3 18,f8e8 c1c2 d2d3 c2a2,2054,75,97,1796,advantage interference middlegame short,https://lichess.org/MLsaX2Qj/black#36,Grunfeld_Defense Grunfeld_Defense_Exchange_Variation
nBkRv,6k1/7p/p4q2/2pP2p1/1pP2p1P/1P3P2/P6Q/6K1 w - - 0 33,h4g5 f6a1 g1g2 a1a2,2058,88,88,36,crushing endgame interference queenEndgame short,https://lichess.org/lZaFYdsB#65,
nHXEK,3R1r1k/pp4pp/8/4p3/4B3/P1P3PK/1q6/3R4 b - - 1 36,b2a3 d1d6 g7g6 d8f8,2076,76,87,321,advantage endgame interference master quietMove short,https://lichess.org/px6ofXyw/black#72,
nIwdu,4r3/5k2/2p2r2/6R1/4p3/6R1/6P1/6K1 b - - 0 41,e4e3 g5g7 f7f8 g7g8 f8e7 g3e3,2006,76,96,7208,crushing endgame exposedKing interference long rookEndgame,https://lichess.org/fSBLhl4Q/black#82,
nK9hE,4rk2/2p2q2/b1p2N2/p3P1p1/2PP1pPp/3K3P/P4Q2/1R5R w - - 6 29,f6e8 f7c4 d3d2 c4a2 d2c1 a2f2,2035,75,97,443,crushing endgame interference long skewer,https://lichess.org/bZjrA1Ax#57,
nLwaY,r2k3r/p1pn1p1p/2P3p1/8/Q3p3/4P1R1/P6q/K5R1 b - - 0 25,d7b6 a4d4 d8e7 d4e5 e7f8 e5h8 f8e7 h8e5,2001,78,47,53,crushing fork interference middlegame veryLong,https://lichess.org/L1OTNBj1/black#50,
nMYwK,r4k2/pp3rbQ/2ppbq2/4n1p1/2PB1nP1/2N2P2/PP6/2KR1BNR w - - 6 19,c3e4 e5d3 f1d3 f6d4,2002,76,69,553,crushing discoveredAttack interference master masterVsMaster middlegame queensideAttack short,https://lichess.org/6uzwJEc6#37,Dutch_Defense Dutch_Defense_Queens_Knight_Variation
nMyFw,2r3k1/p4ppp/1p2p3/4Nq2/nP3P2/2P3P1/P3Q2P/3R2K1 b - - 2 26,a4c3 e2c4 c8f8 c4c3,2097,76,83,85,advantage endgame interference short,https://lichess.org/rMZRDJLq/black#52,
nNEti,r5k1/pp3pp1/2n4p/2b5/6b1/2qBPN2/P3KPPP/R2Q3R w - - 0 17,d1c2 c6d4 e3d4 a8e8 e2f1 c3a1,2049,75,94,4327,crushing interference long middlegame sacrifice,https://lichess.org/3zkbaGRm#33,Queens_Gambit_Declined Queens_Gambit_Declined_Exchange_Variation
nYKxy,6k1/pp2r2p/3pr1p1/2p5/2P3q1/1PQ1PR1R/P4K2/8 b - - 8 30,b7b6 f3f8 g8f8 c3h8 f8f7 h3h7,2017,75,95,4425,attraction endgame interference long mate mateIn3 sacrifice,https://lichess.org/VSoCpc8x/black#60,
nemLW,r3k2r/p5pp/5pb1/1QBPp1P1/4P2P/1Rb5/2P1K3/7q b kq - 1 24,e8f7 b5b7 f7g8 b7a8 g6e8 a8e8,2034,75,91,1629,interference long mate mateIn3 middlegame,https://lichess.org/prAkNgNQ/black#48,
nfiAV,1rq3k1/p4ppp/1b6/4Pb2/1Q1B1P2/P2P1B2/2r3PP/1R3R1K w - - 1 25,f3e4 f5e4 d3e4 c2c4 b4b3 c4d4,2065,90,82,39,advantage interference long middlegame,https://lichess.org/6a2wGgBi#49,
nhrJG,r4rk1/pp4pp/2pqb3/8/3P1p2/2P3p1/PPQ3B1/1K2R2R b - - 0 27,f4f3 c2h7 g8f7 g2f3,2076,78,78,308,crushing interference middlegame short,https://lichess.org/0TXy4bd6/black#54,
nmbMG,r3q1k1/1p4p1/p1p3pp/3bP3/2pPN1Q1/2P5/P5PP/5RK1 b - - 2 24,e8e6 e4f6 g8h8 g4g6 g7f6 g6h6,2086,111,82,34,crushing endgame interference kingsideAttack long,https://lichess.org/64HzF80e/black#48,
nqHa5,rn3rk1/pp3ppp/2p5/3p4/3P1b2/2N2q2/PPP2P1P/1K1RQBR1 b - - 3 13,b8d7 f1e2 f3h3 e2g4 h3h4 g4d7,2029,75,93,4535,advantage interference long middlegame,https://lichess.org/CpPZvtMx/black#26,French_Defense French_Defense_Knight_Variation
nrdNn,r2q1rk1/1b2bpp1/5n1p/p4N2/Pp2p3/1P1p2B1/1P1N1PPP/2RRQ1K1 b - - 1 25,g7g6 f5e7 d8e7 c1c7 e7e6 c7b7,2002,73,95,8433,advantage interference long middlegame,https://lichess.org/aWBKrLJJ/black#50,
nuKiq,5r2/3n1knQ/8/3p4/p7/P1q1BP2/2B5/2K4R b - - 1 31,f8c8 h7g6 f7e7 e3g5 d7f6 g6g7 e7e6 g7f6,2000,100,85,65,crushing exposedKing interference middlegame veryLong,https://lichess.org/BMMIilsd/black#62,
o12cQ,6k1/5pp1/1q2p1p1/3n4/p3N3/Pr4PP/KPQR1P2/8 w - - 3 33,e4c5 d5c3 a2a1 b6c5,2024,76,84,112,crushing endgame interference short,https://lichess.org/NMy3R1P8#65,
o1onA,4r2k/p4Q1p/4r1p1/4N3/3q1n2/8/PP3PPP/R3R1K1 w - - 1 22,a1d1 f4e2 g1h1 d4e5,2012,80,81,73,advantage interference middlegame short,https://lichess.org/GWVfsuVX#43,
o2yWS,r1b1kr2/ppp2p1p/2np3Q/4q1N1/8/4P3/nPP2PPP/1K1R1B1R b q - 3 14,c6b4 g5h7 f8h8 h7f6 e8e7 h6h8 e5f6 h8f6,2087,82,86,378,advantage discoveredAttack interference middlegame veryLong,https://lichess.org/EEMSGEW4/black#28,Indian_Defense Indian_Defense_Pawn_Push_Variation
o6lRT,6rk/4R1p1/2pq4/1p1b1P2/p5PK/P1B1Q3/1P6/8 w - - 1 44,f5f6 d6h2 h4g5 h2h6 g5f5 g7g6 f5e5 h6e3,2010,81,86,50,crushing endgame interference veryLong,https://lichess.org/68IHfBxd#87,
o8G3k,r2qnr1k/pp1bbppB/n1p1p3/4P3/2P5/P1N2N2/1PQ2PPP/R1B1K2R w KQ - 1 12,c2e4 f7f5 e4e2 h8h7,2047,230,100,11,equality interference opening short,https://lichess.org/S51aVBXO#23,
oD1uD,8/pR6/2p2k2/4R3/2KP2p1/6P1/PP3r2/3r4 w - - 0 45,c4c5 f2c2 c5b4 c2b2 b4c3 b2b7,2084,75,97,408,crushing endgame interference long rookEndgame skewer,https://lichess.org/vEuTahiA#89,
oDCY4,7k/pp2N1pp/4Br2/8/8/P7/2r1b1K1/R5R1 w - - 0 45,a1c1 e2f1 g2g3 c2c1,2098,74,94,5386,crushing doubleCheck interference master masterVsMaster middlegame short,https://lichess.org/RqaQxMKm#89,
oDDnT,7r/1q3kp1/4P1p1/3p2Q1/2p2P1B/2P1K3/3R2P1/2r5 b - - 0 38,f7e6 g5g6 e6d7 g6g7,2029,75,95,402,crushing endgame interference short,https://lichess.org/bDXbMvxj/black#76,
oIxob,r1bqk2r/ppp1bpp1/2np4/4p3/2P3nP/3P1N2/PP2PPB1/RNBQK2R b KQkq - 0 8,e7h4 h1h4 h8h4 c1g5 f7f6 g5h4,2041,80,75,66,advantage attraction fork interference long opening sacrifice,https://lichess.org/T1X9f4b8/black#16,Grob_Opening Grob_Opening_Other_variations
oL6VE,r4rk1/pp3ppp/3p4/q1pN4/4P2R/3Q3P/PPP3PK/8 b - - 3 20,f7f5 d5e7 g8f7 e7f5,2021,77,75,200,crushing endgame interference kingsideAttack short,https://lichess.org/BrD3Q3hv/black#40,
oOFYa,2r3r1/4k1b1/p2p2QB/4p3/p3P3/7q/5R1P/5NK1 b - - 0 40,h3h6 g6f7 e7d8 f7g8,2080,75,85,99,crushing interference master middlegame short,https://lichess.org/FOLoYCJc/black#80,
oOhFa,1r5k/2R2p2/2R1b2p/P3p1p1/K2bP3/8/7P/8 b - - 2 41,d4b2 c6b6 b8a8 b6b2,2016,76,91,547,advantage endgame interference master short,https://lichess.org/MysgYPaN/black#82,
oTVkj,4r1k1/pq3p1p/5bp1/2R5/3p4/1P1Q2P1/P2NrP1P/2R3K1 w - - 0 22,d2f3 e8e3 f2e3 b7f3 d3e2 f3e2,2086,76,87,440,crushing interference long middlegame sacrifice,https://lichess.org/AVJrkmfk#43,
onTxb,N1bk2nr/pp1p1ppp/8/4q3/1b3B2/6P1/P1P1PP1P/R2QKB1R w KQ - 3 13,f4d2 b4d2 e1d2 e5d4 d2c1 d4a1,2087,83,89,574,advantage attraction interference long opening,https://lichess.org/FEhdFq0S#25,Englund_Gambit_Complex Englund_Gambit_Complex_Englund_Gambit
ooVva,7k/7p/KpB5/p7/P7/2P4P/1r4P1/8 b - - 10 54,b2b3 c3c4 h8g7 c6b5 b3g3 a6b6 g3g6 b6a5,2062,76,90,868,crushing endgame interference quietMove veryLong,https://lichess.org/0CGdxN4v/black#108,
orosi,5r2/2P3p1/7p/1P6/8/2k4b/7P/3R2K1 b - - 3 43,c3b4 b5b6 h3c8 d1d8 f8f5 d8c8,2052,74,87,94,crushing endgame interference long,https://lichess.org/Qbe89Sf7/black#86,
ovlis,r3k2r/p1p2ppp/2Q1pn2/5b2/3P4/4PN2/P2BKPPP/7q b kq - 0 14,e8e7 d2b4 e7d8 c6a8 d8d7 f3e5,2042,79,88,476,interference long mate mateIn3 middlegame,https://lichess.org/O5aYtWpj/black#28,Queens_Gambit_Declined Queens_Gambit_Declined_Chigorin_Defense
p0dGh,4k1r1/ppq4p/4Q3/4N2P/8/2P5/P5PK/b7 b - - 8 32,e8d8 e6g8 d8e7 g8h7,2022,108,14,22,crushing endgame hangingPiece interference short,https://lichess.org/BdEsYpwk/black#64,
p0x3X,8/8/8/6p1/6Pp/R4PkP/2r5/4K3 w - - 3 57,e1d1 c2f2 f3f4 g3f4 d1e1 f2f3 a3a5 f3h3,2035,76,88,54,crushing endgame interference rookEndgame veryLong,https://lichess.org/qHLpTMaQ#113,
p6irU,4k3/r3bnQ1/p6r/1pp2qpp/3p1P2/6BP/PPP3P1/RN2R1K1 w - - 0 24,f4g5 h6g6 g7h7 f5g5,2062,114,82,34,crushing interference intermezzo middlegame short,https://lichess.org/tNPw5TGo#47,
p6lRI,r1q2rk1/2p1bpp1/2bp1n1p/8/1P2P3/1B2B2P/1P1N1PP1/R2Q1RK1 b - - 0 16,c6e4 d2e4 f6e4 a1a8 c8a8 b3d5 a8b8 d5e4,2091,72,93,148389,advantage fork interference opening veryLong,https://lichess.org/Y0QWJeWf/black#32,Italian_Game Italian_Game_Anti-Fried_Liver_Defense
p7ca2,3r1r2/q5k1/2Q1B1pp/1p2b3/4P3/3P1PR1/2P5/1R1K4 w - - 6 31,g3g2 d8d6 c6b5 d6e6,2030,91,67,50,advantage interference middlegame short,https://lichess.org/WqUUzyfo#61,
p7iK1,3r1rk1/p1p2ppp/1p6/2bRB3/4qP2/1P2P1P1/P1P1NK1P/3Q3R w - - 3 21,d5d8 c5e3 f2e1 e4h1 e2g1 h1g1 e1e2 g1f2 e2d3 f8d8,2000,94,29,23,crushing interference middlegame veryLong,https://lichess.org/f2wGDiOn#41,
p829o,7k/1pBR2p1/4Pqpp/5r2/8/1P4Q1/r1P4P/1NK1R3 w - - 2 25,e6e7 f6b2 c1d2 b2c2 d2e3 c2b3 d7d3 b3e6 c7e5 f5e5 g3e5 e6e5,2057,77,91,3220,crushing interference middlegame queensideAttack veryLong,https://lichess.org/aSjk6wu2#49,
pEpoM,8/7R/3r1k1p/4p1pP/5p2/5KP1/5P2/8 b - - 1 45,f6f5 g3g4 f5f6 h7h6,2028,214,88,3,crushing endgame interference rookEndgame short,https://lichess.org/jXXStbk7/black#90,
pHTWf,2r1k2r/1b1nppb1/p2p2p1/qp1Pn1Np/2pBP2P/1PN2P2/P1PQB1P1/R3K1R1 w Qk - 2 16,f3f4 e5d3 e2d3 g7d4,2009,75,83,199,crushing discoveredAttack interference middlegame short,https://lichess.org/710T9ws7#31,Modern_Defense Modern_Defense_Standard_Line
pNL2J,2r1k2r/ppqbb1pp/4pp2/8/1P1P3N/2PB4/P1Q2PPP/R3R1K1 w k - 3 18,d3h7 f6f5 d4d5 h8h7,2002,105,85,20,advantage interference intermezzo middlegame quietMove short,https://lichess.org/0Qo35qbT#35,Horwitz_Defense Horwitz_Defense_Other_variations
pOrlq,r4rk1/1b1n1ppp/p3pn2/1p4q1/2p5/2P3BP/PPBN1PP1/R2QR1K1 b - - 1 21,d7c5 e1e5 g5h6 e5c5 a8d8 f2f4,2088,76,94,6518,advantage defensiveMove interference long middlegame,https://lichess.org/MJ2sjt1Y/black#42,
pTKw5,8/3q2pk/2p5/4Q1Pp/p4PbK/2B5/1P6/8 b - - 5 41,g4h3 g5g6 h7g8 e5h5 c6c5 h5h7 g8f8 h7h8 f8e7 h8g7,2073,76,80,103,crushing deflection discoveredAttack endgame interference master veryLong,https://lichess.org/A5BVnqSD/black#82,
pTL0R,5rk1/p7/1pp1r1pp/5q2/2PQ1p1P/5N2/P4PK1/R6R w - - 2 27,d4c3 f5g4 g2f1 e6e3 c3c2 e3f3,2097,76,91,1171,advantage interference long master masterVsMaster middlegame,https://lichess.org/p3Mt0sTR#53,
pVBgK,r2qk2r/pp2pp1p/2np1np1/8/2Bb1Nb1/1Q6/PPP2PPP/R1BR2K1 b kq - 5 12,g4d1 c4f7 e8d7 b3b7 d8c7 f7e6 d7d8 b7a8,2023,78,91,2702,advantage attackingF2F7 interference middlegame veryLong,https://lichess.org/eI4s7WR9/black#24,Sicilian_Defense Sicilian_Defense_Sozin
pdvKD,2Q5/p5p1/1pp5/k1b1p3/2P3p1/P2P2q1/4K3/R4R2 w - - 1 36,d3d4 c5d4 c8f5 g3e3 e2d1 d4a1,2059,77,92,3694,crushing endgame exposedKing interference long,https://lichess.org/GMBWCG8N#71,
poGow,r2q1r1k/1p2n1p1/p6p/3Pn3/P2BQ1b1/1B6/2P2PPP/R4RK1 b - - 0 18,g4f3 e4e5 e7f5 g2f3 d8g5 g1h1 g5h5 f1g1,2063,97,76,26,clearance crushing hangingPiece interference middlegame veryLong,https://lichess.org/aHQmhHi4/black#36,Italian_Game Italian_Game_Anti-Fried_Liver_Defense
ppA9N,5Q2/1p1k1pp1/1q2p2p/1p2P3/2p2P2/2r4r/5RP1/R5K1 b - - 3 33,c3c2 f8f7 d7c6 f7e6,2016,77,88,805,crushing deflection endgame interference short,https://lichess.org/5Lw0oOft/black#66,
ppQev,r4rk1/pp2bppp/3p1n2/q6b/4PR2/3BB3/PPPN2PP/R3Q1K1 b - - 0 14,f6g4 f4f5 a5c7 f5h5,2036,74,95,3865,crushing interference middlegame short,https://lichess.org/6ZZdTaBX/black#28,Sicilian_Defense Sicilian_Defense_Other_variations
prgFh,r2q4/p1pk2b1/3pp1p1/8/P1N5/1P1R1QPp/6rP/1R5K b - - 0 24,d8f8 d3d6 c7d6 f3b7 d7e8 b7a8 e8f7 b1f1 f7g8 f1f8,2095,75,91,854,crushing interference middlegame sacrifice skewer veryLong,https://lichess.org/OqvHJjcp/black#48,
prqsM,3r1rk1/p1qb1ppp/1p6/5n2/3p1R2/P1P2B1P/2QB1PP1/1R4K1 w - - 0 25,f4f5 d4d3 c2c1 d7f5,2025,83,48,52,advantage interference intermezzo middlegame short,https://lichess.org/qQUX08Il#49,
puJAx,8/1k1q3p/p3p1r1/Pp2Ppb1/2bPp3/Q3P3/5RPP/R3B1K1 w - - 6 33,a1b1 c4d3 b1d1 g5e3,2055,75,85,114,advantage interference middlegame pin short,https://lichess.org/TatXKsdT#65,
q2qee,4Q3/7p/1p3rk1/8/3PK2P/5r2/8/8 b - - 6 48,f6f7 e8g8 g6f6 e4f3,2050,76,92,6434,crushing endgame interference queenRookEndgame short,https://lichess.org/n0iobVre/black#96,
q9fj9,1r1q1rk1/4bp1p/p2p2p1/2pP4/1p3Q2/3PB2R/PPP1N1PP/6K1 b - - 0 19,e7f6 f4h6 f8e8 h6h7 g8f8 e3h6 f8e7 h3e3 e7d7 h7f7 e8e7 f7f6 e7e3 f6d8 b8d8 h6e3,2075,77,91,3499,crushing deflection interference kingsideAttack middlegame veryLong,https://lichess.org/5NA19O6G/black#38,Sicilian_Defense Sicilian_Defense_Grand_Prix_Attack
qFHMr,r1bqkbnr/ppp1p2p/2n2p2/3p2p1/3P1B1N/4P3/PPP2PPP/RN1QKB1R b KQkq - 0 5,g5f4 d1h5 e8d7 h5d5 d7e8 d5h5,2067,75,83,176,advantage interference long opening,https://lichess.org/JdQ1L1Dx/black#10,Queens_Pawn_Game Queens_Pawn_Game_Accelerated_London_System
qJZUY,rnbqk2r/pp2ppbp/5np1/3P4/3N4/2N1P3/PP3PPP/R1BQKB1R b KQkq - 0 7,f6d5 f1b5 c8d7 c3d5,2053,79,84,53,advantage interference intermezzo opening short,https://lichess.org/iKtfm2B5/black#14,English_Opening English_Opening_Symmetrical_Variation
qSbFs,2r5/1p6/4k3/p2pb3/4p1PP/4K3/P1P5/5R1R w - - 4 32,f1f2 c8c3 e3e2 c3c2 e2f1 c2c1 f1g2 c1h1,2056,77,91,2866,advantage endgame exposedKing interference veryLong,https://lichess.org/LRFX4WSJ#63,
qaEeu,8/4Q3/1p4p1/pP1Pp1k1/4P3/2p2P1K/8/6q1 b - - 1 62,g5f4 e7f6 f4e3 f6b6 e3d2 b6g1,2036,76,92,301,crushing endgame interference long master queenEndgame skewer,https://lichess.org/UNcFNwC2/black#124,
qetcc,2r3k1/4qppp/1n2p1b1/1B1n4/3B4/4P3/3N1PPP/2Q2RK1 w - - 5 23,c1b2 c8c2 b2a1 c2d2 a1a5 d2d4,2036,90,87,29,advantage interference long middlegame,https://lichess.org/ILYD3faw#45,
qjuaa,2r4r/pp1pkppp/2n1pn2/q5B1/1b2P3/2N5/PPPQ1PPP/2KR1B1R b - - 5 11,b4c3 d2d7 e7f8 d7c8,2072,76,88,318,crushing interference master middlegame pin short,https://lichess.org/29Uf2YnW/black#22,Sicilian_Defense Sicilian_Defense_Four_Knights_Variation
qkFzH,r4r2/pp1qk1pQ/2bbp1P1/3p1n2/3P4/1P5R/PBPN3P/5RK1 b - - 2 23,f8h8 h7g7 f5g7 f1f7 e7d8 h3h8 d7e8 h8e8,2001,77,92,200,advantage fork interference middlegame sacrifice veryLong,https://lichess.org/1ylOj1GO/black#46,
qlFpU,2r3k1/1qr1p3/p3N1p1/3p2Pp/6nP/1P4Q1/Pb2R3/1K1R4 w - - 0 37,e6c7 b2e5 g3d3 b7c7 d3g6 e5g7,2098,74,95,584,advantage defensiveMove interference intermezzo long middlegame,https://lichess.org/INLJv2F5#73,
qmDF2,8/b7/P7/5B2/2pp2p1/1Pk3P1/2P2K2/8 w - - 0 51,b3c4 d4d3 f2f1 d3c2 f5c2 c3c2,2025,75,96,715,advancedPawn bishopEndgame crushing discoveredAttack endgame interference long,https://lichess.org/LNsu8Eec#101,
qmwIc,2r1br2/4k1p1/p3P2p/1p6/2nN4/3Q4/PP3qPP/1B1R3K b - - 1 31,c4e3 d3a3 b5b4 a3b4 e7f6 b4f8,2011,76,82,78,crushing deflection exposedKing interference long middlegame skewer,https://lichess.org/OLsl1LKo/black#62,
qs807,r2qnrk1/1p4pp/p2Pp3/2ppB3/1n6/3BP3/PPP2PPP/R2QK2R w KQ - 4 14,d1h5 b4d3 c2d3 f8f5 h5e2 f5e5,2001,75,93,3454,crushing interference long middlegame,https://lichess.org/sqmgp3Bn#27,Horwitz_Defense Horwitz_Defense_Other_variations
qsn61,4rr2/p5k1/bpn4p/5p1Q/8/1P5N/PbPP1PPP/3R2K1 w - - 4 21,c2c3 a6e2 f2f3 e2d1 h3f4 c6e5,2033,135,37,14,advantage fork interference long middlegame,https://lichess.org/uiUt2HuW#41,
qtPFZ,1r5r/1Pp1kp2/2B5/p1bQp3/1q4b1/1P5p/P4PPP/2RR2K1 b - - 4 22,g4d1 d5e5 e7f8 e5h8 f8e7 h8e5,2095,75,90,124,crushing interference long middlegame,https://lichess.org/LxmVfwTt/black#44,
r4oW4,r2qkb1r/pp3p2/7p/3Nn3/4p3/4P3/PP2NPPP/R2QK2R w KQkq - 1 14,a1c1 e5d3 e1f1 d8d5,2093,76,92,2975,advantage fork interference middlegame short,https://lichess.org/GYeDdm8v#27,Slav_Defense Slav_Defense_Three_Knights_Variation
r7xO2,2rqr1k1/pp3pp1/2bp1b1p/8/4PP2/1BN4P/PP1Q2P1/3RR1K1 w - - 2 19,d2d6 d8b6 g1h2 c8d8 c3d5 d8d6,2038,75,92,2251,advantage clearance interference long middlegame,https://lichess.org/f9MEE35l#37,Center_Game Center_Game_Kieseritzky_Variation
rA8GR,5rk1/ppp3p1/q7/3Ppr1p/n1P1Q3/2PKB3/P4P1P/3R2R1 b - - 5 21,f5f3 g1g7 g8g7 d1g1 g7f7 e4f3,2006,145,-5,10,attraction crushing interference kingsideAttack long master middlegame sacrifice,https://lichess.org/ITbTe5bK/black#42,
rDFY4,8/5pkp/1p4b1/1Pp1b3/2P5/1P4PP/3R2QK/4q3 b - - 2 36,g6e4 d2e2 e1c3 e2e4,2090,75,91,2157,advantage endgame interference short,https://lichess.org/CXI25fQi/black#72,
rFhmh,8/8/p1Q2k2/4p1pp/P2p4/5PPP/6K1/4q3 b - - 1 46,f6f5 g3g4 f5f4 c6f6 f4e3 f6e5 e3d2 e5d4,2002,75,98,338,crushing deflection endgame interference queenEndgame veryLong,https://lichess.org/5JdkIEmw/black#92,
rK8Bl,r4k1r/2Rqnp2/1p2p1p1/4P3/1b2N3/6B1/5P1P/2Q2RK1 b - - 1 26,d7d4 c7c4 d4d3 c4b4,2043,75,91,1891,advantage interference master middlegame short,https://lichess.org/bbn33jBh/black#52,
rL61P,r2r1bk1/1q4p1/p4p1B/4pP2/2Pn2Q1/6RP/6P1/1B1R2K1 w - - 1 37,c4c5 d4f3 g3f3 d8d1,2017,75,85,129,advantage discoveredAttack interference kingsideAttack middlegame short,https://lichess.org/9aLHiNHk#73,
