PuzzleId,FEN,Moves,Rating,RatingDeviation,Popularity,NbPlays,Themes,GameUrl,OpeningTags
QaZ7h,r4k1r/ppp2pp1/nb4qp/3P1b2/3PN3/PB3N1P/1PP3P1/R2QR1K1 w - - 3 17,e4g3 g6g3,1086,482,-50,3,equality hangingPiece middlegame oneMove,https://lichess.org/HOvX1PWQ#33,
QbD9m,2kr2nr/1pp3p1/p3p3/2q2pNp/5P2/3PB1P1/PPP2K1P/R2Q4 b - - 2 18,c5f8 g5e6 f8e7 e6d8,1026,83,100,237,equality fork middlegame short,https://lichess.org/jgankoVX/black#36,
QgQPQ,r3k2r/1p2Rppp/p1n2q2/1B1Q4/8/8/PPP2PPP/R5K1 b kq - 0 15,f6e7 b5c6 e8f8 c6b7,1089,180,20,18,equality middlegame short,https://lichess.org/jBoSdWIR/black#30,
R3YSc,8/8/7p/2p3p1/6P1/1P1K2kP/2P5/8 w - - 3 48,d3c4 g3h3 c4c5 h3g4,1034,156,71,38,endgame equality pawnEndgame short,https://lichess.org/Wnr7pyce#95,
RH7CM,4k3/4n1p1/p2B1p1p/2PPp3/8/P6P/5PP1/6K1 w - - 1 33,c5c6 e7d5,1041,193,-33,19,endgame equality oneMove,https://lichess.org/f9sCTymP#65,
RVxJV,r2q1rk1/1p2bppp/p2p1n2/5P2/2B2Pn1/2N1B3/PPPQ2PP/R3K2R b KQ - 0 14,g4e3 d2e3,1038,125,80,45,equality middlegame oneMove,https://lichess.org/Ed4rkl7h/black#28,
RXxAD,3r1r2/2p1q2k/pp2p3/5ppP/P1P1B1P1/8/1P3Q2/R2R2K1 b - - 0 27,d8d1 a1d1,1038,208,0,21,endgame equality oneMove pin,https://lichess.org/U6xzbeO5/black#54,
RcbD5,5rk1/2R2p2/pp2p2p/2b5/2n1B3/7P/P1P2PP1/3R1K2 w - - 9 29,f2f4 c4e3 f1e2 e3d1,1011,186,100,34,endgame equality fork short,https://lichess.org/rP5GS8iw#57,
Rfycb,r1b2rk1/2q1pp1p/3p3b/5PN1/pp1NP1Q1/3P2n1/PPP3P1/R4RK1 b - - 2 20,h6g5 g4g5 g8h8 g5g3,1057,83,59,186,equality fork middlegame short,https://lichess.org/qOUWzSJm/black#40,
RsBCm,5rk1/p3ppb1/1p5p/6p1/3P4/1b3NBP/5PP1/R2R2K1 w - - 2 26,a1a7 b3d1,1037,99,100,101,equality hangingPiece middlegame oneMove,https://lichess.org/dKMtQd3S#51,
RwCMD,8/r7/5k2/6pp/pN6/N1K3P1/7P/8 b - - 3 56,f6e5 b4c6 e5e4 c6a7,1003,105,82,76,endgame equality fork short,https://lichess.org/qgbM4TY3/black#112,
SaWk6,B3kb1r/p1pp1pp1/1p2p2p/4P3/1n1P4/5NP1/PPP2P1P/RN3K2 w k - 1 13,c2c3 b4c2 a8e4 c2a1,1015,85,82,171,equality middlegame short trappedPiece,https://lichess.org/S0IJV5C9#25,
StrVP,3rrnk1/2p2q1p/R3p1p1/2Pp2N1/3Q4/2P3b1/PP3P1P/4R1K1 b - - 1 27,g3f2 d4f2 f7f2 g1f2,1097,132,63,51,equality middlegame short,https://lichess.org/vC9EIgah/black#54,
THGXH,6k1/5pp1/7p/2nPp3/4P3/2b1P3/6PP/1B3K2 b - - 0 29,c5e4 b1e4,1033,183,89,33,endgame equality hangingPiece oneMove,https://lichess.org/CWvAUqhR/black#58,
TXlhj,3b1r2/p1q3pk/2p3p1/3p3p/1PpPrP2/P1P3PP/5RN1/3Q2K1 b - - 2 31,e4e3 g2e3,1012,96,86,96,equality hangingPiece middlegame oneMove,https://lichess.org/GBJDSsp4/black#62,
UYNuu,r1bqk2r/ppp2pp1/2np1n1p/1Bb1p3/4P3/2P2N2/PP1PQPPP/RNB2RK1 w kq - 0 7,b5c6 b7c6,1044,85,87,175,equality oneMove opening,https://lichess.org/lZ35SRyB#13,
Ud4Rr,r2q1rk1/bb3pp1/p6p/n3N3/N3n3/P1P5/BP1B1PPP/R2QR1K1 w - - 0 20,e1e4 b7e4,1064,130,100,60,equality hangingPiece middlegame oneMove,https://lichess.org/vPJyEn7R#39,
UiLrf,r3r1k1/1p3p1p/p1ppn1pP/6P1/PP1pP3/1N3K2/1P6/R5R1 b - - 2 25,e6g5 g1g5,1003,82,100,220,endgame equality hangingPiece oneMove,https://lichess.org/xI8uGJZj/black#50,
Uje5g,3r1rk1/2p2p1p/1pn2R2/p7/8/1PP4P/1P4P1/R5K1 b - - 0 23,g8g7 f6c6,1023,218,100,27,endgame equality hangingPiece oneMove,https://lichess.org/nW45xKOF/black#46,
UqM5u,3rk1r1/4bp1p/p2Bp3/1p6/8/1pP4P/1P1R1PP1/3R2K1 b - - 4 23,d8d6 d2d6 e7d6 d1d6,1051,225,100,27,endgame equality short,https://lichess.org/jmLaPKwp/black#46,
UwdwA,r4rk1/5ppp/4p3/p2p4/P1pP4/2n1B3/2B2PPP/R4RK1 w - - 0 24,f1c1 c3e2 g1f1 e2c1,1038,247,100,20,equality fork middlegame short,https://lichess.org/Q6MPMJkB#47,
V1wdM,6k1/2p3pp/2p3b1/8/pPN3P1/7P/1b4K1/4N3 b - - 1 30,g6f7 c4b2,1010,90,100,149,endgame equality hangingPiece oneMove,https://lichess.org/IQsZYlG5/black#60,
V6zlq,5K1k/5R2/7p/4n1p1/6P1/7P/8/8 w - - 3 56,f7f6 e5d7 f8e7 d7f6,1027,149,33,35,endgame equality fork short,https://lichess.org/5bzIzCvZ#111,
VJ5Ck,3R4/5pbk/2r3p1/6Bp/3P4/2n4P/5PP1/5RK1 w - - 4 35,f1c1 c3e2 g1f1 e2c1,1078,93,100,148,endgame equality fork short,https://lichess.org/UrW7ggzW#69,
VTBI9,r1bq1rk1/ppppnpbp/2n3p1/8/2BNPP2/4B3/PPP3PP/RN1Q1RK1 b - - 0 8,c6d4 e3d4 g7d4 d1d4,1099,297,-33,7,equality opening short,https://lichess.org/1lAUzIIE/black#16,
VUj0V,r3kbnr/pp2pppp/8/3q4/3Q4/5b2/PP2BPPP/RNB1K2R w KQkq - 0 9,d4d5 f3d5,1003,82,100,232,equality oneMove opening,https://lichess.org/W24hNyuT#17,
VmtS7,8/8/2R4K/8/5kP1/3q1B2/8/8 b - - 2 60,d3f3 c6f6 f4g4 f6f3,1009,129,79,71,endgame equality queenRookEndgame short skewer,https://lichess.org/tKSmnLOl/black#120,
VpbHY,r1bq1b1r/ppp1n1pp/4k3/3np3/2B5/2N2Q2/PPPP1PPP/R1B1K2R w KQ - 4 9,c3d5 e7d5,1024,91,60,111,equality oneMove opening,https://lichess.org/fMCJpe3D#17,
Vqpmh,8/8/5k2/2R4P/6P1/5P2/5K2/7r w - - 1 57,c5c2 h1h2 f2g3 h2c2,1025,84,100,187,endgame equality rookEndgame short skewer,https://lichess.org/gEhKFlBh#113,
VyQTC,1r4k1/p4pbp/1p1p2p1/1B6/P3P3/2r1BR2/5PKP/8 b - - 5 41,g7d4 e3d4 c3f3 g2f3,1069,317,33,7,endgame equality hangingPiece short,https://lichess.org/LTe3pKpt/black#82,
W6OjO,3rkb1r/pp2pppp/2n2n2/3q4/Q5b1/2Pp1N2/PP2BPPP/RNBR2K1 b k - 1 10,d3e2 d1d5,1012,89,100,150,equality middlegame oneMove,https://lichess.org/qsuC0kmU/black#20,
WuSTx,7k/p3B1bp/1p1N2p1/2p2r2/3n4/8/PP5P/3R2K1 b - - 1 26,f5e5 d6f7 h8g8 f7e5,1048,189,100,28,endgame equality fork short,https://lichess.org/yzvYSS22/black#52,
Wxp7O,k1r5/1p5p/1R1N2p1/P4p2/2n1p3/2b1P1PP/5P2/5BK1 b - - 0 38,c4d6 b6d6,1000,82,100,206,endgame equality oneMove,https://lichess.org/zhb6EgoF/black#76,
XI6oc,2N4k/1b3ppp/2pB4/p7/8/1pP2P2/1P3nPP/2KR4 w - - 1 27,d1e1 f2d3 c1d2 d3e1 d2e1 b7c8,1056,81,100,215,endgame equality fork long,https://lichess.org/qlUztVGb#53,
XJ92n,r6k/1R4p1/p1pn3p/4R3/PPP5/2P3PP/8/7K w - - 1 31,b7b6 d6c4 e5e8 a8e8,1074,122,65,53,endgame equality fork short,https://lichess.org/mg6QsuA9#61,
XKKYF,r1br2k1/p1q2pbp/5np1/3Bp3/8/2B2P2/PPPQ2PP/RN2K2R w KQ - 1 14,d5a8 d8d2,1059,80,100,211,equality middlegame oneMove,https://lichess.org/Peqwyo6P#27,
XLNEB,3k4/2p3p1/1p3p2/p4B2/2r4P/R1P3P1/P4P2/4K3 w - - 3 29,f5e6 c4e4 e1d2 e4e6,1017,107,100,90,endgame equality fork short,https://lichess.org/YZ8DS04Q#57,
XN2qO,r3kb1r/p4ppp/2n1q3/1ppp2N1/3P4/2P1n1P1/PP4BP/R1BQ1RK1 w kq - 0 14,c1e3 e6e3 g1h1 e3g5,1068,127,100,56,equality fork middlegame short,https://lichess.org/HgzeUc3U#27,
XcQoL,1r6/3k1pB1/p1pPp3/8/2p2Pp1/8/PP6/5K2 b - - 0 29,d7d6 g7e5 d6d5 e5b8 c4c3 b2c3,1007,103,83,86,endgame equality long skewer,https://lichess.org/nkcjvS3U/black#58,
Xmtu5,1r5k/1pN4p/pP1p1p1b/3B1P1P/P1PP4/1n2PK2/8/6R1 w - - 3 39,g1b1 b3d2 f3e2 d2b1,1050,105,75,68,endgame equality fork short,https://lichess.org/EU3Oi3JB#77,
Xol47,7B/8/8/6k1/1R6/1p4P1/6K1/1r6 w - - 5 58,g2h3 b1h1 h3g2 h1h8,1016,108,100,83,endgame equality short skewer,https://lichess.org/lwdjrjcM#115,
Xq9tl,8/5prk/b1p1pq1p/P2N2r1/8/5RPQ/6PK/8 b - - 0 41,f6e5 d5f6 e5f6 f3f6,1095,293,11,19,equality middlegame short,https://lichess.org/X6twLzuL/black#82,
Y7NiG,r7/5p1k/p3p1pp/1p6/3PQ3/P3P2P/2R2PPK/3q4 w - - 0 34,e4a8 d1c2,1014,305,-60,9,endgame equality hangingPiece oneMove,https://lichess.org/n9HyNK80#67,
YCter,4r3/pRp2kpp/B4p2/7P/5bP1/8/5K2/7R w - - 0 34,b7a7 f4e3 f2g2 e3a7,1057,93,100,120,endgame equality fork short,https://lichess.org/bgRm39YU#67,
YHlho,R7/1r3p2/4pk1p/3pN3/5pP1/4P1KP/8/8 w - - 0 43,g3f4 b7b4 f4f3 f6e5,1037,104,100,87,deflection endgame equality short,https://lichess.org/XomTq5sQ#85,
YWZK8,6k1/pp4Pp/2p3q1/8/4p3/7P/PP1R1KP1/8 b - - 0 32,g6g7 d2d8 g8f7 d8d7 f7f6 d7g7,1007,98,100,122,endgame equality long queenRookEndgame skewer,https://lichess.org/U0NsGFNW/black#64,
YdICc,7r/p2q4/1p1p2k1/1PpNp1p1/P1PnPpBr/3P3P/1R4KR/5Q2 b - - 0 44,h4g4 h3g4 h8h2 g2h2,1077,199,100,28,equality middlegame short,https://lichess.org/avnPKqF6/black#88,
Yksjw,5k1r/p4ppp/1p6/8/3b4/3R3P/P5P1/3K4 b - - 1 34,d4c5 d3d8 f8e7 d8h8,1045,146,50,60,endgame equality short skewer,https://lichess.org/eqSSBFgN/black#68,
Ylb80,2k3nr/2p5/p2p3p/1pnP1pp1/1N3p2/P1P2P1K/QP2rb1P/R1B2R2 w - - 1 24,f1f2 e2f2,1044,82,100,228,equality hangingPiece middlegame oneMove,https://lichess.org/sDafNhjd#47,
YqYM9,rnbqk2r/pppp1ppp/8/4P3/2B5/4P3/PPP2nPP/RN1QK1NR w KQkq - 1 7,e1f2 d8h4 g2g3 h4c4,1033,276,100,16,equality fork opening short,https://lichess.org/7VpDAIRt#13,
Z0R5P,1R6/p1r3pk/1b3p1p/2P1p3/1R2b3/6P1/P4P1P/6K1 b - - 0 27,b6c5 b4e4,1036,82,100,201,endgame equality hangingPiece oneMove,https://lichess.org/vqzbGb9i/black#54,
Z5t4A,r6r/ppbn2p1/6k1/3p1p2/3P4/2P4Q/P4PP1/1RB2R1K w - - 0 20,h3h8 a8h8 h1g1 c7h2,1097,90,90,117,equality hangingPiece middlegame short,https://lichess.org/x9P20q7T#39,
Z6Hi7,6k1/1rq2ppp/4p1n1/1PbpP3/3B4/5N1P/4QPP1/R5K1 w - - 0 23,d4c5 c7c5,1005,143,0,33,equality middlegame oneMove,https://lichess.org/PgpfLxwS#45,
ZbcVY,8/5K2/8/4BP2/6r1/1k4P1/1p2r3/1R6 b - - 7 48,b3a2 b1b2 e2b2 e5b2,1070,160,45,24,endgame equality short,https://lichess.org/p5C3QHH7/black#96,
Zp1QV,3r1r2/4qp1k/p5pP/1p1ppP2/4b3/3B4/PPPQ4/1K1R2R1 b - - 0 24,e4f5 d3f5,1019,109,100,74,equality middlegame oneMove,https://lichess.org/DxgkcSQP/black#48,
ZsN37,rn1qkb1r/p4ppp/2p1pn2/1p3b2/6P1/PQ1P1P2/1PP4P/RNB1KBNR b KQkq - 0 9,f6g4 f3g4,1055,333,-60,6,equality middlegame oneMove,https://lichess.org/M38DPG7p/black#18,
Zw4T6,1k6/p1b5/1p5R/8/2p5/5BPP/r7/5K2 b - - 1 51,c4c3 h6h8 c7d8 h8d8,1006,106,100,118,endgame equality short,https://lichess.org/upF9HZ9f/black#102,
b4Wfy,1r3b2/pp4k1/3p1pBp/4pPpP/4PnP1/5R2/PPP5/5RK1 w - - 1 32,f3c3 f4e2 g1g2 e2c3,1036,82,100,222,endgame equality fork short,https://lichess.org/WYARoytb#63,
bHy0G,8/3bnpkP/3p2p1/3Pp1Q1/pp2P3/5PK1/q2NB1P1/8 w - - 1 38,g5e7 a2d2 h7h8b g7h8,1018,137,67,60,endgame equality hangingPiece short,https://lichess.org/edDbbwQa#75,
bK11v,3rkb1r/1pp1n1pp/p5q1/4B3/5Q2/2P1P3/PP1N1PPP/1bKR1B1R w k - 9 14,d2b1 d8d1 c1d1 g6b1,1087,195,0,18,attraction equality opening queensideAttack short,https://lichess.org/QMjwCKGm#27,
bUWme,r3kb1r/5ppp/p2p4/1p1Pp3/2pn4/3Q3P/PPPB1PP1/1R3RK1 w kq - 0 17,d3g3 d4e2 g1h2 e2g3,1031,122,88,52,equality fork middlegame short,https://lichess.org/0JXCyQXW#33,
bxqwN,r3k2r/ppqbn1p1/1bp1pp2/3pPn1p/3P1P2/1NP1BN1P/PP2Q1P1/2KR1B1R b kq - 1 14,f5e3 e2e3,1011,185,0,20,equality middlegame oneMove,https://lichess.org/ywMXWjHv/black#28,
bzWMr,8/5pk1/8/3nPR1p/p7/P4P1P/1P3PK1/8 w - - 0 50,f5h5 d5f4 g2g3 f4h5,1060,80,100,227,endgame equality fork short,https://lichess.org/2dzFd6zJ#99,
cEqOB,r1b1q1k1/ppp2p2/3prQ1p/6pB/8/P1P3BP/1P3PP1/R4RK1 w - - 1 19,f1e1 e6e1 a1e1 e8e1,1015,90,100,174,equality kingsideAttack middlegame short,https://lichess.org/lJ0ixtSv#37,
cdL25,8/pk6/2p1R1p1/1p1pnrqp/3B4/1PP4P/P1Q2PP1/7K w - - 1 32,d4e5 f5e5 e6e5 g5e5,1076,138,80,39,endgame equality short,https://lichess.org/VPEKzsVP#63,
d0NUD,r1r3k1/pp3pbp/n3pQp1/q7/3Pp1PP/P3P3/1P1BBP2/1K1R3R b - - 0 18,g7f6 d2a5,1090,107,85,60,equality hangingPiece middlegame oneMove,https://lichess.org/Q90pckQz/black#36,
d6zQe,r3r1k1/pq3ppp/5n2/1B1bN3/1Q6/6P1/PP3PP1/2R1R1K1 b - - 0 24,e8e5 e1e5,1082,88,85,149,equality hangingPiece middlegame oneMove,https://lichess.org/Uy1L6qQd/black#48,
dBHEp,6k1/1pn3p1/r2P3p/P1K1P3/5p2/8/8/4R3 b - - 0 44,a6a5 c5b6 c7e6 b6a5,1093,157,82,33,defensiveMove endgame equality short,https://lichess.org/o1Jpu5uM/black#88,
dDm7H,r4rk1/4qp1p/bp1p2p1/p1pPn2n/4PN2/PPB2P2/2BQ2PP/R3R1K1 b - - 1 19,h5f4 d2f4,1084,82,100,223,equality middlegame oneMove,https://lichess.org/pD2HdlSr/black#38,
dWo5b,1kr4r/p1p3p1/1pbb4/q5B1/6Q1/P1N2NP1/2P2P1P/R4RK1 w - - 0 22,f3d4 a5c3 d4c6 c3c6,1060,82,100,226,equality hangingPiece middlegame short,https://lichess.org/DGceZD6s#43,
dbTB1,8/8/1kpq1n1Q/1p1p4/1P1P4/1P6/1KP4p/8 b - - 7 50,d6b4 h6f6,1063,81,100,211,endgame equality hangingPiece oneMove,https://lichess.org/KhXo4huj/black#100,
dqOOC,5rk1/1P1p1ppp/r1nN4/3Np1P1/p3Pn2/3R1P2/1PP4P/2K4R w - - 5 26,d3c3 f4e2 c1d2 e2c3,1027,84,100,229,equality fork middlegame short,https://lichess.org/28jDhbX0#51,
e28Hu,8/1p6/p1p1p3/3pb3/PP5k/6p1/6Kp/5R2 b - - 2 45,e5d4 f1f4 h4g5 f4d4,1098,307,0,7,endgame equality fork short,https://lichess.org/SwcqWew4/black#90,
eAPQ7,r1b2r2/pp3k2/2p2n2/3P4/3P2Q1/4P1B1/P3KPPP/R7 w - - 1 24,g4f3 c8g4 f3g4 f6g4 d5c6 b7c6,1078,98,86,82,equality long middlegame pin,https://lichess.org/epwNYxOL#47,
eHb7e,r3kbnr/pp3ppp/4P3/2p5/1n6/2N5/PP2PPPP/R1BqKBNR w KQkq - 0 8,c3d1 b4c2 e1d2 c2a1,1055,131,100,60,equality fork opening short,https://lichess.org/emdGZPFy#15,
ePhTk,r5rk/ppp4n/3p3Q/n3pN2/4P3/2PP1NPP/PP2q3/R4R1K w - - 1 25,f3g5 g8g5,1069,148,100,48,equality middlegame oneMove,https://lichess.org/nW2ASdfK#49,
ewInJ,2r5/2qbnkb1/4p2p/3pPppP/5P2/Q1N3P1/PP1R4/1K2R1B1 w - - 1 30,g1c5 c7c5 a3c5 c8c5,1071,83,100,205,equality hangingPiece middlegame short,https://lichess.org/24uc1b3i#59,
f6k1i,Q5k1/p4pp1/7p/8/3b2P1/q6P/8/6NK b - - 1 35,g8h7 a8e4 g7g6 e4d4,1021,144,100,46,endgame equality fork short,https://lichess.org/GYMOYd8t/black#70,
fDjVy,8/p1p3k1/2p5/1P2P3/2n3p1/P1K1RpP1/b7/R7 w - - 4 42,e5e6 c4e3,1042,116,89,69,endgame equality hangingPiece oneMove,https://lichess.org/VOgzmgHy#83,
fiKEr,4r1k1/2pq1pp1/1r3b1p/3n4/P2Q4/1P3N2/1BPN1PPP/R4RK1 w - - 2 19,f3e5 f6e5 d4e5 e8e5,1046,91,80,122,equality middlegame short,https://lichess.org/RW9fOsNw#37,
g3EbO,2r1k3/pp1p4/n3p1R1/7p/2P4P/1P1r4/P2P4/R5K1 b - - 0 26,d3d2 g6g8 e8e7 g8c8,1004,222,-33,20,endgame equality short skewer,https://lichess.org/xjjf6jPu/black#52,
gOZZY,3r4/8/2k3p1/1R6/3pp2P/5n2/PP3P1P/1K5R w - - 1 35,b5b3 f3d2 b1c2 d2b3,1056,269,25,11,endgame equality fork short,https://lichess.org/StvIsxRA#69,
gbk6V,1qr1k2r/6p1/1Bb1pp2/4p3/2Q1P3/2P5/P1P3PP/3RK2R b Kk - 0 21,b8b6 c4e6 e8f8 e6c8,1013,179,87,33,equality fork middlegame short,https://lichess.org/YcSZASOb/black#42,
gygub,3r1rk1/p4qp1/2p1N3/1p3p1p/1Pb4P/4Q1P1/P4P2/2R1R1K1 b - - 0 24,c4e6 e3e6 f7e6 e1e6,1058,155,33,35,equality middlegame short,https://lichess.org/qlnxLpYW/black#48,
h58qK,8/p3p1k1/2p2p2/4P1p1/p1q5/P1P1Q3/1PK5/8 b - - 0 39,f6f5 e3g5,1074,119,100,79,endgame equality oneMove queenEndgame,https://lichess.org/DjbQ0FBe/black#78,
hBG01,7r/PR5P/5p2/5p2/2k5/r1p2P2/5RP1/6K1 w - - 5 46,b7b8 a3a1,1088,455,-100,1,endgame equality oneMove rookEndgame,https://lichess.org/gR4GYhLP#91,
hFiUm,r4rk1/p5p1/1q2p2p/3pPp2/3n4/1Pb1BNP1/P3QPKP/2R4R w - - 0 22,f3d4 c3d4 h1d1 d4e3,1036,87,100,161,equality middlegame short,https://lichess.org/Z1TMdoIT#43,
hPPMp,5rk1/4Bp1p/b1p3p1/8/1PP1N3/8/5PPP/r4NK1 b - - 0 23,f8e8 e4f6 g8h8 f6e8,1097,237,100,14,endgame equality fork short,https://lichess.org/45WgFwYe/black#46,
hUqJr,4r2k/p5pp/1pq5/8/2B2R2/1P2Q1P1/P4P1P/6K1 w - - 15 39,e3d3 e8e1 d3f1 e1f1,1093,179,-20,23,endgame equality short,https://lichess.org/COetFrSh#77,
hVthY,8/8/k1p1p2R/6p1/1p6/pP3NP1/n1Pr2PP/2R3K1 w - - 0 30,f3d2 a2c1,1061,324,0,10,endgame equality hangingPiece oneMove,https://lichess.org/m6k4yGhA#59,
hgiJB,r2q2rk/p1p2p1p/2Q4p/3pP3/3N2b1/7P/PP1N1P2/R4RK1 w - - 0 18,c6f6 d8f6,1070,448,-100,1,equality middlegame oneMove,https://lichess.org/eI43wsEV#35,
hxe2R,2k5/ppp2p1p/2q3p1/2P2p2/8/4B1P1/5P1P/2R3K1 b - - 0 30,b7b6 c5b6 c6c1 e3c1,1035,90,100,144,endgame equality short,https://lichess.org/30dHQ1GK/black#60,
hzCPd,r5k1/1b4rp/3Q4/1K5p/p7/7P/PP6/8 b - - 3 33,b7e4 d6e6 g7f7 e6e4,1083,83,100,206,endgame equality fork short,https://lichess.org/ZloxOOeY/black#66,
i7oPe,8/5pk1/8/PR6/1P2P2p/6b1/2r5/6K1 b - - 0 40,h4h3 b5g5 g7f6 g5g3,1090,140,100,48,endgame equality fork short,https://lichess.org/AjGid2Ui/black#80,
iJUeO,1k1r3r/1p1b2b1/pP2pq2/P1N1p2p/2B1Ppn1/3P1Q1P/2P2BP1/R3K2R w KQ - 3 23,c5a6 b7a6,1065,198,-11,16,equality middlegame oneMove,https://lichess.org/rZimQmO8#45,
il88B,4rrk1/pp1n1pp1/3qb2p/8/8/3BnN1P/PP1N1PP1/R2Q1RK1 w - - 0 17,f2e3 d6d3,1095,84,100,189,equality hangingPiece middlegame oneMove,https://lichess.org/wnz42y9c#33,
ipn6e,4r1k1/pp2b1p1/3p1q2/2pP1N2/2P5/3Q4/PP4P1/4R1K1 w - - 2 27,f5e7 e8e7 e1e7 f6e7,1074,84,100,223,endgame equality short,https://lichess.org/kKpdWzLf#53,
ivzlD,6k1/5p1p/4p3/6PR/r2PpP2/2K5/p7/R7 w - - 0 34,h5h3 a4a3 c3c4 a3h3,1007,84,100,185,endgame equality rookEndgame short skewer,https://lichess.org/dfouZnhf#67,
iwqdq,r1b4k/ppp2rpp/1b6/6B1/3n4/2Q5/PP3PPP/RN2K2R w KQ - 0 14,e1g1 d4e2 g1h1 e2c3,1085,261,14,15,equality fork middlegame short,https://lichess.org/CrBDwWjZ#27,
jLPj4,2r2rk1/1p2bqp1/2nR1n1p/pN2p1p1/2P3P1/1P2PPB1/P1Q1N2P/2K4R b - - 0 19,e7d6 b5d6 f7e7 d6c8,1066,179,-43,22,equality fork middlegame short,https://lichess.org/KlD8yKVW/black#38,
jc7av,r2q1rk1/ppp2pp1/1b5p/1B1PB3/1P2n3/P6b/4NPP1/R2Q1RK1 b - - 0 17,h3g2 g1g2,1046,127,38,42,equality hangingPiece middlegame oneMove,https://lichess.org/2Q8XH3M8/black#34,
jnbAp,5nk1/p5p1/1pN5/2p2b2/6p1/2B5/PP6/K7 b - - 3 34,a7a5 c6e7 g8f7 e7f5,1055,166,-20,29,endgame equality fork short,https://lichess.org/hIROgFou/black#68,
jopnM,2b3k1/pr4pp/8/7r/3Pp3/4P1Q1/P1P2PP1/R3K3 w Q - 0 26,g3f4 h5h1 e1e2 h1a1,1042,127,100,52,endgame equality short skewer,https://lichess.org/yAglpbPM#51,
jr5Ee,7k/2R5/2B4p/1b6/2r5/2P3KP/6P1/8 w - - 1 41,c6b5 c4c7,1068,138,80,49,endgame equality hangingPiece oneMove,https://lichess.org/8trtwU9d#81,
kEEIn,8/5pp1/2k1p2p/4PP2/3K2P1/7P/8/8 b - - 0 43,e6f5 g4f5,1090,482,-100,1,endgame equality oneMove pawnEndgame,https://lichess.org/bTaLjS20/black#86,
kGp7c,rn1q1rk1/1b2bpp1/p3p2p/4P1PP/p2P4/5N2/PPPBQP2/2KR3R b - - 0 18,b7f3 e2f3 d8d5 f3d5,1086,209,67,21,equality middlegame short,https://lichess.org/QLFqGTnC/black#36,
kMzXY,6k1/pp5p/6pP/2pPp3/2P1n3/1P2r3/P3Br2/3KRR2 b - - 3 33,e4c3 d1d2 e3f3 f1f2,1084,134,86,42,defensiveMove endgame equality short,https://lichess.org/cYO1nQ4e/black#66,
kO1R6,r5k1/pp2n1p1/8/2pp2Q1/8/2PPKPP1/PP1NR2r/R1q5 b - - 6 28,h2e2 e3e2 c1a1 g5e7,1070,293,-50,8,equality middlegame short,https://lichess.org/ua4MTdHy/black#56,
l0CKd,8/5pk1/3b1r1p/p2p4/3n4/1Q5P/5PP1/2R3K1 w - - 0 35,b3d5 d4e2 g1h1 e2c1,1055,268,100,16,endgame equality fork short,https://lichess.org/PWEukLpq#69,
l1HCi,r1b2rk1/ppp3p1/4p2p/5p2/3n4/2NB4/PP3PPP/R3K1NR w KQ - 0 15,d3c4 d4c2 e1d2 c2a1,1068,239,9,25,equality fork middlegame short,https://lichess.org/6oJ2fizI#29,
l7DjO,r1b1k2r/2qn1p1p/2p1p1pP/1p1n4/p2PN3/P1P1BNbB/1PQ2P2/R4RK1 w kq - 0 17,e4g3 d5e3 f2e3 c7g3,1063,90,100,140,equality kingsideAttack middlegame short,https://lichess.org/fvxaeIKO#33,
lRiIv,8/8/3K4/3Q4/7r/6k1/8/8 w - - 4 64,d6e5 h4h5 e5e4 h5d5,1042,130,64,46,endgame equality queenRookEndgame short skewer,https://lichess.org/AceYCspv#127,
lx3SO,6k1/6p1/5p1p/ppp2P1K/4B2P/8/PP4P1/2r5 b - - 1 39,c1c4 e4d5 g8f8 d5c4,1089,285,0,9,endgame equality fork short,https://lichess.org/1DFdsW9M/black#78,
lzS3x,5k2/8/2p1q3/2PpPpQ1/1Pn2P2/3BP3/7P/5K2 w - - 0 43,g5f5 e6f5 d3f5 c4e3 f1e2 e3f5,1096,102,100,79,endgame equality exposedKing fork long,https://lichess.org/JSrC2X2U#85,
m3jl7,8/6p1/4p3/1k6/6PP/p1bK4/8/2N5 b - - 1 37,b5b4 c1a2 b4b3 a2c3,1007,121,100,71,endgame equality short,https://lichess.org/pmS96XPX/black#74,
mER3X,4r2k/ppR4p/6pB/8/3bB3/6P1/P3q2P/1Q5K w - - 3 32,e4g2 e2e1 b1e1 e8e1 g2f1 e1f1,1080,82,100,176,equality long middlegame,https://lichess.org/70c9Dv1l#63,
mGADt,r1bq1rk1/pp2npbp/2n3p1/2Pp4/3N4/2N1B3/PP2BPPP/R2Q1RK1 b - - 0 11,c6d4 e3d4 g7d4 d1d4,1090,99,100,82,equality opening short,https://lichess.org/LRpmAoY5/black#22,
mGQRx,4rk2/p4q2/8/1ppP4/4BQ2/2P2p2/PP6/2K1R3 w - - 3 34,f4f3 f7f3 e4f3 e8e1,1047,215,100,26,endgame equality short,https://lichess.org/A88sLqAa#67,
mQsHI,r4rk1/4bppp/1qp2n2/4p3/pp1pP2P/P2P3Q/1PPBB3/1NKR2R1 w - - 0 22,g1g7 g8g7 h3g3 g7h8,1030,113,65,79,equality hangingPiece middlegame short,https://lichess.org/1J4kJ9GK#43,
maOiv,6r1/p2p1k1p/1p1PpPrb/1Ppn2P1/P3N2P/8/1P2K3/3R1BR1 w - - 5 27,f1h3 d5f4 e2e3 f4h3,1084,134,82,45,equality fork middlegame short,https://lichess.org/Rt4h54Bs#53,
mjuhM,5k2/1p3p2/pNnpq1r1/4pp1p/1P2P2P/2P5/P2Q1P2/2KR3R w - - 0 21,d2d6 e6d6 d1d6 g6d6,1005,84,100,204,equality middlegame short,https://lichess.org/IAtGFCKd#41,
nDrQs,3r2k1/1p3p1p/p4p2/1B5P/6P1/P4n2/1P2N3/1K5R w - - 0 26,b5c4 f3d2 b1a2 d2c4,1014,87,100,164,endgame equality fork short,https://lichess.org/OmOgv1i7#51,
nZBFN,2r3k1/p4pp1/1b1q3p/3P1N2/8/8/P4PPP/1R1R2K1 b - - 0 26,d6f4 f5e7 g8h7 e7c8,1025,98,100,118,endgame equality fork short,https://lichess.org/PXLDWGQj/black#52,
nbfN7,rn2k2r/ppp3pp/2b1pq2/2b5/8/5NPP/PPPN1RB1/R1BQ2K1 b kq - 0 12,c5f2 g1f2,1019,289,100,18,equality oneMove opening,https://lichess.org/JTgGogpd/black#24,
o6teM,8/5kpp/8/3p4/r3p1P1/1N5P/2K2P2/8 b - - 2 39,f7e6 b3c5 e6e5 c5a4,1069,238,-60,14,endgame equality fork short,https://lichess.org/wuoDwtnI/black#78,
o7Mxn,6k1/p1q1bppp/4p3/3pP3/1r1N4/7P/P4PP1/3Q1RK1 b - - 3 21,c7e5 d4c6 e5c7 c6b4,1031,145,-25,40,endgame equality fork short,https://lichess.org/FAKacbdj/black#42,
oCqZ7,2r2rk1/4Qp1p/2Bn2p1/8/5p2/7P/P1q2PP1/3R1RK1 b - - 0 20,c8c6 d1d6 c6d6 e7d6,1084,84,100,162,equality middlegame short,https://lichess.org/unuEpN6Z/black#40,
oEACb,8/6kp/5p2/P1p5/8/1P4P1/2PN2br/3R1K2 w - - 1 39,f1g1 h2h1 g1g2 h1d1,1033,122,33,60,endgame equality short skewer,https://lichess.org/BiegVtom#77,
of8Mb,5rk1/7p/2p1p1p1/P2p4/8/1P6/3n1PPP/R4RK1 w - - 1 27,f1c1 d2b3 a1b1 b3c1,1045,216,100,24,endgame equality fork short,https://lichess.org/X8rHWEUn#53,
ofabO,2q3k1/6pp/4p3/p2nP3/P5Q1/8/1P4PP/R6K w - - 2 27,a1d1 d5e3 g4f3 e3d1,1033,151,41,35,endgame equality fork short,https://lichess.org/0I5MkiPe#53,
ouz36,6r1/8/8/p2P4/2p1kp1p/2P2R1P/P4K2/8 b - - 0 44,e4d5 f3f4,1039,238,33,21,endgame equality oneMove rookEndgame,https://lichess.org/0LrADUOQ/black#88,
p1IK5,5rk1/1p2bppp/p3p3/3pq3/2p1n3/1P2P2P/P1P2PP1/R2RQ1K1 b - - 0 19,e7b4 e1b4,1027,182,14,37,equality hangingPiece middlegame oneMove,https://lichess.org/mhAQERXz/black#38,
pCoCS,5k2/R5R1/1p3rpp/1Pp5/2P4q/3p3P/3Q1P1K/8 w - - 5 48,g7h7 f6f2 d2f2 h4f2,1078,149,100,41,endgame equality fork short,https://lichess.org/SXHmR3mN#95,
pGpup,5k2/8/p3rPpp/2N5/3p4/1P1Pn3/4R2K/8 b - - 5 52,e6f6 c5d7 f8g7 d7f6,1000,110,100,90,endgame equality fork short,https://lichess.org/ikBRmoKk/black#104,
pOPC2,r2q1rk1/bpp2pp1/p2p4/3bp1BQ/1PB5/P5P1/2n2P1P/R3R1K1 b - - 1 20,d8d7 c4d5,1003,126,67,45,equality hangingPiece middlegame oneMove,https://lichess.org/gs1SpsmB/black#40,
pqL53,r4rk1/p4ppp/p1pR4/8/3B4/5Q2/qPP2PPP/2K4R w - - 0 15,f3c6 a2a1 c1d2 a1h1,1082,98,100,103,equality middlegame short skewer,https://lichess.org/31vYowaV#29,
psTcL,3q2k1/5p1p/3b2p1/8/P4Q2/1P3B1P/5PP1/1R4K1 w - - 0 36,f4d4 d6h2 g1h2 d8d4,1076,134,69,51,discoveredAttack endgame equality short,https://lichess.org/8uB4U0un#71,
pvxyJ,r5k1/5R1p/2p1p1p1/p1NpP3/6b1/2P4R/PP6/2K5 b - - 0 31,g8f7 h3h7,1007,226,-11,22,endgame equality oneMove,https://lichess.org/eHGid7Pq/black#62,
q1Xvr,8/p7/1p4k1/2p1K3/6P1/3P1n2/PP6/5R2 w - - 7 49,e5e4 f3d2 e4d5 d2f1,1069,116,100,63,endgame equality fork short,https://lichess.org/56fR9crh#97,
qKKYw,6k1/2q1b1pp/2bppn2/1pp4N/4PB2/1P1P2NP/rP4P1/3Q1RK1 w - - 4 22,h5f6 e7f6,1001,154,100,50,equality middlegame oneMove,https://lichess.org/wyb7UHAK#43,
qZmlK,2r3k1/p2r2p1/1p2N2p/n2QPp2/qR3P2/P7/2P3PP/R5K1 b - - 2 23,d7d5 b4a4,1082,197,100,25,equality hangingPiece middlegame oneMove,https://lichess.org/ikokVXCn/black#46,
qaB95,rnb1k1nr/ppp2p2/3p1q2/8/2B1P1P1/2PP4/PP5p/RNQ2R1K b kq - 1 14,f6g6 c4f7 g6f7 f1f7,1059,80,100,229,attackingF2F7 equality fork middlegame short,https://lichess.org/vCILRdrq/black#28,
r25Dv,5rk1/pppn2pp/4p3/8/3P1P2/1Pn1P2P/P5P1/R3NRK1 w - - 0 22,a1c1 c3e2 g1h2 e2c1,1088,150,60,31,endgame equality fork short,https://lichess.org/M76IYKvx#43,
rIiW5,2kr1b1r/1pp1pppp/p1n5/8/3P2n1/P1NBB2q/1PPQ1P1N/R4RK1 w - - 2 15,h2g4 h3g4,1005,82,100,208,equality kingsideAttack middlegame oneMove,https://lichess.org/IQwmU0dR#29,
rN2IO,r2qn1k1/p2nb1pp/Q3p3/2ppP3/5r2/2N2N2/PPP2PPP/R4RK1 b - - 1 14,c5c4 a6e6,1041,86,75,119,equality kingsideAttack middlegame oneMove,https://lichess.org/Py0MFgL4/black#28,
rOgVu,8/8/8/p5p1/P4p1k/7P/6K1/8 b - - 3 50,g5g4 h3g4 h4g4 g2f2,1099,103,88,76,defensiveMove endgame equality pawnEndgame short,https://lichess.org/ItfCJCuh/black#100,
rze0o,7r/2b2p2/p4k2/3p2n1/2p3r1/P1P1N1P1/1P3P2/R4RK1 b - - 4 31,g4e4 e3d5 f6f5 d5c7,1021,100,93,100,equality fork middlegame short,https://lichess.org/Ee3i8f6k/black#62,
s0OUa,rn1q1rk1/3p1pb1/5P1p/3b2pN/2p5/4Q3/4N1PP/5R1K b - - 0 25,g7f6 h5f6 d8f6 f1f6,1006,84,100,217,equality fork middlegame short,https://lichess.org/r3SvqBEK/black#50,
s7wuS,N1bk1b1r/3p2p1/p5B1/1pp1p3/3nP1n1/3P4/PPP2PPP/R1BK2NR w - - 1 13,h2h3 g4f2 d1d2 f2h1,1011,85,86,167,equality fork middlegame short,https://lichess.org/EABa8F1m#25,
sAWLt,8/2R5/p7/3p1p2/1P2b1p1/Pk2K1P1/8/2B5 w - - 0 49,c7c6 d5d4 e3d4 e4c6,1057,91,78,125,discoveredAttack endgame equality short,https://lichess.org/OZvzVLrq#97,
sXP2a,4k2r/pp1r1pp1/1qpPP1bp/6N1/4Q3/2P3P1/PP1R3P/1K5R w k - 1 26,e6d7 e8d7 h1f1 g6e4,1022,82,100,235,equality middlegame pin short,https://lichess.org/Q4ocby09#51,
sqZ1V,3r4/6pk/p4p1p/8/r3P3/5P2/1R1p1BPP/3R2K1 w - - 0 32,b2d2 d8d2 d1d2 a4a1 f2e1 a1e1,1068,80,100,240,endgame equality long,https://lichess.org/soX5Cxcx#63,
t2FE7,6k1/5r2/6p1/4Q1Pp/7P/6K1/8/8 w - - 6 50,e5f6 f7f6 g5f6 g8f7,1050,131,100,45,endgame equality short,https://lichess.org/8AbcB3GI#99,
tC0PR,r3k1r1/ppp3pp/1b3p2/8/1n2P3/N4N2/P1P2PPP/R1B1K2R w KQq - 0 13,a3c4 b4c2 e1d2 c2a1,1028,194,43,26,equality fork middlegame short,https://lichess.org/5t7B3Hci#25,
tFuKo,r3k2r/pb2bppp/1pn1pn2/1Bq5/3N4/2N3B1/PPP2PPP/R2Q1RK1 w kq - 6 14,b5c6 b7c6 d4c6 c5c6,1069,110,60,69,equality middlegame short,https://lichess.org/zRpqFWU4#27,
tZ5HP,r2qk1nr/pbppppbp/1p4p1/n7/2BPP3/2N2N2/PPP2PPP/R1BQ1RK1 w kq - 4 7,c4f7 e8f7,1057,251,-33,17,equality hangingPiece oneMove opening,https://lichess.org/wFUl6ScR#13,
tubCB,4b3/1p2B1Rp/p1k5/3p4/3P4/q1PK4/8/8 b - - 5 35,e8g6 g7g6 h7g6 e7a3,1088,97,60,80,endgame equality short,https://lichess.org/V0Yiikh7/black#70,
uDg5l,rr4k1/pR3ppp/P3p3/P1ppP3/5P2/2P5/3N1KPP/8 b - - 0 22,b8b7 a6b7 a8b8 a5a6,1072,80,100,199,advancedPawn endgame equality short,https://lichess.org/X8dNXJ2M/black#44,
uXZOW,r1bqk2r/pp2p3/2n2ppb/2Qp3n/7R/3PPPp1/PPPB2P1/RN2KB2 b Qkq - 2 15,b7b6 c5c6,1061,86,100,147,equality hangingPiece oneMove opening,https://lichess.org/H0ksTbIr/black#30,
uZVXm,r3r1k1/1pp1qp1n/p1pb3B/6p1/4PN2/3P2QP/PPP3P1/4RR1K w - - 0 22,e4e5 d6e5 e1e5 e7e5,1072,128,92,44,equality middlegame short,https://lichess.org/nX7fJENN#43,
