PuzzleId,FEN,Moves,Rating,RatingDeviation,Popularity,NbPlays,Themes,GameUrl,OpeningTags
00XCT,6Q1/7K/2k5/3r4/8/8/8/8 w - - 5 82,h7h8 d5h5 g8h7 h5h7,1044,80,100,265,endgame equality queenRookEndgame short,https://lichess.org/I94rnuWS#163,
02tXM,rnbq1rkb/ppp1pp1n/7P/3p2p1/3P4/2PBPN2/PP3PP1/RN1QK2R b KQ - 4 11,f7f6 d3h7,1028,80,100,281,equality kingsideAttack oneMove opening,https://lichess.org/WyNuC84y/black#22,
03rlt,8/pp6/2p4N/4k3/PPP3p1/3B1p2/6rP/4K3 b - - 0 39,g2h2 h6g4 e5d4 g4h2,1049,114,92,88,endgame equality fork short,https://lichess.org/gKfrkV8O/black#78,
0CCu2,8/7p/bp4p1/p1pk1p2/P3rP2/1P1pRKPP/3R4/8 b - - 9 42,e4e3 f3e3 c5c4 b3c4,1060,121,52,56,endgame equality short,https://lichess.org/llVliIGJ/black#84,
0EjC6,r2qk2r/pbpnbpp1/1p2p2p/3pN3/Q1PP4/2N1P3/PP3PPP/R3KB1R w KQkq - 2 11,e5d7 d8d7 a4d7 e8d7,1034,83,100,244,equality opening short,https://lichess.org/jnHYLuFB#21,
0RjAw,r3k2r/p1ppnppp/bp6/2b3q1/3NPn2/1BP1B3/PP1R1PPP/RN1Q2K1 w kq - 8 13,e3f4 g5f4,1076,269,0,12,equality middlegame oneMove,https://lichess.org/vSOThXqa#25,
0Z3uQ,2krr3/ppp3pp/2p5/4p3/3P1P2/2N1K1PP/P1b3B1/R6R w - - 0 23,d4e5 d8d3 e3e2 d3c3,1063,144,47,34,equality fork middlegame short,https://lichess.org/Bir8M7hS#45,
0stES,rnbq1rk1/ppp1b1p1/4p2p/5pB1/3P3P/3Q1N2/PPP2PP1/2KR1B1R w - - 0 11,g5h6 g7h6,1072,87,94,159,equality hangingPiece oneMove opening,https://lichess.org/XL5dpwuA#21,
123aK,8/6kp/6p1/4qp2/8/PNPBp1P1/1P5P/4R1K1 w - - 1 37,b3d2 e3d2 e1e5 d2d1q,1094,169,29,29,advancedPawn endgame equality promotion short,https://lichess.org/nRKuUkwu#73,
1zaL6,2r3k1/2r2ppp/1p1bpn2/qP1p4/3P4/1Q2P1P1/1B1n1PBP/RN3RK1 w - - 1 20,b1d2 a5d2,1036,102,100,80,equality middlegame oneMove,https://lichess.org/5uJOYCKd#39,
2JbV6,rn2q2k/5p1p/p5p1/3PN3/5n2/PQ5P/B4PP1/2R2RK1 w - - 2 31,b3c3 f4e2 g1h1 e2c3,1086,81,100,226,equality fork middlegame short,https://lichess.org/iemHLqRU#61,
2i212,8/pBb1r3/P1P4P/3Kp1R1/4Pp2/5k2/8/8 w - - 0 56,h6h7 e7h7,1039,82,100,210,endgame equality oneMove,https://lichess.org/y0l2YIyP#111,
2o3Mj,8/p4p1p/7k/1p2pp2/2br3P/P3N1P1/5P2/R5K1 b - - 1 29,f5f4 e3f5 h6g6 f5d4,1072,80,100,226,endgame equality fork short,https://lichess.org/nlchTAuQ/black#58,
2rKsY,8/5pk1/1R2r1p1/PQ3r1p/7P/6P1/5PK1/8 w - - 9 46,a5a6 f5b5 b6b5 e6a6,1098,113,29,62,capturingDefender endgame equality short skewer,https://lichess.org/cmv2Jfpa#91,
2svGU,r3k3/pppq1rBQ/2b1p1p1/4Pp2/3Pp3/2P5/PP4PP/R4RK1 b q - 0 20,f7g7 h7h8 e8f7 h8a8,1016,140,47,42,equality middlegame short skewer,https://lichess.org/Lb7lqbLx/black#40,
36bW6,r2q1rk1/1p3pp1/4b2p/p1ppP3/4n3/PQP3P1/4PPBP/R1BR2K1 w - - 3 15,g2e4 d5e4,1044,82,100,232,equality middlegame oneMove,https://lichess.org/GbkCXIGt#29,
3Y54s,5rk1/p4ppp/Br2p3/2pp3q/5Pn1/P6P/2N3P1/R1Q2RK1 b - - 0 24,b6a6 h3g4,1053,124,100,55,equality middlegame oneMove,https://lichess.org/RlHVV0JR/black#48,
3ghgO,r1bq1b1r/pp1kpBpp/1n1p4/8/3n2Q1/3P4/PPP2PPP/RN2K1NR b KQ - 2 11,d7c7 g4d4,1021,85,100,212,equality hangingPiece oneMove opening,https://lichess.org/W5AaEtgT/black#22,
3ksxn,8/8/6n1/3B1R1p/3kP1pP/n7/4K1P1/8 w - - 17 67,f5h5 g6f4 e2f2 f4h5,1019,251,25,22,endgame equality fork short,https://lichess.org/sxhcQJ0b#133,
3xeEP,4r1k1/p1p2pbp/4rnp1/8/1PNP4/BQP4P/P3qPP1/R4RK1 w - - 7 20,f1e1 e2e1 a1e1 e6e1,1010,137,85,40,equality kingsideAttack middlegame short,https://lichess.org/xSzvj5CT#39,
4Ebyv,1rb2rk1/p4ppp/4pqn1/3pb3/N7/PP4P1/1BP2P1P/1R1QRBK1 w - - 3 18,b2e5 g6e5,1090,473,-100,1,equality oneMove opening,https://lichess.org/NSgT9FAq#35,
4FD24,8/5p1k/3B2pp/p1p5/b7/q6P/P1Q2PP1/3R2K1 w - - 2 30,d6c5 a4c2 c5a3 c2d1,1054,269,-71,13,endgame equality short,https://lichess.org/GlY14neZ#59,
4M5Vg,5k2/6bp/3R2p1/1p3p2/8/1R3B1P/5PP1/2r3K1 w - - 2 42,g1h2 g7e5 g2g3 e5d6,1065,83,100,215,endgame equality fork short,https://lichess.org/ETHFWOpE#83,
4Ufk4,r7/pbp1B2k/1p1pB2p/3Pn1p1/8/2N4P/PP6/2K1R3 w - - 2 33,e7f6 e5d3 c1d2 d3e1,1034,123,100,58,equality fork middlegame short,https://lichess.org/KwzVRUq2#65,
4Yhlp,8/pR6/2pk4/7p/5p2/2R2P2/Pn2rr2/6K1 b - - 7 41,f2f3 c3f3,1087,109,68,97,endgame equality hangingPiece oneMove,https://lichess.org/5o7m2uBr/black#82,
5WOoO,3rb1k1/p4ppp/2P1p3/PP2q3/3r4/7P/2QB1PP1/1R1R2K1 w - - 0 31,d2c3 d4d1 b1d1 d8d1 c2d1 e5c3,1050,81,100,191,equality long middlegame,https://lichess.org/yKw1GGqM#61,
5g8n1,4n1R1/3k2p1/7p/1P6/5PP1/5K2/8/8 w - - 3 46,f3e4 e8f6 e4f5 f6g8,1088,80,100,218,endgame equality fork short,https://lichess.org/H8GDs9J9#91,
5nrJ4,r2q2k1/pp3ppp/2p5/2bn4/3n3r/3B2P1/PP5P/R1BQ1R1K b - - 0 18,h4h5 d1h5,1059,80,100,239,equality hangingPiece middlegame oneMove,https://lichess.org/v0Smqlzh/black#36,
5uO4a,r6r/3k1p1p/2pBq1p1/1p1pPp2/3P4/1RPQ3P/2P2PP1/6K1 b - - 0 23,h8b8 d6b8,1099,105,100,82,endgame equality oneMove,https://lichess.org/eUq2Ujdw/black#46,
65iEZ,8/3n4/2p5/2P5/1P2p3/2K1P3/Q4k2/6q1 b - - 1 52,f2e3 a2d2 e3f3 d2d7,1078,176,100,40,endgame equality fork short,https://lichess.org/VQQcn5og/black#104,
69aXv,8/5K2/B4p2/5PbP/8/2kp4/8/8 w - - 0 74,a6d3 c3d3 h5h6 g5h6,1033,92,91,125,bishopEndgame endgame equality hangingPiece short,https://lichess.org/PDA5bWqv#147,
6GsDq,8/5RK1/6p1/3k3p/7r/8/8/8 b - - 0 51,g6g5 f7f5 d5e4 f5g5,1096,94,67,96,endgame equality rookEndgame short,https://lichess.org/k69VSuNB/black#102,
6WwHm,8/6k1/8/6P1/5K2/6P1/8/8 w - - 3 59,g3g4 g7g6 f4e3 g6g5,1019,206,100,29,endgame equality pawnEndgame short zugzwang,https://lichess.org/P5XfZWkS#117,
6cfjJ,r4rkb/1p1b1p1n/1q1p3P/p1pPp1p1/P1P1P1N1/2B2Q2/1P6/RN2K2R b KQ - 2 21,d7g4 f3g4,1005,103,78,90,equality middlegame oneMove,https://lichess.org/xLqYWt5G/black#42,
751W9,8/6k1/1ppn1pP1/5b2/1PPK1N1P/3B4/8/8 w - - 5 48,d3f5 d6f5 d4d3 f5h4,1023,84,100,217,endgame equality short,https://lichess.org/2wNuQnEJ#95,
78vuO,rn4k1/pp3rpp/2pQ4/8/8/3Pq3/PP4PP/R4R1K b - - 1 24,b8d7 f1f7 g8f7 d6d7,1069,133,14,47,attraction capturingDefender equality middlegame short,https://lichess.org/BAlb3IaJ/black#48,
7SpTA,8/1rp2kp1/p1Nr1p2/P2p1b1q/1P1P1PRp/2Q1PK1P/6P1/2R5 b - - 4 32,f5g4 h3g4,1008,125,100,63,equality middlegame oneMove,https://lichess.org/FVogE8Vq/black#64,
7ZrkQ,r4rk1/p5b1/1p1p4/3PpBn1/6pp/4N1B1/PP3P2/R4RK1 w - - 0 29,g3h4 g5f3 g1h1 f3h4,1015,89,100,151,equality fork middlegame short,https://lichess.org/Zw8SnhgU#57,
7vF5t,8/R7/5k2/p4p1r/7P/2P1K1P1/PP4P1/8 w - - 2 45,a7a5 f5f4 g3f4 h5a5,1079,83,100,230,discoveredAttack endgame equality rookEndgame short,https://lichess.org/us0Zy9Cb#89,
85RNQ,2kqr2r/pp3p2/2pb3p/3p4/B2P1pb1/P1NQ1P2/1PPK3P/R6R b - - 0 20,g4h5 d3f5 c8b8 f5h5,1034,81,100,236,equality fork middlegame short,https://lichess.org/6MTAtKal/black#40,
88fwU,Q7/1pp2ppk/7p/5b2/2B5/1P3N1P/4nPPK/3q4 w - - 5 31,c4e2 d1e2,1082,93,94,95,endgame equality oneMove,https://lichess.org/unwx4b9x#61,
8RKYs,r1br2k1/pp2R1pB/7p/6N1/3p4/8/PPP2PPP/6K1 b - - 1 20,g8h8 g5f7 h8h7 f7d8,1055,93,100,136,endgame equality fork short,https://lichess.org/KCyFWEil/black#40,
8WYOX,5rk1/2q2pbp/Qrp1p1p1/3pPn2/P2P4/5N2/1P1B1PPP/1RR3K1 w - - 3 23,d2a5 b6a6,1028,82,100,201,equality hangingPiece middlegame oneMove,https://lichess.org/yx4r4f3P#45,
8c9F2,5r1k/4N2p/p7/8/PP5R/r7/6K1/8 b - - 7 40,a3a4 e7g6 h8g7 g6f8,1002,83,100,200,endgame equality pin short,https://lichess.org/E09IhAe4/black#80,
8tawj,r1r3k1/pp1bnppN/4p2B/2P1P3/n1P5/P2B4/5PPP/R4RK1 b - - 0 21,g7h6 h7f6 g8g7 f6d7,1027,154,-20,35,equality fork middlegame short,https://lichess.org/dZewaAHd/black#42,
8zujY,7r/1p2kp2/p1p1p1r1/N1PpP2p/1PnPp2P/7R/5PP1/2R2K2 b - - 1 29,c4a5 b4a5,1087,80,100,222,endgame equality oneMove,https://lichess.org/MNPEYbto/black#58,
95fGZ,5bk1/4rpp1/5p1p/3Qp3/3P3q/8/1P1N2P1/1rB2RK1 b - - 5 35,h4d4 d5d4 e5d4 d2b1,1068,79,100,229,equality middlegame short,https://lichess.org/fCcRAN0Y/black#70,
98wJb,r1k5/pp6/8/3R1P1p/3Pn3/2P5/P5K1/8 b - - 0 31,e4c3 d5c5 c8d7 c5c3,1045,170,60,17,endgame equality fork short,https://lichess.org/yg7ThnSj/black#62,
9M6VG,rn1qr3/ppp2k1p/5bp1/3b2P1/5Q2/8/PPPP1P1P/RNBK2R1 b - - 0 15,e8e4 f4f6 d8f6 g5f6,1042,195,-33,18,equality middlegame short,https://lichess.org/FNRhb7B0/black#30,
9miWJ,6k1/R6p/6p1/P7/1b6/6PP/5P2/6K1 w - - 1 34,f2f4 b4c5 g1g2 c5a7,1007,201,45,22,endgame equality fork short,https://lichess.org/cT8qcYYu#67,
9z9Fj,r1b2k1r/pp1pppNp/2n2np1/8/4P3/2N1BP2/PqP3PP/R2QKB1R w KQ - 1 10,e3h6 b2c3,1048,84,100,171,equality hangingPiece oneMove opening,https://lichess.org/pQHHuq94#19,
9zoez,8/8/2kr3p/3p2p1/P5r1/1R1B4/3K2P1/8 b - - 0 46,g4a4 d3b5 c6c5 b5a4,1038,81,100,220,endgame equality fork short,https://lichess.org/jEtyGJOO/black#92,
A0N5G,8/8/p5k1/3P4/1p6/bP1PK3/8/R7 w - - 0 39,e3d4 a3b2 d4c5 b2a1,1096,228,50,20,endgame equality fork short,https://lichess.org/NekvVBTP#77,
AJers,8/6pp/8/2pkP3/2N5/1pK5/2b3PP/8 b - - 7 41,c2d1 c4e3 d5e5 e3d1,1040,84,100,209,endgame equality fork short,https://lichess.org/J1QJLFFf/black#82,
AKZxL,8/1p2k3/p2pN2q/6p1/3pP1Q1/3P3P/PPPb2P1/6K1 w - - 2 26,e6d4 d2e3 g1h1 e3d4,1005,95,100,117,endgame equality fork short,https://lichess.org/2251Dqev#51,
AQWVe,8/2p2r2/1p4kp/p1bP2p1/2P1R3/1PB3P1/P5KP/8 w - - 1 44,g3g4 f7f2,1023,89,88,158,endgame equality oneMove,https://lichess.org/r7oOnV17#87,
AZMtS,rnbqk1r1/ppp2pPp/8/8/Qb6/2p2N2/PB1N1PPP/R3K2R b KQq - 1 11,c7c6 a4b4,1077,80,100,234,equality hangingPiece middlegame oneMove,https://lichess.org/86LX4Vlp/black#22,
AbqQm,r1bq1r2/p2np1k1/6p1/2pnNp1p/7P/3B1N2/P1PP1PP1/R2Q1RK1 w - - 1 16,e5g6 g7g6,1038,134,87,45,equality hangingPiece middlegame oneMove,https://lichess.org/6FyowBNQ#31,
AeoMl,2q2r2/5p2/p5k1/5b1p/2p1Q3/2R2P2/P5P1/4R1K1 w - - 1 40,c3c4 f5e4 c4c8 f8c8,1054,116,100,74,endgame equality short,https://lichess.org/VcTn1Eq1#79,
AuIyg,r3r1k1/1q2bp2/1p2p1p1/2p1N2n/p1P1nB1P/P2BPN2/1P2QP2/2K3R1 w - - 3 23,d3e4 b7e4,1054,79,100,236,equality middlegame oneMove,https://lichess.org/j6w8ThgU#45,
AwiTa,8/6k1/6p1/8/4r2P/8/3Kp3/4R3 b - - 3 45,e4h4 e1e2,1019,274,-33,15,endgame equality oneMove rookEndgame,https://lichess.org/i01GvYt5/black#90,
AzxQo,6k1/3r2pp/5p2/B1P5/3nP3/1R5P/5PP1/6K1 w - - 2 33,b3d3 d4e2 g1f1 d7d3,1071,82,100,221,discoveredAttack endgame equality short,https://lichess.org/zuBOEhtL#65,
B52zG,r3r1k1/pb2P1pp/8/3q1p2/3P1P2/4Q3/2R3PP/2R3K1 b - - 0 33,b7c8 c2c8 a8c8 c1c8,1098,139,100,40,equality middlegame short,https://lichess.org/bCblUZGj/black#66,
B9mR8,8/pp1b4/1kpNp3/3n4/8/1P6/r6P/2R3K1 b - - 5 38,a2b2 d6c4 b6b5 c4b2,1032,107,100,76,endgame equality fork short,https://lichess.org/bbBab2m6/black#76,
BAgHx,8/8/2r5/6P1/k1n5/6K1/1p6/1R6 b - - 0 54,c4d2 b1b2,1076,81,100,223,endgame equality oneMove,https://lichess.org/LqjOsRdU/black#108,
BBWNj,7r/pp2k3/3p1n2/4p3/P3b3/R7/1P1P1P1p/2B1KB1R w - - 2 25,h1h2 h8h2,1040,141,67,40,equality hangingPiece middlegame oneMove,https://lichess.org/xiDLhtoG#49,
BDvo4,1q1r3r/2k3pp/pp3pbn/8/2P1n3/PQBP3P/4BPP1/1R2R1K1 b - - 1 25,e4c3 b3c3,1094,89,100,123,equality middlegame oneMove,https://lichess.org/M1sGukZt/black#50,
BRiY1,r3kb1r/1Q3ppp/p1nqb3/2pR4/8/5N2/PP2NPPP/R1B3K1 b kq - 0 14,d6d5 b7a8 c6d8 a8d5,1090,482,-100,1,equality hangingPiece middlegame short,https://lichess.org/PTEc62JB/black#28,
BlFAL,5rk1/5ppp/p2P4/3pR2b/2pr1B2/6P1/8/2R4K b - - 0 34,f7f6 e5h5,1021,156,43,49,endgame equality hangingPiece oneMove,https://lichess.org/M53NFUP6/black#68,
C4Vn1,8/p5k1/1pB1p3/2r2p1R/2p5/2P1PP2/PP1K4/8 w - - 4 36,c6d7 c5d5 d2e2 d5d7,1005,83,100,209,endgame equality fork short,https://lichess.org/d5OPqaMy#71,
ChIQG,8/6p1/3k4/2R3P1/1p5p/2bB3P/P1P1K1b1/8 w - - 10 47,c5c3 b4c3,1059,212,-33,17,endgame equality hangingPiece oneMove,https://lichess.org/MSoBDTTB#93,
DL53C,8/8/8/5K2/7p/2N4P/5P2/2k1n1r1 b - - 1 57,e1d3 c3e2 c1d2 e2g1,1030,96,100,112,endgame equality fork short,https://lichess.org/T2LnJakk/black#114,
DUMXc,6k1/p1p2pp1/7p/8/N7/PP5P/2r1rPP1/5RK1 b - - 1 27,c2a2 a4c3 e2c2 c3a2,1027,106,66,72,endgame equality fork short,https://lichess.org/QTug6Bvf/black#54,
DaufX,1r1k2r1/2q2pp1/1p3n2/3p1bN1/1Q1P4/2nB1N2/PP2R1P1/1K2R3 w - - 0 33,b2c3 f5d3 b1a1 d3e2,1087,82,100,201,equality fork hangingPiece middlegame short,https://lichess.org/QtEnHzjE#65,
DqbSk,2r2rk1/p2q1bpp/n1p5/2P2p2/2PN2n1/3P2P1/PQ1B1PBP/R4RK1 w - - 1 22,b2a3 d7d4,1066,157,33,39,equality hangingPiece middlegame oneMove,https://lichess.org/k3rDVj0C#43,
Dqezk,r6k/b3r1pp/p2R4/1p2Bp2/1P6/P3P3/5PPP/4R1K1 w - - 2 26,e1d1 e7e5,1030,96,100,126,endgame equality hangingPiece oneMove,https://lichess.org/EsnvHZk2#51,
E3XxD,8/5p1p/p2k4/2b2p2/2P1r2P/5KP1/P2R4/8 b - - 1 41,d6e5 d2d5 e5f6 d5c5,1073,161,20,29,endgame equality fork short,https://lichess.org/TBI29zfg/black#82,
ECajn,5k2/7p/5P2/p1pK2P1/2P1B3/4r3/8/8 b - - 2 51,e3e4 d5e4,1073,154,20,37,endgame equality hangingPiece oneMove,https://lichess.org/PIW0WESQ/black#102,
EEd74,1r6/5kr1/4p1p1/qP1pQ1Rp/2pP1P1P/2P2K2/1R6/8 w - - 11 48,e5b8 a5c3 f3g2 c3b2,1007,117,100,94,endgame equality fork short,https://lichess.org/5klkZH6P#95,
ENqw8,r2q1rk1/pppnbpp1/3p1n1p/5N2/4P3/2N5/PPP2PPP/R1BQ1RK1 w - - 4 10,f5h6 g7h6,1024,147,100,40,equality oneMove opening,https://lichess.org/Y6DoxZlV#19,
EgLrK,r1b1k2r/pp5p/3q1pp1/3Nb3/3p4/4B3/PPQ2PPP/2KR1B1R w kq - 2 17,d5c7 d6c7 c2c7 e5c7,1093,200,0,22,equality opening short,https://lichess.org/iyMarVrZ#33,
Eo221,2r4k/p3R1p1/1p6/3P3p/3B1n2/P1P5/5PPP/6K1 w - - 0 27,e7g7 f4e2 g1f1 e2d4,1077,109,100,83,endgame equality short,https://lichess.org/ntiRynez#53,
Eu95L,r2q1rk1/p1p1bp1p/1nQp3p/4p3/2BPP1b1/2P2N2/PP3PPP/RN2K2R b KQ - 4 10,b6c4 c6c4 g4f3 g2f3,1027,162,-14,38,equality opening short,https://lichess.org/eu385Y9n/black#20,
F4E6R,5rk1/6pp/8/6P1/1pR4n/8/1PP5/1K6 b - - 1 33,f8b8 c4h4,1026,85,100,218,endgame equality hangingPiece oneMove,https://lichess.org/xiOOS5t5/black#66,
FJqHD,3q1rk1/1p1npp1p/3p2pB/1p1Pb3/4R2N/P1r3P1/5PBP/3Q2K1 b - - 2 24,e5g7 h6g7,1044,152,80,45,equality middlegame oneMove,https://lichess.org/QHeK1B2p/black#48,
FccCI,r2q2k1/1p1b1pb1/p1p1pRp1/4P3/2BPP1Q1/2P5/P5PP/R5K1 w - - 2 18,f6g6 f7g6 c4e6 d7e6,1017,254,14,11,equality middlegame short,https://lichess.org/nNaQRV2a#35,
Fftz8,8/8/1r4k1/5np1/P2BN3/5P2/1P4KP/3R4 w - - 1 46,d4c3 f5e3 g2g3 e3d1,1015,128,100,61,endgame equality fork short,https://lichess.org/O6NLetXz#91,
Fl6fD,rnb1kb1r/1pqn1ppp/p2pB3/6B1/3NP3/3Q4/PPP2PPP/RN3RK1 b kq - 0 9,f7e6 d4e6,1004,81,100,218,equality oneMove opening,https://lichess.org/vfDdtvAe/black#18,
FtLuh,r1b1r1k1/1p1p1pp1/p1nBp2p/4P3/P4n2/2q2N2/2B2PPP/R3QRK1 w - - 0 17,e1c3 f4e2 g1h1 e2c3,1065,184,50,31,equality fork middlegame short,https://lichess.org/dy6O8Ixo#33,
Fu8TZ,5rk1/2p2p1p/1p4p1/p1n5/1bP5/4P1P1/5PBP/1R4K1 b - - 3 32,f8a8 g2a8,1003,116,45,66,endgame equality hangingPiece oneMove,https://lichess.org/aheYyrlj/black#64,
Fynif,r3n3/4k2p/2p5/4p1p1/Npb1Pp2/1P3P2/P2R1KPP/2N5 w - - 0 32,b3c4 a8a4,1064,149,73,47,endgame equality hangingPiece oneMove,https://lichess.org/U8RnKOYQ#63,
GQvue,r2qk1r1/1pp1npbp/p1n1p3/3pP2p/3P4/2PBBN1P/PP3P2/RN1QK1R1 w Qq - 2 12,e3h6 g7h6 g1g8 e7g8,1039,82,100,237,equality hangingPiece opening short,https://lichess.org/zZLa9ocB#23,
GXhyX,6k1/4Bpb1/7p/1N2P1p1/P3Bnq1/R4NPb/3Q1P2/2r3K1 w - - 0 33,d2c1 f4e2 g1h2 e2c1,1008,82,100,250,equality fork middlegame short,https://lichess.org/hvUbzu4u#65,
GXrKw,6k1/4qpp1/3P3p/5p2/b6P/2p3Q1/PpP3P1/1K1B4 b - - 0 32,e7e6 g3c3,1091,305,100,22,endgame equality oneMove,https://lichess.org/zhL1d468/black#64,
GcWqd,8/p4p2/1p1n2pp/3kp3/PP4P1/3KPP1P/8/8 b - - 0 42,d6c4 e3e4 d5d6 d3c4,1019,113,100,87,deflection endgame equality knightEndgame short,https://lichess.org/C3nunVDu/black#84,
GpLR4,r2qkbnr/pppn3p/5p2/4P1p1/2B2pbP/2N2N2/PPP3P1/R1BQK2R b KQkq - 0 9,g4f3 d1f3,1070,308,-100,2,equality oneMove opening,https://lichess.org/ScJZ5atz/black#18,
HBjqs,2r2rk1/1p1b2p1/p2p4/1P1Pp1q1/P3Pn2/2N2PPp/4BQ2/2R2RK1 b - - 2 26,c8c3 c1c3 f4e2 f2e2,1008,191,100,32,equality hangingPiece middlegame short,https://lichess.org/A4XXJUBM/black#52,
HCLCb,1r1r4/1pR2ppp/p7/4k3/3nPR2/PP4PB/7P/6K1 w - - 1 25,c7f7 d4e2 g1f2 e2f4,1078,116,70,66,endgame equality fork short,https://lichess.org/7zJvtMAB#49,
HLhHo,r3kbnr/ppp1pppp/6q1/1N1P1b2/8/5B2/PPn2PPP/R1BQ1KNR b kq - 1 9,c2a1 b5c7 e8d7 c7a8,1043,87,100,154,equality fork opening short,https://lichess.org/IZLtA2n3/black#18,
HgfsV,7r/p7/1p4k1/1P1p1b1B/P4p1R/1KP3r1/7R/8 b - - 0 57,h8h5 h4h5,1040,235,100,20,endgame equality oneMove,https://lichess.org/rYe0fVLf/black#114,
HgzLZ,1q2r3/4r1pk/p2p3p/2pB2b1/P1N1b3/1PR5/6PP/3QR1K1 w - - 0 37,d5e4 e7e4 e1e4 e8e4,1040,106,54,73,equality middlegame short,https://lichess.org/n5I19Ycs#73,
I1yZ4,5b2/1pk5/p5qp/Q1p5/5p2/P3P2P/1P2KPP1/8 b - - 1 30,c7b8 a5d8 b8a7 d8f8,1059,80,100,266,endgame equality fork short,https://lichess.org/dspGDjOV/black#60,
IEj3G,8/1K6/8/7R/8/6k1/6p1/8 b - - 0 53,g2g1q h5g5 g3f2 g5g1,1010,273,-33,10,endgame equality queenRookEndgame short skewer,https://lichess.org/KPPlE0a3/black#106,
IFtCJ,4q2k/1p4p1/p2p3p/6Q1/1P6/P6P/2b2PPK/R7 w - - 0 30,g5d2 e8e5 g2g3 e5a1,1031,145,100,51,endgame equality fork short,https://lichess.org/dPYHq6P1#59,
IITOP,8/8/1n2k2p/1p6/1B2KPP1/8/8/b7 b - - 0 52,b6d5 f4f5 e6f6 e4d5,1008,84,75,169,deflection endgame equality short,https://lichess.org/aHe4hj21/black#104,
IK8TY,8/8/1p4kP/p1p5/P1P1pKp1/1P6/8/8 b - - 2 48,g6h6 f4g4 h6g6 g4f4 g6f6 f4e4,1096,206,0,21,endgame equality long pawnEndgame,https://lichess.org/1D1272pq/black#96,
Igkxe,r2q3r/1pp2kb1/p6p/3pN3/3Qb3/2P3P1/PP2P1P1/R3KB1R b KQ - 2 17,g7e5 d4e5,1086,190,100,34,equality middlegame oneMove,https://lichess.org/JsIdUqmw/black#34,
Ijuzt,r1bqk2r/1p1p1ppp/p1n2n2/1N2p3/1b2P3/P1N5/1PPB1PPP/R2QKB1R b KQkq - 0 8,a6b5 a3b4 a8a1 d1a1,1095,492,-100,1,equality opening short,https://lichess.org/bj895N1x/black#16,
InZIq,r1bk2n1/ppp3b1/3p3q/1Q1Pp1p1/4PpP1/2PB1P2/PP2N1r1/R1BK1N2 b - - 7 20,g2g1 e2g1,1096,99,92,79,equality hangingPiece oneMove opening,https://lichess.org/nPTmGMrL/black#40,
Iri6p,8/2r1nkp1/2N2b2/PP2pp2/8/6Pp/3rNP1P/2R1R1K1 w - - 3 37,c6e5 f6e5 c1c7 e5c7,1053,81,100,199,equality hangingPiece middlegame short,https://lichess.org/hyHBuT5a#73,
JImcI,8/5R2/7k/2pB4/2N5/4PK2/2q2PPP/8 w - - 13 49,f7c7 c2f5 f3e2 f5d5,1086,251,-33,9,endgame equality fork short,https://lichess.org/nvX93BX8#97,
JKxZu,r3k3/1p2bp1p/p2p4/2p2b2/2P5/2N1PN2/P2PBPrP/R3K2R w KQq - 0 18,f3h4 e7h4,1053,81,100,232,equality hangingPiece middlegame oneMove,https://lichess.org/DnCHjxAd#35,
JmwFF,3k4/p5p1/5n1p/pN1p4/P2P1qp1/1P2rP1P/2PQ2P1/R6K w - - 0 28,a1e1 e3e1,1083,149,100,43,endgame equality kingsideAttack oneMove,https://lichess.org/ipMkK6JE#55,
Jnumz,2b3k1/1p3p2/p1p5/4q1p1/5p2/P2B4/1PP5/1K2R1R1 b - - 1 33,e5f6 e1e8 g8g7 e8c8,1076,81,100,232,endgame equality fork short,https://lichess.org/O8iygy7p/black#66,
JwBYM,r3kb1r/ppp2ppp/5n2/1N2n3/2q5/5R2/PPP1Q1PP/R1B4K w kq - 0 15,e2c4 e5c4,1088,256,0,17,equality middlegame oneMove,https://lichess.org/aqIc6eJw#29,
KC3ya,8/p4kp1/1bR4p/8/8/2P4P/P2r1PP1/4R1K1 w - - 1 29,a2a4 b6f2 g1f1 f2e1,1009,83,100,223,endgame equality fork short,https://lichess.org/2HMozxkj#57,
KDdGr,r1bk2nr/1pNp1pp1/p4q1p/4n3/3QP3/8/PPP2PPP/R1B1KB1R w KQ - 1 10,c7a8 e5f3 g2f3 f6d4,1091,488,-100,1,discoveredAttack equality opening short,https://lichess.org/9RnPlBww#19,
KDpNS,2k5/p4p1p/2p1r3/6p1/2p5/P3pP1P/1Pb1N1P1/4R1K1 b - - 4 30,f7f5 e2d4 e6d6 d4c2,1055,175,38,26,endgame equality fork short,https://lichess.org/uiVkaPdS/black#60,
KMDGY,r2q1rk1/1bppbppn/p1n4p/1p2P3/3P4/1B3N2/PP3PPP/RNBQR1K1 w - - 1 12,c1h6 g7h6,1060,262,0,12,equality hangingPiece oneMove opening,https://lichess.org/8EsGO1go#23,
KQEY7,r4rk1/p1qn3p/4b1p1/1p2P1N1/1PpP3Q/P1P5/3BK1P1/R7 b - - 0 33,h7h5 g5e6 c7c6 e6f8,1000,112,100,91,equality fork hangingPiece middlegame short,https://lichess.org/Ci4LvuJX/black#66,
KSX90,2rr2k1/p6p/6p1/2p5/2N1n3/5N2/P5PP/R4RK1 w - - 3 24,c4d2 e4d2 f3d2 d8d2,1076,102,100,97,equality middlegame short,https://lichess.org/FbNN8atR#47,
KjR1P,r5k1/2np4/1qp1prpp/p7/Pp1nN3/1B5Q/1PP1KPPP/3RR3 w - - 0 21,d1d4 b6d4 e4f6 d4f6,1021,84,100,227,equality middlegame short,https://lichess.org/UGSMoU57#41,
KkTsu,r2b1rk1/ppp2pp1/5n1p/q2p1N2/4P3/2PPQN1P/PP3PP1/R3K2R w KQ - 0 19,f5h6 g7h6,1009,101,100,118,equality middlegame oneMove,https://lichess.org/hFK71NBm#37,
Kpyf9,8/8/3P4/2K4p/2p3pP/4n1k1/8/8 b - - 0 53,g3f3 d6d7 g4g3 d7d8q,1073,98,81,114,advancedPawn endgame equality knightEndgame promotion short,https://lichess.org/4JQ3lwi1/black#106,
KqVmp,r4rk1/p2p1ppp/2p2B2/2n1q3/2Q1P3/2P5/P1P2PPP/R4RK1 b - - 0 15,e5f6 c4c5,1002,91,81,151,equality hangingPiece middlegame oneMove,https://lichess.org/6SHRNFz4/black#30,
Ku0RX,8/pp5k/5N2/2p2qBb/3p3P/8/PP4RK/8 b - - 4 39,h7h8 f6h5,1039,83,100,243,endgame equality hangingPiece oneMove,https://lichess.org/fmfYEVQq/black#78,
LDXVU,8/6pp/p1b2k2/1p2bP2/1Pp3R1/P6P/3K4/8 b - - 3 45,h7h5 g4g6 f6f5 g6c6,1026,134,88,44,endgame equality short skewer,https://lichess.org/ThUf2eP0/black#90,
LDzNu,6k1/pp3p2/3q2p1/6Pp/4P2P/3b1Q1B/6K1/8 b - - 3 37,d6e5 f3d3,1023,88,89,150,endgame equality hangingPiece oneMove,https://lichess.org/cLrVosad/black#74,
LHDfk,8/p1p1R3/5k1p/3b2p1/3R2P1/2n5/5P1P/6K1 w - - 1 34,e7c7 c3e2 g1f1 e2d4,1098,160,100,37,endgame equality fork short,https://lichess.org/V8AZL3P4#67,
LYH5r,8/4k3/1R6/1p2K3/4P3/P1P4r/1P6/8 w - - 1 46,b6b5 h3h5 e5d4 h5b5,1017,83,100,205,endgame equality rookEndgame short skewer,https://lichess.org/pz7mU5IP#91,
LbMcN,rnb1kb1Q/pp5p/4p1pB/2q5/2p5/2P5/P1P2PPP/R3K2R w KQq - 1 13,h6f8 c5f8,1038,93,100,160,equality middlegame oneMove,https://lichess.org/vmrT3bMr#25,
LcuLC,5r1k/5ppp/1q3n2/3N1Q2/8/8/5PPP/R5K1 b - - 0 28,f6d5 f5d5,1080,108,81,80,endgame equality oneMove,https://lichess.org/RfLkNeBJ/black#56,
LrQoa,r2q1rk1/1pN3bn/n2p4/p2Pp3/P3Ppp1/3N4/1PQ2BPP/2R2RK1 b - - 1 22,a6c7 c2c7,1063,208,83,20,equality middlegame oneMove,https://lichess.org/kl7U2rdm/black#44,
M4WSi,2r5/2P3p1/4kp2/7p/3K3P/P1R3P1/8/8 w - - 5 59,d4c5 c8c7,1075,201,-50,16,endgame equality oneMove rookEndgame,https://lichess.org/dov9CMYT#117,
M59AG,8/3r4/6k1/p1pp4/5PPp/1PPR1K2/P7/8 w - - 0 42,f4f5 g6g5,1054,133,41,39,defensiveMove endgame equality oneMove rookEndgame,https://lichess.org/V92gvuN5#83,
MAETc,r5k1/1p3pp1/7p/1Pqpp3/2b1P3/r6P/2Q3P1/1RR4K b - - 2 30,a3a1 b1a1 a8a1 c1a1,1002,137,67,53,equality middlegame short,https://lichess.org/UpODU4Gs/black#60,
MMJuy,1k5r/Npp1qpb1/Q3p2p/4P3/2P2n2/5N1P/P4PP1/3R2K1 b - - 0 26,b7a6 a7c6 b8b7 c6e7,1019,81,100,225,equality fork middlegame short,https://lichess.org/XnW2tRnc/black#52,
MNgdY,2kr2nr/1ppbq1bp/p1np1p2/1B4p1/3PPp1P/2N2N2/PPPBQ1P1/2KR3R w - - 0 12,b5c6 d7c6,1019,103,54,78,equality middlegame oneMove,https://lichess.org/ezka57Ju#23,
MOZIl,1r4k1/5ppp/2p1p3/3p4/qB1P4/p3P1P1/Q4PKP/1R6 w - - 0 28,b4a3 b8b1 a2b1 a4a3,1021,112,100,98,endgame equality short,https://lichess.org/PHAnuhpF#55,
Mcx89,4Nrk1/4Rpp1/1q3n1p/1p1pQ3/1Pp5/Pn3P1P/R5P1/7K b - - 13 35,f6e8 e7e8 f8e8 e5e8,1019,116,60,63,equality kingsideAttack middlegame short,https://lichess.org/XicBPq1g/black#70,
MehD1,r4rk1/3b1p1p/2p2p2/pp6/3PN3/6P1/4KPBP/2R5 b - - 0 21,a5a4 e4f6 g8h8 f6d7,1087,227,33,13,endgame equality fork short,https://lichess.org/GUuaNQKq/black#42,
MleBF,rn1qk2r/pp2bpQ1/2p1p2p/8/3Pn3/3B4/PPPB1PPP/R4RK1 b kq - 0 14,e4d2 g7h8,1025,86,89,210,equality hangingPiece middlegame oneMove,https://lichess.org/hpWR4Z4G/black#28,
MpCQq,r2qkb1r/ppp2ppp/4p3/3pP1n1/4P3/5P2/PPP1Q1PP/RNB1K2R w KQkq - 0 10,c1g5 d8g5,1025,84,89,195,equality middlegame oneMove,https://lichess.org/CeaLyksR#19,
NGnuo,r1b1k1nr/pppp1ppp/8/n3P3/2B1P3/1RB2N2/q1P2PPP/3QK2R w Kkq - 2 12,c3a5 a2a5,1046,80,100,248,equality middlegame oneMove,https://lichess.org/2sfvpZHM#23,
NNBNp,4rrk1/1p3pp1/p2bpqnp/2pp1P1R/8/N2P4/PPPB2PP/3Q1R1K b - - 0 21,g6f4 d2f4 d6f4 f1f4,1016,119,14,53,equality middlegame short,https://lichess.org/wLa0hjm7/black#42,
NkYHm,7k/1R2P1N1/7p/3p3P/b3r3/P7/5K2/8 w - - 1 38,g7f5 e4f4 f2g3 f4f5,1031,87,100,161,endgame equality fork short,https://lichess.org/5yD3cVxr#75,
O4379,r4r1k/pp4p1/2p4p/2Q5/2N4q/2P5/PP3PPP/5RK1 b - - 1 23,f8f5 c5f5,1025,83,91,191,endgame equality hangingPiece oneMove,https://lichess.org/vv2umpXG/black#46,
OCCV5,2bk3r/1p1n4/p3p2p/8/2B5/5P2/PPP4P/3RK2R w K - 0 21,c4e6 h8e8 e1f2 e8e6,1044,155,100,49,endgame equality pin short,https://lichess.org/9vKX0Tea#41,
OKwXe,2k5/p2n1r1b/2pp3P/1p6/3PNP1b/2P2Pr1/PP6/2KR2R1 b - - 1 24,g3f3 e4d6 c8c7 d6f7,1084,83,100,197,equality fork middlegame short,https://lichess.org/ygmx3vgZ/black#48,
OLAY7,4rrk1/1ppq1pp1/p2b1n2/3P4/4bPP1/P1N3QP/1P4BK/R1B2R2 w - - 1 22,c3e4 f6e4,1051,88,100,160,equality middlegame oneMove,https://lichess.org/KvaEOZLM#43,
OWhg1,2r5/4qkrp/pbR1pp2/3p1n2/QP1P4/4BN2/5PPP/5RK1 b - - 0 23,c8c6 a4c6,1053,168,100,41,equality middlegame oneMove,https://lichess.org/0PfJhDrQ/black#46,
ObT41,8/8/3k4/8/5N1q/5K2/8/5n2 b - - 6 59,d6e5 f4g6 e5d6 g6h4,1055,289,100,18,endgame equality fork short,https://lichess.org/DR5edhUh/black#118,
OgNsA,r5k1/2qn1ppp/1p2p3/3pN3/PQ1P4/2n1P3/5PPP/RR4K1 w - - 10 26,b1c1 c3e2 g1h1 e2c1,1040,81,100,222,equality fork middlegame short,https://lichess.org/U2XuRkvu#51,
PCnkE,k7/Pr4p1/3K4/RN3p1p/2r5/1P5P/8/8 b - - 0 48,c4b4 b5c7 b7c7 d6c7,1052,107,100,82,endgame equality short,https://lichess.org/ZrllX8cz/black#96,
PFdlv,2r2rk1/P1Nb2p1/3P3p/4Bp2/8/7P/6P1/2R3K1 w - - 1 39,a7a8q c8a8 c7a8 f8a8,1038,109,82,95,equality master middlegame short,https://lichess.org/wuOeRiv6#77,
POXqU,8/8/1p3k2/pPp3p1/P1P2pP1/2N2P2/3rB3/2b2K2 b - - 10 36,d2d6 c3e4 f6e5 e4d6,1037,262,100,13,endgame equality fork short,https://lichess.org/my1CImTy/black#72,
PedRu,r2q1rk1/ppp1bpp1/2n1p2p/3p4/3Pb1PP/P3BN2/1PPQPP2/2KR1B1R b - - 0 12,e4f3 e2f3,1025,96,100,130,equality oneMove opening,https://lichess.org/icQ6iuny/black#24,
PhE86,r4rk1/2p1qppp/p2p1n2/1p1Bp1B1/3nP1b1/3P1N2/PPP2PPP/R2QR1K1 b - - 4 13,d4f3 g2f3,1099,143,83,37,equality middlegame oneMove,https://lichess.org/ud1wLdM8/black#26,
Pk8FI,4rrk1/p5pp/2q5/2pp2N1/1p3bQ1/5P1P/PPP3P1/4RRK1 b - - 1 24,e8e1 f1e1,1051,187,20,19,equality middlegame oneMove,https://lichess.org/jqp9iLhG/black#48,
PohBF,r2qr1k1/pp3ppp/3b4/2NP1b2/2P5/5P2/PP2BBPP/Q3R1K1 b - - 0 17,d6c5 f2c5,1099,178,-11,22,equality middlegame oneMove,https://lichess.org/noDjqNG4/black#34,
Q9iGl,4rrk1/6q1/2p1ppn1/1p3pQ1/p7/P2P3R/BPP2PPP/5RK1 w - - 0 27,g5h5 g6f4 h5f3 f4h3,1061,82,100,216,equality fork middlegame pin short,https://lichess.org/45grrDAe#53,
