PuzzleId,FEN,Moves,Rating,RatingDeviation,Popularity,NbPlays,Themes,GameUrl,OpeningTags
H2BX4,2rr2k1/5pp1/1p5R/p1q1P2P/3pQ3/4P1R1/PP4P1/1K6 w - - 1 26,g3g7 g8g7 e4h7 g7f8 h7h8 f8e7 h8f6 e7e8 h6h8 e8d7 f6f7 d7c6,2591,99,81,196,advantage endgame hangingPiece veryLong,https://lichess.org/JTUyRjt6#51,
H3fgd,1rb3k1/pp1q1pp1/4p2p/1N1n4/1P2Q3/P3P1P1/5PBP/3R2K1 w - - 1 26,d1c1 d7b5 e4e5 b8a8 e3e4 b5e2,2543,105,90,807,advantage hangingPiece long middlegame quietMove,https://lichess.org/ZnQnQ9zV#51,
H5YMD,rk1r4/1bp2BQp/3bN3/p7/4n3/4B3/PPP1q1PP/R4RK1 w - - 3 26,e6d8 e2e3 g1h1 e3h3 d8c6 b7c6,2522,97,100,75,crushing hangingPiece long master middlegame,https://lichess.org/Zs3vwqzW#51,
H7OeV,1k6/pp2Q3/4p3/n2pN1p1/3P4/P3P3/1q1N3P/1Rr4K w - - 1 27,h1g2 b2d2 g2f3 c1c8,2513,99,83,26,advantage defensiveMove hangingPiece middlegame short,https://lichess.org/DOhtsw2s#53,
H931h,rnq5/pbp2kN1/1p3bpr/4p2p/2P1PP1P/2NB4/PP1Q4/2KR3R w - - 0 21,f4e5 f6g7 c4c5 f7g8 d3c4 g8h7,2533,171,100,21,defensiveMove equality hangingPiece long middlegame,https://lichess.org/Wr5MfLyh#41,
HATze,8/p2K3k/1p5P/3pP3/3P4/P4pN1/1P2n3/8 w - - 4 54,e5e6 e2g3 e6e7 g3h5 d7d6 h5f6,2509,117,65,18,crushing defensiveMove endgame hangingPiece knightEndgame long master quietMove,https://lichess.org/5j6npvA6#107,
HDF2K,8/8/2p5/2KbBk2/p7/P4P2/1P6/8 w - - 4 40,c5b4 f5e5 f3f4 e5f4 b4a4 f4e5 a4a5 e5d6,2506,85,100,61,bishopEndgame crushing defensiveMove endgame hangingPiece veryLong,https://lichess.org/PmVfaDBP#79,
HFPv5,8/8/8/3b3R/3k1p1p/5P1P/1r4P1/6K1 b - - 9 51,d4e3 h5d5 b2b1 g1h2 e3f2 d5d4 b1g1 d4d2,2526,100,91,650,advantage endgame hangingPiece veryLong,https://lichess.org/dp6VEUp9/black#102,
HM3al,2kr2r1/pp3p2/2nqb2p/8/P1pP4/2P1PN2/2B3P1/R2QR1K1 b - - 0 20,g8g2 g1g2 d8g8 g2h1 g8g3 f3h2,2509,80,81,177,advantage defensiveMove hangingPiece long master middlegame,https://lichess.org/Z0DaPRkm/black#40,
HMrbd,8/1p1kN3/7p/8/5p2/P4P1P/6nK/8 w - - 0 46,h2g2 d7e7 g2f2 e7f6 f2e2 f6g5,2519,87,88,504,crushing defensiveMove endgame hangingPiece long,https://lichess.org/31IoGBN3#91,
HU8au,r1bqr1k1/ppp2ppp/2n1p3/3n4/1b1P3P/2NB1N2/PPPB1PP1/R2QK2R w KQ - 1 9,d3h7 g8h7 f3g5 h7g8 d1h5 d8f6,2512,93,89,1111,advantage hangingPiece long opening,https://lichess.org/Bpf22FjY#17,French_Defense French_Defense_Two_Knights_Variation
HaDZU,r1b2q1k/pp2nBb1/7p/3pPp2/2p3P1/2N4Q/PPn4P/1RB2RK1 w - - 0 23,g4f5 f8f7 c1h6 c8f5 h6g7 h8g7,2544,83,86,298,advantage hangingPiece intermezzo long middlegame,https://lichess.org/3w7pcGO2#45,
HaPqM,3r2kb/p4p1p/1p3PpB/4P2P/4BQ2/2R3K1/1q6/8 w - - 3 37,g3g4 b2c3 h5g6 h7g6 e4g6 f7g6,2504,85,85,99,advantage hangingPiece long middlegame,https://lichess.org/tJwojv5W#73,
Hb9t0,5r1k/b1p2p1p/p7/1p2n1N1/5p1q/P1Pr1P1P/BP2QP1K/6R1 b - - 3 23,a7f2 e2e5 h8g8 a2f7 f8f7 e5h8 g8h8 g5f7,2510,81,92,4758,attraction hangingPiece kingsideAttack mate mateIn4 middlegame sacrifice veryLong,https://lichess.org/DTfr5LOL/black#46,
HbpSV,2r4k/4qp1p/r2pbp2/4p3/pp2P2Q/5R2/PPPN1PPP/1K1R4 b - - 3 23,e6a2 b1a2 b4b3 a2a1,2520,95,88,686,crushing defensiveMove hangingPiece middlegame short,https://lichess.org/9EAugVew/black#46,
Hd4vD,r3kb2/ppN2qp1/3p2Q1/2p5/3NP1n1/1P1P4/q1P1K3/8 b q - 3 27,e8d8 g6f7 f8e7 c7d5 a2c2 d4c2,2579,101,89,648,crushing hangingPiece long middlegame,https://lichess.org/O2wuRKTj/black#54,
HdEak,3r1rk1/1p2n1bp/3N2p1/3Pp1B1/8/5P1q/PP3P1P/R2QR1K1 b - - 2 23,d8d6 g5e7 f8f5 e1e4 d6d7 d5d6,2542,113,88,575,advantage fork hangingPiece long middlegame,https://lichess.org/TGD8fthE/black#46,
HddA8,4k2r/2qbbppp/8/1p2R3/1P1Q1P2/7P/r2B2P1/5RK1 b k - 0 21,e8g8 e5e7 f8d8 f1c1 c7c1 d2c1,2549,115,89,572,advantage hangingPiece long middlegame,https://lichess.org/wWUZMVSL/black#42,
HdzNe,r4rk1/p1p1b1p1/Q6p/3qp3/1P4b1/2P5/P2N1PP1/R1B1R1K1 b - - 0 21,f8f2 g1f2 e7h4 g2g3 a8f8 f2g1 h4g3 e1f1 g3f4 a6c4 d5c4 d2c4,2524,81,85,212,advantage hangingPiece middlegame veryLong,https://lichess.org/0fjXhRMm/black#42,
He0qV,r4rk1/pp1qbppp/5n2/2pNR1B1/3n4/1B1P1P1P/PPP2P2/R2Q2K1 b - - 0 14,d7h3 d5e7 g8h8 e5e3 h3h5 g5f4,2505,88,74,191,advantage defensiveMove hangingPiece long middlegame quietMove,https://lichess.org/brO06vdr/black#28,French_Defense French_Defense_Other_variations
HgSeW,r2qk2r/ppp1bppp/3pbn2/4p1B1/3nP3/1BNP4/PPP1NPPP/R2Q1RK1 b kq - 5 8,f6e4 c3e4 d4b3 g5e7,2516,93,76,92,advantage hangingPiece opening short,https://lichess.org/1w3vugJR/black#16,Bishops_Opening Bishops_Opening_Berlin_Defense
HitBL,r7/4p1bk/1qp1r1p1/p2pPp1p/1p1P1P1P/2nB1P2/PPP2B2/2KR1QR1 w - - 3 27,g1g6 e6g6 d3f5 c3d1 f1g1 c6c5,2567,86,78,164,advantage hangingPiece long master middlegame,https://lichess.org/F7XYFJhd#53,
Hjekq,r3r1k1/5p2/p6Q/1pp2PP1/4b3/Pq6/4R1P1/5R1K b - - 0 32,e4g2 e2g2 b3d3 f1g1 e8e3 h1h2 d3f5 g5g6,2599,111,85,232,crushing hangingPiece middlegame quietMove veryLong,https://lichess.org/KoDfGm7G/black#64,
Hky7q,3q2k1/P4p2/4p1p1/2Q5/1K5p/1PN5/2r5/8 b - - 0 44,c2c3 b4c3 e6e5 c5e5 g8h7 e5b8 d8f6 c3b4 f6d4 b4b5,2549,84,66,77,advantage defensiveMove endgame hangingPiece master veryLong,https://lichess.org/C2KylWWz/black#88,
HqPpR,r3kn2/pp3Q2/2p5/3pP3/3P4/2b5/P1qNK3/5R2 b - - 0 22,e8d8 f7f8 d8c7 f8e7 c7b6 f1b1,2531,83,82,61,crushing exposedKing hangingPiece long middlegame,https://lichess.org/cnOhkusr/black#44,
HqdEi,2k2r2/p1prBNQ1/1pn1p1B1/3pP3/3P4/2P5/P3KPPP/7q b - - 0 25,c6e7 g7f8 c8b7 f8e8 e7g6 e8d7,2571,82,77,182,crushing hangingPiece long middlegame trappedPiece,https://lichess.org/CMwFJ4dn/black#50,
HsggF,4r2r/pbk1np1p/1ppRN3/4n3/3QP1q1/1P6/P1P3PP/3R2K1 b - - 6 24,c7b8 d4e5 b7c8 d6d7 b8a8 e6c7,2504,80,85,386,crushing discoveredAttack hangingPiece long middlegame queensideAttack,https://lichess.org/kNVcKTi3/black#48,
HvDLX,r5k1/1Q4p1/3N3p/p2P4/P3q3/7P/N1r1nPP1/5R1K b - - 2 40,e4d3 b7a8 g8h7 a8f8,2582,82,88,565,advantage hangingPiece master middlegame short,https://lichess.org/oubhIpBG/black#80,
Hw6UU,rk5r/3bRpbp/p2p4/1p6/2qB2Q1/8/PPP3PP/R5K1 w - - 0 24,g4d7 c4d4 g1h1 a8a7,2506,80,91,3222,advantage hangingPiece middlegame short,https://lichess.org/i1UDwhdO#47,
HzZWw,8/3k2rp/1pb4R/p7/P1P5/5K2/2P2Pp1/6R1 w - - 0 39,h6c6 d7c6 g1g2 g7g2 f3g2 c6c5 g2h3 c5c4 f2f4 c4d5 h3g4 d5e6,2554,97,90,670,crushing defensiveMove endgame hangingPiece rookEndgame veryLong,https://lichess.org/uY6KZC63#77,
I0Bvz,3r2k1/pp3p1r/5PpP/4Q3/2p1P3/7R/PPq4P/6RK w - - 0 30,g1g6 f7g6 f6f7 g8f8 e5c5 f8f7 c5c7 f7e8,2546,93,90,1199,crushing defensiveMove endgame hangingPiece veryLong,https://lichess.org/08ezz1Z1#59,
I2Q4y,r7/P7/8/R4pk1/3K1p1p/8/8/8 b - - 2 54,a8a7 a5a7 g5g4 d4d3 g4f3 a7h7,2569,97,80,473,crushing endgame hangingPiece long master rookEndgame,https://lichess.org/Xh5CbbnI/black#108,
I3b19,2rqr1k1/p4pp1/1p1b1n1p/3p1NN1/5P1P/4B1Q1/PPP1b1P1/2KR3R w - - 1 23,f5h6 g7h6 g5e6 f6g4 e6d8 e8e3,2597,85,93,241,advantage hangingPiece long middlegame sacrifice,https://lichess.org/NQeIRpmE#45,
I4PQo,8/pp6/3Pk1K1/4P2P/P7/6P1/2p3r1/2R5 w - - 2 48,c1c2 g2c2 h5h6 c2g2 h6h7 g2g3 g6h6 e6f7,2559,82,85,386,crushing defensiveMove endgame hangingPiece rookEndgame veryLong,https://lichess.org/jeOAPfjR#95,
I5ohq,5r1k/1b2P1p1/4Q2p/8/r7/q4NP1/1p3PBP/1R1n2K1 w - - 2 32,e7f8q a3f8 e6b3 a4a1 b3d1 f8a8 h2h4 b7e4 f3d2 e4g2,2576,94,79,55,advantage hangingPiece middlegame quietMove veryLong,https://lichess.org/lKGkBuTU#63,
I6fKr,1r1q1rk1/p5pp/1pBN1n2/2p2b2/2Pp1Q2/1P6/P4PPP/3R1RK1 b - - 2 22,f5d3 d1d3 d8c7 f4e5 b8d8 e5e6,2556,88,91,733,advantage hangingPiece long middlegame,https://lichess.org/wzmhrVro/black#44,
I8Wjw,2rq1rk1/pb3ppp/1pN1pn2/8/Bb2P3/2N2P2/Pn2QBPP/R2R2K1 b - - 1 18,d8c7 e2b2 b4c3 b2c3 b7c6 d1c1,2577,84,87,567,advantage defensiveMove hangingPiece long middlegame,https://lichess.org/rhCOoBEL/black#36,Queens_Indian_Accelerated Queens_Indian_Accelerated_Other_variations
I988V,5rk1/1bq4p/p3p1p1/5p2/2rPpP2/bQ2B2P/P5P1/1R1B1RK1 b - - 1 25,b7d5 b3a3 c4c3 b1b3,2540,81,92,3070,advantage hangingPiece middlegame short,https://lichess.org/jTez9ZWY/black#50,
I99TM,r1bq1rk1/ppp2ppp/4pb2/8/3PB2P/5N2/PPP2PP1/R2QK2R w KQ - 1 11,e4h7 g8h7 f3g5 h7h6,2515,101,91,771,advantage hangingPiece middlegame short,https://lichess.org/DfiBLUc1#21,French_Defense French_Defense_Rubinstein_Variation
I9a4N,4r1k1/3nr1Pb/p2qN3/1p1P4/2p5/5P1B/nPPQ4/1K1R2R1 b - - 1 27,d6b4 b1a2 b4a4 a2b1 b5b4 d2h2 b4b3 h3f5,2555,93,76,41,advantage hangingPiece middlegame quietMove veryLong,https://lichess.org/gJvFQNg7/black#54,
IAUgL,7r/p3kp2/8/4PQ2/2rp1P1P/q1n4P/2PK2R1/7R b - - 0 31,c3b1 h1b1 a3e3 d2d1 e3f3 d1e1,2593,85,96,82,advantage defensiveMove hangingPiece long middlegame,https://lichess.org/BvO3Il1G/black#62,
IAtxd,R3Q3/1p3rkp/5pp1/2pPp3/1q6/1P1P3P/5PP1/4n1K1 b - - 7 30,e1f3 g2f3 b4f4 e8g8 g7h6 a8a4,2572,93,85,116,crushing endgame hangingPiece long,https://lichess.org/mHG29u6z/black#60,
ICOsN,8/p7/8/2p1bkPK/4pP2/P3n3/2R3P1/8 w - - 1 42,f4e5 e3c2 g5g6 f5e6 g6g7 e6f7 h5h6 f7g8,2532,81,94,527,crushing endgame hangingPiece master veryLong,https://lichess.org/0dvL1SZE#83,
IEkBN,8/3k3p/1P1P4/p4p2/4nB2/K7/1p4r1/3R4 b - - 0 38,b2b1q d1b1 e4c3 b1c1,2568,107,90,1136,crushing endgame hangingPiece short,https://lichess.org/AOns3B3N/black#76,
IGCN0,8/8/1kn1N2p/p4p2/1p5P/1P1p4/6P1/5K2 b - - 1 48,c6d4 e6d4 b6c5 d4f3,2584,166,71,17,advantage defensiveMove endgame hangingPiece knightEndgame short,https://lichess.org/a6XG5JXC/black#96,
IGmxK,3rr1k1/1pp2p2/1pp1q1p1/7p/2N1Pn2/2PP1PRP/PPQ2P1K/6R1 w - - 0 21,d3d4 e6c4 c2c1 f4e6,2566,96,84,101,advantage hangingPiece middlegame short,https://lichess.org/P2k3nodI#41,
IK0me,6k1/7p/1r1b4/1P1N4/2KP4/4pp2/7P/1R6 b - - 1 43,b6b5 c4b5 e3e2 d5c3 d6h2 c3e2 f3e2 b1e1,2553,94,90,2200,crushing endgame hangingPiece veryLong,https://lichess.org/CR8hjeG9/black#86,
IKaJ3,r3kbr1/p2p3p/b1n1B1p1/q1p1Q3/8/2P5/P2N1PPP/R1B1K2R w KQq - 1 14,e6d7 e8d7 e5d5 d7c7,2553,95,84,458,advantage defensiveMove hangingPiece master opening short,https://lichess.org/UKCfKpCs#27,Benko_Gambit_Declined Benko_Gambit_Declined_Main_Line
IOAd0,1r6/p1p2qk1/5p2/1rpR3p/2Q1R1P1/P7/1B3P2/2K5 w - - 1 32,b2f6 f7f6 d5d7 g7h6 e4e6 b5b1 c1c2 b8b2 c2d3 b1d1 d3e3 d1e1,2596,86,86,64,crushing exposedKing hangingPiece middlegame veryLong,https://lichess.org/Bs5MjiGI#63,
IQnsw,8/5k2/8/3R4/1rP4p/1PK5/3p4/8 b - - 1 54,h4h3 c3b4 h3h2 d5f5 f7e7 f5f1,2500,83,87,239,crushing defensiveMove endgame exposedKing hangingPiece long rookEndgame,https://lichess.org/CA6woqjn/black#108,
ISt8B,2r3k1/RQ3pb1/3p2p1/3Pn3/P2BP2p/4P1qP/2r2NP1/5R1K b - - 3 38,c2f2 b7c8 g7f8 f1f2 g3f2 c8c1,2569,101,90,904,advantage defensiveMove hangingPiece intermezzo long master middlegame,https://lichess.org/yd5OdiXf/black#76,
IUx6K,5rbk/7p/4N1p1/4b1N1/5P1Q/2P4P/6PK/q7 b - - 0 31,e5f6 e6f8 a1a7 f8g6 h8g7 g6e5 h7h6 e5g4 f6g5 f4g5,2598,104,91,1070,advantage hangingPiece middlegame pin quietMove veryLong,https://lichess.org/OMm38fNj/black#62,
IVf64,8/5p2/8/PK1P1Nk1/2n1P1pp/8/1P6/8 b - - 2 51,c4a5 b5a5 h4h3 d5d6 h3h2 d6d7 h2h1q d7d8q,2551,86,80,226,advancedPawn crushing endgame hangingPiece knightEndgame promotion veryLong,https://lichess.org/2quTJXZV/black#102,
IWgJe,1rb2rk1/5ppp/p2pNb2/q1pP4/2p1P1nP/2N5/PP1QB1P1/K4R1R b - - 3 20,b8b2 a1b2 c8e6 f1f6 g4f6 d5e6,2536,81,96,583,advantage hangingPiece long master middlegame,https://lichess.org/GpjSwq6N/black#40,
IY8Ya,3k4/5R2/4p1p1/2N5/2Pn1P1K/1P5P/6r1/8 w - - 0 38,c5e6 d4e6 f4f5 e6g5 f5g6 g5f7,2540,101,90,555,crushing endgame hangingPiece long master,https://lichess.org/3BPbTN6E#75,
Iabra,4r1k1/pQ3pBp/6p1/2P5/1Pn2q2/P4P2/4BP1P/2KR4 w - - 1 22,c1b1 e8e2 g7c3 f4f5 b7e4 e2e4,2552,78,96,185,crushing exposedKing hangingPiece long middlegame,https://lichess.org/bmrqor0W#43,
IbWwM,4r1k1/4r1pp/p2pn1p1/2p4q/2P2P2/1P4P1/PB5P/R2Q1RK1 b - - 1 26,e6f4 f1f4 e7e2 f4f2,2584,108,90,1285,advantage hangingPiece master middlegame short,https://lichess.org/tND62Ncz/black#52,
Icjyb,6b1/8/8/8/1K6/2r5/1R6/3k4 b - - 9 70,d1c1 b4c3 c1d1 b2d2 d1e1 c3d3 e1f1 d3e3 g8b3 d2f2,2573,82,82,222,crushing endgame hangingPiece veryLong,https://lichess.org/wkMhuqK8/black#140,
IeNN5,8/8/8/1p1k4/1P3BK1/PNpP3p/3b1P2/8 w - - 0 52,g4h3 d2f4 h3g4 f4d2 a3a4 b5a4 b3a1 d5d4 b4b5 d4c5 b5b6 c5b6,2568,82,96,75,crushing endgame hangingPiece quietMove veryLong,https://lichess.org/w7Hu79QI#103,
Iisgg,1k3r2/1p6/p7/5p1P/1P2BR2/P4p1K/5b2/8 b - - 0 39,f5e4 f4f8 b8a7 h3g4,2530,101,89,393,crushing endgame hangingPiece master short,https://lichess.org/CDnB3IhK/black#78,
Iivlz,r4rk1/3bN1b1/4p2p/5pp1/p7/P2Q2P1/q1P3PP/3RR2K b - - 1 25,g8f7 d3d7 f8d8 d7c7 g7e5 c7e5 d8d1 e1d1,2513,98,90,999,crushing hangingPiece middlegame veryLong,https://lichess.org/8ITI4Ty9/black#50,
IiyRn,8/8/1r6/6PK/3k1P2/8/1p6/1R6 w - - 3 67,b1b2 b6b2 h5g6 d4e4 f4f5 e4e5 f5f6 e5e6 g6g7 b2b7,2595,87,66,77,crushing endgame hangingPiece master rookEndgame veryLong,https://lichess.org/IeG9pMeO#133,
Ijw6p,4rr2/ppp3kp/2np2p1/3QqP2/2P5/1P2p1NP/P1P3P1/4RRK1 w - - 0 23,f5g6 e5g3 f1f7 f8f7 d5f7 g7h6,2562,86,94,202,advantage hangingPiece long middlegame,https://lichess.org/zxw6tegh#45,
IkMnW,1R6/5p2/6p1/2k1r2p/1p3K2/7P/8/8 b - - 5 53,c5c4 f4e5 g6g5 e5e4,2547,118,88,481,advantage defensiveMove endgame hangingPiece rookEndgame short,https://lichess.org/n4iGwhr1/black#106,
IpwCr,6k1/pp2q1p1/2p4p/3p4/2PPp1b1/PP4P1/R2N1r1P/1Q2nBK1 b - - 3 23,e7f6 b1e1 f2f5 e1e3,2521,94,90,764,advantage hangingPiece middlegame short,https://lichess.org/cbLRI5vi/black#46,
Iq6k8,5r2/5k1p/p3R2p/3B1r2/8/3K2Q1/PP5p/8 w - - 4 37,e6a6 f5d5 d3c2 h2h1q a6a7 f7e6,2547,88,96,100,advancedPawn advantage defensiveMove endgame hangingPiece long promotion,https://lichess.org/umps6gIS#73,
Ito9G,r2q1rk1/p5p1/1p1b3R/3Pp3/4Q3/4P1P1/P3KPP1/R7 b - - 0 24,f8f2 e2f2 d8f8 f2g1 g7h6 e4g6,2528,118,90,384,crushing hangingPiece long middlegame,https://lichess.org/Naindvvc/black#48,
ItwGu,8/Kp4p1/pBb1Rrk1/P2p3p/7P/2P2pP1/5P2/8 w - - 5 40,e6c6 f6c6 a7b7 c6c3 b7a6 g6f5,2528,90,54,50,advantage defensiveMove endgame hangingPiece long,https://lichess.org/IoCR9u7O#79,
IuwpI,3Q4/N2K1ppk/2P4p/2B1r3/8/6P1/4q2P/8 w - - 2 56,c6c7 e5c5 d7c8 e2a6 c8b8 a6b6,2513,94,68,120,crushing endgame fork hangingPiece long,https://lichess.org/JrH2qiV4#111,
IxN2G,r1b1Rbk1/pp4pp/8/q1pp1r2/6Q1/P1N5/1PP2PPP/2K2B1R w - - 0 17,c3d5 f5d5 g4f4 c8f5 f1c4 a8e8,2521,81,91,1466,crushing discoveredAttack hangingPiece long middlegame,https://lichess.org/Ywmk7jSa#33,Scotch_Game Scotch_Game_Other_variations
IxPDf,b2r2k1/1q3rp1/pp2p2p/2Pp3N/1P1QR3/P5RP/6P1/6K1 b - - 0 29,d5e4 d4d8 g8h7 d8e8 b7e7 e8a8,2556,80,81,165,crushing hangingPiece long middlegame,https://lichess.org/tAVLgr9H/black#58,
Ixn5q,1r3rk1/p3pp1p/2p1bnpQ/8/3RP3/5P2/PPP3PP/1KN1qB1R b - - 6 18,e6a2 b1a2 e1a5 a2b1 a5c3 h6f8 g8f8 d4d8 f8g7 d8b8,2575,89,84,388,advantage attraction hangingPiece middlegame veryLong,https://lichess.org/0Y8W0CtI/black#36,Sicilian_Defense Sicilian_Defense_Dragon_Variation
Iyc40,7k/1p4p1/3n1qBp/pP1p3P/P2P1PQN/6P1/1r2R1K1/2r5 b - - 2 36,f6e7 e2b2 e7e1 g2h3,2569,107,90,178,advantage defensiveMove hangingPiece master middlegame short,https://lichess.org/i2v4Mwvr/black#72,
J0j6o,r7/p3r1b1/3Q3k/5Ppp/3P4/2P2R1P/1P4PK/4q3 b - - 1 28,g7f6 d6f6 h6h7 f6g5,2515,92,72,122,advantage deflection endgame hangingPiece short,https://lichess.org/vI4tKbRj/black#56,
J1LgP,rnbq1rk1/p2n2pp/1p1bpp2/3pN3/2pP1P2/2P1P3/PPBN2PP/R1BQ1RK1 w - - 0 11,c2h7 g8h7 d1h5 h7g8 e5g6 f6f5 d2f3 d7f6,2511,93,38,65,advantage hangingPiece opening quietMove veryLong,https://lichess.org/Jyvk43cT#21,Queens_Pawn_Game Queens_Pawn_Game_Other_variations
J37A8,r2qr1k1/1ppb1ppp/p4b2/4Q3/2B5/2N5/PPP2PPP/2KRR3 w - - 0 14,c4f7 g8f7 e5d5 f7f8 e1e8 d7e8,2530,95,90,33,advantage hangingPiece long middlegame,https://lichess.org/kBa8tL11#27,Italian_Game Italian_Game_Paris_Defense
J39i5,1k1r1b1r/pbq2p2/1p3n1p/4nBp1/3P4/1QP3B1/PP3PPP/RN3RK1 b - - 1 14,c7c6 g3e5 f8d6 e5d6,2527,86,84,241,advantage hangingPiece middlegame queensideAttack short,https://lichess.org/cQVLDHUa/black#28,Caro-Kann_Defense Caro-Kann_Defense_Exchange_Variation
J8lw8,1r2kbr1/pp2q2B/2p1b3/8/8/8/PPP1Q1PP/R4RK1 b - - 0 18,e7h7 e2e6 f8e7 a1d1 b8d8 d1d8 e8d8 f1d1 d8e8 e6d7,2510,81,79,215,attraction crushing exposedKing hangingPiece middlegame pin quietMove veryLong,https://lichess.org/DlVyf7Kb/black#36,Vienna_Game Vienna_Game_Vienna_Gambit
JCnAJ,4r1k1/2p2ppp/p2p1n2/2q5/4P2P/p2B1Q2/1r2NPP1/K2RR3 b - - 3 21,b2e2 e1e2 c5e5 a1a2,2584,83,84,1051,advantage hangingPiece middlegame short,https://lichess.org/ly6y6tti/black#42,
JGpVZ,8/8/5n2/4B2k/4P3/4Kp2/8/8 b - - 2 69,h5g4 e5f6 g4g3 f6d4 f3f2 e3e2 g3f4 e4e5 f2f1q e2f1,2533,91,89,136,crushing endgame hangingPiece master quietMove veryLong,https://lichess.org/iluY0kcf/black#138,
JK9AH,5k2/p1pb2Rp/4r3/5K2/1P1P4/P1P5/8/8 b - - 0 39,e6g6 g7d7 g6c6 d7h7 c6c3 f5e6,2580,106,89,521,crushing defensiveMove endgame hangingPiece long,https://lichess.org/wqZFxHdb/black#78,
JLdCD,1r5k/6pp/3P4/3Qpb2/1qp1N3/2N2p1P/rB5R/2K1R3 w - - 5 36,c3a2 b4e1 d5d1 e1e4 a2c3 e4e3 d1d2 e3g1 c3d1 c4c3,2557,108,89,1101,crushing exposedKing hangingPiece master middlegame pin queensideAttack veryLong,https://lichess.org/nfDnSp3c#71,
JRxuH,2r3k1/5p2/3P2p1/1Q2p3/1P2P3/2r1P3/7q/4K1R1 b - - 2 42,h2d2 e1d2 c3c2 d2e1 c2c1 e1f2 c8c2 b5e2 c2e2 f2e2,2514,83,85,110,crushing endgame hangingPiece veryLong,https://lichess.org/6ETRjeGu/black#84,
JSc1a,r1bq3k/pppnb1p1/3p1r2/6NP/3PQ3/8/PPP2PP1/R3K2R b KQ - 6 19,f6e6 g5e6 d7f6 e4g6,2589,102,90,896,crushing hangingPiece middlegame short,https://lichess.org/ayDkdbBv/black#38,Queens_Pawn_Game Queens_Pawn_Game_Other_variations
JbcB6,1r1r4/q3p1bk/2p1Ppp1/p1Np1b1p/P2P1P1P/1P3Q2/3B1P1K/R5R1 w - - 5 25,g1g6 h7g6 a1g1 g6h6,2531,80,85,91,advantage defensiveMove hangingPiece master middlegame short,https://lichess.org/6ZgIN36F#49,
JekVd,5r2/ppq1n3/2p5/6k1/3P3N/1P2Q3/P1r3Pb/5R1K b - - 7 29,g5h4 f1f8 c7d6 f8h8,2582,114,90,857,crushing hangingPiece middlegame short,https://lichess.org/nieCDOGu/black#58,
JfMps,r3k2b/p3p3/npp1P3/3p4/3P4/2P5/P1QB1PP1/qN2K3 b q - 2 20,a6b4 c3b4 h8d4 c2c6,2527,94,91,593,capturingDefender crushing discoveredAttack hangingPiece middlegame short,https://lichess.org/62HARTkd/black#40,
JfbZp,r2q3r/ppp1k1pp/2n1Nn2/2b5/4pPQ1/2N5/PPPP2PP/R1B2R1K w - - 3 13,c3d5 d8d5 g4g7 e7e6 f4f5 e6d6,2513,89,84,163,advantage defensiveMove hangingPiece long middlegame,https://lichess.org/ZK8K6gsM#25,Kings_Gambit_Declined Kings_Gambit_Declined_Falkbeer_Countergambit_Accepted
JgtGv,8/p7/K1Bk4/P7/7p/8/8/8 w - - 8 67,a6a7 d6c6 a5a6 c6b5 a7b7 h4h3 a6a7 h3h2 a7a8q h2h1q,2562,79,56,48,advancedPawn crushing endgame hangingPiece promotion veryLong,https://lichess.org/DQA0wjLO#133,
JkFpT,r2q1rk1/pp3pbp/3p1np1/2pP3b/2P3P1/1PN2n1P/P3NPB1/R1BQ1R1K b - - 0 14,f6g4 g2f3 d8h4 h1g2 g4h2 f3h5,2576,87,79,264,advantage hangingPiece long middlegame,https://lichess.org/m7DJtOkJ/black#28,English_Opening English_Opening_Anglo-Indian_Defense
JmW9f,8/1b4k1/1R6/3rP3/1PK4p/P7/8/8 b - - 0 45,d5e5 b6b7 g7g6 b7d7 e5e4 c4c5,2592,88,83,92,advantage defensiveMove endgame hangingPiece long quietMove,https://lichess.org/lJW0BywU/black#90,
JorqR,r6k/2p1q1p1/1p1p3p/p2Qb3/4P3/2P2P1P/PP6/2B1R1K1 b - - 0 37,e7h4 d5a8 h8h7 g1f1 h4h3 f1e2,2514,79,75,152,advantage defensiveMove endgame hangingPiece long,https://lichess.org/ScpFD3uI/black#74,
JrTw9,8/5p2/8/3PPk2/2K2n1p/7P/6P1/8 b - - 0 47,f4d5 c4d5 f5f4 e5e6 f7e6 d5e6,2515,89,84,103,crushing endgame hangingPiece long,https://lichess.org/lEj1JdgV/black#94,
JwZQQ,2kr3r/3b1p2/3p3p/4p2n/1QP1P2P/1N3q2/PP5B/2KR3R w - - 0 24,d1d6 f3h1 d6d1 h1e4 b4c5 d7c6,2538,99,79,98,advantage defensiveMove fork hangingPiece long middlegame,https://lichess.org/UA2zoZ3x#47,
Jwg5i,8/K6p/8/3N4/5p2/3P2k1/8/8 w - - 0 73,d5f4 g3f4 a7b6 h7h5 d3d4 h5h4 d4d5 f4e5 b6c6 h4h3 d5d6 h3h2 c6c7 h2h1q,2533,104,89,1108,advancedPawn crushing endgame hangingPiece promotion quietMove veryLong,https://lichess.org/L7AtgYMV#145,
K1r3S,r2qk2r/4p1bp/p3p1p1/1pp1N3/3N1P2/P2Pn3/1PP3PP/R2Q1RK1 w kq - 0 16,d1f3 c5d4 f3c6 e8f8 c6e6 d8d5 e6d5 e3d5,2535,118,88,556,advantage hangingPiece middlegame veryLong,https://lichess.org/w3mvsKne#31,Van_Geet_Opening Van_Geet_Opening_Other_variations
K8vHf,8/2n5/1K1k4/8/1P6/rb1R3P/5P2/8 b - - 2 66,d6e7 b6c7 a3a7 c7b8,2532,85,82,119,crushing endgame hangingPiece short,https://lichess.org/a3VBXplt/black#132,
KBRw6,r2q2k1/pp3ppp/2pN4/5b2/P5n1/1P1BP1P1/2Q2P1r/R1B2RK1 b - - 0 18,d8d6 d3f5 d6h6 c2e4 g4f6 e4f3,2595,91,90,186,advantage hangingPiece long middlegame,https://lichess.org/wS795vjV/black#36,Semi-Slav_Defense Semi-Slav_Defense_Chigorin_Defense
KDkPl,4r2k/pp3q1p/4p1bQ/7p/3P4/2N1N3/Pn1K1PP1/7R b - - 3 25,b2c4 e3c4 e8c8 c4e3 e6e5 d4d5 f7f2 c3e2,2580,109,90,629,advantage defensiveMove hangingPiece middlegame quietMove veryLong,https://lichess.org/kVBcK3rh/black#50,
KFh6U,1n1q2rk/r3bp2/p3p2p/1p2P3/8/2p1QN2/PP3P1P/R1B2R1K b - - 3 20,e7g5 e3a7 d8d3 c1e3,2564,118,89,999,advantage hangingPiece middlegame short,https://lichess.org/mzHbFlRw/black#40,
KJWqn,3q1rk1/p2n1ppp/2rNpn2/8/3Pb3/Q3PN2/PP3PPP/R3KB1R b KQ - 4 14,c6d6 a3d6 e4f3 g2f3 d8a5 e1d1,2552,103,61,49,advantage defensiveMove hangingPiece long middlegame,https://lichess.org/Qj8VLN1B/black#28,Slav_Defense Slav_Defense_Bonet_Gambit
KMdK3,r3k1r1/1Qp2p2/p1np1q1p/2b1p3/2B1Pp2/2PP1N1b/PP1N1PP1/R4RK1 b q - 0 15,h3g2 b7c6 e8e7 c6c7 e7f8 g1h2,2506,86,57,51,advantage fork hangingPiece long middlegame,https://lichess.org/tWq4AnoH/black#30,Italian_Game Italian_Game_Giuoco_Pianissimo
KQmlv,1r3rk1/1p2bb1p/p5pB/8/6Q1/2p5/1qB3PP/2R2R1K w - - 0 26,f1f7 f8f7 g4e6 b8f8,2556,87,82,177,crushing defensiveMove hangingPiece middlegame short,https://lichess.org/stJT096q#51,
KR0ed,B2r2k1/p4pp1/5r1p/8/2P3Q1/3p3P/PP2pq1B/1R2R2K b - - 1 31,f2e1 b1e1 f6f1 h1g2 f1e1 g4h4,2542,101,89,835,crushing hangingPiece long middlegame,https://lichess.org/IWE75zxL/black#62,
KUGjk,4rk2/2p2ppp/rp1q4/p2p4/P2Pn3/1PP2P1P/1B2Q1P1/2KR3R b - - 0 22,e4c3 e2a6 c3a2 c1b1 a2b4 b2a3 b4a6 a3d6,2525,82,78,177,advantage hangingPiece middlegame veryLong,https://lichess.org/K153OXox/black#44,
KWFyb,r5k1/3b3p/3B2p1/1P1P4/2Q3P1/p3qP2/1b6/1K1R2NR w - - 0 26,d6a3 e3a3 d5d6 g8f8 h1h7 b2g7 h7g7 a3a1 b1c2 a8a2 c2d3 a1d1,2552,94,83,37,crushing deflection exposedKing fork hangingPiece middlegame quietMove veryLong,https://lichess.org/H6FxIeOk#51,
KYomf,6r1/R4p1k/2p1r1q1/3p1B2/1P6/2P1bQ2/1P3K1P/3R4 w - - 1 32,f3e3 g6f5 e3f3 f5c2 f2f1 c2h2 f3f7 h7h8,2590,85,85,305,crushing defensiveMove exposedKing hangingPiece middlegame skewer veryLong,https://lichess.org/t6O2iwng#63,
KaBjT,2r2rk1/1Q3ppp/p2bpn2/3p1b2/Pn1P4/5NP1/1P1BPPBP/2R1K2R w K - 1 16,d2b4 c8c1 e1d2 c1c2 d2d1 c2b2 b4d6 b2b7,2559,104,88,1101,advantage hangingPiece middlegame veryLong,https://lichess.org/recbalMq#31,Hungarian_Opening Hungarian_Opening_Other_variations
KaC1W,8/8/p6P/Bp3KP1/8/1Pbp4/P1k5/8 w - - 1 51,g5g6 c3a5 g6g7 d3d2 h6h7 d2d1q,2508,81,65,56,advancedPawn bishopEndgame crushing endgame hangingPiece long promotion,https://lichess.org/Dt8x8o7E#101,
KaqGV,B1q5/5pk1/p3r1b1/1p4QP/1P6/P5PK/8/7R w - - 1 35,g5g4 c8a8 h1f1 a8h8 g4d4 f7f6,2531,83,43,55,advantage defensiveMove endgame hangingPiece long pin,https://lichess.org/0ngDituX#69,
KeK6g,4R3/1p1k4/p2p4/2pPP3/2P4p/P2Pq1rP/1P6/R2Q3K w - - 2 32,e5e6 d7e8 d1h5 e8d8 h5h4 d8c8,2504,89,83,187,advantage defensiveMove endgame hangingPiece long,https://lichess.org/0HoB3kHO#63,
Kfgos,r2k2r1/pp2RpPp/1b1p4/q2P4/3Q1pB1/2N5/PP4PP/R1B3K1 w - - 3 19,d4b6 a5b6 c1e3 f4e3 e7f7 e3e2 g1h1 b6b2,2596,99,91,869,advancedPawn crushing discoveredAttack hangingPiece middlegame veryLong,https://lichess.org/geeZyPDK#37,Sicilian_Defense Sicilian_Defense_Alapin_Variation
KkcHw,r5k1/2p2pR1/p3r3/1p6/3np2q/P6P/1PP2P1K/3R2Q1 b - - 0 28,g8h8 d1d4 e6h6 g7g3,2572,192,100,12,defensiveMove equality hangingPiece middlegame short,https://lichess.org/Hz7ANZF4/black#56,
Kmfmn,r2k4/pp3R2/2p1Q3/3pN1q1/3Pp3/1PP5/P2R4/1K5r w - - 1 33,b1b2 g5d2 b2a3 d2c1 a3a4 b7b5 a4b4 a7a5 b4c5 c1c3 e5c4 c3b4 c5c6 b4c4 c6b7 c4c8,2530,94,51,63,crushing deflection hangingPiece middlegame veryLong,https://lichess.org/T2jd2i9g#65,
KqPy0,8/4k1p1/2p1P2p/P1p2P2/1nP2K2/3B3P/8/8 w - - 5 50,f4e5 b4d3 e5e4 d3b2,2534,81,72,145,advantage endgame hangingPiece short,https://lichess.org/8SRX8IW1#99,
KsMoQ,r7/ppQ5/2p2qp1/8/4nk1P/5r2/P4P2/R3R1K1 b - - 0 31,f4g4 e1e4 f3f4 a1e1,2560,85,48,33,advantage defensiveMove hangingPiece middlegame short,https://lichess.org/R1kIeM7E/black#62,
KtZMP,8/4k3/2P1p3/2K3N1/6p1/4n3/6P1/8 w - - 3 60,g5e6 e7e6 c5d4 e3f1,2500,86,81,56,crushing defensiveMove endgame hangingPiece knightEndgame short,https://lichess.org/8V2Qk17n#119,
KuAXx,2kr3r/1p1bnBp1/pq2p2p/2bpP2Q/8/2N1B3/PP3PPP/R3R1K1 w - - 3 16,f7e6 d7e6 c3a4 c5e3 a4b6 e3b6,2503,78,90,179,advantage hangingPiece long middlegame,https://lichess.org/GPDbmdNf#31,French_Defense French_Defense_Advance_Variation
Kud0w,3k4/1Q6/1P2p1p1/2n5/3p2P1/3P4/4B1K1/8 w - - 1 56,b7d7 d8d7 g4g5 d7c6 g2f3 e6e5,2555,94,73,50,crushing defensiveMove endgame hangingPiece long,https://lichess.org/e5PrrI08#111,
KycJz,r4k1r/pp3pp1/7p/1Nbp1P2/Q3p3/2PnPP2/Pq1NK1P1/R6R b - - 3 19,e4f3 e2d3 a8e8 a1e1,2588,109,90,359,advantage defensiveMove hangingPiece middlegame short,https://lichess.org/tvp4V5be/black#38,Queens_Pawn_Game Queens_Pawn_Game_Mason_Variation
L20jl,1r1q3r/p3k2p/3pBN1B/2pPn3/1nP5/1P3Q2/P7/2KR3R w - - 3 31,c1b2 e5f3 h1h3 d8a5,2561,94,84,160,crushing hangingPiece middlegame short,https://lichess.org/TRxucbZs#61,
L4E1Q,4Q1k1/1R1r2p1/p2bbr2/2p1p3/P6R/3P2P1/2P2P1P/4qBK1 b - - 1 26,f6f8 e8e6 f8f7 b7b8 d6b8 e6e8 f7f8 h4h8 g8h8 e8f8 h8h7 f8f5 h7g8 f5d7,2590,90,85,104,advantage attraction deflection fork hangingPiece middlegame sacrifice veryLong,https://lichess.org/NKDdgnC4/black#52,
L55bG,r3r3/p1p2pkp/3b1Np1/2p2b2/6q1/6P1/PPQN1P1P/R1BR2K1 w - - 3 19,c2c3 g4d1 d2f1 d1d4 f6e8 a8e8,2577,94,83,250,advantage hangingPiece long middlegame,https://lichess.org/fDu7bpVi#37,
L8UkL,5bk1/pp2p1p1/5nNr/3p4/7P/3pK3/PP1N2Q1/2r5 b - - 3 30,g8h7 g6f8 h7g8 f8g6,2590,95,91,147,advantage hangingPiece middlegame short,https://lichess.org/31LadOEV/black#60,
L9kLK,2b2k1r/q4pp1/2n1p2p/3NP3/2pP2QP/2R5/2PKBPP1/8 b - - 0 21,e6d5 g4c8 f8e7 c8c6 a7d4 c3d3,2548,85,89,754,crushing fork hangingPiece long master middlegame,https://lichess.org/zj0BMIXh/black#42,
