PuzzleId,FEN,Moves,Rating,RatingDeviation,Popularity,NbPlays,Themes,GameUrl,OpeningTags
U4PXx,r5k1/1b1p1q1p/1b1P1pn1/1pp5/p6N/3Q2N1/PPB2PPP/R5K1 w - - 2 24,d3f5 g6h4 f5g4 h4g6 c2g6 f7g6 g4d7 g6f7,2583,92,73,126,advantage hangingPiece middlegame veryLong,https://lichess.org/vtjshBW2#47,
U8PVJ,8/1Q4bk/6pp/PK2Pp2/4r3/8/8/8 w - - 1 49,b7e4 f5e4 e5e6 g7f8 a5a6 e4e3 a6a7 e3e2 a7a8q e2e1q,2524,91,75,155,advancedPawn crushing endgame hangingPiece promotion quietMove veryLong,https://lichess.org/LmRihLwj#97,
UF2e2,r1b1k2r/pp3p2/2nQ2p1/1q1R2Kn/6P1/8/P1P1PP1P/5B1R b kq - 2 22,b5e2 f1e2 f7f6 g5h4 h5f4 h4g3,2509,81,66,68,crushing hangingPiece long middlegame,https://lichess.org/9FsqL8kS/black#44,
UG6an,r1b2k1r/5p1p/p1QbpPp1/8/1p2R3/3B4/PPP1KPP1/q7 b - - 3 22,c8b7 c6d6 f8g8 e4b4,2555,79,92,526,crushing hangingPiece middlegame short,https://lichess.org/UkJHfcDd/black#44,
UJXN2,2r3k1/p4r2/Q7/3pPP1P/3P4/2p5/PPn5/1K6 b - - 0 37,c2a3 b2a3 c3c2 b1c1 f7c7 f5f6 c8b8 f6f7,2571,97,85,31,advancedPawn advantage endgame hangingPiece veryLong,https://lichess.org/jFkN7s8V/black#74,
UJdLU,r2qkb1r/3n2p1/2p1p2p/pp3p2/3PN1nP/3Q1N2/PPPB1P2/2KR2R1 w kq - 0 15,g1g4 f5g4 e4g5 d8f6,2512,130,100,23,equality hangingPiece middlegame short,https://lichess.org/zKaszI3k#29,
ULwJi,6R1/5r1p/2p3pk/p7/3P1pPP/3BnP2/Pr6/4R1K1 w - - 1 40,e1e3 f4e3 g4g5 h6h5 d3g6 h5h4 g6f7 b2b1 g1g2 e3e2,2513,87,91,586,advancedPawn advantage endgame exposedKing hangingPiece veryLong,https://lichess.org/iWiMNZez#79,
UR0EY,1r2r1k1/p1p3p1/2Q3p1/b1P4p/P6P/3qB3/1P3P2/R1KN4 b - - 0 28,b8b2 c6e8 g8h7 d1b2 d3f1 c1c2,2510,80,92,614,crushing hangingPiece intermezzo long middlegame,https://lichess.org/Lr9oOnlt/black#56,
UUwEP,8/8/2Rbk1p1/8/1p6/2pKB3/7r/8 w - - 0 42,c6d6 e6d6 e3f4 d6c5 f4h2 g6g5,2502,89,84,43,crushing defensiveMove endgame hangingPiece long,https://lichess.org/9akSLQ79#83,
UXjkN,3r2k1/4bp2/1p4pK/pP5p/R3QP2/6P1/7P/5q2 b - - 0 38,f1a1 a4a1 d8e8 a1e1 e7f8 h6g5 e8e4 e1e4,2554,91,93,2263,crushing endgame hangingPiece quietMove veryLong,https://lichess.org/Cgz3uk15/black#76,
UZPb0,6k1/p4pq1/6p1/3p2B1/1Q2b1BP/1P1r2P1/P4P2/6K1 b - - 0 29,d3d1 g4d1 g7a1 b4e1 e4f3 e1e8 g8g7 g5h6 g7h6 e8e3 h6g7 e3f3,2569,108,91,1186,attraction crushing endgame fork hangingPiece veryLong,https://lichess.org/yTwop250/black#58,
Uapw1,7r/3kpQb1/1qp1N3/3pP2p/1p1R4/6BP/rP3PP1/2K4R w - - 3 24,e6g7 b6d4 f7f5 e7e6 f5e6 d7c7,2597,94,90,1345,crushing hangingPiece long middlegame,https://lichess.org/TqJPLoRz#47,
UayGf,2r2r1k/3q1pp1/4p2p/p2pP2Q/1p1P4/1P4R1/P1P3PP/5RK1 w - - 0 28,g3g7 h8g7 h5g4 g7h7 f1f6 f8h8,2547,91,74,47,crushing defensiveMove endgame hangingPiece long,https://lichess.org/U8FaocM9#55,
UeAwr,5r1k/2p3p1/bp2Q2p/5P2/p1PqNP2/7P/B5PK/5R2 w - - 5 34,c4c5 a6f1 f5f6 d4b2 f6g7 b2g7 e4g3 g7f6,2590,87,74,44,advantage hangingPiece middlegame veryLong,https://lichess.org/X6pEPEGk#67,
Ug4rF,r4r1k/pbp3pB/1p2p3/nP4q1/2P3n1/1N5R/PBQ3PP/R5K1 w - - 3 26,h7g8 h8g8 c2h7 g8f7 a1f1 f7e8 f1f8 e8f8,2501,93,90,652,advantage hangingPiece middlegame veryLong,https://lichess.org/FeOIIeVN#51,
Uk8nm,rnbq3r/pp3kb1/3P1p1n/2pP2p1/2B2p1p/2N2N2/PPP1Q1PP/R1B1R1K1 w - - 4 13,f3g5 f6g5 e2h5 f7f8 e1e7 g7f6,2524,89,91,196,advantage hangingPiece long middlegame,https://lichess.org/pBJAX7hM#25,Kings_Gambit_Accepted Kings_Gambit_Accepted_Kings_Knights_Gambit
UnIKI,r7/2p1kb2/p6p/1pqr4/4QR2/2P5/6PP/3R3K b - - 1 34,d5e5 e4a8 c5d5 f4f7 d5f7 a8d8 e7e6 d8c8 e6f6 d1f1,2559,79,95,270,crushing exposedKing hangingPiece middlegame veryLong,https://lichess.org/d8z5XWK2/black#68,
UpS04,r2q1rk1/1pp1bpp1/p1n5/6P1/2p2N2/P1B1P3/1P4P1/1QKR3n b - - 1 19,e7d6 d1h1 f7f5 g5f6 f8f6 b1h7 g8f7 h7h5,2564,105,89,406,advantage enPassant hangingPiece kingsideAttack middlegame veryLong,https://lichess.org/sGcoRoZk/black#38,
UpejS,3rr1k1/p1q4p/1p2b1p1/2p1B3/2B3P1/P6n/1PQ2P1K/R3R3 b - - 1 29,c7c6 h2h3 c6f3 h3h2,2539,84,82,363,advantage defensiveMove hangingPiece master middlegame pin short,https://lichess.org/RyRTyKh8/black#58,
UrqDb,5rk1/R1R2p2/1p1p2pp/1q1P4/4Pp1N/1n1P3P/4BPP1/6K1 b - - 10 29,b3c1 c7c1 b5b2 c1e1,2520,79,80,153,advantage defensiveMove hangingPiece middlegame short,https://lichess.org/zeYSq8j3/black#58,
Us7Rl,r1r3k1/5ppp/4pq2/2nb4/1pNP2Q1/1P1BB3/1K3PPP/3R3R w - - 3 24,d3h7 g8h7 c4b6 c5b3,2504,97,76,23,advantage hangingPiece middlegame pin short,https://lichess.org/pUcvrIxV#47,
Us7sH,R7/5K2/4P3/7p/8/6k1/p3r3/8 b - - 19 64,e2e6 f7e6 h5h4 e6f5 h4h3 a8a3,2520,83,96,206,crushing endgame hangingPiece long master rookEndgame,https://lichess.org/p9TmcYjF/black#128,
Uui6v,4k3/1p6/p7/3P4/2P5/2K5/Pn6/8 b - - 1 52,e8d7 c3b2 d7d6 a2a4 d6c5 a4a5,2507,91,77,39,crushing defensiveMove endgame hangingPiece long quietMove,https://lichess.org/sjkIeLsp/black#104,
UwSw2,r1b4k/pp4pp/5r2/q7/5P2/PQ6/1P1N2PP/R3K2R w KQ - 0 21,e1g1 a5d2 a1d1 c8e6 b3b7 d2e3,2517,94,81,214,crushing hangingPiece long middlegame,https://lichess.org/89xyXmII#41,
V0i1O,r1bq1rk1/pp3ppp/4pb2/8/3n3P/3B1N2/PP3PP1/R1BQK2R w KQ - 0 12,d3h7 g8h7 f3g5 h7g8 d1h5 d8a5,2584,102,91,815,crushing hangingPiece long opening,https://lichess.org/yZnu56Sq#23,Caro-Kann_Defense Caro-Kann_Defense_Other_variations
V7VoN,r3r1k1/p7/2pq1ppQ/2pbN3/3p1P2/3P4/PPP1R1PP/R5K1 w - - 0 21,e5g6 e8e2 g1f1 d6e6 g6e7 e6e7,2509,87,79,72,crushing hangingPiece long middlegame quietMove,https://lichess.org/REb76KQl#41,
V84Dt,6k1/4b1p1/p4P1p/1p1p4/2p1N3/P1P4P/1P3PP1/6K1 b - - 0 31,d5e4 f6e7 g8f7 g1h2 f7e7 h2g3 g7g5 g3g4,2556,98,51,24,advancedPawn advantage endgame hangingPiece master veryLong,https://lichess.org/BflBQ2nn/black#62,
V8Qk4,8/5pk1/6p1/2K5/8/P2n3P/5R2/8 w - - 0 47,c5d4 d3f2 a3a4 f7f5 a4a5 f2e4,2546,108,87,552,crushing defensiveMove endgame hangingPiece long quietMove,https://lichess.org/RT6bD8UK#93,
V9bMj,r2q2kr/1p4np/p3N2B/2b2p2/2B5/3R3P/PPP2PP1/2K5 b - - 0 23,d8f6 e6c5 g8f8 c5d7 f8e7 d7f6,2514,79,93,1047,advantage discoveredAttack fork hangingPiece long middlegame,https://lichess.org/XUijSpXU/black#46,
V9cZ1,3rr1k1/1b3p1p/p4pp1/2p3q1/8/PQN1P2P/3P1R2/1R2K1N1 w - - 2 24,b3b7 g5g1 f2f1 g1g3,2522,83,85,199,advantage hangingPiece middlegame short,https://lichess.org/ihKpsCbB#47,
VCbcd,r5rk/p6p/bp2p3/3pP3/P3n1qN/2P1Q3/1P3PP1/R3RBK1 w - - 9 25,f1a6 g4h4 a6d3 a8f8 d3e4 d5e4,2509,100,82,42,crushing hangingPiece long middlegame,https://lichess.org/f21y6Xf8#49,
VFxi3,5r1k/p4pp1/2pn3p/8/1P4Q1/PB3PK1/4q3/R1B5 w - - 7 33,c1h6 g7h6 g4d4 h8h7,2559,85,80,109,crushing defensiveMove hangingPiece middlegame short,https://lichess.org/Jy2OnE6b#65,
VJeQv,r5k1/5R2/8/3N2pp/4P3/3P2qP/2PQ2P1/r4R1K w - - 4 37,d5f6 g8f7 d2e2 g3f4 e2h5 f7e6,2526,100,80,38,advantage hangingPiece long middlegame pin,https://lichess.org/wglvMH1F#73,
VMzfc,k3r2r/1p3p2/pP3P2/q2Q4/2pB3p/2Pp3P/6P1/3R3K b - - 3 42,d3d2 d5a5 e8e1 d4g1 e1d1 a5d5,2530,106,90,177,crushing endgame hangingPiece long,https://lichess.org/njLj6Qn0/black#84,
VOj9X,r1r3k1/PQ3pp1/8/3p4/8/4P3/4KPqp/RR6 w - - 2 33,b7c8 a8c8 b1b8 g8h7 b8c8 g2g4 e2d2 g4c8,2531,100,83,60,crushing endgame fork hangingPiece veryLong,https://lichess.org/XKog6rv5#65,
VSyNO,r3b1k1/1p4r1/3nR2Q/pP1p1p2/P4P2/3B4/3N1qPP/4R2K w - - 1 26,d3f1 f2d2 e6e7 g7e7,2596,93,91,2387,advantage hangingPiece middlegame short,https://lichess.org/DLr30VF8#51,
VTL2B,1r1q2k1/1pp2ppp/p4n2/4r3/1b2N3/1P4P1/PBPP2QP/2KR3R b - - 0 17,f6e4 b2e5 b4a3 e5b2 d8f6 c2c3,2502,101,88,765,advantage defensiveMove hangingPiece long middlegame,https://lichess.org/cNuJk538/black#34,Nimzo-Larsen_Attack Nimzo-Larsen_Attack_Modern_Variation
VW7ad,2bqk2r/5r1p/p4p2/1p2p2Q/3p4/3P2P1/PPP3BP/R4RK1 w k - 2 18,f1f6 d8f6 a1f1 c8f5,2583,80,92,1620,advantage hangingPiece middlegame short,https://lichess.org/ObXAiXC6#35,Sicilian_Defense Sicilian_Defense_Closed
VWWcO,1k4r1/1pp5/6r1/P2p3p/q1P4B/P1Q1P2B/3K4/5R2 w - - 0 29,c4d5 a4h4 f1f7 h4g3,2542,80,81,93,crushing hangingPiece master middlegame short,https://lichess.org/5PcVMikX#57,
VWnVM,2kr4/1pp5/p5q1/7p/2R2b2/1PQ5/P4PBP/7K w - - 0 29,g2b7 c8b7 c3f3 c7c6 c4b4 b7a7 b4f4 d8g8 f3e3 a7a8,2572,98,73,61,advantage defensiveMove endgame hangingPiece quietMove veryLong,https://lichess.org/dOlI3D4Z#57,
Ve4mo,1k1r1b1r/pb1p1p2/1pnN1q2/4N1pp/2B5/6P1/PPP2P1P/R1BQR1K1 w - - 1 17,e5d7 d8d7 e1e8 c6d8 c1g5 f6g5 d6b7 d7d1,2506,112,95,46,equality hangingPiece opening veryLong,https://lichess.org/8FgC2kcN#33,
VfinC,r1bq1rk1/pp1p1ppp/2n2n2/2b1p1B1/Q3P3/2P2N1P/PP3PP1/RN2KB1R b KQ - 2 8,c5f2 e1f2 d8b6 f2g3,2509,81,84,365,advantage defensiveMove hangingPiece opening short,https://lichess.org/NIZoRVfc/black#16,Sicilian_Defense Sicilian_Defense_Smith-Morra_Gambit
VgXKx,rn1qk2r/pQ2pp2/2p3p1/3Pb2p/8/7P/PP3PP1/RNB1K2R b KQkq - 0 13,e8g8 b7a8 d8d7 b1c3,2542,91,81,168,advantage defensiveMove hangingPiece master middlegame short,https://lichess.org/aVP8lfam/black#26,Queens_Pawn_Game Queens_Pawn_Game_Other_variations
VnNuW,Rn2rb1r/3kn1p1/1q5p/1PpPQ3/2P5/8/1P3PPP/R5K1 b - - 0 23,e7d5 e5d5 f8d6 a1a7 d7d8 f2f4,2516,88,82,52,crushing defensiveMove exposedKing hangingPiece long middlegame pin,https://lichess.org/1ekcFGH3/black#46,
Vnbf1,3r3k/6p1/1P5p/P7/5P2/6P1/2Qb2KP/8 w - - 0 45,c2d2 d8d2 g2f3 d2b2 f3e3 b2b5 e3d4 b5a5 d4c4 a5a2,2587,115,90,805,advantage endgame hangingPiece master veryLong,https://lichess.org/sW17Q16J#89,
VoOPC,8/p1R5/r5P1/7K/8/2pk4/5P2/8 b - - 0 45,a6g6 h5g6 a7a5 f2f4 a5a4 f4f5 a4a3 c7a7,2504,84,98,160,crushing endgame hangingPiece quietMove rookEndgame veryLong,https://lichess.org/yu980FGW/black#90,
Vogko,1k1r4/pp2p3/2p2b2/1P3B2/P1bPP3/2P3qp/4Q3/R1B2R1K w - - 2 25,e2b2 c4f1 b2h2 f1g2 h1g1 f6e5 h2g3 e5g3,2541,106,88,757,advantage exposedKing hangingPiece kingsideAttack middlegame veryLong,https://lichess.org/LY5jffC0#49,
VpbvQ,1R6/8/6KP/3r4/6p1/6P1/kp6/8 w - - 4 58,b8b2 a2b2 h6h7 d5d8 g6h5 d8h8 h5g4 h8h7 g4f5 h7f7 f5e5 f7g7,2587,97,91,68,crushing endgame hangingPiece quietMove rookEndgame veryLong,https://lichess.org/aNbo0WCp#115,
VpquX,r3k2r/5ppp/pqp1bn2/2bpN3/N4P2/8/PPP1Q1PP/R1B1K2R b KQkq - 1 12,b6c7 a4c5 c7a5 c1d2 a5c5 e5d3,2527,107,90,569,advantage hangingPiece long middlegame,https://lichess.org/HUKQ8HrL/black#24,French_Defense French_Defense_Pelikan_Variation
VrkOD,3R1r1k/pp3p2/2p2qp1/5b2/8/5N2/PPQ2PPP/4R1K1 b - - 0 27,f5c2 d8f8 h8g7 f3e5 g7f8 e5d7 f8g7 d7f6,2562,106,88,863,crushing endgame exposedKing fork hangingPiece veryLong,https://lichess.org/HERE1YxC/black#54,
VuKD4,6k1/2B2pp1/2pr4/4p2p/P3Pn1n/1B2KP2/2P5/8 b - - 1 36,h4g6 c7d6 h5h4 e3f2 h4h3 f2g3 g6h4 d6e5 h3h2 g3h2 h4f3 h2g3,2581,104,89,625,crushing endgame hangingPiece veryLong,https://lichess.org/aBqOsOQI/black#72,
VvXFW,8/6kp/3rB1p1/1QBP1p2/p3pP2/7K/1b4PP/4q3 b - - 9 34,g7h6 b5b2 e1d1 h3g3 e4e3 c5e3,2540,90,84,69,crushing endgame hangingPiece long,https://lichess.org/4JwwBqQI/black#68,
Vxu9t,r5k1/4rppp/pp1N4/2ppP2q/3n1P2/2N3R1/PPP2Q2/3R2K1 w - - 4 23,c3d5 h5d1 g1h2 e7e6 d5f6 e6f6,2568,99,79,498,advantage hangingPiece long middlegame,https://lichess.org/imtZW9Up#45,
W3R2q,r1bqk1nr/1p1p1ppp/p3pb2/2p1P3/P1B3Q1/2NP1N2/1P3PPP/n1BK3R b kq - 0 10,a1b3 c4b3 h7h5 g4g3,2519,367,-50,3,equality hangingPiece middlegame short,https://lichess.org/PtZHIXKt/black#20,
W9cCM,r1b1k2r/pp2bpp1/2nq3p/1B1p4/3N2PP/8/PPP1QP2/R1B1K1R1 w Qkq - 2 13,c1f4 d6f4 d4c6 b7c6 b5c6 e8d8,2554,84,81,70,crushing defensiveMove hangingPiece long middlegame,https://lichess.org/CmsAdNRl#25,Sicilian_Defense Sicilian_Defense_Scheveningen_Variation
WClbj,2r1N3/5p1k/1p5p/p1nPp1p1/P1Q1P2q/2B4P/1P3nPK/4R3 b - - 0 34,c5e4 c4c8 h4f4 h2g1 g5g4 e1e4 f2h3 g2h3,2505,98,90,1325,crushing hangingPiece master middlegame veryLong,https://lichess.org/YMnYTNrS/black#68,
WEPXG,8/6rk/2bpN3/p1pPp2p/P1P1Pp1b/1P3P1P/2R5/7K b - - 1 41,g7g8 d5c6 g8c8 c2g2 c8c6 e6f8 h7h8 f8g6,2568,85,74,102,crushing endgame exposedKing hangingPiece quietMove veryLong,https://lichess.org/93aOmZ8Q/black#82,
WERfQ,4rk2/2qr1p1p/R2p4/2pB1Q2/1pP4b/8/1P3PP1/4R1K1 w - - 0 31,f5h7 e8e1 g1h2 h4f6 a6a8 d7d8 a8d8 f6d8,2549,110,90,329,crushing hangingPiece middlegame veryLong,https://lichess.org/BwviqQt3#61,
WFWDp,r7/6bk/p3Q2p/2p1p3/2P5/3P3P/1q4P1/R4R1K w - - 3 35,f1f7 b2a1 h1h2 a1d4 f7g7 h7g7,2527,86,51,49,crushing endgame hangingPiece long,https://lichess.org/Caj0qNR4#69,
WHbcf,8/1p4K1/p2B4/2P3kP/P5n1/8/8/8 w - - 3 68,d6f4 g5f4 g7f7 f4e5 f7g6 e5e6,2541,103,35,23,crushing defensiveMove endgame hangingPiece long,https://lichess.org/U3UwjYN7#135,
WJS4B,3b4/8/2K1k3/p1P4p/PpN2p1P/1P6/5P2/8 w - - 0 43,c4a5 d8a5 c6b5 a5d8 a4a5 e6d7,2591,90,91,152,crushing defensiveMove endgame hangingPiece long,https://lichess.org/LFKK9muL#85,
WJv6c,1Q2R3/1br2pp1/p4qkp/2N5/1Pr1p3/4P1P1/5PP1/R5K1 w - - 8 30,b8c7 f6a1 g1h2 c4c1 g3g4 c1h1 h2g3 a1g1,2513,79,90,253,clearance crushing hangingPiece middlegame veryLong,https://lichess.org/opnisu0F#59,
WK9dg,8/p6k/3pp1p1/5pP1/PP1PpP2/4PbK1/7p/1RB4r b - - 0 37,h1c1 b1c1 h2h1q c1h1 f3h1 g3f2 h1f3 f2e1,2536,79,94,1213,advantage defensiveMove endgame hangingPiece veryLong,https://lichess.org/FIyH0xbY/black#74,
WLYYI,4r1k1/bpp1r2p/p1p5/6p1/3P1Bq1/2P1R3/PP1Q1P1P/4R1K1 w - - 0 26,g1f1 g4f4 e3e7 e8e7 d2f4 e7e1 f1e1 g5f4,2560,105,90,611,crushing hangingPiece intermezzo middlegame veryLong,https://lichess.org/BeNpF8I6#51,
WM9B4,6k1/qb3ppp/1r2P1n1/8/1Q2N3/8/2P1BPPP/3rR1K1 w - - 0 30,e1d1 b6b4 e6e7 g6f8 d1d8 b4b1 e2d1 b1d1,2548,103,89,675,advantage hangingPiece middlegame quietMove veryLong,https://lichess.org/AMu60o6z#59,
WPanR,8/8/8/5k1p/2bP4/p1N3K1/P5P1/8 b - - 5 44,c4a2 c3a2 f5e4 a2b4,2506,86,96,200,crushing defensiveMove endgame hangingPiece short,https://lichess.org/BzR9El7C/black#88,
WR037,4rbk1/PR6/3p4/2pPp1p1/2P3Pp/1R5P/5NQK/2q2n2 w - - 3 40,g2f1 c1f1 b3f3 e5e4 f3f5 f8g7,2553,92,76,130,crushing defensiveMove hangingPiece long middlegame,https://lichess.org/kXQHnry2#79,
WS6Hi,2r1r1k1/pp2p2p/3ppnpB/7P/4PQP1/q4P2/P1PK3R/3R4 b - - 2 23,c8c2 d2c2 e6e5 f4d2,2576,85,80,272,advantage hangingPiece middlegame short,https://lichess.org/8tortlqE/black#46,
WTcd8,7r/8/p2k4/1p1p1pP1/2pR1n1r/P1P1KBRP/2P5/8 b - - 1 34,h4h3 e3f4 h8h4 f4e3 h3g3 d4h4,2514,79,91,1489,crushing discoveredAttack endgame hangingPiece long,https://lichess.org/EoW8tZvV/black#68,
WTnpi,r1bq1r2/1p3ppk/1pp2n1p/5P2/1P1p4/PB4QP/2P3P1/R1B2RK1 w - - 4 19,c1h6 g7h6 b3f7 c8f5 f1f5 f8f7,2578,102,90,949,advantage hangingPiece long middlegame,https://lichess.org/E3xOo8mY#37,Italian_Game Italian_Game_Anti-Fried_Liver_Defense
WVEuu,8/5B2/1k6/R7/8/p5r1/3K4/8 w - - 7 58,a5a7 b6a7 d2c2 g3g7,2574,80,93,72,crushing endgame hangingPiece master short,https://lichess.org/lHWFt9rA#115,
WX10M,2kr2n1/p4R1Q/4p3/1p6/2Kbp3/8/PPP1B2P/R5q1 w - - 0 22,c4b4 g1a1 f7c7 c8b8 c7b7 b8a8 b7a7 d4a7,2586,94,91,154,advantage hangingPiece middlegame veryLong,https://lichess.org/5MRuje5y#43,
WYLRO,r4r1k/5p1p/5Np1/q1pPp1P1/1p2Q2b/P3P2P/1P6/1K3RR1 b - - 3 25,b4a3 e4h4 h7h5 f6h5 a5b4 h4b4,2521,82,94,429,advantage hangingPiece long middlegame,https://lichess.org/bAz8YqeX/black#50,
WYLrm,8/2r2kp1/5p2/4pP2/p2q4/7P/2B1QRPK/8 w - - 1 41,e2b5 d4f2 b5d5 f7e7 d5e6 e7f8 e6d6 c7e7,2527,83,77,105,crushing defensiveMove endgame hangingPiece master veryLong,https://lichess.org/zhx7hR2t#81,
WcRQC,3r3r/p4kpp/6q1/1N5n/4PP2/1P3P2/1P1B1K2/1Q1R3R w - - 5 32,d1g1 d8d2 f2e3 g6b6 e3d2 h8d8,2510,80,82,119,crushing fork hangingPiece long middlegame sacrifice,https://lichess.org/SDJkZSsi#63,
WcoeM,r2q1rk1/pp4pp/3bpnp1/3p4/3P4/2P5/PPQNRPPP/R1B3K1 b - - 0 14,d6h2 g1h2 f6g4 h2g1 d8h4 d2f1,2534,98,86,164,advantage defensiveMove hangingPiece long middlegame,https://lichess.org/OJW5Pkl7/black#28,Queens_Pawn_Game Queens_Pawn_Game_Colle_System
Wdqe9,r1b2r1k/pp2n1pp/q1pb4/3pN3/3PpP2/1Q2P1P1/PP1B1RBP/R5K1 w - - 8 18,g2e4 d5e4 e5f7 f8f7,2585,84,92,989,advantage hangingPiece middlegame short,https://lichess.org/wi9ihO8c#35,Slav_Defense Slav_Defense_Other_variations
WeKYd,r1bk3r/1p2bq1p/pn2p3/3pQ3/2pPp3/4B3/PPP1NPPP/2R1KB1R b K - 3 23,b6d7 e5h8 d8c7 e2f4 e7f6 f4e6,2579,89,77,105,crushing hangingPiece long opening,https://lichess.org/dsbMygTV/black#46,
WgO5F,5rk1/1r2q1bp/b5p1/pN1Rn3/2P3P1/4B3/PP2B3/1K1Q3R b - - 2 25,e5c4 e2c4 e7e4 d1c2 e4c2 b1c2,2561,92,91,4037,advantage hangingPiece long middlegame,https://lichess.org/2S3DmTkP/black#50,
WgyEp,8/8/4k3/1P2B1p1/3K3r/8/7p/7R w - - 2 57,d4c5 e6e5 b5b6 h4h7 b6b7 h7b7,2507,81,92,812,crushing endgame hangingPiece long master masterVsMaster quietMove,https://lichess.org/698v8CRP#113,
WhUpH,2k2b1r/pppq1ppp/5n2/5b2/3r4/2NN1B2/PPP2PPP/R2QR1K1 w - - 2 14,f3b7 c8b7 d1f3 c7c6,2596,92,73,165,advantage defensiveMove hangingPiece master middlegame short,https://lichess.org/8qVnV7ug#27,Elephant_Gambit Elephant_Gambit_Paulsen_Countergambit
WlkXQ,8/8/4K3/3r3k/4R1p1/8/8/8 b - - 0 55,g4g3 e6d5 h5g5 d5e5 g3g2 e4e1,2512,80,96,126,crushing defensiveMove endgame hangingPiece long rookEndgame,https://lichess.org/bRePRBvy/black#110,
WmcPH,2k1r3/qp3ppp/3r1B2/2bp4/8/2P2Q2/PP3PPP/R3R1K1 b - - 0 17,d6f6 e1e8 c8d7 f3e2 f6f2 e2b5,2552,91,81,66,advantage hangingPiece long middlegame quietMove,https://lichess.org/xXgaYnLN/black#34,French_Defense French_Defense_Tarrasch_Variation
Wn62I,2rr2k1/p4p1p/1bq2QpB/8/3p4/2N4R/PP4KP/3R4 w - - 1 28,c3e4 c6e4 h3f3 e4e2 g2h3 e2e6 f6e6 f7e6,2545,93,89,646,advantage fork hangingPiece middlegame veryLong,https://lichess.org/W7YGMZ0y#55,
WnrPe,1r4r1/p6k/3R3p/1bp1qp2/4pN2/2P1Q2P/PP4P1/3R2K1 w - - 5 31,d6h6 h7h6 d1d5 e5f6,2521,80,92,1358,advantage hangingPiece middlegame short,https://lichess.org/2faED9FY#61,
Wo6b7,2r5/pp1kbppp/4p3/q2pP3/N5P1/PP3Q2/1Br2P1P/R1R3K1 w - - 5 19,a4c3 c2b2 b3b4 a5c7 c3a4 c7c1 a1c1 c8c1,2576,92,80,69,advantage hangingPiece middlegame veryLong,https://lichess.org/Vd80eX7e#37,Sicilian_Defense Sicilian_Defense_Old_Sicilian
X0ipJ,1r4k1/R2B1ppp/8/3n4/3P4/5R2/P1r3PP/6K1 w - - 1 22,f3f7 g8f7 d7a4 c2c7 a7c7 d5c7,2511,91,81,333,advantage endgame hangingPiece long master,https://lichess.org/AMtUIoG6#43,
X133C,k1b4r/6pp/1p1Q1p2/pN6/P7/8/1P3PPP/1qB1K2R w K - 1 25,d6b6 b1c1 e1e2 c1c2 e2f3 c8b7,2531,92,83,43,crushing hangingPiece long middlegame,https://lichess.org/7NrTtBp9#49,
X5Qvf,8/8/6p1/3K2P1/2pP1p2/2k5/3N4/8 w - - 0 53,d5e4 c3d2 d4d5 d2e2 d5d6 f4f3 d6d7 f3f2 d7d8q f2f1q,2576,112,91,1300,advancedPawn crushing endgame hangingPiece promotion veryLong,https://lichess.org/tVVMYDAw#105,
XAzpv,rr3qk1/5p2/1p2p1pQ/n2pP1P1/2pP1P2/R1P2R2/3N3P/6K1 w - - 6 30,h6h4 f8a3 f4f5 e6f5 f3h3 g8f8 h4h8 f8e7 h8f6 e7d7,2557,110,90,1009,advantage defensiveMove hangingPiece middlegame veryLong,https://lichess.org/dbaFX3hV#59,
XBK8p,8/P1n5/8/2Np4/1P1k4/5p2/2P5/5K2 w - - 0 52,b4b5 d4c5 f1f2 c5b6 f2f3 b6a7,2531,99,91,1088,crushing endgame hangingPiece knightEndgame long,https://lichess.org/0mDQU5fq#103,
XDLNI,8/5RP1/8/8/3p4/3kp3/6r1/5K2 b - - 6 57,g2g7 f7g7 d3d2 g7g2 d2d1 g2e2 d1c1 e2e1,2513,80,84,96,crushing endgame hangingPiece rookEndgame veryLong,https://lichess.org/QdwHf3Zb/black#114,
XDZmG,6k1/p5pp/2Q5/5r2/P1Pp1n1P/3P4/1q2NPK1/R6R w - - 0 28,g2h2 b2e2 a1f1 e2h5 c6a8 f5f8,2521,89,85,173,crushing hangingPiece long middlegame pin,https://lichess.org/7RD3JC6g#55,
XFfdx,3qk3/1b1p1pp1/p3p3/1pr3P1/3nPQBr/P1N3KP/1PP2P2/R4R2 b - - 6 20,c5c3 g3h4 d8c7 f4c7,2587,80,84,378,advantage hangingPiece middlegame short,https://lichess.org/hqsSR64y/black#40,
XGE2r,r3r1k1/4bppp/pNp2n2/2p2q2/3p1B2/P2P4/1PP2PPP/R2QR1K1 w - - 4 17,b6a8 f5f4 d1f3 f4f3 g2f3 f6d5,2526,80,73,189,advantage defensiveMove hangingPiece long middlegame,https://lichess.org/AKsISiWW#33,Sicilian_Defense Sicilian_Defense_Old_Sicilian
XHRQU,2kr2r1/p1p2p2/Bp1p3p/7b/1Q1qPp1P/3P1p1K/P1P5/1R3R2 b - - 1 23,c8b8 b4d4 g8g2 f1f3 h5f3 b1g1 d8g8 g1g2 f3g2 h3h2 g2f3 d4f2,2529,87,83,84,advantage clearance hangingPiece middlegame veryLong,https://lichess.org/aNdmsqFM/black#46,
XJBeC,2kr4/5p2/1p5q/1QnBpP2/2P3pr/6R1/5P2/3R1K2 b - - 5 31,d8d5 d1d5 h6c1 f1e2 c1c2 d5d2,2564,82,81,278,advantage hangingPiece long middlegame,https://lichess.org/0pAI1IUa/black#62,
XLF1a,8/6k1/3BP3/p1P1Kp2/4bP2/3r4/8/8 b - - 0 39,d3d6 c5d6 g7f8 e5f6 f8e8 d6d7 e8d8 e6e7 d8d7 f6f7,2562,109,90,707,advancedPawn crushing defensiveMove endgame exposedKing hangingPiece veryLong,https://lichess.org/dm4oafrA/black#78,
XN8h4,r1bq1rk1/pp3ppp/4pb2/2p5/3P3P/3B1N2/PPP2PP1/R2QK2R w KQ - 0 11,d3h7 g8h7 f3g5 h7h6,2538,97,89,2191,advantage hangingPiece middlegame short,https://lichess.org/cHl3NsTq#21,French_Defense French_Defense_Rubinstein_Variation
XSqra,8/p7/Q3p3/2Rb1p2/8/Pk6/1P1q1PPP/6K1 w - - 11 48,c5d5 e6d5 a6b5 b3a2 h2h4 d5d4,2554,108,91,467,crushing defensiveMove endgame hangingPiece long,https://lichess.org/Ejs3VVht#95,
XTpfP,r7/pp3pk1/1qp2pnp/8/1P1N2bN/1BP3Q1/P5PP/5K2 b - - 0 22,g6h4 g3g4 h4g6 b3f7 g7f7 g4e6 f7f8 e6f6 f8e8 f6g6,2549,89,83,55,advantage attraction deflection fork hangingPiece master middlegame veryLong,https://lichess.org/eDX7Swij/black#44,
XVAKG,2rq1rk1/3nbppp/p2p4/1p1PpQ2/7P/P1N1B3/1PP2PP1/R3K2R b KQ - 0 16,d8a5 f5d7 c8c3 b2c3 a5c3 e1e2,2521,92,84,744,advantage defensiveMove hangingPiece long middlegame,https://lichess.org/BDy9OwWd/black#32,Sicilian_Defense Sicilian_Defense_Lasker-Pelikan_Variation
XWYBa,6k1/1p5p/p1b1q1p1/3p2P1/1P1RpBn1/PB4K1/8/4R3 b - - 3 40,g4f2 g3f2 e6h3 e1e3 h3h4 f4g3,2588,79,82,303,advantage hangingPiece long master middlegame,https://lichess.org/TtheR6aV/black#80,
XWnC5,1k1r2r1/p1p5/1pPp4/3P1p1p/QP5q/P4B1P/5bP1/1R3R1K b - - 1 25,g8g3 f1f2 g3h3 g2h3 h4f2 a4d1,2552,89,70,86,crushing defensiveMove hangingPiece long middlegame,https://lichess.org/wXOziAZD/black#50,
XbnCZ,2k2b1r/ppp3pp/2n1bp2/1N1r4/4Q3/2P1B3/q4PPP/1R2KB1R b K - 1 17,f6f5 e4e6 c8b8 f1d3,2546,102,83,170,crushing hangingPiece middlegame short,https://lichess.org/eKh3C80q/black#34,Englund_Gambit_Complex Englund_Gambit_Complex_Stockholm_Variation
Xfw1n,1k1r2nr/pp4p1/1q2p1Pp/1N6/3Pp1P1/3Q4/PP4K1/2R2R2 w - - 0 25,d3e4 b6b5 c1c5 b5a6,2511,97,78,51,advantage hangingPiece middlegame short,https://lichess.org/T4ecRghc#49,
XiiCq,1r5k/p1R3pp/2p1r3/4N3/3P4/1Pq4P/P5P1/R2Q3K w - - 0 23,d1f3 c3a1 h1h2 a1d4 e5c6 d4d6,2511,77,91,121,advantage hangingPiece long middlegame,https://lichess.org/J3A5Nijp#45,
XkK8h,r5k1/1bq2rp1/p4nQP/3p3P/1B1bpp2/8/PPP5/1K1RRB2 b - - 1 27,e4e3 d1d4 f6e4 d4e4,2568,103,90,498,advantage hangingPiece master middlegame short,https://lichess.org/zh9G9vhg/black#54,
XkfoT,r1b1r1k1/1p3p1p/p2p1qpQ/2bP4/2PpBB2/3P2P1/PP5P/R4RK1 w - - 2 17,f4e5 f6e5 f1f7 g8f7 h6h7 f7f6,2502,94,70,59,crushing defensiveMove hangingPiece long middlegame,https://lichess.org/xjXsLOKd#33,Sicilian_Defense Sicilian_Defense_Staunton-Cochrane_Variation
XlO2D,8/5K2/1p2r2P/4k1P1/3Rb3/8/8/8 b - - 10 51,e5d4 f7e6 b6b5 e6f7 b5b4 g5g6,2521,101,88,262,crushing endgame hangingPiece long master,https://lichess.org/7BPCQ6Z8/black#102,
XozCE,r4rk1/ppp2pp1/4b2p/4B3/Qn5q/3B3P/PP3PP1/R3R1K1 b - - 7 19,e6d7 a4d7 a8d8 d7a4,2549,94,91,736,crushing hangingPiece master middlegame short,https://lichess.org/fMAehiFb/black#38,Italian_Game Italian_Game_Classical_Variation
XqyvG,2r3k1/p1q3bp/3ppBp1/6Q1/b1r1P1P1/1Np2P2/PPP5/1K1R3R w - - 2 23,h1h7 g8h7 d1h1 h7g8 g5g6 a4e8 g6h7 g8f8 f6g7 c7g7,2529,94,75,93,crushing hangingPiece middlegame veryLong,https://lichess.org/tJUH8198#45,
XuukB,8/6R1/8/p7/r3pn2/P1P1K1kp/3P4/8 b - - 1 48,g3h4 e3f4 e4e3 f4e3 h3h2 e3f2 a4a3 g7h7,2500,105,88,929,advantage endgame hangingPiece veryLong,https://lichess.org/y4mKDHdS/black#96,
Y1pny,r4k1r/1p3ppp/8/nBpP4/p3Q1b1/P1P1P1q1/1P4P1/1K1R2NR w - - 1 20,d5d6 g4d1 e4e7 f8g8 d6d7 g3b8,2579,100,73,145,advantage defensiveMove hangingPiece long middlegame,https://lichess.org/I56lr0ln#39,
Y39bP,7k/5pq1/5N1p/ppp1R3/2pr1QbP/3p2P1/PP3P2/6K1 w - - 3 34,f4d4 c5d4 e5e8 g7f8 e8f8 h8g7 f8d8 g7f6,2540,84,92,755,crushing endgame hangingPiece veryLong,https://lichess.org/2f1VwwW7#67,
Y5BBh,1n3r2/1R5N/8/r2B1k2/8/p1b1BN1p/P4PbP/6K1 w - - 14 37,h7f8 a5d5 b7f7 f5e4,2534,84,83,256,advantage hangingPiece middlegame short,https://lichess.org/upllVEVq#73,
Y7aql,3R2k1/6p1/5r2/4p3/4b1Kp/2q2B1P/2P5/5Q2 b - - 1 31,g8h7 f3e4 g7g6 f1d3,2581,93,72,88,crushing endgame hangingPiece short,https://lichess.org/PsYJyQDU/black#62,
Y85U1,8/2p5/6R1/1p1k3r/2pP2K1/7N/1P6/8 b - - 0 40,h5h3 g4h3 b5b4 g6g7 c7c6 g7d7,2520,88,65,82,crushing endgame hangingPiece long rookEndgame,https://lichess.org/0BdXVJvV/black#80,
Y8DC1,2r1q1k1/1R1Q2p1/8/pP1p4/3b4/P4N2/5PP1/6K1 b - - 3 31,d4f2 g1f2 c8c2 f2g1 e8e3 g1h2 e3h6 d7h3 h6h3 h2h3,2508,82,83,68,crushing endgame hangingPiece veryLong,https://lichess.org/TAFnarPK/black#62,
Y8KFj,r3r2k/pp2b2p/2p2p2/4Pbq1/2Q5/2B3P1/P4PBP/1RR3K1 w - - 3 26,b1b7 g5c1 g2f1 f5e6 c4e6 c1c3,2519,181,100,24,deflection equality hangingPiece long middlegame,https://lichess.org/dfz9AFYJ#51,
Y8xyC,2r1r1k1/2q2pbp/p2p1Bp1/N2np2P/6P1/2P2P2/P1KQN3/3R3R b - - 0 23,g7f6 d2d5 e5e4 h5g6,2501,87,77,92,advantage hangingPiece middlegame pin short,https://lichess.org/OsUa9JKP/black#46,
Y92JR,8/pQ5p/n1p3pk/3p2q1/3P4/1N6/PPP2P2/4K3 b - - 0 29,a6b4 b7b4 g5g1 e1e2 g1g4 e2f1,2509,83,89,578,advantage defensiveMove endgame hangingPiece long,https://lichess.org/t0ODXl5A/black#58,
YCZ1e,Q7/p4rk1/1p1R2p1/4p2p/P7/1KPB4/1P4P1/1r4q1 b - - 4 49,b1b2 b3b2 f7f2 d3c2 g1g2 d6d7 g7h6 a8h8,2506,79,84,396,crushing endgame hangingPiece veryLong,https://lichess.org/xghEQAEp/black#98,
YD04b,2k2r1r/1p1b4/p7/2bQ3P/1pP1qN2/6B1/P4PP1/2R3KR b - - 6 30,f8f4 d5c5 d7c6 h1h2,2560,91,90,90,advantage defensiveMove hangingPiece middlegame short,https://lichess.org/7R9onzpt/black#60,
YGvJ8,8/6pp/1rk5/2NN4/1p1n4/3B2pP/PP1P1qP1/1RBKR3 w - - 1 35,d5e7 c6c5 b2b3 f2g2 c1b2 g2f3 d1c1 f3d3,2501,94,91,1038,advantage fork hangingPiece middlegame veryLong,https://lichess.org/0QxpahMR#69,
YLDjm,4Rr2/8/2p2Bp1/6K1/3kb1PP/8/8/8 b - - 22 44,f8f6 g5f6 c6c5 e8d8,2526,101,89,434,crushing endgame hangingPiece master short,https://lichess.org/QXg6VblD/black#88,
YLfCe,2r3k1/p2nRppp/Q7/3p4/3P1q2/2NP1N1P/Pr3KP1/R7 w - - 0 19,f2g1 c8c3 e7e8 d7f8 g1h1 b2g2 a6a5 g2e2 e8e2 f4f3,2506,97,61,71,advantage hangingPiece middlegame veryLong,https://lichess.org/v8iqqgi8#37,French_Defense French_Defense_Exchange_Variation
YLvMB,r1bqr1k1/2R2ppp/p2bp3/3nB3/1p6/5N1P/PP2QPP1/1B1R2K1 w - - 6 21,d1d5 e6d5 e2d3 g7g6 e5d6 d8d6,2500,110,90,995,advantage hangingPiece long middlegame quietMove,https://lichess.org/8VDdag6O#41,
