PuzzleId,FEN,Moves,Rating,RatingDeviation,Popularity,NbPlays,Themes,GameUrl,OpeningTags
00Xop,r2q1rk1/2p2nbp/1B1p2p1/4p1N1/4P1P1/1bN4P/PP1Q1P2/2KR3R w - - 0 18,b6c7 d8c7 a2b3 f7g5,2535,103,90,1013,crushing hangingPiece master middlegame short,https://lichess.org/Bw3qJ0LJ#35,Queens_Pawn_Game Queens_Pawn_Game_Other_variations
02Ht4,r1b2rk1/1pR3b1/3q2p1/1Q1Pp2p/4P2P/5p2/B4PP1/R4NK1 w - - 0 25,g2g3 d6c7 d5d6 a8a2 d6c7 a2a1,2590,87,91,2447,advantage hangingPiece long middlegame,https://lichess.org/B8bFeLSf#49,
04epC,2rr2k1/p4pp1/1n2p2p/4Q2n/3PP2q/1B3P2/PP1B1P1P/R4R1K w - - 4 19,d2h6 g7h6 b3e6 f7e6 e5e6 g8h7 e6f5 h7h8,2503,82,90,144,advantage defensiveMove hangingPiece middlegame veryLong,https://lichess.org/ZNFbWZ67#37,
04zwt,r4rk1/p1p3qp/1pnp2p1/3N4/2P1PRB1/7Q/Pb4PP/5R1K w - - 0 26,d5c7 g7c7 g4e6 g8g7,2595,85,78,163,crushing defensiveMove hangingPiece middlegame short,https://lichess.org/XrTqGPDZ#51,
05NV9,8/8/1p3p2/1P2p3/4P1pk/4K2p/2r2N2/7R b - - 7 55,c2f2 e3f2 f6f5 e4f5 g4g3 f2f3 e5e4 f3f4 h3h2 f5f6 h4h3 f6f7,2591,104,85,205,advancedPawn crushing endgame hangingPiece rookEndgame veryLong,https://lichess.org/OvsjQJ5P/black#110,
07BkM,5rk1/p2p2pp/1p2bp2/6P1/q4P2/P1Q2N2/1Kn4P/3R1R2 b - - 3 33,c2e3 c3e3 a4c4 e3c3,2508,84,85,85,advantage hangingPiece middlegame short,https://lichess.org/l4p0ojJs/black#66,
09f7l,5kr1/8/2p1pp1N/p1Pn4/1p3n2/8/PP1BRPP1/2K5 w - - 11 34,h6g8 f4e2 c1d1 e2d4,2501,80,82,128,advantage defensiveMove endgame hangingPiece short,https://lichess.org/W0V8oiHS#67,
0C3n8,2k2b1r/ppp2Bpp/4pn2/4r3/1P6/q1N2Q1P/2P2PP1/3R1K1R w - - 0 16,f7e6 e5e6 f3f5 a3a6 b4b5 g7g6 b5a6 g6f5,2578,92,92,596,crushing hangingPiece middlegame veryLong,https://lichess.org/fUXTxXlv#31,Scandinavian_Defense Scandinavian_Defense_Main_Line
0CFAe,r1b2rk1/pp2bppp/2n1p3/3qP3/3P3P/3B1N2/P4PP1/R1BQK2R w KQ - 1 12,d3h7 g8h7 f3g5 h7g8 d1h5 e7b4,2507,102,81,154,advantage hangingPiece long opening,https://lichess.org/l1sRrfef#23,English_Opening English_Opening_Mikenas-Carls_Variation
0Cfvp,r3kb1r/pp1n1ppp/4p3/1Q1pqP2/8/2N1B3/PPP3PP/R4RK1 w kq - 4 14,f5e6 e5e3 g1h1 f7e6 c3d5 e3c5 b5c5 f8c5,2576,79,91,603,advantage hangingPiece intermezzo middlegame veryLong,https://lichess.org/UevH0pBS#27,Bird_Opening Bird_Opening_Dutch_Variation
0HGt4,5r2/p2k1Pp1/qp2p3/3pPn2/2pPr3/P1P3Q1/PR6/2B2RK1 w - - 4 24,f1f5 e6f5 g1f2 e4g4 e5e6 d7e6,2577,81,83,161,crushing hangingPiece long middlegame,https://lichess.org/r9t8uLmr#47,
0Huzq,3r2k1/R1p4p/6pP/2p2pN1/2b1pP2/2K3P1/8/8 b - - 11 41,e4e3 c3c4 e3e2 a7a1 d8e8 a1e1,2577,84,92,915,crushing endgame hangingPiece long master quietMove,https://lichess.org/G5h4Ib80/black#82,
0JHIK,r4rk1/1bq2p1p/4pRp1/pppnP1N1/2pPB3/4P1P1/PP2Q2P/R5K1 w - - 0 20,g5h7 g8h7 e2h5 h7g7 h5g5 d5e7,2585,93,81,45,crushing defensiveMove hangingPiece long middlegame,https://lichess.org/Z0XQeLII#39,
0JhDP,7R/pk1p2p1/4p3/2b3BQ/8/6q1/2P2rP1/R6K w - - 5 31,h8b8 g3b8 a1b1 c5b6,2591,82,91,511,crushing defensiveMove hangingPiece middlegame short,https://lichess.org/mcgdbXDN#61,
0KfaI,1r6/2b3p1/6kp/p4rp1/P3Q2B/2q1P1P1/2p2P1P/2R1R1K1 w - - 5 34,c1c2 c3e1 g1g2 e1b4 c2c6 c7d6,2595,90,82,66,crushing hangingPiece long middlegame,https://lichess.org/ukxzQVNy#67,
0UHgS,2R5/5pk1/6pp/Q3pq2/8/p2P3P/2p3PK/4R3 w - - 1 41,e1e5 f5c8 e5c5 c8b8 a5c7 b8c7 c5c7 a3a2 c7c2 a2a1q,2574,86,93,289,advancedPawn crushing endgame hangingPiece promotion veryLong,https://lichess.org/0D240IxJ#81,
0WDfT,r1bqk2r/2p3pp/p4p2/1pbnn3/8/1B1P4/PPP2PPP/RNBQR1K1 w kq - 0 11,e1e5 f6e5 d1h5 g7g6 h5e5 d8e7 e5e7 d5e7,2529,99,90,286,advantage hangingPiece middlegame veryLong,https://lichess.org/YMXUHD7q#21,Ruy_Lopez Ruy_Lopez_Berlin_Defense
0XQQM,5rk1/pppRb2p/4p1p1/4Pr2/6Q1/2q1B3/P4PPP/5RK1 b - - 1 22,c3e5 d7e7 e5d6 e3g5 h7h6 g5h6,2564,83,72,94,advantage hangingPiece long middlegame quietMove,https://lichess.org/CTVOxDGg/black#44,
0YGMa,2r3k1/5p2/PQBqp1pb/7p/8/4P2P/6P1/2R3K1 b - - 0 29,h6e3 b6e3 c8c6 c1c6 d6c6 a6a7 h5h4 e3a3,2549,82,85,478,advancedPawn crushing defensiveMove endgame hangingPiece veryLong,https://lichess.org/bZ06VVOc/black#58,
0aBqg,4bkrr/4qp2/p1BNp1p1/PpP1P2n/3P3R/5Q2/5PK1/7R b - - 0 37,h5f4 h4f4 e7g5 g2f1,2570,81,84,89,crushing defensiveMove hangingPiece master middlegame short,https://lichess.org/BCuGIkwT/black#74,
0cUg0,4r1k1/p2qBp2/2p2Ppb/1rN4n/4p2Q/1P1P3R/P1P4P/5RK1 b - - 0 24,b5c5 e7c5 e8e5 c5e3 h6e3 h3e3,2573,84,89,196,advantage hangingPiece long master middlegame,https://lichess.org/V64cnzh7/black#48,
0eKbL,8/R4pk1/2KN2p1/4p2p/8/3r4/8/8 b - - 3 52,d3d6 c6d6 g7f6 d6d5 h5h4 d5e4,2507,83,99,202,advantage endgame hangingPiece long master rookEndgame,https://lichess.org/WJufCmhY/black#104,
0fiY9,r1bqk2r/pp1p1p2/2n1p2p/6p1/1b2n3/1NNQ2B1/PPP2PPP/R3KB1R b KQkq - 1 10,d8f6 d3e4 b4c3 b2c3 f6c3 e1d1 f7f5 e4e3 c3e3 f2e3,2514,100,90,592,advantage hangingPiece middlegame veryLong,https://lichess.org/s4vCMmUK/black#20,Sicilian_Defense Sicilian_Defense_Four_Knights_Variation
0gHNm,8/5K2/4p3/2p1P1P1/2Pp4/2kn4/5N2/8 w - - 0 50,g5g6 d3f2 g6g7 f2g4,2533,106,90,529,crushing endgame hangingPiece knightEndgame master short,https://lichess.org/6nD8mEJy#99,
0gLU1,8/1p6/p7/4K3/8/P3p1k1/1P2Bp2/8 b - - 6 85,f2f1q e2f1 g3f2 f1d3 a6a5 e5d6 a5a4 d6c7,2515,91,82,47,crushing endgame hangingPiece veryLong,https://lichess.org/r1fdJx2J/black#170,
0gXJ2,r1b1kb1r/p1qp1ppp/1pn1pn2/1B2P3/8/2N2Q2/PPP2PPP/R1B1K1NR b KQkq - 0 8,c6e5 f3a8 f8b4 g1e2 e8g8 c1f4,2574,99,89,803,advantage hangingPiece long opening quietMove,https://lichess.org/EXmRxSx0/black#16,Sicilian_Defense Sicilian_Defense_Smith-Morra_Gambit
0iN33,2b5/8/p7/1p1P4/2p1N2k/P1P1K1p1/1P6/8 w - - 0 48,e4g3 h4g3 a3a4 c8f5 e3d4 g3f4,2508,88,78,87,crushing defensiveMove endgame hangingPiece long quietMove,https://lichess.org/S3fQGQDu#95,
0if5P,1k1rr3/pB1bq1p1/1np4p/3pp3/Q2P4/1R2P3/PP3PPP/1KR5 w - - 2 24,b3b6 a7b6 b7c6 d7c6 c1c6 e7a7,2507,82,86,52,clearance crushing hangingPiece long master masterVsMaster middlegame,https://lichess.org/ZIqJ030q#47,
0lwHP,r3q1r1/1k6/1pnpp2b/1B3p2/3BbNpp/1P2P3/P3QPPP/2R2RK1 w - - 4 25,f4e6 e8e6 b5c6 e4c6 c1c6 b7c6 f1c1 c6d7 e2b5 d7e7 c1c7 e7f8,2570,113,90,969,advantage defensiveMove hangingPiece master middlegame veryLong,https://lichess.org/218TcZTT#49,
0nHEY,2Kb4/3P4/5k2/8/p7/8/8/3B4 b - - 1 55,a4a3 c8d8 a3a2 d8e8 f6f5 d7d8q a2a1q d8d3,2596,88,30,71,advancedPawn bishopEndgame clearance crushing endgame hangingPiece master promotion veryLong,https://lichess.org/783643yU/black#110,
0r9ML,1R6/7k/b3Q3/p2P1rq1/2Pp2p1/P2Pb1P1/6BK/8 w - - 2 30,e6f5 g5f5 g2e4 f5e4 d3e4 d4d3 d5d6 d3d2 b8b1 a6c8,2599,81,94,862,advancedPawn crushing defensiveMove endgame hangingPiece veryLong,https://lichess.org/8TYWxh4X#59,
0rJ2n,r1bq1rk1/pppp1ppp/5nn1/8/4P3/2BB4/PPP2PPP/R2QK1NR b KQ - 0 9,f6e4 d3e4 d8e7 d1e2 f8e8 e4g6,2519,89,79,185,crushing hangingPiece long opening quietMove,https://lichess.org/rqCM5I5q/black#18,Nimzowitsch_Defense Nimzowitsch_Defense_Kennedy_Variation
0v8ts,4b1k1/4Q1b1/4P1p1/1p1P4/1Pp4p/2N3nP/4B1P1/q2N2K1 b - - 2 36,g7c3 e7e8 g8g7 e8e7 g7h6 e7h4,2594,96,80,210,crushing exposedKing hangingPiece long middlegame,https://lichess.org/APaiwHGN/black#72,
0viMS,6k1/q4ppp/4pn2/2ppNB2/1n6/1Q2P3/rP1N1PPP/1K1R3R w - - 1 20,f5h7 g8h7 b1c1 a2a4,2571,105,39,104,advantage defensiveMove hangingPiece middlegame short,https://lichess.org/vpXecI97#39,
0yvow,8/8/2P5/7p/2NR4/p1rp4/4k1KP/8 w - - 0 48,c4a3 c3a3 d4e4 e2d1 e4c4 a3a2 g2f3 a2c2,2543,79,92,372,crushing endgame hangingPiece veryLong,https://lichess.org/qWjbt2Dn#95,
0zIH2,5r2/1pr3k1/1q1pB1p1/p7/7Q/1P5P/P5P1/2R2R1K w - - 1 29,f1f8 c7c1 h1h2 b6g1 h2g3 c1c3 f8f3 g1e1 g3h2 e1h4,2515,79,89,1039,crushing deflection endgame fork hangingPiece skewer veryLong,https://lichess.org/T9UV3Z7U#57,
13nt3,1rQb2k1/1P5p/6p1/4p3/8/7P/4p1P1/3rR2K w - - 4 41,c8b8 d1e1 h1h2 e1d1 b8e5 e2e1q e5e1 d8c7 g2g3 d1e1,2592,83,98,57,advancedPawn clearance crushing endgame hangingPiece intermezzo promotion quietMove veryLong,https://lichess.org/LpoI6sMT#81,
15LHY,1N5k/1p4p1/p3B3/6pq/5p1n/6n1/PP4Q1/R1B1R1K1 w - - 7 35,e6g4 h5g4 e1e8 h8h7 g2c2 g3e4,2508,107,90,970,crushing discoveredAttack hangingPiece long middlegame,https://lichess.org/GKDF8uV2#69,
15O1g,5k1N/pp4pR/2np4/1qpN1p2/8/3P2b1/PPP5/R1BQrK2 w - - 1 19,f1g2 e1d1 c1h6 g3e5 h8g6 f8g8,2557,111,90,455,advantage hangingPiece long middlegame,https://lichess.org/ytShae53#37,Sicilian_Defense Sicilian_Defense_Closed
17fwx,6k1/pp1b2p1/2n1p2p/3p2qP/3P4/2PB1rpR/PP3r2/1K1Q2R1 b - - 1 21,f2d2 d1f3 d2d3 f3d3 e6e5 g1g3,2519,83,75,99,advantage hangingPiece long middlegame,https://lichess.org/UQst2MeI/black#42,
1A3WO,5k2/1R3P1P/8/6B1/2p5/2b2K2/1p6/7r w - - 1 60,h7h8q c3h8 g5e7 f8f7 e7a3 f7e6 a3b2 h8b2,2577,104,90,226,advantage endgame hangingPiece interference veryLong,https://lichess.org/DQbhQ7Vy#119,
1CQyg,1rb2r1k/1p5p/p1p3p1/2Np4/1P1Pp1P1/P3b3/1B4P1/1BR2R1K b - - 1 25,e3c1 f1f8 h8g7 f8c8 b8c8 b2c1,2523,82,92,3380,advantage hangingPiece long middlegame,https://lichess.org/aQGbg8PX/black#50,
1Ien8,r2q1k2/pp1r2pp/5p2/2N2P2/8/PP2PQ2/1B1b2PP/2R3K1 b - - 2 25,d2e3 f3e3 d7d1 g1f2 d8d2 f2f3,2500,148,85,24,defensiveMove equality hangingPiece long middlegame,https://lichess.org/2GKkeZfz/black#50,
1MEo0,3r1rk1/1p1q3p/pP1PR1p1/P1pQ2b1/2N2p2/2P3pP/6K1/4R3 b - - 1 31,g8h8 d5g5 f4f3 g2g3 f3f2 g5e5,2558,82,85,402,crushing hangingPiece long master middlegame,https://lichess.org/FSapE12U/black#62,
1P4vV,8/2b5/1P6/2B3p1/5p2/7k/3K1P2/8 b - - 0 46,c7b6 c5b6 g5g4 d2d3 h3g2 d3e4,2556,94,84,102,bishopEndgame crushing endgame hangingPiece long,https://lichess.org/Oyn4FMso/black#92,
1PmF5,r3r1k1/pp3ppp/nqp2n2/3p4/8/2PP1PPB/PP3Q1P/RN2R1K1 w - - 1 15,f2b6 e8e1 g1f2 a7b6 f2e1 a6c5 e1d2 c5b3 a2b3 a8a1,2509,97,76,55,crushing hangingPiece intermezzo middlegame veryLong,https://lichess.org/Vx68aFqc#29,Hungarian_Opening Hungarian_Opening_Slav_Formation
1Qabl,5r1k/pp3p2/4p2P/4P2P/4n1Rq/5Q2/P2r1P2/R3K3 b Q - 3 29,h4h2 g4e4 d2f2 f3f2 h2h1 e1d2 f8d8 e4d4 d8d4 f2d4,2555,97,85,118,crushing hangingPiece middlegame veryLong,https://lichess.org/OuKcP2y2/black#58,
1QfqU,r4r1k/1p3R2/p3p2P/3p2PQ/2p5/2P5/PP4b1/R3KBq1 w Q - 0 25,f7h7 h8h7 g5g6 h7g8 h6h7 g8g7 h7h8b f8h8 h5e5 g7h6,2537,79,80,122,crushing hangingPiece middlegame veryLong,https://lichess.org/7zQFApRg#49,
1Teji,6k1/5pp1/3P3p/R2K1r2/8/3R1P2/P3r2P/8 w - - 5 43,d5c6 f5a5 d6d7 e2e6 c6c7 e6e7,2567,94,80,90,crushing endgame hangingPiece long rookEndgame,https://lichess.org/C6i7Ndjf#85,
1TgsG,3rk2r/ppp1bppp/3q4/nQ3b2/4n3/P1N2N2/1PKB1PPP/3R1B1R b k - 3 17,c7c6 b5f5 e4c3 c2c3,2507,94,76,69,advantage fork hangingPiece middlegame short,https://lichess.org/Rx3RCD9z/black#34,English_Opening English_Opening_Kings_English_Variation
1ZGhi,8/4r1pk/1p2Pr1p/p2P1P1b/P3R3/1P1B2QP/3q2K1/4R3 w - - 3 47,g3f2 d2d3 e4d4 h5f3 f2f3 d3d4,2510,82,84,153,advantage deflection hangingPiece long middlegame,https://lichess.org/ZwDcVnY3#93,
1aeA2,r2q1rk1/1b3ppp/p3pn1P/1p4Q1/4p3/2BB1N2/PPP3P1/2K4R b - - 0 18,f6h5 g5h5 g7g6 h5e5 f7f6 e5e6 f8f7 d3e4,2582,100,90,571,crushing hangingPiece kingsideAttack middlegame veryLong,https://lichess.org/TDPRHnT9/black#36,Sicilian_Defense Sicilian_Defense_Taimanov_Variation
1akRx,8/8/p2p1k2/Pp2p1p1/1P2P1P1/1b1BPK2/8/8 w - - 1 34,d3b5 a6b5 a5a6 b3d1 f3g2 d1c2,2506,88,84,98,advantage bishopEndgame endgame hangingPiece long,https://lichess.org/4qnXUZ2T#67,
1cxmH,2k4r/ppp2p2/6qp/2b1B1pn/4P3/P1P5/1P3PPP/RN1Q2K1 b - - 0 17,g6e4 e5h8 h5f4 d1f1 f4e2 g1h1 e4d3 b1d2,2586,84,81,263,crushing defensiveMove hangingPiece middlegame quietMove veryLong,https://lichess.org/3y7DIske/black#34,Kings_Knight_Opening Kings_Knight_Opening_Normal_Variation
1d4P5,r2q1b1r/ppp2k2/5npp/1Q6/4p3/1PN5/PB1P1PPP/n2KR3 b - - 1 16,a1b3 b5b3 f7g7 c3d5 f8e7 e1e4,2579,93,74,157,advantage hangingPiece long middlegame pin,https://lichess.org/PPR6dqGx/black#32,Latvian_Gambit Latvian_Gambit_Mayet_Attack
1eJm8,r4rk1/pR5p/6p1/2PNp3/2P1B1q1/P7/5PP1/4RK2 b - - 0 28,f8f2 f1f2 g4h4 g2g3 h4h2 f2e3,2556,99,93,397,crushing defensiveMove hangingPiece long middlegame,https://lichess.org/h3I7d0O7/black#56,
1eeP0,5rk1/1p4p1/5P2/p2p2Q1/qr3Pb1/6R1/6PP/5RK1 b - - 0 23,f8f6 g5g4 f6f7 g4c8,2579,100,83,94,crushing hangingPiece master masterVsMaster middlegame short,https://lichess.org/7SIRHEWP/black#46,
1hYmi,2kr1r2/ppp2p1p/2np2p1/3Np3/4P3/5Q1P/Pq2NPP1/R1R3K1 w - - 2 17,c1c6 b7c6 f3c3 b2c3,2550,93,90,106,advantage hangingPiece middlegame short,https://lichess.org/v6P7Vgps#33,Kings_Pawn_Game Kings_Pawn_Game_Wayward_Queen_Attack
1iFIO,8/8/2p2K2/4pn1p/6p1/6P1/1k3P2/3B4 b - - 1 48,h5h4 f6f5 h4h3 f5g4 h3h2 d1f3,2531,83,96,63,crushing endgame hangingPiece long,https://lichess.org/MWfjd2Ip/black#96,
1mUlv,2rr2k1/pp3ppp/2N1p3/8/1n2N3/8/PPPR1PPP/2K1R3 b - - 0 17,d8d2 c6b4 d2d4 a2a3,2574,100,90,1107,advantage defensiveMove endgame hangingPiece short,https://lichess.org/5N6FxcDi/black#34,Sicilian_Defense Sicilian_Defense_Chekhover_Variation
1pjEH,5k2/pR4bQ/4b1B1/3p4/3qp1P1/5P1K/P1r5/5N2 b - - 2 33,e6g4 h3g4 c2g2 g4h3 g2g6 h7g6,2505,90,90,223,crushing hangingPiece long middlegame,https://lichess.org/lhEi77SK/black#66,
1qGrc,1r2kbnr/p2b1ppp/1qn1p3/1N6/3P4/1Q2PN2/3B1PPP/R3KB1R w KQk - 5 12,a1a6 b6a6 b5c7 e8e7 d2b4 b8b4 b3b4 c6b4,2521,86,79,164,advantage hangingPiece middlegame veryLong,https://lichess.org/XodEo2Wr#23,Queens_Gambit_Accepted Queens_Gambit_Accepted_Old_Variation
1sUet,8/3k4/1p1P1p1p/1PnR2p1/P7/8/3K3P/8 w - - 1 43,d5c5 b6c5 a4a5 d7d6 d2d3 f6f5 d3c4 f5f4 a5a6 f4f3 a6a7 f3f2 c4c3 f2f1q,2561,111,90,707,advancedPawn advantage endgame hangingPiece promotion quietMove veryLong,https://lichess.org/Zhlx3f6t#85,
21nGU,rnbqk2r/p2pppbp/5np1/2pP4/NpP5/1P3N2/P3PPPP/R1BQKB1R b KQkq - 0 7,f6d5 d1d5 g7a1 d5a8 b8c6 c1h6,2586,99,80,118,advantage defensiveMove hangingPiece long opening trappedPiece,https://lichess.org/pr82nohr/black#14,Benko_Gambit Benko_Gambit_Other_variations
23FYr,8/8/1k1b4/1P1Pp1p1/P1K1Pp1p/5P1P/5P1B/8 w - - 1 45,h2f4 g5f4 c4c3 b6c5,2542,102,89,442,bishopEndgame crushing endgame hangingPiece short zugzwang,https://lichess.org/rh6BG4UI#89,
25ES7,8/4qpkp/2Pp2p1/2PBb2P/1p4P1/1P3Q2/r2r1PK1/4RR2 w - - 1 35,e1e4 d2d5 h5h6 g7h6 c5d6 e7d6,2599,101,89,468,crushing hangingPiece long middlegame,https://lichess.org/eHSJ3qVq#69,
26TRB,6k1/ppq2ppp/8/2b5/2np3B/5Q2/PPR2PPP/4rNK1 b - - 2 19,c4d2 c2d2 c5d6 d2d1 d6h2 g1h1 e1d1 f3d1,2562,110,83,554,advantage hangingPiece middlegame veryLong,https://lichess.org/fgbV4JLe/black#38,Italian_Game Italian_Game_Two_Knights_Defense
26qwE,1r4k1/p4pb1/3p2p1/2pP2Pp/n1q1r3/P1P4Q/1RPN4/KR6 b - - 7 39,c4e2 b2b8 e4e8 h3d7 e8f8 b8f8 g7f8 b1b7 e2d1 d2b1,2525,85,64,66,crushing defensiveMove hangingPiece middlegame veryLong,https://lichess.org/xfAkL7qv/black#78,
27mat,1r4k1/p4Rpp/2pN4/q1P5/3P2n1/8/P1Q3PP/6K1 w - - 1 26,f7f8 g8f8 c2f5 g4f6,2558,80,92,1280,advantage defensiveMove endgame hangingPiece short,https://lichess.org/cHxOALJA#51,
2AUnQ,1rb4b/p7/2p2kBP/1p5R/3q1P2/5p2/PPQNrP2/R4K2 w - - 0 25,d2e4 f6g6 h5g5 g6f7,2538,88,76,42,crushing defensiveMove hangingPiece middlegame short,https://lichess.org/gr7YHRnz#49,
2CmJJ,r1b3rk/1pq5/p4b1p/2BPp2n/2P2p2/2NQ3P/PP4P1/1B2RRK1 w - - 4 25,d5d6 c7c5 g1h2 g8g7 c3e4 c5c6,2575,117,91,1167,advantage hangingPiece long master middlegame,https://lichess.org/15jxDOT5#49,
2FrkX,8/8/3k1p2/1n1p1Pp1/1p1P2Pp/1P5P/pKN5/8 b - - 3 56,b5d4 c2d4 a2a1q b2a1 d6e5 d4e6,2591,95,85,226,crushing endgame hangingPiece knightEndgame long,https://lichess.org/e5IRjfxL/black#112,
2H2Iv,r1b2r1k/3npP1p/p3N1p1/2pP4/1p1b1Q2/1P1B3P/1qP1K1P1/5R1R b - - 5 24,d7e5 e6f8 c8f5 f8g6 e5g6 f4f5,2518,83,72,241,advantage hangingPiece kingsideAttack long middlegame,https://lichess.org/y0kt0GyV/black#48,
2J3gg,kn3r2/ppR3p1/7p/PP1rq3/R7/4B3/4QPPP/6K1 w - - 0 30,a5a6 e5c7 a6b7 c7b7 a4a7 b7a7 e3a7 f8d8,2554,81,76,112,advantage defensiveMove hangingPiece middlegame veryLong,https://lichess.org/yWUuqXhe#59,
2LCey,3r2k1/pb3pbp/1p3rp1/8/3N2Pq/P1P1PP1P/1P3Q1R/RN3K2 b - - 6 25,d8d4 f2h4 d4d1 f1f2 f6f3 f2e2 f3f1 b1d2 b7a6 c3c4,2587,81,77,143,advantage hangingPiece middlegame veryLong,https://lichess.org/M8LIxWsk/black#50,
2MAlL,2r3k1/1Q3pp1/1p5p/6q1/8/4P2b/P4PPP/3R2K1 b - - 2 25,h3g2 b7c8 g8h7 h2h4,2533,102,78,106,advantage endgame hangingPiece short,https://lichess.org/SBfEYwIc/black#50,
2SWyk,1k2Nr2/4r2p/1pp2bp1/8/PPP1Q3/7P/5PP1/4R1K1 w - - 3 29,e4c6 e7e1 g1h2 f6e5 f2f4 f8f4 c6b6 b8c8,2581,96,82,288,crushing endgame hangingPiece veryLong,https://lichess.org/334GdxUW#57,
2T9Qm,1k1r2nr/2p2p2/1p1p2q1/b2Np1pp/P1PnP1B1/3P4/1Q3PPP/1RB2RK1 w - - 0 18,d5b6 h5g4 b6d5 b8c8,2514,84,88,540,crushing defensiveMove hangingPiece middlegame short,https://lichess.org/ICuMzaDQ#35,English_Opening English_Opening_The_Whale
2TaAY,3R1r1k/q4pp1/4p2p/pn2P2P/4R3/2Q3PN/P4P2/6K1 b - - 0 29,b5c3 d8f8 h8h7 e4c4 c3e2 g1h2,2571,115,90,2182,advantage defensiveMove endgame hangingPiece long master,https://lichess.org/SpSfnYJy/black#58,
2UGU7,4R3/7k/6pp/2pP2q1/2P2R2/1P5b/2Q3P1/1r4K1 w - - 0 37,g1h2 g5f4 g2g3 f4f3 e8e7 h7h8,2539,93,91,25,crushing defensiveMove endgame hangingPiece long,https://lichess.org/YdG3ccB9#73,
2Uyl8,6R1/Q7/P4p1q/2p3pk/2P1PBn1/2P3Pr/5r2/R5K1 w - - 5 30,g8h8 h6h8 a7f7 h5h6 f4d6 h8g7,2507,84,97,110,crushing hangingPiece long middlegame,https://lichess.org/j7ykRRhy#59,
2WSRz,r4r1k/2p5/5p1p/p3pP2/1pq5/7Q/KP2N2P/3R3R w - - 2 32,b2b3 c4e2 a2b1 h6h5 d1e1 e2g4 h3g4 h5g4,2548,80,76,143,advantage hangingPiece middlegame quietMove veryLong,https://lichess.org/oJOpx51C#63,
2XjM4,r2qk2r/pbpp1ppp/np2p3/4P3/2PPn3/2BB1Q2/PP3PPP/R3K1NR b KQkq - 2 9,e4c3 f3b7 a6b4 b7f3,2505,92,90,1360,advantage hangingPiece opening short,https://lichess.org/PlzKaipM/black#18,Horwitz_Defense Horwitz_Defense_Other_variations
2YgqE,r4rk1/pb3ppp/5n2/q1ppn3/7N/1P2P3/P1QNBPP1/2R2R1K w - - 0 17,c2c5 a5d2 c1c2 f6e4 c2d2 e4c5,2513,80,87,685,crushing hangingPiece long middlegame,https://lichess.org/bvGwKaPa#33,Zukertort_Opening Zukertort_Opening_Nimzo-Larsen_Variation
2ZNpK,r4r2/1b2k1p1/pq1ppbQp/3p4/PB3P2/3BR3/1PP3PP/R6K w - - 2 22,e3e6 e7e6 b4c3 e6d7 c3f6 g7f6,2505,87,71,49,advantage hangingPiece long middlegame,https://lichess.org/3PTk4F91#43,
2bzon,5rk1/5p2/3b1qp1/4p2p/1pBPQ2P/1Pr3P1/5PK1/R1R5 w - - 0 28,a1a6 c3c1 d4e5 c1c4 e4c4 f6e5,2549,88,83,56,crushing deflection hangingPiece long middlegame,https://lichess.org/ZYshaEW4#55,
2eVfM,2r3k1/5b1p/4p2P/4bpN1/Q2p4/1P1B1K2/1q3PP1/7R b - - 0 39,f7h5 h1h5 b2d2 g2g3 d2d1 f3g2,2506,87,78,51,crushing hangingPiece long middlegame quietMove,https://lichess.org/YeLDPZWB/black#78,
2hwU9,8/p7/1R6/5pP1/4p1k1/1B4P1/8/r5K1 w - - 1 36,g1g2 a7b6 g5g6 a1a7 b3f7 a7a3,2570,92,67,77,crushing endgame hangingPiece long master quietMove,https://lichess.org/Hq7yO0qG#71,
2iU9F,3r2k1/pQ4pp/4pnn1/4p3/4P3/1P2B1P1/q1rb1PBP/3R1RK1 b - - 0 24,d2e3 d1d8 g6f8 g2h3 e3c5 h3e6,2526,105,90,979,crushing hangingPiece kingsideAttack long middlegame pin,https://lichess.org/hNV0a4as/black#48,
2jNMs,8/8/8/8/4pp2/8/r4k1R/3K4 b - - 1 69,f2g1 h2a2 f4f3 a2a1 g1g2 d1d2,2557,104,90,602,crushing defensiveMove endgame hangingPiece long quietMove rookEndgame,https://lichess.org/2wmBOyar/black#138,
2jhGa,r1b2rk1/1p2q2p/p1np2p1/5p2/5QP1/2P5/PP1NBPP1/R3K2R w KQ - 0 17,e1c1 e7e2 d1e1 c6e5 f4h6 e5d3 c1b1 e2e1 h1e1 d3e1,2590,90,85,312,crushing fork hangingPiece middlegame veryLong,https://lichess.org/Ec32W8PA#33,Indian_Defense Indian_Defense_Other_variations
2kUbC,6k1/1b3qp1/p6p/1p6/2pPr3/2P2NP1/1P2QP1P/R4RK1 w - - 0 28,e2d2 f7f3 d4d5 b7c8 d2d1 e4e2 d1e2 f3e2,2585,106,86,49,crushing hangingPiece middlegame quietMove veryLong,https://lichess.org/bFNA7Xf2#55,
2p5HD,r2qkb1r/pp1b1pp1/3p1n1p/1Bp1P3/3Q4/8/PPP2PPP/RNB2RK1 w kq - 2 10,e5f6 c5d4 f1e1 f8e7 e1e7 d8e7 f6e7 d7b5,2514,82,93,4981,advantage hangingPiece opening veryLong,https://lichess.org/qge0RDmk#19,Italian_Game Italian_Game_Anti-Fried_Liver_Defense
2siXZ,8/5p2/R3nk2/P3p3/3p2p1/8/4K3/8 w - - 0 49,a6e6 f6e6 a5a6 g4g3 a6a7 d4d3,2534,92,91,2312,crushing endgame hangingPiece long,https://lichess.org/fjwAgwM6#97,
2t6Tt,3r2k1/1q1P1pbp/6p1/1pP1p3/2n1n3/7B/2Q1NPPP/3RR1K1 w - - 0 31,c2e4 b7e4 e2d4 e4b7,2584,80,89,1157,advantage hangingPiece middlegame short,https://lichess.org/51WLMZc1#61,
2wyC3,r2qr1k1/pp3pB1/2p3np/2b2N1Q/7R/1P6/P1P2PPP/R5K1 b - - 0 19,c5f2 g1f2 d8d2 f2f1 g6h4 h5h4,2506,85,84,287,advantage hangingPiece long middlegame,https://lichess.org/gr3Oe5DW/black#38,Ruy_Lopez Ruy_Lopez_Steinitz_Defense
2zke1,2r3k1/5pp1/2Qb3p/3p4/3B2q1/5N1P/1P3P2/K2R4 w - - 0 28,c6d6 g4f3 d1d2 c8a8 a1b1 f3e4,2562,83,81,284,crushing endgame hangingPiece long,https://lichess.org/rTyJaYfh#55,
3458m,8/8/1k2b2p/2p2p2/2P2PpP/1K4P1/pN6/8 b - - 1 42,e6c4 b2c4 b6b5 c4a3 b5c6 b3a2 c6d5 a3b5,2516,107,90,658,crushing defensiveMove endgame hangingPiece veryLong,https://lichess.org/nWmZ7uYq/black#84,
38Gi6,3q1rk1/1p1bnppp/1b2p3/nP1pP3/8/3B1N2/2P1QPPP/BN3RK1 w - - 5 15,d3h7 g8h7 f3g5 h7h6,2572,83,92,618,advantage hangingPiece master middlegame short,https://lichess.org/q3B1PatO#29,Caro-Kann_Defense Caro-Kann_Defense_Advance_Variation
39gpm,r4r2/p1knQ3/bp4R1/8/2pP3P/2P1N3/PP3qP1/4R1K1 w - - 0 31,g1h1 f2e1 h1h2 a8e8 e3d5 c7c8 g6c6 c8b8 e7d6 b8a8,2503,89,100,126,advantage hangingPiece middlegame veryLong,https://lichess.org/tfsA942B#61,
39zmd,4r2k/1p1r4/2p1NPP1/p7/3P1b2/8/2P3K1/4R3 b - - 0 44,e8e6 e1e6 d7d8 e6e7 f4g5 e7h7 h8g8 f6f7 g8f8 h7h8 f8g7 h8e8,2532,93,55,51,advancedPawn advantage endgame exposedKing hangingPiece veryLong,https://lichess.org/HrYtGksg/black#88,
3AWxX,8/8/6p1/3k2K1/5p1P/7P/2n5/4B3 w - - 2 54,g5g6 c2e1 h4h5 e1d3 h5h6 d3e5,2507,81,85,49,crushing endgame hangingPiece long master quietMove,https://lichess.org/l3gP4Jth#107,
3H5Wa,4r1k1/2pr2pp/p7/3pN3/3Q4/6RP/q1P3PK/8 b - - 11 32,e8e5 d4e5 d7f7 g3g7 g8f8 g7g3,2578,86,79,67,crushing defensiveMove endgame hangingPiece long,https://lichess.org/cq8K6DCW/black#64,
3Lf5w,5qk1/p5pp/P7/1p1N4/3Pp3/1P1nP2P/5rP1/R2Q2K1 b - - 2 42,f2g2 g1g2 f8f2 g2h1 f2g3 a1a2 g3h3 h1g1,2598,82,83,262,advantage endgame hangingPiece quietMove veryLong,https://lichess.org/iWAtO1z5/black#84,
3SJdA,rn1q1rk1/p1p2ppp/bp2pb2/3p4/2PP3P/3BPN2/PP3PP1/RN1QK2R w KQ - 0 9,d3h7 g8h7 f3g5 h7h6,2535,91,89,834,advantage hangingPiece master middlegame short,https://lichess.org/MsY3aUhg#17,Torre_Attack Torre_Attack_Classical_Defense
3SMpH,r4rk1/pp2Rbp1/1qp5/3n4/3P1B2/2PB2PQ/PP4P1/1R4K1 w - - 9 31,d3c4 d5e7 c4d3 e7g6,2575,106,89,1195,advantage hangingPiece middlegame short,https://lichess.org/mGYe7f27#61,
3TFRh,8/5p2/6p1/8/6P1/4P3/1k2KP2/4b3 b - - 1 65,b2c3 e2e1 c3d3 g4g5 d3e4 e1e2 e4f5 f2f4 f5e4 e2f2 e4d3 f2f3,2597,88,79,167,crushing defensiveMove endgame hangingPiece quietMove veryLong,https://lichess.org/ofR5N9aW/black#130,
3TNtz,2Bqk2r/p4ppp/8/1p6/Qb1nN3/2P2P2/PP2nP1P/R3K2R w KQk - 0 18,a4d1 d8c8 d1d3 e8g8,2556,106,84,604,advantage castling defensiveMove hangingPiece middlegame pin short,https://lichess.org/qozrkbWD#35,Englund_Gambit_Complex Englund_Gambit_Complex_Hartlaub-Charlick_Gambit
3TZJE,1r4r1/3bppnk/3p3b/p1qn1PP1/PpP4Q/1P1B2N1/6KN/1R2R3 b - - 0 30,d5f4 h4f4 g7h5 g5g6,2546,84,81,307,crushing hangingPiece middlegame short,https://lichess.org/0VtENzm5/black#60,
3Vnce,Q1b1nr2/6p1/pk6/1pN5/4P3/P7/B1PK1q2/R6R w - - 1 29,d2c3 f2c5 c3b2 e8c7 a8b8 c8b7 b8f8 c5f8,2591,84,83,68,advantage hangingPiece middlegame trappedPiece veryLong,https://lichess.org/DWNgjJlb#57,
3Wv5e,4r2k/2R5/5P2/8/4B3/pP3KP1/1r6/8 b - - 1 45,e8e4 f3e4 a3a2 c7a7,2508,92,85,276,crushing endgame hangingPiece master rookEndgame short,https://lichess.org/F7BIcX1R/black#90,
3Xws6,r2r2k1/1p3ppp/p7/Q3n2q/4N3/P5PP/2P1PPK1/R4R2 b - - 4 21,h5e2 a5e5 d8e8 f1e1 e2e1 e5e8 a8e8 a1e1,2515,103,90,3094,advantage hangingPiece middlegame veryLong,https://lichess.org/BCBzehop/black#42,
3Xwz2,1k1r4/Npp1R2p/3p4/3Pp3/4n3/Q3BK1P/PPP2P2/5qr1 b - - 2 21,f1h3 f3e4 h3h1 e4d3 h1d5 d3c3 g1g4 b2b3,2532,82,79,70,advantage defensiveMove hangingPiece middlegame veryLong,https://lichess.org/Z2jFr7c9/black#42,
3YJ78,3r1r2/1p5k/3BP2p/p1p2p2/PnP4q/2N4P/1P1Q1bP1/1B3R1K w - - 1 29,d6f8 d8d2 e6e7 h4c4 f1c1 c4f7,2578,114,89,521,advantage hangingPiece long master middlegame,https://lichess.org/Tzu8PHCA#57,
3Zi3f,1k1r4/1p6/p2n3p/3qBp1b/1Q3P1p/4P3/P4RP1/R5K1 w - - 2 33,a1d1 d5d1 g1h2 b8a8,2534,77,81,312,crushing defensiveMove hangingPiece middlegame short,https://lichess.org/GPDOMaJP#65,
3bW48,r2q1rk1/ppp2pp1/2np2QB/2b1p2n/2B1P3/3P3P/PPP1bPP1/RN2NRK1 b - - 2 11,e2f1 g6h5 f1e2 h5g6 d8f6 g6f6,2520,85,53,46,advantage hangingPiece long middlegame pin,https://lichess.org/qyiWXtfQ/black#22,Italian_Game Italian_Game_Two_Knights_Defense
3bon5,8/8/8/p1p1K2k/Pp1nP1p1/1P1PN3/2P5/8 w - - 0 56,e3g4 h5g4 e5d5 d4c2 e4e5 c2d4 e5e6 d4e6,2548,83,92,331,crushing endgame hangingPiece knightEndgame veryLong,https://lichess.org/FQ84gh1S#111,
3kmN8,r4rk1/1p1nbp2/p1p2npp/3p4/1q1B4/1NN1Q3/P1P2PPP/3RR1K1 b - - 3 17,c6c5 e3e7 a8e8 e7d6,2553,98,91,1395,advantage hangingPiece master middlegame short,https://lichess.org/GN8RMPuh/black#34,Scandinavian_Defense Scandinavian_Defense_Gubinsky-Melts_Defense
3ljyp,3Q4/p4r1p/1p4kP/2p2pq1/7R/5bPB/P4P1K/8 w - - 6 52,h3f5 f7f5 d8e8 g6f6,2544,100,90,1048,advantage endgame hangingPiece short,https://lichess.org/M2tnAxyr#103,
3pOuH,r1bq1rk1/pp1nbp1p/2p1p1pP/3nN1N1/3P4/2PB4/PP1B1PP1/R2QK2R w KQ - 11 15,g5e6 f7e6 e5g6 h7g6 d1g4 f8f6,2556,93,85,165,advantage hangingPiece long opening,https://lichess.org/OOc0BmiM#29,Caro-Kann_Defense Caro-Kann_Defense_Gurgenidze_System
3rLX6,8/5bk1/2Q2r2/P2p4/3P2p1/2P5/1P2K3/8 w - - 3 46,c6f6 g7f6 e2e3 f6f5 a5a6 f7e8 c3c4 e8c6,2572,80,93,641,crushing defensiveMove endgame hangingPiece quietMove veryLong,https://lichess.org/PmGiYjlZ#91,
3uBOU,r4knr/ppp1b3/2n2pp1/6N1/2q2p2/2B5/PP4PP/RNQ2R1K b - - 0 18,h8h2 h1h2 c4d5 g5h3,2593,102,84,285,advantage hangingPiece middlegame short,https://lichess.org/KU1TZXaW/black#36,Kings_Gambit_Accepted Kings_Gambit_Accepted_Modern_Defense
3urpp,r4k1r/5pp1/bppP3p/p7/3BqP2/1P2n2P/P2Q2P1/4R1K1 b - - 0 33,e4d4 d2d4 e3c2 d4b6 c2e1 b6c6,2581,80,92,338,advantage hangingPiece long middlegame,https://lichess.org/DpVgu7cQ/black#66,
3vyfg,r7/1ppb1pk1/p7/n2p2P1/8/P1P2N2/2Q2PP1/2KR1B1q w - - 0 20,d1d5 h1f1 d5d1 f1g2 d1d7 g2f3,2591,86,82,121,crushing hangingPiece long middlegame,https://lichess.org/bq5jTrlh#39,
