PuzzleId,FEN,Moves,Rating,RatingDeviation,Popularity,NbPlays,Themes,GameUrl,OpeningTags
gYB7D,r1bq1rk1/pppn2pp/3bpp2/3pN3/3P1P2/3BP3/PPPB2PP/R2Q1RK1 w - - 0 10,d3h7 g8h7 d1h5 h7g8 e5g6 f6f5 g2g4 d7f6,2598,88,85,74,advantage hangingPiece opening quietMove veryLong,https://lichess.org/LSHBBJ1K#19,Queens_Pawn_Game Queens_Pawn_Game_Colle_System
gYges,r4rk1/pp2bp2/1qp2npp/3pn3/3Q4/6PP/PPB1NPK1/R1BR4 b - - 0 20,e7c5 d4e5 a8e8 e5f6 e8e2 d1d2 e2d2 c1d2,2529,103,90,214,advantage hangingPiece middlegame veryLong,https://lichess.org/o3IBLSMr/black#40,
gdoPd,r2qr1k1/pp1b1p1n/2pp1b1p/8/3NP3/2NB4/PP1Q1PPP/R3R1K1 w - - 0 16,d2h6 f6d4 e4e5 h7f8,2575,111,90,1234,advantage defensiveMove hangingPiece middlegame short,https://lichess.org/1lVgEUI1#31,Italian_Game Italian_Game_Anti-Fried_Liver_Defense
gg7gt,5r1k/n3Q3/b4pPb/p3p2N/3pP3/5N1K/P5B1/2q5 b - - 2 39,f8f7 g6f7 a6c8 h3h2 h6f4 h5f4 c1f4 h2h1,2573,94,81,65,advancedPawn crushing hangingPiece middlegame veryLong,https://lichess.org/2dCxL40M/black#78,
ggPds,8/5p2/1P1K4/8/2P5/6k1/1R3p2/4r3 w - - 3 63,b2f2 g3f2 c4c5 e1b1 c5c6 b1b6,2565,94,89,116,crushing endgame hangingPiece long rookEndgame,https://lichess.org/q5Drj2pJ#125,
ggRkO,r2q1k2/ppp1n1pQ/3p1r1p/8/3P4/6PB/PPP5/2K1R2R w - - 5 22,e1e7 d8e7 h7h8 f8f7 h8a8 e7e4 h1d1 f6f2,2542,91,91,930,advantage hangingPiece middlegame veryLong,https://lichess.org/Jdi2RjbQ#43,
gh6o0,2r5/2r3kp/3R1pp1/5b2/1Q6/P1p2q2/7P/2K1R3 b - - 2 33,f3f4 b4f4 c7b7 e1e4 c3c2 e4b4,2538,86,94,166,crushing hangingPiece long middlegame quietMove,https://lichess.org/82bf5DcN/black#66,
gibpP,2r4k/1pp3r1/p3pQ2/2P3P1/1P1P1P2/2q5/P4R2/R5K1 w - - 2 39,a2a3 c3a1 f2f1 a1a2,2557,104,90,2219,crushing endgame hangingPiece short,https://lichess.org/HIug0bkI#77,
glAiU,3k1n2/pp4p1/2q1P3/3P2Pp/7P/P3bR2/1P2N3/3R3K b - - 0 34,c6c2 f3f8 d8e7 f8f7 e7e8 e2c3 e3c5 d5d6 c5d6 d1d6,2569,85,70,113,crushing endgame exposedKing hangingPiece quietMove veryLong,https://lichess.org/Skk8xuDb/black#68,
gmLeW,rnb1k2r/ppp1n3/6p1/4Qp1p/P6P/2P2N2/2P2P2/1NB1KB1q b kq - 2 14,b7b6 e5h8 e8d7 f3e5 d7e6 c1g5,2514,95,85,255,advantage exposedKing hangingPiece long middlegame,https://lichess.org/jSGz3Sze/black#28,Scandinavian_Defense Scandinavian_Defense_Mieses-Kotroc_Variation
gp0ot,r3k2r/3p1p1p/bp1p1q1n/4p1p1/1nP1P1P1/5N1P/3P1PB1/R1BQK2R b KQkq - 3 15,a6c4 a1a8 e8e7 a8a3,2576,88,83,148,crushing defensiveMove hangingPiece middlegame short,https://lichess.org/qrgS3fwd/black#30,French_Defense French_Defense_Queens_Knight
grfMA,r2q1rk1/pp2bppp/2p2n2/4p1B1/2B1P1b1/3P2Q1/PPP3PP/RN3RK1 b - - 3 11,f6e4 d3e4 e7g5 g3g4 d8d4 g1h1 d4c4 b1a3 c4b4 g4g5,2551,103,91,1737,advantage hangingPiece opening veryLong,https://lichess.org/SioNnUhc/black#22,Kings_Gambit Kings_Gambit_Other_variations
gsD8b,2r5/5pkp/1R1P4/1p2p3/p2nPp1P/P4P1K/6P1/1R6 w - - 2 33,b1c1 c8c1 d6d7 h7h5 h3h2 c1d1 d7d8b d4f3,2560,91,82,47,crushing endgame hangingPiece quietMove veryLong,https://lichess.org/aRTQoE64#65,
gulKq,5r1r/1p1qk1b1/1B1p2p1/1N1Pn1Pp/8/P7/1PQ2nP1/2KR1B1R w - - 5 22,b5d6 d7d6 b6c7 f8c8,2526,79,95,198,advantage hangingPiece middlegame short,https://lichess.org/x7thzgoe#43,
gwsxZ,4rr2/6kp/pp1b1q2/n1p5/4Q3/5N2/1P1B1PP1/2R2RK1 w - - 3 23,e4e8 f8e8 d2c3 e8e5,2578,93,74,51,advantage defensiveMove hangingPiece middlegame short,https://lichess.org/1wILxzqW#45,
gx2aR,r2q1rk1/ppN3pp/1np1bp1n/2b5/8/3B1NQ1/PB3PPP/R3R1K1 b - - 1 18,d8d3 c7e6 h6f5 g3g4 c5f2 g1f2,2547,90,71,134,advantage fork hangingPiece long middlegame,https://lichess.org/W3Mc2CaD/black#36,Danish_Gambit_Accepted Danish_Gambit_Accepted_Classical_Defense
gx5db,2k4r/1pp5/p1p2qp1/2b1Q3/2Nr2p1/7P/PPP2P2/R4RK1 b - - 1 19,f6f3 e5h8 d4d8 h8c3,2569,88,92,1749,advantage hangingPiece middlegame short,https://lichess.org/hECsuTkr/black#38,Ruy_Lopez Ruy_Lopez_Exchange_Variation
h1bqy,r1b2rk1/pp3p1p/4pnpQ/4P1N1/3p4/8/PPq3PP/R3KB1R b KQ - 0 17,c2b2 e5f6 b2c3 e1e2 d4d3 e2e3,2543,88,79,122,crushing hangingPiece long middlegame,https://lichess.org/3VX6ajXz/black#34,Rapport-Jobava_System Rapport-Jobava_System_Other_variations
h5byJ,8/2Nk1b2/3P4/1PK5/2p5/3r3p/p7/5R2 b - - 5 51,d3f3 f1f3 f7g6 f3f1,2510,82,91,1375,crushing defensiveMove endgame hangingPiece master masterVsMaster short,https://lichess.org/qCCQAl3D/black#102,
hAyco,4q3/6k1/7R/1p3rpp/1P2p3/P1P1Q2P/6PK/8 w - - 2 42,h6h5 e8h5 g2g4 h5h4 g4f5 h4f4 e3f4 g5f4,2592,86,81,185,advantage endgame hangingPiece veryLong,https://lichess.org/CLedgGjV#83,
hBsKl,2k3r1/R7/2p3p1/3p3p/P2P3P/2r1nPBq/2P2K2/4QR2 b - - 2 36,c3c2 f2e3 g8e8 g3e5 e8e5 d4e5 h3h2 a7a8,2564,97,66,40,crushing hangingPiece middlegame veryLong,https://lichess.org/TB2W4Pq1/black#72,
hE8Rx,2r3r1/pp2Q3/6qk/3pR3/3P3P/2P5/PP3P2/1R4K1 w - - 0 32,e5g5 g6b1 g1h2 b1e4 e7d6 g8g6 g5g6 e4g6,2522,80,97,121,advantage endgame hangingPiece pin veryLong,https://lichess.org/1O44T0Ee#63,
hGinx,8/8/8/3k2K1/6np/4p2N/7P/8 b - - 1 59,d5e4 g5g4 e3e2 h3g5 e4d3 g5f3 d3e3 f3e1,2574,96,90,682,crushing defensiveMove endgame hangingPiece knightEndgame master veryLong,https://lichess.org/RErSxBHe/black#118,
hJnna,1r1R2k1/2p3p1/p1p2Ppp/4P1P1/6P1/2P5/5q2/K2R4 b - - 2 32,g8h7 d8b8 f2c2 d1d7 c2c1 a1a2,2538,99,85,317,crushing endgame hangingPiece long queenRookEndgame,https://lichess.org/FNbyQZ0S/black#64,
hJyM0,rb3rk1/2p1R1p1/1pN1R2p/1Pp5/3p1q2/3Q1P1P/1P4P1/6K1 w - - 7 32,e7g7 g8g7 d3g6 g7h8 e6e8 d4d3,2507,95,79,49,advantage hangingPiece long middlegame,https://lichess.org/96iSUviA#63,
hKbGL,2r1kb2/p1r5/4pRQP/1q1pP3/1p1P4/4PP2/PP2N3/1K6 b - - 2 29,e8d8 f6f8 d8d7 f8c8 c7c8 h6h7 b5e2 g6f7 d7c6 f7e6 c6c7 e6c8 c7c8 h7h8q,2541,93,84,41,advancedPawn attraction crushing deflection exposedKing fork hangingPiece middlegame promotion veryLong,https://lichess.org/ovnj1Iai/black#58,
hL5eV,8/8/3r4/7P/8/1p3RP1/k5K1/8 w - - 1 45,f3b3 a2b3 g2f3 b3c4 f3e4 d6e6 e4f5 c4d5 g3g4 d5d6,2583,85,81,54,crushing defensiveMove endgame hangingPiece rookEndgame veryLong,https://lichess.org/7hM6ev69#89,
hOkt5,3r3k/ppq2R2/1n2p1rP/4n1PQ/4P3/1P2P3/1PP5/1K3R2 b - - 0 31,e5f7 h5g6 f7e5 g6f6 h8h7 f6e6 d8g8 f1f5,2580,105,91,1066,advantage exposedKing hangingPiece master middlegame veryLong,https://lichess.org/fbl5HBF9/black#62,
hRUYK,4r1k1/pppbq2p/2n1N2r/2b2B2/6P1/2P2R2/PPQB3P/4R2K b - - 0 26,d7e6 d2h6 e6d5 f5h7 g8h8 h6g7 h8g7 e1e7,2571,90,90,385,attraction crushing hangingPiece kingsideAttack middlegame veryLong,https://lichess.org/8M5PJkS2/black#52,
hUdlu,8/P5R1/r3p3/2K2p2/5P2/8/7p/7k b - - 1 57,a6a7 g7a7 h1g2 a7g7 g2f3 g7h7,2549,107,88,402,crushing endgame hangingPiece long rookEndgame,https://lichess.org/TfxNgAJ9/black#114,
hXb9O,8/p1r1ppbk/8/qp4Qn/4P2P/3r1P1B/PPP1N3/1K5R b - - 1 23,d3d2 g5h5 h7g8 h3e6 f7e6 h5e8,2582,97,83,271,crushing hangingPiece long master middlegame,https://lichess.org/8xDf78Rw/black#46,
hcLqY,2rr2k1/1p3ppp/p1pN4/4P3/1R3P2/8/6PP/2Rn3K b - - 9 31,d8d6 e5d6 d1f2 h1g1 f2d3 b4e4,2594,100,92,989,advantage defensiveMove endgame hangingPiece long,https://lichess.org/z77cTNpq/black#62,
hdOd5,1q4k1/R4pp1/3P4/6p1/2P5/1r5P/3Q2P1/6K1 w - - 0 37,d6d7 b8a7 g1f1 a7a1 f1f2 a1f6,2590,117,90,887,crushing endgame hangingPiece long,https://lichess.org/S9UGp1yl#73,
he8eg,3r2r1/5k2/p6p/1p1bp3/1Bq2p2/P1P5/4R1PP/3RQ1K1 b - - 5 34,c4e2 e1e2 f4f3 d1f1 g8g2 e2g2,2508,87,61,72,advantage hangingPiece long middlegame pin,https://lichess.org/KGgHs6I9/black#68,
heTe1,3r3k/pp2R1p1/2p4p/5q2/5p2/1P3P1P/P3QP2/6K1 w - - 2 32,e7g7 h8g7 e2e7 g7g6 e7d8 f5g5,2527,96,89,147,crushing endgame hangingPiece long,https://lichess.org/8i0KuUAj#63,
heaga,r2qk2r/1p2npb1/p2p3P/2pPnbB1/2P1N3/3B4/PP3PP1/R2QK2R w KQkq - 1 15,h6g7 h8h1 e1e2 f5e4 d1h1 e4d3,2569,114,90,326,advantage hangingPiece long master middlegame,https://lichess.org/GtIfx3hW#29,French_Defense French_Defense_St_George_Defense
hfbmS,2r2rk1/p4p1p/1p2pRpQ/4P2P/1q1P4/8/1PB3P1/2K4R b - - 0 27,c8c2 c1c2 b4c4 c2d1 c4a4 d1e2,2512,77,93,466,advantage defensiveMove endgame hangingPiece long,https://lichess.org/1W2EqQEq/black#54,
hhxwy,2r1r1k1/p1p2p1p/1p4p1/3PP2n/2PB2Q1/q3P3/P5PP/2R2RK1 w - - 3 25,f1f2 a3c1 f2f1 c1a3,2580,91,81,83,advantage hangingPiece middlegame short,https://lichess.org/dEjkBwip#49,
hicJy,1r1q1rk1/p1p2ppp/1p1p4/3bp1P1/4P1Q1/2NP4/PPnK1PP1/R6R b - - 1 16,c2a1 c3d5 f7f5 g4h5 h7h6 g5h6,2574,111,88,645,crushing hangingPiece long middlegame,https://lichess.org/iv3BmNHD/black#32,Owen_Defense Owen_Defense_Other_variations
hjcfq,8/p5k1/1p3p1p/P1p1p1p1/3qr1P1/1P4QP/2P2P1K/R7 w - - 3 38,a5b6 d4a1 g3g2 e4f4 b6b7 f4b4 g2c6 a1d4,2530,96,50,32,crushing endgame hangingPiece veryLong,https://lichess.org/BGJejxWF#75,
hkeOq,3qk2r/p4ppp/1rp1p3/n4b2/Q1BPnB2/2P1PN2/P4PPP/R3K2R b KQk - 0 14,e4c3 a4a5 b6b1 a1b1 d8a5 b1b8 e8e7 b8b7,2548,91,85,86,advantage hangingPiece middlegame veryLong,https://lichess.org/2XlGdLVc/black#28,Queens_Gambit_Declined Queens_Gambit_Declined_Baltic_Defense
hrYDp,r7/PK5p/2P5/8/8/4p2P/8/4k3 b - - 0 46,e3e2 b7a8 e1f1 a8b8 e2e1q a7a8q,2564,92,80,103,advancedPawn clearance crushing endgame hangingPiece long promotion,https://lichess.org/BUn4vSbg/black#92,
hsSNZ,1r2r1k1/3bppbp/2P3p1/4P3/1P1N4/3BP1BP/6P1/R2n2K1 b - - 0 26,d1e3 c6d7 e8d8 a1a7 b8b4 d4c6,2584,97,74,61,advancedPawn advantage hangingPiece long master middlegame quietMove,https://lichess.org/WO9ZfFen/black#52,
hsnzY,1k4r1/pp6/2p3r1/4n2Q/P2qN3/3P3P/2P2RB1/6RK w - - 1 33,f2f8 g8f8 c2c3 d4d5 e4f6 d5d6,2580,93,91,505,advantage hangingPiece long middlegame,https://lichess.org/D0OY5D8q#65,
htCc4,r4k2/pq1n1p1p/1p2p3/1N1n1p1Q/8/3B4/PPP3rP/3R1R1K b - - 1 21,d5f4 f1f4 g2g5 h5f3,2542,85,84,328,advantage hangingPiece master middlegame short,https://lichess.org/XGCUXsY5/black#42,
hwrAp,5rk1/1p5P/2p5/4N3/3Pp1bq/1P2P2P/6QK/r5R1 b - - 0 27,g8g7 g1a1 h4h3 g2h3,2558,102,91,131,crushing hangingPiece middlegame short,https://lichess.org/bTqwJ05l/black#54,
i2SNL,4r3/8/5K2/4P1pk/7p/8/8/1R6 b - - 0 67,e8e5 f6e5 h5g4 e5e4,2523,79,83,624,crushing defensiveMove endgame hangingPiece master rookEndgame short,https://lichess.org/1qsTcM3t/black#134,
i3CsW,r4k1r/4Rp2/2Np1p1p/pp1P4/4QPbP/4R3/1PPK4/6q1 w - - 0 23,e7f7 f8f7 e4e7 f7g8,2509,77,73,144,crushing hangingPiece master middlegame short,https://lichess.org/YM96BQUk#45,
i3Zdq,7r/1Q1bk3/5b2/1P2p3/2Pp1B2/P2P4/5Prq/R3RK2 w - - 0 30,b7g2 h2f4 e1e4 f4d2,2599,105,75,158,crushing hangingPiece middlegame short,https://lichess.org/pafAKucI#59,
i3uDl,1r5k/1P3Qpp/1q6/8/8/4b1P1/4R1KP/8 b - - 3 51,b6d8 e2e3 d8d2 g2f3,2562,81,50,57,crushing defensiveMove endgame hangingPiece master short,https://lichess.org/1kZ81vpf/black#102,
i7Kw3,4rrk1/7p/2Q1p1p1/2Np4/P7/4qP2/7P/5R1K b - - 6 31,f8f3 c6e8 g8g7 e8e7,2559,101,89,776,crushing endgame hangingPiece short,https://lichess.org/IQaCOG7B/black#62,
i7ZYo,4r1k1/p1b2p2/2p3pQ/3p4/5P2/P1PBq1NP/1P4P1/5RK1 w - - 1 27,g1h1 e3d3 h1h2 e8e3 g3h5 g6h5,2565,98,88,599,crushing hangingPiece long middlegame,https://lichess.org/xs3f5kRM#53,
iC4oK,3R4/pp2P1kp/2q2nr1/8/2p5/B1P2PQ1/PP6/5RK1 w - - 3 30,e7e8q g6g3 g1f2 f6e8 f2g3 c6c7 g3g2 c7d8,2514,79,92,1131,advantage exposedKing fork hangingPiece middlegame veryLong,https://lichess.org/DVnYNxIx#59,
iFLAr,r1bqr1k1/p4ppp/1pB5/4P3/3p2n1/2NQ2P1/PPP2P1P/R4RK1 b - - 0 15,d4c3 c6a8 c8a6 d3a6,2590,89,66,114,advantage hangingPiece middlegame short,https://lichess.org/mwDmjWdh/black#30,Scotch_Game Scotch_Game_Other_variations
iHx2G,1r3k2/6n1/1pppBb2/p3pPP1/4P3/2PKB2q/PP1R4/6R1 b - - 0 40,d6d5 g5f6 g7e6 f5e6 h3e6 d2h2 d5e4 d3c2,2560,86,43,39,advantage defensiveMove hangingPiece middlegame quietMove veryLong,https://lichess.org/1fMiVCmx/black#80,
iI9Dy,8/5R2/2pk3P/p5n1/2p5/3p1P1P/PP1K4/8 w - - 7 51,h6h7 g5f7 b2b3 d6e5 b3c4 e5d4,2526,95,78,42,crushing endgame hangingPiece long,https://lichess.org/8DsRaIVz#101,
iJM6Z,3rr1k1/pp1b1p1p/2p2npB/q3pP2/P3p2Q/1PbP1N2/2P1B1PP/3R1RK1 b - - 1 22,e4f3 h4f6 c3d4 f1f2 e5e4 f6d4 a5e5 d4e5,2568,105,89,309,crushing hangingPiece middlegame veryLong,https://lichess.org/BKZE5RcU/black#44,
iLGCf,8/1K3k2/1P3pp1/5n1p/1B4n1/8/8/8 b - - 0 47,f5d6 b4d6 g4e3 b7a6 e3c4 b6b7 c4d6 b7b8q,2523,87,84,92,advancedPawn advantage endgame hangingPiece promotion veryLong,https://lichess.org/kf53FgoL/black#94,
iLNbS,2r2r1k/p2q2pp/2b5/1B1pB3/4p3/6QP/PP2NnP1/1K1R3R w - - 3 22,d1d5 f2h1 b5c6 c8c6,2544,92,76,84,advantage hangingPiece middlegame short,https://lichess.org/GcgJceB7#43,
iLoHq,r5k1/pb3pbp/1p2p1p1/1q6/8/3P1NP1/1B2QPBP/1R4K1 w - - 0 27,b2g7 b5b1 f3e1 b7g2 g7c3 a8c8 e2e5 c8c3 e5b8 g8g7,2516,80,78,373,advantage hangingPiece middlegame pin veryLong,https://lichess.org/hCl5db6P#53,
iObA3,8/p4r2/3P4/2K5/1P3Bk1/6Pp/P4Rb1/8 w - - 3 55,f2g2 h3g2 f4e3 f7f3,2558,92,90,524,advancedPawn crushing endgame hangingPiece master short,https://lichess.org/vqD3DH7A#109,
iQ0bW,4r1k1/p2b1ppp/1rp5/3p3P/6P1/2QB1P2/qPP5/2KR3R w - - 1 19,d3h7 g8h7 h5h6 a2a1 c1d2 a1b2 h6g7 h7g6 d1e1 b2c3,2586,98,92,1323,crushing deflection hangingPiece middlegame queensideAttack veryLong,https://lichess.org/i5j4m5IS#37,French_Defense French_Defense_Knight_Variation
iWSaK,2rn1rk1/1b1N2p1/1p1Pp2p/pP3pb1/P1P2B2/2q5/5PPP/R2QR1K1 w - - 0 23,d7f8 g5f4 f8g6 c8c4 g6f4 c4f4,2525,99,89,711,advantage hangingPiece long middlegame,https://lichess.org/W8BxvNLE#45,
ifTY1,3r1k2/pp3ppp/2b1p3/2b5/1q6/1P1BP3/PBQ2PPP/3R2K1 b - - 8 20,b4g4 c2c5 f8g8 f2f3 c6f3 d1d2,2521,78,90,910,advantage defensiveMove hangingPiece long middlegame,https://lichess.org/PBMnqyJR/black#40,
ifp4j,8/1p4kp/2p3p1/p1n2r2/1qP1pP2/1P5Q/P3P1BP/3R3K w - - 0 28,g2e4 c5e4 d1d7 g7f8,2500,95,89,642,crushing defensiveMove endgame hangingPiece master short,https://lichess.org/KX9hvVtq#55,
ilkhv,2r3k1/5pp1/p4r1p/3Pp1b1/2P3QP/8/P3BqP1/1R1R3K b - - 1 27,f6f4 g4c8 g8h7 e2g4,2556,86,83,451,crushing defensiveMove hangingPiece middlegame short,https://lichess.org/5qhA2AxD/black#54,
ima0N,rnb2b1r/ppp1kBpp/5n2/2q1N2Q/4pP2/2P5/PP1P2PP/RNB1K2R w KQ - 3 9,e5g6 e7f7 g6e5 f7e7,2571,108,90,337,advantage defensiveMove hangingPiece middlegame short,https://lichess.org/nRLxPfCS#17,Kings_Gambit_Declined Kings_Gambit_Declined_Falkbeer_Countergambit
imhI9,r1b4Q/1p1pkp1p/4p3/1p2P3/1P2nP2/1K2q3/1PP3PP/R4B1R w - - 2 21,c2c3 a8a1 f1d3 e3d3,2525,100,89,948,advantage hangingPiece middlegame short,https://lichess.org/nhCICr3x#41,
ipWRw,6k1/6p1/6Q1/p2q1p2/5Pn1/1P4K1/6R1/8 w - - 14 56,g3h4 d5g2 g6e6 g8f8 e6f5 g4f6,2517,94,90,1037,crushing defensiveMove endgame hangingPiece long master,https://lichess.org/tSPfBCb6#111,
iqb0Z,3k3r/5Q2/p1Bq4/1p2N3/3P2pr/2P5/PP3PK1/3R4 w - - 3 48,e5g6 d6c6 d4d5 h4h2 g2g3 c6d6,2518,77,93,733,crushing hangingPiece long middlegame,https://lichess.org/2MIMPOf4#95,
iqkub,8/P6R/r7/2p5/3p2p1/3K2k1/8/8 b - - 5 58,a6a7 h7a7 g3g2 d3e2 c5c4 a7a4 d4d3 e2e3 g4g3 a4c4 d3d2 e3d2 g2f3 d2e1 g3g2 c4c3 f3f4 e1f2,2533,99,81,41,crushing endgame hangingPiece rookEndgame veryLong,https://lichess.org/nCXWhROP/black#116,
irXir,8/6pk/7p/3BQ3/P2n4/4P1KP/4q1P1/6r1 b - - 0 38,e2e3 e5e3 d4f5 g3h2 f5e3 d5e4 h7h8 h2g1,2572,84,94,609,advantage endgame fork hangingPiece master veryLong,https://lichess.org/pYe0nuqB/black#76,
isgDH,4r3/7p/8/3k1p2/1B6/1K2p1P1/7P/4R3 w - - 0 42,b4d2 e3d2 e1d1 e8e2 b3c3 d5e4,2508,79,92,658,advancedPawn crushing defensiveMove endgame hangingPiece long,https://lichess.org/t2HgKHhg#83,
iukHZ,2r1k3/4n1rp/p3Qp2/7q/8/5N2/P2R1PPP/3R2K1 w - - 1 23,e6c8 e7c8 d2d8 e8f7 d8c8 g7g2 g1g2 h5g4,2512,101,90,2350,advantage attraction hangingPiece middlegame veryLong,https://lichess.org/CKyjhjEi#45,
j4rsr,5r1k/pp4pp/4Q1B1/3p2P1/5p1P/2P2bq1/PP4P1/R1B1R1K1 w - - 1 27,e6h3 g3e1 g1h2 f3g2 h3g2 f4f3 c1f4 e1a1,2591,112,88,633,advantage hangingPiece kingsideAttack middlegame veryLong,https://lichess.org/zoPGm04B#53,
j5xrj,2rq1b1r/pb2nk2/1pnp1p2/1B1N2pp/3NP3/2R3B1/P1P1QPPP/4K2R w K - 4 19,d5e7 c6d4 c3c8 b7c8 e2c4 f7e7,2566,89,79,101,advantage hangingPiece long middlegame,https://lichess.org/cVaCOm8T#37,Englund_Gambit_Complex Englund_Gambit_Complex_Englund_Gambit
jH5xy,r1bq1rk1/ppp2pp1/5n1p/2b1p3/4P3/PB1P3P/1PP1NP2/R1BQK2R b KQ - 0 11,f6e4 d3e4 d8f6 h1h2 f8d8 c1d2,2533,102,90,1112,advantage hangingPiece long opening quietMove,https://lichess.org/fcft1vcK/black#22,Italian_Game Italian_Game_Giuoco_Pianissimo
jR2m0,3r2k1/1p3pbp/2p1p1p1/Q3P3/5B2/1q1rR2P/1P4P1/R6K b - - 1 29,d3e3 a5d8 g7f8 a1a8 e3h3 h1g1,2592,102,88,502,crushing defensiveMove hangingPiece long middlegame quietMove,https://lichess.org/w4WRdByn/black#58,
jSYoV,5k1r/p2b1ppp/3N4/4q3/2Q5/1P6/1rP2PPP/R3K2R w KQ - 0 21,e1f1 e5d6 c4c3 d7b5 f1g1 b2a2 h2h4 a2a1,2506,104,90,330,crushing hangingPiece middlegame veryLong,https://lichess.org/HPSS3tuL#41,
jTqcb,r1b1N2k/5prp/p3p2Q/1p2q3/8/1N1P4/PP4PP/5RK1 b - - 2 23,g7g2 g1g2 c8b7 g2h3 a8e8 f1f7 b7g2 h3g2 e5e2 g2h3,2539,79,76,308,advantage defensiveMove hangingPiece middlegame veryLong,https://lichess.org/sv2znLbx/black#46,
jUOCR,4r1k1/1p4pp/5p2/2p2P2/1p1p1Q2/2nP1BBP/2q2PPK/r2N1R2 w - - 0 24,d1c3 a1f1 c3e4 c2c1 f4c1 f1c1,2575,94,89,347,advantage hangingPiece long master middlegame,https://lichess.org/peersK3g#47,
jX8ce,r4rk1/p4ppp/1p6/3Q1P2/4p3/5q2/PPP2P1P/1K4RR w - - 2 20,g1g7 g8g7 h1g1 g7h6 d5d2 e4e3 d2d4 h6h5 d4f6 h7h6,2547,95,63,59,crushing defensiveMove endgame hangingPiece veryLong,https://lichess.org/UTiblTDy#39,
jbvAn,r2r2k1/1b4q1/1p2p1P1/2pP1p2/2P1P2Q/3B2RP/p5P1/R5K1 w - - 0 31,e4f5 g7a1 g1h2 a1g7 f5f6 a2a1q f6g7 a1g7,2556,89,71,51,advancedPawn advantage clearance hangingPiece middlegame promotion veryLong,https://lichess.org/AZwBDihr#61,
jeMK7,5Q2/2p5/8/3q4/P1kn4/8/2P3p1/1K4R1 w - - 1 48,g1g2 d5g2 f8f7 c4c3 f7c7 d4c6,2560,105,90,144,crushing defensiveMove endgame hangingPiece long,https://lichess.org/jbd0EyN9#95,
jgldW,2r5/pp2k3/3pN3/3P1q1p/4bp2/8/PP1N1P1r/2RQRK2 w - - 0 25,e6f4 f5f4 e1e4 f4e4 d2e4 c8c1 d1c1 h2h1 f1g2 h1c1,2500,169,58,11,crushing hangingPiece middlegame pin sacrifice skewer veryLong,https://lichess.org/H08PXxbs#49,
jhHlj,8/8/p1p2K2/2P1B3/8/8/kPr5/5R2 w - - 0 70,f1f2 c2f2 f6e7 f2d2,2537,80,85,339,crushing endgame hangingPiece master masterVsMaster short,https://lichess.org/paR485Jk#139,
jj3D3,rn1qk2r/ppp1nppp/3p4/8/2BPPBbb/5N2/PPP3PP/RN1Q1K1R w kq - 1 8,c4f7 e8f7 f4g5 g4f3 d1f3 f7g6,2588,87,83,267,advantage hangingPiece long opening,https://lichess.org/wojqSSJj#15,Kings_Gambit_Accepted Kings_Gambit_Accepted_Cunningham_Defense
jjeza,5R2/6k1/p3p1pp/3pP3/2pP4/1nq1b1B1/6PP/1Q2N2K w - - 1 29,b1d1 g7f8 d1f3 f8e8 g3f2 e3d4,2507,113,90,1758,crushing hangingPiece long middlegame,https://lichess.org/SrWCq8u8#57,
jlGP0,8/P7/1n5p/4k1p1/8/4Q2P/4p1PK/5q2 b - - 6 61,e5f6 e3b6 f6g7 b6c7 f1f7 c7e5,2593,85,97,144,crushing endgame hangingPiece long,https://lichess.org/ZKjYJrVd/black#122,
jpZH6,4k3/6P1/5K2/1P5p/2P2p1P/6r1/4p3/R7 b - - 0 44,g3g7 f6g7 e8d7 b5b6,2535,82,84,323,crushing endgame hangingPiece rookEndgame short,https://lichess.org/G42AxQTV/black#88,
jsALU,2br3k/5Q2/1qnr3b/p1p1p2N/PpB1P3/1P6/5PPN/2R2RK1 w - - 3 29,h2g4 c8g4 h5f6 b6a7 f7a7 c6a7 f6g4 h6c1,2510,111,35,22,advantage hangingPiece middlegame veryLong,https://lichess.org/UHWSqqnp#57,
k2dU7,1n3r1k/r4pp1/2p1p2p/p1NqN3/Pp1PP3/2nQ2P1/5P1P/R1R3K1 b - - 0 21,d5d4 d3d4 c3e2 g1f1 e2d4 c1c4 b8a6 c5a6,2596,81,82,215,crushing hangingPiece master middlegame veryLong,https://lichess.org/10MgOSn7/black#42,
k8qqU,rB1qk1r1/pp6/4b2p/2p2pp1/3P4/2P2P2/P3Q1PP/2KR2Nn b q - 0 16,a8b8 e2e6 e8f8 e6f5 f8g7 d4c5,2540,111,89,1452,advantage exposedKing fork hangingPiece long middlegame,https://lichess.org/bULHfFWl/black#32,Queens_Gambit_Accepted Queens_Gambit_Accepted_Other_variations
k8sjT,6k1/r4rpp/2p1p1q1/bPPp4/4p3/1Q2P1PP/R1P2P2/2B2RK1 b - - 0 28,f7f2 g1f2 a7f7 f2g2 f7f1 g2f1 g6f7 f1g1,2594,85,81,185,crushing defensiveMove hangingPiece middlegame veryLong,https://lichess.org/gQ6NjKno/black#56,
kCetX,8/8/5kp1/1K5p/3R3P/8/6n1/8 b - - 2 61,g2h4 d4h4 f6g5 h4h1 g5f4 b5c4 f4f3 c4d3,2518,82,50,259,crushing defensiveMove endgame hangingPiece veryLong,https://lichess.org/udLIPpPK/black#122,
kD1uT,r2q1rk1/1p3ppp/p1nb1n2/4p2b/2P5/1PN2N1P/PB1PBPP1/R2Q1RK1 w - - 1 12,f3e5 d6e5 e2h5 f6h5 d2d4 d8d4,2579,96,69,58,advantage hangingPiece long opening,https://lichess.org/gfwEB6UQ#23,Scandinavian_Defense Scandinavian_Defense_Panov_Transfer
kD6lj,r1b2k1r/pp3p2/3p1q2/2pPpN2/B1P1PnQb/8/PP3PP1/R1B1R1K1 b - - 0 21,f4g2 g1g2 c8f5 g4f5 f6f5 e4f5,2529,85,93,254,advantage hangingPiece long middlegame,https://lichess.org/EDxJh3Iq/black#42,
kDbZk,4n2k/p4p1p/1p2pPpB/4P1P1/3pq3/6Q1/6K1/1R6 w - - 7 34,g2h3 e4b1 g3g2 b1b3 h3g4 b3d5,2577,81,92,1288,crushing endgame exposedKing hangingPiece long,https://lichess.org/UPZI10fy#67,
kGNGL,4r1k1/5ppp/2b1pb2/3p1P2/2pP4/2q3B1/2BNQ1PP/5RK1 w - - 0 23,f5e6 c3c2 e6f7 g8f7,2513,80,92,1524,advantage hangingPiece middlegame short,https://lichess.org/NJMY4W7S#45,
kHXsb,1r3k1r/2R5/3n4/p2pN3/Nb1P1pP1/1P3Pq1/Q4KB1/5R2 w - - 3 39,f2e2 g3g2 f1f2 g2g1,2585,98,82,115,crushing hangingPiece middlegame short,https://lichess.org/WXZn2eHu#77,
kKlhb,1k6/8/5KP1/1pp4b/2p5/P1P5/1P6/8 b - - 2 43,h5g6 f6g6 b8c7 g6f5 c7d6 f5f6,2525,79,90,2860,crushing defensiveMove endgame hangingPiece long zugzwang,https://lichess.org/dVfj0kZI/black#86,
kLEQy,8/8/2k5/p1P3p1/2R3p1/3K1pP1/7r/7B w - - 3 49,c4g4 h2h1 d3e3 h1e1 e3f3 e1e5,2566,93,90,669,crushing endgame exposedKing hangingPiece long,https://lichess.org/4rEwvj1E#97,
kNKcS,3k4/qp1b2p1/p2R2Q1/P2p2N1/3b4/2r5/2B2rPP/1R4K1 w - - 0 28,d6d7 d8d7 c2a4 d7c7,2508,91,88,322,advantage defensiveMove hangingPiece middlegame short,https://lichess.org/lwi6Irzq#55,
kNbkd,2r2r2/p4ppk/7p/1p1pP3/2qP2RP/2P2R2/P2Q2P1/6K1 w - - 2 27,g4g7 h7g7 f3f6 f8h8 d2f4 c4c7,2599,109,90,2352,advantage endgame hangingPiece long master quietMove,https://lichess.org/3cyeiNDt#53,
kPcRb,8/2P2k2/5p1Q/p2p4/3P4/3q3b/PK1b4/2R5 w - - 12 45,c7c8q d2h6 c1c7 f7g6 c8e8 g6g5,2516,83,90,51,advantage endgame hangingPiece long,https://lichess.org/h63f3E21#89,
kS731,4r1k1/2NRb3/6K1/8/7p/8/8/8 b - - 1 41,e8c8 d7e7 h4h3 c7d5 c8c6 d5f6 c6f6 g6f6,2599,87,90,128,crushing endgame exposedKing hangingPiece quietMove veryLong,https://lichess.org/QhEYM2vc/black#82,
kSv4h,8/5p2/8/1k2K3/3P4/P7/8/7q b - - 1 63,h1d5 e5d5 f7f5 a3a4 b5a4 d5e5,2586,104,91,357,crushing endgame hangingPiece long,https://lichess.org/Bt0L0AgT/black#126,
kezAd,2n5/p5B1/kp2P2p/1n4p1/8/5PK1/5P1P/8 b - - 1 34,b5d4 g7d4 a6b7 f3f4 b7c6 f4f5,2524,93,78,161,crushing defensiveMove endgame hangingPiece long,https://lichess.org/NxFcto1x/black#68,
kfOlq,1r4k1/p1pqb1pp/2p1p3/1b1pN3/1P1P1r2/1QP3K1/P2N2PP/R3R3 b - - 1 19,d7e8 g3f4 e8h5 d2f3 e7h4 f3h4 h5h4 f4e3,2554,117,90,955,advantage defensiveMove hangingPiece middlegame quietMove veryLong,https://lichess.org/ybdogwDk/black#38,Nimzowitsch_Defense Nimzowitsch_Defense_Scandinavian_Variation
kh8Hg,1k2r3/1pp5/p5Q1/1qNR1p2/1Pn1p3/5r2/1PP5/2K3R1 b - - 0 31,b5b4 g6e8 b8a7 e8h8 c4b6 c5d7 b6d7 d5d7,2510,94,45,28,advantage hangingPiece middlegame quietMove veryLong,https://lichess.org/Vue4GoEK/black#62,
kicil,3qr1k1/2p1bp1p/r5pB/p2pP3/P2P2Q1/2P5/1P4PP/R4RK1 w - - 0 18,f1f7 g8f7 a1f1 f7g8 g4f3 g8h8,2532,108,91,679,advantage defensiveMove hangingPiece long middlegame,https://lichess.org/zJOwyE7p#35,Vienna_Game Vienna_Game_Vienna_Gambit
kirWt,8/5p2/1p3Nk1/4B1pp/8/8/8/3K4 w - - 2 45,f6h5 g6h5 d1e2 h5g4 e5f6 g4f4,2537,93,90,592,crushing defensiveMove endgame hangingPiece long,https://lichess.org/ilWQuDKC#89,
kjX7y,8/8/6p1/7p/3k2N1/3p1P2/3K2PP/8 w - - 0 41,f3f4 h5g4 h2h4 g4h3 g2h3 d4e4 f4f5 e4f5,2596,81,93,964,crushing enPassant endgame hangingPiece veryLong,https://lichess.org/4vNwPS4J#81,
kk4dN,2q1r1k1/bp3R2/6pp/pP1p4/P2P2P1/2N3P1/3Q2KP/8 w - - 1 38,d2h6 g8f7 h6h7 f7f8,2503,89,84,96,advantage defensiveMove endgame hangingPiece master short,https://lichess.org/eBB8i8y4#75,
kpwYK,r5k1/2QB1pp1/4p2p/p7/Pq1Pn1b1/4PNP1/1r1N1PP1/3RK2R w K - 3 18,d7e6 f7e6 e1g1 e4d2 d1d2 b2d2 f3d2 b4d2,2531,80,80,103,advantage hangingPiece middlegame pin veryLong,https://lichess.org/Hm4ezer3#35,Queens_Pawn_Game Queens_Pawn_Game_Accelerated_London_System
ksSJs,r4b2/1r4pk/1p3pqB/p3p3/3p3R/P2P1Q1P/1PP3P1/6K1 b - - 1 33,g7h6 f3b7 f8e7 b7e7 g6g7 e7e6 a8g8 h4g4,2508,126,84,28,crushing endgame fork hangingPiece veryLong,https://lichess.org/ENHKSI05/black#66,
ksgo8,K7/8/PQnkp3/8/3P4/8/8/8 w - - 5 72,b6a5 c6a5 a8b8 d6d7 a6a7 a5c6 b8b7 c6a7,2561,86,92,134,crushing endgame hangingPiece master veryLong,https://lichess.org/DTAWgyvd#143,
kvuKM,5R2/1p2q1pp/4p3/5B1k/1pP2PN1/2n4P/6P1/3rQ1K1 w - - 3 35,e1d1 c3d1 f5g6 h5g6 g4e5 g6h6,2526,98,90,417,crushing endgame hangingPiece long,https://lichess.org/47JmBz3H#69,
kwY9R,r2b1rk1/p2n2pp/2p5/q1p1p2b/Q1P2p2/1PNP1P1N/P3PB1P/2KR2R1 w - - 4 19,a4c6 a5c3 c1b1 a8b8,2582,91,68,94,advantage hangingPiece middlegame short,https://lichess.org/n2iNzssa#37,Grob_Opening Grob_Opening_Other_variations
kzmEH,7Q/1p6/p3nPp1/6kp/P1P1q1n1/2Bp4/5RPP/7K w - - 5 55,f6f7 g4f2 h1g1 f2g4 c3d2 g4e3,2546,90,74,84,crushing endgame hangingPiece long,https://lichess.org/XPFom5rq#109,
l1N1Y,3Rr2k/pp3p1p/1b3p2/5N2/2P5/1P2PQP1/5P1P/q5K1 w - - 0 25,g1g2 e8d8 f5h6 h8g7,2566,87,82,186,advantage endgame hangingPiece short,https://lichess.org/doVJrx9l#49,
l2kYF,5k1r/p2r1bp1/1p4Bn/2q3P1/8/5Q2/PPP2RP1/R5K1 b - - 0 24,h6g4 f3g4 d7d2 a1f1 d2f2 f1f2,2523,104,90,1154,advantage hangingPiece long middlegame pin quietMove,https://lichess.org/xE7ziuuI/black#48,
l6kw0,8/pp2pp1p/8/4kPp1/2P1N3/1P2Pn1P/P4P2/7K w - - 1 43,e4g5 f3g5 f2f4 e5f5 f4g5 f5e4 h1g2 e4e3,2542,95,77,150,crushing endgame hangingPiece knightEndgame veryLong,https://lichess.org/L2L9RQRO#85,
l7gkl,2kr3r/5p1p/p7/1ppqb3/6b1/2P1Q3/PP1NNPPP/2KR3R b - - 1 19,d5a2 e3e5 h8e8 e5c5 c8b7 e2d4 d8d4 c5d4 g4f5 d2e4 e8e4 d4d5 a2d5 d1d5,2592,89,90,1176,crushing exposedKing fork hangingPiece middlegame quietMove veryLong,https://lichess.org/JQkPL3pC/black#38,
l8IoM,3Q1rk1/pb4p1/4pp2/7p/2ppqB2/6R1/P1P3PP/5RK1 w - - 1 32,g3g7 g8g7 d8e7 f8f7 f4h6 g7h6 f1f6 f7f6,2533,77,87,214,crushing hangingPiece middlegame veryLong,https://lichess.org/LLA3LAOi#63,
lBPWs,8/1R1b1p1p/p4k1r/P1qBpP2/1p2P3/1P2b3/6PP/3Q3K b - - 7 34,c5c3 b7d7 e3f4 d7d6 f6e7 d6h6,2599,82,68,123,crushing hangingPiece long master middlegame,https://lichess.org/dni5zCTe/black#68,
lCHVi,8/8/r3R3/8/6K1/3k2P1/4p2P/8 w - - 0 58,e6e2 d3e2 h2h4 a6a4,2583,81,97,535,crushing endgame hangingPiece master rookEndgame short,https://lichess.org/j5lH2K3H#115,
