PuzzleId,FEN,Moves,Rating,RatingDeviation,Popularity,NbPlays,Themes,GameUrl,OpeningTags
WsLKQ,5qk1/p5pp/4p3/1pNnPr2/3P2RP/1P6/P5Q1/4K3 b - - 2 44,d5f4 g4f4 f5f4 c5e6 f8e7 e6f4,1625,118,43,12,advantage attraction capturingDefender endgame fork long,https://lichess.org/NOjuj4M7/black#88,
iJXpX,5rk1/ppp3pp/3ppr2/4p2q/N5R1/3P1P1P/PPP5/R1B2QK1 w - - 1 17,g1g2 f6f3 f1f3 f8f3 g2f3 h5h3,1637,75,69,670,advantage attraction capturingDefender long middlegame,https://lichess.org/vIfs9Rnd#33,Four_Knights_Game Four_Knights_Game_Italian_Variation
ekeAz,1r3r2/1pR2pk1/p2R1p2/5B1p/3N2bP/5nP1/PP3P2/6K1 w - - 5 28,g1g2 f3d4 d6d4 g4f5,1609,75,97,3860,advantage capturingDefender middlegame short,https://lichess.org/E9kYC0hL#55,
0FQBp,2kr2r1/pb6/1p1p4/3N1pqp/2P5/P4Q2/5PPP/R3R1K1 w - - 0 23,e1e7 b7d5 f3d5 g5e7 d5a8 c8d7 a8a7 d7e8,1686,77,94,6883,capturingDefender crushing defensiveMove middlegame veryLong,https://lichess.org/BbYspvmp#45,
aCbva,2r1kb1r/pp1b1ppp/1q2p3/3pP3/1P1n4/P2B3P/1B1N1PP1/R2QK2R b KQk - 6 14,d7b5 b2d4 b6d4 d3b5,1699,89,78,32,advantage capturingDefender opening short,https://lichess.org/lSITYge7/black#28,French_Defense French_Defense_Advance_Variation
8TDXf,r3k2r/ppqn2pp/2p1p3/3p1p1P/3Pb1P1/P1N1P1b1/1PPBB3/R2Q1KNR w kq - 0 14,h1h3 f5g4 e2g4 e8g8,1688,194,-100,10,advantage castling discoveredAttack middlegame short,https://lichess.org/FxBZHLy7#27,Queens_Pawn_Game Queens_Pawn_Game_Other_variations
tqSEh,r1bqk2r/pppp1ppp/2n5/8/1bBPn3/2NQ1N2/PP3PPP/R1B1K2R b KQkq - 1 8,d8e7 e1g1 b4c3 b2c3,1643,87,81,637,advantage castling opening short,https://lichess.org/Qq2ydhMD/black#16,Italian_Game Italian_Game_Giuoco_Piano
WOGRQ,rn2k2r/pppq1ppp/5n2/3Pp3/8/2B2Q2/PPP3PP/R3K1NR b KQkq - 0 10,f6d5 e1c1 d5c3 d1d7,1698,79,91,1984,advantage castling middlegame short,https://lichess.org/4RQ47Bz9/black#20,Blackmar-Diemer_Gambit_Declined Blackmar-Diemer_Gambit_Declined_Elbert_Countergambit
cOxhY,r2q1rk1/1p3p1p/3p1np1/p7/1PPpP3/3P1Q1P/R4PP1/1N2K2R b K - 0 17,a5b4 a2a8 d8a8 f3f6 a8a2 e1g1,1615,81,94,1039,advantage castling defensiveMove long middlegame,https://lichess.org/bEk1RPY4/black#34,English_Opening English_Opening_The_Whale
MtCHc,r3k2r/p1p1b1p1/4pn1p/2B5/8/1P6/P1P1RPPP/RN4K1 w kq - 0 17,e2e6 e8c8 b1c3 e7c5,1638,95,89,2116,advantage castling middlegame short,https://lichess.org/dWlHzIGJ#33,Italian_Game Italian_Game_Two_Knights_Defense
aF8fT,r3k2r/ppp2ppp/2n4n/1B3b2/8/1PP1PN1P/P4PP1/RN1K3R w kq - 3 13,f3e5 e8c8 d1e1 c6e5,1686,83,98,1224,advantage castling discoveredAttack middlegame short,https://lichess.org/f1sMTqoT#25,Indian_Defense Indian_Defense_Knights_Variation
SfO73,r3k2r/pp3ppp/4p3/8/2P5/b7/P4PPP/1R1K2NR w kq - 0 15,b1b7 e8c8 d1e2 c8b7,1651,88,80,613,castling crushing discoveredAttack endgame short,https://lichess.org/aDn2evus#29,Scandinavian_Defense Scandinavian_Defense_Panov_Transfer
UL02Y,r3k2r/1pp1qppp/p7/1b6/4PB2/P1Q5/1P3PPP/R3K2R w KQkq - 1 16,c3g7 e7e4 f4e3 e8c8,1653,77,94,221,advantage castling defensiveMove fork middlegame short,https://lichess.org/KGghgJh9#31,English_Opening English_Opening_Anglo-Indian_Defense
gDWKx,r3k1r1/pppqnpPp/4b3/8/2pp4/5N2/PPP2PPP/RN1QR1K1 w q - 0 13,f3d4 e8c8 b1c3 d7d4 d1d4 d8d4,1684,89,80,733,advantage castling intermezzo long middlegame,https://lichess.org/kZyQkYIz#25,Italian_Game Italian_Game_Scotch_Gambit
Vh8F1,7r/2Pk1ppp/4p3/5b2/1r6/5P2/1P3P1P/R3KB1R b KQ - 0 20,b4b2 e1c1 d7c7 c1b2,1603,90,81,701,advantage castling discoveredAttack endgame short,https://lichess.org/lccn0nCg/black#40,
4bihF,r3k2r/pp2q1bp/2p1bpp1/8/4PB2/1QPB4/PP4PP/4RRK1 w kq - 4 17,d3c4 e7c5 f4e3 c5c4 b3b7 e8g8,1680,77,94,3869,castling crushing defensiveMove long master middlegame,https://lichess.org/mK6FtBcI#33,Pirc_Defense Pirc_Defense_Other_variations
EQRj5,rnbqk2r/pp3ppp/2P2n2/2b1N3/8/8/PPPP1PPP/RNBQKB1R w KQkq - 1 6,d1e2 e8g8 c6b7 c8b7,1697,264,100,12,castling equality opening short,https://lichess.org/C7ClaBFX#11,
iKgv7,r3k2r/pp3ppp/2n1pq2/3B4/8/6P1/PPP2PP1/R2QR1K1 w kq - 1 16,c2c3 e8c8 d5c6 d8d1,1699,92,86,571,advantage castling middlegame short,https://lichess.org/rU61mAiK#31,Caro-Kann_Defense Caro-Kann_Defense_Classical_Variation
POqpT,r3k2r/ppp2ppp/2p5/8/4q3/6Pb/PPP1BK1P/RNBQ1R2 w kq - 2 11,f1e1 e4g2 f2e3 e8g8,1658,91,95,17331,advantage castling defensiveMove middlegame short,https://lichess.org/OBhCVFPX#21,Russian_Game Russian_Game_Stafford_Gambit
2gdZl,r3k2r/1R5p/p4p2/6p1/8/2n1PNP1/P4PP1/4K2R w Kkq - 1 22,a2a3 e8c8 b7b8 c8b8,1646,87,82,638,castling crushing endgame short,https://lichess.org/pROgm2In#43,
x124n,2r1r1k1/pp5p/3N2p1/2pP4/6nq/4P3/PP1QBPP1/R3K3 b Q - 0 20,e8e3 e1c1 e3e2 d2e2,1614,87,84,617,advantage castling middlegame short,https://lichess.org/VE7mUQ95/black#40,
71kOY,r3k2r/p1p3pp/2pb4/8/4bB2/2P5/PP1R2PP/2K2B1R w kq - 0 16,d2e2 d6f4 c1d1 e8c8,1645,92,90,2781,castling crushing discoveredAttack hangingPiece middlegame short,https://lichess.org/NiQJttzk#31,Queens_Pawn_Game Queens_Pawn_Game_Accelerated_London_System
45Z4r,1r5r/3k1ppp/5b2/p1p5/4P3/2N2P2/PP3P1P/R3K2R b KQ - 1 16,b8b2 e1c1 f6d4 c1b2,1662,94,89,2335,castling crushing discoveredAttack endgame pin short,https://lichess.org/ZKF6mc4K/black#32,Queens_Gambit_Accepted Queens_Gambit_Accepted_Gunsberg_Defense
7AiFb,r1bqkb1r/ppp2ppp/2p5/4N3/4n3/5Q2/PPPP1PPP/RNB1K2R b KQkq - 1 6,f7f5 f3h5 g7g6 e5g6 h7g6 h5h8 d8e7 e1g1,1646,77,95,14446,advantage castling defensiveMove opening veryLong,https://lichess.org/nhIVQjS7/black#12,Ruy_Lopez Ruy_Lopez_Berlin_Defense
QkA1q,r1b3kr/ppQ4p/2n4p/6q1/3Pp3/2N5/PPP2PPP/R3K2R b KQ - 0 12,g5g2 e1c1 g2g5 c1b1,1645,90,94,9463,advantage castling defensiveMove middlegame short,https://lichess.org/NL6Bb8Sg/black#24,Elephant_Gambit Elephant_Gambit_Other_variations
s0CdA,r2q1r2/1b3pk1/p4Pp1/1pp5/3np3/3PN3/PP1Q2PP/1RN2RK1 b - - 0 21,g7h7 e3g4 d4e6 d2h6,1681,81,67,40,clearance crushing middlegame quietMove short,https://lichess.org/xZCNVbYG/black#42,
zGuVk,r3Rrk1/p2P4/2p5/1b3p1p/7p/3P4/1P3PP1/4R1K1 b - - 1 29,a8d8 e8d8 f8d8 e1e8 g8f7 e8d8,1628,75,87,73,attraction clearance crushing endgame exposedKing long,https://lichess.org/VIh3i8Wu/black#58,
Z4Se6,6k1/p4p2/1pN3pp/2pP3q/P1P3n1/6P1/2Q2P1P/6K1 w - - 3 33,f2f4 g4e3 c2d3 h5f3 d3e3 f3e3,1641,75,82,84,clearance crushing endgame long,https://lichess.org/o0pskWYK#65,
QKv7N,5rk1/1Q3ppp/1R1p4/p3p1b1/P1B5/qPr4P/5PP1/4R1K1 b - - 0 32,c3c1 b7f7 f8f7 b6b8 g5d8 b8d8,1672,75,100,151,clearance kingsideAttack long mate mateIn3 middlegame pin sacrifice,https://lichess.org/kFtD0l12/black#64,
89v97,3r3k/ppQ3p1/2b4p/8/5P2/4n3/P1Pq2PP/4R1RK w - - 0 27,e1e3 d2g2 g1g2 d8d1 e3e1 d1e1,1676,72,95,16476,clearance endgame long mate mateIn3 pin sacrifice,https://lichess.org/XWFht6Qz#53,
eUnxd,3r1r2/pp2n2k/4q1pp/1P1p4/3bp3/BB6/P3QPPP/1R3RK1 b - - 5 25,f8f2 f1f2 d8f8 b1f1,1678,76,79,175,advantage clearance defensiveMove master middlegame short,https://lichess.org/AScOQDkQ/black#50,
YofUq,rn3r2/5pk1/q1p4p/3pP1bP/p2P4/1P6/1PQ1N1P1/1K3RNR w - - 0 23,e5e6 a4b3 c2b3 a6a1 b1c2 a1f1,1684,74,88,1452,clearance crushing long middlegame skewer,https://lichess.org/Wx4w85os#45,
m3YqP,8/8/8/pK3k2/P4P2/rp6/8/5R2 w - - 0 46,b5a5 b3b2 f1b1 a3b3,1676,98,89,29,advancedPawn clearance crushing defensiveMove endgame master rookEndgame short,https://lichess.org/57Q8O0If#91,
qTbGU,2r3q1/1p3p1k/6rP/p3BQ2/3P4/PP2nP2/6P1/2RR2K1 w - - 1 31,f5c8 g6g2 g1h1 g2h2 e5h2 g8g2,1620,74,96,20331,clearance long mate mateIn3 middlegame sacrifice,https://lichess.org/rZKJdGco#61,
BrRID,r4r2/2pb1pkp/pp1p2p1/3Pn1q1/4P1R1/3B2N1/PPP1NQP1/5RK1 b - - 0 19,g5g4 f2f6 g7g8 f1f4,1621,75,96,8932,clearance crushing middlegame short,https://lichess.org/9RvRJAaV/black#38,
hPEY9,1kr5/pppQ2pp/5p1n/8/8/6B1/PP3P1q/K2R4 b - - 3 25,h2h5 d7c7 c8c7 d1d8,1662,75,98,113,clearance endgame mate mateIn2 pin sacrifice short,https://lichess.org/gbMiFIRI/black#50,
GP72Z,r4rk1/pqp2ppb/5n1p/1p6/5P2/1QB1P2P/PP5K/2R3R1 b - - 6 26,f6h5 g1g7 h5g7 c1g1 h7g6 g1g6,1672,110,76,15,clearance crushing kingsideAttack long middlegame pin sacrifice,https://lichess.org/3FgLJaSh/black#52,
24Hlb,2rr4/p7/5qkp/2NB1np1/P2PP3/3Q4/5P1P/1R4K1 b - - 0 36,f5d4 e4e5 f6f5 d5e4,1680,74,94,2377,clearance crushing discoveredAttack middlegame pin short,https://lichess.org/ipUEDl7f/black#72,
8jBWb,1k1r4/1p3p2/p2p3q/P1p1pBr1/Q3P1Pp/2PP4/1P3P1K/R4R2 w - - 3 28,a4b3 g5f5 e4f5 h6f4 h2h3 f4f3,1622,335,100,19,clearance equality exposedKing long middlegame sacrifice,https://lichess.org/enXE3eCR#55,
K4yca,r1bq1rk1/2ppb1pp/p1p5/6PQ/3p4/8/PPP1NPP1/R1B2RK1 b - - 1 13,c6c5 g5g6 h7g6 h5d5 g8h7 d5a8,1695,130,88,19,advantage clearance fork long middlegame,https://lichess.org/MvZqFcgt/black#26,Ruy_Lopez Ruy_Lopez_Berlin_Defense
QtndA,4r1k1/p1R2pp1/7p/2N5/5P2/6P1/PP2nr1P/1K1R4 w - - 3 33,d1d7 e2c3 b2c3 e8e1 d7d1 e1d1,1678,76,97,2339,clearance endgame long mate mateIn3 sacrifice,https://lichess.org/fshBM7Ut#65,
CagNr,r3k2r/1b2qpp1/p1np1n1p/2pN4/1p1pP3/3B1N2/PPPQ1PPP/2K1R2R b kq - 3 14,f6d5 e4d5 c6e5 f3e5 d6e5 e1e5 e7e5 h1e1,1698,74,97,236,clearance crushing middlegame pin veryLong,https://lichess.org/S5L5NIMT/black#28,St_George_Defense St_George_Defense_Other_variations
NeFCJ,rn1qr2k/pp3Qpp/1b6/6B1/4n3/PBP4P/1P2NpP1/RN3K1R w - - 1 18,g5d8 e4g3 e2g3 e8e1,1682,76,95,16263,clearance mate mateIn2 opening sacrifice short,https://lichess.org/M3qD3jsc#35,Bishops_Opening Bishops_Opening_Berlin_Defense
FCGOv,r5k1/1p2qp1p/2p3p1/5b2/2P1r3/1PQ1B1P1/P4P2/2R1R1K1 b - - 4 22,a8a2 e3h6 f7f6 e1e4 f5e4 c1e1,1676,74,84,539,advantage clearance discoveredAttack long middlegame quietMove,https://lichess.org/kwVONZB3/black#44,
cUwsc,r3r1k1/p2q1ppp/2p2n2/8/2B3b1/3PP1Q1/PPP3PP/RN2K2R w KQ - 1 13,h2h3 e8e3 g3e3 a8e8 e3e8 d7e8,1637,76,88,753,advantage clearance long middlegame pin sacrifice,https://lichess.org/loPD7J4F#25,Kings_Pawn_Game Kings_Pawn_Game_Gunderam_Gambit
xdVQi,2k1r3/1pp2p2/pn6/8/2n2BRP/1BP2Q1K/P1P3P1/7q w - - 3 31,f4h2 e8e3 g4g8 c8d7 g8g3 e3f3,1628,79,85,50,crushing long middlegame pin,https://lichess.org/ZPN1S8MC#61,
m1huL,8/7K/8/3p2P1/3k4/5r2/8/2R5 b - - 1 52,d4e3 c1c3 e3e4 c3f3 e4f3 g5g6 d5d4 g6g7 d4d3 g7g8q,1643,75,88,1103,advancedPawn crushing endgame master promotion rookEndgame veryLong,https://lichess.org/v5c2sNqE/black#104,
M3yXc,5q1k/6p1/7p/Q7/P7/4B1PP/1PR2P1K/3r4 w - - 1 30,a5e5 f8f3 c2c8 h8h7 e5f5 f3f5,1642,75,94,79,crushing defensiveMove endgame long,https://lichess.org/7LIQvUhg#59,
5MGjE,8/1P6/B1kn3p/2p3p1/2P3P1/4K3/8/8 b - - 0 47,d6b7 a6b7 c6b7 e3e4,1606,75,82,383,crushing defensiveMove endgame master short,https://lichess.org/2UbReL8q/black#94,
nTkir,8/7p/2p5/pkPp2K1/3P2BP/P2b4/8/8 w - - 1 35,g4d7 b5c4 g5f4 c4d4,1615,119,53,15,bishopEndgame crushing endgame short,https://lichess.org/x256chIS#69,
ReQsY,2R5/p4k1p/6p1/6P1/7P/P7/r1pK4/8 w - - 6 53,c8c2 a2c2 d2c2 f7e6,1621,84,88,34,crushing defensiveMove endgame rookEndgame short,https://lichess.org/63c6sJWf#105,
xDWfp,5r1k/pqr3p1/3n3p/1pQ1N3/3P4/1P6/P4PPP/2R3K1 w - - 0 25,c5c7 f8c8 c7c8 d6c8,1688,74,90,1340,crushing endgame short,https://lichess.org/JNQisCtY#49,
rLIM8,8/2nkp2p/3p1np1/1p3pN1/p2q4/P5PP/2QN1P2/5BK1 b - - 1 33,h7h6 c2c7 d7c7 g5e6 c7b7 e6d4,1660,76,94,11990,attraction crushing fork long middlegame sacrifice,https://lichess.org/7nsQTBG3/black#66,
OdEFL,r1b1kb1r/ppp2ppp/2n1pn2/q7/3P1P2/2N2N2/PPPB2PP/R2QKB1R b KQkq - 4 7,a5b6 c3a4 b6d4 f3d4,1608,76,90,418,crushing opening short trappedPiece,https://lichess.org/jjNYvjNj/black#14,French_Defense French_Defense_La_Bourdonnais_Variation
H8OSy,8/pp6/8/1PP2b2/1k3K2/2N5/8/8 b - - 5 51,b4c3 f4f5 c3d4 c5c6 b7c6 b5c6,1673,78,95,9094,crushing endgame hangingPiece long master,https://lichess.org/A7icoxVZ/black#102,
R2CeC,r1bq1b1r/ppp2Qpp/3k4/3Bp3/3P4/2P5/PP3PPP/nNBK3R b - - 0 12,d8f6 d4e5 f6e5 c1f4 e5f4 f7f4,1605,75,36,75,crushing long opening pin,https://lichess.org/9EfJ5Vey/black#24,Italian_Game Italian_Game_Two_Knights_Defense
6SOZU,4r1k1/5ppp/2p5/p4q2/2Pp4/Pr1P2Q1/5PPP/1R3RK1 b - - 3 26,b3d3 b1b8 h7h6 b8e8,1656,76,92,1083,crushing endgame short,https://lichess.org/AztoEURF/black#52,
k4Hmk,2r2bk1/1q6/p4pb1/3Np1p1/1P2P1P1/5PK1/3Q4/1R6 b - - 0 39,g6f7 d5f6 g8g7 d2g5 f7g6 f6h5 g7f7 g5f6,1641,75,76,75,crushing exposedKing middlegame veryLong,https://lichess.org/vFE8Invc/black#78,
B22yF,2r5/p5qk/1p6/7p/4Q3/P7/1Pp3P1/K1R5 b - - 2 44,g7g6 e4b7 g6g7 b7c8,1669,78,82,49,crushing endgame fork master short,https://lichess.org/PIQzyIIB/black#88,
MrXtQ,6k1/1r4rB/8/2p1q1P1/8/pP1p3Q/P1P5/1K5R b - - 0 36,g8f8 h3c8 f8e7 c8b7,1613,198,43,9,crushing endgame interference short,https://lichess.org/mOR8kyuM/black#72,
Jclfv,r4rk1/1pp1qppp/p4n2/1b1QN3/5P2/4PN2/PP4PP/R2R2K1 w - - 9 17,d5b7 f8b8 b7b8 a8b8,1671,74,96,8842,crushing middlegame short trappedPiece,https://lichess.org/f8YiDsNp#33,Queens_Pawn_Game Queens_Pawn_Game_Other_variations
5Xzij,8/8/pp2p3/5p2/1PP2K1k/8/8/8 b - - 0 45,h4h5 c4c5 b6c5 b4c5 h5g6 c5c6 g6f6 c6c7,1693,76,90,2487,advancedPawn crushing endgame pawnEndgame veryLong,https://lichess.org/DKAwzvZ0/black#90,
PlAjQ,1rr2k2/4qpbQ/8/8/p2P1P2/2P1PBP1/P7/K3R2R w - - 7 36,f3d5 e7a3 h7c2 c8c3,1693,75,92,2737,crushing master middlegame short,https://lichess.org/LbEP70Vu#71,
OGy9p,8/2k1P3/2P2Kp1/2R2n1p/5P2/7P/6r1/8 b - - 0 48,g2e2 c5e5 e2e5 f4e5 f5e7 f6e7,1626,75,89,372,crushing endgame long,https://lichess.org/X8o0Bkqg/black#96,
Q1mWp,8/1r6/3k4/1pRp3p/1P1P2pP/6P1/5K2/8 b - - 1 45,b7c7 c5c7 d6c7 f2e3 c7c6 e3f4,1679,74,94,2111,crushing endgame long rookEndgame,https://lichess.org/ivl0uC5p/black#90,
gN5r1,r6k/3n2p1/2R4p/2PBp3/4P3/2r3PP/p5K1/R7 b - - 2 34,d7c5 c6c5 c3c5 d5a8 c5c2 g2f3,1650,77,96,13914,advantage defensiveMove discoveredAttack endgame long,https://lichess.org/Q75BCjt0/black#68,
tplx5,2r5/1k5p/4p1p1/QpPpN1P1/p2P1PP1/7K/q7/8 b - - 1 44,a2b3 h3h4 c8c7 a5b6,1658,76,90,3736,crushing defensiveMove endgame master short,https://lichess.org/1CUwdAQN/black#88,
8bAPd,r3k2r/pbq1pp1p/2pp1np1/4b3/8/6P1/PPP1NPBP/R1BQ1RK1 b kq - 1 13,e8g8 f2f4 c7b6 g1h1,1655,75,88,362,advantage defensiveMove middlegame short,https://lichess.org/dse5h1Lp/black#26,Sicilian_Defense Sicilian_Defense_Accelerated_Dragon
CmPFV,rnb1k3/pp3p2/2pp4/3np1B1/8/3NP1P1/q1P2PBP/3QK2R b Kq - 0 19,d5c3 d1h5 a2a1 e1d2,1646,74,92,1457,crushing defensiveMove middlegame short,https://lichess.org/TwC84a9j/black#38,
rM3SA,8/8/8/4knp1/5pB1/7P/5K2/8 w - - 7 51,g4f5 e5f5 f2f3 f5e5,1605,75,100,487,crushing defensiveMove endgame short,https://lichess.org/zOoI0DkN#101,
pFgKL,6k1/3b4/p2N2Pp/1pP1q3/1P6/P3pP2/2Q3PK/8 w - - 1 45,h2g1 e3e2 c2a2 d7e6 a2e2 e5e2,1620,79,95,21195,advancedPawn crushing defensiveMove endgame long,https://lichess.org/Z74sIa1a#89,
1SvlI,r4rk1/pp1qbp2/2n2n1Q/3p1bN1/8/2NB3P/PPP2PP1/3R1RK1 b - - 4 15,f5d3 d1d3 d7f5 d3g3,1652,74,93,1899,advantage defensiveMove master middlegame short,https://lichess.org/U2zpxwgE/black#30,French_Defense French_Defense_Knight_Variation
r9WVq,4r1k1/p3r1pp/8/5Q2/8/P1n1B1P1/2P2P1P/6K1 w - - 3 28,e3d4 c3e2 g1g2 e2d4 f5d5 d4e6,1695,74,91,1661,advantage defensiveMove endgame fork long,https://lichess.org/c777guLT#55,
KiaFH,8/5pp1/7p/1k6/pp6/1P5P/P1K2PP1/8 b - - 1 37,a4a3 c2d3 b5c5 d3e4,1627,76,84,932,crushing defensiveMove endgame pawnEndgame short,https://lichess.org/ENQ6Tb0m/black#74,
2RIfN,7q/6kP/7R/5KP1/8/8/8/8 b - - 0 52,h8h7 h6h7 g7h7 f5f6 h7g8 f6g6,1629,75,95,4292,crushing defensiveMove endgame long,https://lichess.org/HawwuPXm/black#104,
SF5iG,2r2rk1/pp1b1ppp/3p4/3Pp3/3b4/P6P/1PqBBPP1/1R2QRK1 b - - 3 18,c8c7 b1c1 c2g6 c1c7 d7h3 e2f3,1630,84,19,78,advantage defensiveMove long middlegame skewer,https://lichess.org/hHOSiKGV/black#36,Kings_Pawn_Game Kings_Pawn_Game_Dresden_Opening
yo7dl,2r1r1k1/5pp1/p7/3N4/1P1Q1P1p/6qP/P5P1/R2R2K1 w - - 1 29,d1d3 e8e1 a1e1 g3e1 g1h2 c8c1,1614,74,92,2663,crushing defensiveMove long master middlegame,https://lichess.org/ThL2mvH7#57,
6EaE2,5k2/2p1qp1p/p1p2p2/4p3/4P3/2P3R1/P1P2PKP/6R1 b - - 4 23,f8e8 g3g8 e8d7 g1d1 d7e6 d1d8,1607,75,94,1494,crushing defensiveMove endgame long queenRookEndgame,https://lichess.org/mjqJD0t3/black#46,
haQXc,4rr2/ppp4k/1b1pq1pp/1P6/2P1R3/P3PNPP/2Q3B1/5RK1 b - - 0 30,e6e4 f3g5 h6g5 g2e4 b6e3 g1g2,1642,79,96,22346,crushing defensiveMove discoveredAttack long middlegame,https://lichess.org/bOzCMVvI/black#60,
5RBTt,8/2k5/P4p2/1PK1p3/4P3/1P3P1b/8/8 b - - 2 41,h3g2 b5b6 c7c8 c5c6,1665,75,100,156,bishopEndgame crushing defensiveMove endgame short,https://lichess.org/BLphk0NC/black#82,
rwWuL,r2q1rk1/pp3ppp/2p2n2/8/3P1B2/2PB2Pb/PP3P1P/R2QR1K1 w - - 5 18,f4g5 d8d5 f2f3 d5g5 e1e5 g5h6,1641,74,96,1229,advantage defensiveMove long middlegame,https://lichess.org/zAjdh8qs#35,Scandinavian_Defense Scandinavian_Defense_Gubinsky-Melts_Defense
UTqjv,2k5/1pp3p1/p7/3p1N2/4p1q1/2P1PRP1/PPK1Q1P1/7r w - - 0 27,f5e7 c8d7 f3f2 g4e2 f2e2 d7e7,1681,77,93,5535,advantage defensiveMove endgame long,https://lichess.org/V6Qyi8Mr#53,
lCje7,3Rbk2/5pp1/7p/1p6/1r6/Pp1B3P/5PP1/6K1 b - - 0 35,b4a4 d8e8 f8e8 d3b5 e8e7 b5a4 b3b2 a4c2,1679,76,88,120,attraction crushing defensiveMove endgame fork master masterVsMaster veryLong,https://lichess.org/6qB5h1cK/black#70,
Q0tbW,8/8/8/3k3p/3p4/5P1P/3K4/8 w - - 2 65,f3f4 d5e4 f4f5 e4f5 d2d3 f5e5 h3h4 e5d5,1613,76,87,298,crushing defensiveMove endgame pawnEndgame veryLong,https://lichess.org/G2wXCsAB#129,
W6WFF,8/R3Rpk1/5r2/7p/6rK/6P1/8/8 w - - 2 52,h4h5 g4g3 h5h4 g3g1,1679,75,88,110,crushing defensiveMove endgame master rookEndgame short,https://lichess.org/29DDf0BK#103,
SO6zT,8/3Rr3/2P5/pp2Pkp1/4p3/4P3/8/7K b - - 4 55,e7e5 c6c7 e5c5 d7d5 c5d5 c7c8q,1601,76,80,119,advancedPawn advantage deflection endgame long promotion rookEndgame,https://lichess.org/OT7XpiUJ/black#110,
6MRV6,2R5/6kp/4p1pb/3p1p2/1P1P4/q3P2P/5QP1/6K1 w - - 2 40,f2g3 h6e3 g1h2 e3g1 h2g1 a3g3,1673,79,96,18192,crushing deflection discoveredAttack endgame long,https://lichess.org/3Kg7ZiuY#79,
2mGyR,r1b1kbnr/1pp2ppp/p1p5/4N3/3PP3/5Q2/PPP2PqP/RNB1K2R b KQkq - 1 7,c8h3 f3f7 e8d8 f7f8,1689,74,87,159,attackingF2F7 deflection mate mateIn2 opening short,https://lichess.org/RG8j1Swo/black#14,Ruy_Lopez Ruy_Lopez_Exchange_Variation
jkHYw,8/2p3kP/1pRbr1B1/1Pp2K2/2P5/8/8/8 b - - 11 54,e6g6 h7h8q g7h8 f5g6 h8g8 g6f6,1600,75,97,1597,advancedPawn crushing defensiveMove deflection endgame long promotion,https://lichess.org/bCzRZ1CQ/black#108,
xE1QL,6q1/pkp1b3/1pb1r3/P2pNp2/4pP2/4B3/2P2QPP/R6K b - - 3 31,e7d6 a5a6 b7c8 e5c6,1601,83,74,48,advantage deflection middlegame short,https://lichess.org/pMRylOrn/black#62,
oysRz,1k5r/2p2p2/2p5/pp3P2/3qP3/1R1P4/2P3R1/5QK1 w - - 4 39,f1f2 d4a1 f2f1 h8h1 g1h1 a1f1,1602,89,78,30,advantage attraction deflection endgame exposedKing long,https://lichess.org/2LM44WZK#77,
HAie1,8/2p5/2p1k3/2Pp1R2/3P2K1/8/1P2r3/8 w - - 1 37,b2b4 e2g2 g4f3 e6f5,1664,135,73,16,crushing deflection endgame rookEndgame short,https://lichess.org/DnahSX4Q#73,
QwJyb,3b1k2/1b3p2/p3p2p/1pB1P3/1Pp2P2/P1P3Q1/2B1q2P/6K1 b - - 8 37,f8e8 g3g8 e8d7 g8f7 d7c8 f7e6 c8b8 e6d6 d8c7 d6f8 b7c8 c2f5,1646,122,88,12,crushing deflection endgame fork master veryLong,https://lichess.org/J9YQmHTD/black#74,
Z5Sgy,r2q3r/p4kpp/1p1pbn2/2p5/4NP2/8/PPP3PP/R1B1QRK1 b - - 1 15,h8e8 e4g5 f7g8 g5e6 d8e7 f4f5,1602,74,96,28087,crushing defensiveMove deflection long middlegame,https://lichess.org/2qt0v8zd/black#30,Kings_Gambit_Declined Kings_Gambit_Declined_Classical_Variation
wu7Ak,2kr4/2p4p/1p3p2/p7/1b3P2/1QN1qBrP/6P1/2R2R1K w - - 2 25,f1e1 g3h3 g2h3 e3f3,1685,75,92,735,crushing deflection middlegame short,https://lichess.org/E92uv61h#49,
6UCk0,6r1/8/p2R4/2P2pk1/PP2b3/K3P3/1Q3P2/5q2 b - - 1 45,g8g6 f2f4 g5g4 d6g6,1626,81,63,101,crushing deflection endgame short,https://lichess.org/yVsMEHbR/black#90,
YqFcz,8/2R4p/5k1r/1p1p1pp1/bB1P4/2P3PP/5P1K/8 b - - 0 33,f5f4 c7c6 f6g7 b4f8 g7f8 c6h6,1647,75,92,2214,crushing deflection endgame long,https://lichess.org/vrno22Qi/black#66,
rJkj6,8/5pk1/3B2bp/p1p5/Pp1b3P/1B3R2/KPP1r1P1/1N6 w - - 1 27,g2g4 c5c4 b3c4 e2c2 f3b3 c2c4,1648,355,82,1,advantage deflection long middlegame,https://lichess.org/kNxZI4Av#53,
s5hRN,r1bk1b1r/pp1n1Qpp/3q1n2/8/3P4/8/PP3PPP/RNB1R1K1 b - - 0 14,d6d5 e1e8 f6e8 f7d5,1670,86,79,33,advantage deflection master opening short,https://lichess.org/t8eovaDp/black#28,Sicilian_Defense Sicilian_Defense_Modern_Variations
5q8cA,b4k2/P4p1p/4p3/8/1N2P3/6Pp/1r5P/R5K1 w - - 0 38,b4a6 b2g2 g1f1 g2h2,1625,74,80,133,crushing deflection endgame master short,https://lichess.org/2qxL2z3i#75,
RKN9g,6Q1/8/p5k1/1p1p4/2pP1bqP/2P5/PP6/7K b - - 1 40,g6f5 g8c8 f5f6 c8g4,1675,76,95,11113,crushing deflection endgame short skewer,https://lichess.org/voFwh9br/black#80,
zaqa5,8/5pk1/5pq1/bRn5/P3P2Q/2P3RP/6P1/3r2K1 w - - 2 47,g1h2 a5c7 b5c5 c7g3 h4g3 d1h1 h2h1 g6g3,1674,77,95,13341,advantage deflection fork middlegame pin veryLong,https://lichess.org/hT4Ylr80#93,
GTiiv,4r3/1p4kp/p2p4/2PP1pq1/2P5/P4Qb1/6PP/2R1R1K1 w - - 0 29,e1e8 g5c1 f3f1 g3h2 g1h2 c1f1,1608,75,92,92,crushing deflection endgame hangingPiece long pin,https://lichess.org/FMPZGzn3#57,
CHtJ9,2b2rk1/q1b3pp/4P3/1p1pP3/nPp3P1/2P2R2/2BNQ1PN/7K b - - 0 32,c8e6 c2h7 g8h7 f3f8,1617,79,-3,54,crushing deflection kingsideAttack middlegame short,https://lichess.org/OL9NaUTC/black#64,
Vnm0P,8/1R5p/3p1bk1/2pPp3/p3P3/P2K4/r3BPP1/8 w - - 4 40,b7a7 c5c4 d3c4 a2e2,1696,88,84,27,advantage deflection endgame short,https://lichess.org/FndQuQcG#79,
WqDag,3r2k1/p2r1p1p/3nbqp1/2Q5/N7/1P2P1P1/P4PBP/3RR1K1 w - - 9 23,g2c6 d6e4 c6e4 d7d1 e1d1 d8d1,1613,75,92,1608,advantage discoveredAttack long middlegame,https://lichess.org/tnkqZaha#45,
FGJIE,8/4K3/8/p1p3p1/PbB2kP1/1P6/8/8 w - - 7 58,c4e6 c5c4 e7f6 c4c3,1610,74,93,3712,bishopEndgame crushing discoveredAttack endgame master short,https://lichess.org/dG3ZRwk6#115,
OwOCS,r3k2r/p4ppp/2p2N1n/1pb1p3/8/P2B1qPb/1P1PRP1P/R1BQ2K1 b kq - 3 17,g7f6 e2e5 e8f8 d1f3,1649,74,86,122,crushing discoveredAttack middlegame short,https://lichess.org/T9tcNIpN/black#34,Ruy_Lopez Ruy_Lopez_Bird_Variation
nZmre,r1b2rk1/ppp3pp/3p4/P2P1p2/4P3/2NB1N1P/Pq4P1/4QK1R w - - 4 24,e1d2 b2d2 f3d2 f5e4 f1g1 e4d3,1629,75,94,277,advantage discoveredAttack long middlegame,https://lichess.org/wFsJGGgq#47,
OiSz5,8/1p3p1p/5bp1/p1kb4/8/PNP2P2/1BK3PP/8 b - - 1 31,c5b5 c3c4 d5c4 b2f6,1641,75,92,799,advantage discoveredAttack endgame short,https://lichess.org/xogzqqde/black#62,
JtED5,r2qk1nr/pppn1ppp/3p4/8/2B1PB2/2P2QP1/P1P5/2KR3R b kq - 0 12,d8f6 e4e5 d7e5 f3b7,1699,78,84,53,crushing discoveredAttack middlegame short,https://lichess.org/3tF1fR75/black#24,Kings_Gambit_Accepted Kings_Gambit_Accepted_Cunningham_Defense
Cc4cp,r1b2rk1/ppp2ppp/3q4/n5N1/3b4/2NB4/P5PP/R1BQRK2 b - - 1 16,d6h2 d3h7 g8h8 d1d4,1678,75,92,1995,advantage discoveredAttack kingsideAttack opening short,https://lichess.org/Rvg6kMeg/black#32,Italian_Game Italian_Game_Two_Knights_Defense
pL4s9,8/1k1q1r2/2n1p3/2Qp4/P7/1P6/5PP1/2R3K1 b - - 3 41,d7c7 c5b5 c7b6 c1c6 b6b5 a4b5,1636,75,86,407,crushing discoveredAttack endgame long,https://lichess.org/jz3X4jbj/black#82,
p9jL6,r1bq1rk1/2p2p2/p2b1n1p/1p1P2p1/4N2B/1Q3N2/PP3PPP/R3R1K1 w - - 0 16,f3g5 f6e4 g5e4 d8h4,1632,76,86,178,advantage discoveredAttack middlegame short,https://lichess.org/81cA2PNE#31,French_Defense French_Defense_Exchange_Variation
8m33I,1r2kbr1/pb1qpp1p/2pp4/4p3/Q7/3BP3/PPP2PPP/RN3RK1 w - - 4 15,d3h7 g8g2 g1g2 c6c5,1651,76,93,3600,crushing discoveredAttack kingsideAttack middlegame sacrifice short,https://lichess.org/SBx9O4gd#29,Indian_Defense Indian_Defense_Pawn_Push_Variation
UNSBm,6k1/1b3r1p/6p1/3p1p2/3P3q/3BP1RP/5Q1K/8 b - - 4 38,f5f4 g3g6 h7g6 f2h4,1604,77,96,26243,crushing discoveredAttack endgame short,https://lichess.org/mG3btdGZ/black#76,
xX1Gd,r7/1bkp2rp/p3p3/5p2/3QP3/2NB4/1qP3PP/5RK1 b - - 1 28,a8g8 c3d5 b7d5 d4b2,1679,75,88,1350,advantage discoveredAttack middlegame short,https://lichess.org/qvsESKwG/black#56,
CqtPA,1k1r4/pp3p2/5P1b/4p2p/2prN2P/3P4/PPP3R1/1K1R4 w - - 4 27,a2a3 d4e4 d3e4 d8d1,1603,75,95,18436,crushing discoveredAttack endgame queensideAttack short,https://lichess.org/zYSW3i0v#53,
62PrE,r1bqkb1r/ppp2ppp/2p5/4P3/3P2n1/6P1/PPP2P1P/RNBQKB1R w KQkq - 1 8,f1h3 g4f2 e1f2 c8h3,1699,76,85,114,advantage attackingF2F7 discoveredAttack opening short,https://lichess.org/XwOhLzDJ#15,Russian_Game Russian_Game_Stafford_Gambit
qS6uz,1k1r4/ppp5/7p/6p1/5pQ1/P2q3P/1P1n1PP1/3RR1K1 w - - 0 25,g4e2 d3e2 e1e2 d2f3 g2f3 d8d1,1682,77,68,63,advantage discoveredAttack endgame long,https://lichess.org/qo2SMFle#49,
V8uIc,r3rk2/ppq1p1b1/2p1B1p1/2P2b2/3Pp1n1/2B4Q/PP3PP1/2KR3R b - - 1 23,g4f2 h3h8 g7h8 h1h8 f8g7 d4d5 c7e5 c3e5,1628,75,94,1202,discoveredAttack master mate mateIn4 middlegame sacrifice veryLong,https://lichess.org/SKM0mUa8/black#46,
BCqvl,rnbq1bnr/pp2pkp1/2p4p/8/8/2NB4/PPP2PPP/R1BQK2R b KQ - 0 7,g8f6 d3g6 f7g6 d1d8,1636,77,86,274,advantage discoveredAttack opening short,https://lichess.org/ka1rvHgD/black#14,Caro-Kann_Defense Caro-Kann_Defense_Other_variations
sGcEC,8/pp2rkp1/2p2Rp1/3p4/8/1P1q2NQ/PP4K1/8 b - - 0 33,f7f6 g3h5 g6h5 h3d3,1625,77,94,1944,advantage discoveredAttack endgame short,https://lichess.org/IfW7P3xE/black#66,
4GfZ0,1r2r3/5kb1/1p3qpp/pRn5/2P1p3/4Q1PP/P1N2P2/1R4K1 b - - 1 27,e8e6 b5c5 b6c5 b1b8,1635,252,100,18,discoveredAttack equality middlegame short,https://lichess.org/AyEQVXqq/black#54,
ZBNoj,rb3r1k/pbq1nppB/2n1p3/8/3P4/2N1BN2/PPP2PPP/R2Q1RK1 w - - 1 12,h7d3 c6d4 e3d4 b7f3 g2g3 f3d1,1663,76,89,888,advantage discoveredAttack long opening,https://lichess.org/jY1oY75N#23,Scandinavian_Defense Scandinavian_Defense_Blackburne-Kloosterboer_Gambit
oECO0,r1b1kb1r/pp1n1pp1/1qp1p2p/8/3PQ2B/3B1N2/P1P2PPP/R3R1K1 b kq - 1 12,b6c7 e4e6 f7e6 d3g6,1688,83,87,948,clearance doubleBishopMate mate mateIn2 middlegame sacrifice short,https://lichess.org/ISEbVpwA/black#24,Caro-Kann_Defense Caro-Kann_Defense_Main_Line
6WYmU,5rk1/bp2R2p/p2p4/P5p1/5Bb1/1N4P1/1P1N3P/7K w - - 0 28,f4d6 f8f1 d2f1 g4f3,1670,82,90,7778,doubleBishopMate mate mateIn2 middlegame sacrifice short,https://lichess.org/1BdyvVVw#55,
TPNt9,q4r1k/p6p/3p2p1/1P2P3/2B5/2BP2Pb/5R1P/1R4K1 b - - 0 28,f8f2 e5d6 f2f6 c3f6,1633,100,85,166,discoveredAttack doubleBishopMate endgame mate mateIn2 short,https://lichess.org/JshAMWCc/black#56,
