PuzzleId,FEN,Moves,Rating,RatingDeviation,Popularity,NbPlays,Themes,GameUrl,OpeningTags
Nm00A,6k1/Q4pp1/7p/7P/Pq6/3P4/2K5/8 b - - 1 40,b4g4 a7a8 g8h7 a8e4 f7f5 e4g4,1473,83,66,58,crushing endgame long queenEndgame,https://lichess.org/4ZuUb5MG/black#80,
Hhtcm,4Q3/2p2pkp/1q1p2p1/3P4/8/7P/2P2PPK/8 w - - 7 35,e8e3 b6e3 f2e3 g7f6,1499,76,39,125,crushing defensiveMove endgame queenEndgame short,https://lichess.org/fsXqtEr0#69,
YB4HL,8/8/8/7p/8/3K4/4Qp2/6k1 w - - 2 49,e2d1 f2f1q d1f1 g1f1 d3e3 f1g2 e3e2 h5h4,1466,77,93,1473,advancedPawn crushing defensiveMove endgame promotion queenEndgame veryLong,https://lichess.org/9gp1wTCu#97,
ffkFb,Q7/1K6/3k4/1q1P4/3PP3/8/8/8 w - - 1 72,b7c8 b5d7 c8b8 d7c7,1463,78,95,23926,endgame mate mateIn2 queenEndgame short,https://lichess.org/dwMsjxLp#143,
gCgFI,6k1/p2PQpp1/7p/1q1K4/8/P6P/6P1/8 w - - 23 46,d5e4 b5e2 e4d5 e2e7,1415,76,91,793,crushing endgame master queenEndgame short skewer,https://lichess.org/PA3RevSY#91,
VRD3P,8/5Qpk/7p/1q6/p6P/8/5PP1/6K1 w - - 0 41,h4h5 b5b1 g1h2 a4a3,1478,76,93,1802,crushing endgame queenEndgame short,https://lichess.org/lMaSrSMY#81,
pKND4,3Q4/5pk1/4p3/2qp4/P7/2P5/KP6/8 b - - 6 53,d5d4 d8d4 c5d4 c3d4,1474,87,87,45,crushing endgame queenEndgame short,https://lichess.org/JdcrYSvf/black#106,
d7VfV,6k1/5ppp/2p3q1/3p4/8/5P1P/P5P1/4Q1K1 b - - 0 29,g6e6 e1e6 f7e6 a2a4 g8f8 a4a5 f8e7 a5a6,1441,86,82,45,crushing endgame queenEndgame quietMove veryLong,https://lichess.org/abyAmjww/black#58,
EAbkD,8/4Q1k1/2p1P1p1/5p1p/1P3P1P/6PK/2qp4/8 b - - 2 57,g7g8 e7f7 g8h8 e6e7,1440,85,63,71,advancedPawn crushing endgame master queenEndgame short,https://lichess.org/7ym5ila4/black#114,
zeiS6,8/1pK5/2p5/1qP5/k7/8/8/3Q4 b - - 16 71,b5b3 d1b3 a4b3 c7b7,1413,79,86,188,crushing endgame queenEndgame short,https://lichess.org/k77V8yQu/black#142,
GoN9E,6Q1/8/3k2K1/5P1p/7P/6q1/8/8 w - - 3 53,g6h7 g3g8 h7g8 d6e5 f5f6 e5f6,1416,75,93,6907,crushing endgame long queenEndgame,https://lichess.org/FyIkU1Uv#105,
GFNJ3,4r3/pp1r4/kn4R1/8/P4Q2/1P3P2/2P1p3/4K3 w - - 1 40,g6b6 a7b6 f4c4 a6a7,1491,77,81,191,crushing defensiveMove endgame hangingPiece queenRookEndgame short,https://lichess.org/lDKvc1hJ#79,
bX26G,8/8/R7/5k2/5P1P/1p3K2/p5P1/1r6 b - - 4 44,a2a1q g2g4,1418,75,90,1605,endgame mate mateIn1 oneMove queenRookEndgame,https://lichess.org/ZNirNorA/black#88,
6Fif0,8/7P/8/6P1/1p2q2K/1p2pk2/1R4R1/8 w - - 5 68,h4h5 e4h7,1488,76,93,3386,endgame master masterVsMaster mate mateIn1 oneMove queenRookEndgame,https://lichess.org/qrLVeN1Q#135,
pIYx4,8/r7/8/4P3/3Q4/1P1P1k2/1K4r1/8 w - - 3 57,b2c3 a7c7 c3b4 g2g4 d4g4 f3g4,1412,92,82,32,crushing endgame long pin queenRookEndgame,https://lichess.org/cT8kxGrI#113,
00dnp,8/Q7/7r/8/6K1/1r2k1p1/6P1/8 b - - 2 64,e3e2 a7a2 e2e3 a2b3,1453,79,94,22829,crushing endgame fork master queenRookEndgame short,https://lichess.org/hMbf0KPM/black#128,
UUWp9,4k3/4P3/1p3K2/1P6/8/8/R2p4/4r3 b - - 2 54,d2d1q a2a8 e8d7 a8d8 d7c7 d8d1 e1d1 e7e8q,1426,78,100,184,advancedPawn crushing endgame exposedKing promotion queenRookEndgame skewer veryLong,https://lichess.org/qXbaKmnJ/black#108,
z949z,8/6p1/2p3kp/1p2Pp2/p4PPQ/2Pr3P/P2r4/4K3 b - - 10 43,d2g2 h4h5 g6h7 h5f5,1429,75,85,271,crushing deflection endgame master masterVsMaster queenRookEndgame short,https://lichess.org/Rci7FZZY/black#86,
LMDFK,1q5k/5P1p/p1r1p1pP/1p1pB3/1P1P2P1/P7/5PK1/8 b - - 1 44,b8e5 f7f8r,1404,455,82,4,advancedPawn endgame master mate mateIn1 oneMove promotion queenRookEndgame,https://lichess.org/W6bd1BuL/black#88,
gb80B,7R/1k6/8/8/2q3p1/6P1/5P1K/8 b - - 4 46,b7c6 h8c8 c6b5 c8c4 b5c4 h2g2,1495,76,94,3708,crushing defensiveMove endgame long queenRookEndgame skewer,https://lichess.org/U9c4PCGn/black#92,
Cy6rP,8/8/R3p1q1/R1p1k3/1p1pP1p1/1P1P1P2/2P2K2/8 b - - 1 48,g4f3 a5c5 e5f4 c5f5,1425,75,94,410,crushing endgame queenRookEndgame short,https://lichess.org/DgTswZIv/black#96,
JT6yb,3q4/5p2/6kp/5R2/p4RPK/P7/8/8 w - - 13 61,f5f6 d8f6 f4f6 g6f6 h4h5 f6g7,1472,85,76,40,crushing defensiveMove endgame long master queenRookEndgame,https://lichess.org/rf6doKq7#121,
78CRq,8/5pk1/4p1p1/3pP3/1p3P1p/1P4qP/6P1/1R3R1K b - - 3 36,g6g5 f1f3 g3f3 g2f3,1488,75,100,1002,crushing endgame queenRookEndgame short trappedPiece,https://lichess.org/YjbyeEYH/black#72,
rZ8v6,R5R1/6k1/1p4p1/5p1p/p3q2P/6P1/5P2/5K2 b - - 1 47,g7f6 a8f8 f6e6 f8e8 e6d5 e8e4,1489,75,97,6430,crushing endgame long queenRookEndgame skewer,https://lichess.org/3l7SsmkJ/black#94,
WKjQ3,7k/6p1/7p/8/pq5P/6P1/8/K4RR1 w - - 0 38,f1b1 b4a3,1490,80,76,787,endgame mate mateIn1 oneMove queenRookEndgame,https://lichess.org/n9xF13Ji#75,
wjR7o,5r1k/p5p1/7p/4Q3/5q2/1P3P2/P4RPP/2r1R1K1 w - - 1 30,e5f4 c1e1 f2f1 e1f1 g1f1 f8f4,1404,74,95,19301,crushing endgame hangingPiece long queenRookEndgame,https://lichess.org/V5Xmvpcl#59,
0yHm3,7k/1Q4p1/1p2r2p/8/8/4r2P/5K2/8 b - - 0 32,e3h3 b7c8 h8h7 c8e6,1456,399,100,11,endgame equality fork queenRookEndgame short,https://lichess.org/tL1WKTyX/black#64,
XWXjU,7k/3R2p1/4P3/5p2/5P2/6PK/Pq6/8 b - - 0 41,b2a2 e6e7 a2e2 d7d8 h8h7 e7e8q,1461,76,100,140,advancedPawn crushing endgame long promotion queenRookEndgame,https://lichess.org/Pt8CanXJ/black#82,
879RR,8/6pp/4kp2/8/8/8/4R1Pq/4K3 b - - 3 55,e6f5 g2g4 f5g4 e2h2,1404,75,95,6219,advantage discoveredAttack endgame master queenRookEndgame short,https://lichess.org/SntwyyAB/black#110,
DveKB,2r3k1/p4pp1/5P1p/6r1/3Q4/7P/P4P1K/8 b - - 2 33,c8c2 d4d8 g8h7 d8d3 g7g6 d3c2,1434,76,91,1771,crushing endgame fork long queenRookEndgame,https://lichess.org/JHBpOV9B/black#66,
DADmt,3k4/3r4/6Q1/8/p4PK1/3r4/P7/8 w - - 1 55,f4f5 d7d4 g4h5 d3h3 h5g5 h3g3,1425,117,86,15,crushing endgame long queenRookEndgame,https://lichess.org/72YjbFnH#109,
mQIXa,1k6/ppp2pr1/1r2pNp1/3p4/q2P1P1P/2P1P3/1P2Q3/1K1R3R w - - 4 26,b1c1 a4a1 c1d2 b6b2 d2e1 b2e2,1494,76,92,457,crushing deflection long middlegame queensideAttack skewer,https://lichess.org/3vdCajlg#51,
1GpEK,2kr1bnr/Np3ppp/2n3q1/8/3p2b1/1Q2B1P1/PP3PBP/R3K1NR b KQ - 0 12,c6a7 b3b7,1432,85,70,64,mate mateIn1 oneMove opening queensideAttack,https://lichess.org/kxyfjABX/black#24,Sicilian_Defense Sicilian_Defense_Alapin_Variation
KcbWA,r4b1r/1p1k2pp/4p3/1QPpqp2/1p6/2P1P3/P5PP/RN3RK1 b - - 1 18,d7c8 b5e8 c8c7 e8a8,1435,74,91,1967,crushing middlegame queensideAttack short skewer,https://lichess.org/MpXsLrpL/black#36,French_Defense French_Defense_Advance_Variation
XkT3w,2k2b1r/ppp2ppp/4P3/3QPn1q/1r4b1/5BP1/PP2PR1P/RNB3K1 b - - 3 15,g4f3 d5d7 c8b8 d7d8,1472,75,93,1044,mate mateIn2 middlegame queensideAttack short,https://lichess.org/qO5TGslc/black#30,Bird_Opening Bird_Opening_Dutch_Variation
me8Yx,r4rk1/1pp3b1/p2pbq1p/n4p1B/5P1N/P1N5/1PPQ1PP1/2KR3R w - - 0 20,c3d5 f6b2,1445,77,86,288,mate mateIn1 middlegame oneMove queensideAttack,https://lichess.org/s3HfHfhg#39,
eCpQ6,r2qk1r1/1pp2p1p/p3bP2/4n3/3Q4/5P2/PPP4P/1K1R1B1R w q - 0 19,d4e5 d8d1,1474,465,33,4,hangingPiece master mate mateIn1 middlegame oneMove queensideAttack,https://lichess.org/KuRK0dws#37,
55TN1,2kr1b1r/pp3ppb/B1p1p3/4Bq1p/3P1P2/2P2Q2/PP4PP/R3R1K1 b - - 1 20,f5g4 f3c6,1467,83,86,947,mate mateIn1 middlegame oneMove pin queensideAttack,https://lichess.org/mU15PVes/black#40,
8HBrZ,5rk1/3RRrbp/6p1/pp4N1/1n6/1Q5P/1PP2qP1/1K6 w - - 0 25,e7f7 f2e1 d7d1 e1d1,1467,77,78,79,mate mateIn2 middlegame queensideAttack short,https://lichess.org/pkdV5Yx1#49,
VOnJq,2r4k/2r2p1p/p2p1bp1/1p1R3P/4P1P1/5P2/PPP5/1K3B1R w - - 1 21,h5g6 c7c2 f1d3 c2b2,1498,75,94,3008,crushing endgame queensideAttack short,https://lichess.org/2Zasco1W#41,
CbkEm,1k1r3r/1pp3p1/Q6p/3Nn3/5P2/1R5P/P1P3PK/2q5 b - - 0 26,b7b6 b3b6 c7b6 a6b6 b8c8 b6c7,1444,77,95,16135,long mate mateIn3 middlegame queensideAttack sacrifice,https://lichess.org/UuCjUyKD/black#52,
1jdLi,rn2kb1r/5pp1/p3p2p/4P3/qp1N1PPP/2p1B3/P1P3Q1/2KR3R w kq - 0 20,g2a8 a4a3 c1b1 a3b2,1408,75,87,143,mate mateIn2 middlegame queensideAttack short,https://lichess.org/d4LNdBai#39,
hosni,Rk1r3r/8/1p1p1p1p/1NpP2p1/4P3/3Q2Pb/2P2P1K/5q2 b - - 7 28,b8a8 d3a3 a8b8 a3a7 b8c8 a7c7,1410,75,90,557,endgame exposedKing long mate mateIn3 queensideAttack,https://lichess.org/f9mKzBwN/black#56,
sMMli,2k5/ppp5/3r1pq1/4n1p1/4p1Pp/2P4P/PP2QP2/1K2RR2 w - - 0 27,e2e4 d6d1 e1d1 g6e4,1404,103,83,59,crushing deflection endgame queensideAttack short,https://lichess.org/T9x5EWUO#53,
pYo0M,4q2k/p5rn/1p2pR2/2ppPp2/3P3Q/2P4R/PP5P/1K6 w - - 0 35,f6h6 g7g1 b1c2 e8a4 c2d2 a4d1,1470,75,100,252,crushing endgame long queensideAttack,https://lichess.org/VIZECQXY#69,
4CfzV,5rk1/1p3ppp/3Q1n2/1Nn5/8/4pP2/qPP3PP/2KR3R w - - 0 22,b5c3 a2a1 c3b1 c5b3 c2b3 f8c8 d6c7 c8c7,1418,81,89,116,master mate mateIn4 middlegame queensideAttack sacrifice veryLong,https://lichess.org/sD6yO1py#43,
CzjeY,1k3b1r/p1p1qppp/1p3p2/8/3r4/3P1KPB/P1PQ1P1P/R3R3 b - - 1 16,e7c5 e1e8 b8b7 h3c8,1401,78,65,89,advantage middlegame queensideAttack short,https://lichess.org/23hMUcnH/black#32,Owen_Defense Owen_Defense_Other_variations
0M5CF,r2q1rk1/2p1ppbp/p1npb1p1/1p6/1n1PP1P1/3B1N1P/PPPBQP2/1NKR3R w - - 1 13,d4d5 b4a2,1432,76,90,475,mate mateIn1 middlegame oneMove queensideAttack smotheredMate,https://lichess.org/l2tfI4k1#25,Queens_Pawn_Game Queens_Pawn_Game_Modern_Defense
nOwAO,2r1kbR1/1bq2p2/p3p3/8/Np1Q3P/1B2P3/PPP4r/2KR4 w - - 4 28,d4g7 h2c2 c1b1 c2c1 d1c1 c7c1,1490,75,82,149,long mate mateIn3 middlegame queensideAttack,https://lichess.org/pWoNMLyT#55,
TO0uu,2kr3r/2pnp2p/p4pp1/1p1R4/5P2/5B1P/PPP3P1/3R2K1 b - - 4 19,d7b6 d5d8 h8d8 f3b7 c8b7 d1d8,1476,75,100,173,advantage deflection endgame long queensideAttack,https://lichess.org/qnJSgZM3/black#38,
LicTC,3rqrk1/1pp4n/p3b1pP/4p3/4N3/P5Q1/1PP2P2/2KR1BR1 w - - 0 24,g3e5 d8d1 c1d1 e6g4 g1g4 e8e5,1416,75,79,133,attraction crushing discoveredAttack long middlegame queensideAttack,https://lichess.org/36w1rZmk#47,
YLYyX,8/8/2p2p2/R6p/5krK/1P6/P7/8 w - - 3 47,h4h5 g4g5 a5g5 f6g5 b3b4 g5g4 b4b5 c6b5,1484,79,96,23332,crushing endgame quietMove rookEndgame veryLong,https://lichess.org/4hAE1dDQ#93,
lT7OU,8/4R3/pr2p1kp/4K1p1/1p1P4/1P6/P6P/8 b - - 3 36,h6h5 e7e6 b6e6 e5e6 h5h4 d4d5 g5g4 d5d6 g4g3 h2g3 h4h3 d6d7,1414,75,98,733,advancedPawn crushing endgame quietMove rookEndgame veryLong,https://lichess.org/a7R3QwU9/black#72,
31zPj,2r5/p4kp1/4R2p/2pK4/3p4/P4P2/2P3PP/8 w - - 6 31,e6c6 c8c6 d5c6 c5c4 c6d5 d4d3,1450,75,94,5477,crushing endgame long quietMove rookEndgame,https://lichess.org/7ciVmrrs#61,
SnkNb,7Q/1k6/p7/8/2q4p/7K/6P1/8 w - - 0 41,h8h4 c4h4 h3h4 a6a5 g2g4 a5a4 g4g5 a4a3 g5g6 a3a2 g6g7 a2a1q,1490,76,80,111,advancedPawn crushing endgame promotion queenEndgame quietMove veryLong,https://lichess.org/qvMGXBgf#81,
5Ar5i,3r2k1/pb3ppp/1p2p3/8/1P6/P5P1/5P1P/4Q1K1 w - - 1 25,h2h4 b7f3 e1c1 d8d1 c1d1 f3d1,1458,114,60,20,crushing endgame fork long quietMove,https://lichess.org/g8bj6pZc#49,
tyczR,8/8/1p4k1/7p/P7/8/1P2K3/8 b - - 0 39,g6g5 b2b4 g5f5 a4a5 b6a5 b4a5,1432,77,92,2034,crushing endgame long pawnEndgame quietMove,https://lichess.org/erYYOfIL/black#78,
5Q9cR,7k/4r1p1/7p/R2p4/p7/2P3QP/P5PK/5q2 w - - 2 37,a5a4 e7e1 g3e1 f1e1,1405,74,100,564,advantage endgame master quietMove short,https://lichess.org/rxiJ9akB#73,
CReZh,r1b2rk1/pp3pp1/1n2p2p/q7/3P3B/P1P5/B1Q2PPP/R3K2R b KQ - 0 15,a5a3 a2b1 a3c3 c2c3,1467,75,92,1410,crushing master middlegame quietMove short,https://lichess.org/tJOKnlep/black#30,Nimzo-Indian_Defense Nimzo-Indian_Defense_Three_Knights_Variation
ITc3J,r1b3k1/pp3ppp/2n1r3/7q/1P3b2/P3PN2/1B2BPP1/R2Q1RK1 w - - 0 19,e3f4 e6h6 f3h4 h5h4,1448,92,86,28,crushing middlegame quietMove short,https://lichess.org/4IelbFhv#37,Queens_Gambit_Declined Queens_Gambit_Declined_Semi-Tarrasch_Defense
K0eJ8,8/5r1k/2Q1prpP/3p4/1p2P2R/1B3p2/1PP2q2/1K5R b - - 0 41,f2h4 h1h4 f3f2 h4h1 f2f1q h1f1,1424,82,56,50,advantage endgame hangingPiece long quietMove,https://lichess.org/wO1msrcj/black#82,
Xzcx3,2Q5/4q1pk/p5p1/1p2p3/3rP3/1P5P/P1P2RP1/7K b - - 7 28,d4e4 f2f8 e7f8 c8f8,1463,75,82,168,crushing endgame quietMove short,https://lichess.org/bGhkEkYj/black#56,
ZJno4,5Q2/5ppk/p6p/1p3N2/n1p1P3/2q4P/5PP1/6K1 b - - 3 33,c3f6 f5e7 f6e7 f8e7,1466,75,93,4407,crushing endgame master quietMove short,https://lichess.org/DGHQ3YV9/black#66,
JYc0q,8/2p4p/1p1p4/pP1P2K1/P1P2P2/6k1/8/8 b - - 0 44,h7h5 f4f5 h5h4 f5f6 h4h3 f6f7 h3h2 f7f8q,1446,77,79,364,advancedPawn crushing endgame pawnEndgame promotion quietMove veryLong,https://lichess.org/HRZXEgyg/black#88,
GT8Rd,2R5/6p1/5rkp/1R5P/p3pP2/P1Pn2P1/1Pr5/5K2 b - - 0 39,g6h7 b5b8 f6f4 g3f4,1436,74,92,1107,crushing endgame quietMove short,https://lichess.org/2qBOSmmH/black#78,
P0rkH,8/8/8/p1k2p2/3p3P/P2K4/8/8 b - - 0 41,f5f4 h4h5 f4f3 h5h6 f3f2 d3e2 d4d3 e2f2 d3d2 f2e2 d2d1q e2d1,1495,75,97,625,crushing endgame pawnEndgame quietMove veryLong,https://lichess.org/Uskr0v2b/black#82,
Atkq4,8/3bNpk1/8/3PP1p1/1P6/K7/8/8 w - - 0 58,a3b3 g5g4 e7c6 g4g3 e5e6 f7e6,1400,76,91,63,advantage endgame long quietMove,https://lichess.org/v1ibGiGD#115,
yEcdY,8/8/8/5p1p/5P2/3K2P1/6kP/8 w - - 10 48,d3d4 g2h2 d4e5 h2g3 e5f5 h5h4 f5g5 h4h3 f4f5 h3h2 f5f6 h2h1q,1416,140,67,10,advancedPawn crushing endgame pawnEndgame promotion quietMove veryLong,https://lichess.org/RzisRRXG#95,
gt2EP,8/7K/8/4p3/3k1p2/8/5PPP/8 w - - 0 46,h2h4 e5e4 h4h5 e4e3 f2e3 f4e3 g2g4 e3e2 g4g5 e2e1q,1448,76,95,19723,advancedPawn crushing endgame pawnEndgame promotion quietMove veryLong,https://lichess.org/vVQzJZmK#91,
XMEDi,2k5/2b5/p1K1p1p1/1p2P3/1Bp2PP1/8/PP6/8 w - - 3 35,b4d6 c7d6 c6d6 b5b4 d6e6 c4c3,1444,75,76,420,bishopEndgame crushing endgame long quietMove,https://lichess.org/R32HStVj#69,
UVBXT,1r3rk1/5ppp/3p3b/3Qp2P/RN2P2q/2P5/5PP1/5RK1 w - - 1 23,b4c6 h6f4 g2g3 f4g3 f2g3 h4g3,1471,76,84,381,crushing kingsideAttack long master middlegame quietMove,https://lichess.org/ACnCJ7Gu#45,
QdpPk,8/r5pp/2k2p2/3Rp3/4K1PP/4PP2/8/8 w - - 1 43,h4h5 a7a4 d5d4 e5d4,1444,74,97,9180,crushing endgame rookEndgame short,https://lichess.org/Hs9uRYgm#85,
FqYfa,4r3/p1R5/6k1/4r1p1/6Kp/1P2p2P/P3R1P1/8 w - - 4 35,c7a7 e5e4 g4f3 e4f4,1411,76,78,106,endgame mate mateIn2 rookEndgame short,https://lichess.org/WNw3ekxu#69,
6DAcv,r7/P4pp1/1k1K3p/5P2/7P/2p5/8/2R5 b - - 1 48,a8c8 c1c3 c8d8 d6e7,1473,91,80,43,crushing endgame master rookEndgame short,https://lichess.org/Zi52i6vm/black#96,
3MI9t,8/5k2/4R1p1/6Pp/5r1P/2K5/5P2/8 w - - 7 42,e6f6 f4f6 g5f6 f7f6 c3d4 f6f5 f2f3 f5f4,1476,82,78,33,crushing endgame rookEndgame veryLong,https://lichess.org/mCr5Qv1Z#83,
RX88i,8/8/8/8/8/5Rpk/6r1/5K2 b - - 5 59,g2f2 f3f2 g3f2 f1f2,1415,437,100,7,endgame equality rookEndgame short,https://lichess.org/bf8kPbOd/black#118,
RQEaD,8/3k4/5p1R/r3p2p/2P4P/3KPP2/8/8 w - - 4 48,h6h5 e5e4 d3e4 a5h5,1483,75,93,1484,crushing discoveredAttack endgame rookEndgame short,https://lichess.org/I4BgVxx9#95,
LY2R4,8/6p1/6R1/4k3/p7/6P1/2r4P/6K1 w - - 9 48,g6g7 a4a3 g7a7 a3a2,1420,74,97,13188,advancedPawn crushing endgame master rookEndgame short,https://lichess.org/qhrO9qVu#95,
QTg3G,6k1/5p2/8/8/2K5/1P6/P4r1p/2R5 w - - 2 44,a2a4 f2c2 c1c2 h2h1q,1457,76,100,1747,advancedPawn advantage deflection endgame promotion rookEndgame short,https://lichess.org/7dWWWbky#87,
99WGm,8/R7/pPp3p1/2r1kp1p/4p3/4P1PP/5PK1/8 b - - 1 39,a6a5 b6b7 c5b5 a7a5 b5a5 b7b8q,1475,76,84,69,advancedPawn crushing deflection endgame long pin promotion rookEndgame,https://lichess.org/vNT4il9c/black#78,
KvyqI,8/2r1k3/R6R/6p1/4Pp2/2p2P1K/3r4/8 b - - 10 55,c3c2 h6h7 e7d8 a6a8 c7c8 h7h8,1441,76,87,427,crushing endgame exposedKing long rookEndgame,https://lichess.org/pRvYVSEL/black#110,
TktCw,7r/8/8/3pk2P/p3p3/2P2p2/PP3K1R/8 w - - 2 39,h5h6 e5f4 h2h4 f4g5,1452,75,84,2935,crushing defensiveMove endgame rookEndgame short,https://lichess.org/rILJk45O#77,
Cvh9Y,8/3k4/1r6/3Pp1p1/1p2P1Pp/2pK1P1P/8/3R4 w - - 3 41,d3c4 c3c2 d1f1 b4b3,1402,74,84,331,advancedPawn crushing endgame rookEndgame short,https://lichess.org/zx6Fb4gw#81,
xO0rx,8/8/1pR4k/8/5K2/1r6/6P1/8 b - - 1 39,h6h5 g2g4 h5h4 c6h6,1480,76,96,25484,endgame mate mateIn2 rookEndgame short,https://lichess.org/fcMwl2EX/black#78,
byPNj,6r1/8/2R5/PP3p2/5k1K/8/8/8 w - - 1 48,a5a6 g8h8 c6h6 h8h6,1488,75,88,1433,endgame mate mateIn2 rookEndgame short,https://lichess.org/9hnW0csL#95,
AFdl7,7r/8/1p3pRp/p1p1kP1K/4P3/P1P5/1P6/8 w - - 6 51,g6h6 h8h6 h5h6 e5e4 h6g6 e4e5,1434,76,93,12002,crushing endgame long rookEndgame,https://lichess.org/edn5qxo1#101,
V1aJz,8/8/8/2P1k3/6R1/6p1/2r3P1/5K2 b - - 2 46,c2c5 g4g5 e5d6 g5c5 d6c5 f1e2,1410,75,76,646,crushing defensiveMove endgame long rookEndgame,https://lichess.org/OALN37sk/black#92,
bLYII,8/8/P4p2/KPk1p1p1/2Pp2P1/1p1P1P2/7r/R7 w - - 0 45,a6a7 h2a2 a1a2 b3a2 a5a6 a2a1q,1440,75,93,750,advancedPawn crushing endgame long promotion rookEndgame,https://lichess.org/GWiloD6u#89,
p9o63,8/8/5k2/4p1rP/4R2K/8/8/8 b - - 2 46,f6f5 e4e5 f5e5 h4g5 e5e6 g5g6,1476,75,86,248,crushing defensiveMove deflection endgame long rookEndgame,https://lichess.org/OehWMyK8/black#92,
nSkeH,8/7R/4k1p1/4P3/4r2P/7K/8/8 b - - 0 53,e6e5 h7e7 e5f4 e7e4 f4e4 h3g4 e4d5 g4g5 d5e6 g5g6 e6e7 g6g7,1493,74,87,2168,crushing defensiveMove endgame rookEndgame veryLong,https://lichess.org/tpJRQliQ/black#106,
IZJMO,8/1KP5/2R5/2r5/2k5/1p6/8/8 b - - 2 63,b3b2 c6c5 c4c5 c7c8q,1495,76,96,24116,advancedPawn attraction crushing endgame promotion rookEndgame short,https://lichess.org/BA41zJ96/black#126,
Rjm1E,1r4k1/p3Rp2/2p4p/2P2b2/2pB4/4R3/P5K1/1r6 b - - 0 30,b8f8 e3g3 f5g6 g3g6 f7g6 e7g7,1439,87,79,34,crushing endgame long sacrifice,https://lichess.org/Sp7QDxEp/black#60,
XtBLo,1q3r2/2p1ppkp/b1p3p1/p2pP1QP/2nP2P1/2N2P2/PrP1N3/K2R3R w - - 2 21,h5g6 b2a2 c3a2 b8b2,1493,74,97,25995,clearance mate mateIn2 middlegame sacrifice short,https://lichess.org/KLfoiZrk#41,
5vLDZ,6k1/5p2/6p1/7p/1pBq3P/1Pn3P1/2Q2P2/6K1 w - - 0 37,c2c1 d4c4 b3c4 c3e2 g1f1 e2c1,1495,74,96,18995,crushing endgame fork long sacrifice,https://lichess.org/XyAeNjzq#73,
QqkOm,5r1k/1p3Nbp/p1n3p1/3Q4/8/2P1P3/Pq1BK2P/8 b - - 1 29,h8g8 f7h6 g8h8 d5g8 f8g8 h6f7,1408,76,90,1379,doubleCheck long mate mateIn3 middlegame sacrifice smotheredMate,https://lichess.org/TOF8mUK8/black#58,
3nQYQ,5r1k/6pp/3p4/3Qp3/7q/2P5/1r3PPP/R4RK1 w - - 0 26,a1a8 h4f2 f1f2 b2b1 d5d1 b1d1 f2f1 d1f1,1403,74,92,5426,endgame mate mateIn4 sacrifice veryLong,https://lichess.org/RC3jNWKe#51,
rW4Lk,1r5r/1ppk1ppp/3p2q1/8/pR4P1/Pb2BQ1P/1P3P2/2R3K1 b - - 3 25,c7c6 b4b7 b8b7 f3c6,1458,76,95,23705,crushing middlegame sacrifice short,https://lichess.org/S5XW0ZZg/black#50,
oNIqo,1r1q2k1/2N2Rnp/b2p2p1/3Pp3/1p2P3/7P/PP3Q2/5BK1 b - - 9 36,a6f1 f7g7 g8g7 c7e6 g7g8 e6d8,1445,74,97,20579,attraction crushing fork long master masterVsMaster middlegame sacrifice,https://lichess.org/Av4E8Udu/black#72,
Mu7YH,3q2kr/1p2rpn1/p2P2b1/4P1n1/1Q1N4/1P3B1p/P6K/4R1R1 w - - 0 31,d6e7 d8d4 b4d4 g5f3 h2h1 f3d4,1495,74,97,14030,attraction capturingDefender crushing exposedKing fork long master middlegame sacrifice,https://lichess.org/FAQGdN8X#61,
jspkh,2r3k1/1p4pp/1qr2p2/4n3/2PNR1P1/pP5P/P1Q5/2KR4 w - - 1 30,g4g5 c6c4 b3c4 c8c4 c2c4 e5c4,1496,75,94,2899,advantage long middlegame pin sacrifice,https://lichess.org/IoW5SEUF#59,
bOQyr,3r1bk1/1p3pp1/p1q4p/3n4/3B4/1PN3QP/1P3PP1/3R2K1 w - - 7 27,d4e5 d5c3 d1d8 c3e2 g1h2 e2g3,1471,126,33,17,crushing fork long middlegame sacrifice,https://lichess.org/nUsp03lV#53,
ZQGT3,r1b2rk1/pp2bppp/1q6/3pP3/4n3/2B2N2/PPP1B1PP/R2Q1R1K b - - 3 15,e4f2 f1f2 b6f2 c3d4 f2e2 d1e2,1458,77,86,399,advantage long opening sacrifice trappedPiece,https://lichess.org/Ee17VrVu/black#30,Philidor_Defense Philidor_Defense_Exchange_Variation
LTziA,6rk/ppp2prp/1b1p4/3Pp3/4P3/P1N2QPq/1P3P1P/2R2RK1 w - - 3 21,c3a4 g7g3 h2g3 g8g3 f3g3 h3g3,1428,76,74,311,crushing kingsideAttack long middlegame pin sacrifice,https://lichess.org/UI3QOC2T#41,
fxYNi,1k1r2r1/1pp1R3/p2p1Q2/6p1/1PqB1b2/2P5/6PP/4R2K b - - 5 33,d8f8 f6f8 g8f8 e7e8 f8e8 e1e8,1455,75,85,379,long mate mateIn3 middlegame queensideAttack sacrifice,https://lichess.org/ca55i7y7/black#66,
yELjv,2r1r1k1/pb4pp/1pq2p2/8/PR3N2/8/Q5PP/3R3K b - - 4 31,g8h8 f4g6 h7g6 b4h4,1494,76,88,159,clearance mate mateIn2 middlegame sacrifice short,https://lichess.org/GiKWZGwX/black#62,
q55HM,r2q2k1/ppp2p1p/2p1r1pB/8/3n4/6Q1/PPP2PPP/4RRK1 b - - 1 15,d4e2 e1e2 e6e2 g3c3 d8f8 h6f8,1404,74,92,7395,advantage long middlegame sacrifice,https://lichess.org/k7mAWCJS/black#30,Russian_Game Russian_Game_Stafford_Gambit
7SOmW,3r3k/6p1/3p1bBp/p5P1/1p2P3/2qP1Q2/8/5R1K b - - 0 34,h6g5 f3h5 h8g8 g6f7 g8f8 f7e6 c3c7 f1f6 g7f6 h5h8,1489,290,-91,4,crushing endgame quietMove sacrifice veryLong,https://lichess.org/YqADHCKP/black#68,
7ZNsl,3r1r1k/p2b2pp/1q3p2/2p2P2/2Q2N2/1P6/P4RPP/R6K b - - 4 25,b6d6 f4g6 h7g6 c4h4 h8g8 f5g6,1495,77,96,7247,clearance crushing intermezzo kingsideAttack long middlegame sacrifice,https://lichess.org/74mq6Q89/black#50,
21hEK,1k5r/pp1r4/3R4/5pp1/5Pq1/4P1Pp/PPQ4P/2R3K1 b - - 0 26,d7d6 c2c7 b8a8 c7c8 h8c8 c1c8,1462,394,73,14,backRankMate endgame fork long mate mateIn3 sacrifice,https://lichess.org/qJuZSk88/black#52,
B7Xgz,rq3r2/pb3pp1/1p3n1k/2pp1QNP/3P4/4P3/PP3PP1/R3K2R b KQ - 4 19,b7c8 g5f7 f8f7 f5g6,1476,101,86,21,mate mateIn2 middlegame sacrifice short,https://lichess.org/LwupQfgY/black#38,Queens_Gambit_Declined Queens_Gambit_Declined_Modern_Variation
BnKDM,r1b1kb1r/p3pppp/5n2/1N1Pq3/N1p5/4B3/PP3PPP/R2QK2R b KQkq - 3 14,f6d5 d1d5 e5d5 b5c7 e8d7 c7d5,1404,75,86,703,attraction crushing fork long opening sacrifice,https://lichess.org/nWXVsBZq/black#28,Caro-Kann_Defense Caro-Kann_Defense_Accelerated_Panov_Attack
K7qqe,8/1p6/2b5/1p1Bp3/1P2P2p/P2PkP2/6K1/8 w - - 4 38,d5c6 b7c6 g2h3 e3f3,1418,75,90,803,crushing endgame short,https://lichess.org/gMc359Gu#75,
mnkJK,2r4r/pp1n3p/3k1b2/q2ppQ2/4P2p/5N2/P1PR1PPP/5RK1 b - - 4 21,d5d4 d2d4 e5d4 f5a5,1413,74,96,30886,crushing middlegame short,https://lichess.org/M5fjdQhN/black#42,
nC4zD,r6k/8/p3Q2P/1p6/8/2P2n2/P3KP2/R5q1 b - - 2 30,g1a1 e6f6 h8h7 f6g7,1432,75,96,11655,endgame fork mate mateIn2 short,https://lichess.org/ExN7Eu4j/black#60,
9ehts,r4r1k/ppp3pp/8/8/2QBq1n1/1BP1R3/P1P3PK/5R2 w - - 1 23,h2g1 f8f1 c4f1 g4e3,1419,75,94,7282,advantage kingsideAttack middlegame short,https://lichess.org/AGy5iqDf#45,
VIo7n,2R5/p3k3/8/2PP4/4K1p1/2r5/8/8 b - - 2 58,g4g3 d5d6 e7d7 c8c7,1444,75,93,5168,advantage endgame master rookEndgame short,https://lichess.org/5HQuW95G/black#116,
t6NgO,6k1/5pp1/qb3n1p/3p1P2/3P1p2/5N1P/BQ2rPP1/R5K1 w - - 1 30,b2c3 e2a2 a1a2 a6a2,1432,80,84,78,crushing middlegame short,https://lichess.org/didPTfuZ#59,
iyNZc,r1bq1rk1/pp2nppp/2n1p3/1B1pP3/5P2/2Q2N2/PPP3PP/R1B1K2R w KQ - 3 10,e1g1 d8b6 f1f2 b6b5,1412,74,83,443,advantage fork opening short,https://lichess.org/eltRgEid#19,French_Defense French_Defense_Winawer_Variation
iA1yq,4n3/p2r2k1/1p3nNp/8/3P4/2P5/PP3PPP/4R1K1 w - - 5 31,e1e7 g7g6 e7d7 f6d7,1402,77,82,1968,advantage endgame hangingPiece short,https://lichess.org/i00SvlUe#61,
H7xFB,8/8/3N4/p7/1pP1p3/1P2Pk2/2K5/6b1 w - - 12 49,c4c5 g1e3 c5c6 e3b6,1456,93,53,54,advantage defensiveMove endgame short,https://lichess.org/nbbjZGcR#97,
Pd2Bv,1r4k1/p7/4RR2/2p1n2Q/K1P4P/4P3/PPq5/8 w - - 4 32,a4a5 e5c4 a5a6 c2a4,1420,75,93,3334,endgame mate mateIn2 short,https://lichess.org/3EhyPnVs#63,
nphh1,2r1k2r/pp2nppp/4qb2/8/1Q6/1PN5/P1P2PPP/1RB1K1NR w Kk - 0 13,c3e2 f6c3 b4c3 c8c3,1492,76,84,85,advantage fork middlegame pin short,https://lichess.org/7ti0xtMc#25,Sicilian_Defense Sicilian_Defense_Marshall_Gambit
Il0Yg,r2q1rk1/1bp2pp1/p6p/1p2n3/5n2/1B1P2N1/PPP2KPP/R1BQR3 w - - 0 15,c1f4 d8d4 f2f1 d4f4,1446,75,92,2662,advantage fork middlegame short,https://lichess.org/FXQUzBKB#29,Ruy_Lopez Ruy_Lopez_Morphy_Defense
ZPzNC,8/2R1kpP1/4p3/4N2P/3P1n2/8/p4P1K/Br3q2 b - - 2 38,e7d8 c7d7 d8e8 g7g8q,1459,74,93,2029,advancedPawn endgame mate mateIn2 promotion short,https://lichess.org/KgQfkTF4/black#76,
IRDvT,3r3r/kpB3pp/1n6/1Q1p4/1K2p1q1/3p4/P1P1P3/R7 b - - 0 30,b6c4 b5a4 c4a5 a4a5,1463,75,89,905,mate mateIn2 middlegame short,https://lichess.org/NWwXSm8A/black#60,
Ojeiy,rqb1r1k1/1p1n1pp1/p1pb3p/3N4/1P1Pn2B/P2BPN2/5PPP/2RQ1RK1 w - - 1 15,d5e7 d6e7 h4e7 e8e7,1427,75,92,2735,advantage middlegame short,https://lichess.org/ppK4WCsB#29,Queens_Gambit_Declined Queens_Gambit_Declined_Exchange_Variation
hZQdM,5rk1/p2pprbp/2p3pn/q7/2QPR3/1P3N2/PB3PPP/R5K1 w - - 1 17,a1e1 d7d5 c4c5 a5c5,1494,74,92,4220,crushing fork middlegame short,https://lichess.org/JQNzwAvL#33,Sicilian_Defense Sicilian_Defense_Nyezhmetdinov-Rossolimo_Attack
oJiMc,8/3b4/8/8/k1N3p1/1p4P1/3K3P/8 w - - 0 58,d2c3 d7e6 c4b2 a4a3,1471,75,89,608,crushing defensiveMove endgame short,https://lichess.org/uZKisY2X#115,
N3M8r,r2qn1k1/pp3p1Q/2pbb1p1/3N2R1/8/1P1B4/PBPP1PPP/6K1 b - - 0 18,g8h7 g5h5 h7g8 h5h8,1467,73,96,20749,master mate mateIn2 middlegame pin short,https://lichess.org/oSnQHd5g/black#36,Ruy_Lopez Ruy_Lopez_Berlin_Defense
Z7Fge,1k5r/ppq1p3/2p5/5Q2/3P4/1P2P1r1/PB5P/R4RK1 w - - 0 24,g1h1 g3g1 f1g1 c7h2,1446,76,100,760,discoveredAttack mate mateIn2 middlegame sacrifice short,https://lichess.org/uuxsCCu0#47,
2H7zy,r1b2rk1/ppB1p3/2n1p3/2n4N/2PbN1pP/8/PP3PP1/3RKB1R w K - 3 16,c7g3 c5e4 d1d4 c6d4,1427,75,92,6989,crushing hangingPiece middlegame short,https://lichess.org/eQmrPCtq#31,English_Opening English_Opening_Anglo-Indian_Defense
deZEG,r3k2r/pp1nq3/2p1p1p1/3pP1p1/3P3P/2P4N/PP3P2/R2Q1K1R w kq - 0 21,h3g5 e7g5 h4g5 h8h1 f1e2 h1d1,1432,105,87,51,crushing long middlegame skewer,https://lichess.org/QbfFZGUr#41,
6zigM,8/8/8/5rp1/1R2k1K1/7P/4p3/8 b - - 1 61,e4e3 g4f5 e2e1q b4e4 e3f2 e4e1,1486,75,86,183,crushing endgame long master rookEndgame skewer,https://lichess.org/gM0tbp9u/black#122,
CVPyf,8/p4kpp/2p5/8/PPP2bP1/7r/N1R5/7K w - - 0 48,h1g2 h3h2 g2f3 h2c2,1437,78,51,50,crushing endgame short skewer,https://lichess.org/B4dp61Eb#95,
SsqmG,2k2b1r/ppp2Npp/8/8/3r2b1/2N5/PP5P/R1K1R3 b - - 0 19,h8g8 e1e8 c8d7 e8d8 d7e6 d8d4,1481,74,98,10392,crushing long middlegame queensideAttack skewer,https://lichess.org/sXYPT8Hb/black#38,
pfdH0,r1b1k1nr/pp3ppp/2nbp3/3pq3/8/1NP3P1/PP2BP1P/RNBQ1RK1 b kq - 0 10,g8f6 c1f4 e5f5 f4d6,1481,75,88,1324,advantage opening short skewer,https://lichess.org/KzDtYEyn/black#20,French_Defense French_Defense_Advance_Variation
A1XAj,5Q2/8/2p1p2p/2Pp1kp1/q2P4/7P/6PK/8 b - - 5 43,f5e4 f8f3 e4d4 f3g4 d4c5 g4a4,1450,76,33,370,crushing endgame long queenEndgame skewer,https://lichess.org/b0TZn1Pd/black#86,
