PuzzleId,FEN,Moves,Rating,RatingDeviation,Popularity,NbPlays,Themes,GameUrl,OpeningTags
6s7tZ,8/8/8/r4P2/6PK/2p5/3k4/2R5 w - - 1 59,c1c3 d2c3 g4g5 c3d4 g5g6 d4e5 g6g7 a5a1 f5f6 e5f6 g7g8n f6g7 g8e7 a1a5 h4g3 g7f6 e7c6 a5a4 g3f2 a4c4 c6a5 c4c3 f2e1 f6e5 e1d2 e5d4,3100,119,92,529,crushing defensiveMove endgame hangingPiece master quietMove rookEndgame veryLong zugzwang,https://lichess.org/WiXlYWDP#117,
9ADV9,8/6pp/3k1p2/8/3PKP2/7P/8/8 b - - 0 43,f6f5 e4d3 d6d5 h3h4 g7g6 d3c3 h7h6 c3d3 h6h5 d3c3 d5e4 c3c4 e4f4 d4d5 f4g3 d5d6,3138,136,91,1183,crushing defensiveMove endgame pawnEndgame quietMove veryLong zugzwang,https://lichess.org/gkEcsZZV/black#86,
F8JhQ,8/4kp2/p7/R5K1/5P2/Pr6/8/8 b - - 2 45,b3b5 a5b5 a6b5 f4f5 e7e8 g5f4,3118,101,87,308,crushing defensiveMove endgame long quietMove rookEndgame zugzwang,https://lichess.org/F5T4A8tz/black#90,
GJt4i,8/3b4/5K2/3p4/pNp5/P7/1P1k4/8 w - - 7 49,b4d5 d2c1 d5e3 d7b5 f6e5 c1b2 e5d4 b2b3 e3d5 b5a6 d5c7 a6c8,3164,143,93,566,crushing defensiveMove endgame quietMove veryLong zugzwang,https://lichess.org/wXRNzSDD#97,
K9sZV,8/8/1p6/p3k1pp/P3p3/1PP1K1PP/8/8 b - - 0 38,e5d5 h3h4 g5h4 g3h4 d5e5 b3b4 e5d5 b4b5 d5c4 e3e4 c4b3 e4d5 b3a4 c3c4 a4b3 c4c5 a5a4 c5b6 a4a3 b6b7 a3a2 b7b8q a2a1q b8g3,3188,132,89,473,advancedPawn crushing endgame pawnEndgame promotion quietMove veryLong zugzwang,https://lichess.org/XEU5lvwC/black#76,
UYz0I,8/5p2/4p1p1/1ppkP2p/5P2/1P1K2PP/2P5/8 b - - 0 35,c5c4 b3c4 b5c4 d3e3 g6g5 c2c3 g5g4 h3h4 d5c5 f4f5,3105,119,92,1253,crushing endgame pawnEndgame quietMove veryLong zugzwang,https://lichess.org/OgGFjgYc/black#70,
V0DSV,8/5p2/p1k5/Pppp1pPp/1P3P1P/2PPK3/8/8 w - b6 0 47,a5b6 d5d4 e3d2 d4c3 d2c3 c5b4 c3b4 c6b6 b4c4 a6a5 c4d4 a5a4 d4c4 b6a5,3149,120,92,901,attraction crushing defensiveMove endgame pawnEndgame quietMove veryLong zugzwang,https://lichess.org/BBGyyLL4#93,
Y7fOD,8/2p5/1p3p2/p2P2k1/P1P5/5KPp/7P/8 b - - 2 41,g5f5 g3g4 f5e5 f3e3 f6f5 g4g5 f5f4 e3f3 e5f5 g5g6 f5g6 f3g4 f4f3 g4h3 f3f2 h3g2 f2f1q g2f1,3123,138,90,2118,crushing endgame pawnEndgame quietMove veryLong zugzwang,https://lichess.org/KqphTGzB/black#82,
hWwXX,8/1p6/1p3kp1/3p4/1P1Pp1PP/4K3/P7/8 w - - 0 38,e3f4 g6g5 h4g5 f6g7 b4b5 g7g6,3107,103,87,353,crushing endgame long pawnEndgame zugzwang,https://lichess.org/R2JCKI0L#75,
