PuzzleId,FEN,Moves,Rating,RatingDeviation,Popularity,NbPlays,Themes,GameUrl,OpeningTags
cyuP4,rnb1kb1r/ppp2ppp/5n2/3p4/3P4/q1P2N2/P2BBPPP/R2QR1K1 b kq - 1 10,a3d6 e2b5 e8d8 f3g5 c8e6 e1e6 f7e6 g5f7 d8c8 f7d6,2304,81,85,787,advantage doubleCheck fork opening sacrifice veryLong,https://lichess.org/1XwWuFfP/black#20,Englund_Gambit_Declined Englund_Gambit_Declined_Reversed_French
cztm8,1k5r/1r2qp2/R1P2n2/1P4p1/3Pp3/1Q2P1pP/5bB1/7K b - - 0 28,h8h7 b5b6 e7e6 c6c7 b7c7 b6c7,2312,91,71,36,advancedPawn crushing doubleCheck exposedKing long middlegame queensideAttack,https://lichess.org/CqgqwFVQ/black#56,
czurq,r1b3kr/ppp1n1p1/3p1P2/2b1n1Nq/3pP3/6Q1/PPP3PP/RNB2RK1 b - - 0 15,e7g6 g3b3 g8f8 f6g7 f8g7 f1f7,2333,90,90,1344,advancedPawn advantage attraction doubleCheck kingsideAttack long opening,https://lichess.org/hE4cEMGV/black#30,Scotch_Game Scotch_Game_Haxo_Gambit
d13rW,r2q1r2/ppp1bpk1/7p/4n3/4N2P/2PB2Q1/PP3P2/R3K3 b Q - 1 16,g7h7 e4g5 h7g7 g5e6 g7f6 e6d8 e5d3 g3d3,2373,89,38,50,advantage doubleCheck middlegame veryLong,https://lichess.org/zaCssaav/black#32,French_Defense French_Defense_Classical_Variation
d54qy,5r1k/5p2/1q3p1p/3Pp3/p3Q3/1p2PP2/P5PP/1KR5 w - - 0 35,e4a4 b3a2 b1a1 b6e3,2386,84,67,103,advancedPawn advantage doubleCheck endgame short,https://lichess.org/Okwhsl3Q#69,
d6Sm4,r4rk1/1b1qbppp/3p4/3n2P1/1p1B2N1/p6P/PP1QBP2/1K1R2R1 b - - 1 22,a3b2 g4h6 g8h8 d4g7 h8g7 d2d4 e7f6 g5f6,2338,82,72,61,advantage attraction doubleCheck kingsideAttack middlegame sacrifice veryLong,https://lichess.org/Gsp8rbx2/black#44,
dECd6,5r2/ppp2qkp/3pn1p1/5p1P/8/4Q3/PP4R1/6RK b - - 2 31,f5f4 e3c3 g7g8 h5g6 f7f5 g6h7,2384,78,93,1992,advancedPawn crushing deflection doubleCheck endgame long pin,https://lichess.org/jGljB5f3/black#62,
dcNNU,5rk1/pp3p2/1q4p1/7P/8/P1r5/1P6/1K1R1QR1 b - - 0 32,c3a3 h5g6 b6e6 g6f7 g8h7 g1h1,2327,80,88,733,advancedPawn crushing doubleCheck endgame long,https://lichess.org/aUAm2fFh/black#64,
dmewz,r1b3qr/1pp2kb1/p1n1p1nB/3p1P1Q/8/2NB4/PPP3PP/R4RK1 b - - 0 17,h8h6 f5e6 f7e7 h5g5,2373,80,96,70,crushing doubleCheck middlegame short,https://lichess.org/NylX1Ut9/black#34,Nimzowitsch_Defense Nimzowitsch_Defense_Other_variations
dtUwj,2kr3r/1p2b1pp/p2p4/3Q2P1/4PB1K/1BN2nR1/PPP3q1/R7 w - - 7 24,g3f3 h7h6 f3g3 h6g5 h4g4 h8h4,2312,83,83,211,crushing doubleCheck fork long middlegame,https://lichess.org/Jzk0SHxX#47,
eC2z7,5r1k/6pB/p7/1pp1N3/3p2q1/P1PQ2P1/5r1P/3R2K1 b - - 1 34,g4h3 e5g6 h8h7 g6f8 h7g8 g1f2,2313,86,90,1376,crushing doubleCheck fork long middlegame,https://lichess.org/BDtmM0eD/black#68,
eK15v,6k1/5p1p/2q1p1p1/3pP3/4nr2/2N5/Q3B1PP/2R4K w - - 2 32,a2b2 e4f2 h1g1 c6c5 c3e4 c5e3 b2d2 f2h3,2340,94,57,54,crushing doubleCheck middlegame veryLong,https://lichess.org/IxE8WmJu#63,
eU7AF,2kB3r/ppp2p2/2nb3p/6p1/2P3q1/3P1N1b/PP2BPP1/R2Q1RK1 w - - 1 16,g2g3 d6g3 f3e1 g3f2 g1f2 g4d4 f2g3 d4h4 g3h2 h3f1,2355,80,88,92,attraction crushing discoveredAttack doubleCheck fork middlegame veryLong,https://lichess.org/bfm9gWio#31,Scandinavian_Defense Scandinavian_Defense_Main_Line
edY4U,2rq1r1k/5pp1/4p2P/p3P1P1/1b1p4/2PB4/P2QNP2/2K4R b - - 0 27,b4c3 h6g7 h8g7 h1h7 g7g8 d2f4,2331,80,92,1489,advancedPawn attraction crushing doubleCheck kingsideAttack long middlegame,https://lichess.org/6tNswTxi/black#54,
eh8tH,3r2k1/pp4pp/2p5/2QnR1P1/2r3qP/1NP5/PP4P1/2KR4 w - - 0 25,c5f2 g4d1 c1d1 d5c3 d1c1 c3e2 c1b1 d8d1 b3c1 d1c1,2389,92,89,1568,attraction doubleCheck mate mateIn5 middlegame queensideAttack sacrifice veryLong,https://lichess.org/orsAxlX1#49,
ehsC4,3r4/q4p1k/p4Npp/8/5p2/2Q2P2/4K1PP/8 b - - 3 42,h7g7 f6h5 g7f8 c3h8 f8e7 h8f6 e7d7 f6f7 d7d6 f7a7,2324,80,89,366,crushing deflection doubleCheck endgame skewer veryLong,https://lichess.org/AP80NAcw/black#84,
emjVo,5rk1/1pp2p2/7p/5npr/1p1Pq1bP/4PNP1/PP2BP1K/R2Q1R2 w - - 0 25,f3d2 f5h4 d2e4 h4f3 h2g2 h5h2,2300,77,92,2529,doubleCheck long mate mateIn3 middlegame sacrifice,https://lichess.org/09ceg02O#49,
enahz,r3k3/pb1p2pr/1p1bp3/5Bqp/3P2n1/1P5P/PBPNQPP1/R4RK1 w q - 1 15,f5h7 d6h2 g1h1 b7g2 h1g2 g4e3 g2h1 g5g2,2369,80,92,6819,attraction doubleCheck kingsideAttack mate mateIn4 middlegame sacrifice veryLong,https://lichess.org/EZHrIHFX#29,Benoni_Defense Benoni_Defense_Benoni_Gambit_Accepted
eyCNY,6k1/p1p2rr1/1p2Q3/2b4p/2P2ppq/3B1P1P/PP3PKB/5R1R w - - 4 33,e6e8 c5f8 h3g4 h5g4 h2f4 g4f3,2350,81,86,116,crushing doubleCheck long middlegame,https://lichess.org/PYDY55g6#65,
fGZ5N,6rk/6rp/2NQ4/p1P5/3P2pq/1P4nP/P5P1/R3R1K1 w - - 0 29,e1e7 g4h3 e7g7 h3h2 g1f2 g3e4,2368,78,86,117,advancedPawn advantage doubleCheck long master middlegame sacrifice,https://lichess.org/8L3ACa7K#57,
fQvL4,rn3rk1/ppq2p2/2b3p1/5N1B/6Q1/1P4P1/P1PP1p1K/R7 b - - 1 25,c6d7 h5g6 c7e5 g6h7 g8h7 g4h5,2327,77,92,3005,advantage attraction doubleCheck kingsideAttack long middlegame sacrifice,https://lichess.org/TFx8YO0J/black#50,
fUwBU,r4r1k/ppqb2Bp/2n5/3pPpNP/6Q1/P1p5/2P2PP1/R3K2R b KQ - 0 20,h8g7 g5e6 g7f7 g4f5 f7e7 f5f8 a8f8 e6c7,2364,77,76,144,advantage doubleCheck interference middlegame skewer veryLong,https://lichess.org/fV0zBbGi/black#40,
fd1Fi,r7/8/2p1Pk2/p1b1p3/Pp1q1r2/1B1P1Q2/1PP2PP1/R4RK1 w - - 2 23,f3c6 f4f2 c6c5 f2f1 g1f1 d4c5,2300,79,93,4901,crushing doubleCheck kingsideAttack long middlegame,https://lichess.org/bbdtHJqO#45,
fdXVo,r5rk/1p3p1p/5q2/1p6/1Q6/2N5/PPP2PPP/R4RK1 w - - 5 19,b4b5 g8g2 g1h1 f6f3 b5d3 g2g1 h1g1 a8g8 d3g6 g8g6,2346,80,91,5440,attraction doubleCheck mate mateIn5 middlegame sacrifice veryLong,https://lichess.org/lyVJ4Ry4#37,Sicilian_Defense Sicilian_Defense_Chekhover_Variation
fmAuR,rr4k1/2pn1Rpp/p7/6P1/P2q4/1P3Q1P/3P1P2/4R1K1 b - - 0 26,b8f8 e1e7 a8e8 f3d5 e8e7 f7f8 g8f8 d5d4,2301,98,84,32,advantage doubleCheck middlegame veryLong,https://lichess.org/ohvlAQKJ/black#52,
fnHnY,8/8/5rp1/2p2r2/R2N3k/P4PpP/2Pn2P1/5R1K b - - 0 53,d2f1 d4f5 h4h5 h1g1 g6f5 g1f1,2331,102,62,48,advantage doubleCheck endgame long,https://lichess.org/x7jh2523/black#106,
g4Kki,5rk1/2p1qpBp/3pbN2/1p1n4/1r6/5P2/PQ4PP/R4RK1 b - - 1 21,g8g7 f6e8 g7g6 b2g7,2302,84,82,184,crushing doubleCheck middlegame short,https://lichess.org/xePQYzMF/black#42,
gJRGg,r1b1B1k1/pp2Qppp/8/3p3q/3N1nn1/6P1/PP1N1PKP/2R2R2 w - - 3 24,g2f3 g4e5 f3f4 e5g6,2310,91,13,40,crushing doubleCheck middlegame sacrifice short,https://lichess.org/4MveuzEr#47,
gNhtV,r1b1k2N/ppp3p1/3b3p/2q5/2BnPBn1/2NP3P/PPP3P1/R2Q1RK1 w q - 3 14,f4d6 d4f3 g1h1 c5g1 f1g1 g4f2,2305,78,91,4972,doubleCheck kingsideAttack long mate mateIn3 middlegame sacrifice,https://lichess.org/pAMhcA1v#27,Kings_Gambit_Declined Kings_Gambit_Declined_Queens_Knight_Defense
gU9r4,1R3bk1/2N1pp1p/q2p2pB/2pP4/2n1P3/8/2QN1PPP/r5K1 w - - 5 29,d2f1 a1f1 g1f1 c4e3 f1e1 a6f1 e1d2 f1f2 d2d3 f2c2 d3e3 c2c1,2381,79,98,102,attraction crushing deflection doubleCheck kingsideAttack middlegame sacrifice skewer veryLong,https://lichess.org/xisvwS7k#57,
gVof5,1rr3k1/p3qp1p/1p2bRp1/2p3Q1/4B3/2PP4/PP4RP/6K1 b - - 2 32,c8e8 e4g6 e7f6 g6h7 g8f8 g5f6,2350,87,90,1024,crushing doubleCheck kingsideAttack long middlegame sacrifice,https://lichess.org/YKEChZYf/black#64,
gdedA,r2q4/2pk1p2/8/4Q3/p2nP1Pp/1p1P1P2/KPPN2PB/3R1R2 w - - 0 25,c2b3 a4b3 a2b1 a8a1 b1a1 d8a8 e5a5 a8a5 a1b1 a5a2 b1c1 d4e2,2314,78,74,242,attraction doubleCheck mate mateIn5 middlegame sacrifice veryLong,https://lichess.org/PjPguuR7#49,
gv8Yq,6r1/2q1b3/p2k3p/1p1bn3/BPpQ3P/2N5/P1P2PP1/3R1RK1 w - - 0 35,a4b5 g8g2 g1h1 g2g1 h1g1 e5f3 g1h1 f3d4 c3d5 d6d5,2316,87,100,90,advantage attraction discoveredAttack doubleCheck fork middlegame sacrifice veryLong,https://lichess.org/kp93Ciao#69,
gwyHb,2kr1br1/1pq5/2p4p/P1p1pP2/P4p2/2PP2p1/3BQP2/RR1N2K1 w - - 0 23,d2f4 g3f2 g1f2 c7g7,2344,85,86,263,advancedPawn advantage defensiveMove doubleCheck middlegame short,https://lichess.org/8GSXAMSd#45,
h36pB,2kr3r/pp2q1p1/2n1p3/3p4/PP1P1BQ1/2n3P1/5P1P/R3R1K1 b - - 0 21,d8g8 b4b5 g7g5 e1e6 g5f4 e6c6 c8b8 g4f4 b8a8 c6c3,2347,116,84,41,crushing doubleCheck middlegame veryLong,https://lichess.org/DqVXttmx/black#42,
h44b3,4rrk1/1b5p/4p1p1/p1qpP3/2p2P2/1P2R1QP/P1B3P1/5R1K b - - 0 28,b7a6 c2g6 e8e7 g6h7 g8h7 g3h4 h7g8 e3g3 e7g7 g3g7 g8g7 h4g5 g7f7 g5f6 f7e8 f6e6 e8d8 e6a6,2396,85,81,163,attraction crushing deflection doubleCheck fork middlegame veryLong,https://lichess.org/l1fREjWz/black#56,
h5FLJ,r1bq1r2/ppp4k/5b1P/6pR/4Q1p1/1P1P4/PBP2P2/2K3R1 b - - 2 22,h7g8 e4g6 g8h8 g6g7 f6g7 h6g7,2365,75,84,123,advancedPawn advantage doubleCheck exposedKing kingsideAttack long middlegame sacrifice,https://lichess.org/aeFw44LQ/black#44,
h7jXT,1r2kbnr/ppp2Np1/4R2p/8/3n4/1QNq4/PP1P1PPP/R1B3K1 b k - 0 15,e8f7 e6f6 f7f6 c3d5 f6f7 b3d3,2361,76,91,3925,attraction crushing discoveredAttack doubleCheck long middlegame sacrifice,https://lichess.org/NLhzd6Uw/black#30,Scandinavian_Defense Scandinavian_Defense_Mieses-Kotroc_Variation
hI3NC,5k2/8/1qBp1p2/pP1bpP2/P7/3PQ2r/5Pr1/1RR4K w - - 0 34,e3h3 g2h2 h1h2 b6f2 h3g2 f2g2,2368,85,89,405,attraction doubleCheck exposedKing long mate mateIn3 middlegame sacrifice,https://lichess.org/DJhArWqz#67,
hIRO5,r3qrk1/2pb1pb1/3p2P1/p1nPp1Q1/1p2P3/2N2N2/PPP1BPP1/1K1R3R b - - 0 17,b4c3 h1h8 g7h8 g6f7 g8f7 f3e5 e8e5 e2h5,2312,88,53,249,advancedPawn attraction clearance doubleCheck kingsideAttack mate mateIn4 middlegame sacrifice veryLong,https://lichess.org/uO0lRKha/black#34,Philidor_Defense Philidor_Defense_Lion_Variation
hK4CT,rnbqr1k1/ppp2Bpp/1b6/8/3P4/2P1pN2/PP3QPP/RN3RK1 b - - 0 13,g8f7 f3g5 f7g8 f2f7 g8h8 f7h5 h7h6 g5f7,2370,77,91,4786,crushing doubleCheck opening veryLong,https://lichess.org/pJfJTBsT/black#26,Kings_Gambit_Accepted Kings_Gambit_Accepted_Bishops_Gambit
hNlYH,2k5/pp3pp1/3bp3/4n3/6Pq/3P3B/PPP2P1K/R2Q1R2 w - - 3 22,d3d4 e5g4 h2g2 g4e3,2314,78,95,1161,crushing doubleCheck middlegame short,https://lichess.org/PEHtVaI7#43,
hOHvz,r5k1/2p2ppp/p1p5/6B1/3q4/2N1R1bP/PPQ2nP1/6K1 w - - 0 21,e3g3 f2h3 g1h2 h3g5,2302,77,97,294,advantage doubleCheck middlegame short,https://lichess.org/Nr0dbZuh#41,
hVV40,2rk1b1r/pp3ppp/3Npn2/8/Q1P5/4B3/PP3P1P/2KR3q b - - 1 18,h1c6 d6b7 d8e7 e3c5 c6c5 b7c5,2341,90,90,2329,crushing doubleCheck exposedKing long middlegame,https://lichess.org/HnMlZc3H/black#36,Sicilian_Defense Sicilian_Defense_Alapin_Variation
hgoE4,5k2/1p4bp/Pqpn1pp1/4p3/P2nP3/2NQ1PBP/B5P1/6K1 w - - 1 35,a6b7 d4e2 g1f1 e2g3,2336,86,91,1731,crushing doubleCheck kingsideAttack master middlegame short,https://lichess.org/4fEEgeaA#69,
hm8kw,2b2r1k/2p3pp/p2p4/1p2n3/4B2q/1N1p3P/PPP2bP1/R1BQ1R1K w - - 2 21,c1e3 c8h3 f1f2 h3g2 h1g2 h4e4,2377,93,85,28,advantage attraction doubleCheck kingsideAttack long master middlegame,https://lichess.org/tqdAnsID#41,
hsOFk,k5r1/pp4Qp/5p2/1P1bp3/2q5/8/5PPP/1R1R2K1 w - - 1 29,g7d7 g8g2 g1h1 g2h2 h1h2 c4h4 d7h3 h4f2 h3g2 f2g2,2375,84,83,438,attraction doubleCheck endgame mate mateIn5 sacrifice veryLong,https://lichess.org/ShEEyWU8#57,
hwvuY,8/1QP2pkp/5bp1/8/3q4/6P1/2r2rBP/2R2RK1 w - - 0 39,c1c2 f2f1 g1f1 d4d1 f1f2 f6d4,2321,74,93,3405,attraction doubleCheck fork long mate mateIn3 middlegame,https://lichess.org/4iwl0FU8#77,
hxw4M,8/1pp1qp1k/p2p2r1/3Pp3/1PP1Ppb1/P2B1P2/5QK1/R4R2 w - - 0 27,f1h1 g4h3 g2h3 g6h6 h3g2 e7g5 g2f1 h6h1 f1e2 h1a1,2325,81,85,129,attraction crushing deflection doubleCheck middlegame sacrifice skewer veryLong,https://lichess.org/rzSE1xSZ#53,
hyBVt,r1bq1b1r/pp1n2pp/4Qnk1/2p5/2B4P/8/PPPP1PP1/RNB1K2R b KQ - 0 9,d8e7 h4h5 g6h6 d2d4 g7g5 h5g6 h6g6 c4d3 g6g7 c1h6,2313,80,93,2034,attraction discoveredAttack doubleCheck enPassant exposedKing master masterVsMaster mate mateIn5 opening veryLong,https://lichess.org/KHg5HW7k/black#18,Sicilian_Defense Sicilian_Defense_Modern_Variations
i0XfZ,r6r/bppqk1p1/p4n1p/1P2R1Nb/P1Pn4/1Q1P3P/5PP1/RNB3K1 b - - 0 17,e7d6 c1f4 d7d8 e5d5,2354,80,85,105,crushing doubleCheck middlegame quietMove short,https://lichess.org/5XXK6adb/black#34,Italian_Game Italian_Game_Giuoco_Piano
i6fSj,7k/5pr1/8/1PQN4/6p1/4PK2/1q3PP1/8 w - - 0 40,f3g3 b2e5 f2f4 g4f3 g3f3 e5f5,2325,79,83,206,attraction crushing discoveredAttack doubleCheck enPassant endgame exposedKing long master,https://lichess.org/f7dOeJQ4#79,
i7ls3,rn3rk1/p7/3p2pp/2pP1p2/4PQ1P/3B1K2/Pq3PP1/R6R w - - 0 20,f4h6 f5e4 f3g3 e4d3,2351,82,78,295,crushing doubleCheck middlegame short,https://lichess.org/kS69AUrx#39,
i8T6G,rn4k1/6pp/4b2q/1p2P3/p4p2/P4PrP/1P2Q1PK/RBB2R2 w - - 1 26,b1e4 e6h3 c1f4 h6f4 g2h3 a8a6 e5e6 a6e6 e4d5 g3h3 h2h3 f4f5,2338,111,45,39,advantage attraction doubleCheck middlegame quietMove sacrifice veryLong,https://lichess.org/loYV8ouF#51,
i9oOw,r4nk1/2q1bppp/4p3/2Pp3P/b1rN2Q1/1N4P1/PB3P2/3RR1K1 b - - 2 28,e7c5 g4g7 g8g7 d4f5 g7g8 f5h6,2362,78,96,3485,attraction doubleCheck kingsideAttack long master mate mateIn3 middlegame sacrifice,https://lichess.org/xcTTVkxe/black#56,
iFm6H,r5k1/1b4p1/1p2p1q1/pPbpN2p/2P1n1B1/P6P/1B2RrP1/3QR1K1 w - - 0 27,e5g6 f2f1 g1h2 c5g1 h2h1 e4g3,2308,86,86,105,doubleCheck kingsideAttack long mate mateIn3 middlegame,https://lichess.org/j5bMYs74#53,
iMMNe,r4rk1/pp2qp1p/4b1p1/4N3/3p4/3BbRR1/PPP3PQ/7K b - - 7 26,e6d5 d3g6 f7g6 e5g6 f8f3 g6e7,2394,94,88,614,crushing doubleCheck kingsideAttack long middlegame,https://lichess.org/Uq3cEpxQ/black#52,
iUDhm,r1b2rk1/1p5p/p2p4/2pPN3/P2b1p1q/2N2B1P/1P2Q2B/R3RK2 w - - 0 25,f3g4 f4f3 g4c8 f3e2,2336,82,89,724,advancedPawn crushing doubleCheck master middlegame short,https://lichess.org/IO4b5zBa#49,
iZyK7,3R1b2/pq4kp/1p3p2/2pNrPp1/2Q1P3/1P6/P5PP/6K1 b - - 2 33,f8e7 d8g8 g7g8 d5e7 g8f8 c4g8,2330,77,93,238,attraction crushing doubleCheck endgame long sacrifice,https://lichess.org/UTfXDvC9/black#66,
irEaq,3k2r1/1p1b4/p2p1p2/3Np3/P3P1nP/3P1N1K/BP2R3/8 w - - 2 37,h4h5 g4e3 h3h2 e3f1 h2h1 f1g3 h1g1 g3e2,2334,98,76,78,crushing discoveredAttack doubleCheck exposedKing fork middlegame veryLong,https://lichess.org/BXsGTtsr#73,
irvHX,r1b3kr/ppNnb1pp/5n2/3N4/2QBP3/8/PPPK1P1P/q7 b - - 0 15,d7b6 d5e7 g8f8 e7g6 h7g6 d4c5,2363,78,87,103,doubleCheck hangingPiece kingsideAttack long mate mateIn3 middlegame,https://lichess.org/LwSETrZg/black#30,Philidor_Defense Philidor_Defense_Lion_Variation
is0Ih,r1bq1rk1/ppp1bnpp/5n2/3p1PBQ/2B5/2N2N2/PPP3PP/2KR3R b - - 1 13,f7g5 c3d5 f6h5 d5e7 g8h8 d1d8 f8d8 f3g5,2355,92,73,167,advantage discoveredAttack doubleCheck kingsideAttack middlegame sacrifice veryLong,https://lichess.org/g5qGJux3/black#26,Mikenas_Defense Mikenas_Defense_Other_variations
j4jrp,Q5k1/5p2/4pb1p/1bNpN1p1/1Ppq4/6PP/6PK/8 b - - 1 34,g8g7 c5e6 f7e6 a8b7 g7h8 e5f7 h8h7 f7g5,2348,103,90,706,crushing doubleCheck endgame fork sacrifice veryLong,https://lichess.org/EJ71ZVL3/black#68,
jDIQR,4r1k1/Q6p/5np1/8/4p1q1/NP3n2/PBPPKP1P/R4R2 w - - 7 21,b2f6 f3d4 e2e3 d4f5,2359,81,79,239,doubleCheck mate mateIn2 middlegame short,https://lichess.org/UmS7hAJt#41,
jK5Uy,r3r3/1pp2R1k/p2p2pP/3R2B1/4q3/P5n1/BPP5/1K6 b - - 1 30,h7g8 h6h7 g8f7 d5f5 f7g7 f5f7 g7h8 g5f6,2325,78,98,319,advancedPawn doubleCheck exposedKing mate mateIn4 middlegame sacrifice veryLong,https://lichess.org/1gBLh49G/black#60,
jLwxY,8/p1p5/1pk5/2b1p3/2Q4P/6PB/P1Pr1r2/4R1K1 w - - 12 43,e1e5 f2g2 g1f1 g2g1,2366,84,90,2751,doubleCheck endgame master mate mateIn2 short,https://lichess.org/TcO2Azx0#85,
jUTmu,r6r/2q1k1p1/p3pn1p/3Q2B1/8/8/PP3PPP/R3R1K1 b - - 0 19,h6g5 e1e6 e7f7 e6e7 f7e7 a1e1 e7f8 d5a8 f8f7 a8h8,2308,78,92,2700,attraction crushing doubleCheck interference middlegame sacrifice skewer veryLong,https://lichess.org/cPNDoebA/black#38,Sicilian_Defense Sicilian_Defense_Moscow_Variation
jbmAc,2kr3r/ppp2p1p/5qpn/2b1p3/2BnPP2/2NP3P/PPP3P1/R1BQ1RK1 w - - 1 13,b2b4 d4e2 g1h1 e2g3 h1h2 g3f1,2314,88,90,1414,advantage doubleCheck fork long middlegame,https://lichess.org/ygLheeuK#25,Philidor_Defense Philidor_Defense_Other_variations
jkbJU,k2r3r/pp3ppp/2p2b2/3p4/1R2QB2/2P4P/1PPK1PP1/q4B1R w - - 2 23,e4f3 d5d4 c3d4 f6d4 c2c3 d4e3 d2e3 h8e8,2343,104,83,31,advantage attraction doubleCheck middlegame sacrifice veryLong,https://lichess.org/MrmiiC3M#45,
jktop,8/p4kbQ/2p2r2/3p4/7P/2qB4/PrP5/2KR3R w - - 2 26,d1g1 b2b1 c1b1 c3a1 b1a1 f6f1,2390,83,95,2223,attraction doubleCheck long mate mateIn3 middlegame sacrifice,https://lichess.org/HhhXarEz#51,
jmfGv,5rk1/p1p1qrp1/1b5R/3pP3/7N/1N4Q1/PP2bPPP/5RK1 b - - 0 21,e2f1 h4g6 b6f2 g1h1 g7h6 g6e7,2312,91,90,524,advantage defensiveMove doubleCheck fork long middlegame,https://lichess.org/UsfaVfp6/black#42,
jyZur,r4r2/2q2p1k/1pb1pQpp/p2pP3/7N/P1PB4/1P3PPP/R5K1 b - - 2 26,c7d8 h4g6 d8f6 g6f8,2314,94,86,408,advantage doubleCheck middlegame sacrifice short,https://lichess.org/K9Nz4tPg/black#52,
kAMU8,8/P4ppk/4p3/2P1Pq1p/3Pb1rP/3Q4/5PP1/R2R2K1 w - - 7 37,a7a8q g4g2 g1h1 g2h2 h1h2 f5f2 h2h3 f2g2,2340,83,90,1102,attraction doubleCheck mate mateIn4 middlegame sacrifice veryLong,https://lichess.org/R7aNb0i1#73,
kO4YW,r4rk1/1p1q1p2/4pR1p/1p6/2pP4/2P5/P1B1Q1PP/6K1 b - - 0 23,g8g7 e2e5 f8g8 f6g6 g7f8 e5c5 d7e7 g6g8 f8g8 c5e7,2351,78,93,6549,crushing doubleCheck endgame veryLong,https://lichess.org/MISB4szZ/black#46,
kTn2O,2kr3r/pp2bpp1/2qp4/8/5B2/2N2np1/PP2NP2/R2Q1K1R w - - 0 24,h1h8 g3g2 f1g2 f3h4 g2f1 c6g2 f1e1 h4f3,2310,94,91,5790,advancedPawn attraction doubleCheck mate mateIn4 middlegame veryLong,https://lichess.org/5DrwPPHp#47,
kdhKy,2kr1bnr/pp3ppp/8/q1p5/1n2bB2/1QN2N2/PP3PPP/R3KB1R w KQ - 0 12,c3e4 b4c2 e1e2 a5a6 b3b5 a6b5,2351,90,89,1976,doubleCheck long mate mateIn3 opening,https://lichess.org/BHBiykht#23,Queens_Pawn_Game Queens_Pawn_Game_Other_variations
kjQUe,r3k2r/pp3pp1/2pp4/4p2p/4Pqb1/1BPPQ1RP/PP3P1K/R7 w kq - 2 20,h3g4 h5h4 e3f4 h4g3 h2g3 e5f4,2313,86,85,53,advantage attraction doubleCheck exposedKing intermezzo long middlegame sacrifice,https://lichess.org/F5kfj6qJ#39,
ktDOW,r4rk1/p1p3pp/2p5/3p2q1/3P1p2/2PB1Pnb/PP4P1/R2QRNK1 w - - 0 17,g2h3 g3e2 g1f2 g5g1 f2e2 g1g2,2378,81,92,5343,doubleCheck exposedKing kingsideAttack long mate mateIn3 middlegame sacrifice,https://lichess.org/hvFS9dXh#33,French_Defense French_Defense_Exchange_Variation
l8BMt,8/8/8/6k1/4b3/5rK1/pR3P2/B7 w - - 2 50,g3h2 g5h4 h2g2 f3g3 g2f1 e4d3 f1e1 g3g1,2376,114,86,44,crushing doubleCheck endgame exposedKing veryLong,https://lichess.org/kGu1aFLi#99,
lA3Jg,5nr1/1bk1qN1p/pp1rPn1b/2p2B2/N1P2P2/1Q2B3/P5PP/4RRK1 w - - 6 23,f7d6 g8g2 g1h1 g2g1 h1g1 e7g7 f5g6 g7g6 g1f2 g6g2,2385,84,91,2754,attraction doubleCheck kingsideAttack mate mateIn5 middlegame sacrifice veryLong,https://lichess.org/26itgKI2#45,
lBhJX,3Q1rk1/pp2pp1p/2q3p1/5b2/8/2b1B2P/PP3PP1/2KR1B1R w - - 0 15,d8d5 c3d2 c1d2 c6d5,2366,80,91,5838,advantage attraction doubleCheck interference master middlegame queensideAttack short,https://lichess.org/Cj6EfaD2#29,Modern_Defense Modern_Defense_Modern_Pterodactyl
lVMu5,r1b5/5k1p/p1n1pqpP/1p1p1P2/2p3P1/2N1Q3/1PP5/3B1RK1 b - - 0 30,g6f5 g4f5 f6d4 f5e6 f7g6 e3d4 c6d4 e6e7,2313,77,85,346,advancedPawn advantage doubleCheck middlegame veryLong,https://lichess.org/JPLHETtk/black#60,
la3Ch,8/5k2/6p1/1p1pPqPp/1P1P3P/2rbQ3/2p2P1K/R5R1 w - - 2 39,e3d2 f5h3 h2h3 d3f1 h3h2 c3h3,2379,80,92,6674,attraction doubleCheck endgame exposedKing long mate mateIn3 sacrifice,https://lichess.org/QeaphAp9#77,
ld92x,r2q1r2/pp3pk1/2p5/n2bP1N1/1b1P3p/8/PP3PPP/RNBQ2K1 b - - 1 19,b4e7 d1g4 e7g5 c1g5 f7f5 g5f6,2335,78,84,344,crushing doubleCheck long middlegame,https://lichess.org/RyiucQmO/black#38,Philidor_Defense Philidor_Defense_Other_variations
leAmu,3Qn1k1/pp3p1p/2q1p1pB/2r5/N3nPP1/8/PPP4P/R3R2K w - - 0 26,a4c5 e4f2 h1g1 f2h3 g1f1 c6f3,2336,75,95,3879,doubleCheck kingsideAttack long mate mateIn3 middlegame,https://lichess.org/Ex67VPlX#51,
lgZAe,r1b2kr1/ppp3q1/3p1p2/n3p2Q/3PPP1N/2P5/PP4PP/R4RK1 b - - 0 25,c8h3 f4e5 h3g4 e5f6 g4h5 f6g7,2368,83,90,1593,advancedPawn advantage doubleCheck long middlegame,https://lichess.org/hh39BwRw/black#50,
li04V,r1b3rk/p1Q2n2/2R4p/2NR4/4B1p1/4P2q/PP3P2/7K w - - 0 36,h1g1 g4g3 c7f7 g3f2 g1f2 h3h2 f2e1 g8g1,2380,87,90,733,advancedPawn attraction crushing doubleCheck middlegame sacrifice veryLong,https://lichess.org/eKViErox#71,
lmUPg,5rk1/pp3pp1/7p/3pPN1P/8/q7/P3QRPK/2r5 b - - 3 27,a3c5 e2g4 g7g5 h5g6 c5f2 g6f7 g8f7 g4g7 f7e6 g7e7 e6f5 e7f8 f5e5 f8f2,2387,88,82,262,advancedPawn advantage attraction doubleCheck enPassant endgame fork sacrifice skewer veryLong,https://lichess.org/636ZClx3/black#54,
lnUf8,r1b2r2/pp1nq3/2n1p1p1/2Pp2b1/4kBQ1/6P1/PPP1NP2/R3K2R b KQ - 5 20,d7e5 e2c3 e4d4 f4e3,2305,79,94,2048,doubleCheck mate mateIn2 middlegame short,https://lichess.org/kJbO4Boc/black#40,
loAjL,2r3k1/pp2npq1/2b1p1pp/2N5/4PR2/1B5P/PP2QPP1/6K1 b - - 4 26,c8d8 f4f7 g8f7 c5e6 g7f6 e6d8,2361,77,82,215,crushing doubleCheck fork long master middlegame sacrifice,https://lichess.org/1H2phUQR/black#52,
loj4f,5r2/1Br3pk/p5pp/8/PP1q4/1Q1n2PP/2R2P2/5RK1 w - - 0 30,c2c7 f8f2 b3d3 f2f1 g1f1 d4d3,2366,79,89,615,attraction crushing doubleCheck long middlegame,https://lichess.org/MjKP6Hsj#59,
lpihm,b1rqrnk1/3n1p2/p2P4/1p5N/1P6/PQ1B4/7P/1K4R1 b - - 3 26,f8g6 d3g6 d7e5 g6f7,2393,90,90,2864,crushing doubleCheck middlegame pin short,https://lichess.org/qnS0ikPX/black#52,
lsORO,1k5r/p3q3/1nQ5/P4r2/5p2/1R4P1/1P5P/2R3K1 b - - 0 32,f4g3 a5b6 g3h2 g1h1 a7a5 c6c7 e7c7 b6c7,2339,80,87,233,advancedPawn crushing doubleCheck middlegame veryLong,https://lichess.org/VbZVtYc5/black#64,
luwpR,8/5R2/1k1p4/p1pP1Np1/b1P2pP1/P4N2/5P2/r1n1KB2 w - - 1 38,f3d2 c1d3 e1e2 d3e5 f7b7 b6b7,2360,88,88,718,crushing doubleCheck long master middlegame,https://lichess.org/rdHNRoAK#75,
m1QiY,4B2k/pp2R1p1/6Qp/2q5/2p3n1/2N3P1/PP3r1P/4R1K1 w - - 1 30,c3a4 f2f1 g1g2 c5g1 g2h3 g4f2 h3h4 g1h2,2359,76,93,5417,deflection doubleCheck mate mateIn4 middlegame veryLong,https://lichess.org/ylfDR9T8#59,
m5jre,r1b1q2k/pp4pp/2pb3r/3N1pN1/3P3P/1Q2P1n1/PP3PB1/3RR1K1 b - - 0 17,g3e4 d5c7 d6c7 g5f7 h8g8 f7h6,2330,116,83,33,crushing doubleCheck fork long middlegame sacrifice,https://lichess.org/fRQGApiC/black#34,Queens_Gambit_Declined Queens_Gambit_Declined_Queens_Knight_Variation
mEhJB,7r/r1q2pk1/bnBp4/p1pP2B1/1p4Q1/8/P1R2PPb/4R2K b - - 1 29,a6c8 g5h6 g7h6 g4h4 h6g6 h4h8,2314,78,91,1158,advantage attraction doubleCheck fork long middlegame sacrifice skewer,https://lichess.org/blxg82SE/black#58,
mHlZN,2r3k1/pp2b1p1/4r3/P6q/1P1p1N1P/3Pp3/2PQ1P2/R3K1R1 w Q - 0 27,g1g7 g8h8 f4h5 e3d2 e1d2 e7b4,2368,86,88,589,advancedPawn advantage attraction defensiveMove doubleCheck long middlegame,https://lichess.org/CIKiVbRh#53,
mL1Aa,6k1/6p1/3b2rp/2P3q1/R7/3P1QpP/P4P2/5RK1 w - - 0 30,c5d6 g3f2 g1f2 g5d2 f3e2 g6f6 f2g1 d2e2,2352,77,98,222,advancedPawn advantage attraction deflection doubleCheck endgame veryLong,https://lichess.org/fU6ykgiQ#59,
mLTgR,r3kn2/1b3r2/4p3/3pP1BQ/p1pn4/2q3N1/5PP1/1R2R1K1 b q - 1 30,d4b3 g3f5 e6f5 e5e6 c3g7 e6f7,2332,77,97,526,advancedPawn advantage attackingF2F7 doubleCheck long master middlegame pin quietMove sacrifice,https://lichess.org/Tfp71lhP/black#60,
mLn6J,r7/pp3kpp/8/3p1b2/2P1rn1K/P5P1/P5qP/R1BQ1B1R w - - 0 23,f1g2 f4g2 h4h5 f5g6 h5g5 h7h6,2335,83,86,802,doubleCheck long mate mateIn3 middlegame,https://lichess.org/pEPqjlsu#45,
mRq3q,3q1b2/r1p1kp2/p1Bp3p/1p6/1Pn1RB1p/4P2P/P5K1/5R2 b - - 1 26,e7f6 f4e5 f6e6 e5f6,2389,77,94,834,advantage discoveredAttack doubleCheck middlegame short,https://lichess.org/JpOsJTPZ/black#52,
mS7dT,5rk1/2Q3p1/bp3n2/p7/3P4/1PN5/P1P3PP/R1B1rBK1 w - - 1 26,g1f2 f6e4 f2e1 f8f1,2325,82,80,235,discoveredAttack doubleCheck mate mateIn2 middlegame sacrifice short,https://lichess.org/8sVBjZSk#51,
mSHQK,r4B1k/pbpp4/1p3pr1/8/8/3P4/PPPQ1PPP/RN3RK1 w - - 2 18,f8e7 g6g2 g1h1 g2g1 h1g1 a8g8 d2g5 g8g5,2345,95,90,3517,attraction doubleCheck kingsideAttack mate mateIn4 middlegame sacrifice veryLong,https://lichess.org/mjUcWSfD#35,Italian_Game Italian_Game_Two_Knights_Defense
mVKQh,2k3rr/bpp2p2/p2pb3/PP2p3/4P1pp/2Q2P2/2P1N1BK/1R3R2 w - - 0 23,b5a6 g4g3 h2h1 h4h3 b1b6 h3g2 h1g2 h8h2 g2g1 h2e2,2349,79,80,268,advancedPawn attraction crushing doubleCheck exposedKing middlegame pin skewer trappedPiece veryLong,https://lichess.org/dabiZzwo#45,
mer5D,rn2k2r/ppp2ppp/4b3/2bp4/3n4/2NN1P2/PPPP2PP/R1BBR1K1 w kq - 7 12,c3d5 d4f3 g1h1 f3e1 d5c7 e8d7 d3c5 d7c7 c5e6 f7e6,2352,81,86,183,advantage doubleCheck opening veryLong,https://lichess.org/tbzXgpeP#23,Russian_Game Russian_Game_Damiano_Variation
mpV23,2r1r1k1/pb2ppbp/1p2P1p1/2q2P2/3p2Q1/1PN3NP/1PP2RP1/4R1K1 b - - 0 24,d4c3 e6f7 g8f7 f5g6 f7g8 g3f5,2397,104,85,34,advancedPawn advantage attraction doubleCheck kingsideAttack long master middlegame,https://lichess.org/uDcQkkHY/black#48,
mqb6X,2r1q1k1/pp3p1p/2b3p1/4PPQ1/2B5/1P6/P6P/4R1K1 b - - 0 27,b7b5 f5g6 b5c4 g6f7,2384,86,85,252,advancedPawn crushing doubleCheck endgame short,https://lichess.org/r4jTgJT7/black#54,
mqi9S,rn1q1rk1/1b2bpp1/p3p2p/1p1pN3/3P1N2/3BP3/PPQ2PPP/R4RK1 b - - 0 14,b8d7 d3h7 g8h8 e5f7 f8f7 f4g6 h8h7 g6f8 h7g8 c2h7 g8f8 h7h8,2395,84,94,7304,deflection doubleCheck kingsideAttack mate mateIn5 middlegame sacrifice veryLong,https://lichess.org/8Hdoeubh/black#28,Semi-Slav_Defense Semi-Slav_Defense_Other_variations
n3KRV,5k1r/pp6/2p1PP2/8/8/2PB2P1/P4RKP/2q5 b - - 2 30,c1c3 d3g6 c3e5 e6e7 e5e7 f6e7,2365,77,84,367,advancedPawn advantage doubleCheck endgame exposedKing long master quietMove,https://lichess.org/Sdfvjec9/black#60,
n8l60,6rr/Bppk1p2/p2p4/3Nn3/2PQ2nq/1P2P1N1/P3RP2/R4bKB w - - 3 22,g1f1 h4h1 g3h1 h8h1 f1g2 g4e3 g2h1 g8h8 d4h4 h8h4 h1g1 e5f3,2336,87,90,1577,doubleCheck master mate mateIn5 middlegame sacrifice veryLong,https://lichess.org/nHRhg5e6#43,
nB3n0,5r1k/p1p3pp/2p1Q3/3p4/5p1q/2PB1Pn1/PP3K2/3R1N2 w - - 5 27,e6g4 g3e4 f2g2 h4f2 g2h3 e4g5 g4g5 f2f3,2329,86,84,170,crushing deflection doubleCheck middlegame sacrifice veryLong,https://lichess.org/7irpNCpW#53,
nKoxY,r6k/bpp3pp/p2p1p2/6nq/1PB2Q2/P6b/1BP2PP1/3RR2K w - - 0 24,g2h3 g5h3 f4g3 h3f2 h1g2 f2d1 c4e2 h5d5,2326,82,57,118,crushing doubleCheck exposedKing fork middlegame veryLong,https://lichess.org/F0et031o#47,
nXLTA,r6r/p1B1bppp/b1p1pn2/8/Pkp5/8/1NK1PPPP/1R3B1R b - - 1 19,f6d5 b2d3 b4a4 b1a1 e7a3 d3c5 a4b5 c5a6 d5b4 a6b4,2375,83,81,70,advantage doubleCheck middlegame pin veryLong,https://lichess.org/zegYyD4d/black#38,English_Opening English_Opening_Symmetrical_Variation
nc12N,5r2/ppp5/k2b4/P1q5/8/2P5/1PK1QP2/R7 b - - 2 38,b7b5 a5b6 a6b7 e2a6 b7c6 b6a7,2345,87,90,598,advancedPawn advantage deflection discoveredAttack doubleCheck enPassant endgame long,https://lichess.org/hMYUsRET/black#76,
