PuzzleId,FEN,Moves,Rating,RatingDeviation,Popularity,NbPlays,Themes,GameUrl,OpeningTags
MeCCG,r5rk/1bq2p1p/p2bpP1Q/1p1n3B/8/5R2/PPPB2PP/6RK b - - 3 22,d6h2 f3h3 d5f4 h3h2,2323,140,98,32,equality interference middlegame short,https://lichess.org/xs50gm30/black#44,
MhAR6,r3r1k1/1p3p1p/2p2p1q/3n1P2/p1Q1N1P1/bP4RP/P5B1/3R2K1 b - - 4 27,d5e3 g4g5 f6g5 g3e3,2306,84,89,470,advantage interference master middlegame short,https://lichess.org/27Ng1Lti/black#54,
MmQW9,3k2r1/ppp5/3qp1nR/5p2/3PpN2/2P1P1r1/PP2QK2/7R w - - 5 28,f4e6 d6e6 f2g3 g6h4 g3f2 e6h6,2351,77,94,3374,crushing discoveredAttack interference long middlegame sacrifice,https://lichess.org/Jdz7rbqc#55,
MtLho,1r3r2/4k1b1/p3p1np/q2pP1N1/2p5/2P1Q1B1/P1R3PP/R5K1 b - - 0 28,h6g5 e3a7 e7e8 a7b8,2324,82,91,688,crushing interference middlegame short,https://lichess.org/ufWEaGJM/black#56,
MvWfA,N6r/p2Q2pp/4pk2/1B1n4/8/2q2K2/P4PPP/R6R w - - 2 28,f3e2 d5f4 e2d1 c3a1 d1c2 a1a2,2395,92,87,1491,advantage interference long middlegame,https://lichess.org/TUqAMec6#55,
MwKQT,1k5r/pp6/P1n4q/3Q4/2pP4/R1P5/2P2RB1/4rNK1 w - - 1 31,g2h1 e1f1 g1f1 h6c1 f1e2 c1c2,2301,89,82,36,advantage attraction exposedKing fork interference long middlegame sacrifice,https://lichess.org/hMbZ1c7t#61,
MyqgX,8/5pk1/4p1p1/3pP2p/p2R1P2/5rRK/3Q3P/5q2 w - - 2 52,h3h4 f3f2 d2b4 f2h2 h4g5 h2g2,2341,80,86,103,advantage endgame interference long,https://lichess.org/pay2RUgV#103,
NKyQn,7r/1ppq1pk1/6p1/1P1np1P1/2Q3N1/2PP2P1/5PK1/7R w - - 6 29,h1e1 d5f4 g2f3 f4d3 e1e3 d7f5 f3e2 d3f4 g3f4 f5g4,2370,90,45,47,advantage endgame interference veryLong,https://lichess.org/ejHLsQXP#57,
NXIBm,1b6/3q1p1k/p2P3N/2P1n3/8/P2B3p/5r2/2RQ3K b - - 1 36,e5d3 d1d3 f7f5 d3h3 d7c6 h1g1,2392,78,93,1134,advantage interference long middlegame,https://lichess.org/WP1J0AKz/black#72,
Nfp1d,r1b2rk1/ppqn2p1/2n1p3/3pP1N1/7Q/b1P5/P2N2PP/R4R1K b - - 3 18,f8f1 a1f1 d7f8 f1f8 g8f8 h4h8 f8e7 h8g7 e7d8 g7g8,2373,171,88,28,attraction deflection equality interference kingsideAttack middlegame veryLong,https://lichess.org/uajykcMG/black#36,
NgF0j,1nk4r/p1p3p1/1p1b4/2PP1p1p/7q/1Q5B/P4K2/1RB3R1 w - - 1 37,f2e2 h8e8 c1e3 h4h3 c5d6 f5f4,2333,97,86,64,crushing interference long middlegame pin,https://lichess.org/LYqMktFm#73,
Nhkf6,r3k2r/p1p4p/2p2Qp1/3pPb2/4p3/2P1q3/PP4PP/RN3R1K b kq - 3 17,e8d7 f6g7 d7c8 g7h8,2336,78,79,103,crushing interference middlegame short,https://lichess.org/8MafTd36/black#34,Bird_Opening Bird_Opening_Dutch_Variation
NvUvn,2k1r2r/ppp2pQp/2n5/5p2/3p4/PP1P1NPB/qPK2P1P/4R2R w - - 3 22,e1a1 e8e2 c2d1 a2a1 d1e2 h8e8 e2d2 a1b2,2302,81,51,64,crushing interference middlegame veryLong,https://lichess.org/KpqX5wj1#43,
O12tH,r3kb1r/1bq2ppp/p2pN3/1p5Q/5P2/P2BB1nP/1PP3P1/R4RK1 b kq - 0 15,c7e7 d3b5 a6b5 h5b5 e7d7 e6c7 e8d8 b5b7,2389,80,80,259,crushing interference middlegame pin veryLong,https://lichess.org/3H3lsWpD/black#30,Sicilian_Defense Sicilian_Defense_Najdorf_Variation
O3C8l,8/5k1p/4p1rP/5rP1/4R3/4Q3/6K1/8 w - - 1 55,e4e6 f5g5 g2f3 g5f5 f3e4 g6e6,2308,89,90,3132,crushing endgame exposedKing interference long master queenRookEndgame,https://lichess.org/tfzqluxr#109,
O4PgT,1r2k2r/2q2ppp/4pn2/pPPp4/1np5/4PN2/5PPP/R1BQ1RK1 b k - 0 17,b8b5 d1a4 c7d7 c5c6 b4c6 a4b5,2358,86,81,75,advantage interference long middlegame pin,https://lichess.org/V9cnxjuB/black#34,Queens_Pawn_Game Queens_Pawn_Game_Other_variations
OA7Si,7Q/2p5/8/5K2/8/5k2/1P6/1q6 w - - 1 45,f5g5 b1g1 g5h6 g1h2 h6g7 h2b2,2359,80,67,78,crushing endgame interference long queenEndgame,https://lichess.org/5jglbtE6#89,
OGIMC,r4rk1/pb4pp/1p6/2p1P2B/2P4q/3P2p1/PB4PP/R2QR1K1 w - - 2 25,h2h3 f8f2 e1e2 h4h5 e2f2 g3f2,2359,84,78,56,advancedPawn advantage interference kingsideAttack long middlegame,https://lichess.org/iCZK5f3Z#49,
OKsOc,6k1/1pp2p2/p2p3p/3PrBn1/5N2/3Q2P1/5q1P/3R3K w - - 4 32,h2h4 g5f3 d3c2 f2g3 c2g2 g3g2,2339,91,51,50,crushing interference long middlegame,https://lichess.org/T6Es7Uxb#63,
OP9Vq,r6r/1p2k3/p2RBq2/2B1n1p1/6n1/2P5/P1P2P1P/1K1R4 b - - 4 24,g4f2 d6a6 e7e8 a6a8 f6d8 d1d8,2300,74,92,6302,discoveredAttack exposedKing interference long mate mateIn3 middlegame,https://lichess.org/9I2hG8jd/black#48,
OUN0y,Q1bkr3/p4ppp/3b4/6q1/5p2/3P4/PPPK1PPP/RN5R w - - 7 18,b1c3 f4f3 d2d1 g5g2,2300,79,89,166,crushing discoveredAttack interference middlegame short,https://lichess.org/o282j2BR#35,Italian_Game Italian_Game_Two_Knights_Defense
OYZfP,3q3k/ppb3p1/2r4p/n2pPrpQ/2pP3P/4BN2/PP3P2/1KR4R b - - 0 26,c4c3 h4g5 a5c4 c1c3,2358,81,80,143,advantage interference middlegame short,https://lichess.org/GD16fm5k/black#52,
OYlLG,4r1k1/1p1qrpbp/p2p2p1/P1pP4/2N1nP2/5B2/1PQ5/R3BRK1 w - - 5 29,e1h4 d7h3 c2h2 g7d4 g1h1 e4f2 h4f2 h3f3,2347,76,85,469,crushing exposedKing interference kingsideAttack middlegame veryLong,https://lichess.org/jWdJH7ig#57,
OZQw8,7R/1k5P/8/2p5/p1K5/5P2/8/7r b - - 2 57,a4a3 c4b3 h1h3 b3a2 c5c4 f3f4 b7a7 f4f5 c4c3 a2a3,2361,75,91,990,crushing endgame interference master masterVsMaster quietMove rookEndgame veryLong,https://lichess.org/CqV9AwUB/black#114,
Oebn7,2rq1r2/3bbp1k/6pp/1p1NP3/p4P2/5Q2/PPP5/2K3RR b - - 1 24,d7c6 f3h3 e7h4 d5f6 h7g7 h3h4,2340,79,91,998,advantage interference long middlegame,https://lichess.org/bI3DtRjz/black#48,
OgRz7,r5k1/2p2ppp/p1Rr4/1p1PpP2/4q3/1B4Q1/PP5K/5R2 w - - 2 28,c6c7 d6h6 h2g1 h6h1 g1f2 e4f5,2360,78,83,80,advantage exposedKing interference long middlegame,https://lichess.org/AXcaYvkv#55,
OiGGQ,1r2r1k1/p4p1p/2p2Qp1/q2b4/6P1/2N2P1P/1PK5/3R1B1R w - - 1 21,c3d5 a5a4 c2d2 c6d5,2375,113,57,24,advantage interference intermezzo middlegame short,https://lichess.org/sZHK8igA#41,
OjPnV,8/p1p2Q2/1pkrp3/6p1/P2P4/2q5/2P2P1P/2KR2R1 w - - 1 24,f7f8 c3a1 c1d2 a1d4 d2e2 d4e4 e2f1 d6d1,2339,81,96,1332,deflection discoveredAttack endgame interference mate mateIn4 veryLong,https://lichess.org/rV2jXHBj#47,
OoxGJ,2b1qr1k/1p4pp/3p4/1PbNn3/2PpP3/8/1Q1B1PPP/1B3RK1 w - - 7 23,f2f4 e5c4 b2c1 d4d3 g1h1 e8e4,2385,76,79,111,crushing discoveredAttack interference long middlegame,https://lichess.org/kyKOfgeV#45,
OspoM,2r3k1/2P5/4p3/3b2pp/3B1P1K/4Q2P/p5q1/6R1 w - - 0 40,h4h5 d5f3 h5g6 g2h3 e3f3 h3f3,2307,80,86,83,crushing endgame interference long master,https://lichess.org/MKt13LgJ#79,
Ovbxu,1rb1k3/6R1/2p1p1r1/2Np1p2/1P1Q1P2/P5Pp/2P2RKP/4q3 w - - 0 33,g2f3 e6e5 f4e5 g6g7,2355,84,82,118,advantage interference master middlegame short,https://lichess.org/gj7aWCGn#65,
Oyuff,4rk2/pp1r1p1p/6p1/2b1p3/4B1Q1/5RP1/PP1q3P/5R1K b - - 3 28,f7f5 e4f5 g6f5 f3f5 f8e7 f5e5,2387,98,89,739,advantage exposedKing interference long middlegame,https://lichess.org/6gtdBjhL/black#56,
PF80d,r1k2b2/2n5/p1Q1p1rp/1p3q2/8/1P1R4/PBPP1PP1/4R1K1 b - - 7 23,f8c5 e1e2 e6e5 c6c5,2317,140,23,31,crushing interference middlegame short,https://lichess.org/kNWXVPsm/black#46,
PM9f3,r3r1k1/pbp2p2/1p3p2/1q1p4/3P1B1P/P1P2Q1N/5PP1/R3K2R w KQ - 2 20,e1d2 b5b2 d2d1 b2a1 d1c2 a1a2,2359,81,84,225,crushing interference long middlegame,https://lichess.org/66squiHw#39,
POBC0,1b2r1k1/5ppp/2p5/2qb1P2/Q1npP3/8/P1B3PP/1RB1K2R w K - 1 28,e1g1 d4d3 g1h1 d5e4 b1b8 e8b8,2334,100,81,38,advantage discoveredAttack interference long middlegame,https://lichess.org/HImBCilw#55,
PR8Vw,r1b1k2r/1p2b1pp/4p3/p1n1P3/1pqN1R2/4B3/P2Q2PP/RN4K1 b kq - 3 18,h8f8 d4f5 c4f4 f5g7 e8f7 e3f4,2380,76,92,3325,advantage exposedKing interference long middlegame sacrifice,https://lichess.org/HEcgmHLr/black#36,Sicilian_Defense Sicilian_Defense_Wing_Gambit
PS2xY,r1bQ1k1r/pp4bp/3p2q1/3P4/3P1Bp1/6P1/PPP4P/4R1K1 b - - 2 19,f8f7 e1e7 f7f6 d8d6 f6f5 e7e5 g7e5 d6e5,2303,118,100,45,exposedKing interference mate mateIn4 middlegame veryLong,https://lichess.org/RqfpXJmE/black#38,
PT5Vx,r3r3/1pp2k2/3p2R1/p3b1Q1/n1P1P3/3B1q2/1P6/4K1R1 b - - 2 29,e8h8 g6g7 e5g7 g5g7 f7e8 g7h8 e8d7 g1g7 d7c6 h8a8,2369,84,84,95,advantage exposedKing interference middlegame sacrifice veryLong,https://lichess.org/I6si35dQ/black#58,
Pfp8c,4r1k1/1n1b2q1/3p2B1/pp1pr1N1/1P5Q/P6P/2P2P2/6RK b - - 0 31,e5e1 g6h7 g8f8 h4f4 f8e7 g1e1,2322,77,93,4635,advantage exposedKing interference kingsideAttack long middlegame,https://lichess.org/Ls9Tyk5F/black#62,
PghKQ,8/8/8/5r2/7p/2K3k1/4R1P1/8 w - - 5 53,c3d3 f5f2 e2e7 g3g2 e7g7 g2f1 g7h7 f2f3,2392,94,56,48,crushing endgame interference rookEndgame veryLong,https://lichess.org/XXAwysLR#105,
Phvwj,2k4r/Bpp4p/3b2b1/5q2/P3rn2/2NP1Q1P/1P3Pp1/R2R2K1 w - - 0 29,c3e4 d6e5 e4g3 f5h3,2368,111,79,48,crushing interference master middlegame short,https://lichess.org/Tt8Xmzmy#57,
PmbId,6k1/2r2pp1/p6p/1p2N1n1/3pP3/PB1P3P/1P3RPK/2r5 b - - 9 33,g5e6 f2f7 e6c5 f7c7,2312,77,41,52,advantage discoveredAttack endgame interference short,https://lichess.org/JcnBQFVg/black#66,
Po5ZH,4r1k1/ppq2Rpp/3b4/3Q2B1/8/1BP5/PP3KPP/4r3 b - - 0 21,d6c5 g5e3 c5e3 f2e1 g8h8 f7c7,2338,87,92,2782,crushing defensiveMove interference long middlegame,https://lichess.org/tF96QOXo/black#42,
PsE3g,8/pp1B2p1/4R3/3p1pk1/3P4/QKPn4/PP4q1/7r b - - 3 28,h1b1 a3e7 g5f4 e7d6 f4f3 d6d5,2338,82,90,1492,crushing endgame interference long,https://lichess.org/g2IQ7KjE/black#56,
Q08Zi,4r1k1/ppp2ppp/4r3/b6q/2Pp3B/3Q1N2/PP3P2/R4KR1 w - - 12 25,h4g3 e6e3 f2e3 h5f3 g3f2 d4e3,2372,80,92,885,crushing interference long middlegame sacrifice,https://lichess.org/Ly0YBhaK#49,
Q87HE,8/1k2n1pp/p2r1p2/1pp5/4PP2/1PNn2P1/6BP/3R2K1 b - - 1 28,b7b6 c3d5 e7d5 d1d3 c5c4 b3c4,2381,77,94,1708,advantage endgame interference long,https://lichess.org/ZrHCFdw4/black#56,
QFdk8,2rq1kr1/pp6/5n2/4BQ1p/1b6/7P/PPP1B3/R4K2 b - - 4 24,b4e7 a1d1 d8e8 e5f6 e7f6 d1d6 g8g6 e2h5 f8g7 h5g6,2345,134,79,17,crushing interference middlegame pin veryLong,https://lichess.org/vHIqKbtP/black#48,
QG8mL,r2qr1k1/pp3pbp/6p1/3N3b/3n1P2/1P2P2P/P2PNPB1/2RQ1RK1 w - - 3 16,f1e1 d4f3 g1h1 d8d5,2380,91,89,378,advantage fork interference master masterVsMaster middlegame short,https://lichess.org/5YHvZ1jd#31,Nimzo-Larsen_Attack Nimzo-Larsen_Attack_Indian_Variation
QI982,6k1/5p2/R7/6p1/1r4P1/5PKp/7P/8 b - - 1 37,b4f4 a6a5 f7f6 a5f5 f4b4 f5f6,2396,102,89,1161,crushing endgame interference long rookEndgame,https://lichess.org/WMcuCpN1/black#74,
QTYVE,2r3k1/pp4p1/2q1ppbp/b2p4/3P1B2/PBr1P3/1Q1N1PPP/R2R2K1 w - - 4 25,d2b1 c3b3 b2b3 g6c2 b3a2 c2d1,2327,79,82,83,advantage fork interference long middlegame sacrifice,https://lichess.org/Yu8ELCAr#49,
QVsa4,8/2Q5/p3p1pk/4P2p/4P2P/P2q1KP1/8/8 w - - 1 45,f3f4 d3e2 c7c3 e2g4 f4e3 g4g3,2342,77,83,148,crushing deflection endgame interference long master queenEndgame,https://lichess.org/zjQmJUVo#89,
QXWJW,7r/1Q3ppp/3p1k2/4qP2/4p1P1/4B2P/8/7K b - - 0 33,e5g3 e3d4 f6g5 b7e7 g5f4 e7d6 f4f3 d6a3,2312,84,90,924,crushing endgame exposedKing interference veryLong,https://lichess.org/2XibJKl6/black#66,
QgUVT,8/pk2r3/2p2Q1p/1q3b2/8/P5BP/1P6/K2R4 b - - 2 35,e7e6 f6f7 b7a6 g3f2 c6c5 f7f5,2393,95,90,1345,crushing endgame interference long master,https://lichess.org/wQoAnsqX/black#70,
Qkzc8,8/p4r2/k2r4/R1R5/P4p2/1P6/1K6/8 b - - 0 44,a6b6 c5b5 b6c6 a5a6 c6d7 a6a7 d7e6 a7f7 e6f7 b5f5,2325,79,86,89,attraction crushing endgame exposedKing interference rookEndgame veryLong,https://lichess.org/FsIrBiKO/black#88,
Qrn75,2kr3r/1pp1qp2/B1n4p/2Pp1bp1/Q2Pp3/2P1PN1P/P4PPK/2R2R2 b - - 0 18,e4f3 a4c6 b7a6 c6a8 c8d7 a8d5 d7e8 d5f5,2378,90,90,2558,advantage fork interference middlegame pin veryLong,https://lichess.org/p83b8Sui/black#36,Queens_Gambit_Declined Queens_Gambit_Declined_Marshall_Defense
QwfBG,1k4r1/pp4rp/2p4b/1P6/P3Bp1q/2P2Q2/5PPP/R4RK1 w - - 1 28,g1h1 g7g2 h2h3 g2g3 f2g3 h4h3 h1g1 g8g3,2329,100,78,46,crushing interference kingsideAttack middlegame sacrifice veryLong,https://lichess.org/3qXQySNw#55,
R1k0h,8/6k1/5pp1/P6p/4qP2/3p2P1/1Q5P/5K2 w - - 0 43,b2d2 e4h1 f1f2 h1h2 f2e3 h2g3 e3d4 h5h4,2312,78,73,262,crushing defensiveMove deflection endgame exposedKing interference queenEndgame veryLong,https://lichess.org/tsnqfbaj#85,
R2kmK,r1b1k2r/pp1p1ppn/2p1p3/2bPP3/2P2n2/2N2B1P/PP1KNqP1/R1BQ3R b kq - 3 13,f4g2 h1f1 g2e3 f1f2 e3d1 c3d1,2313,86,91,2010,advantage interference long opening,https://lichess.org/9ZdoXsTB/black#26,Mikenas_Defense Mikenas_Defense_Other_variations
R7QTM,2r3k1/3np2p/3p2p1/1N1P1p2/1P6/1Q2B1bP/P1rN2P1/6K1 w - - 2 29,b5d4 c2c3 b3b2 c3e3,2398,102,89,1404,advantage interference middlegame short,https://lichess.org/bFSbksc6#57,
R7la3,3r1b1r/kp1q1pp1/p7/2pNPnBp/1PP5/3P1Q1P/P5K1/R3R3 b - - 2 22,f7f6 e5e6 f6g5 f3f5,2386,92,80,189,crushing interference middlegame short,https://lichess.org/1HQKEdLM/black#44,
RCFHq,3R4/p1p2r1p/8/1p2k1Q1/4P3/8/PPq2r1P/K7 b - - 8 30,e5e4 g5d5 e4e3 d8e8 e3f4 d5f7 c2f5 f7f5 f4f5 e8f8 f5e4 f8f2,2332,78,81,215,attraction crushing endgame interference skewer veryLong,https://lichess.org/tpo73S6M/black#60,
RNp4o,2r1k2r/2q2pp1/3bp2p/pppnN2P/3P2P1/5QB1/PPP2P2/2KR3R w k - 0 21,e5f7 d6f4 g3f4 c7f7,2342,78,67,109,advantage interference intermezzo middlegame short,https://lichess.org/5JaOAm2b#41,
RTNJ8,r3k2r/pR2bppp/2p1p3/q2pP1N1/3P3P/3Q4/P2N1PP1/6K1 b kq - 0 21,h7h6 g5e6 f7e6 d3g6 e8f8 b7e7 f8e7 g6g7 e7d8 g7h8 d8c7 h8a8 a5d2 a8a7,2333,78,90,750,attraction crushing deflection interference master middlegame sacrifice skewer veryLong,https://lichess.org/eQxwIXyz/black#42,
Reggq,6kb/1q3p1p/p5p1/1p3nn1/4N3/P1PQ3P/BP3PK1/5R2 b - - 0 30,g5e4 d3d8 g8g7 a2d5 b7a7 d5e4,2394,87,88,1210,crushing interference long middlegame,https://lichess.org/0fky1wlh/black#60,
Rks8K,8/p3q1k1/1p1pPbpp/2rB4/5rP1/P2Q1P2/1P2R2P/1R4K1 w - - 1 28,b2b4 f4d4 d3a6 c5d5,2374,84,90,643,advantage interference middlegame short,https://lichess.org/ij4doMJ9#55,
RvwJc,3b1k2/2q2p2/Q3b3/4P3/3p2r1/5N2/P3BPPP/K2R3R w - - 0 24,f3d4 c7c3 a1b1 e6f5 e2d3 g4d4,2315,79,84,82,crushing interference long middlegame,https://lichess.org/rPRVltsj#47,
Rwdwe,5q1k/pp4r1/5p1p/P2p4/3P1Qbn/1NP5/1PB2K1P/R7 b - - 5 27,h4f3 c2d1 f3g5 d1g4,2310,91,24,28,advantage interference middlegame short,https://lichess.org/h60konp4/black#54,
Rwfv1,4r1n1/1Qpkr3/4q2p/6p1/2P1pp2/1P6/P5PP/4RR1K b - - 0 25,e7f7 e1e4 e6e4 f1d1 d7e7 b7e4,2359,81,87,65,advantage interference intermezzo long middlegame sacrifice,https://lichess.org/uRnUgauS/black#50,
S5NJY,r5k1/ppq2pbp/1n3np1/3PN1B1/2B3b1/2NQ4/PP3PPP/R5K1 w - - 1 16,a1e1 a8e8 g5f6 g7f6 c3e4 f6e5,2380,77,83,491,advantage interference long middlegame,https://lichess.org/6lUVVLhM#31,Caro-Kann_Defense Caro-Kann_Defense_Panov_Attack
SYcWV,2rkb1r1/qp4PQ/2n1p3/p2pP3/Pb1P3N/3BB3/1P3PK1/R7 b - - 2 31,e8f7 d3g6 b7b5 e3g5 d8c7 g6f7 g8g7 h7g7,2332,81,91,2974,crushing exposedKing interference middlegame trappedPiece veryLong,https://lichess.org/mKwwxrb8/black#62,
SgoVj,2k4r/pp6/4p3/4npB1/2p1p1b1/2Pr4/PPB2RPq/R3QKN1 w - - 1 21,g5f4 e5f3 g1f3 h2f4,2369,81,86,140,advantage interference master middlegame short,https://lichess.org/Gben2jdZ#41,
SxtA9,3r4/1p5r/1QnkB3/2pP4/5R2/8/PPPB1Kbq/4R3 w - - 1 30,d5c6 g2c6 f2e3 d6e6 f4f6 e6d7,2366,111,37,43,crushing defensiveMove discoveredAttack interference long middlegame,https://lichess.org/t9ef6jiY#59,
T5bhp,r1b2r2/1qk1R2p/p1pb4/3p2Q1/3P4/P1N5/1PP2PPP/4R1K1 b - - 8 25,d6e7 e1e7 c8d7 e7d7 c7d7 g5g7 d7c8 g7f8,2329,81,86,490,advantage attraction interference middlegame veryLong,https://lichess.org/fA7gNFoG/black#50,
T9dzd,1r4k1/1q2bppp/p7/8/2P3P1/2n2N1P/PB4Q1/2KR3R w - - 1 24,b2c3 b7b1 c1d2 b1a2 d2d3 a2g2,2358,85,95,247,advantage exposedKing interference long middlegame queensideAttack skewer,https://lichess.org/EdbnUqY2#47,
TMJF8,r5k1/1R3p2/2pBr1p1/p1P1pq1p/P1QnN3/4bP1P/6P1/1R5K b - - 2 34,d4f3 b1f1 e3f4 f1f3,2317,79,93,1805,crushing interference master middlegame short,https://lichess.org/mRmDffBW/black#68,
TXBXU,6kr/p1p2pp1/1bq2n2/6Np/8/3Q1PP1/PPP3KP/4R3 b - - 8 25,g7g6 e1e6 c6d5 e6f6 d5d3 c2d3,2331,82,82,79,advantage interference long middlegame,https://lichess.org/3kYo2UEK/black#50,
Thw2c,5k2/4q2p/p3b1pP/1p2Q2n/6B1/2N5/PPP5/2K5 b - - 1 26,e6g4 e5h8 f8f7 h8h7 f7e6 h7e7 e6e7 h6h7,2376,75,92,1030,advancedPawn crushing endgame exposedKing interference veryLong,https://lichess.org/uZYYTnT1/black#52,
Tj5TB,rn3rk1/3q1pp1/p2p1b1B/1p1P4/4P3/1N6/PP1QB2P/5RK1 b - - 1 20,d7h3 f1f6 g7f6 d2f4 b8d7 e2g4 h3h4 g4d7 h4f4 h6f4,2397,80,90,883,advantage interference middlegame sacrifice veryLong,https://lichess.org/0nmhIunJ/black#40,
Tzzc8,8/5k1r/3p2n1/1PpPp2r/1pP1P1Pb/1P3N1P/qB2K2R/6QR w - - 1 45,g4h5 g6f4 e2d1 a2b1 d1d2 b1b2,2334,77,97,74,crushing exposedKing interference long middlegame pin,https://lichess.org/kSXX83oR#89,
U3D1K,r4n2/1p2Q2p/3p2p1/2p5/4kp1B/pqP1n3/1P2R3/2K3R1 b - - 3 43,e4d3 e2d2 d3c4 e7e4 c4b5 e4b7,2378,83,54,103,crushing interference long middlegame,https://lichess.org/rJ1OhpW8/black#86,
UDHmv,rn2kb1R/ppN1qp2/4pppQ/3p4/3P4/5P2/PPP1r3/2KR4 b q - 1 17,e7c7 h8f8 e8d7 f8f7 d7c6 f7c7,2384,81,92,138,advantage deflection interference long middlegame skewer,https://lichess.org/9pOKbxWh/black#34,Caro-Kann_Defense Caro-Kann_Defense_Other_variations
UKH4g,r2qk2r/pb2bp1p/1p2p1pQ/2p1P3/3P4/3B4/PPPN2PP/R4RK1 b kq - 1 14,e7g5 d3b5 e8e7 h6g5,2317,75,90,91,crushing interference middlegame short,https://lichess.org/e4T3YTEg/black#28,French_Defense French_Defense_Knight_Variation
UOrGG,5rk1/p1pRnppp/8/2q5/2N1Q3/2P5/r5PP/5R1K b - - 1 20,e7f5 d7d5 c5c6 e4f5,2318,79,91,743,advantage interference middlegame short,https://lichess.org/3YGsFQJx/black#40,
UVIYq,8/P5R1/8/7p/4PKp1/7k/r7/8 b - - 2 45,a2a5 g7g5 a5a7 g5h5,2390,82,90,535,crushing endgame interference master rookEndgame short,https://lichess.org/4JxqfOss/black#90,
UWMOn,2k3r1/pp1b4/1q2pQ2/3p2r1/3P3p/PpP3P1/1P1N1PK1/1R2R3 w - - 0 28,d2f3 h4h3 g2g1 g5f5 f6h6 f5f3,2336,80,90,613,crushing interference long middlegame,https://lichess.org/grK4Skm0#55,
UbgO0,2kn2r1/1p2q3/pPp1b3/P1NpPp2/5P2/2PQ2Pr/5B1p/RR5K w - - 2 35,c5a6 d5d4 c3c4 b7a6,2372,83,85,195,advantage interference intermezzo middlegame short,https://lichess.org/1EqbQGQR#69,
Uixyn,7r/1bN4r/p2b1kp1/p2PN3/5P2/4P3/P4K2/2R3R1 b - - 2 33,d6c7 g1g6 f6f5 g6g5 f5e4 c1c4 e4d5 e3e4 d5e6 g5g6 e6e7 c4c7,2362,93,90,740,crushing interference middlegame veryLong,https://lichess.org/SVSpvsvJ/black#66,
UjVal,r3r3/pp1q2k1/2p3Np/3nPb2/3P3Q/P4pPn/1PBN1P1P/4RR1K b - - 6 30,f5g6 c2g6 g7g6 e5e6 e8e6 h4h3,2358,77,94,734,advantage interference long middlegame,https://lichess.org/LdlptAC9/black#60,
UpFTF,r3k1nr/pp3ppp/2B1b3/2bQ4/8/8/PPq2PPP/RNB1R1K1 b kq - 0 12,b7c6 d5c6 e8e7 c1g5 g8f6 c6b7 e7f8 b7a8,2392,94,42,34,crushing fork interference opening veryLong,https://lichess.org/surAM1zm/black#24,Sicilian_Defense Sicilian_Defense_Modern_Variations
Usudm,8/6B1/4r2p/5P1P/4k1K1/8/8/8 b - - 0 68,e6c6 f5f6 c6c7 g7h6 c7a7 h6g7,2348,84,90,458,crushing defensiveMove endgame interference long,https://lichess.org/SnQAaIEb/black#136,
UvhIp,2r1r2k/7p/3p4/4qp1P/3N1P2/bP6/P1P3P1/QK1R4 b - - 0 33,e5e1 d4e2 h8g8 d1e1,2343,77,89,77,advantage discoveredAttack interference middlegame short,https://lichess.org/A71yioX7/black#66,
UzMfU,2k1r1r1/Qp6/2pp2p1/4n3/4RBqp/1PP3P1/P4PKP/3R4 w - - 1 30,d1e1 g4f3 g2f1 f3h1 f1e2 h1e4,2300,78,97,138,crushing interference long middlegame,https://lichess.org/buOvVvAS#59,
V5UqT,r2r1k2/1bq2n1R/pp4Q1/2p5/P3P3/2P5/1P1R1PP1/4K3 b - - 0 25,d8d2 g6g7 f8e8 g7g8 e8d7 g8f7 d7c6 f7c7,2371,81,94,722,deflection exposedKing interference mate mateIn4 middlegame veryLong,https://lichess.org/bqccl1Dh/black#50,
VJFfK,r4rk1/pb1n1ppp/1p6/2pPP3/6Pq/1N1QbB2/PP5B/R2K3R b - - 1 22,h4g5 h2f4 g5g6 d3e3,2315,94,87,560,advantage interference middlegame short,https://lichess.org/AZKxYhT7/black#44,
VJahf,7r/nppkq3/3p1n2/pP6/P2PP3/1QP4p/5R2/1N3RK1 w - - 0 25,f2f6 e7g7 g1f2 g7f6,2302,81,90,530,crushing interference middlegame short,https://lichess.org/nn4QZPE0#49,
VOWil,1r6/5N1p/6p1/p4p1k/8/3n2P1/PP2RKQP/1q6 w - - 7 35,f2f3 d3e1 e2e1 b1d3 f3f2 b8b2,2337,80,71,142,clearance crushing endgame fork interference long sacrifice,https://lichess.org/aHFwvHHK#69,
VVpVm,r1b2rk1/pp3p1p/1bp2Rn1/3pP3/3P2q1/2N5/PPB3PP/R1B2Q1K b - - 4 17,b6d4 c2g6 h7g6 f6f4 g4h5 f4d4,2349,90,89,978,crushing interference long opening,https://lichess.org/H9867EWb/black#34,Ruy_Lopez Ruy_Lopez_Bird_Variation
VcFSZ,r4rk1/5ppp/p1qp1n2/1p3b2/3P4/1PN1PR1P/PB4P1/R2Q2K1 b - - 0 17,f5e4 f3f6 g7f6 d4d5 c6c5 c3e4 c5e3 e4f2,2351,82,80,228,crushing defensiveMove interference middlegame sacrifice veryLong,https://lichess.org/s067kj26/black#34,Nimzo-Larsen_Attack Nimzo-Larsen_Attack_Indian_Variation
VfIWc,r3k3/ppp2pp1/2p2q2/2P5/4P1b1/2P2B2/PP4pr/RNBQK1R1 w Qq - 0 15,f3g4 f6h4 e1e2 h4g4 e2f2 g4h4,2386,89,75,48,advantage exposedKing interference long middlegame,https://lichess.org/7ZfIBST3#29,Russian_Game Russian_Game_Stafford_Gambit
VlKg4,5r1k/p1p3Rp/2pp4/4p3/4Pq2/1P3P2/P1P2P1K/5QR1 w - - 1 23,h2h1 f4h6 h1g2 h6g7 g2h2 g7h6 f1h3 h6h3,2300,80,91,610,advantage endgame exposedKing interference veryLong,https://lichess.org/dgP5w5XK#45,
VtbGs,8/3Bk3/1K2P3/p3r3/P1P5/8/8/8 b - - 2 47,e5f5 c4c5 f5f3 b6a5,2332,96,90,424,crushing endgame interference quietMove short,https://lichess.org/cHGE2llC/black#94,
Vv1w4,5br1/1pB2k2/p1n1p3/3rPpp1/5QP1/8/PP3P2/4R1K1 w - - 0 30,f4c4 d5d4 c4b3 d4g4 g1f1 g8h8 b3b7 h8h1 f1e2 g4e4,2349,100,90,1038,advantage interference middlegame quietMove veryLong,https://lichess.org/Ot8DAyRD#59,
VvdvR,8/p3kqp1/2p1p3/1p4P1/2r1N1P1/PK1Q4/1P6/8 b - - 1 37,e6e5 d3d6 e7e8 d6b8 e8d7 b8a7 d7e6 a7f7 e6f7 e4d6 f7e6 d6c4,2359,75,99,119,attraction crushing endgame exposedKing fork interference veryLong,https://lichess.org/J9mubkI8/black#74,
VwKHL,8/5p2/4b1p1/6Rp/5P2/4K1P1/6k1/8 w - - 29 52,e3d4 e6g4 g5a5 g2g3,2363,102,89,524,crushing endgame interference quietMove short,https://lichess.org/6VJoahgE#103,
W3vjX,r4rk1/pp3ppp/2npb3/q7/2Nn4/P5B1/1P2QPPP/1K1R1B1R w - - 2 17,d1d4 a5f5 d4d3 e6c4,2384,82,87,103,advantage deflection interference middlegame pin short,https://lichess.org/Bgha5AnE#33,Scotch_Game Scotch_Game_Other_variations
W6RCx,r1b1k2r/p4pp1/4p2p/8/1QBP1B2/b3PN2/2K2PPP/q6R b kq - 0 18,a1h1 c4b5 c8d7 b5d7 e8d7 b4b7 d7e8 b7a8 e8e7 a8a7,2329,94,34,52,advantage attraction interference middlegame veryLong,https://lichess.org/cvhH8dnx/black#36,Queens_Gambit_Declined Queens_Gambit_Declined_Marshall_Defense
WV2Ny,2krr3/Qppq3p/8/3P1pp1/4nB2/8/PP3PPP/R4RK1 b - - 0 18,d7d5 a1d1 d5d1 a7a8 c8d7 f1d1,2387,96,90,1186,advantage interference intermezzo long middlegame sacrifice,https://lichess.org/dhSimk1i/black#36,Nimzowitsch_Defense Nimzowitsch_Defense_Scandinavian_Variation
WW3T9,r5nr/pp1k1ppp/4pq2/2Pp4/8/P3B1Q1/2P2PPP/1N3RK1 b - - 1 15,g8e7 e3g5 e7f5 g3b3 f6g5 b3b7 d7e8 b7a8,2353,104,66,33,advantage clearance interference middlegame sacrifice veryLong,https://lichess.org/L8FDQR1y/black#30,Caro-Kann_Defense Caro-Kann_Defense_Advance_Variation
WZ3EC,r1b1k1r1/ppp1qp1p/1b6/4p3/4N3/2P2Q2/PP4PP/2KR1B1R b q - 3 14,c8g4 e4f6 e8f8 f6h7 f8g7 f3g4,2390,88,87,282,advantage fork interference long middlegame,https://lichess.org/VpXKQABM/black#28,Kings_Gambit_Declined Kings_Gambit_Declined_Classical_Variation
WoN0F,2krr3/1q3p1p/p2b1Q1P/1p1R4/2p3P1/2P5/PPK5/3R2N1 b - - 3 27,e8e6 d5c5 c8d7 f6f7,2302,82,89,816,crushing interference middlegame pin short,https://lichess.org/tUKABA1c/black#54,
WoyLe,3r2k1/1b3ppp/p3pq2/1p2n3/8/P5QP/BP3PP1/R4RK1 w - - 2 24,a2b3 d8d3 f2f3 d3b3 a1e1 e5c6,2300,83,53,44,advantage defensiveMove interference long middlegame,https://lichess.org/rQbzjUdG#47,
Wwxoh,4rk2/3nqpR1/3p1n1p/p1bP1Q1P/5P2/1P6/1PP1B1R1/1K6 b - - 0 30,e7e2 g7f7 f8f7 f5g6 f7e7 g2e2,2307,76,87,171,attraction crushing interference long middlegame sacrifice,https://lichess.org/YYsaCtGA/black#60,
WxU8g,1r3rk1/p1pn1ppp/Q2b4/7n/2BP4/2N1Bq2/PPK2P1P/R5R1 b - - 1 16,d6f4 c4e2 f3h3 e2g4 h3h4 g4d7,2354,162,58,11,crushing interference long middlegame,https://lichess.org/AjtL6YEC/black#32,French_Defense French_Defense_Orthoschnapp_Gambit
XLTJR,3r1r1k/1p1bq2n/p5R1/4pp1Q/8/PBP4R/1P3PP1/7K b - - 3 28,f5f4 b3e6 d7e6 h5e5 f8f6 g6f6,2357,101,83,34,crushing exposedKing interference kingsideAttack long middlegame pin sacrifice,https://lichess.org/Eo0J7FpQ/black#56,
XNXNo,8/3nbpk1/2p2nq1/1pPp4/1P1Pp3/2N1P3/2K1B2Q/2B5 b - - 3 28,f6g4 h2c7 e7g5 e2g4,2396,92,90,1098,advantage interference middlegame short,https://lichess.org/jFAihNdH/black#56,
XSH9u,2r1r1k1/5p1p/p3p1p1/1p1b3q/3Q4/P3B3/1nB2PPP/2R1R1K1 b - - 5 25,b2c4 c2d1 h5f5 e3h6 e6e5 d4d5,2309,78,87,299,advantage interference long middlegame quietMove,https://lichess.org/Ad4oRcDp/black#50,
XShhI,4rrk1/ppqn2pp/2p1Rpn1/3p4/3P4/2PQ1NP1/PP1N1PP1/R5K1 w - - 1 16,a1e1 d7e5 d4e5 e8e6,2300,77,92,3145,advantage interference master middlegame short,https://lichess.org/H0rYAoWV#31,French_Defense French_Defense_Exchange_Variation
XWfr4,r1b2rk1/ppp1bppp/4p3/8/3P1PN1/2PBB3/PP4qP/R2QK2R w KQ - 0 13,h1g1 e7h4 g4f2 g2g1 e1d2 g1d1,2315,83,87,407,advantage exposedKing interference long opening,https://lichess.org/MPWIpmqy#25,French_Defense French_Defense_Other_variations
Xe4on,3r2k1/p1pr4/2p2p2/2p1pPpp/2P1P1q1/1P1P4/P3N1Q1/3R1K1R w - - 2 32,g2f2 d7d3 d1d3 d8d3 f2g2 d3f3 f1g1 g4e4,2303,77,76,66,advantage exposedKing interference middlegame veryLong,https://lichess.org/CfZkEUcl#63,
XnZyX,3r2k1/pr3ppp/3p4/1N2p3/2B5/3P1P2/P4P1P/R5K1 w - - 2 20,a1b1 d6d5 c4b3 b7b5,2320,177,43,12,advantage endgame interference short,https://lichess.org/p8eHheGl#39,
Y2YlL,5rk1/pp2b2p/3p2p1/3Ppp1n/3pP3/qP1P1NPP/P2QBP2/2R3K1 w - - 0 19,f3g5 e7g5 d2g5 h5f4 g3f4 a3c1,2343,78,92,250,advantage interference long middlegame,https://lichess.org/DC8DN0Kj#37,
Y6gyB,r6r/pp1b1k1p/3b3Q/3Pp1p1/3P4/4q1P1/P5BP/5R1K b - - 3 26,f7e7 h6f6 e7e8 f6h8,2304,80,76,93,crushing interference middlegame short,https://lichess.org/1myfdqZU/black#52,
YDfBW,r1r3k1/6p1/1q2ppQ1/3p2p1/3P4/2P3PR/p1P2PK1/3R4 b - - 1 27,b6b1 h3h7 b1b7 d1h1 g8f8 h7h8 f8e7 g6g7,2341,80,90,993,crushing deflection endgame interference quietMove veryLong,https://lichess.org/2TEEQrH2/black#54,
YFG1v,2r2k2/1p1R1p1p/1q1P2p1/p7/P7/2bn4/Q4PPP/R5K1 b - - 0 22,b6f2 a2f2 d3f2 d7c7 c8d8 c7c3,2386,76,85,232,advantage interference long master middlegame,https://lichess.org/JRxKHUbM/black#44,
YMfbJ,2r5/1b2Qp1k/4N2p/p2pqP2/7P/4K3/P5B1/4R2R w - - 0 31,e3f2 c8c2 f2g1 e5e1 g1h2 e1e5,2354,85,90,307,advantage deflection exposedKing interference long middlegame,https://lichess.org/76WFyHEx#61,
