PuzzleId,FEN,Moves,Rating,RatingDeviation,Popularity,NbPlays,Themes,GameUrl,OpeningTags
CE3QI,rnb1k2r/pp3ppp/4pn2/2bP4/3NP3/2N1BP2/Pq4PP/R2QKB1R w KQkq - 0 10,c3a4 c5b4 e3d2 b2d4,2344,76,91,219,advantage deflection interference middlegame short,https://lichess.org/uHSVh5DQ#19,Sicilian_Defense Sicilian_Defense_Prins_Variation
CEsAv,2rq1k2/p2r3p/6p1/1R2Qp2/1p1P4/2P5/PP2R3/1K6 b - - 9 40,b4c3 e5h8 f8f7 h8h7 f7f6 e2e6 f6e6 h7g6 d8f6 b5e5 e6d6 g6f6,2300,84,90,484,attraction crushing deflection endgame exposedKing interference sacrifice veryLong,https://lichess.org/L3CpVmOH/black#80,
CFunM,r3r1k1/2n2ppp/3q4/pp2PQ2/2pp4/3B4/PP3PPP/3R1RK1 b - - 0 29,d6e5 f5h7 g8f8 d1e1 e5e1 h7h8 f8e7 f1e1 e7d6 e1e8,2309,83,90,2161,advantage interference intermezzo kingsideAttack middlegame sacrifice veryLong,https://lichess.org/X1StwbXA/black#58,
CIeCv,8/8/8/5p2/5Pk1/r2K4/8/5R2 w - - 17 54,d3d4 a3f3 f1a1 g4f4,2392,80,74,89,crushing endgame interference rookEndgame short,https://lichess.org/ihiwkZMh#107,
CNLXG,4r1r1/5ppk/p1bb1q1p/1pp2P1Q/3pP3/PP1P3P/2PBN1R1/6RK w - - 0 27,h3h4 c6e4 d3e4 e8e4 d2g5 f6f5,2306,90,87,55,advantage capturingDefender interference long middlegame pin,https://lichess.org/Nt8titsV#53,
Cbsnp,1r2r3/q1k2p2/3pp1p1/2pP2Pp/4BP2/P1Q4b/4R3/K3R3 w - - 0 34,c3h3 a7a4 h3c3 b8b3 c3f6 b3a3,2394,83,34,54,advantage interference long middlegame,https://lichess.org/DNmkuB6F#67,
CgRLp,r3brk1/1ppnq1pp/p6N/3p1p2/Pb1QN3/1P3P2/1BP3PP/R4RK1 b - - 3 19,g7h6 d4h8 g8f7 h8h7 f7e6 h7h6 d7f6 e4f6,2315,98,87,1035,crushing deflection interference kingsideAttack middlegame veryLong,https://lichess.org/KlH7thtx/black#38,Queens_Pawn_Game Queens_Pawn_Game_Other_variations
CiBTu,2rk3r/q3bQ1p/pN2R3/3p4/1p1pb3/8/PPP4P/1K1R4 b - - 3 27,c8c2 e6e4 d5e4 d1d4 d8c7 f7e7,2302,114,86,31,crushing deflection exposedKing interference long middlegame,https://lichess.org/uZEgT0Hf/black#54,
CnjAK,2r4r/1p1kb3/p3pp1n/3p3Q/2q4p/P1N4P/1P3PPB/2RR2K1 b - - 3 22,h6f5 c3d5 h8h5 d5f6 d7c6 c1c4 c6b5 c4c8,2386,94,90,1527,crushing doubleCheck interference middlegame sacrifice skewer veryLong,https://lichess.org/4NFvSL9g/black#44,
Cnyty,r5k1/p5pp/b1pqpr2/3pN3/N1P2nP1/1P1PQ3/P4P1P/4RR1K w - - 1 22,a4c5 d5d4 e3e4 d6c5 e5d7 c5d6 d7f6 g7f6,2361,90,87,500,advantage interference middlegame veryLong,https://lichess.org/eL63hgU9#43,
CpLew,2kr4/ppp2ppp/2nr4/4n1N1/4P3/2P1B3/PPQ1BP1q/R3KR2 w Q - 6 18,f2f4 h2g3 e3f2 g3f4,2344,86,81,45,advantage deflection fork interference master middlegame short,https://lichess.org/Vj8u7UjV#35,Englund_Gambit_Complex Englund_Gambit_Complex_Hartlaub-Charlick_Gambit
Ct3QZ,r4rk1/1bppq1pp/np6/3P1pN1/1PP1p2P/4P3/1Q2BPP1/R2R2K1 b - - 1 19,a6b4 a1a8 b7a8 d5d6 c7d6 b2b4,2356,87,90,2514,advantage interference long middlegame,https://lichess.org/iWOAHKDw/black#38,English_Defense English_Defense_Other_variations
CuOND,r4rk1/p1q3pp/1nb3P1/2p2P2/p2pP3/3P1N1Q/1PP3B1/R1B1b1K1 b - - 0 27,h7g6 f3g5 f8f6 h3h7 g8f8 h7h8 f8e7 h8g7,2337,95,89,1558,crushing deflection interference kingsideAttack middlegame veryLong,https://lichess.org/FfOl8RcF/black#54,
CzxcG,2r2kr1/5pb1/3pn2p/3qp2Q/7P/2PB1R2/PP3PP1/2K5 b - - 1 25,f8e7 h5f7 e7d8 f7g8 d8c7 g8f7,2399,82,92,1234,advantage interference long master middlegame,https://lichess.org/Eb3YifVb/black#50,
D8BNi,4rk2/1p1b2p1/p1q2r1p/2PBRp1Q/1P1p4/6P1/P3R2P/6K1 b - - 1 30,c6b5 c5c6 e8e5 c6d7 e5e2 d7d8q,2361,81,90,1299,advancedPawn crushing interference long middlegame promotion sacrifice,https://lichess.org/RK1zML9o/black#60,
DEGG8,2k3r1/Qpr3q1/p3b3/8/2P1B3/8/P4PPP/1R4K1 b - - 8 28,e6c4 e4f5 c8d8 a7b8 d8e7 b8c7,2311,78,94,544,crushing deflection interference long middlegame,https://lichess.org/M8cmGgxW/black#56,
DFdgp,1r4k1/2p2pp1/p2brn1p/3pp3/4P2q/1P1P1Q2/P2N1P1N/R1B1R1K1 w - - 2 22,e4d5 e5e4 f3g2 f6d5,2359,77,75,128,advantage interference intermezzo master middlegame short,https://lichess.org/tPMelVxu#43,
DNIDA,3rrk2/1b1n1p2/p1q5/1p2p1Q1/2p1P3/2P4R/PPB2PPP/3R2K1 b - - 4 25,d7f6 h3h8 f8e7 g5e5 c6e6 e5c5,2397,87,99,165,crushing interference long middlegame,https://lichess.org/pIaLlIhT/black#50,
DQDgx,8/8/3Q2k1/5p1p/8/3K1PP1/8/7q b - - 8 51,g6g5 f3f4 g5g4 d6g6 g4h3 g6h5 h3g2 h5h1 g2h1 d3d4,2319,89,74,47,crushing defensiveMove deflection endgame interference queenEndgame veryLong,https://lichess.org/ojlVGefJ/black#102,
DRZgt,r2q1r2/p5kp/2p3p1/1p1b2N1/3Pp3/1P6/P2Q1PPP/2R2RK1 w - - 0 21,c1c6 f8e8 c6c5 e4e3 f2e3 d8g5,2349,113,56,26,advantage interference long middlegame quietMove,https://lichess.org/J3J4Vvk9#41,
DRkhO,8/pp4Qb/2p5/4N1k1/3Pq3/2P5/P7/6K1 b - - 0 40,g5f4 g7h6 f4f5 h6h7,2309,78,92,4937,crushing endgame interference master short,https://lichess.org/pGXNAY9F/black#80,
DXcmX,3q4/1ppP2Q1/1p1kPn1p/7b/3r1r2/1P4P1/P6P/R3R1K1 b - - 0 31,f4g4 e6e7 d8d7 g7f6 d6c5 e1e5,2327,100,89,917,advancedPawn crushing exposedKing interference long middlegame,https://lichess.org/QIImJYFg/black#62,
Dav6a,1q3br1/4kp2/p2p1p2/3B3p/2Q1P3/5PP1/Pr5P/R4RK1 w - - 0 22,d5f7 d6d5 c4c5 e7f7 c5d5 f7g7,2369,75,94,2145,advantage defensiveMove interference long middlegame,https://lichess.org/PFIqfRZ3#43,
Dd3Tl,4r1k1/3q1p1p/1pp2pn1/4B1NQ/r2P4/2P5/6PP/4R1K1 b - - 1 28,f6e5 h5h7 g8f8 e1f1 g6f4 h7h8 f8e7 h8e5,2389,79,76,270,advantage interference middlegame veryLong,https://lichess.org/Ti6CTAGz/black#56,
DgvWw,8/5Qpk/3B3p/8/P7/1P1p3P/5PPK/4q3 w - - 0 36,d6e5 e1e5 g2g3 e5f6 f7d5 f6f2,2300,77,91,1489,crushing endgame hangingPiece interference long,https://lichess.org/pMkPzGRv#71,
DpuFE,8/8/8/KP5k/2B5/6p1/1P3p2/8 w - - 0 64,b5b6 g3g2 b6b7 g2g1q b7b8q g1a1 a5b6 a1b2 b6a7 b2a3,2320,78,85,70,advancedPawn bishopEndgame crushing endgame interference master promotion veryLong,https://lichess.org/jiuUwYbc#127,
E02rL,3r1rk1/pbq2pb1/5npp/2p1N1Q1/8/P1N4P/BPP2PP1/3RR1K1 w - - 0 21,g5g3 d8d1 c3d1 f6e4 g3g6 c7e5,2311,82,89,856,advantage interference long middlegame,https://lichess.org/XmuucpcG#41,
E1d3F,r3k2r/p2pppb1/Bp3np1/7p/N2Nq1P1/2B3K1/P4P1P/1R1Q3R w kq - 0 19,a6d3 h5h4 g3h3 f6d5 c3d2 e4d3,2325,76,87,102,advantage interference long middlegame,https://lichess.org/MhyDjSOF#37,
E81f4,4rbk1/3b1pp1/3p1q1p/2pP1P2/1pB1P3/6QP/rP1B2P1/1R3RK1 b - - 3 23,a2b2 e4e5 e8e5 b1b2,2350,82,91,7039,advantage interference intermezzo middlegame short,https://lichess.org/zRhQCyhy/black#46,
EKvHB,1r2k3/pp5p/2qp1p1b/3N1P2/2nPP1r1/P7/2P2Q2/1R3R1K b - - 1 30,g4e4 d5f6 e8d8 d4d5 c6c5 f6e4,2335,82,89,1995,advantage fork interference long middlegame,https://lichess.org/N6tcxGhI/black#60,
EV052,6r1/8/5R1k/p1p4p/3p4/3Q1Pq1/PPP5/5K2 b - - 7 40,h6g5 f6f5 g5h6 f5h5 h6h5 d3h7 h5g5 h7g8,2359,94,71,53,attraction crushing endgame interference sacrifice veryLong,https://lichess.org/3HPWsaJv/black#80,
EtPhM,r3k2r/p2bppbp/1q4p1/4P1B1/8/1B6/PpP1Q1PP/1R3R1K b kq - 0 18,e7e6 f1f7 e8f7 e2f3 f7g8 f3a8,2329,79,85,258,attackingF2F7 attraction crushing interference long master middlegame sacrifice,https://lichess.org/3ctsCUfn/black#36,Modern_Defense Modern_Defense_Standard_Defense
EzIAb,3qQ1rk/pb5p/5p2/1pp2N2/8/P2P3P/1PP2P2/4RK2 w - - 2 29,e8h5 b7g2 f1e2 g8g5 h5f7 g5f5,2323,75,92,3769,advantage endgame interference long,https://lichess.org/HvtaYOBe#57,
F0nep,7r/8/3N1p2/6k1/6Pp/2PQ4/PP3qP1/1K6 b - - 2 46,g5g4 d3g6 g4f4 g6f6,2312,79,90,1325,crushing endgame interference master short,https://lichess.org/OQHnCnuH/black#92,
F1ftG,2k1r3/pp6/2p3q1/4Bp2/2P3r1/P4Q1p/1P3PP1/3RRK2 w - - 0 32,g2h3 g4g1 f1e2 e8e5 e2d2 g1e1 d1e1 g6d6 d2c2 e5e1,2341,94,90,217,advantage deflection interference middlegame veryLong,https://lichess.org/vqMwNg8F#63,
F5aCc,8/8/p5p1/2P2p2/4q2k/P5p1/3R4/2QK4 w - - 9 49,c5c6 e4h1 d1c2 h1c6 c2b1 c6c1,2372,77,92,1540,crushing endgame exposedKing interference long,https://lichess.org/BVbdILQm#97,
F5vqm,3r2k1/p4p2/1rp2P1p/3qPRp1/P1pp4/1P4Q1/2P3PP/3R2K1 b - - 1 27,c4b3 f5g5 h6g5 g3g5 g8f8 g5g7 f8e8 e5e6 d5e6 g7g8 e8d7 d1d4,2374,100,90,510,crushing endgame interference kingsideAttack sacrifice veryLong,https://lichess.org/bzDzxtwF/black#54,
F8JsQ,8/p3qk2/2p2b2/3p4/2Q5/8/PPP2RP1/2KN3r w - - 0 30,c4c6 e7e3 f2d2 h1d1 c1d1 e3g1 d1e2 g1g2,2347,80,93,2509,attraction crushing endgame interference pin sacrifice veryLong,https://lichess.org/8fYY6YsW#59,
FOF1T,rnbqk2r/ppp4p/4pp2/3nN1B1/1b1P4/2N5/PP3PPP/R2QKB1R b KQkq - 1 10,f6g5 d1h5 e8e7 h5g5 e7d6 e5f7,2355,100,77,31,crushing exposedKing interference long middlegame,https://lichess.org/ykilHVti/black#20,Queens_Gambit_Declined Queens_Gambit_Declined_Marshall_Defense
FQ5LY,r1b2rk1/p6p/1p3pq1/2pQ4/2P5/4P3/PB1P2P1/RN4K1 b - - 1 18,g6f7 d5a8 c8b7 a8a7 f7g7 e3e4,2342,78,90,1152,advantage defensiveMove hangingPiece interference long middlegame,https://lichess.org/w7aHkZVJ/black#36,Zukertort_Opening Zukertort_Opening_Sicilian_Invitation
FYVu4,6k1/pb5p/1p2p3/3pPp2/4rP1q/5QrP/PP2B1P1/3R1RK1 w - - 8 29,f3f2 d5d4 e2f3 e4f4 f3b7 f4f2,2372,90,83,36,crushing interference long middlegame quietMove,https://lichess.org/yMCNAtRr#57,
Fcjyd,1B4k1/3p1p1p/b7/p2N3K/3q3b/3P4/P1Q3B1/8 b - - 2 42,a6d3 c2c8 g8g7 b8f4 d3e2 h5h4,2311,90,72,30,advantage interference long middlegame quietMove,https://lichess.org/yMPtli0a/black#84,
FdBWA,7r/4kppp/2pbpnb1/2p5/q1p1P2P/3P1P2/PB2Q1P1/1K1R2NR w - - 0 17,d3c4 f6e4 f3e4 g6e4 d1d3 a4c4,2362,75,97,145,crushing interference long middlegame pin queensideAttack,https://lichess.org/ANIfhJcb#33,Vant_Kruijs_Opening Vant_Kruijs_Opening_Other_variations
FiXOw,8/p2R4/6pk/4P3/3P1P2/P3KQP1/8/1q5r w - - 11 41,f4f5 h1e1 e3d2 b1c1 d2d3 c1a3,2363,83,80,65,crushing endgame interference long,https://lichess.org/YJJfQ5T0#81,
Finld,8/p6r/4k2P/R7/6K1/8/8/8 b - - 0 39,e6f6 a5a6 f6f7 a6a7 f7g6 a7a6,2343,82,83,104,crushing endgame exposedKing interference long rookEndgame,https://lichess.org/4MJIUO2N/black#78,
FnM4c,r1b2r1k/4nppp/4p3/3pP3/p1pP1PN1/q1P3QP/P3B1P1/R4RK1 w - - 3 24,e2d1 a3b2 d1f3 b2c3,2308,78,89,834,advantage interference middlegame short,https://lichess.org/L9ZiB0Ja#47,
Fovo9,r6r/pp1k2pp/4p3/4Pq2/3p3P/BQ1b4/4R3/2K2B2 b - - 1 34,d3e2 b3b7 d7d8 b7a8 d8c7 a8a7,2368,78,69,104,advantage interference long middlegame,https://lichess.org/5sn2U1p9/black#68,
G3g2x,8/8/4p3/3p1kp1/3P2R1/4PK2/r4P2/8 w - - 2 57,f3g3 a2e2 f2f3 e2e3 g3f2 e3e4 g4g1 e4d4,2358,123,85,22,crushing endgame interference rookEndgame veryLong zugzwang,https://lichess.org/4bJYqvuf#113,
G3xcx,1n4k1/2p3p1/1pP2q1p/pP1pN3/4brP1/6QP/8/2R1R1K1 w - - 2 40,e5d3 f4f3 g3e5 f3d3 e5f6 g7f6,2316,83,90,583,crushing interference long middlegame,https://lichess.org/sRR8Zh5E#79,
GGfRp,r6N/pppk1Bpp/8/2qpp1B1/4P1nP/3P3b/PP1K3P/nN1Q3R w - - 0 17,d1f3 c5c2 d2e1 c2b1 e1e2 b1b2 g5d2 a1c2,2385,86,81,124,crushing defensiveMove interference middlegame veryLong,https://lichess.org/Y1CBIHxR#33,Italian_Game Italian_Game_Two_Knights_Defense
GIrcW,r4r2/pp3p1k/7p/q2pP2P/2p1nQ2/P1P1P3/5P1P/R3KBR1 w Q - 3 21,f1h3 a5c3 e1e2 c3b2 e2f1 b2a1,2399,95,89,343,crushing fork interference long master middlegame,https://lichess.org/wTjUfwoI#41,
GMLk4,r4rk1/1bq1bppp/1p2p3/p3n3/Q2RPB2/2N3P1/PP3PBP/3R2K1 b - - 1 17,a8d8 f4e5 c7e5 d4d7 b6b5 a4a5,2380,94,-4,34,crushing fork interference long master masterVsMaster middlegame superGM,https://lichess.org/SijAY0Sm/black#34,Catalan_Opening Catalan_Opening_Closed
GMUyc,r2qr1k1/1pp3p1/pbn1p2p/3np3/2B5/1QPP1N2/PP3PPP/R1B1R1K1 w - - 0 14,f3e5 b6f2 g1f2 d8h4 f2e2 c6e5,2396,86,62,121,advantage attraction interference kingsideAttack long opening sacrifice,https://lichess.org/X0FWSQsd#27,Bishops_Opening Bishops_Opening_Berlin_Defense
GO69H,6k1/p6p/1p4p1/4pq2/P2p4/1P2Br2/2PKQ2P/1R6 w - - 0 29,e3g1 f5g5 d2d1 g5g1,2339,83,83,118,crushing endgame interference master short,https://lichess.org/uRpeyTC3#57,
GQhNW,r4rk1/p2n1pbp/1p1Np1p1/4q3/8/1B3R2/PP4PP/3R1Q1K b - - 5 21,e5b2 d6c4 d7e5 c4b2,2311,78,84,70,advantage interference middlegame short trappedPiece,https://lichess.org/bAFiBVYE/black#42,
GVUu8,r4rk1/pp1b4/4p2p/q1Pp1p2/6pN/PnPB2B1/3Q1PPP/R3K2R w KQ - 2 19,d2h6 a5c3 e1e2 c3b2 e2d1 b2a1,2365,77,93,1268,advantage fork interference long middlegame,https://lichess.org/0h6e5Tft#37,
GgY3J,4rrk1/p1p3pp/bb3p2/1P1p4/5P2/3Q1Nq1/PBPN2PR/3K4 b - - 2 25,a6b5 d3h7 g8f7 f3g5 f7e7 h7g7,2315,93,87,119,crushing deflection interference kingsideAttack long middlegame,https://lichess.org/teoi8ljA/black#50,
H37uJ,6r1/5RP1/2p1Pn2/2k2p2/P4P2/8/4K3/8 b - - 2 53,f6e8 f7f5 c5d6 f5f8 g8g7 f8e8,2387,89,89,498,advantage endgame interference long master,https://lichess.org/358V1naT/black#106,
HGl9Z,3k3r/p1p3pp/2p2n2/3pq2b/7P/3P1P2/P3NKP1/R2Q3R w - - 3 21,d1a4 f6g4 f3g4 h8f8 f2g1 e5a1 g1h2 a1e5,2327,86,9,51,crushing interference middlegame sacrifice veryLong,https://lichess.org/Nlrc73RF#41,
HRgx1,2r1r1k1/1q1p1pbp/Rp1B2p1/3bP3/3N4/1P5P/1PP2PP1/3QR1K1 w - - 3 19,d4b5 b7a6 d1d5 c8c5 d6c5 a6b5 b3b4 b6c5,2340,98,90,2386,advantage interference master middlegame veryLong,https://lichess.org/4CSwpRzV#37,Sicilian_Defense Sicilian_Defense_Accelerated_Dragon
Hdhuh,5kr1/pp5Q/5P2/7K/3P2P1/2P1r3/P4q2/3R3R w - - 3 39,f6f7 g8g7 h7h8 f8f7,2316,81,83,288,advantage endgame interference short,https://lichess.org/VCvWwpUI#77,
Hgs3M,r3rbk1/1pq2p2/p2p2p1/3P2Pp/1P1N1QnP/2B5/1PP5/2KR1R2 b - - 8 25,g4e3 d4e6 f7e6 f4e3,2333,78,86,143,crushing interference master middlegame short,https://lichess.org/Wlx5ZMAI/black#50,
HjY4V,4r1k1/q4p1p/p2p1BpQ/2p5/2Pnr1P1/1P5P/2P2R2/R5K1 b - - 3 27,e4e1 g1h2 d4e6 a1e1,2309,82,91,383,advantage defensiveMove interference master middlegame short,https://lichess.org/970WqDEb/black#54,
HlNCk,3Q4/p4ppk/4p2p/4N3/4bP2/P7/1P4PP/2qN3K w - - 0 32,e5f3 e4d5 d8h4 c1d1,2368,75,79,167,crushing endgame interference pin short,https://lichess.org/Vei19Tth#63,
Hmjzo,5rr1/1b1pkp2/pp2p3/5p1B/2q1PQ1P/5P2/P1P5/3R1R1K b - - 3 25,g8h8 f4d6 e7f6 e4e5 f6g7 f1g1 g7h7 h5g6 h7h6 d6d2 f5f4 g6e4 b7e4 d2f4 h6h7 f3e4,2381,101,76,44,advantage interference middlegame sacrifice veryLong,https://lichess.org/bOQtngeG/black#50,
Ho2I0,3r2k1/5pp1/8/P1n5/7P/3p1K2/3Q1PP1/8 w - - 7 38,g2g4 c5b3 d2e1 d3d2 e1d1 b3a5,2346,96,86,35,advancedPawn crushing endgame interference long,https://lichess.org/YOs1cFMZ#75,
Hsvnv,r2q1rk1/ppp3pp/1bp5/3nN3/3P1pP1/2P2P1P/PP3B2/RQ3RK1 w - - 0 16,c3c4 d5e3 c4c5 d8d4 c5b6 d4e5,2309,80,90,1176,advantage discoveredAttack interference long middlegame,https://lichess.org/0Ov2FQKM#31,Ruy_Lopez Ruy_Lopez_Classical_Variation
HwMu6,6k1/pR4pp/1p3qn1/3B4/P2p4/2P4P/1P4PB/6K1 b - - 0 30,g8h8 b7b8 g6f8 h2e5 f6e7 c3d4,2337,80,85,96,crushing endgame interference long,https://lichess.org/SznGUQJ8/black#60,
I23yw,r2q1rk1/pp4bp/2n3p1/3N1p2/2P1p3/1P2QN2/P4PPP/2R2RK1 w - - 0 19,f3g5 f5f4 e3e4 d8g5,2314,75,94,3575,crushing interference master middlegame short,https://lichess.org/4swGfcll#37,Scandinavian_Defense Scandinavian_Defense_Richter_Variation
I5xai,r2qk2r/p6p/3Ppnp1/1pQ3B1/3p4/8/PPP2PPP/R5K1 b kq - 2 18,h7h6 g5f6 d8f6 c5c6 e8f7 c6b7 f7g8 b7a8,2349,83,80,54,crushing exposedKing fork interference middlegame veryLong,https://lichess.org/X56bmbSn/black#36,Philidor_Defense Philidor_Defense_Exchange_Variation
I5yvT,8/6B1/p2b2p1/1p1k1p2/6P1/P2K1P2/1P6/8 w - - 1 39,g7f6 f5g4 f3g4 d6e5 f6d8 e5b2,2366,91,89,897,bishopEndgame crushing endgame interference long,https://lichess.org/IgUdD2H6#77,
I75lM,q5k1/5p2/3P2p1/2pb1nNp/2B2P2/r3B2P/6PK/1R2Q3 b - - 0 29,f5e3 c4b3 d5b3 e1e3,2356,115,85,40,crushing interference intermezzo middlegame short,https://lichess.org/Zg21ZPl5/black#58,
I80OX,r4r2/1p3pk1/p1p1b1p1/8/3p2q1/1B1Q1R2/P1P3PP/4R1K1 b - - 3 24,a8e8 e1e4 g4g5 d3d4 g7g8 e4h4,2306,77,85,190,advantage defensiveMove interference long middlegame,https://lichess.org/SkzjNtbX/black#48,
IFkIN,rn1qkb1r/1b5p/p3BppN/1pn1p1B1/6Q1/2N5/PPP2PPP/R3K2R b KQkq - 0 14,f6g5 e6f7 e8e7 g4g5 e7d7 e1c1,2312,84,91,1297,castling crushing discoveredAttack exposedKing interference intermezzo long middlegame,https://lichess.org/NSix9gYe/black#28,Sicilian_Defense Sicilian_Defense_Modern_Variations
ILZHQ,6k1/pp2p3/1q2P1p1/n2P4/2r5/3Q4/P4PP1/K2R4 b - - 3 29,c4g4 d3f3 b6b4 d5d6 g4f4 d6e7,2323,117,0,26,advancedPawn advantage endgame interference long master,https://lichess.org/s3loM1XW/black#58,
IMEy7,8/4r1kp/p1p1Bbp1/2P5/2Q5/6P1/P2q3P/5RK1 w - - 5 32,e6g4 d2e3 g1g2 e7e4 c4a6 e4g4,2330,88,90,2142,advantage endgame interference long master,https://lichess.org/hUtmuZFg#63,
IT1ge,r1b2k2/pp2rppB/8/2Q4R/7P/4Pq2/Pp3P2/1K4R1 b - - 0 23,f3f2 h7c2 f2g1 b1b2 g7g6 h5h8 f8g7 c5d4 f7f6 d4d8,2332,108,87,40,advantage interference middlegame quietMove sacrifice veryLong,https://lichess.org/XeAn5yLH/black#46,
IieiY,3r1rk1/pb1qpp2/1pn3pQ/2p1P3/8/2PB4/PP1N1PPP/2R1R1K1 b - - 0 18,d7d3 d2e4 f7f6 h6g6,2384,76,93,2727,crushing interference kingsideAttack master middlegame short,https://lichess.org/dsE9AsXs/black#36,Trompowsky_Attack Trompowsky_Attack_Other_variations
In4tK,r6r/p3kppp/2Qbp3/3p4/7q/2N1BPP1/PPP4P/R6K b - - 0 17,d6g3 c3d5 e6d5 e3c5 e7d8 c6a8,2364,80,90,796,advantage interference long middlegame sacrifice,https://lichess.org/UhGowxB6/black#34,Sicilian_Defense Sicilian_Defense_Open
Io4qX,7k/pp4r1/n3pBQ1/2p5/2P1K1P1/P7/2B3q1/R7 w - - 5 34,e4e5 g2h2 e5e4 h2c2 e4e3 c2g6,2387,78,91,3567,crushing interference long middlegame skewer,https://lichess.org/7wpqYAw8#67,
Iwlul,r3k3/pp2b1p1/3q1p2/2pN2rp/4P2N/2PP3b/PP2Q1P1/2R2R1K b q - 3 25,d6g3 f1f3 h3g4 f3g3,2314,87,90,666,crushing interference middlegame short,https://lichess.org/faIhBSPe/black#50,
J324n,4rRk1/7p/p1p3q1/1p1p1R1p/1P1P3r/P1P2QP1/4p1K1/8 b - - 1 35,g8g7 f5f7 g7h6 f8e8 h4e4 e8e4 g6e4 f3e4 d5e4 g2f2,2368,77,94,2384,crushing endgame interference veryLong,https://lichess.org/0KirgUOp/black#70,
J4xzm,2r5/8/p4k2/5p2/5K2/2P5/P1P5/6R1 w - - 6 31,g1g3 c8c4 f4f3 c4c3 f3f4 c3c4,2396,104,90,780,crushing endgame interference long rookEndgame,https://lichess.org/Jptfc4tS#61,
JDTQI,2kr3r/ppp3bp/4qnp1/8/N3pP2/4Q2P/PPP3P1/1R2R1K1 b - - 0 19,e6a2 e3a7 a2d5 b1d1 d5d1 a7a8 c8d7 e1d1 d7e7 d1d8,2388,87,80,70,crushing interference intermezzo middlegame queensideAttack sacrifice veryLong,https://lichess.org/PFAGGlVu/black#38,Nimzowitsch_Defense Nimzowitsch_Defense_Declined_Variation
JHetN,3r4/3b1kbr/p2Q4/np3pq1/8/4R3/PPP2PPP/1K2R3 b - - 7 22,d7c8 e3e7 f7g8 d6d8 g7f8 d8d5,2338,79,84,125,crushing exposedKing fork interference long middlegame,https://lichess.org/PxFFuSNt/black#44,
JHhHa,5r2/5p1k/3N2pp/1ppBp3/4P3/3P2QP/1Pn2PPK/q7 b - - 2 27,a1b2 d5f7 f8f7 d6f7 c2d4 f7e5,2324,83,90,228,crushing endgame interference long,https://lichess.org/fYNgm53c/black#54,
JIlYR,2n2rk1/7p/p5p1/1p1p4/3B4/2PB2QP/2P3PK/1q6 b - - 4 30,b1c1 d3g6 c1f4 g6f7 g8f7 g3f4,2363,77,94,1022,attraction crushing doubleCheck endgame interference long,https://lichess.org/LtPsMQuX/black#60,
JJGUq,r2q2rk/1p3p1n/p1pp3Q/4p1PN/4P1b1/1P1P4/1PP2PP1/R3K2R b KQ - 0 18,d8g5 h5f6 g5h6 h1h6 h8g7 f6g4,2300,80,85,298,advantage interference long middlegame,https://lichess.org/bOcgzFx0/black#36,Three_Knights_Opening Three_Knights_Opening_Other_variations
JNzV2,r1b2r2/pp2k1p1/1bPpP1qp/8/2B1Nn2/5Q2/PP3PPP/R4RK1 b - - 0 18,d6d5 f3a3 e7e6 a3d6 e6f7 d6f4 f7g8 c4d5,2324,88,87,757,crushing exposedKing fork interference middlegame pin veryLong,https://lichess.org/Sw7u7Xkl/black#36,Scotch_Game Scotch_Game_Haxo_Gambit
JSety,r5k1/2p1Rrb1/1pPp3p/1P3qp1/P7/6P1/4R1BP/3Q2K1 w - - 1 30,g2d5 g7d4 e2f2 f5d5 d1d4 d5d4,2313,87,87,534,crushing interference long middlegame pin,https://lichess.org/zN4HKdI7#59,
JTBGh,3r4/p1p1kbr1/1p1q1p2/4p2p/1P1nBN1P/P1Q3P1/3R1PK1/4R3 b - - 5 29,e5f4 d2d4 d6d4 e4d5 e7f8 c3d4,2344,78,92,7452,advantage discoveredAttack interference intermezzo long middlegame sacrifice,https://lichess.org/cOsoqUZq/black#58,
JX0ZG,r6r/ppp1k2p/2b1q3/8/2pQ1P2/2P5/P4K1P/3R3R b - - 1 22,c6h1 d4g7 e7e8 g7h8,2347,244,100,12,endgame equality interference short,https://lichess.org/AYfjzyNr/black#44,
JwOhu,3r1b1r/1Q1k1ppp/7n/4P3/3p1P2/3P4/PP1BNK1P/q7 b - - 0 20,d7e6 b7c6 f8d6 e2d4 e6e7 e5d6 d8d6 c6c7 e7e8 c7d6,2384,79,90,400,advantage attraction deflection exposedKing interference middlegame veryLong,https://lichess.org/qrZpR25X/black#40,
JyeTg,4r3/p5k1/1q4p1/3P1b1p/8/1P3Q2/P3BRPP/6K1 w - - 1 28,e2d3 e8e3 f3f4 e3d3,2325,74,91,5534,advantage endgame interference short,https://lichess.org/0mkZu6xy#55,
K47yI,r3k2r/pppn1ppp/1b1Pq3/8/2nP1Q2/2N3B1/P1P3PP/R4R1K b kq - 0 16,e8c8 d6c7 d8e8 d4d5 e6e5 f4c4,2398,80,92,1579,advancedPawn advantage discoveredAttack interference long middlegame,https://lichess.org/ctEdO7uF/black#32,Kings_Gambit_Accepted Kings_Gambit_Accepted_Kings_Knights_Gambit
K65Ft,5b2/1q2k1r1/6p1/2pR3p/2P1pQ1P/P5P1/5P2/6K1 b - - 13 41,e7e8 d5d8 e8d8 f4f8 d8c7 f8g7,2373,78,92,4373,attraction crushing deflection endgame exposedKing interference long sacrifice,https://lichess.org/8j47Kg9G/black#82,
KAZ6t,r1b2qk1/pp5p/2p5/3pP3/2PQnNpR/1P2P1P1/PB3r2/R5K1 b - - 1 24,f2d2 e5e6 d2d4 h4g4 f8g7 g4g7,2355,80,89,544,crushing interference kingsideAttack long middlegame sacrifice,https://lichess.org/fe8b068a/black#48,
KfKmu,r1bb1rk1/pp5p/4pppP/3p2q1/3Q4/P4N2/1PP1B1P1/1K3R1R b - - 1 21,g5f5 e2d3 e6e5 d4d5 f5e6 d3c4 e6d5 c4d5,2312,84,87,519,crushing interference middlegame quietMove veryLong,https://lichess.org/xyKbSEsE/black#42,
KmOUG,r2qk2r/1ppb1pp1/p1nb3p/8/3NP1n1/2N5/PPP1BPP1/R1BQRK2 w kq - 2 12,d4c6 d8h4 e2g4 h4h1 f1e2 d7g4 f2f3 h1g2 e2d3 g4f3,2304,78,86,426,crushing deflection interference intermezzo opening sacrifice veryLong,https://lichess.org/8nTn40YN#23,Philidor_Defense Philidor_Defense_Other_variations
Kza4V,2r1qrk1/p1pb1pbp/1p4p1/3BP3/4PB2/1Q3PP1/PP5P/2RR2K1 w - - 3 19,d5f7 f8f7 d1d7 e8d7 e5e6 d7d4 f4e3 f7f3 e6e7 g8h8,2326,84,90,2033,advantage defensiveMove interference middlegame veryLong,https://lichess.org/AVQa4M0g#37,Neo-Grunfeld_Defense Neo-Grunfeld_Defense_Classical_Variation
L2SoX,2r5/8/1p6/pP6/P4R2/1k3K2/8/8 w - - 7 44,f3f2 c8c4 f4f6 c4a4,2375,81,84,237,advantage endgame interference master rookEndgame short,https://lichess.org/Nn1utJ3P#87,
L8yMP,2b3rk/6r1/p3pq2/1p1pNp2/3P1Qp1/PPPB4/4RPP1/6K1 b - - 1 38,f6g5 f4h2 g7h7 e5f7 h8g7 f7g5 h7h2 g1h2 g7f6 f2f4,2355,79,73,81,crushing defensiveMove exposedKing interference middlegame pin veryLong,https://lichess.org/Qyq5d5PA/black#76,
LD2Rx,rn5k/pp3q1p/2pPR3/2PP4/8/1QP5/P5PP/6K1 b - - 0 25,c6d5 e6e7 f7h5 b3b7 h5d1 g1f2,2364,77,95,593,crushing endgame interference long,https://lichess.org/EqzThdX8/black#50,
LF8Vu,2r1k3/1r3p2/4p3/3pP1QP/2pP2p1/8/5PP1/6K1 b - - 0 38,c4c3 g5g8 e8d7 g8f7 d7d8 f7f8,2385,79,91,802,advantage deflection endgame interference long queenRookEndgame,https://lichess.org/D7BlEAsG/black#76,
LHJH7,8/4R3/6pk/2PK4/P5pP/8/r7/8 b - - 1 50,a2a4 e7e4 a4a8 e4g4,2322,131,77,19,crushing endgame interference rookEndgame short,https://lichess.org/3xuXVXNf/black#100,
LRymD,2kr2nN/ppp3pp/2nb4/8/4p2q/2NP4/PPP1BP2/R1BQ1RK1 w - - 0 13,e2g4 c8b8 f2f4 e4f3 f1f3 h4g4,2316,77,91,542,advantage defensiveMove enPassant interference kingsideAttack long middlegame,https://lichess.org/DcextJwE#25,Nimzowitsch_Defense Nimzowitsch_Defense_Declined_Variation
LW3Kk,3r2k1/p1Nq1ppp/2pB4/1P6/1nP1b3/5N1P/P4KP1/R2Q4 w - - 0 24,f3e5 b4d3 e5d3 d7d6 c7d5 c6d5,2389,95,90,981,advantage interference long middlegame,https://lichess.org/4iwPdva8#47,
LWQoj,1r5k/2R3p1/2P1p2p/1b1p4/1p2pP2/rP2P1N1/6PP/2R3K1 b - - 0 32,a3b3 c7b7 b8c8 b7b5,2308,82,91,2657,crushing endgame interference master short,https://lichess.org/YRjAQMAq/black#64,
LZNGJ,r1bqr1k1/pp2bppp/2nppn2/6N1/8/2P1B3/PPB2PPP/R2QR1K1 b - - 7 15,f6d7 d1h5 e7g5 h5h7 g8f8 h7h8 f8e7 e3g5 d7f6 h8g7,2370,79,92,4261,crushing interference kingsideAttack opening sacrifice veryLong,https://lichess.org/5HkxMXLV/black#30,Sicilian_Defense Sicilian_Defense_Delayed_Alapin
LfGEx,1r2r1k1/p1b2R1p/Pp4p1/1Pp1q3/2Pp4/3P3P/3QN1P1/5RK1 w - - 2 35,d2h6 e5h2 g1f2 g8f7 h6h7 f7f6,2308,91,60,50,crushing defensiveMove interference long middlegame,https://lichess.org/Vj9Y8OnW#69,
Lfayv,8/8/2p1p1k1/2B1PpP1/1P6/1K4p1/8/8 w - - 1 70,b4b5 c6b5 c5e3 g3g2 b3b4 f5f4 e3g1 g6g5 b4b5 g5f5,2310,80,92,3322,advancedPawn bishopEndgame crushing endgame interference veryLong,https://lichess.org/g2gVCf87#139,
LjbTJ,5rk1/pp5p/2q1p3/4P1p1/2p3P1/2P4P/PP1Qp3/2R3K1 w - - 0 30,d2g5 g8h8 g5e3 f8f3 e3e2 f3h3,2351,83,90,859,crushing endgame interference long,https://lichess.org/qUAoh6Ew#59,
LnDtU,4R3/6pk/3p4/8/1P3p1p/P4q2/5B1P/4R1K1 w - - 0 39,e8e6 f3g4 g1f1 g4h3 f1e2 h3e6,2352,91,84,35,crushing endgame interference long,https://lichess.org/aaMY48ij#77,
Lo52u,3r2k1/1pR3pp/p7/4Ppb1/1P2b3/P1Q3P1/1B3q1P/1K2R3 w - - 2 32,b1a2 e4d5 a2a1 g5d2 c3d3 f2e1,2370,89,90,219,advantage fork interference long middlegame,https://lichess.org/SAj5zbfW#63,
LoDNQ,k6r/p6q/3R4/1PPp2p1/3P1pP1/P7/5P1P/3Q2K1 w - - 1 34,d6e6 h7h2 g1f1 h2h3 f1e2 h3g4,2348,77,92,1315,crushing endgame interference long,https://lichess.org/WmTwAfjv#67,
Lq6vN,6k1/p2q1p2/1p3P1p/6p1/4Qb2/7P/1P3BP1/7K b - - 9 40,g8h8 e4e7 d7c8 e7f7,2325,77,92,1664,crushing endgame interference short,https://lichess.org/7tLWxU90/black#80,
LyHNG,8/7p/6p1/kp5r/3PPP2/1R1K4/7P/8 w - - 1 48,b3b2 h5h3 d3c2 h3h2 c2b3 h2b2 b3b2 a5b6,2353,88,85,63,crushing defensiveMove endgame interference rookEndgame veryLong,https://lichess.org/p5oLTG1u#95,
M56KM,2kr4/Qbq2ppp/N1p1p3/Pp6/8/6P1/4PP1P/2Rr1BK1 b - - 2 26,b7a6 a7a8 c8d7 c1d1 d7e7 d1d8,2312,82,80,481,advantage exposedKing fork interference long master middlegame,https://lichess.org/qlSjREKb/black#52,
MEk7l,8/2R3pk/4Q1p1/p2NP3/3q1K2/7P/6P1/6b1 w - - 1 41,f4g3 d4f2 g3g4 f2g2 g4f4 g6g5 f4f5 g2h3 f5e4 h3e6,2394,77,69,105,crushing deflection endgame interference skewer veryLong,https://lichess.org/25tl1mSE#81,
MGRTU,r3k2r/1b1p1pp1/p2Rp3/2q3P1/3nPQ1p/P1N4P/1PP1BP2/2K3R1 w kq - 1 23,g1d1 e6e5 f4d2 c5d6,2358,88,87,256,advantage interference middlegame short trappedPiece,https://lichess.org/NAIG1eqA#45,
MIcxY,r3k1r1/2p2pp1/p1qp1P1B/2b1p3/4P1B1/1QPP3P/P4P2/1n2K1R1 b q - 0 23,g7h6 g4d7 e8d7 b3f7 d7c8 g1g8 c8b7 g8a8,2371,77,95,207,advantage attraction deflection interference middlegame sacrifice veryLong,https://lichess.org/n5aXuuJT/black#46,
MJCpB,8/5bk1/2pq1pp1/3p4/3P1NQ1/nPpB2P1/5K1P/8 w - - 0 34,f4g6 f6f5 g4f4 d6g6,2312,78,82,68,advantage discoveredAttack endgame interference master short,https://lichess.org/Uoo6ktFu#67,
ML1VH,8/1p3pkp/6pN/p5Q1/Pb6/5P2/1P1r1KPP/4n2R w - - 2 29,f2e3 e1c2 e3f4 b4d6 f4g4 d2g2 g4h4 g2g5,2330,81,82,71,crushing endgame interference skewer veryLong,https://lichess.org/3SIuH6Wp#57,
