PuzzleId,FEN,Moves,Rating,RatingDeviation,Popularity,NbPlays,Themes,GameUrl,OpeningTags
rnNeY,8/p4k2/1p3p1p/1P3Kp1/P1n1P3/2N3P1/5P1P/8 w - - 1 36,f2f4 c4e3,1103,83,68,675,endgame knightEndgame master mate mateIn1 oneMove,https://lichess.org/WtDNJ29g#71,
8RcBG,8/p7/2k2p1p/5p2/2Pp1P2/Pn1K1P2/1N5P/8 w - - 2 39,b2a4 b3c5 d3d4 c5a4,1174,75,88,75,crushing endgame knightEndgame short,https://lichess.org/rjRkvk0w#77,
m6XVn,8/6p1/7p/1p3p1k/5P2/2K3PN/6P1/8 w - - 3 41,c3b4 h5g4 h3g1 g4g3,1180,83,87,72,crushing endgame knightEndgame short,https://lichess.org/0SilAEci#81,
bFBnL,8/3Pk3/2K1P3/8/8/3n4/8/8 b - - 15 60,d3e5 c6c7 e7e6 d7d8q,1176,77,100,587,advancedPawn crushing defensiveMove endgame knightEndgame promotion short,https://lichess.org/H4HyTVY7/black#120,
sd23M,8/1p5p/1p1Pnpp1/5N2/2k5/8/PP3PPP/5K2 w - - 0 28,f5g7 e6g7 d6d7 g7e6,1178,117,76,31,advantage defensiveMove endgame hangingPiece knightEndgame short,https://lichess.org/LiCFkcIl#55,
2ffpk,8/8/p7/1p4k1/4K3/P1P4p/1P4N1/8 w - - 0 52,e4f3 h3h2 g2e1 h2h1q,1179,79,88,47,advancedPawn crushing endgame knightEndgame promotion short,https://lichess.org/Ib52kkVP#103,
Bf6M9,8/5pp1/3kp3/1pN3p1/1P6/P1n1PP1P/6P1/6K1 w - - 1 36,c5e4 c3e4 f3e4 d6e5 g1f2 e5e4,1105,94,78,35,advantage endgame knightEndgame long,https://lichess.org/KtnWSqgV#71,
HSiaT,8/8/2p1N3/n3Kp2/P4Pk1/8/8/8 b - - 4 42,a5c4 e5d4 c4a5 d4c5,1194,76,89,681,crushing endgame knightEndgame short,https://lichess.org/PD163WPz/black#84,
VU2Te,8/5kN1/7P/8/p6K/8/8/8 w - - 0 65,h4h5 a4a3 g7e6 a3a2,1177,79,94,5955,advancedPawn crushing endgame knightEndgame short,https://lichess.org/E70Qv1AP#129,
Ae8MI,8/8/6KN/8/5kp1/8/8/8 w - - 0 66,g6f6 g4g3 h6f7 g3g2,1161,95,41,33,advancedPawn crushing endgame knightEndgame short,https://lichess.org/nWGFPlQw#131,
RRcMo,1K6/3k2p1/P3p2p/n3P2P/8/8/8/8 b - - 2 46,d7c6 a6a7 c6b6 a7a8q a5c6 b8c8,1167,78,88,263,advancedPawn crushing endgame knightEndgame long promotion,https://lichess.org/Lzr1S2Mu/black#92,
uF7jD,8/8/6p1/7p/P1N1k1n1/1P1p4/3K2P1/8 b - - 1 43,e4d4 a4a5 g4f6 a5a6,1133,77,91,267,crushing endgame knightEndgame quietMove short,https://lichess.org/DRPYJfCc/black#86,
IRw2p,8/8/3nk1K1/6PP/8/8/8/8 b - - 0 48,e6e7 h5h6 d6f7 h6h7 e7e6 g6g7 f7g5 h7h8q,1136,76,84,334,advancedPawn crushing endgame knightEndgame promotion veryLong,https://lichess.org/QoJOurss/black#96,
8CnPH,8/8/n5pN/2pp4/P4P2/1PK3P1/4k2P/8 w - - 1 49,h2h4 d5d4 c3c4 d4d3 h6g4 d3d2,1147,75,71,118,advancedPawn crushing endgame knightEndgame long,https://lichess.org/L8PeNrTN#97,
ZRnly,1n6/1P5p/3k1p2/2NppP2/3P4/8/5K1P/8 w - - 0 39,f2e3 e5d4 e3e2 d6c5,1140,78,88,1163,crushing endgame knightEndgame master masterVsMaster short,https://lichess.org/okwyyb0T#77,
OMu73,8/8/8/PK6/3n2kp/8/8/7N w - - 1 64,b5c5 d4b3 c5d5 b3a5,1159,75,100,220,crushing endgame knightEndgame short,https://lichess.org/Z1xWAYXj#127,
GscU9,8/8/8/8/6k1/5N2/5K1p/8 w - - 0 63,f3e5 g4h3 f2f3 h2h1q,1176,122,67,14,advancedPawn crushing defensiveMove endgame knightEndgame master promotion short,https://lichess.org/iTZXHJ3v#125,
GoB5g,8/7p/pp1k2p1/2n2p2/3K1P1P/2N5/PP4P1/8 w - - 3 39,c3d5 c5e6 d4c4 b6b5,1185,78,92,115,advantage endgame knightEndgame short,https://lichess.org/sAUGdMTC#77,
qxtkv,8/5p2/p2kp1np/P7/2PK2P1/1N3P2/8/8 b - - 3 48,g6e5 c4c5 d6e7 d4e5,1152,105,50,43,crushing deflection endgame knightEndgame short,https://lichess.org/4Vtgmx5o/black#96,
r8I2S,6k1/8/4p3/1pn1p1p1/1Np1P1Pp/P4P1P/3K4/8 b - - 3 31,c5d3 b4d3 c4d3 d2d3 g8f7 d3c3 f7e7 c3b4,1199,78,77,143,crushing endgame knightEndgame veryLong,https://lichess.org/WtKMZLXm/black#62,
aCLom,6k1/2p3p1/7p/8/1PR2Nn1/1r4P1/6KP/8 w - - 3 36,g2g1 b3b1 g1g2 g4e3 g2f2 e3c4,1133,78,79,360,crushing endgame fork long,https://lichess.org/rPjzjCb7#71,
hgPwe,r4r2/3qnpbk/1pbpp1pp/1B6/N3P3/4BP2/2PQN1PP/R3R1K1 b - - 0 21,c6b5 a4b6 a8a1 b6d7 a1e1 d2e1,1190,87,68,70,advantage fork long middlegame,https://lichess.org/EzmFstIB/black#42,
Y2xdn,1k6/2p1npp1/1p6/pR5p/P2bPB1P/2pr1P2/6K1/1R6 b - - 1 31,e7c6 b5b6 d4b6 b1b6 b8c8 b6c6,1171,75,92,484,advantage endgame long pin queensideAttack,https://lichess.org/oM0WAtkz/black#62,
LoLNm,5bk1/1p4rp/3p4/3Pp3/1q2PP2/5P2/P3Q3/R4K1R w - - 0 34,h1g1 g7g1 f1g1 b4d4 g1g2 d4a1,1168,74,97,10457,advantage attraction endgame exposedKing fork long,https://lichess.org/bW89acX1#67,
6KrSw,2r1r1k1/pp4pp/2p1p1n1/3pPp2/2PPq3/1P2PR2/P2Q2PP/2B2RK1 b - - 20 24,g6h4 f3f4 e4g2 d2g2 h4g2 g1g2,1199,75,88,489,advantage long middlegame,https://lichess.org/QJIOHcKS/black#48,
fK5eH,r2qrbk1/pp3ppp/2pp1n2/8/2Q1N3/1P3N1P/PBP2PP1/R3R1K1 b - - 0 15,f6e4 e1e4 d6d5 e4e8 d5c4 e8d8,1150,83,83,101,advantage long middlegame,https://lichess.org/jl0HV4wJ/black#30,Ruy_Lopez Ruy_Lopez_Steinitz_Defense
65q3n,8/8/2kb1P1R/1p6/2p5/2n2K2/8/8 b - - 0 61,c3d5 f6f7 c6d7 h6d6 d7d6 f7f8q,1156,75,96,8506,advancedPawn attraction crushing discoveredAttack endgame long promotion,https://lichess.org/t9siF3mS/black#122,
Ksd4P,1k4r1/1p6/3p3R/p2Pp3/1qP5/5P2/4Q1B1/5K2 w - - 2 53,g2h3 b4b1 e2e1 g8g1 f1g1 b1e1,1194,80,94,6249,attraction crushing deflection endgame exposedKing long pin,https://lichess.org/5ZVcCeqI#105,
vIZSZ,5r2/p3n3/1p1kp3/3n2B1/1PBb4/P2N4/7P/3KR3 w - - 1 27,e1e4 d5c3 d1c2 c3e4 g5e7 d6e7,1135,77,98,5198,crushing fork long middlegame,https://lichess.org/36utJXfY#53,
nJeXJ,8/1Q3p1k/p5pp/8/PP6/8/4rqPP/6RK w - - 3 31,b7a6 e2e1 g1e1 f2e1 a6f1 e1f1,1166,80,75,48,endgame long mate mateIn3,https://lichess.org/WVILc2FK#61,
UiHaZ,6k1/5pbp/3p2p1/1p1Pp3/1P4N1/3r3P/6P1/2R4K b - - 7 36,d3d5 c1c8 g7f8 g4f6 g8g7 f6d5,1113,179,100,6,advantage endgame fork long,https://lichess.org/Fg9Rb8U6/black#72,
KaTcY,rn2k2r/4p2p/2p1bpp1/1N6/8/6P1/5PBP/1R3RK1 b kq - 0 23,e8g8 b5c7 e6f5 c7a8 f5b1 f1b1,1114,78,93,328,advantage fork long middlegame,https://lichess.org/sxmm13ED/black#46,
cTES6,1krb4/pp3ppp/3N4/P2P4/1PP1pP2/R1Q1q3/5nPP/5R1K w - - 3 27,h1g1 f2h3 g1h1 e3g1 f1g1 h3f2,1120,90,80,222,doubleCheck kingsideAttack long mate mateIn3 middlegame sacrifice smotheredMate,https://lichess.org/dRvkiOZi#53,
6YaEB,1r3rk1/p3qppb/7p/2P5/2BPp1n1/1Q6/PP2N1PP/R4RK1 w - - 8 20,b3b8 f8b8 f1f7 e7f7 c4f7 g8f7,1189,76,89,347,advantage hangingPiece long middlegame,https://lichess.org/x1TaYX8l#39,
UNBtX,2r3rk/1b1qb1pp/p2p1p2/1p2pP1Q/4P3/P1NPBR2/1P4PP/3R2K1 b - - 1 21,d7e8 h5h7 h8h7 f3h3 e8h5 h3h5,1179,80,92,6076,attraction kingsideAttack long mate mateIn3 middlegame sacrifice,https://lichess.org/BEs0oO26/black#42,
hFcPG,8/5K1k/1p6/3n2P1/p1pP1B2/2n3P1/2P5/8 b - - 1 48,d5f4 g3f4 a4a3 g5g6 h7h6 g6g7,1188,75,68,98,advancedPawn crushing endgame exposedKing knightEndgame long master,https://lichess.org/8zLWyk46/black#96,
GOhiQ,3r1r1k/p3Nppp/8/Qpp1p3/3n4/3P1q2/PPP5/2K3RR b - - 3 23,f3e2 h1h7 h8h7 g1h1 e2h5 h1h5,1121,79,86,1245,anastasiaMate attraction kingsideAttack long mate mateIn3 middlegame sacrifice,https://lichess.org/drTMKUuV/black#46,
3NKmq,4r3/pp3Q1p/1kp3r1/2p4q/2P2P2/4PbP1/PP1B3P/4RRK1 w - - 1 25,f7e8 g6g3 h2g3 h5h1 g1f2 h1g2,1183,80,90,1127,kingsideAttack long mate mateIn3 middlegame sacrifice,https://lichess.org/Mjk5FPix#49,
nX1KX,8/8/5p1p/1p3Pp1/3k2P1/1K4P1/P7/8 b - - 1 49,d4e4 b3b4 e4f3 b4b5 f3g4 a2a4,1163,139,100,14,crushing defensiveMove endgame long pawnEndgame,https://lichess.org/mHBzLkjN/black#98,
V8ksb,7k/pp1qb1p1/3p2p1/3Qn1P1/3p1R2/2P4P/PP5K/8 b - - 1 29,e7g5 f4f8 h8h7 d5g8 h7h6 g8h8,1100,76,89,187,endgame long mate mateIn3,https://lichess.org/NNe6HBC4/black#58,
47TCH,8/8/pp3n2/3kp3/1P3r2/P3N3/4K3/2R5 b - - 9 48,d5d4 c1c4,1100,76,100,192,endgame master masterVsMaster mate mateIn1 oneMove,https://lichess.org/avaaLfCI/black#96,
BOYrB,6k1/5bp1/7p/1Q1pP3/p2P4/5p1P/P5r1/4K3 b - - 0 43,g2a2 b5b8 g8h7 b8b1,1180,75,88,273,crushing endgame master short,https://lichess.org/NkgSfY78/black#86,
eidic,8/8/8/4kp1N/7K/7P/6P1/4n3 w - - 5 47,g2g3 e1f3,1107,76,100,260,endgame knightEndgame master mate mateIn1 oneMove,https://lichess.org/kMHSyX3v#93,
WHbZ5,8/8/8/p2kp2p/1P2p3/P3K1P1/8/8 b - - 0 51,a5b4 a3b4 d5c4 e3e4 c4b4 e4e5,1112,75,99,857,crushing endgame long master masterVsMaster pawnEndgame,https://lichess.org/G3YT7Jro/black#102,
eaTtr,r4rk1/ppp2p1p/5pb1/2qB4/3n1PQN/P7/1PP3PP/2KR3R w - - 3 18,d1d4 c5c2,1108,76,100,151,master mate mateIn1 middlegame oneMove queensideAttack,https://lichess.org/xKP0TZck#35,Scandinavian_Defense Scandinavian_Defense_Classical_Variation
rXUri,2r2bk1/1p4pp/p1n1Rp2/8/8/1PB3N1/5PPP/6K1 b - - 0 30,c6d4 c3d4 c8c1 g3f1,1110,122,53,31,crushing endgame hangingPiece master short,https://lichess.org/tA6KLvYP/black#60,
qmzC2,3r1rk1/pp3pp1/2n4p/7b/2B1N3/2R1PP2/PP2K2P/6R1 b - - 1 20,c6e5 e4f6 g8h8 f6h5,1121,76,100,209,advantage kingsideAttack master masterVsMaster middlegame pin short,https://lichess.org/VBVSvknX/black#40,
DrNoP,8/8/6PK/5k1p/5n2/8/8/8 b - - 0 54,f5f6 g6g7 f6f7 h6h7 h5h4 g7g8q,1148,99,82,24,advancedPawn crushing endgame knightEndgame long master promotion,https://lichess.org/mnboPJmW/black#108,
ilPPG,8/2r3pk/2pR3p/1p2Pp2/p1P2P1b/P4Qq1/1P4B1/7K w - - 2 41,d6c6 g3e1 f3f1 e1f1 g2f1 c7c6,1182,75,92,589,advantage endgame exposedKing long master masterVsMaster,https://lichess.org/NRoQQrZw#81,
rsJfV,8/7R/4nkp1/p2K3p/2P2p2/P7/8/8 w - - 0 46,d5e4 e6g5 e4d4 g5h7,1115,77,94,1449,crushing endgame fork master short,https://lichess.org/tllSVnM1#91,
Pprii,5rk1/pB1n1ppp/3p1b2/8/4P3/1P2QP2/1q1N2PP/2R3K1 w - - 1 21,d2c4 f6d4 c4b2 d4e3,1159,78,86,473,crushing kingsideAttack master middlegame pin short,https://lichess.org/kVV2gDDr#41,
XZ8Ue,4R3/5rk1/p2p4/1p1Pb1q1/1P2Qp2/4pP2/P5N1/6K1 b - - 2 37,g5g6 e8g8 g7g8 e4g6,1128,75,91,1217,advantage attraction deflection endgame master short,https://lichess.org/3v0Net8w/black#74,
mOjwb,5rk1/2R2pb1/p7/4p1p1/1PQ1Pq2/2P2N1K/5PP1/8 w - - 0 35,f3h2 f4h4,1178,82,63,101,endgame master mate mateIn1 oneMove,https://lichess.org/enROCF1S#69,
wA52I,r3r1k1/p1pqbpp1/2p5/7p/5Pb1/2N1B1QP/PPP3P1/R4R1K b - - 0 17,h5h4 g3g4 d7g4 h3g4,1125,76,96,6173,crushing master middlegame short,https://lichess.org/FJt4IeTC/black#34,Philidor_Defense Philidor_Defense_Exchange_Variation
U3Wxk,r2kr3/p2b3p/6p1/2Np1pP1/3Pn3/3B4/PPR4P/4R1K1 b - - 1 30,e4g5 c5b7,1138,76,94,255,master mate mateIn1 middlegame oneMove,https://lichess.org/UDY8PExo/black#60,
g8bPW,7k/pbQ5/1p3q1p/2nP1Br1/2P1P3/2P5/P6P/R6K b - - 0 26,f6c3 c7h7,1121,81,93,420,master mate mateIn1 middlegame oneMove,https://lichess.org/gSohmsO2/black#52,
4jSD9,r4b1r/p3p2k/6pp/P1p4q/4Q1n1/2N5/1PPP1P1P/R1B1R1K1 w - - 0 19,e4a8 h5h2 g1f1 h2f2,1113,75,99,673,kingsideAttack master mate mateIn2 middlegame short,https://lichess.org/zWPZ8ZcY#37,
cxdUn,5r1k/p7/1pq1pPQp/2p5/2Pn4/P2P4/1P4PP/4R1K1 b - - 0 33,c6d7 g6h6 d7h7 h6f8,1136,75,96,176,crushing endgame fork master short,https://lichess.org/HbEvZwJD/black#66,
4Hrt8,2kr4/pbpqb3/1pn1p2Q/3p1p2/1n1P4/1P2N1BB/P1P2P1P/2KR3R w - - 3 24,h6h7 b4a2 c1b1 a2c3,1142,76,100,317,advantage master middlegame queensideAttack short,https://lichess.org/hi16HdQ8#47,
GGdlS,8/4pp2/2p5/4k3/r1P1R3/5K2/8/8 b - - 1 39,e5d6 c4c5 d6c5 e4a4,1188,76,94,318,crushing discoveredAttack endgame master rookEndgame short,https://lichess.org/SjOgZHvO/black#78,
pThDW,2r5/p3KP1p/1b6/1P6/2Pp4/1k5P/8/3R4 b - - 0 51,b3c4 d1c1 c4d3 c1c8,1104,78,93,319,crushing endgame master masterVsMaster short skewer,https://lichess.org/cwGocRFr/black#102,
Qkms0,5rk1/1QR2p2/p5p1/7P/6P1/1PR3K1/5r2/5q2 b - - 2 40,f1g2 b7g2 f2g2 g3g2,1118,89,94,2641,crushing endgame master masterVsMaster short,https://lichess.org/aIG9jt2D/black#80,
aA1Dj,8/7p/4k3/pB4p1/P2K1p2/1b3P1P/6P1/8 b - - 0 39,h7h5 b5c4 b3c4 d4c4,1178,92,83,439,bishopEndgame crushing endgame master masterVsMaster short,https://lichess.org/93jMniHl/black#78,
nG50P,8/2k1b2p/2p3b1/6p1/1PN1p3/2P2P2/B4KPP/8 w - - 0 50,a2b1 e4e3 f2e2 g6b1,1199,74,91,659,advantage discoveredAttack endgame master masterVsMaster short,https://lichess.org/MI93aiB9#99,
5i2Td,5rk1/P7/8/1P6/8/5R2/1KP3p1/6r1 b - - 1 44,f8f3 a7a8q f3f8 a8d5,1115,75,99,1638,advancedPawn advantage endgame fork master masterVsMaster promotion short,https://lichess.org/xpqKqZZ1/black#88,
K62NA,r1bq1rnk/4b2p/pp6/2pP1p2/P1P1p3/2NB1R1P/1P1Q2PN/5RK1 w - - 0 22,c3e4 f5e4 f3f8 e7f8,1175,76,94,11876,advantage master masterVsMaster middlegame short,https://lichess.org/AYO02DgW#43,
cZxGU,1q1r1r2/pp2bppk/6np/2pp3N/P4BQ1/2PP3P/1P4P1/R3R1K1 b - - 0 29,g6f4 g4g7,1196,78,71,130,master masterVsMaster mate mateIn1 middlegame oneMove,https://lichess.org/oZzoWY6E/black#58,
P9SX3,rn1q1rk1/pb2bp1p/1p2p1p1/2p3N1/4P2P/1PQ5/PB1P1PP1/R3KB1R b KQ - 2 13,e6e5 c3e5 e7f6 e5f6 d8f6 b2f6,1126,79,33,48,crushing long master masterVsMaster middlegame,https://lichess.org/ZeAJVWhA/black#26,English_Opening English_Opening_Agincourt_Defense
7pCIU,8/8/5nk1/5b1p/B2B1K1P/8/8/8 b - - 3 48,f6g4 a4e8 g6h7 f4f5,1126,77,100,161,crushing deflection endgame master masterVsMaster short,https://lichess.org/oR6Bppsy/black#96,
AN492,8/p2b1pk1/3r3p/5Bp1/4P3/5PP1/PR5P/6K1 w - - 2 35,e4e5 d6d1 g1f2 d7f5,1120,189,67,8,advantage endgame master masterVsMaster short,https://lichess.org/C1CUaYmM#69,
Ag7io,r1b2r2/6bk/2pp4/p1n2N1Q/P1P2B1p/2q5/6PP/5B1K b - - 0 25,h7g8 f5e7,1193,79,87,503,master masterVsMaster mate mateIn1 middlegame oneMove,https://lichess.org/4AvwyhHr/black#50,
1MtHs,3r2k1/5pp1/2RN4/7Q/pP2p2p/P2bP2P/5qPK/8 w - - 2 39,h5f7 f2f7 d6f7 g8f7,1112,77,85,279,advantage endgame master masterVsMaster short,https://lichess.org/mbN3Xw1A#77,
ZhFjk,8/8/2b5/5kpp/8/1N2K1PP/8/8 b - - 1 48,h5h4 b3d4 f5f6 d4c6,1172,81,94,2004,crushing endgame fork master masterVsMaster short,https://lichess.org/EQMO7bce/black#96,
w6hNY,5rk1/2bp3p/p1bq2p1/1p1n1p2/1P6/3QPP2/3B2PP/1R1NR2K w - - 6 27,d1c3 d6h2,1128,74,78,221,kingsideAttack master masterVsMaster mate mateIn1 middlegame oneMove,https://lichess.org/5wkknDmO#53,
bhNVx,5rk1/pp3pn1/1q1p2P1/4p1P1/3N2bR/2P1r3/P1PK3Q/R7 b - - 1 23,g4h5 h4h5 f7g6 h5h8,1154,80,55,47,crushing kingsideAttack master masterVsMaster middlegame short,https://lichess.org/4wgEunbj/black#46,
7TSE6,8/p7/1p6/3p4/5k2/2PP2p1/1PK5/5N2 w - - 0 56,c2d2 g3g2 f1e3 g2g1q,1150,79,93,79,advancedPawn crushing endgame knightEndgame master masterVsMaster promotion short,https://lichess.org/tXg84w35#111,
1Zjhs,7k/1p6/6Rp/p2p4/P2P1BP1/8/4K3/1r3Br1 b - - 10 45,g1f1 f4e5 h8h7 g6g7,1183,76,84,221,advantage endgame master masterVsMaster short,https://lichess.org/Yy0RQf22/black#90,
PJmUS,4RK2/8/5k2/8/8/P6r/8/8 w - - 13 67,e8d8 h3h8,1173,80,89,120,endgame master masterVsMaster mate mateIn1 oneMove rookEndgame,https://lichess.org/HKxyw9rk#133,
d3yiH,2r2r2/4Qp1k/p6R/1pn4P/7P/5q2/1P6/K5R1 b - - 1 29,h7h6 e7g5 h6h7 g5g7,1158,78,94,8127,endgame master masterVsMaster mate mateIn2 short,https://lichess.org/Dl4JPzr7/black#58,
rnxPR,1b3rk1/1p3ppp/1n1qb3/1P2p3/8/1QN2NP1/3PBP1P/2R3K1 w - - 4 25,c3e4 e6b3 e4d6 b8d6,1150,77,89,1511,crushing master masterVsMaster middlegame short,https://lichess.org/2TVxQ8ZC#49,
P6LT3,8/2P5/1R6/8/5ppk/1P6/r4PKP/8 w - - 0 39,c7c8q f4f3 g2f1 a2a1 c8c1 a1c1,1135,77,80,153,endgame long mate mateIn3 queenRookEndgame,https://lichess.org/yBafXVGO#77,
crFMr,1k1r3r/p1pq1ppp/Qp6/2bnN3/3p1P2/7P/PPP3P1/R1B2RK1 b - - 4 18,d7c8 e5c6 b8a8 a6a7,1141,75,88,537,fork mate mateIn2 middlegame short,https://lichess.org/kwLZ8whO/black#36,Philidor_Defense Philidor_Defense_Other_variations
dfa0A,r4rk1/5p2/p3pbN1/8/3P4/1p1QP1R1/q4PP1/5RK1 b - - 0 24,f7g6 d3g6 f6g7 g6g7,1194,156,80,22,mate mateIn2 middlegame short,https://lichess.org/JzRtQ5vL/black#48,
ue8Zn,2N5/Q7/5p1k/4p1pp/3pP3/1P4PK/P1q5/R7 w - - 1 32,a7f7 g5g4 h3h4 c2h2,1162,76,86,715,endgame mate mateIn2 short,https://lichess.org/E9G6n2st#63,
Et21b,5k1n/1p1BP3/5B2/3p2K1/8/8/p7/3r4 b - - 0 48,f8f7 e7e8q,1177,76,93,500,advancedPawn endgame mate mateIn1 oneMove promotion,https://lichess.org/KEDPvnbV/black#96,
rW4vC,6k1/R7/Q1p4p/2Ppq1nn/4p3/7P/P2NNrP1/7K b - - 0 33,f2e2 a6c8 e5e8 c8e8,1193,78,91,735,mate mateIn2 middlegame short,https://lichess.org/09DfQz88/black#66,
012uA,r4r2/p1p2k1R/6R1/3n1pB1/1q1Pb3/8/1P2Q1PP/6K1 b - - 2 35,f7g6 e2h5,1139,77,84,177,mate mateIn1 middlegame oneMove,https://lichess.org/giEyOLMZ/black#70,
aVxcu,rn2kb1r/ppp1qppp/3p4/8/2NPn3/5b2/PPP1B1PP/RNBQK2R w KQkq - 0 8,g2f3 e7h4 e1f1 h4f2,1166,78,89,2349,mate mateIn2 opening short,https://lichess.org/hwTYle0r#15,Russian_Game Russian_Game_Other_variations
IMQf0,5r1k/pb2Qqpp/1p6/8/8/P6B/1P4rP/3RR1K1 w - - 0 27,h3g2 f7f2 g1h1 f2g2,1124,79,92,342,mate mateIn2 middlegame short,https://lichess.org/JdAIvYAw#53,
6vw7t,6k1/7p/1RpB2p1/5p2/3b4/1PR3P1/r5KP/8 w - - 2 29,g2f3 a2f2,1137,121,82,68,endgame master mate mateIn1 oneMove,https://lichess.org/blbOrCA9#57,
J5mNU,5r1k/2q3pp/p3Q1n1/1bNB4/1p1P1P2/1P4P1/P6P/1K2R3 w - - 1 27,c5a6 b5d3 b1a1 c7c3,1138,75,100,291,mate mateIn2 middlegame queensideAttack short,https://lichess.org/jvpUItHt#53,
FsdmI,2r2k2/p4p2/3qpQ2/2N5/3PP3/5P2/P5K1/8 b - - 0 40,d6e7 f6h8,1183,75,96,109,endgame mate mateIn1 oneMove,https://lichess.org/EAcmIfcd/black#80,
V2AYn,rn2r1k1/p4ppp/2p5/1pN2Q2/2q2P2/6P1/bP1K3P/3RR3 b - - 3 23,e8e1 f5c8 e1e8 c8e8,1111,74,97,5808,kingsideAttack mate mateIn2 middlegame short,https://lichess.org/smOY77Np/black#46,
imWxG,Bk6/4qr1p/8/4p3/p2qP3/8/4QPPP/2R4K b - - 2 34,b8a8 e2a6 d4a7 c1c8,1150,82,93,1128,endgame killBoxMate mate mateIn2 pin short,https://lichess.org/vhOcQksE/black#68,
KCJYx,r1b2k1r/ppp3pp/8/3Pp3/3b4/2N5/PP1PBPqP/R1BQK2R w KQ - 0 13,e2f3 g2f2,1161,82,100,75,attackingF2F7 mate mateIn1 oneMove opening,https://lichess.org/Q2JWTwgS#25,Italian_Game Italian_Game_Two_Knights_Defense
fDIXQ,r3r3/pp1q4/2p1k2Q/3pn1Pp/7P/5P2/PPP5/2K2R1R b - - 0 28,e6e7 h6f6,1193,81,85,1208,dovetailMate mate mateIn1 middlegame oneMove,https://lichess.org/Q2tuxqPl/black#56,
MjTLy,r2q4/6R1/pp6/2pPp3/2P1N3/3K4/PP6/4k3 b - - 11 51,e1d1 g7g1,1120,76,91,251,endgame master mate mateIn1 oneMove,https://lichess.org/qw8wDY0I/black#102,
l5i11,r6k/pb4pp/1q1N1r2/1P6/P3P1P1/3Q2P1/6BK/R2R4 w - - 1 32,d6b7 f6h6 g2h3 b6f2 h2h1 h6h3,1177,79,95,14740,deflection long mate mateIn3 middlegame,https://lichess.org/yNSZkSUA#63,
PGjtz,2b1k3/2q5/pRp1pbp1/2Pp1n2/P2P2nr/2NQ1BP1/3BNP2/6K1 w - - 0 25,g3h4 c7h2 g1f1 h2f2,1133,80,91,1584,kingsideAttack mate mateIn2 middlegame short,https://lichess.org/BmNZS4fu#49,
DcTxH,8/5pk1/3p2p1/1p5p/3PK2P/QP2P1P1/P4q2/8 w - - 0 36,a3d6 f2f5,1105,80,84,751,dovetailMate endgame master mate mateIn1 oneMove queenEndgame,https://lichess.org/DYOPZDIj#71,
XMWMv,2r2k1r/5ppp/p1nb4/1p1p4/5N1B/1K1B1N2/PP4PP/4R3 w - - 4 21,f4d5 c6a5,1197,79,72,236,mate mateIn1 middlegame oneMove,https://lichess.org/fUlD3xTJ#41,
S4Rji,3k4/3P1p2/3K2b1/4N3/8/8/7p/8 b - - 2 70,g6f5 e5f7,1162,214,43,31,endgame mate mateIn1 oneMove,https://lichess.org/ZY8peztz/black#140,
KoKE5,6k1/1b3pp1/p3p2p/1p2PP2/3Q3b/P2N3P/1P1q2PK/7N w - - 1 36,d4h4 d2g2,1107,186,90,33,endgame mate mateIn1 oneMove,https://lichess.org/0rfqX5a6#71,
tsWJa,6k1/1p2R3/3pN1p1/1B1PnbKp/1P5P/4b3/6P1/8 w - - 12 39,g5f6 e5g4,1132,75,100,380,endgame mate mateIn1 oneMove,https://lichess.org/wNhQrcCb#77,
lGB9A,r1bk3r/pppp1Bpp/8/2b1N3/4P2q/2N4P/PPnP2P1/R1BQ1K1R w - - 1 11,d1f3 h4e1,1185,77,88,638,mate mateIn1 middlegame oneMove,https://lichess.org/nJnwVm5x#21,Russian_Game Russian_Game_Three_Knights_Game
fuPfY,8/5ppp/R7/1pBPp3/8/5PkP/1r6/6K1 w - - 3 37,f3f4 b2b1,1176,75,97,3604,endgame master mate mateIn1 oneMove,https://lichess.org/CNPfJzYn#73,
lVPs2,r3Nr1k/7p/b1pP4/p3p1B1/Pp6/1n6/NP4PP/2K1R2R w - - 0 24,c1b1 a6d3,1104,75,94,1595,master mate mateIn1 middlegame oneMove,https://lichess.org/QlOIBbMA#47,
nGboY,r2qkbnr/ppp2Bpp/3p4/4N3/1P1nP3/2N5/P1PP1PPP/R1BbK2R b KQkq - 0 7,e8e7 c3d5,1160,78,85,286,mate mateIn1 oneMove opening,https://lichess.org/EAWRJ1gi/black#14,
tPQ8l,r3r3/6k1/2q1pb2/1pp1n1p1/5pP1/PB1P1N1K/1P2Q2P/2R2R2 w - - 2 34,f3e5 e8h8,1174,78,90,785,mate mateIn1 middlegame oneMove,https://lichess.org/1gtjisgR#67,
jKN60,6rk/p6p/6q1/2Nr1p2/8/1P2b3/P4QPP/4RRK1 w - - 0 30,f2e3 g6g2,1121,79,67,137,mate mateIn1 middlegame oneMove,https://lichess.org/DW1kwb4L#59,
xjur1,2Q5/3Rbpp1/kp6/2p1p2p/1P2q3/PK5P/6P1/8 b - - 13 37,a6b5 a3a4,1119,75,98,321,endgame mate mateIn1 oneMove,https://lichess.org/16SVEWY9/black#74,
MGaFT,4rr1k/pp4bn/2n5/2pQ2B1/7P/2P2pPq/PP3P1N/R3R1K1 w - - 1 24,e1e8 h3g2,1178,77,94,196,mate mateIn1 middlegame oneMove,https://lichess.org/QPnTdn70#47,
8BjsJ,r1b2rk1/ppq2ppp/2nppb2/4P3/8/2PQ1N2/PPB2PPP/RN2R1K1 b - - 0 12,d6e5 d3h7,1158,225,47,6,kingsideAttack mate mateIn1 oneMove opening,https://lichess.org/FuKNnx3R/black#24,Sicilian_Defense Sicilian_Defense_Delayed_Alapin_Variation
ZZQIi,rn1q1rk1/1bp2N2/p1n3p1/1p1BP2p/P7/2b3Q1/5PPP/R1B2RK1 b - - 0 20,d8d5 g3g6,1120,77,92,433,kingsideAttack mate mateIn1 middlegame oneMove,https://lichess.org/pVmUYAvC/black#40,
rrJpP,r2q1rk1/1Q4pp/p1n1p1p1/3pB1P1/3P4/5N1P/P1P2P2/2KR4 b - - 0 18,c6a5 b7g7,1103,203,54,21,kingsideAttack mate mateIn1 middlegame oneMove,https://lichess.org/ZwNNkXev/black#36,Scandinavian_Defense Scandinavian_Defense_Blackburne-Kloosterboer_Gambit
PGux5,8/1p3k1p/4p1p1/p1pnq1B1/P2b3P/3B1QP1/2P3K1/8 b - - 3 34,f7e8 d3b5,1153,76,95,11076,endgame master mate mateIn1 oneMove,https://lichess.org/cIB2l2gn/black#68,
vKCMR,r4k1r/p1p2P2/3pq3/4p2p/1p1nP3/P1KPbN1P/1PP3P1/R3QR2 w - - 0 21,a3b4 d4b5,1192,76,99,2075,mate mateIn1 middlegame oneMove,https://lichess.org/UgR2JtVv#41,
uRLED,1k2r1R1/p1pN4/BnPp4/4p3/1P2Pp2/P4n2/1B6/2K5 b - - 3 36,b6d7 g8e8,1132,243,0,5,endgame hangingPiece mate mateIn1 oneMove,https://lichess.org/3kHcAtIt/black#72,
8Y92m,r3r3/1b5k/pq1P2pp/1p3N2/5P2/2QB4/P5PP/4RK2 b - - 0 32,a8c8 c3g7,1199,77,82,151,mate mateIn1 middlegame oneMove,https://lichess.org/GS73ehl1/black#64,
fvxnx,2r2rk1/pp2q2p/3np1p1/4Q3/3P1pNN/2P3P1/PP4PP/5RK1 b - - 3 24,d6c4 g4h6,1117,77,83,50,mate mateIn1 middlegame oneMove,https://lichess.org/XIC8BsYQ/black#48,
nFfL0,r4k1r/pppB1ppp/2n3b1/3p4/1P1P1qP1/2P2P2/P3Q2P/RN2R2K b - - 5 17,f4d6 e2e8 a8e8 e1e8,1114,117,68,37,mate mateIn2 middlegame sacrifice short,https://lichess.org/879TAsGg/black#34,French_Defense French_Defense_Exchange_Variation
O5d1E,1r1qr2k/4b1pn/p2p3p/1p1PN3/1P2PN2/1B5P/4QPP1/2R3K1 b - - 0 29,d6e5 f4g6 h8g8 d5d6,1160,76,94,1064,discoveredAttack kingsideAttack mate mateIn2 middlegame short,https://lichess.org/1N0Ts5rx/black#58,
9LECO,4k3/pp4Rp/3p4/5p1P/2P1pr2/1P2K3/P1P2r2/6R1 w - - 2 33,g7h7 f4f3 e3d4 f2d2,1193,75,100,379,endgame mate mateIn2 rookEndgame short,https://lichess.org/GCNDGTeq#65,
CVCiU,7r/7p/1q1PQ1pk/1p1R4/1pp2P2/4b2P/1P2N3/rBKR4 w - - 3 39,c1c2 b4b3 c2c3 b6a5,1157,76,100,212,mate mateIn2 middlegame short,https://lichess.org/n3YS9et5#77,
ENqZ8,1r4k1/R4ppp/2p1p3/3pPn2/3P4/3q1N2/5PPP/4R1K1 b - - 0 26,b8b1 a7a8 b1b8 a8b8,1189,83,87,85,backRankMate endgame mate mateIn2 short,https://lichess.org/EXm2Xi1C/black#52,
A0xo7,8/3R2k1/1R4p1/1pr1p1Pp/p3p2r/8/PP2KP2/8 b - - 1 42,g7f8 b6b8 c5c8 b8c8,1107,79,86,333,endgame mate mateIn2 rookEndgame short,https://lichess.org/78G8dJiJ/black#84,
rEY5x,r2q2k1/bpp1rb1p/p2p1pnQ/3P3N/1PP3P1/3P2BP/P5BK/2R5 b - - 1 23,d8f8 h5f6 g8h8 h6h7,1186,76,82,142,kingsideAttack mate mateIn2 middlegame short,https://lichess.org/rY7rH4EJ/black#46,
Ox6bn,8/1p3pk1/p2br1p1/8/3BR3/1P5P/P5K1/8 b - - 1 37,g7h7 e4h4 h7g8 h4h8,1186,88,-33,79,endgame mate mateIn2 short,https://lichess.org/jD6adkZa/black#74,
n3ZuH,1k6/1b6/p3p3/1p1pP3/3P2pp/PBPqQ1nP/1P1B2P1/2R2rK1 w - - 2 37,c1f1 d3f1 g1h2 f1h1,1126,83,100,65,kingsideAttack mate mateIn2 middlegame short,https://lichess.org/DwFtyBSj#73,
fbLCF,1r1q3k/8/p2b1pQ1/8/2p1P3/5R2/PPP3PP/7K b - - 2 30,b8b7 f3h3 b7h7 g6h7,1196,283,33,5,endgame mate mateIn2 short,https://lichess.org/bek7gagL/black#60,
pfVvI,1R6/p1p4p/8/2K2p2/k7/2pb1P2/2r3PP/4R3 b - - 1 37,c2b2 e1a1 b2a2 a1a2,1169,75,98,3845,endgame mate mateIn2 short,https://lichess.org/3JFa3puS/black#74,
04dwQ,r2qr1k1/1bp2pp1/pn1p1N1p/1p6/3P3b/1P1Q4/P1B2PPP/R1B1R1K1 b - - 2 18,d8f6 d3h7 g8f8 h7h8,1107,78,79,234,kingsideAttack mate mateIn2 middlegame short,https://lichess.org/DTInvske/black#36,Scotch_Game Scotch_Game_Scotch_Gambit
GDQOE,2r4k/ppNQ2b1/6Bp/4p1q1/2P2p2/P7/1P3PPP/6K1 b - - 4 28,c8c7 d7e8 g7f8 e8f8,1119,76,100,81,endgame mate mateIn2 short,https://lichess.org/jZeGN6AZ/black#56,
VwVmR,8/4Qrkp/p3N1p1/4P3/2p5/2P4P/P2q2P1/6K1 b - - 5 39,g7g8 e7e8 f7f8 e8f8,1197,75,93,845,endgame mate mateIn2 short,https://lichess.org/BeLoQ2o3/black#78,
kRRLJ,r5rk/5p1R/p1pp4/1pb5/4P3/1P1P4/1PPB1q1N/R2Q3K b - - 0 24,h8h7 d1h5 h7g7 h5h6,1115,77,95,350,dovetailMate mate mateIn2 middlegame short,https://lichess.org/9fQh6kQP/black#48,
orVHH,1k4R1/2pr4/5p2/2bPp3/4P3/4q2r/1PP4N/Q6K b - - 0 29,b8b7 a1a8 b7b6 g8b8,1134,76,91,409,mate mateIn2 middlegame short,https://lichess.org/iTMgH1Gn/black#58,
o8t8G,r2qkb1r/pp4p1/2n1pn1p/3pN1p1/3P2P1/2PQB2P/PP3P2/RN2K2R b KQkq - 3 13,f8d6 d3g6 e8f8 g6f7,1181,76,100,335,mate mateIn2 middlegame short,https://lichess.org/ucqywGao/black#26,Caro-Kann_Defense Caro-Kann_Defense_Exchange_Variation
ANWHo,N6r/pp2k2p/4p3/2P3q1/3b1p2/5Qn1/P1P3PP/2B2R1K w - - 3 19,h2g3 g5h6 f3h5 h6h5,1192,79,73,93,mate mateIn2 middlegame short,https://lichess.org/u0z0PVeg#37,
k0ixi,7k/4qr1p/2n1pN2/pp1pPpQ1/2pP4/P1P4R/1P5P/7K b - - 3 37,f7g7 h3h7 g7h7 g5g8,1185,76,100,105,endgame kingsideAttack mate mateIn2 sacrifice short,https://lichess.org/dYZfbMxd/black#74,
l24qH,r1b2k2/ppp2p2/2nN4/5nq1/2BP1B2/2P3p1/PP4P1/R2Q1RKr w - - 1 19,g1h1 g5h4 h1g1 h4h2,1153,76,89,388,kingsideAttack mate mateIn2 middlegame short,https://lichess.org/sufUq5IN#37,
AIqBw,1r3rk1/4QRpp/8/8/8/P2qp3/6PP/5R1K b - - 0 32,f8f7 e7f7 g8h8 f7f8 b8f8 f1f8,1111,77,74,225,backRankMate endgame long mate mateIn3,https://lichess.org/JY7hYI6l/black#64,
0xcFy,r2q1rk1/pp3pp1/4p2p/2p1P3/5P2/2NP1bb1/PP2Q1P1/R3BR1K w - - 0 20,f1f3 d8h4 h1g1 h4h2 g1f1 h2h1,1174,76,82,204,kingsideAttack long mate mateIn3 middlegame,https://lichess.org/Rx8yNOc6#39,
Ie99U,2r1n2k/5R1p/4Nnp1/3p4/5R2/5P1P/6PK/2r5 b - - 11 34,c1c6 f7f8 f6g8 f8g8 h8g8 f4f8,1169,77,94,2558,attraction long mate mateIn3 middlegame sacrifice,https://lichess.org/g8yNlZ2f/black#68,
WV9AR,3r2k1/Q4p1p/1p2p1p1/2p5/2Pb1B2/1P3qP1/P4P1P/5RK1 w - - 1 24,a7b6 d4f2 f1f2 d8d1 f2f1 f3f1,1169,76,100,705,endgame long mate mateIn3 sacrifice,https://lichess.org/zkIN1ZTc#47,
N26V5,3bk1r1/1Q3p1p/pB6/1q1PpP2/2N1P3/7P/P1P1B2K/R7 w - - 1 32,c4e5 b5e2 b6f2 e2f2 h2h1 f2g2,1179,77,88,204,hangingPiece long mate mateIn3 middlegame,https://lichess.org/IkaPowVl#63,
