PuzzleId,FEN,Moves,Rating,RatingDeviation,Popularity,NbPlays,Themes,GameUrl,OpeningTags
ycIhC,4r1k1/p7/3qpr1p/2R1R1p1/1P1P4/2P2p1P/P5P1/4Q1K1 w - - 0 31,e1g3 f3f2 g3f2 f6f2,1001,78,100,60,advancedPawn advantage endgame short,https://lichess.org/FtK1uhrg#61,
LnqS1,2r5/1p2r1pk/p4n2/5P1P/3R4/1P1B4/PKP5/8 b - - 0 38,f6h5 f5f6 g7g6 f6e7,1036,82,94,1698,advancedPawn advantage discoveredAttack endgame short,https://lichess.org/ysJ5MKIv/black#76,
iEztT,8/1R6/1P6/8/2k2pr1/7p/2K5/8 b - - 0 39,g4h4 b7c7 c4d5 b6b7 h4h8 c7c8,1082,77,90,66,advancedPawn crushing endgame long rookEndgame,https://lichess.org/MvbPls1P/black#78,
WYuuR,5k2/7p/6p1/pP2rp2/8/6P1/1R3K1P/8 b - - 0 45,f8e8 b5b6 e8d7 b6b7,1073,108,63,24,advancedPawn crushing endgame rookEndgame short,https://lichess.org/EwkA2D7m/black#90,
sEMI9,8/8/3P4/pK5B/Pb2p3/4k3/8/8 b - - 0 49,e3d2 d6d7 b4e7 b5a5,1052,77,95,3359,advancedPawn bishopEndgame crushing endgame master short,https://lichess.org/ohNDy3gf/black#98,
Zg1Rf,4B3/8/1p2KP1k/8/1p6/2b5/P7/8 b - - 0 47,h6g5 f6f7 c3g7 e6e7,1075,85,88,697,advancedPawn bishopEndgame crushing defensiveMove endgame short,https://lichess.org/vE30H1pH/black#94,
V9H3z,8/6pk/4p1pp/8/1p1N4/r3P3/5PPP/2R3K1 w - - 0 29,d4e6 b4b3 c1f1 b3b2,1045,92,88,27,advancedPawn advantage endgame short,https://lichess.org/b2VfqbQN#57,
UppA8,6k1/5ppp/2P5/2R5/8/5P1P/4p1PK/3r4 w - - 0 39,c5e5 e2e1q e5e1 d1e1,1027,86,93,176,advancedPawn crushing endgame promotion short,https://lichess.org/N7ZfoRKh#77,
WnmSJ,5b2/p4pkp/1p1rP1pq/5p2/8/PB1b2R1/6PP/Q6K b - - 1 35,g7g8 e6f7,1014,77,86,270,advancedPawn mate mateIn1 middlegame oneMove,https://lichess.org/nCatQ2Iu/black#70,
HfpsM,8/3r1k1p/5p2/p4R2/3p4/1P6/P5PP/6K1 w - - 0 35,f5a5 d4d3 a5f5 d3d2,1044,87,87,33,advancedPawn crushing endgame rookEndgame short,https://lichess.org/aAbtl2Qo#69,
v4yH9,r7/3K1P2/4N3/8/8/8/1k6/8 b - - 0 69,a8a7 e6c7 a7a1 f7f8q,1064,77,96,4263,advancedPawn crushing defensiveMove endgame master masterVsMaster promotion short,https://lichess.org/ae8QiWSn/black#138,
9xx7e,8/8/p5p1/5p1p/KP2kP1P/6P1/8/8 b - - 2 52,e4f3 a4a5 f3g3 a5a6 g3f4 b4b5 f4f3 b5b6 f5f4 b6b7,1092,76,100,501,advancedPawn crushing endgame pawnEndgame quietMove veryLong,https://lichess.org/m429EHnp/black#104,
065u6,5rk1/p7/2p4p/2qp2pB/P7/2P1p3/2b1Q1PP/1R4K1 w - - 0 26,e2c2 e3e2 g1h1 f8f1 b1f1 e2f1q,1091,228,-100,3,advancedPawn discoveredAttack endgame long mate mateIn3 promotion,https://lichess.org/6v3d3BLs#51,
ComB8,6rk/1R4p1/5pp1/1P2p3/P7/4P1N1/1pr2PPP/1R4K1 w - - 0 33,a4a5 c2c1 b1c1 b2c1q,1085,79,80,213,advancedPawn crushing endgame promotion short,https://lichess.org/IMuiHCoV#65,
FDUcg,1r4k1/2R2ppp/pP6/8/4pP2/1R1b3P/2r3PK/8 b - - 6 38,c2c7 b6c7 b8f8 b3b8,1090,83,92,601,advancedPawn advantage endgame short,https://lichess.org/N1VpW9dK/black#76,
WYXo0,1q1r1rk1/5pp1/R6p/5R2/3P4/1p2PQPP/5P1K/8 w - - 0 42,a6a5 b3b2 f5b5 b2b1q b5b1 b8b1,1090,76,98,2076,advancedPawn advantage endgame long master promotion xRayAttack,https://lichess.org/FyXneC7Y#83,
LmGfT,4k3/5p1p/3Bp1p1/4P3/5P2/3N3P/1p4PK/1r6 w - - 0 37,d6a3 b1h1 h2h1 b2b1q,1023,84,92,2090,advancedPawn attraction crushing endgame promotion short,https://lichess.org/vqUROKEI#73,
bs3KL,8/8/8/4Q2P/8/pk6/2r2PP1/2K5 w - - 1 45,c1b1 a3a2 b1a1 c2c1,1052,76,100,130,advancedPawn endgame mate mateIn2 queenRookEndgame short,https://lichess.org/38YNJTNs#89,
suBSr,7k/6pp/8/8/p2B3P/rp1N4/5PPK/8 w - - 0 35,d3b4 b3b2 d4b2 a3b3 b2e5 b3b4,1076,82,89,56,advancedPawn clearance crushing endgame fork long,https://lichess.org/2xnP8PuE#69,
XzvhW,8/7p/3k2p1/3p4/1P1P1K2/7P/8/8 b - - 6 47,h7h6 b4b5 d6e6 b5b6 e6d6 b6b7,1087,82,93,1595,advancedPawn crushing endgame long pawnEndgame quietMove zugzwang,https://lichess.org/embxgsnQ/black#94,
bSw5V,2R5/6k1/8/8/5p2/2P2Kbp/PP6/8 w - - 0 47,c8e8 h3h2 f3g2 f4f3 g2f3 h2h1q,1073,80,100,78,advancedPawn advantage attraction deflection endgame exposedKing long promotion,https://lichess.org/B2TEoFFC#93,
hyeeL,1r5k/p7/2Q4p/3pPq2/8/n1P1R3/2PK1P2/B7 w - - 8 32,c6f6 f5f6 e5f6 a3c4 d2d3 c4e3,1059,75,98,357,advantage endgame fork long,https://lichess.org/hrlL2mMK#63,
uqN0d,8/p3np1p/8/3k4/2p3P1/5K1P/PB3P2/8 b - - 3 31,d5c5 b2a3 c5d4 a3e7,1048,80,93,1763,advantage endgame short skewer,https://lichess.org/jVKGpPPq/black#62,
LSvAX,4r1k1/1p2q3/p1prn3/3n3Q/3P4/P6P/1PB1RPP1/4R1K1 w - - 0 34,e2e6 d6e6 e1e6 e7e6,1050,82,94,171,advantage middlegame short,https://lichess.org/Hfigl3tE#67,
zKME1,3rr1k1/pp2qp1p/2pb1n1n/6p1/2P1p3/1PN1P1NP/PBQ2PP1/2R2RK1 w - - 4 20,g3e4 f6e4 c3e4 e7e4 c2e4 e8e4,1077,78,87,1066,advantage long master middlegame,https://lichess.org/zmtQfYqu#39,
3Jqie,2r1r1k1/p7/1p3p1p/3ppqP1/2P5/PP1nQPR1/1B3P2/6RK b - - 0 29,f6g5 g3g5 h6g5 g1g5 f5g5 e3g5,1076,83,94,2578,advantage exposedKing fork long middlegame sacrifice,https://lichess.org/43giySy3/black#58,
EOC51,r2q1r2/2pn2bk/pp1p3p/3Ppp2/8/3BQN1P/PPP2PP1/R3R1K1 w - - 0 18,g2g4 e5e4 d3e4 f5e4,1062,83,89,65,advantage fork middlegame short,https://lichess.org/ZPCeIjjB#35,St_George_Defense St_George_Defense_Other_variations
yIZdt,8/7k/p5pp/1pq2p2/2r1pQ2/6P1/5P1P/3R2K1 b - - 3 41,e4e3 d1d7 h7g8 f4b8,1028,78,82,117,advantage endgame short,https://lichess.org/8YZzxDLs/black#82,
aHBca,r4rk1/pbpp1pp1/1p6/3PnNp1/8/3B3P/PPP2PP1/R4RK1 b - - 0 17,b7d5 f5e7 g8h8 e7d5 e5d3 c2d3,1082,79,88,1607,advantage fork long middlegame,https://lichess.org/ralMdNVl/black#34,Italian_Game Italian_Game_Anti-Fried_Liver_Defense
rF7iu,r1b1k2r/pp2qppp/2n4n/3p4/Q1pPP3/2B5/PP1N1PPP/R3KB1R w KQkq - 3 11,c3b4 e7b4 a4b4 c6b4,1087,76,89,278,advantage opening short,https://lichess.org/LFw586zx#21,Tarrasch_Defense Tarrasch_Defense_Two_Knights_Variation
YJvAA,r1b1k1nr/pppp1ppp/2n2q2/2b1p3/2B1P1Q1/2N4N/PPPP2PP/R1BK1R2 b kq - 5 7,f6g6 c4f7 g6f7 f1f7,1084,78,89,403,advantage attackingF2F7 fork middlegame short,https://lichess.org/x7dpug9Y/black#14,Bishops_Opening Bishops_Opening_Boi_Variation
kWKr7,2r3k1/5p1p/n1Pp2pb/3P4/b5P1/P1R2B1P/5P2/3R2K1 w - - 0 35,d1e1 h6d2 e1e4 d2c3,1000,77,89,356,advantage fork master masterVsMaster middlegame short,https://lichess.org/aD99kjrk#69,
TfuUj,6N1/8/2ppk2P/pp2nR2/8/8/P2KP2r/8 b - - 2 47,e5f7 f5f6 e6d7 f6f7,1006,79,95,3013,advantage deflection endgame short,https://lichess.org/1rak99mn/black#94,
7zzDe,1K6/8/P1k3p1/5p1p/5P1P/2Np4/2r3P1/2B5 b - - 4 57,c2c3 a6a7 c6d7 a7a8q,1021,83,87,53,advancedPawn advantage endgame promotion short,https://lichess.org/YtBiGmSj/black#114,
2TsP0,r1bqkb1r/pp2pp1p/2n3p1/1B1pP3/3p4/2P2N2/P1P2PPP/R1BQK2R w KQkq - 0 9,c3d4 d8a5 c2c3 a5b5,1000,84,93,153,advantage fork master opening short,https://lichess.org/djECsxF3#17,Modern_Defense Modern_Defense_Other_variations
wUi0D,1r6/5r2/2pPk3/p2pP1B1/P1pP1PK1/6N1/8/8 b - - 2 40,c4c3 f4f5 f7f5 g3f5,1016,80,92,930,advantage endgame short,https://lichess.org/5VVBmIpf/black#80,
kFdqj,5r2/pR3pk1/4b1p1/3pP1N1/2p4P/2b5/P1B5/5K2 b - - 3 36,c3e5 g5e6 g7g8 e6f8,1033,77,86,500,advantage endgame pin short,https://lichess.org/QGWfz9x0/black#72,
lEy1l,3r1rk1/2p1qppp/p3nn2/1p1Pb3/1P3N2/P2QB3/B4PPP/2R1R1K1 b - - 2 18,e6f4 e3f4 e5f4 e1e7,1079,77,90,2754,advantage discoveredAttack middlegame short,https://lichess.org/IuZblrZO/black#36,French_Defense French_Defense_Exchange_Variation
wgK7g,r1bqr1k1/p1p1bp2/2pp3Q/7n/4P3/2NB4/PPP2PPP/R3R1K1 b - - 0 13,c8g4 e4e5 e7g5 h6h7,1089,76,93,737,advantage middlegame short,https://lichess.org/kf1DyE2K/black#26,Scotch_Game Scotch_Game_Other_variations
K6OaE,8/4b3/2p1k3/B3pp1p/P1K4P/1P3NP1/2n2P2/8 w - - 1 30,a5c3 c2a3 c4d3 e5e4 d3e2 e4f3,1084,76,99,3787,advantage endgame fork long,https://lichess.org/hvqweplt#59,
3KGYp,r4r2/pp6/2p1N1pk/8/8/3P4/PP3p2/2K2R2 b - - 0 29,a8e8 f1h1,1061,83,93,658,anastasiaMate endgame mate mateIn1 oneMove,https://lichess.org/0gNeVhmE/black#58,
GPZCI,1k5r/1p5p/1N6/4p3/8/2RPP3/PP4r1/4K3 b - - 0 27,g2b2 b6d7 b8a7 c3a3,1033,79,92,9866,anastasiaMate endgame mate mateIn2 short,https://lichess.org/2lFvr7dj/black#54,
hZ7Cn,5r2/3k4/p3b3/2p5/P4nQ1/1p6/1P4P1/R2N2K1 w - - 2 46,g4g5 f4e2 g1h2 f8h8 g5h6 h8h6,1020,80,51,472,anastasiaMate endgame long mate mateIn3,https://lichess.org/48UwrvXJ#91,
Bhmx5,r6k/1p2NrpR/2pp4/p1P1p1B1/3bPPb1/P2P2P1/1P6/1K1R4 b - - 0 22,h8h7 d1h1 g4h5 h1h5,1021,97,77,166,anastasiaMate mate mateIn2 middlegame short,https://lichess.org/yvLxnulm/black#44,
FcZPT,r4rk1/3n1pp1/q1NNp1p1/p1PQ4/1p1P4/4R3/PP3PPP/3R2K1 b - - 0 23,e6d5 c6e7 g8h7 e3h3,1031,78,95,2263,anastasiaMate mate mateIn2 middlegame short,https://lichess.org/P7cMfQ2w/black#46,
eONPm,1q1r1rk1/pp3pp1/8/2R2N2/3Pp1Pp/P6n/1P2BP2/3Q1K2 b - - 1 27,b8h2 f5e7 g8h7 c5h5,1022,81,76,254,anastasiaMate kingsideAttack mate mateIn2 middlegame short,https://lichess.org/UfGIEeNF/black#54,
rjcCT,5rk1/pp3ppp/8/3R1N2/P7/4PK1R/6PP/2r1b3 b - - 4 26,e1c3 f5e7 g8h8 h3h7 h8h7 d5h5,1022,82,88,836,anastasiaMate attraction endgame long mate mateIn3 sacrifice,https://lichess.org/zMTSzbu9/black#52,
PINry,6k1/7p/3p1q2/1p1Pp3/3n4/N5p1/P4PP1/1Q2N1K1 w - - 0 35,f2g3 d4e2 g1h2 f6h6,1079,80,89,762,anastasiaMate endgame mate mateIn2 short,https://lichess.org/setDRJTg#69,
42Qq3,r3qr1k/p1ppN1pQ/1bp2p2/4PPB1/2b1R3/7P/PP4P1/3R3K b - - 0 22,h8h7 e4h4 e8h5 h4h5,1092,118,73,46,anastasiaMate fork mate mateIn2 middlegame short,https://lichess.org/KOgzhtc5/black#44,
cHGvc,8/5R2/8/8/2K1N1pk/8/1r4rp/8 b - - 0 81,g2f2 f7h7,1053,234,100,25,anastasiaMate endgame mate mateIn1 oneMove,https://lichess.org/TMCVZmSt/black#162,
XSOxO,2b2rk1/prp2pp1/1bNp1q2/3R4/7p/2Q1PB2/PP3PPP/R5K1 b - - 3 21,f6c3 c6e7 g8h7 d5h5,1002,82,90,749,anastasiaMate kingsideAttack master mate mateIn2 middlegame short,https://lichess.org/Zwc37mjl/black#42,
cn3RB,5rk1/5pp1/8/3N4/p7/1r3R2/3K4/4R3 b - - 0 36,b3f3 d5e7 g8h7 e1h1 f3h3 h1h3,1076,77,95,209,anastasiaMate endgame long mate mateIn3,https://lichess.org/zxBvCzTt/black#72,
0xXpj,5rk1/p4pp1/3p4/5N1b/1p2PPR1/1B6/P4Q1K/q7 b - - 1 39,h5g4 f5e7 g8h7 f2h4 g4h5 h4h5,1059,76,92,873,anastasiaMate endgame fork long mate mateIn3,https://lichess.org/cvFooszW/black#78,
C0OSC,5rk1/5pp1/1p6/2p2bN1/3p3P/qP1n4/K2Q1P2/2R3R1 w - - 0 27,a2a3 f8a8 d2a5 a8a5,1043,76,100,402,anastasiaMate mate mateIn2 middlegame short,https://lichess.org/JXtCLWMU#53,
8n1nk,8/8/R6R/1pk2r1r/8/8/P3n1PK/8 w - - 10 47,h6h5 f5h5,1014,161,100,41,anastasiaMate endgame mate mateIn1 oneMove,https://lichess.org/rfqYzcoI#93,
kIrXz,1rb2rk1/1p1p1pp1/p6p/3N2Q1/2B1P3/8/PP1K1P2/4R3 b - - 0 22,h6g5 d5e7 g8h7 e1h1,1025,82,76,352,anastasiaMate endgame mate mateIn2 short,https://lichess.org/BWRDh3od/black#44,
E3tG2,5r2/2pk4/8/2P5/3PB1n1/P2RP1P1/1P4KP/8 w - - 2 40,d3d2 g4e3 g2h3 f8h8 e4h7 h8h7,1051,81,93,963,anastasiaMate endgame long mate mateIn3,https://lichess.org/cnPbxVMK#79,
hZWNt,3r4/1b5p/p3N1pk/1p2pp2/8/3B2R1/PPP5/2K5 b - - 1 29,d8e8 g3h3,1024,83,84,671,anastasiaMate endgame mate mateIn1 oneMove,https://lichess.org/7ZWS03um/black#58,
uk3MM,4r3/4Nqpk/3Q2b1/2Bp4/1P6/5p2/P7/6K1 b - - 3 36,g6b1 d6h2 f7h5 h2h5,1052,102,64,165,anastasiaMate endgame mate mateIn2 short,https://lichess.org/Q64fzMsq/black#72,
81dEs,6k1/p3N1p1/8/4b3/1Pppr3/P3pR2/4K1P1/8 b - - 1 33,g8h7 f3h3 e4h4 h3h4,1014,97,38,72,anastasiaMate endgame mate mateIn2 short,https://lichess.org/z6u5iGoe/black#66,
nf6cK,6rk/1b1R2Qp/4pN2/pp2P3/1Pp5/P4P2/2P2qPP/7K b - - 0 31,g8g7 d7d8 g7g8 d8g8,1094,78,93,1401,arabianMate endgame mate mateIn2 short,https://lichess.org/hp3NsEpa/black#62,
RYUCX,1r3b2/2R2k2/7p/1p1Np3/4P3/p4P1P/4K1P1/8 b - - 3 43,f7g8 d5f6 g8h8 c7h7,1042,79,60,158,arabianMate endgame mate mateIn2 short,https://lichess.org/KIZqbpns/black#86,
8qe3J,2k4r/ppp5/4p3/4p1Q1/2N1P2r/2N2nP1/PP4RP/6K1 w - - 1 27,g1h1 h4h2 g2h2 h8h2,1078,77,96,7668,arabianMate mate mateIn2 middlegame short,https://lichess.org/7PcJSDTy#53,
aIPDC,kr5r/5pp1/p1Nbp2p/8/2P1n3/2P1B2P/2K2PP1/R7 b - - 6 29,b8b7 a1a6 b7a7 a6a7,1095,77,100,128,arabianMate mate mateIn2 middlegame queensideAttack short,https://lichess.org/3jdt918i/black#58,
6qIXU,r4r1k/pp2R2p/1nppQNp1/8/8/5P2/PP2qP1P/5RK1 b - - 3 24,e2e6 e7h7,1027,81,91,700,arabianMate kingsideAttack mate mateIn1 middlegame oneMove,https://lichess.org/tjrfyEOG/black#48,
vI8Jr,1k6/5p2/p2p4/1p3P2/7P/5n1p/PPB2Br1/R4R1K w - - 1 29,a1d1 g2h2,1037,77,88,382,arabianMate endgame mate mateIn1 oneMove,https://lichess.org/SMbr8VB0#57,
CVEYR,k3r2r/p1q5/1pN2pp1/2pp3p/Q6P/R5P1/P5PK/8 b - - 3 41,g6g5 a4a7 c7a7 a3a7,1089,80,94,2828,arabianMate endgame mate mateIn2 queensideAttack short,https://lichess.org/z2IpYwRv/black#82,
kGkhT,8/6kp/1R6/1p2n3/P7/8/1r5P/5BK1 w - - 1 35,b6b5 e5f3 g1h1 b2h2,1051,87,88,612,arabianMate endgame mate mateIn2 short,https://lichess.org/qzUeZuUg#69,
kGApN,3r3k/pp2qprp/2p2N2/4p3/2PP3Q/7R/PP4PP/6K1 b - - 1 21,d8d4 h4h7 g7h7 h3h7,1034,76,70,254,arabianMate endgame mate mateIn2 sacrifice short,https://lichess.org/LOymadHS/black#42,
JILcC,8/3R2pk/7p/1pRN1P2/1Pb1n3/2P5/1K6/6r1 b - - 1 46,e4c5 d5f6 h7h8 d7d8 c4g8 d8g8,1058,79,95,8485,arabianMate endgame long mate mateIn3 pin,https://lichess.org/Lc0gPsW4/black#92,
KPHIG,1r4k1/R2N1p2/p3p1pP/4p1P1/8/2n5/1r4B1/K6R w - - 8 35,d7b8 b2a2,1074,87,92,1087,arabianMate endgame mate mateIn1 oneMove,https://lichess.org/80AQK7T2#69,
8KxAB,7k/R7/5N2/5P1p/5K2/1p6/p7/2r5 b - - 0 60,a2a1q a7h7,1068,83,89,1398,arabianMate endgame mate mateIn1 oneMove,https://lichess.org/9VVFFDPr/black#120,
wk8NS,r4rk1/1pp2ppp/8/4P3/3P3P/1Pn5/qQ4P1/K2R1B1R w - - 0 22,b2a2 a8a2,1048,78,84,185,arabianMate master mate mateIn1 middlegame oneMove,https://lichess.org/QQwmXzPt#43,
ZHim2,kr6/1R1R4/p1N2n2/5pK1/4PP1p/4P2P/P1P5/5q2 b - - 0 39,b8b7 d7d8 b7b8 d8b8,1069,79,88,248,arabianMate endgame mate mateIn2 short,https://lichess.org/3KRf95z0/black#78,
KBvJj,7r/1p3pk1/p5p1/2P4q/1P2P3/P2p1n2/5PRP/R2Q3K w - - 1 29,d1d3 h5h2 g2h2 h8h2,1062,82,72,402,arabianMate endgame mate mateIn2 sacrifice short,https://lichess.org/ZpwdQykB#57,
FmgDb,r3rn1k/pp3p1p/1q3Np1/3P2P1/7Q/1BP2P2/PP2p1P1/1b2K2R b K - 3 23,b6e3 h4h7 f8h7 h1h7,1068,77,94,459,arabianMate kingsideAttack mate mateIn2 middlegame sacrifice short,https://lichess.org/puIQwZkh/black#46,
F3VMZ,6Qk/p5rp/5N2/2p5/8/8/1PP2q2/2K4R b - - 0 34,g7g8 h1h7,1050,83,80,232,arabianMate endgame master mate mateIn1 oneMove,https://lichess.org/ucqzDHLu/black#68,
2UfED,6rk/3p1R2/ppb1pN1b/2p5/P1B1P3/3P1n2/1PP5/3K4 b - - 1 30,g8g7 f7f8 g7g8 f8g8,1052,81,91,1409,arabianMate mate mateIn2 middlegame short,https://lichess.org/KotzhuLU/black#60,
IcYsg,5rk1/4R2p/1p1p2p1/8/P5Pn/1P3P2/2r3BP/R5K1 w - - 0 25,g2f1 h4f3 g1h1 c2h2,1077,81,90,1929,arabianMate endgame mate mateIn2 short,https://lichess.org/EraYTNIj#49,
jYKfv,2R1N2k/r5p1/p4p1p/8/8/P2n3P/bP3PP1/4R1K1 b - - 2 33,d3e1 e8f6 a2g8 c8g8,1098,80,91,694,arabianMate discoveredAttack endgame mate mateIn2 short,https://lichess.org/JgiVG9M0/black#66,
yiXW0,rnb1kb1r/ppp2p1p/6pn/4N1Q1/2Bqp3/8/PPPP1PPP/RNB2RK1 b kq - 1 7,h6f5 c4f7,1075,77,100,216,attackingF2F7 mate mateIn1 oneMove opening,https://lichess.org/G5e7Dw7z/black#14,Elephant_Gambit Elephant_Gambit_Other_variations
JH7GY,r3k1nr/ppp2ppp/2np2q1/6B1/2BPP3/2P2Q2/P4PPP/R3K2R b KQkq - 0 12,g6g5 f3f7 e8d8 f7f8,1032,84,93,2541,advantage attackingF2F7 middlegame short,https://lichess.org/buP9e4kV/black#24,Italian_Game Italian_Game_Classical_Variation
hh9A1,r2qk2r/p4pb1/2p1p1p1/1p1n1bNn/3P4/1BPN1Q1P/PP1B1P1P/R4RK1 b kq - 5 17,f5d3 f3f7,1023,80,89,472,attackingF2F7 mate mateIn1 middlegame oneMove,https://lichess.org/UbcdkLgt/black#34,Caro-Kann_Defense Caro-Kann_Defense_Main_Line
apKKT,rnb1k1n1/ppp2p2/8/8/6pq/8/PPPPPR2/R1BQKB2 w Qq - 2 14,e2e4 g4g3 d1f3 g3f2,1071,78,95,3740,advancedPawn attackingF2F7 crushing middlegame short,https://lichess.org/M1jPP0xK#27,Bird_Opening Bird_Opening_Froms_Gambit
2FGMt,rn1qkb1r/ppp2ppp/1n2p3/4Nb2/2PP2P1/5Q2/PP3P1P/RNB1KB1R b KQkq - 0 8,f5b1 f3f7,1090,81,90,605,attackingF2F7 mate mateIn1 oneMove opening,https://lichess.org/aTO0TMoa/black#16,Alekhine_Defense Alekhine_Defense_Two_Pawns_Attack
RJpRE,r3kb1r/pb2pppp/8/1P6/3qn3/1PN5/P2P1PPP/R1BQKB1R w KQkq - 2 10,c1b2 d4f2,1034,78,100,161,attackingF2F7 mate mateIn1 oneMove opening,https://lichess.org/B72nJBlm#19,Scandinavian_Defense Scandinavian_Defense_Modern_Variation
SISwo,rnbqkb1r/ppp1pppp/5n2/4N3/2B1p3/8/PPPP1PPP/RNBQK2R b KQkq - 3 4,b8c6 c4f7,1049,87,93,7089,attackingF2F7 mate mateIn1 oneMove opening,https://lichess.org/1ak9caAu/black#8,
I3wsc,r1bqk2r/p3nppp/2n1p3/1p2N3/2pP4/4PQ2/1P3PPP/RN2KB1R b KQkq - 3 10,c8b7 f3f7,1022,83,93,1616,attackingF2F7 mate mateIn1 oneMove opening,https://lichess.org/rlWFu12C/black#20,
fMjMb,r1b1kbnr/pppp1ppp/5q2/6B1/2Bp4/5Q2/PPP2PPP/RN2K2R b KQkq - 0 7,f6g5 f3f7 e8d8 f7f8,1079,96,93,1094,attackingF2F7 deflection mate mateIn2 opening short,https://lichess.org/gYrRWgN3/black#14,Scotch_Game Scotch_Game_Scotch_Gambit
WOxhi,rn1qkbnr/pp2pppp/2p5/2P1Nb2/8/1Q1pP3/PP1P1PPP/RNB1KB1R b KQkq - 0 6,b8a6 b3f7,1091,81,89,165,attackingF2F7 mate mateIn1 oneMove opening,https://lichess.org/j4292MPT/black#12,Reti_Opening Reti_Opening_Advance_Variation
9kczC,rn1qkb1r/1bpppppp/p4n2/8/2BP4/1Q2PN2/PP3PPP/RNB1K2R b KQkq - 2 6,b7f3 c4f7,1047,90,50,43,attackingF2F7 mate mateIn1 oneMove opening,https://lichess.org/NtJj6Wpd/black#12,Indian_Defense Indian_Defense_Other_variations
54c7p,r3k1nr/pbpp1ppp/1p6/4p3/1PB1P2q/P2PPQP1/2P4P/RN2K2R b KQkq - 0 10,h4h6 f3f7 e8d8 f7f8,1018,145,87,20,attackingF2F7 mate mateIn2 middlegame short,https://lichess.org/ypWcKGSM/black#20,Italian_Game Italian_Game_Other_variations
7LhQI,r1b2rk1/ppNnB1pp/8/3p1p2/3Pn3/P2BPN2/1P3PqP/R2QK2R w KQ - 0 14,h1g1 g2f2,1023,94,90,902,attackingF2F7 mate mateIn1 middlegame oneMove,https://lichess.org/XkLKYMvG#27,Queens_Gambit_Declined Queens_Gambit_Declined_Other_variations
z73DN,r2qkbnr/pp1bpppp/2np4/2p5/2B1P3/1QP2N2/PP1P1PPP/RNB1K2R b KQkq - 2 5,a8b8 c4f7,1004,114,38,51,attackingF2F7 mate mateIn1 oneMove opening,https://lichess.org/VRyKW4lK/black#10,Sicilian_Defense Sicilian_Defense_Modern_Variations
5C2Fi,r1bqkbnr/5ppp/p1np4/1p1Qp3/4P3/1BN2N2/PP3PPP/R1B1K2R b KQkq - 1 9,c8b7 d5f7,1052,78,88,430,attackingF2F7 mate mateIn1 oneMove opening,https://lichess.org/eEpIcTFT/black#18,
gLD6p,rnb2rk1/pp4p1/2p1pq1p/3pN1bQ/2PPpB2/4P3/PP3P2/R3KBR1 w Q - 2 14,f4g5 f6f2 e1d1 f2g1,1090,77,95,820,advantage attackingF2F7 fork middlegame pin short,https://lichess.org/1lckKDwQ#27,Queens_Pawn_Game Queens_Pawn_Game_Accelerated_London_System
NViWL,r1b1k1nr/pppp1ppp/2n2q2/8/1PPbp3/P1N5/3PPPPP/R1BQKBNR w KQkq - 3 7,c1b2 f6f2,1037,91,78,144,attackingF2F7 mate mateIn1 oneMove opening,https://lichess.org/Yb7aZ7LQ#13,
3nvEw,r1b1k2r/pp3ppp/1qn2n2/2bp2B1/8/P1N2N2/1PP2PPP/R2QKB1R w KQkq - 3 10,g5f6 c5f2 e1d2 b6e3,1039,79,93,6265,attackingF2F7 mate mateIn2 opening short,https://lichess.org/XFi2RyIa#19,French_Defense French_Defense_Knight_Variation
EcO3g,r1b1k2r/1p1nppbp/p3P1p1/8/2B5/2N5/PP3PPP/R1BR2K1 b kq - 0 13,d7b6 e6f7 e8f8 d1d8,1042,77,84,145,advancedPawn attackingF2F7 mate mateIn2 middlegame short,https://lichess.org/DKD59jHL/black#26,Sicilian_Defense Sicilian_Defense_Smith-Morra_Gambit
6Tcp6,rnb1k1nr/pp1p1ppp/4pq2/2b5/4P3/B7/P1PP1PPP/RN1QKBNR w KQkq - 2 5,c2c3 f6f2,1046,79,81,270,attackingF2F7 mate mateIn1 oneMove opening,https://lichess.org/FB12KQPo#9,Sicilian_Defense Sicilian_Defense_Wing_Gambit
9IhIl,r7/pppqp1k1/2n3pp/4P2n/2PP2p1/4B3/PP2N2P/R4QK1 b - - 1 19,a8f8 e3h6 g7h6 f1f8,1071,80,94,1882,attraction crushing deflection middlegame short,https://lichess.org/KlMMhhqQ/black#38,Kings_Indian_Defense Kings_Indian_Defense_Four_Pawns_Attack
FpiQw,3rrk2/p4p2/6nN/2p5/2q5/2P3Q1/2P2PPP/R4RK1 w - - 1 26,a1a7 c4f1 g1f1 d8d1,1042,78,94,1183,attraction mate mateIn2 middlegame sacrifice short,https://lichess.org/Jj9ADFXj#51,
1taCv,8/8/1p1kp3/4r2p/5Q1P/6P1/P2K4/8 w - - 7 38,f4d4 e5d5 d2e3 d5d4 e3d4 e6e5,1002,83,95,1692,attraction crushing defensiveMove endgame long pin queenRookEndgame,https://lichess.org/vW134XSQ#75,
2Nfna,q4rn1/2pbppkp/2np2p1/6PP/3PPN2/1pP2P2/1P1Q4/rNKR1B1R w - - 1 19,h5g6 a1b1 c1b1 a8a2 b1c1 a2a1,1052,77,94,10675,attraction long mate mateIn3 middlegame queensideAttack sacrifice,https://lichess.org/80oYGtMc#37,Modern_Defense Modern_Defense_Other_variations
JJYjT,8/1r3k2/2n2pp1/3N4/1pP1PP2/1R1PK2r/5R2/8 w - - 4 39,f2f3 h3f3 e3f3 c6d4 f3e3 d4b3,1044,75,100,129,attraction crushing endgame fork long master,https://lichess.org/Z2Z1r45a#77,
AGWca,2r2r1k/pbqnb1pp/1p3p2/4pP2/2BPp3/4Q2R/PP1NN1PP/R5K1 b - - 1 20,e5d4 h3h7 h8h7 e3h3,1077,78,93,735,attraction kingsideAttack mate mateIn2 middlegame sacrifice short,https://lichess.org/KQNnTyhK/black#40,
eq971,2r1k3/5p1R/p3pPp1/1p2P3/5PK1/2pr4/P5P1/2R5 b - - 1 47,c3c2 h7h8 e8d7 h8c8 d7c8 c1c2,1002,77,98,1345,advantage attraction capturingDefender endgame long master rookEndgame,https://lichess.org/TGr26ikM/black#94,
sBGze,r6k/ppp2prp/5Q2/2p2P2/2b1P3/7R/P1q3PP/6RK b - - 0 24,a8g8 h3h7 h8h7 f6h4,1011,87,92,1956,attraction kingsideAttack mate mateIn2 middlegame pin sacrifice short,https://lichess.org/FMDpHKuX/black#48,
p0Plt,3r3r/ppp2k1p/1n4pQ/5b2/3q4/8/PP3PPP/R1B1R1K1 b - - 5 23,d4g7 e1e7 f7e7 h6g7,1032,78,88,100,attraction crushing deflection middlegame short,https://lichess.org/Jt7SytDS/black#46,
BRthQ,1k5Q/1p1q4/8/4p3/4r3/R7/KP6/8 b - - 1 55,d7c8 a3a8 b8a8 h8c8,1080,75,100,1056,attraction crushing deflection endgame short,https://lichess.org/rw4b4snT/black#110,
Q2LxA,r1b1k3/pp3p2/4p3/3R4/5q2/3N2pr/PPB1QbP1/5R1K w q - 0 25,g2h3 g3g2 h1g2 f4g3 g2h1 g3h3,1028,77,90,2034,advancedPawn attraction deflection exposedKing long mate mateIn3 middlegame,https://lichess.org/HcOb3xq8#49,
7PCnl,5Q2/pp4pk/2n4p/8/3pB1Pn/3P3P/PPP1pP1K/4q3 b - - 3 30,h4g6 e4g6 h7g6 f8f5,1094,82,90,4307,attraction endgame mate mateIn2 short,https://lichess.org/82OZS44I/black#60,
bqnvD,rnbq1r2/p4pk1/2p1p1p1/1p1pN1b1/3P4/7Q/PPP1PPP1/1K1R1B1R b - - 3 15,f8h8 h3h8 d8h8 h1h8 g7h8 e5f7 h8g7 f7g5,1060,76,85,263,advantage attraction fork opening veryLong,https://lichess.org/xU611BVQ/black#30,Indian_Defense Indian_Defense_Other_variations
IBiEd,r2q1rk1/1ppb1ppp/6P1/4p2P/p3P3/1B1P2Q1/PPP5/2KR2R1 b - - 0 19,a4b3 g6h7 g8h7 g3g7,1050,80,93,1089,advancedPawn attraction discoveredAttack kingsideAttack mate mateIn2 middlegame short,https://lichess.org/W6T2j444/black#38,Bishops_Opening Bishops_Opening_Vienna_Hybrid
eIVeQ,3r3k/6pp/1p6/2p2p2/Pp4n1/1Bq1P1P1/K2pQ1P1/7R b - - 3 43,g4e3 h1h7 h8h7 e2h5,1078,84,94,10457,attraction endgame mate mateIn2 sacrifice short,https://lichess.org/giEYcV3F/black#86,
RqGwo,r4k2/1pp4p/3pbpq1/p3p1n1/4P2Q/P2PK2P/1PP2R2/5R2 b - - 9 25,f8g7 f2f6 g6f6 f1f6 g7f6 h4h6,1084,76,99,856,advantage attraction long middlegame,https://lichess.org/EZVxYCaZ/black#50,
PNRIq,r2q3r/ppp1kppp/3b2b1/1B1P4/3Q2P1/4P2P/PP3P2/R1B1K2R w KQ - 3 13,d4g7 d6b4 c1d2 b4d2 e1d2 d8d5,1074,75,89,543,advantage attraction long middlegame,https://lichess.org/aLsgST6s#25,Queens_Gambit_Declined Queens_Gambit_Declined_Marshall_Defense
WUGDA,3R2k1/pp3rp1/7p/4B3/3P2P1/r7/6P1/6K1 b - - 1 30,f7f8 d8f8 g8f8 e5d6 f8f7 d6a3,1083,77,90,1922,attraction crushing endgame fork long,https://lichess.org/WOyjQBWQ/black#60,
2KAZj,8/2p2k2/4b1pp/4P3/p1r1BP2/P1P5/1P4PP/4R2K w - - 0 31,g2g3 c4e4 e1e4 e6d5 h1g1 d5e4,1035,76,98,2486,advantage attraction endgame long pin sacrifice,https://lichess.org/moa74saK#61,
dFTto,rnbq1rk1/pp2nppp/4p3/2ppP3/3P4/P1PB1N2/2P2PPP/R1BQK2R b KQ - 3 8,c5c4 d3h7 g8h7 f3g5,1027,88,92,1410,attraction crushing kingsideAttack opening sacrifice short,https://lichess.org/kJNlYznZ/black#16,French_Defense French_Defense_Winawer_Variation
jUQb0,2r5/8/3BpQ2/p2bP1pk/1p6/4p3/PP3P2/1K6 w - - 2 36,d6e7 d5e4 b1a1 c8c1,1057,76,94,2338,backRankMate endgame mate mateIn2 short,https://lichess.org/rVzr8rLh#71,
l4IAO,r1r3k1/R1R2ppp/2b1p3/2p5/2P5/8/6PP/6K1 b - - 5 29,a8a7 c7c8 c6e8 c8e8,1019,85,90,129,backRankMate endgame fork hangingPiece mate mateIn2 short,https://lichess.org/3MhWpEcX/black#58,
XAqpt,4r1k1/pp2rppp/2p5/5Q2/3qRR2/P5P1/1P5P/7K b - - 0 25,e7e4 f5f7 g8h8 f7f8 e8f8 f4f8,1086,80,89,557,backRankMate endgame long mate mateIn3 sacrifice,https://lichess.org/R8vRHZhv/black#50,
8cHc3,1r1n1r1k/p5pp/b7/2bB4/3qQ3/P1N5/1PP2PPP/R1B2RK1 w - - 1 20,f1e1 d4f2 g1h1 f2f1 e1f1 f8f1,1004,87,93,849,backRankMate long mate mateIn3 opening sacrifice,https://lichess.org/aaaU14T1#39,
KB7l2,2k2r2/1p3q2/p3p3/P2pP1p1/2p3Q1/2P5/2P3PP/R5K1 w - - 2 25,g4g5 f7f2 g1h1 f2f1 a1f1 f8f1,1026,77,94,5134,backRankMate endgame long mate mateIn3 sacrifice,https://lichess.org/mxihYhjn#49,
6wUez,4r1k1/ppp2ppp/8/8/8/1BP1BQ2/P1P1KP1q/R5r1 b - - 3 23,g1a1 f3f7 g8h8 f7e8,1026,81,92,99,backRankMate endgame fork mate mateIn2 short,https://lichess.org/dHRuRTvF/black#46,
No6qJ,5rk1/2p1b1p1/8/4p3/3qP3/8/2QB1PPP/R5K1 w - - 1 25,a1c1 d4f2 g1h1 f2f1 c1f1 f8f1,1005,76,100,223,backRankMate endgame long mate mateIn3 sacrifice,https://lichess.org/14WxiHD1#49,
Hli3G,5r1k/6pp/2P2q2/3Qp3/p7/8/5PPP/4R1K1 w - - 1 30,d5e5 f6f2 g1h1 f2f1 e1f1 f8f1,1077,76,89,494,backRankMate endgame long mate mateIn3 sacrifice,https://lichess.org/g8W0rm2R#59,
v0ftG,7k/p5p1/4P1p1/7p/5r2/2Q5/2P3PP/7K w - - 0 35,e6e7 f4f1,1031,122,87,18,backRankMate endgame mate mateIn1 oneMove queenRookEndgame,https://lichess.org/rnB7nbpB#69,
zgltb,r1b1R1k1/pp3rpp/2pp2n1/6q1/1bB5/2N3P1/PPP3PP/5RK1 b - - 1 16,g6f8 c4f7 g8h8 e8f8,1027,81,94,790,backRankMate mate mateIn2 middlegame short,https://lichess.org/HAUwi0Wz/black#32,Nimzowitsch_Defense Nimzowitsch_Defense_Kennedy_Variation
xlVnE,4r1k1/pp1r2p1/7p/8/8/P7/5PPP/3R2K1 w - - 0 31,d1d7 e8e1,1041,192,54,7,backRankMate endgame mate mateIn1 oneMove rookEndgame,https://lichess.org/loYMmw4m#61,
yIeiG,5r1k/2bB2p1/p6p/2p1P3/2Pn4/3P3Q/P5PP/4RrK1 w - - 0 29,e1f1 d4e2 g1h1 f8f1,1025,75,96,4393,backRankMate deflection endgame mate mateIn2 short,https://lichess.org/fw3Vdmxp#57,
L0rcU,7k/2p1q1pp/p7/8/8/6PP/PR5K/5r2 b - - 1 33,e7e1 b2b8 e1e8 b8e8 f1f8 e8f8,1048,112,83,45,backRankMate endgame long mate mateIn3 queenRookEndgame,https://lichess.org/CLOrJXM2/black#66,
3RmC2,r4k1r/pp2ppbp/5np1/1BP2b2/1P1QP3/q1N5/P1K2PPP/3R2NR b - - 0 14,f6e4 d4d8 a8d8 d1d8,1019,81,84,505,backRankMate mate mateIn2 middlegame sacrifice short,https://lichess.org/V4uBmG7H/black#28,Queens_Gambit_Declined Queens_Gambit_Declined_Austrian_Defense
iA3B5,7k/1p5n/p4NQ1/2b5/P3P3/2P2B2/1rq3PP/R5K1 w - - 5 37,g1h1 b2b1 a1b1 c2b1 f3d1 b1d1,1009,77,90,838,backRankMate long mate mateIn3 middlegame,https://lichess.org/uDG5wwRH#73,
