PuzzleId,FEN,Moves,Rating,RatingDeviation,Popularity,NbPlays,Themes,GameUrl,OpeningTags
ebsKw,q4rk1/1pp1npp1/1b5p/3p4/1PbPP2N/2Q3PP/1B3PB1/4R1K1 b - - 0 26,c7c6 e4d5 c6d5 e1e7,1270,76,90,1643,crushing discoveredAttack middlegame short,https://lichess.org/3FN0uMxt/black#52,
yThpX,2kr3r/1p6/p3N2p/3pq3/4n3/8/P1P1Q2P/1R3R1K w - - 0 25,e6d8 e4g3 h2g3 e5e2,1235,75,99,2390,advantage discoveredAttack middlegame short,https://lichess.org/EzCtfTUT#49,
KkyAV,r4r2/1b5k/2p4p/2b2p2/PpBN1P2/1P2p1P1/2P3KP/3R1R2 w - - 0 29,f1e1 c5d4 d1d4 c6c5,1265,74,87,446,advantage discoveredAttack middlegame short,https://lichess.org/CE2LIQ0x#57,
DPdwf,3b4/ppk2b2/1p6/4B2p/1P2BPp1/P7/6PP/7K b - - 6 37,c7c8 e4f5 f7e6 f5e6,1217,280,0,17,bishopEndgame doubleBishopMate endgame mate mateIn2 short,https://lichess.org/1iZ3WvkO/black#74,
A8Bdz,r4r1k/ppp4p/2n3p1/2P5/2Bb1B2/P4p1q/R2Q3N/7K b - - 1 25,f3f2 d2d4 c6d4 f4e5 f8f6 e5f6,1257,98,86,2938,doubleBishopMate fork long mate mateIn3 middlegame sacrifice,https://lichess.org/Brd2SP0u/black#50,
LCk92,r4k2/pp1R4/2p5/2bP4/6b1/1B6/PP5P/R4N1K w - - 0 30,d5c6 g4f3,1219,168,78,77,doubleBishopMate mate mateIn1 middlegame oneMove,https://lichess.org/stDIrxxv#59,
K397z,r2qr2k/ppp4p/5Qp1/3B4/2P5/1P4P1/PB1N1K1P/R7 b - - 0 19,d8f6 b2f6,1290,94,88,1210,doubleBishopMate mate mateIn1 middlegame oneMove,https://lichess.org/pX6fa1WO/black#38,
YbHET,r2r2k1/p1R1pp1p/1p3bp1/n2P4/1B2PPb1/8/P2N2PP/4KB1R w K - 4 18,h2h3 f6h4 g2g3 h4g3,1262,87,87,547,doubleBishopMate master mate mateIn2 middlegame short,https://lichess.org/1t1E6Muk#35,Grunfeld_Defense Grunfeld_Defense_Exchange_Variation
Ioye7,8/6p1/b4k2/P3b1R1/7P/6PK/8/8 w - - 5 49,g3g4 a6f1,1266,98,83,174,doubleBishopMate endgame mate mateIn1 oneMove,https://lichess.org/xr3fdCA2#97,
o8eNt,rn2kb1r/ppq2pp1/2p1p1p1/2P3B1/3PB2P/1Q6/PP3P2/R3K2R b KQkq - 0 18,b8d7 b3e6 f7e6 e4g6,1291,92,84,3714,deflection doubleBishopMate mate mateIn2 middlegame sacrifice short,https://lichess.org/cyLZ6ge2/black#36,Slav_Defense Slav_Defense_Quiet_Variation
Y4oEZ,2b2n2/r1kn4/p1B5/1pp1P1Q1/3b4/3P2P1/PPP4P/5R1K w - - 1 25,c6d7 c8b7 d7c6 b7c6 f1f3 c6f3,1236,100,87,3637,doubleBishopMate long master mate mateIn3 middlegame,https://lichess.org/oqeAsOFJ#49,
zIcwJ,r4r1k/1p5p/p1bB4/4ppp1/4P1Q1/1B3P2/PP4P1/6K1 b - - 0 29,f5g4 d6e5 f8f6 e5f6,1262,130,86,158,doubleBishopMate endgame mate mateIn2 short,https://lichess.org/bLSNonDk/black#58,
rje3S,r4rk1/ppp3pp/2n5/1Bbpp1qn/4P1b1/1P1P2P1/PBPQ3P/RN2R2K w - - 0 16,d2g5 g4f3,1218,100,83,2461,doubleBishopMate mate mateIn1 middlegame oneMove,https://lichess.org/PZRPrMLD#31,Nimzo-Larsen_Attack Nimzo-Larsen_Attack_Modern_Variation
zvK84,4rR1k/pp1n3p/6p1/4r1B1/8/1BP5/PP4PP/5RK1 b - - 0 31,e8f8 f1f8 d7f8 g5f6,1241,81,89,5028,doubleBishopMate endgame master mate mateIn2 short,https://lichess.org/A8rSPhOi/black#62,
vlnT7,3rq2k/1p5p/p1n1B1p1/2p3B1/3QP3/3P1R2/PPP3PP/7K b - - 0 22,c6d4 g5f6,1244,106,78,201,doubleBishopMate endgame mate mateIn1 oneMove,https://lichess.org/ADoOQoGu/black#44,
lHunZ,1r3rk1/pb1p3p/6p1/B4p2/2Pb4/1P3qP1/P5BP/R3Q2K w - - 0 24,g2f3 b7f3,1204,341,-38,30,doubleBishopMate kingsideAttack mate mateIn1 middlegame oneMove,https://lichess.org/qMm6LxZS#47,
nkPnl,2b4r/pp3pkp/3p4/2b1n2q/4P3/4PQ2/P1P3PP/R4BKR w - - 0 23,f3h5 c5e3,1240,102,79,2259,doubleBishopMate kingsideAttack mate mateIn1 middlegame oneMove,https://lichess.org/OOT0xyVx#45,
vZU5O,3r1rk1/Q4ppp/8/2p5/5b2/2q2P2/P1P1b1PP/R3B1KR w - - 0 22,e1c3 f4e3,1240,100,83,3172,doubleBishopMate mate mateIn1 middlegame oneMove,https://lichess.org/hIBaNziR#43,
PkEWy,r1b1qr1k/1p1p3p/5Qp1/p3NpB1/2B5/1P6/P1n2PPP/6K1 b - - 1 23,f8f6 g5f6,1286,319,19,51,doubleBishopMate kingsideAttack mate mateIn1 middlegame oneMove,https://lichess.org/gpd3OopD/black#46,
V3Iat,7k/4RBbp/p1p3p1/6P1/5PR1/2N1Bq1b/PPP4K/8 b - - 0 27,f3g4 e7e8 g7f8 e3d4,1295,96,87,5479,doubleBishopMate mate mateIn2 middlegame pin short,https://lichess.org/CKjpiMf8/black#54,
f6E2H,r4rk1/ppp2ppp/8/2bP4/2q3b1/2NQ2P1/4N2P/4R2K w - - 0 21,d3c4 g4f3,1218,334,-100,3,doubleBishopMate mate mateIn1 middlegame oneMove,https://lichess.org/ceYcScRr#41,
Ks40V,4k2r/rbppqppp/p7/1pbQ4/4nP2/1BP3P1/PP5P/RNB1R2K w k - 3 16,e1e4 e7e4 d5e4 b7e4,1297,93,87,2006,doubleBishopMate kingsideAttack master mate mateIn2 middlegame short xRayAttack,https://lichess.org/DARVecV3#31,Ruy_Lopez Ruy_Lopez_Morphy_Defense
LD2rp,r2qr1k1/pppnbppp/8/3p4/2PP4/3BBN2/b1PQ1PPP/2KR3R w - - 0 13,c4d5 e7a3,1266,255,70,71,doubleBishopMate mate mateIn1 middlegame oneMove,https://lichess.org/XaNpyxQM#25,Petrovs_Defense Petrovs_Defense_Nimzowitsch_Attack
nHNbt,8/4k1p1/1p3p1p/pP2P3/Pnr5/6P1/1B5P/4R1K1 b - - 0 29,b4d3 e5f6 e7f7 e1e7,1271,79,94,4241,crushing doubleCheck endgame short,https://lichess.org/0xcjx4NB/black#58,
rUTEn,r2qr1k1/1p3p1n/4n2B/p1p3b1/P2pP1N1/3P2Q1/1P3PP1/R4RK1 b - - 3 27,g5h6 g4h6 g8f8 g3g8,1270,75,100,1117,advantage doubleCheck kingsideAttack middlegame short,https://lichess.org/mGE2hOy6/black#54,
os79F,1rb1kb1r/pp3p1p/5p2/2PN4/8/8/PP1KBnPP/4R1NR b k - 2 14,f2h1 e2b5 e8d8 e1e8,1288,76,95,7531,doubleCheck mate mateIn2 middlegame short,https://lichess.org/6E7pGVNs/black#28,Caro-Kann_Defense Caro-Kann_Defense_Panov_Attack
L1ihH,2r5/p4pk1/n2p3p/1p1P2qN/4r3/2N5/PP1Q2P1/2K4R b - - 0 22,g7h7 d2g5 h6g5 h5f6 h7g6 f6e4,1222,76,94,9438,advantage doubleCheck fork long middlegame,https://lichess.org/ltPYyCsY/black#44,
I6Oqg,rn2kb1r/ppp2ppp/5nb1/8/2BqN1P1/1P3P2/PBPPQ2P/R3K2R b KQkq - 0 12,d4b2 e4f6 e8d8 e2e8,1214,75,100,2130,doubleCheck mate mateIn2 middlegame short,https://lichess.org/Spe71P1k/black#24,Elephant_Gambit Elephant_Gambit_Other_variations
fkJMs,7k/3n3p/1p1QN1p1/p4q2/3n4/6P1/PP5P/1KB5 w - - 8 37,b1a1 d4c2 a1b1 c2a3 b1a1 f5b1,1269,75,93,2059,doubleCheck endgame long mate mateIn3,https://lichess.org/rA9ZVXmt#73,
3sq5h,r3r1k1/p3bppp/5p2/3q1b2/3P4/2N5/PPP2PPP/R3KBNR w KQ - 0 12,c3d5 e7b4 e1d1 e8e1,1249,85,82,93,doubleCheck mate mateIn2 middlegame short,https://lichess.org/8sVcnlrE#23,Caro-Kann_Defense Caro-Kann_Defense_Other_variations
e5Uyp,k6r/P1K5/4pp2/8/5r2/8/7p/RR6 b - - 1 46,h2h1q b1b8 h8b8 a7b8q,1290,76,63,233,advancedPawn doubleCheck endgame mate mateIn2 promotion queenRookEndgame short,https://lichess.org/vihin8vs/black#92,
zj6Bp,rn1qkbnr/ppp2ppp/8/8/3pN1b1/5N2/PPPPQPPP/R1B1KB1R b KQkq - 3 6,b8c6 e4f6,1246,75,89,615,doubleCheck mate mateIn1 oneMove opening,https://lichess.org/X3gG1wJ4/black#12,French_Defense French_Defense_Knight_Variation
qBy3U,1r3r1k/5pp1/1q3b1N/3Pp2Q/1p2P3/pP5R/P1B3KP/8 b - - 0 32,g7g6 h6f7 h8g7 h5h7,1258,76,80,329,doubleCheck kingsideAttack mate mateIn2 middlegame short,https://lichess.org/akutLDur/black#64,
scN8B,8/5q1k/3p1r2/3Pp2P/1p4Q1/1Pr5/5P2/R5KR b - - 0 42,f6f2 g4g6 f7g6 h5g6 h7g6 g1f2,1234,76,92,3338,advantage doubleCheck endgame exposedKing long,https://lichess.org/6vtwEwc6/black#84,
QkxEa,4rrk1/1pp5/6p1/p1pP1p2/2P1P2q/P2B1Rp1/1P4P1/4QKN1 w - - 0 36,e1g3 h4g3 f3g3 f5e4 f1e2 e4d3,1265,88,80,59,advantage discoveredAttack doubleCheck long middlegame,https://lichess.org/LswJiZ5o#71,
4eXXF,5rk1/8/Q2N2pp/2q2r2/8/2b3P1/P4nBP/3R1RK1 w - - 1 29,d6f5 f2h3 g1h1 c5g1 f1g1 h3f2,1263,87,87,1420,doubleCheck long mate mateIn3 middlegame sacrifice smotheredMate,https://lichess.org/9IiynROS#57,
Px3wY,3r2k1/5p1p/4p1pP/pnQ1P1P1/P1pp1P2/1qP5/1PRK4/R7 w - - 0 35,c5b5 d4c3 d2e1 b3c2,1203,203,-100,6,crushing doubleCheck endgame short,https://lichess.org/oGICmuGa#69,
zvpyD,1Qb1r1k1/5pp1/p1p1p2p/2PpB3/3P1P2/P3qB2/5nPP/R4R1K w - - 2 29,h1g1 f2h3 g1h1 e3g1 f1g1 h3f2,1285,84,85,951,doubleCheck kingsideAttack long mate mateIn3 middlegame sacrifice smotheredMate,https://lichess.org/nQL0Jhfh#57,
GGaFl,2kr1b1r/pp4pb/5p2/3pp3/8/4P1B1/PPPN1P2/R2Q1RKq w - - 2 20,g1h1 h7e4 h1g1 h8h1,1265,86,37,67,doubleCheck kingsideAttack mate mateIn2 middlegame short,https://lichess.org/W5LWHPuJ#39,
CFod1,r1bqk2r/pp6/2p1p3/5pBn/2PP1b2/8/PP3PP1/R2Q1R1K w kq - 0 17,g5d8 h5g3 h1g1 h8h1,1204,75,95,15053,doubleCheck kingsideAttack mate mateIn2 middlegame short,https://lichess.org/M2m8aZUx#33,Slav_Defense Slav_Defense_Modern_Line
9FrL9,4kQ2/p2b2pq/1p2p2p/2p1P3/2P5/P1P5/5BPP/5RK1 b - - 0 27,e8f8 f2c5 f8g8 f1f8,1225,104,100,47,doubleCheck endgame mate mateIn2 short,https://lichess.org/hzKwjtqS/black#54,
95a5c,r4r2/ppp1q1nk/1b4n1/3Pp2P/5pp1/3B2B1/PP3PPQ/R4RK1 b - - 0 24,f4g3 h5g6 h7g8 h2h7,1270,74,95,20430,doubleCheck mate mateIn2 middlegame short,https://lichess.org/S9uxOooY/black#48,
T5Ejw,r5k1/ppp2pp1/2n4p/8/3P4/PQP1qB2/1B2rnPP/R4RK1 w - - 2 21,f3e2 f2h3 g1h1 e3g1 f1g1 h3f2,1259,89,86,2220,doubleCheck kingsideAttack long mate mateIn3 middlegame sacrifice smotheredMate,https://lichess.org/Vkwp5xBt#41,
ZVRwE,r2q1b1r/pb2k1p1/2p4p/n1N2p1Q/1nP1B3/8/PP1PKPPP/RNB4R b - - 0 15,f5e4 h5e5 e7f7 e5e6,1277,76,94,11421,dovetailMate master mate mateIn2 opening short,https://lichess.org/NemUsadz/black#30,Italian_Game Italian_Game_Two_Knights_Defense
D5MkL,6r1/pR5Q/2n1krp1/4pp2/3p4/3P1q2/PPP5/1K5R b - - 1 29,g8f8 h7d7,1230,82,78,270,dovetailMate mate mateIn1 middlegame oneMove,https://lichess.org/fEGKJV6M/black#58,
RYuS7,4k1Q1/3b4/2n1p2B/5p2/8/bpPP1N1P/4qP2/6K1 b - - 1 36,e8e7 g8f8,1231,76,100,186,dovetailMate mate mateIn1 middlegame oneMove,https://lichess.org/6CZ2Wg6m/black#72,
GvRnM,2r5/1p1k1Qp1/p3p3/3pP3/P2P2K1/6P1/2q2PP1/8 b - - 0 26,d7c6 f7e6 c6c7 e6d6,1247,102,71,63,dovetailMate endgame fork mate mateIn2 short,https://lichess.org/XttzvOO3/black#52,
A2Xbe,r1b1rk2/5p2/2p4Q/pp3q2/5P2/4p2P/PPP1B3/3R2RK b - - 0 27,f8e7 h6d6,1296,77,71,152,dovetailMate mate mateIn1 middlegame oneMove,https://lichess.org/uM0Mjm6o/black#54,
ShfM1,3r2k1/1p3p2/5pp1/1P2q3/3rP3/1Q1R1nP1/5PK1/3R4 w - - 0 34,g2f3 e5e4,1293,77,61,228,dovetailMate endgame master mate mateIn1 oneMove,https://lichess.org/d6XaFHKY#67,
w82Zl,r3k1nr/ppp2ppp/2n5/8/3bPp2/5q2/PPPKN1RP/R1BQ1B2 w kq - 2 14,e2d4 f3e3,1228,77,85,1695,dovetailMate mate mateIn1 oneMove opening,https://lichess.org/V5c02Sbm#27,Scandinavian_Defense Scandinavian_Defense_Other_variations
HTM7j,r2qr3/1bpp2p1/p4k1p/1pb5/3PP3/1PN2Q2/1PP2PPP/R3R1K1 b - - 1 15,f6g6 f3f5,1234,117,70,44,dovetailMate mate mateIn1 middlegame oneMove,https://lichess.org/MZab2LE5/black#30,Ruy_Lopez Ruy_Lopez_Morphy_Defense
Pn0cm,r5r1/1b3p1k/pp2p1p1/3p3N/3P1P1Q/7R/Pq4PP/5RK1 b - - 0 25,g6h5 h4h5 h7g7 h5h6,1298,94,84,230,dovetailMate mate mateIn2 middlegame short,https://lichess.org/o8oK5ZC4/black#50,
jKrRP,r4bnr/1N3ppp/p1B1pk2/8/P6Q/6P1/4PP1P/q1B1K2R b K - 2 17,g7g5 h4g5,1274,76,92,571,dovetailMate mate mateIn1 middlegame oneMove,https://lichess.org/ORHhxiN6/black#34,Queens_Gambit_Declined Queens_Gambit_Declined_Other_variations
ZL4mC,8/1RQ2pk1/3p4/3Pp3/p6p/2P3PP/6P1/5q1K w - - 1 40,h1h2 h4g3 h2g3 f1f4,1275,80,82,385,attraction dovetailMate endgame mate mateIn2 short,https://lichess.org/ingYhh6D#79,
5iWY8,3R3k/1p3P1p/p5p1/8/8/4q2P/PP4P1/7K b - - 0 29,h8g7 f7f8q,1210,75,95,3386,advancedPawn dovetailMate endgame master mate mateIn1 oneMove promotion,https://lichess.org/Xsr3tz1s/black#58,
GUZbo,3q2k1/1r5p/3p2p1/2n3R1/6P1/5Q1P/P4P2/4R1K1 b - - 0 29,d8g5 e1e8 g8g7 f3f8,1254,75,96,2380,dovetailMate endgame mate mateIn2 short,https://lichess.org/w7v4DtXB/black#58,
QoaRx,6k1/5p1p/b3p1p1/3p4/PB6/1P4R1/3Q2KP/1q6 w - - 4 39,b4d6 b1f1,1223,77,90,966,dovetailMate endgame mate mateIn1 oneMove,https://lichess.org/D4skGczV#77,
1I2EM,6k1/1p5p/1n1p2p1/1PpPp3/1nP1P1P1/7q/r3KP2/1BQ1RR2 w - - 5 27,b1a2 h3d3,1233,118,71,64,dovetailMate master mate mateIn1 middlegame oneMove,https://lichess.org/Ah8Ij9EU#53,
aLSUC,7Q/1pk5/2p5/2Pb1KB1/5P2/2P5/8/6q1 b - - 6 40,g1c5 h8d8,1257,86,31,96,dovetailMate endgame mate mateIn1 oneMove,https://lichess.org/h6M9yZHu/black#80,
AWhEr,5q2/6pk/p6p/1p1QN1b1/3P4/6P1/PP1R3P/2r3K1 w - - 1 25,g1g2 f8f1,1291,78,91,2981,dovetailMate endgame master mate mateIn1 oneMove,https://lichess.org/nqOwSJjZ#49,
EPSWv,6k1/4qp1p/6p1/2P1K1P1/3Q1P2/8/8/8 w - - 15 66,e5d5 e7e6,1274,83,84,676,dovetailMate endgame mate mateIn1 oneMove queenEndgame,https://lichess.org/JuWIwDET#131,
J6eGp,5r2/ppq2pk1/n1p1p3/7Q/6RP/8/P1P2PP1/6K1 b - - 2 24,g7f6 h5g5,1223,77,94,1979,dovetailMate endgame mate mateIn1 oneMove,https://lichess.org/jX1d72Q2/black#48,
b0k7s,8/4Q3/p7/1pk3Pp/2p2P1P/P2q4/7K/8 b - - 6 44,c5d4 e7e5,1282,84,81,873,dovetailMate endgame master masterVsMaster mate mateIn1 oneMove queenEndgame,https://lichess.org/WZdmmYn9/black#88,
VJHa8,5rk1/1p4p1/5q1p/p7/2PPp3/4R2P/P2Q2P1/6K1 w - - 1 31,e3e4 f6f1 g1h2 f8f2 d2f2 f1f2,1292,78,93,833,clearance crushing endgame long,https://lichess.org/lrCd5WhA#61,
tbdjM,6k1/1R5p/6p1/2r1Nn2/4KP2/2P5/5P1P/8 w - - 0 39,c3c4 f5d6 e4d4 d6b7,1254,77,85,357,advantage endgame fork master short,https://lichess.org/XcjMnXG0#77,
Z1uiu,1k3r2/1p6/1p2p3/4P1p1/6r1/4RB2/P4R1K/8 w - - 0 37,f2e2 f8h8,1249,76,89,729,endgame mate mateIn1 oneMove,https://lichess.org/XLDeU2sG#73,
uA0EC,8/8/8/5K1p/8/6kP/8/8 w - - 2 49,f5g5 h5h4 g5f5 g3h3 f5f4 h3g2,1264,111,18,47,crushing endgame long pawnEndgame quietMove,https://lichess.org/g7M3XoQt#97,
IFmyS,3r4/4bk1p/4ppp1/8/8/PNP5/1n3PPP/1R4K1 w - - 0 25,b1b2 d8d1,1268,184,75,17,backRankMate endgame mate mateIn1 oneMove,https://lichess.org/A1fCKM0j#49,
cGbZn,1r4k1/2p2ppp/3p4/p7/4PP2/P1PQ4/P1p3PP/Kr5R w - - 3 28,h1b1 b8b1,1239,79,72,122,endgame mate mateIn1 oneMove queenRookEndgame,https://lichess.org/N0Oysgx2#55,
lg8EP,6k1/pp4pp/q3pR2/3p4/P2P4/1PrrB1Q1/6PP/1R4K1 b - - 0 24,d3e3 g3b8 c3c8 b8c8,1219,76,80,282,endgame mate mateIn2 short,https://lichess.org/LdrNZK4K/black#48,
oxQ3W,3r4/1RR2pkp/5rp1/p7/3b4/6BP/P4PP1/6K1 w - - 11 27,g3h4 d4f2 h4f2 d8d1 f2e1 d1e1,1221,77,81,365,advantage endgame long master sacrifice,https://lichess.org/4munGANo#53,
izv5E,r7/pbpn3R/1p1p4/3Pp3/2P1Ppk1/2P5/P4KP1/R7 b - - 3 31,d7f6 h7g7 g4h5 a1h1,1219,77,100,2579,endgame mate mateIn2 short,https://lichess.org/g4yGUkmi/black#62,
EWPm9,8/8/5n2/1p2k1p1/2p1PpP1/2P2K1P/1PB5/8 w - - 0 35,b2b3 c4b3 c2b3 f6e4,1246,77,94,1412,advantage endgame short,https://lichess.org/msSWRIsQ#69,
UvISj,8/8/5pk1/3b1N2/6pp/1P4r1/P4RPK/8 b - - 5 42,g6g5 f5g3 h4g3 h2g3,1293,226,-100,5,crushing defensiveMove endgame short,https://lichess.org/CLcPJtO6/black#84,
N7ax0,8/8/1p1r3p/1R4pk/P4p2/5P1P/4K1P1/8 w - - 1 43,a4a5 b6a5 b5a5 h5h4 a5a2 h4g3,1293,292,100,2,crushing endgame long rookEndgame,https://lichess.org/PULf1Laq#85,
mT0yR,5k2/4pp1R/3p3P/5p2/1P1K4/8/6r1/8 b - - 0 38,f8g8 h7g7 g2g7 h6g7 g8g7 b4b5 g7f6 b5b6,1203,77,93,253,advancedPawn crushing endgame quietMove rookEndgame veryLong,https://lichess.org/08eMJsGp/black#76,
BlgRQ,8/2k5/p3Pp2/1p1p1Pp1/1P4P1/1P2K3/8/8 b - - 3 53,c7d6 e3d4 d6c6 e6e7 c6d7 d4d5,1234,79,55,123,advancedPawn crushing endgame long master pawnEndgame zugzwang,https://lichess.org/cjD5Ew9j/black#106,
M4JTH,8/8/8/p2n3R/6pP/1k2B1K1/5PP1/3r4 w - - 0 47,g3g4 d5f6 g4f5 f6h5,1265,77,73,202,crushing endgame fork short,https://lichess.org/EXFC3o7S#93,
NZ4gH,2r5/pp6/4p3/3p2k1/3Q4/2P4R/P3qPK1/8 b - - 2 33,c8g8 h3g3 g5f5 g3g8,1210,76,97,2702,endgame,https://lichess.org/YNatvLJq/black#66,
o9Oew,1k4r1/pp6/2Q5/8/P6p/6qP/6K1/1R3R2 w - - 0 34,g2h1 g3h3,1216,77,97,3438,endgame mate mateIn1 oneMove,https://lichess.org/gOUpWwKk#67,
kw21P,r4k2/pp4p1/2qp1r2/8/2QB4/8/P1P3PP/5RK1 w - - 9 27,c4c6 f6f1 g1f1 b7c6,1281,75,93,1109,advantage endgame intermezzo short,https://lichess.org/8YdFDQTr#53,
P6BfG,N4bnr/pk2pppp/8/4B3/5P2/3p4/P2P2PP/R5K1 b - - 1 17,b7a8 a1b1 a7a6 b1b8 a8a7 b8f8,1261,76,83,354,advantage endgame fork long quietMove,https://lichess.org/LfkqYJFC/black#34,Sicilian_Defense Sicilian_Defense_McDonnell_Attack
tAsJy,3rr1k1/5ppp/2q5/4p3/8/2N1P2P/QP4P1/5RK1 b - - 0 29,d8d3 a2f7 g8h8 f7f8 e8f8 f1f8,1232,77,58,111,backRankMate endgame long mate mateIn3 sacrifice,https://lichess.org/TsIwexMA/black#58,
6lGfF,r5k1/pp4pp/8/3pr3/2P1p1qb/4P1Pb/P2B1P1P/1BR1QRK1 w - - 1 21,f2f4 e4f3,1269,138,-49,58,advantage enPassant middlegame oneMove pin,https://lichess.org/7GEVLNrC#41,
xmFtI,6k1/5p1p/2n1p1p1/4B3/Kp3P2/8/P5PP/8 b - - 2 38,c6e5 f4e5 f7f5 e5f6,1278,81,75,340,crushing enPassant endgame short,https://lichess.org/d1WHhNyZ/black#76,
btZXj,r3k1nr/p2p1ppp/bq2P3/8/1p2P3/2N2N2/1PPBKbPP/R2Q1B1R w kq - 0 12,c3b5 a6b5 c2c4 b4c3,1240,77,89,3308,discoveredAttack enPassant hangingPiece mate mateIn2 opening short,https://lichess.org/PDFqACai#23,Sicilian_Defense Sicilian_Defense_Franco-Sicilian_Variation
QOahQ,3rr3/2pkbppp/3p1n2/p3P3/3N4/2B1Q3/qPP2PPP/2KR3R b - - 0 20,f6d5 e3h3 f7f5 e5f6,1240,76,99,986,discoveredAttack enPassant mate mateIn2 middlegame short,https://lichess.org/qGQoWIzq/black#40,
XuTtp,r2q1rk1/pppbbp2/2nppn1Q/8/3PP3/2NB1N2/PPP2PPP/R4RK1 b - - 0 10,f6h7 e4e5 f7f5 e5f6,1285,172,88,16,advantage enPassant middlegame short,https://lichess.org/i6DOckxH/black#20,Nimzowitsch_Defense Nimzowitsch_Defense_Franco-Nimzowitsch_Variation
Uxk22,5k2/5p1p/5p2/4r3/p4p2/P1P2P1P/5KP1/4R3 w - - 2 31,e1e5 f6e5 g2g4 f4g3,1253,78,89,2289,crushing enPassant endgame short,https://lichess.org/Fak3jII1#61,
wsDFy,rnb1r1k1/pp3pp1/2pb3p/8/3Pp2q/4B3/PPPNBPPP/R2Q1RK1 w - - 2 13,f2f4 e4f3,1271,80,86,403,advantage enPassant oneMove opening,https://lichess.org/RsWB7aq6#25,French_Defense French_Defense_Knight_Variation
C3fKl,8/8/8/pr6/R7/5K2/Pk6/8 w - - 7 50,f3g4 b5b4 a4b4 a5b4 a2a4 b4a3,1274,75,93,1623,crushing enPassant endgame long rookEndgame,https://lichess.org/V8zB6ccA#99,
KLQ1n,r2q1rk1/4b1pp/p2p1p1n/1p1P1P2/nP6/3B2N1/P5PP/R1BQ1RK1 b - - 2 19,g7g5 f5g6,1261,91,17,151,crushing enPassant middlegame oneMove,https://lichess.org/z9z37Ete/black#38,Zukertort_Opening Zukertort_Opening_Pirc_Invitation
TuoPL,r2q1rk1/pb2bp2/2pppn1Q/8/4P3/2NB4/PPP2PPP/R4RK1 b - - 0 13,f6h7 e4e5 f7f5 e5f6,1299,80,67,419,crushing enPassant middlegame short,https://lichess.org/yCgzqvdv/black#26,Sicilian_Defense Sicilian_Defense_Modern_Variations
ZoEQ9,8/p4p2/1p1Bp3/4P3/P1P2kpb/8/6K1/8 b - - 2 36,f7f5 e5f6 f4e3 f6f7,1235,83,86,550,advancedPawn bishopEndgame crushing discoveredAttack enPassant endgame short,https://lichess.org/rN1IWPzS/black#72,
OcKx5,4k3/5p1p/6p1/6P1/4KP2/4P3/8/8 b - - 1 66,e8e7 e4e5 f7f5 g5f6,1230,137,83,29,crushing enPassant endgame pawnEndgame short,https://lichess.org/HgDmzMnh/black#132,
bMKkI,8/6pp/3k1p2/1p2pP2/1P2K1P1/2P4P/8/8 b - - 0 46,g7g5 f5g6 h7g6 h3h4,1229,97,100,74,crushing defensiveMove enPassant endgame pawnEndgame short,https://lichess.org/UcMafQdL/black#92,
rdgdW,8/1p6/4p3/8/P6p/PQ2q3/4k1PP/7K w - - 12 45,b3e3 e2e3 g2g4 h4g3,1250,75,89,414,crushing enPassant endgame master short,https://lichess.org/szFWeV4c#89,
rDBu9,3k4/r2p1Rpp/4p1n1/p1p1P2r/P1N1K2P/1P4P1/2P2R2/8 b - - 3 34,d7d5 e5d6 a7f7 f2f7,1290,281,-61,17,crushing enPassant endgame short,https://lichess.org/ELzskFJm/black#68,
uSemx,8/1p3p2/2p5/4P2p/4qPk1/1P4P1/3Q3K/8 b - - 2 44,e4f3 d2d7 f7f5 e5f6,1260,78,92,5552,discoveredAttack enPassant endgame mate mateIn2 queenEndgame short,https://lichess.org/TxMV71vN/black#88,
kjFV6,rn2kb1r/pbppqppp/1p3n2/8/2P1p3/2N1P1P1/PPQP1PBP/R1B1K1NR w KQkq - 4 7,d2d4 e4d3 g2b7 d3c2,1287,82,76,344,advantage enPassant opening short,https://lichess.org/7NfGuDi9#13,English_Opening English_Opening_Kings_English_Variation
dlnCW,2kr3r/pp1bbp1p/1qn1p2p/3pP3/2pP4/P1P2N2/1PB2PPP/RNQ2RK1 w - - 2 12,b2b4 c4b3 c2b3 b6b3,1271,98,-19,109,advantage enPassant middlegame short,https://lichess.org/o5LSKYnc#23,French_Defense French_Defense_Advance_Variation
wTZr5,4k3/1p3p2/p1pR2p1/P2rP1P1/1PKP4/8/8/8 b - - 2 59,d5d6 e5d6 f7f5 g5f6,1285,77,88,1439,crushing enPassant endgame short,https://lichess.org/12oRNikq/black#118,
r9K5D,8/pp2k1p1/2p2p1p/2P1PP1P/3K4/8/P1P5/8 b - - 0 39,f6e5 d4e5 b7b5 c5b6,1239,138,60,33,crushing enPassant endgame master pawnEndgame short,https://lichess.org/Lxdpb50A/black#78,
9OiCY,1r3q2/R2n1Npk/4pn1p/1Q6/3P4/4P2P/4NPP1/6K1 w - - 1 25,a7b7 b8b7 b5b7 f8f7,1290,226,100,17,equality middlegame short,https://lichess.org/RpQ1nOmM#49,
wHx99,8/p7/6p1/2k1K1Pp/1pP4P/8/P7/8 b - - 0 38,c5c4 e5f6 a7a5 f6g6 a5a4 g6h5,1253,95,100,77,endgame equality long pawnEndgame,https://lichess.org/sF9EXWXy/black#76,
p02Wj,r3r1k1/pp1bb1pp/1q2p3/4n3/5B2/1PN4P/1PP3P1/R2Q1R1K b - - 2 19,e7f6 f4e5 f6e5 d1d7,1290,355,100,12,capturingDefender equality middlegame short,https://lichess.org/ZulrQ0vH/black#38,
9Zvh0,5r2/8/8/7P/1k4P1/p1n3K1/3R2P1/2R5 w - - 2 46,d2d3 c3e2 g3h4 e2c1 d3a3 b4a3,1221,96,100,84,endgame equality fork long,https://lichess.org/9yYXdSnk#91,
CEk1R,8/1k6/1P2pN2/1K5p/3P3P/5b2/5P2/8 w - - 1 53,f6e8 f3c6 b5c5 c6e8,1282,333,100,18,endgame equality fork short,https://lichess.org/N9GqtUTI#105,
jdmS3,r2q1rk1/pb1n1ppp/1p1p4/2pP4/1bP5/3B1N2/PP3PPP/R1BQ1RK1 w - - 2 13,d3h7 g8h7,1254,353,100,10,equality hangingPiece oneMove opening,https://lichess.org/x0KUOHuH#25,
AFByY,5b2/1k4p1/1p1p1p2/5r2/1PP1n3/7N/P4P1P/1K1R1R2 w - - 1 26,f2f3 e4c3 b1c2 c3d1,1294,235,100,23,endgame equality fork short,https://lichess.org/695bqnPE#51,
B5JFa,r4r1k/1pp3p1/1p1p3p/4pp1n/1PB1P1R1/P1PP3n/5P1N/R2Q3K w - - 0 21,g4h4 h3f2 h1g2 f2d1,1279,171,100,25,equality fork middlegame short,https://lichess.org/PeckShXu#41,
imrj1,6R1/8/5k2/8/r2K1P2/7N/8/8 w - - 1 58,d4e3 a4a3 e3e4 a3h3,1297,195,100,22,endgame equality short skewer,https://lichess.org/Zl8DC1w1#115,
ml8U8,r1b4r/1pk3pp/4q3/1p6/5Q1P/8/PP3PP1/3R2K1 b - - 3 29,c7b6 d1d6 e6d6 f4d6,1294,390,100,13,endgame equality fork short,https://lichess.org/VcbzHrkK/black#58,
E3Kzq,3k4/R7/2p1P3/p2p3P/2p5/1PP1b3/P1K5/8 w - - 1 45,b3c4 e3a7 c4d5 c6d5,1285,426,100,7,endgame equality hangingPiece short,https://lichess.org/xHL04ggc#89,
cg6Q2,8/6k1/1q6/8/3nK3/4N3/8/8 b - - 7 64,g7f6 e3d5 f6e6 d5b6,1287,323,100,10,endgame equality fork short,https://lichess.org/Fg3l9DEl/black#128,
GbREq,2r3k1/p1r3pp/1pb5/8/1P6/P1R1PB2/6PP/4R2K w - - 0 35,f3c6 c7c6 c3c6 c8c6,1293,404,100,12,endgame equality short,https://lichess.org/hxAeSSd0#69,
vwun6,4r1k1/ppr2p2/3p2qp/5P2/6Pn/6Q1/PPP4P/2KR3R b - - 0 25,h4f5 g4f5,1220,158,100,34,equality middlegame oneMove pin,https://lichess.org/SYecro6A/black#50,
ij4Mw,N1bk1b1r/pp1n1ppp/8/4P3/1q3B2/3Q4/PPP2PPP/R3K2R w KQ - 1 14,c2c3 b4f4,1213,223,71,11,equality hangingPiece middlegame oneMove,https://lichess.org/5HfQniWr#27,
OojbE,8/8/3p4/4b3/2k5/2p5/1pK5/4R3 b - - 3 58,e5f4 e1e4 c4c5 e4f4,1282,338,100,10,endgame equality fork short,https://lichess.org/68a3QFAy/black#116,
4aT4i,3b2k1/5rpp/1pr5/p1p1p3/P1PpPpN1/3P1P1P/5RP1/1R4K1 b - - 3 35,h7h5 g4e5 c6e6 e5f7,1269,216,100,29,endgame equality fork short,https://lichess.org/y7Hn7JUC/black#70,
Bidd6,2r3k1/4pp1p/3p2p1/3n4/Rqr5/1P3P2/1Q4PP/R6K b - - 1 29,c4c1 a1c1,1285,200,100,17,equality middlegame oneMove,https://lichess.org/JKBkXU0d/black#58,
cQv00,r5k1/2p1q1pn/pp1p3p/4pr2/2P5/1Q2BN1P/PPP2PP1/R4RK1 w - - 0 18,b3d3 e5e4 d3b3 e4f3,1297,101,100,78,equality fork middlegame short,https://lichess.org/ojVDtSIY#35,
JNc0q,r5k1/5ppp/2q1p3/prN1Q3/R2P4/6P1/5P1P/4R1K1 w - - 9 33,e5e2 b5c5 d4c5 c6a4,1276,394,100,10,capturingDefender discoveredAttack equality middlegame short,https://lichess.org/rUjtXswa#65,
PPLRZ,r1bqr1k1/pppn2bp/3p2p1/5nN1/3P1P2/2PQ1R2/PP4PP/RNB3K1 b - - 5 15,h7h6 d3c4 g8h8 g5f7 h8h7 f7d8,1282,75,99,2520,advantage exposedKing fork long opening,https://lichess.org/viPE7YXZ/black#30,Indian_Defense Indian_Defense_Other_variations
nzTXp,2k5/pp5r/8/P1p1p3/4PpP1/3P4/2P3K1/R7 w - - 0 32,a1h1 f4f3 g2g1 f3f2 g1f1 h7h1,1239,75,94,451,advancedPawn crushing deflection endgame exposedKing long rookEndgame,https://lichess.org/KypvyEsH#63,
plt3V,1k3rr1/1p5p/pP6/4N3/BR1P4/4P1Nb/P3nP2/R5K1 w - - 5 28,g1h2 f8f2 h2h3 g8g3 h3h4 f2h2,1279,76,95,12263,exposedKing long mate mateIn3 middlegame,https://lichess.org/k508Wq6P#55,
HJoxA,8/P6p/1R6/2p2pp1/2P2k2/1P3P1K/3r4/8 w - - 1 41,a7a8q g5g4 f3g4 f5g4 h3h4 d2h2,1215,80,71,217,endgame exposedKing long mate mateIn3 queenRookEndgame,https://lichess.org/PoRuc7KG#81,
6c1kR,1k3r2/1b2N2p/p2p4/2p3Q1/2P1B3/1P4PP/P4r2/6K1 w - - 10 42,e7f5 b7e4 g1f2 f8f5 g5f5 e4f5,1282,75,73,275,advantage endgame exposedKing fork long,https://lichess.org/MRO4Ldb7#83,
DDsQX,6k1/pp1q3p/8/7P/4KB2/2Pr4/PP6/R5R1 b - - 6 34,g8f8 f4h6 f8e8 g1g8 e8f7 g8g7 f7e6 g7d7,1203,75,84,245,crushing endgame exposedKing skewer veryLong,https://lichess.org/AUTp8zLp/black#68,
0ypst,8/8/8/3Pr1k1/4Q3/K3P3/P7/8 w - - 1 65,d5d6 e5e4 d6d7 e4e3 a3b4 e3d3,1213,75,93,5685,crushing endgame exposedKing hangingPiece long,https://lichess.org/Gr0wH3Bp#129,
S7Qtj,8/8/8/8/1r3k2/4R3/5K2/8 w - - 16 52,f2e2 b4b2 e2d3 b2b3 d3c4 b3e3,1249,105,88,22,crushing deflection endgame exposedKing long rookEndgame skewer,https://lichess.org/xS8QqwdP#103,
Yvcht,k5r1/1p6/p7/8/3R4/2P2RQ1/P1q3K1/8 w - - 1 43,f3f2 g8g3 g2g3 c2c3 g3g2 c3d4,1251,76,96,26482,advantage attraction endgame exposedKing fork long,https://lichess.org/ektfb0bn#85,
zagrM,4r2k/pp4pp/8/3R1pP1/1q3P2/1P1Q2P1/P7/3RrK2 w - - 3 35,d1e1 b4e1 f1g2 e8e2 d3e2 e1e2,1263,112,70,17,crushing endgame exposedKing long,https://lichess.org/USekJMT7#69,
eT37M,r3k3/2q1b3/6Qp/ppp5/3P4/7P/P1B3P1/6K1 b - - 2 38,e8d7 c2f5 d7d8 g6g8 e7f8 g8f8,1218,75,100,133,endgame exposedKing long mate mateIn3,https://lichess.org/YaSWGxrM/black#76,
t86Ct,8/p5k1/2R1Bb2/5P2/Pr3PKp/8/8/8 b - - 0 51,b4a4 c6c7 g7f8 c7f7 f8e8 f7f6,1298,79,85,150,crushing endgame exposedKing fork long,https://lichess.org/1b0W9mxE/black#102,
Oy5F6,r1b3k1/1p5R/3p1b2/2pPpPQ1/3nP1P1/3P4/p4KB1/7R b - - 1 30,f6g5 h7h8 g8f7 h1h7 f7f6 h8f8,1216,76,78,262,exposedKing long mate mateIn3 middlegame,https://lichess.org/yWPvPAVr/black#60,
c3BnD,1k1r4/q7/1p1p1p1p/2pB4/3pN1P1/3P1n2/1PP5/RK6 b - - 6 32,a7e7 a1a8 b8c7 a8a7 c7c8 a7e7,1253,124,87,16,advantage endgame exposedKing long queensideAttack skewer,https://lichess.org/iSTTE2dV/black#64,
l1hl2,1r3k1r/2pq2bB/p3pBQ1/3pP3/3n1P2/8/PP3P2/2K4R b - - 3 30,g7f6 g6f6 d7f7 f6h8 f8e7 h8b8,1257,75,97,532,crushing exposedKing fork long middlegame skewer,https://lichess.org/T5G5DRNd/black#60,
LlyRd,6k1/6p1/p2q4/2p1p1PP/2Pn4/P3Q1B1/7K/8 w - - 0 41,g3e5 d6e5 e3e5 d4f3 h2g3 f3e5,1292,76,91,1803,attraction crushing endgame exposedKing fork long sacrifice,https://lichess.org/fQaYofvy#81,
CnuTh,8/8/3r4/8/8/R3pK2/3k4/8 w - - 4 60,a3e3 d6f6 f3e4 f6e6 e4d4 e6e3,1288,178,76,19,crushing endgame exposedKing long rookEndgame,https://lichess.org/tNBVnU6H#119,
