PuzzleId,FEN,Moves,Rating,RatingDeviation,Popularity,NbPlays,Themes,GameUrl,OpeningTags
orNQI,r3k2r/pR2pp1p/2n3p1/8/4P3/5B2/P2K1PPP/7R w kq - 1 16,h1c1 e8c8 d2e3 c8b7,1951,77,78,157,castling crushing discoveredAttack endgame short,https://lichess.org/YNnwotVP#31,Grunfeld_Defense Grunfeld_Defense_Exchange_Variation
ox0Gt,r3k2r/pp2pp2/2np2p1/q2N3p/3bP1bP/1Q3N2/PP2BPP1/R4K1R w kq - 0 14,f3d4 c6d4 b3b7 g4e2 f1g1 e8g8,1935,77,91,2626,advantage castling defensiveMove long middlegame,https://lichess.org/PJNH65CO#27,Sicilian_Defense Sicilian_Defense_Delayed_Alapin
pHmea,r3k2r/ppqb1pp1/4p3/3pP1Qp/3n4/P7/2PBBPPP/R4RK1 w kq - 0 16,g5g7 d4e2 g1h1 e8c8,1969,76,78,331,castling crushing defensiveMove hangingPiece middlegame short,https://lichess.org/zGqL33mZ#31,French_Defense French_Defense_Winawer_Variation
pdzWS,r1b1k2r/p2p1ppp/2p5/4P3/1b4Q1/2N3P1/PPPB4/R3KB1q b Qkq - 1 12,c8a6 e1c1 a6f1 g4b4,1921,76,89,1583,advantage castling middlegame short,https://lichess.org/hLLuq8Br/black#24,Sicilian_Defense Sicilian_Defense_Lowenthal_Variation
pp9yJ,r3kb1r/pp2pppp/2n5/q7/2BP2b1/2N1PN2/PP4PP/R2QK2R b KQkq - 2 10,a5b4 c4f7 e8f7 f3g5 f7e8 d1g4 b4b2 e1g1,1938,76,90,3316,attackingF2F7 attraction castling crushing defensiveMove discoveredAttack opening sacrifice veryLong,https://lichess.org/0vUcpoAw/black#20,Caro-Kann_Defense Caro-Kann_Defense_Panov_Attack
qEVtw,r2q1rk1/ppp2p2/3p1n2/2b5/2BnP1R1/3P4/PPPN1PP1/R2QK3 b Q - 0 13,f6g4 d1g4 g8h7 e1c1 d8f6 d1h1,1906,77,80,379,castling clearance crushing long middlegame,https://lichess.org/9RlAKlej/black#26,Bishops_Opening Bishops_Opening_Berlin_Defense
qbapY,r2qr1k1/1pp2ppp/p4b2/8/3P4/P1B1PP2/1PQ2P1P/R3K2R b KQ - 0 18,f6d4 e1c1 d4c3 d1d8,1950,78,83,651,advantage castling middlegame short,https://lichess.org/PA8jDMDT/black#36,Queens_Pawn_Game Queens_Pawn_Game_Other_variations
qcItA,r3kbQ1/pp1n4/2p1pqp1/8/4pP2/8/PPPP2PP/RNB1K2R w KQq - 1 11,e1g1 e8c8 g8h7 f8c5 g1h1 d8h8 h7h8 f6h8,1996,74,95,12000,advantage castling clearance middlegame trappedPiece veryLong,https://lichess.org/hhuh6tMi#21,Kings_Gambit_Declined Kings_Gambit_Declined_Falkbeer_Countergambit
rD47Q,1r3rk1/2p2pp1/2p2p1p/3q4/1R1P4/P1Q1PN2/1p3PPP/4K2R b K - 1 22,b8b4 c3b4 d5a2 e1g1,1963,77,95,5148,advantage castling defensiveMove endgame short,https://lichess.org/IbqtHGdo/black#44,
sKqMJ,r3r1k1/1pp2pnp/p2p2pP/3Pp1N1/2PnP1q1/2N5/PP1Q1P2/R3K2R b KQ - 0 18,g4g2 e1c1 d4f3 g5f3 g2f3 h6g7,1964,78,92,2895,advancedPawn advantage castling long middlegame,https://lichess.org/ueJSjsrZ/black#36,Kings_Indian_Defense Kings_Indian_Defense_Normal_Variation
sMZuQ,r2qk2r/pp1n1pp1/4p2p/1Qb5/7P/2B2N2/PPP2PP1/R3K2R b KQkq - 3 16,e8g8 e1c1 d8b6 b5d7,1920,75,96,5514,castling crushing master middlegame short,https://lichess.org/5Fl5unLW/black#32,Caro-Kann_Defense Caro-Kann_Defense_Classical_Variation
sjOrJ,3rkbnr/p2b1ppp/2B5/3Q4/5q2/2N5/PPP2PPP/3RK2R b Kk - 2 12,g8f6 c6d7 f6d7 e1g1,1965,76,88,881,advantage castling defensiveMove middlegame short,https://lichess.org/XfvFz0QP/black#24,Sicilian_Defense Sicilian_Defense_Taimanov_Variation
tarcP,rnb1k3/2qp2pr/p3pnNp/1pb1P3/2p5/5BP1/PPPQ1P1P/RN2K2R b KQq - 0 15,f6g8 f3a8 c8b7 a8b7 c7b7 e1g1,1998,81,92,4425,advantage castling defensiveMove hangingPiece long opening,https://lichess.org/NraHSKSf/black#30,Sicilian_Defense Sicilian_Defense_Drazic_Variation
tw2l4,1rbk1b1r/5ppp/p3p1n1/2p1P3/8/2P2PB1/P1P1N1PP/R3K2R b KQ - 2 16,b8b2 e1c1 d8c7 c1b2,1971,78,88,239,advantage castling discoveredAttack middlegame short,https://lichess.org/IBZ4KjHP/black#32,Caro-Kann_Defense Caro-Kann_Defense_Maroczy_Variation
uDAlg,r3k2r/pp4pp/2pb1q2/3pn3/8/2P2NPb/PP2BP1P/R1BQ1RK1 w kq - 1 14,f1e1 e8g8 c1e3 e5f3,1959,77,92,7204,castling crushing master middlegame short,https://lichess.org/5zDi9PbB#27,French_Defense French_Defense_Tarrasch_Variation
uZ5zK,r3kb1r/1pp1pppp/p1n1q1b1/1B1nN3/5BP1/2N4P/PPP5/R2QK2R w KQkq - 0 13,c3d5 e8c8 b5c6 b7c6 d5b6 c7b6,1909,128,83,80,advantage castling long opening,https://lichess.org/8HZF9ngS#25,Blackmar-Diemer_Gambit_Accepted Blackmar-Diemer_Gambit_Accepted_Teichmann_Defense
uqT2F,r3r1k1/pp3p1R/1qp2bb1/8/1P6/4PN1Q/1PP3P1/2B1K2R b K - 0 20,g6h7 h3h7 g8f8 e1g1,1974,82,78,334,advantage castling defensiveMove middlegame short,https://lichess.org/0QNxkiIh/black#40,
vBLpx,r3kb1r/p3pppp/1pp5/q7/n1Q1N3/2R4N/P4PPP/4K2R b Kkq - 5 18,a4c3 c4c6 e8d8 c6a8 d8c7 e1g1,1945,79,75,141,advantage castling defensiveMove fork long middlegame,https://lichess.org/icxg7mLd/black#36,Queens_Pawn_Game Queens_Pawn_Game_Accelerated_London_System
vNsTz,r3kb1r/pp3ppp/2n2nb1/1BP5/1P2p1P1/2P2N1P/P4P2/RNBK3R w kq - 1 12,f3e5 e8c8 d1c2 c6e5,1935,77,90,4369,advantage castling discoveredAttack middlegame short,https://lichess.org/ACtYqhPJ#23,Sicilian_Defense Sicilian_Defense_Alapin_Variation
vqC06,7r/p2kbpp1/4p2p/8/8/1NP5/Pr3PPP/R3K2R b KQ - 1 17,h8c8 e1c1 d7e8 c1b2,1938,75,94,3881,castling crushing discoveredAttack endgame master short,https://lichess.org/35qMGOE0/black#34,French_Defense French_Defense_Rubinstein_Variation
wGTkq,r1bq1rk1/ppp2ppp/2n5/8/1b6/2PQ1NP1/P3PPBP/R1B1K2R b KQ - 0 11,c8f5 d3d8 a8d8 c3b4 c6b4 e1g1,1953,75,89,847,advantage castling defensiveMove long opening,https://lichess.org/CZKNbiZG/black#22,Englund_Gambit Englund_Gambit_Other_variations
wVJxe,r2qkbnr/pp3ppp/2n1b3/1B2p3/4p3/2P2N2/PP3PPP/RNBQK2R w KQkq - 0 8,f3e5 d8d1 e1d1 e8c8,1970,79,95,9956,castling crushing discoveredAttack opening short,https://lichess.org/7KM5EsUb#15,Benoni_Defense Benoni_Defense_Old_Benoni
wVZpa,r2qk2r/ppp1ppbp/6p1/3pP3/4n2P/2P1P3/PP1NQPP1/R1B1K2R b KQkq - 2 10,g7e5 d2e4 d5e4 e2b5 d8d7 b5e5 e8c8 e1g1,1962,73,95,16052,advantage castling defensiveMove fork middlegame veryLong,https://lichess.org/sv6qw80A/black#20,Indian_Defense Indian_Defense_Other_variations
wWBSL,r3k1nB/p1pp4/1pn1Bp1p/6p1/4q3/2Q5/PPP1NP1P/2K4R w q - 1 17,e6g8 e4h1 c1d2 e8c8,1922,77,86,330,advantage castling defensiveMove hangingPiece master middlegame short,https://lichess.org/nDGazjlJ#33,Owen_Defense Owen_Defense_Naselwaus_Gambit
wsn29,r3kb1r/pp3ppp/2n1b3/1B2p3/2P5/1N3P2/PP4PP/R1B1K2R w KQkq - 1 13,b3a5 f8b4 c1d2 b4d2 e1d2 e8c8 d2c3 c6a5,1999,73,94,12181,advantage castling discoveredAttack exposedKing fork middlegame veryLong,https://lichess.org/g632nu01#25,Sicilian_Defense Sicilian_Defense_Modern_Variations
x0SHw,rn1qk2r/pp3ppp/5n2/2bp4/4p1b1/PBNP1N2/1PP2PPP/R1BQK2R w KQkq - 0 9,d1e2 e8g8 d3e4 d5e4 c3e4 f6e4,1994,78,89,3103,advantage castling long opening,https://lichess.org/KLliFl3s#17,Bishops_Opening Bishops_Opening_Philidor_Counterattack
xqB7u,r2qkb1r/pp1n1ppp/8/1B1N4/5n2/P4P1P/1PP2P2/R2QK2R w KQkq - 0 13,d5f4 d8a5 d1d2 a5b5 e1c1 e8c8,1947,77,87,259,advantage castling defensiveMove fork long middlegame,https://lichess.org/jkzBwfLX#25,Caro-Kann_Defense Caro-Kann_Defense_Other_variations
xzDQM,r3k2r/p3bppp/2p5/8/2P5/3K4/P4PPP/1RB1R3 w kq - 3 19,c1a3 e8c8 d3c2 e7a3,1990,79,92,3288,castling crushing discoveredAttack endgame short,https://lichess.org/hVquIwhr#37,
y1izs,r2q1rk1/ppp3pp/2n1b3/3p4/4P1n1/7Q/PB1NNPPP/R3K2R b KQ - 12 14,g4f2 h3e6 g8h8 e1g1,1914,84,77,567,advantage castling hangingPiece middlegame short,https://lichess.org/yr0APLc1/black#28,Danish_Gambit Danish_Gambit_Other_variations
yHlnB,r3kb1r/ppp3pp/5pb1/2q1p3/3n2P1/2N2N1P/PPP2P2/R1BQR1K1 w kq - 0 13,f3d4 e8c8 d4e6 d8d1 e1d1 c5e7 d1d8 e7d8 e6d8 c8d8,1928,75,93,1969,advantage castling middlegame veryLong,https://lichess.org/mbu2UZm4#25,Italian_Game Italian_Game_Two_Knights_Defense
ysXdJ,r1bqr1k1/pp3p1p/3p2p1/5P2/3bN1P1/3Q1N2/PP4P1/R3K2R b KQ - 2 17,d4c5 e1c1 g6f5 e4c5,1987,76,92,842,advantage castling middlegame short,https://lichess.org/gOLpl2G7/black#34,Queens_Pawn_Game Queens_Pawn_Game_Other_variations
