PuzzleId,FEN,Moves,Rating,RatingDeviation,Popularity,NbPlays,Themes,GameUrl,OpeningTags
1P76M,r4qk1/pb1n3p/1p4p1/1Nb5/2P1n3/1P4P1/PB4BP/R3Q2K w - - 0 20,g2e4 f8f3 e4f3 b7f3,1931,132,100,63,doubleBishopMate kingsideAttack mate mateIn2 middlegame sacrifice short xRayAttack,https://lichess.org/bzjGWJ3n#39,
1pZe2,r2r3k/3bBBbp/p1p2pp1/4P3/5P2/1P6/P1PQNqPP/3R3K b - - 5 25,d7h3 d2d8 a8d8 d1d8 g7f8 e7f6,1965,78,94,12145,doubleBishopMate kingsideAttack long mate mateIn3 middlegame pin,https://lichess.org/24jjF7td/black#50,
5CAPj,r3kb1r/1bqn1p1p/n1p1p1p1/ppPpP1B1/3P2Q1/PP1B4/4NPPP/R3K1NR b KQkq - 4 13,h7h6 g4e6 f7e6 d3g6,1919,79,96,765,deflection doubleBishopMate mate mateIn2 opening sacrifice short,https://lichess.org/SzKVWMDv/black#26,Semi-Slav_Defense Semi-Slav_Defense_Marshall_Gambit
Hp1pr,r2r2k1/1p3ppb/4p2p/Pqb1P3/1P3P2/1QB3P1/6BP/2R1R2K w - - 2 33,g2f1 b5f1 e1f1 h7e4 f1f3 e4f3,1938,78,95,5558,doubleBishopMate kingsideAttack long mate mateIn3 middlegame sacrifice,https://lichess.org/xVs8vXPK#65,
YqEgu,r1bq1bkr/pppn2pp/3P4/nB2p3/8/5Q2/PPPP1PPP/RNB1K2R b KQ - 0 9,c7c6 f3b3 a5b3 b5c4,1980,80,93,1265,doubleBishopMate mate mateIn2 opening sacrifice short,https://lichess.org/qhn1QmB9/black#18,Italian_Game Italian_Game_Two_Knights_Defense
Z9nh3,r3kb1r/p2n1pp1/1pp1p3/q2P2B1/2P4p/3B4/P1P1QP1P/R2K2R1 b kq - 0 18,c6d5 e2e6 f7e6 d3g6,1928,81,96,1218,doubleBishopMate mate mateIn2 middlegame sacrifice short,https://lichess.org/lFFg5OXs/black#36,Owen_Defense Owen_Defense_Other_variations
bDGBY,r3r1k1/pp3ppp/3p1n2/2bP3b/2N1P3/1QN2P1q/PPB4P/R1B2R1K w - - 1 19,c4d2 h3f1 d2f1 h5f3,1984,81,97,5591,doubleBishopMate kingsideAttack mate mateIn2 middlegame sacrifice short,https://lichess.org/aN2EQNi1#37,
ie48r,r2qk3/ppp2p2/3b4/3pn2p/6b1/1PN3P1/PBPPP2P/R2QKB1R w KQq - 2 12,h2h3 e5d3 e2d3 d6g3,1913,85,91,12250,discoveredAttack doubleBishopMate mate mateIn2 middlegame sacrifice short,https://lichess.org/GlKdRfJL#23,Bird_Opening Bird_Opening_Dutch_Variation
r0qdL,3r3k/pp2RBbp/1nb3p1/2p3B1/3r4/2P4P/PP4P1/2K1R3 b - - 0 22,d4d7 e7e8 d8e8 e1e8 g7f8 g5f6,1939,82,93,148541,doubleBishopMate kingsideAttack long mate mateIn3 middlegame pin,https://lichess.org/9NzC5DCT/black#44,
